Date,HomeTeam,AwayTeam,FTHG,FTAG,FTR,IWH,IWD,IWA,datetime,season,game_day,league,result,goal_diff,odds_diff,game_id
18/08/17,Bayern Munich,Leverkusen,3,1,H,1.3,6.0,8.5,2017-08-18,2017/2018,1,D1,3-1,2,-7.2,2017-08-18Bayern MunichLeverkusen
19/08/17,Hamburg,Augsburg,1,0,H,2.1,3.4,3.5,2017-08-19,2017/2018,1,D1,1-0,1,-1.4,2017-08-19HamburgAugsburg
19/08/17,Hertha,Stuttgart,2,0,H,2.0,3.4,3.8,2017-08-19,2017/2018,1,D1,2-0,2,-1.7999999999999998,2017-08-19HerthaStuttgart
19/08/17,Hoffenheim,Werder Bremen,1,0,H,1.8,3.7,4.3,2017-08-19,2017/2018,1,D1,1-0,1,-2.5,2017-08-19HoffenheimWerder Bremen
19/08/17,Mainz,Hannover,0,1,A,2.1,3.4,3.5,2017-08-19,2017/2018,1,D1,0-1,-1,-1.4,2017-08-19MainzHannover
19/08/17,Schalke 04,RB Leipzig,2,0,H,2.6,3.3,2.7,2017-08-19,2017/2018,1,D1,2-0,2,-0.10000000000000009,2017-08-19Schalke 04RB Leipzig
19/08/17,Wolfsburg,Dortmund,0,3,A,4.1,3.7,1.85,2017-08-19,2017/2018,1,D1,0-3,-3,2.2499999999999996,2017-08-19WolfsburgDortmund
20/08/17,Freiburg,Ein Frankfurt,0,0,D,2.4,3.4,2.9,2017-08-20,2017/2018,1,D1,0-0,0,-0.5,2017-08-20FreiburgEin Frankfurt
20/08/17,M'gladbach,FC Koln,1,0,H,2.1,3.4,3.5,2017-08-20,2017/2018,1,D1,1-0,1,-1.4,2017-08-20M'gladbachFC Koln
25/08/17,FC Koln,Hamburg,1,3,A,1.9,3.5,4.1,2017-08-25,2017/2018,2,D1,1-3,-2,-2.1999999999999997,2017-08-25FC KolnHamburg
26/08/17,Augsburg,M'gladbach,2,2,D,3.15,3.3,2.3,2017-08-26,2017/2018,2,D1,2-2,0,0.8500000000000001,2017-08-26AugsburgM'gladbach
26/08/17,Dortmund,Hertha,2,0,H,1.35,5.3,8.0,2017-08-26,2017/2018,2,D1,2-0,2,-6.65,2017-08-26DortmundHertha
26/08/17,Ein Frankfurt,Wolfsburg,0,1,A,2.3,3.3,3.15,2017-08-26,2017/2018,2,D1,0-1,-1,-0.8500000000000001,2017-08-26Ein FrankfurtWolfsburg
26/08/17,Leverkusen,Hoffenheim,2,2,D,2.2,3.4,3.25,2017-08-26,2017/2018,2,D1,2-2,0,-1.0499999999999998,2017-08-26LeverkusenHoffenheim
26/08/17,Stuttgart,Mainz,1,0,H,2.3,3.3,3.15,2017-08-26,2017/2018,2,D1,1-0,1,-0.8500000000000001,2017-08-26StuttgartMainz
26/08/17,Werder Bremen,Bayern Munich,0,2,A,9.0,6.5,1.27,2017-08-26,2017/2018,2,D1,0-2,-2,7.73,2017-08-26Werder BremenBayern Munich
27/08/17,Hannover,Schalke 04,1,0,H,3.25,3.4,2.2,2017-08-27,2017/2018,2,D1,1-0,1,1.0499999999999998,2017-08-27HannoverSchalke 04
27/08/17,RB Leipzig,Freiburg,4,1,H,1.45,4.5,7.0,2017-08-27,2017/2018,2,D1,4-1,3,-5.55,2017-08-27RB LeipzigFreiburg
08/09/17,Hamburg,RB Leipzig,0,2,A,4.1,3.5,1.9,2017-09-08,2017/2018,3,D1,0-2,-2,2.1999999999999997,2017-09-08HamburgRB Leipzig
09/09/17,Augsburg,FC Koln,3,0,H,2.5,3.2,2.95,2017-09-09,2017/2018,3,D1,3-0,3,-0.4500000000000002,2017-09-09AugsburgFC Koln
09/09/17,Freiburg,Dortmund,0,0,D,6.5,4.2,1.5,2017-09-09,2017/2018,3,D1,0-0,0,5.0,2017-09-09FreiburgDortmund
09/09/17,Hoffenheim,Bayern Munich,2,0,H,7.0,4.5,1.45,2017-09-09,2017/2018,3,D1,2-0,2,5.55,2017-09-09HoffenheimBayern Munich
09/09/17,Mainz,Leverkusen,3,1,H,2.65,3.3,2.65,2017-09-09,2017/2018,3,D1,3-1,2,0.0,2017-09-09MainzLeverkusen
09/09/17,M'gladbach,Ein Frankfurt,0,1,A,1.85,3.5,4.3,2017-09-09,2017/2018,3,D1,0-1,-1,-2.4499999999999997,2017-09-09M'gladbachEin Frankfurt
09/09/17,Wolfsburg,Hannover,1,1,D,2.0,3.4,3.8,2017-09-09,2017/2018,3,D1,1-1,0,-1.7999999999999998,2017-09-09WolfsburgHannover
10/09/17,Hertha,Werder Bremen,1,1,D,2.0,3.4,3.8,2017-09-10,2017/2018,3,D1,1-1,0,-1.7999999999999998,2017-09-10HerthaWerder Bremen
10/09/17,Schalke 04,Stuttgart,3,1,H,1.8,3.6,4.5,2017-09-10,2017/2018,3,D1,3-1,2,-2.7,2017-09-10Schalke 04Stuttgart
15/09/17,Hannover,Hamburg,2,0,H,2.2,3.3,3.35,2017-09-15,2017/2018,4,D1,2-0,2,-1.15,2017-09-15HannoverHamburg
16/09/17,Bayern Munich,Mainz,4,0,H,1.15,7.5,18.0,2017-09-16,2017/2018,4,D1,4-0,4,-16.85,2017-09-16Bayern MunichMainz
16/09/17,Ein Frankfurt,Augsburg,1,2,A,1.85,3.5,4.3,2017-09-16,2017/2018,4,D1,1-2,-1,-2.4499999999999997,2017-09-16Ein FrankfurtAugsburg
16/09/17,RB Leipzig,M'gladbach,2,2,D,1.7,3.7,5.0,2017-09-16,2017/2018,4,D1,2-2,0,-3.3,2017-09-16RB LeipzigM'gladbach
16/09/17,Stuttgart,Wolfsburg,1,0,H,2.4,3.3,2.95,2017-09-16,2017/2018,4,D1,1-0,1,-0.5500000000000003,2017-09-16StuttgartWolfsburg
16/09/17,Werder Bremen,Schalke 04,1,2,A,2.7,3.3,2.6,2017-09-16,2017/2018,4,D1,1-2,-1,0.10000000000000009,2017-09-16Werder BremenSchalke 04
17/09/17,Dortmund,FC Koln,5,0,H,1.27,6.5,9.0,2017-09-17,2017/2018,4,D1,5-0,5,-7.73,2017-09-17DortmundFC Koln
17/09/17,Hoffenheim,Hertha,1,1,D,1.75,3.6,4.8,2017-09-17,2017/2018,4,D1,1-1,0,-3.05,2017-09-17HoffenheimHertha
17/09/17,Leverkusen,Freiburg,4,0,H,1.55,4.0,6.2,2017-09-17,2017/2018,4,D1,4-0,4,-4.65,2017-09-17LeverkusenFreiburg
19/09/17,Augsburg,RB Leipzig,1,0,H,3.3,3.35,2.2,2017-09-19,2017/2018,5,D1,1-0,1,1.0999999999999996,2017-09-19AugsburgRB Leipzig
19/09/17,M'gladbach,Stuttgart,2,0,H,1.7,3.7,5.0,2017-09-19,2017/2018,5,D1,2-0,2,-3.3,2017-09-19M'gladbachStuttgart
19/09/17,Schalke 04,Bayern Munich,0,3,A,7.0,4.5,1.45,2017-09-19,2017/2018,5,D1,0-3,-3,5.55,2017-09-19Schalke 04Bayern Munich
19/09/17,Wolfsburg,Werder Bremen,1,1,D,2.1,3.4,3.5,2017-09-19,2017/2018,5,D1,1-1,0,-1.4,2017-09-19WolfsburgWerder Bremen
20/09/17,FC Koln,Ein Frankfurt,0,1,A,2.6,3.3,2.7,2017-09-20,2017/2018,5,D1,0-1,-1,-0.10000000000000009,2017-09-20FC KolnEin Frankfurt
20/09/17,Freiburg,Hannover,1,1,D,2.6,3.3,2.7,2017-09-20,2017/2018,5,D1,1-1,0,-0.10000000000000009,2017-09-20FreiburgHannover
20/09/17,Hamburg,Dortmund,0,3,A,6.5,4.2,1.5,2017-09-20,2017/2018,5,D1,0-3,-3,5.0,2017-09-20HamburgDortmund
20/09/17,Hertha,Leverkusen,2,1,H,2.95,3.3,2.4,2017-09-20,2017/2018,5,D1,2-1,1,0.5500000000000003,2017-09-20HerthaLeverkusen
20/09/17,Mainz,Hoffenheim,2,3,A,2.85,3.3,2.5,2017-09-20,2017/2018,5,D1,2-3,-1,0.3500000000000001,2017-09-20MainzHoffenheim
22/09/17,Bayern Munich,Wolfsburg,2,2,D,1.15,7.5,18.0,2017-09-22,2017/2018,6,D1,2-2,0,-16.85,2017-09-22Bayern MunichWolfsburg
23/09/17,Dortmund,M'gladbach,6,1,H,1.45,4.5,7.0,2017-09-23,2017/2018,6,D1,6-1,5,-5.55,2017-09-23DortmundM'gladbach
23/09/17,Hoffenheim,Schalke 04,2,0,H,2.2,3.35,3.3,2017-09-23,2017/2018,6,D1,2-0,2,-1.0999999999999996,2017-09-23HoffenheimSchalke 04
23/09/17,Mainz,Hertha,1,0,H,2.5,3.3,2.85,2017-09-23,2017/2018,6,D1,1-0,1,-0.3500000000000001,2017-09-23MainzHertha
23/09/17,RB Leipzig,Ein Frankfurt,2,1,H,1.65,3.8,5.3,2017-09-23,2017/2018,6,D1,2-1,1,-3.65,2017-09-23RB LeipzigEin Frankfurt
23/09/17,Stuttgart,Augsburg,0,0,D,2.3,3.3,3.15,2017-09-23,2017/2018,6,D1,0-0,0,-0.8500000000000001,2017-09-23StuttgartAugsburg
23/09/17,Werder Bremen,Freiburg,0,0,D,1.75,3.8,4.5,2017-09-23,2017/2018,6,D1,0-0,0,-2.75,2017-09-23Werder BremenFreiburg
24/09/17,Hannover,FC Koln,0,0,D,2.1,3.4,3.5,2017-09-24,2017/2018,6,D1,0-0,0,-1.4,2017-09-24HannoverFC Koln
24/09/17,Leverkusen,Hamburg,3,0,H,1.45,4.5,7.0,2017-09-24,2017/2018,6,D1,3-0,3,-5.55,2017-09-24LeverkusenHamburg
29/09/17,Schalke 04,Leverkusen,1,1,D,2.4,3.3,2.95,2017-09-29,2017/2018,7,D1,1-1,0,-0.5500000000000003,2017-09-29Schalke 04Leverkusen
30/09/17,Augsburg,Dortmund,1,2,A,7.0,4.5,1.45,2017-09-30,2017/2018,7,D1,1-2,-1,5.55,2017-09-30AugsburgDortmund
30/09/17,Ein Frankfurt,Stuttgart,2,1,H,2.0,3.4,3.8,2017-09-30,2017/2018,7,D1,2-1,1,-1.7999999999999998,2017-09-30Ein FrankfurtStuttgart
30/09/17,Hamburg,Werder Bremen,0,0,D,2.6,3.3,2.7,2017-09-30,2017/2018,7,D1,0-0,0,-0.10000000000000009,2017-09-30HamburgWerder Bremen
30/09/17,M'gladbach,Hannover,2,1,H,1.7,3.7,5.0,2017-09-30,2017/2018,7,D1,2-1,1,-3.3,2017-09-30M'gladbachHannover
30/09/17,Wolfsburg,Mainz,1,1,D,2.0,3.4,3.8,2017-09-30,2017/2018,7,D1,1-1,0,-1.7999999999999998,2017-09-30WolfsburgMainz
01/10/17,FC Koln,RB Leipzig,1,2,A,3.5,3.4,2.1,2017-10-01,2017/2018,7,D1,1-2,-1,1.4,2017-10-01FC KolnRB Leipzig
01/10/17,Freiburg,Hoffenheim,3,2,H,3.8,3.4,2.0,2017-10-01,2017/2018,7,D1,3-2,1,1.7999999999999998,2017-10-01FreiburgHoffenheim
01/10/17,Hertha,Bayern Munich,2,2,D,7.0,4.5,1.45,2017-10-01,2017/2018,7,D1,2-2,0,5.55,2017-10-01HerthaBayern Munich
13/10/17,Stuttgart,FC Koln,2,1,H,2.1,3.4,3.5,2017-10-13,2017/2018,8,D1,2-1,1,-1.4,2017-10-13StuttgartFC Koln
14/10/17,Bayern Munich,Freiburg,5,0,H,1.12,9.0,20.0,2017-10-14,2017/2018,8,D1,5-0,5,-18.88,2017-10-14Bayern MunichFreiburg
14/10/17,Dortmund,RB Leipzig,2,3,A,1.6,4.0,5.5,2017-10-14,2017/2018,8,D1,2-3,-1,-3.9,2017-10-14DortmundRB Leipzig
14/10/17,Hannover,Ein Frankfurt,1,2,A,2.6,3.2,2.8,2017-10-14,2017/2018,8,D1,1-2,-1,-0.19999999999999973,2017-10-14HannoverEin Frankfurt
14/10/17,Hertha,Schalke 04,0,2,A,2.65,3.3,2.65,2017-10-14,2017/2018,8,D1,0-2,-2,0.0,2017-10-14HerthaSchalke 04
14/10/17,Hoffenheim,Augsburg,2,2,D,1.9,3.5,4.1,2017-10-14,2017/2018,8,D1,2-2,0,-2.1999999999999997,2017-10-14HoffenheimAugsburg
14/10/17,Mainz,Hamburg,3,2,H,1.8,3.6,4.5,2017-10-14,2017/2018,8,D1,3-2,1,-2.7,2017-10-14MainzHamburg
15/10/17,Leverkusen,Wolfsburg,2,2,D,1.7,3.7,5.0,2017-10-15,2017/2018,8,D1,2-2,0,-3.3,2017-10-15LeverkusenWolfsburg
15/10/17,Werder Bremen,M'gladbach,0,2,A,2.9,3.4,2.4,2017-10-15,2017/2018,8,D1,0-2,-2,0.5,2017-10-15Werder BremenM'gladbach
20/10/17,Schalke 04,Mainz,2,0,H,1.8,3.6,4.5,2017-10-20,2017/2018,9,D1,2-0,2,-2.7,2017-10-20Schalke 04Mainz
21/10/17,Augsburg,Hannover,1,2,A,2.0,3.4,3.8,2017-10-21,2017/2018,9,D1,1-2,-1,-1.7999999999999998,2017-10-21AugsburgHannover
21/10/17,Ein Frankfurt,Dortmund,2,2,D,4.7,3.7,1.75,2017-10-21,2017/2018,9,D1,2-2,0,2.95,2017-10-21Ein FrankfurtDortmund
21/10/17,Hamburg,Bayern Munich,0,1,A,15.0,6.5,1.2,2017-10-21,2017/2018,9,D1,0-1,-1,13.8,2017-10-21HamburgBayern Munich
21/10/17,M'gladbach,Leverkusen,1,5,A,2.3,3.3,3.15,2017-10-21,2017/2018,9,D1,1-5,-4,-0.8500000000000001,2017-10-21M'gladbachLeverkusen
21/10/17,RB Leipzig,Stuttgart,1,0,H,1.5,4.2,6.5,2017-10-21,2017/2018,9,D1,1-0,1,-5.0,2017-10-21RB LeipzigStuttgart
22/10/17,FC Koln,Werder Bremen,0,0,D,2.5,3.3,2.85,2017-10-22,2017/2018,9,D1,0-0,0,-0.3500000000000001,2017-10-22FC KolnWerder Bremen
22/10/17,Freiburg,Hertha,1,1,D,2.6,3.25,2.75,2017-10-22,2017/2018,9,D1,1-1,0,-0.1499999999999999,2017-10-22FreiburgHertha
22/10/17,Wolfsburg,Hoffenheim,1,1,D,2.5,3.3,2.85,2017-10-22,2017/2018,9,D1,1-1,0,-0.3500000000000001,2017-10-22WolfsburgHoffenheim
27/10/17,Mainz,Ein Frankfurt,1,1,D,2.65,3.25,2.7,2017-10-27,2017/2018,10,D1,1-1,0,-0.050000000000000266,2017-10-27MainzEin Frankfurt
28/10/17,Bayern Munich,RB Leipzig,2,0,H,1.5,4.5,6.0,2017-10-28,2017/2018,10,D1,2-0,2,-4.5,2017-10-28Bayern MunichRB Leipzig
28/10/17,Hannover,Dortmund,4,2,H,5.3,3.8,1.65,2017-10-28,2017/2018,10,D1,4-2,2,3.65,2017-10-28HannoverDortmund
28/10/17,Hertha,Hamburg,2,1,H,1.9,3.5,4.1,2017-10-28,2017/2018,10,D1,2-1,1,-2.1999999999999997,2017-10-28HerthaHamburg
28/10/17,Hoffenheim,M'gladbach,1,3,A,2.2,3.35,3.3,2017-10-28,2017/2018,10,D1,1-3,-2,-1.0999999999999996,2017-10-28HoffenheimM'gladbach
28/10/17,Leverkusen,FC Koln,2,1,H,1.4,4.8,7.5,2017-10-28,2017/2018,10,D1,2-1,1,-6.1,2017-10-28LeverkusenFC Koln
28/10/17,Schalke 04,Wolfsburg,1,1,D,1.8,3.6,4.5,2017-10-28,2017/2018,10,D1,1-1,0,-2.7,2017-10-28Schalke 04Wolfsburg
29/10/17,Stuttgart,Freiburg,3,0,H,1.9,3.5,4.1,2017-10-29,2017/2018,10,D1,3-0,3,-2.1999999999999997,2017-10-29StuttgartFreiburg
29/10/17,Werder Bremen,Augsburg,0,3,A,2.6,3.25,2.75,2017-10-29,2017/2018,10,D1,0-3,-3,-0.1499999999999999,2017-10-29Werder BremenAugsburg
03/11/17,Ein Frankfurt,Werder Bremen,2,1,H,1.85,3.5,4.3,2017-11-03,2017/2018,11,D1,2-1,1,-2.4499999999999997,2017-11-03Ein FrankfurtWerder Bremen
04/11/17,Augsburg,Leverkusen,1,1,D,3.3,3.35,2.2,2017-11-04,2017/2018,11,D1,1-1,0,1.0999999999999996,2017-11-04AugsburgLeverkusen
04/11/17,Dortmund,Bayern Munich,1,3,A,3.15,3.5,2.2,2017-11-04,2017/2018,11,D1,1-3,-2,0.9499999999999997,2017-11-04DortmundBayern Munich
04/11/17,Freiburg,Schalke 04,0,1,A,3.3,3.35,2.2,2017-11-04,2017/2018,11,D1,0-1,-1,1.0999999999999996,2017-11-04FreiburgSchalke 04
04/11/17,Hamburg,Stuttgart,3,1,H,2.4,3.3,2.95,2017-11-04,2017/2018,11,D1,3-1,2,-0.5500000000000003,2017-11-04HamburgStuttgart
04/11/17,M'gladbach,Mainz,1,1,D,1.65,3.8,5.3,2017-11-04,2017/2018,11,D1,1-1,0,-3.65,2017-11-04M'gladbachMainz
04/11/17,RB Leipzig,Hannover,2,1,H,1.5,4.2,6.5,2017-11-04,2017/2018,11,D1,2-1,1,-5.0,2017-11-04RB LeipzigHannover
05/11/17,FC Koln,Hoffenheim,0,3,A,2.65,3.3,2.65,2017-11-05,2017/2018,11,D1,0-3,-3,0.0,2017-11-05FC KolnHoffenheim
05/11/17,Wolfsburg,Hertha,3,3,D,2.15,3.3,3.5,2017-11-05,2017/2018,11,D1,3-3,0,-1.35,2017-11-05WolfsburgHertha
17/11/17,Stuttgart,Dortmund,2,1,H,4.2,3.6,1.85,2017-11-17,2017/2018,12,D1,2-1,1,2.35,2017-11-17StuttgartDortmund
18/11/17,Bayern Munich,Augsburg,3,0,H,1.15,8.0,16.0,2017-11-18,2017/2018,12,D1,3-0,3,-14.85,2017-11-18Bayern MunichAugsburg
18/11/17,Hertha,M'gladbach,2,4,A,2.65,3.3,2.65,2017-11-18,2017/2018,12,D1,2-4,-2,0.0,2017-11-18HerthaM'gladbach
18/11/17,Hoffenheim,Ein Frankfurt,1,1,D,2.2,3.35,3.3,2017-11-18,2017/2018,12,D1,1-1,0,-1.0999999999999996,2017-11-18HoffenheimEin Frankfurt
18/11/17,Leverkusen,RB Leipzig,2,2,D,2.4,3.4,2.9,2017-11-18,2017/2018,12,D1,2-2,0,-0.5,2017-11-18LeverkusenRB Leipzig
18/11/17,Mainz,FC Koln,1,0,H,2.1,3.4,3.5,2017-11-18,2017/2018,12,D1,1-0,1,-1.4,2017-11-18MainzFC Koln
18/11/17,Wolfsburg,Freiburg,3,1,H,1.65,3.8,5.3,2017-11-18,2017/2018,12,D1,3-1,2,-3.65,2017-11-18WolfsburgFreiburg
19/11/17,Schalke 04,Hamburg,2,0,H,1.55,4.0,6.2,2017-11-19,2017/2018,12,D1,2-0,2,-4.65,2017-11-19Schalke 04Hamburg
19/11/17,Werder Bremen,Hannover,4,0,H,2.3,3.3,3.15,2017-11-19,2017/2018,12,D1,4-0,4,-0.8500000000000001,2017-11-19Werder BremenHannover
24/11/17,Hannover,Stuttgart,1,1,D,2.4,3.3,2.95,2017-11-24,2017/2018,13,D1,1-1,0,-0.5500000000000003,2017-11-24HannoverStuttgart
25/11/17,Augsburg,Wolfsburg,2,1,H,2.5,3.3,2.85,2017-11-25,2017/2018,13,D1,2-1,1,-0.3500000000000001,2017-11-25AugsburgWolfsburg
25/11/17,Dortmund,Schalke 04,4,4,D,1.9,3.8,3.8,2017-11-25,2017/2018,13,D1,4-4,0,-1.9,2017-11-25DortmundSchalke 04
25/11/17,Ein Frankfurt,Leverkusen,0,1,A,2.65,3.3,2.65,2017-11-25,2017/2018,13,D1,0-1,-1,0.0,2017-11-25Ein FrankfurtLeverkusen
25/11/17,Freiburg,Mainz,2,1,H,2.65,3.3,2.65,2017-11-25,2017/2018,13,D1,2-1,1,0.0,2017-11-25FreiburgMainz
25/11/17,M'gladbach,Bayern Munich,2,1,H,6.0,4.2,1.55,2017-11-25,2017/2018,13,D1,2-1,1,4.45,2017-11-25M'gladbachBayern Munich
25/11/17,RB Leipzig,Werder Bremen,2,0,H,1.5,4.2,6.5,2017-11-25,2017/2018,13,D1,2-0,2,-5.0,2017-11-25RB LeipzigWerder Bremen
26/11/17,FC Koln,Hertha,0,2,A,2.4,3.2,3.05,2017-11-26,2017/2018,13,D1,0-2,-2,-0.6499999999999999,2017-11-26FC KolnHertha
26/11/17,Hamburg,Hoffenheim,3,0,H,2.85,3.3,2.5,2017-11-26,2017/2018,13,D1,3-0,3,0.3500000000000001,2017-11-26HamburgHoffenheim
01/12/17,Freiburg,Hamburg,0,0,D,2.5,3.2,2.95,2017-12-01,2017/2018,14,D1,0-0,0,-0.4500000000000002,2017-12-01FreiburgHamburg
02/12/17,Bayern Munich,Hannover,3,1,H,1.15,7.5,18.0,2017-12-02,2017/2018,14,D1,3-1,2,-16.85,2017-12-02Bayern MunichHannover
02/12/17,Hoffenheim,RB Leipzig,4,0,H,3.15,3.3,2.3,2017-12-02,2017/2018,14,D1,4-0,4,0.8500000000000001,2017-12-02HoffenheimRB Leipzig
02/12/17,Leverkusen,Dortmund,1,1,D,2.4,3.5,2.85,2017-12-02,2017/2018,14,D1,1-1,0,-0.4500000000000002,2017-12-02LeverkusenDortmund
02/12/17,Mainz,Augsburg,1,3,A,2.4,3.2,3.05,2017-12-02,2017/2018,14,D1,1-3,-2,-0.6499999999999999,2017-12-02MainzAugsburg
02/12/17,Schalke 04,FC Koln,2,2,D,1.45,4.5,7.0,2017-12-02,2017/2018,14,D1,2-2,0,-5.55,2017-12-02Schalke 04FC Koln
02/12/17,Werder Bremen,Stuttgart,1,0,H,2.3,3.3,3.15,2017-12-02,2017/2018,14,D1,1-0,1,-0.8500000000000001,2017-12-02Werder BremenStuttgart
03/12/17,Hertha,Ein Frankfurt,1,2,A,2.65,3.3,2.65,2017-12-03,2017/2018,14,D1,1-2,-1,0.0,2017-12-03HerthaEin Frankfurt
03/12/17,Wolfsburg,M'gladbach,3,0,H,2.65,3.3,2.65,2017-12-03,2017/2018,14,D1,3-0,3,0.0,2017-12-03WolfsburgM'gladbach
08/12/17,Stuttgart,Leverkusen,0,2,A,3.15,3.3,2.3,2017-12-08,2017/2018,15,D1,0-2,-2,0.8500000000000001,2017-12-08StuttgartLeverkusen
09/12/17,Dortmund,Werder Bremen,1,2,A,1.45,4.8,6.5,2017-12-09,2017/2018,15,D1,1-2,-1,-5.05,2017-12-09DortmundWerder Bremen
09/12/17,Ein Frankfurt,Bayern Munich,0,1,A,6.2,4.0,1.55,2017-12-09,2017/2018,15,D1,0-1,-1,4.65,2017-12-09Ein FrankfurtBayern Munich
09/12/17,Hamburg,Wolfsburg,0,0,D,2.6,3.3,2.7,2017-12-09,2017/2018,15,D1,0-0,0,-0.10000000000000009,2017-12-09HamburgWolfsburg
09/12/17,M'gladbach,Schalke 04,1,1,D,2.3,3.3,3.15,2017-12-09,2017/2018,15,D1,1-1,0,-0.8500000000000001,2017-12-09M'gladbachSchalke 04
09/12/17,RB Leipzig,Mainz,2,2,D,1.45,4.4,7.2,2017-12-09,2017/2018,15,D1,2-2,0,-5.75,2017-12-09RB LeipzigMainz
10/12/17,Augsburg,Hertha,1,1,D,1.9,3.4,4.3,2017-12-10,2017/2018,15,D1,1-1,0,-2.4,2017-12-10AugsburgHertha
10/12/17,FC Koln,Freiburg,3,4,A,2.3,3.15,3.3,2017-12-10,2017/2018,15,D1,3-4,-1,-1.0,2017-12-10FC KolnFreiburg
10/12/17,Hannover,Hoffenheim,2,0,H,2.65,3.3,2.65,2017-12-10,2017/2018,15,D1,2-0,2,0.0,2017-12-10HannoverHoffenheim
12/12/17,Freiburg,M'gladbach,1,0,H,3.5,3.4,2.1,2017-12-12,2017/2018,16,D1,1-0,1,1.4,2017-12-12FreiburgM'gladbach
12/12/17,Hamburg,Ein Frankfurt,1,2,A,2.65,3.3,2.65,2017-12-12,2017/2018,16,D1,1-2,-1,0.0,2017-12-12HamburgEin Frankfurt
12/12/17,Mainz,Dortmund,0,2,A,4.7,3.7,1.75,2017-12-12,2017/2018,16,D1,0-2,-2,2.95,2017-12-12MainzDortmund
12/12/17,Wolfsburg,RB Leipzig,1,1,D,2.85,3.3,2.5,2017-12-12,2017/2018,16,D1,1-1,0,0.3500000000000001,2017-12-12WolfsburgRB Leipzig
13/12/17,Bayern Munich,FC Koln,1,0,H,1.1,9.0,27.0,2017-12-13,2017/2018,16,D1,1-0,1,-25.9,2017-12-13Bayern MunichFC Koln
13/12/17,Hertha,Hannover,3,1,H,2.1,3.4,3.5,2017-12-13,2017/2018,16,D1,3-1,2,-1.4,2017-12-13HerthaHannover
13/12/17,Hoffenheim,Stuttgart,1,0,H,1.9,3.5,4.1,2017-12-13,2017/2018,16,D1,1-0,1,-2.1999999999999997,2017-12-13HoffenheimStuttgart
13/12/17,Leverkusen,Werder Bremen,1,0,H,1.55,4.0,6.2,2017-12-13,2017/2018,16,D1,1-0,1,-4.65,2017-12-13LeverkusenWerder Bremen
13/12/17,Schalke 04,Augsburg,3,2,H,1.9,3.5,4.1,2017-12-13,2017/2018,16,D1,3-2,1,-2.1999999999999997,2017-12-13Schalke 04Augsburg
15/12/17,M'gladbach,Hamburg,3,1,H,1.8,3.6,4.5,2017-12-15,2017/2018,17,D1,3-1,2,-2.7,2017-12-15M'gladbachHamburg
16/12/17,Augsburg,Freiburg,3,3,D,1.75,3.7,4.7,2017-12-16,2017/2018,17,D1,3-3,0,-2.95,2017-12-16AugsburgFreiburg
16/12/17,Dortmund,Hoffenheim,2,1,H,1.45,4.5,7.0,2017-12-16,2017/2018,17,D1,2-1,1,-5.55,2017-12-16DortmundHoffenheim
16/12/17,Ein Frankfurt,Schalke 04,2,2,D,2.65,3.3,2.65,2017-12-16,2017/2018,17,D1,2-2,0,0.0,2017-12-16Ein FrankfurtSchalke 04
16/12/17,FC Koln,Wolfsburg,1,0,H,3.8,3.4,2.0,2017-12-16,2017/2018,17,D1,1-0,1,1.7999999999999998,2017-12-16FC KolnWolfsburg
16/12/17,Stuttgart,Bayern Munich,0,1,A,8.0,5.3,1.35,2017-12-16,2017/2018,17,D1,0-1,-1,6.65,2017-12-16StuttgartBayern Munich
16/12/17,Werder Bremen,Mainz,2,2,D,2.0,3.4,3.8,2017-12-16,2017/2018,17,D1,2-2,0,-1.7999999999999998,2017-12-16Werder BremenMainz
17/12/17,Hannover,Leverkusen,4,4,D,3.5,3.4,2.1,2017-12-17,2017/2018,17,D1,4-4,0,1.4,2017-12-17HannoverLeverkusen
17/12/17,RB Leipzig,Hertha,2,3,A,1.6,4.0,5.5,2017-12-17,2017/2018,17,D1,2-3,-1,-3.9,2017-12-17RB LeipzigHertha
12/01/18,Leverkusen,Bayern Munich,1,3,A,3.7,3.6,2.0,2018-01-12,2017/2018,18,D1,1-3,-2,1.7000000000000002,2018-01-12LeverkusenBayern Munich
13/01/18,Augsburg,Hamburg,1,0,H,2.0,3.4,3.8,2018-01-13,2017/2018,18,D1,1-0,1,-1.7999999999999998,2018-01-13AugsburgHamburg
13/01/18,Ein Frankfurt,Freiburg,1,1,D,1.8,3.6,4.5,2018-01-13,2017/2018,18,D1,1-1,0,-2.7,2018-01-13Ein FrankfurtFreiburg
13/01/18,Hannover,Mainz,3,2,H,2.25,3.3,3.25,2018-01-13,2017/2018,18,D1,3-2,1,-1.0,2018-01-13HannoverMainz
13/01/18,RB Leipzig,Schalke 04,3,1,H,2.0,3.4,3.8,2018-01-13,2017/2018,18,D1,3-1,2,-1.7999999999999998,2018-01-13RB LeipzigSchalke 04
13/01/18,Stuttgart,Hertha,1,0,H,2.3,3.3,3.15,2018-01-13,2017/2018,18,D1,1-0,1,-0.8500000000000001,2018-01-13StuttgartHertha
13/01/18,Werder Bremen,Hoffenheim,1,1,D,2.6,3.25,2.75,2018-01-13,2017/2018,18,D1,1-1,0,-0.1499999999999999,2018-01-13Werder BremenHoffenheim
14/01/18,Dortmund,Wolfsburg,0,0,D,1.45,4.5,7.0,2018-01-14,2017/2018,18,D1,0-0,0,-5.55,2018-01-14DortmundWolfsburg
14/01/18,FC Koln,M'gladbach,2,1,H,3.15,3.3,2.3,2018-01-14,2017/2018,18,D1,2-1,1,0.8500000000000001,2018-01-14FC KolnM'gladbach
19/01/18,Hertha,Dortmund,1,1,D,3.4,3.3,2.2,2018-01-19,2017/2018,19,D1,1-1,0,1.1999999999999997,2018-01-19HerthaDortmund
20/01/18,Freiburg,RB Leipzig,2,1,H,3.5,3.4,2.1,2018-01-20,2017/2018,19,D1,2-1,1,1.4,2018-01-20FreiburgRB Leipzig
20/01/18,Hamburg,FC Koln,0,2,A,2.2,3.35,3.3,2018-01-20,2017/2018,19,D1,0-2,-2,-1.0999999999999996,2018-01-20HamburgFC Koln
20/01/18,Hoffenheim,Leverkusen,1,4,A,3.05,3.4,2.3,2018-01-20,2017/2018,19,D1,1-4,-3,0.75,2018-01-20HoffenheimLeverkusen
20/01/18,Mainz,Stuttgart,3,2,H,2.5,3.2,2.95,2018-01-20,2017/2018,19,D1,3-2,1,-0.4500000000000002,2018-01-20MainzStuttgart
20/01/18,M'gladbach,Augsburg,2,0,H,2.0,3.4,3.8,2018-01-20,2017/2018,19,D1,2-0,2,-1.7999999999999998,2018-01-20M'gladbachAugsburg
20/01/18,Wolfsburg,Ein Frankfurt,1,3,A,2.3,3.3,3.15,2018-01-20,2017/2018,19,D1,1-3,-2,-0.8500000000000001,2018-01-20WolfsburgEin Frankfurt
21/01/18,Bayern Munich,Werder Bremen,4,2,H,1.15,8.0,16.0,2018-01-21,2017/2018,19,D1,4-2,2,-14.85,2018-01-21Bayern MunichWerder Bremen
21/01/18,Schalke 04,Hannover,1,1,D,1.65,4.0,5.0,2018-01-21,2017/2018,19,D1,1-1,0,-3.35,2018-01-21Schalke 04Hannover
26/01/18,Ein Frankfurt,M'gladbach,2,0,H,2.5,3.1,3.05,2018-01-26,2017/2018,20,D1,2-0,2,-0.5499999999999998,2018-01-26Ein FrankfurtM'gladbach
27/01/18,Bayern Munich,Hoffenheim,5,2,H,1.2,7.0,13.5,2018-01-27,2017/2018,20,D1,5-2,3,-12.3,2018-01-27Bayern MunichHoffenheim
27/01/18,Dortmund,Freiburg,2,2,D,1.45,4.4,7.2,2018-01-27,2017/2018,20,D1,2-2,0,-5.75,2018-01-27DortmundFreiburg
27/01/18,FC Koln,Augsburg,1,1,D,2.6,3.25,2.75,2018-01-27,2017/2018,20,D1,1-1,0,-0.1499999999999999,2018-01-27FC KolnAugsburg
27/01/18,RB Leipzig,Hamburg,1,1,D,1.45,4.4,7.2,2018-01-27,2017/2018,20,D1,1-1,0,-5.75,2018-01-27RB LeipzigHamburg
27/01/18,Stuttgart,Schalke 04,0,2,A,2.95,3.3,2.4,2018-01-27,2017/2018,20,D1,0-2,-2,0.5500000000000003,2018-01-27StuttgartSchalke 04
27/01/18,Werder Bremen,Hertha,0,0,D,2.2,3.3,3.4,2018-01-27,2017/2018,20,D1,0-0,0,-1.1999999999999997,2018-01-27Werder BremenHertha
28/01/18,Hannover,Wolfsburg,0,1,A,2.6,3.2,2.8,2018-01-28,2017/2018,20,D1,0-1,-1,-0.19999999999999973,2018-01-28HannoverWolfsburg
28/01/18,Leverkusen,Mainz,2,0,H,1.45,4.4,7.2,2018-01-28,2017/2018,20,D1,2-0,2,-5.75,2018-01-28LeverkusenMainz
02/02/18,FC Koln,Dortmund,2,3,A,3.8,3.4,2.0,2018-02-02,2017/2018,21,D1,2-3,-1,1.7999999999999998,2018-02-02FC KolnDortmund
03/02/18,Freiburg,Leverkusen,0,0,D,4.1,3.5,1.9,2018-02-03,2017/2018,21,D1,0-0,0,2.1999999999999997,2018-02-03FreiburgLeverkusen
03/02/18,Hertha,Hoffenheim,1,1,D,2.4,3.3,2.95,2018-02-03,2017/2018,21,D1,1-1,0,-0.5500000000000003,2018-02-03HerthaHoffenheim
03/02/18,Mainz,Bayern Munich,0,2,A,8.0,5.3,1.35,2018-02-03,2017/2018,21,D1,0-2,-2,6.65,2018-02-03MainzBayern Munich
03/02/18,M'gladbach,RB Leipzig,0,1,A,2.65,3.3,2.65,2018-02-03,2017/2018,21,D1,0-1,-1,0.0,2018-02-03M'gladbachRB Leipzig
03/02/18,Schalke 04,Werder Bremen,1,2,A,1.65,3.8,5.3,2018-02-03,2017/2018,21,D1,1-2,-1,-3.65,2018-02-03Schalke 04Werder Bremen
03/02/18,Wolfsburg,Stuttgart,1,1,D,2.3,3.2,3.25,2018-02-03,2017/2018,21,D1,1-1,0,-0.9500000000000002,2018-02-03WolfsburgStuttgart
04/02/18,Augsburg,Ein Frankfurt,3,0,H,2.5,3.3,2.85,2018-02-04,2017/2018,21,D1,3-0,3,-0.3500000000000001,2018-02-04AugsburgEin Frankfurt
04/02/18,Hamburg,Hannover,1,1,D,2.2,3.3,3.4,2018-02-04,2017/2018,21,D1,1-1,0,-1.1999999999999997,2018-02-04HamburgHannover
09/02/18,RB Leipzig,Augsburg,2,0,H,1.7,3.7,5.0,2018-02-09,2017/2018,22,D1,2-0,2,-3.3,2018-02-09RB LeipzigAugsburg
10/02/18,Bayern Munich,Schalke 04,2,1,H,1.3,5.5,9.5,2018-02-10,2017/2018,22,D1,2-1,1,-8.2,2018-02-10Bayern MunichSchalke 04
10/02/18,Dortmund,Hamburg,2,0,H,1.4,4.8,7.5,2018-02-10,2017/2018,22,D1,2-0,2,-6.1,2018-02-10DortmundHamburg
10/02/18,Ein Frankfurt,FC Koln,4,2,H,1.85,3.5,4.3,2018-02-10,2017/2018,22,D1,4-2,2,-2.4499999999999997,2018-02-10Ein FrankfurtFC Koln
10/02/18,Hannover,Freiburg,2,1,H,2.2,3.3,3.4,2018-02-10,2017/2018,22,D1,2-1,1,-1.1999999999999997,2018-02-10HannoverFreiburg
10/02/18,Hoffenheim,Mainz,4,2,H,1.8,3.6,4.5,2018-02-10,2017/2018,22,D1,4-2,2,-2.7,2018-02-10HoffenheimMainz
10/02/18,Leverkusen,Hertha,0,2,A,1.55,4.0,6.2,2018-02-10,2017/2018,22,D1,0-2,-2,-4.65,2018-02-10LeverkusenHertha
11/02/18,Stuttgart,M'gladbach,1,0,H,2.6,3.25,2.75,2018-02-11,2017/2018,22,D1,1-0,1,-0.1499999999999999,2018-02-11StuttgartM'gladbach
11/02/18,Werder Bremen,Wolfsburg,3,1,H,2.1,3.4,3.5,2018-02-11,2017/2018,22,D1,3-1,2,-1.4,2018-02-11Werder BremenWolfsburg
16/02/18,Hertha,Mainz,0,2,A,2.0,3.4,3.8,2018-02-16,2017/2018,23,D1,0-2,-2,-1.7999999999999998,2018-02-16HerthaMainz
17/02/18,FC Koln,Hannover,1,1,D,2.4,3.3,2.95,2018-02-17,2017/2018,23,D1,1-1,0,-0.5500000000000003,2018-02-17FC KolnHannover
17/02/18,Freiburg,Werder Bremen,1,0,H,2.6,3.3,2.7,2018-02-17,2017/2018,23,D1,1-0,1,-0.10000000000000009,2018-02-17FreiburgWerder Bremen
17/02/18,Hamburg,Leverkusen,1,2,A,3.8,3.4,2.0,2018-02-17,2017/2018,23,D1,1-2,-1,1.7999999999999998,2018-02-17HamburgLeverkusen
17/02/18,Schalke 04,Hoffenheim,2,1,H,2.0,3.4,3.8,2018-02-17,2017/2018,23,D1,2-1,1,-1.7999999999999998,2018-02-17Schalke 04Hoffenheim
17/02/18,Wolfsburg,Bayern Munich,1,2,A,7.5,4.8,1.4,2018-02-17,2017/2018,23,D1,1-2,-1,6.1,2018-02-17WolfsburgBayern Munich
18/02/18,Augsburg,Stuttgart,0,1,A,2.0,3.4,3.8,2018-02-18,2017/2018,23,D1,0-1,-1,-1.7999999999999998,2018-02-18AugsburgStuttgart
18/02/18,M'gladbach,Dortmund,0,1,A,3.5,3.4,2.1,2018-02-18,2017/2018,23,D1,0-1,-1,1.4,2018-02-18M'gladbachDortmund
19/02/18,Ein Frankfurt,RB Leipzig,2,1,H,2.85,3.3,2.5,2018-02-19,2017/2018,23,D1,2-1,1,0.3500000000000001,2018-02-19Ein FrankfurtRB Leipzig
23/02/18,Mainz,Wolfsburg,1,1,D,2.4,3.1,3.2,2018-02-23,2017/2018,24,D1,1-1,0,-0.8000000000000003,2018-02-23MainzWolfsburg
24/02/18,Bayern Munich,Hertha,0,0,D,1.15,7.5,18.0,2018-02-24,2017/2018,24,D1,0-0,0,-16.85,2018-02-24Bayern MunichHertha
24/02/18,Hannover,M'gladbach,0,1,A,2.5,3.3,2.85,2018-02-24,2017/2018,24,D1,0-1,-1,-0.3500000000000001,2018-02-24HannoverM'gladbach
24/02/18,Hoffenheim,Freiburg,1,1,D,1.7,3.7,5.0,2018-02-24,2017/2018,24,D1,1-1,0,-3.3,2018-02-24HoffenheimFreiburg
24/02/18,Stuttgart,Ein Frankfurt,1,0,H,2.65,3.3,2.65,2018-02-24,2017/2018,24,D1,1-0,1,0.0,2018-02-24StuttgartEin Frankfurt
24/02/18,Werder Bremen,Hamburg,1,0,H,1.85,3.6,4.2,2018-02-24,2017/2018,24,D1,1-0,1,-2.35,2018-02-24Werder BremenHamburg
25/02/18,Leverkusen,Schalke 04,0,2,A,2.0,3.4,3.8,2018-02-25,2017/2018,24,D1,0-2,-2,-1.7999999999999998,2018-02-25LeverkusenSchalke 04
25/02/18,RB Leipzig,FC Koln,1,2,A,1.5,4.2,6.5,2018-02-25,2017/2018,24,D1,1-2,-1,-5.0,2018-02-25RB LeipzigFC Koln
26/02/18,Dortmund,Augsburg,1,1,D,1.5,4.2,6.5,2018-02-26,2017/2018,24,D1,1-1,0,-5.0,2018-02-26DortmundAugsburg
02/03/18,M'gladbach,Werder Bremen,2,2,D,2.0,3.5,3.7,2018-03-02,2017/2018,25,D1,2-2,0,-1.7000000000000002,2018-03-02M'gladbachWerder Bremen
03/03/18,Augsburg,Hoffenheim,0,2,A,2.5,3.15,3.0,2018-03-03,2017/2018,25,D1,0-2,-2,-0.5,2018-03-03AugsburgHoffenheim
03/03/18,Ein Frankfurt,Hannover,1,0,H,1.85,3.5,4.3,2018-03-03,2017/2018,25,D1,1-0,1,-2.4499999999999997,2018-03-03Ein FrankfurtHannover
03/03/18,Hamburg,Mainz,0,0,D,2.4,3.2,3.1,2018-03-03,2017/2018,25,D1,0-0,0,-0.7000000000000002,2018-03-03HamburgMainz
03/03/18,RB Leipzig,Dortmund,1,1,D,2.5,3.1,3.05,2018-03-03,2017/2018,25,D1,1-1,0,-0.5499999999999998,2018-03-03RB LeipzigDortmund
03/03/18,Schalke 04,Hertha,1,0,H,1.75,3.6,4.8,2018-03-03,2017/2018,25,D1,1-0,1,-3.05,2018-03-03Schalke 04Hertha
03/03/18,Wolfsburg,Leverkusen,1,2,A,3.3,3.2,2.3,2018-03-03,2017/2018,25,D1,1-2,-1,1.0,2018-03-03WolfsburgLeverkusen
04/03/18,FC Koln,Stuttgart,2,3,A,2.4,3.3,2.95,2018-03-04,2017/2018,25,D1,2-3,-1,-0.5500000000000003,2018-03-04FC KolnStuttgart
04/03/18,Freiburg,Bayern Munich,0,4,A,8.0,5.3,1.35,2018-03-04,2017/2018,25,D1,0-4,-4,6.65,2018-03-04FreiburgBayern Munich
09/03/18,Mainz,Schalke 04,0,1,A,3.5,3.4,2.1,2018-03-09,2017/2018,26,D1,0-1,-1,1.4,2018-03-09MainzSchalke 04
10/03/18,Bayern Munich,Hamburg,6,0,H,1.12,9.0,20.0,2018-03-10,2017/2018,26,D1,6-0,6,-18.88,2018-03-10Bayern MunichHamburg
10/03/18,Hannover,Augsburg,1,3,A,2.3,3.2,3.3,2018-03-10,2017/2018,26,D1,1-3,-2,-1.0,2018-03-10HannoverAugsburg
10/03/18,Hertha,Freiburg,0,0,D,2.1,3.4,3.5,2018-03-10,2017/2018,26,D1,0-0,0,-1.4,2018-03-10HerthaFreiburg
10/03/18,Hoffenheim,Wolfsburg,3,0,H,1.75,3.6,4.8,2018-03-10,2017/2018,26,D1,3-0,3,-3.05,2018-03-10HoffenheimWolfsburg
10/03/18,Leverkusen,M'gladbach,2,0,H,1.8,3.6,4.5,2018-03-10,2017/2018,26,D1,2-0,2,-2.7,2018-03-10LeverkusenM'gladbach
11/03/18,Dortmund,Ein Frankfurt,3,2,H,1.75,3.6,4.8,2018-03-11,2017/2018,26,D1,3-2,1,-3.05,2018-03-11DortmundEin Frankfurt
11/03/18,Stuttgart,RB Leipzig,0,0,D,2.85,3.3,2.5,2018-03-11,2017/2018,26,D1,0-0,0,0.3500000000000001,2018-03-11StuttgartRB Leipzig
12/03/18,Werder Bremen,FC Koln,3,1,H,1.8,3.6,4.5,2018-03-12,2017/2018,26,D1,3-1,2,-2.7,2018-03-12Werder BremenFC Koln
16/03/18,Freiburg,Stuttgart,1,2,A,2.6,3.2,2.8,2018-03-16,2017/2018,27,D1,1-2,-1,-0.19999999999999973,2018-03-16FreiburgStuttgart
17/03/18,Augsburg,Werder Bremen,1,3,A,2.4,3.3,2.95,2018-03-17,2017/2018,27,D1,1-3,-2,-0.5500000000000003,2018-03-17AugsburgWerder Bremen
17/03/18,Ein Frankfurt,Mainz,3,0,H,1.7,3.7,5.0,2018-03-17,2017/2018,27,D1,3-0,3,-3.3,2018-03-17Ein FrankfurtMainz
17/03/18,Hamburg,Hertha,1,2,A,2.5,3.3,2.85,2018-03-17,2017/2018,27,D1,1-2,-1,-0.3500000000000001,2018-03-17HamburgHertha
17/03/18,M'gladbach,Hoffenheim,3,3,D,2.65,3.3,2.65,2018-03-17,2017/2018,27,D1,3-3,0,0.0,2018-03-17M'gladbachHoffenheim
17/03/18,Wolfsburg,Schalke 04,0,1,A,3.5,3.4,2.1,2018-03-17,2017/2018,27,D1,0-1,-1,1.4,2018-03-17WolfsburgSchalke 04
18/03/18,Dortmund,Hannover,1,0,H,1.45,4.4,7.2,2018-03-18,2017/2018,27,D1,1-0,1,-5.75,2018-03-18DortmundHannover
18/03/18,FC Koln,Leverkusen,2,0,H,4.3,3.7,1.8,2018-03-18,2017/2018,27,D1,2-0,2,2.5,2018-03-18FC KolnLeverkusen
18/03/18,RB Leipzig,Bayern Munich,2,1,H,4.8,3.9,1.7,2018-03-18,2017/2018,27,D1,2-1,1,3.0999999999999996,2018-03-18RB LeipzigBayern Munich
31/03/18,Bayern Munich,Dortmund,6,0,H,1.5,4.2,6.5,2018-03-31,2017/2018,28,D1,6-0,6,-5.0,2018-03-31Bayern MunichDortmund
31/03/18,Hannover,RB Leipzig,2,3,A,3.8,3.4,2.0,2018-03-31,2017/2018,28,D1,2-3,-1,1.7999999999999998,2018-03-31HannoverRB Leipzig
31/03/18,Hertha,Wolfsburg,0,0,D,2.2,3.35,3.3,2018-03-31,2017/2018,28,D1,0-0,0,-1.0999999999999996,2018-03-31HerthaWolfsburg
31/03/18,Hoffenheim,FC Koln,6,0,H,1.55,4.2,5.8,2018-03-31,2017/2018,28,D1,6-0,6,-4.25,2018-03-31HoffenheimFC Koln
31/03/18,Leverkusen,Augsburg,0,0,D,1.45,4.5,7.0,2018-03-31,2017/2018,28,D1,0-0,0,-5.55,2018-03-31LeverkusenAugsburg
31/03/18,Schalke 04,Freiburg,2,0,H,1.5,4.2,6.5,2018-03-31,2017/2018,28,D1,2-0,2,-5.0,2018-03-31Schalke 04Freiburg
31/03/18,Stuttgart,Hamburg,1,1,D,1.8,3.6,4.5,2018-03-31,2017/2018,28,D1,1-1,0,-2.7,2018-03-31StuttgartHamburg
01/04/18,Mainz,M'gladbach,0,0,D,2.65,3.3,2.65,2018-04-01,2017/2018,28,D1,0-0,0,0.0,2018-04-01MainzM'gladbach
01/04/18,Werder Bremen,Ein Frankfurt,2,1,H,2.5,3.3,2.85,2018-04-01,2017/2018,28,D1,2-1,1,-0.3500000000000001,2018-04-01Werder BremenEin Frankfurt
06/04/18,Hannover,Werder Bremen,2,1,H,2.85,3.3,2.5,2018-04-06,2017/2018,29,D1,2-1,1,0.3500000000000001,2018-04-06HannoverWerder Bremen
07/04/18,Augsburg,Bayern Munich,1,4,A,6.5,4.2,1.5,2018-04-07,2017/2018,29,D1,1-4,-3,5.0,2018-04-07AugsburgBayern Munich
07/04/18,FC Koln,Mainz,1,1,D,2.2,3.35,3.3,2018-04-07,2017/2018,29,D1,1-1,0,-1.0999999999999996,2018-04-07FC KolnMainz
07/04/18,Freiburg,Wolfsburg,0,2,A,2.6,3.25,2.75,2018-04-07,2017/2018,29,D1,0-2,-2,-0.1499999999999999,2018-04-07FreiburgWolfsburg
07/04/18,Hamburg,Schalke 04,3,2,H,4.1,3.5,1.9,2018-04-07,2017/2018,29,D1,3-2,1,2.1999999999999997,2018-04-07HamburgSchalke 04
07/04/18,M'gladbach,Hertha,2,1,H,2.0,3.4,3.8,2018-04-07,2017/2018,29,D1,2-1,1,-1.7999999999999998,2018-04-07M'gladbachHertha
08/04/18,Dortmund,Stuttgart,3,0,H,1.65,4.0,5.0,2018-04-08,2017/2018,29,D1,3-0,3,-3.35,2018-04-08DortmundStuttgart
08/04/18,Ein Frankfurt,Hoffenheim,1,1,D,2.6,3.25,2.75,2018-04-08,2017/2018,29,D1,1-1,0,-0.1499999999999999,2018-04-08Ein FrankfurtHoffenheim
09/04/18,RB Leipzig,Leverkusen,1,4,A,2.3,3.3,3.15,2018-04-09,2017/2018,29,D1,1-4,-3,-0.8500000000000001,2018-04-09RB LeipzigLeverkusen
13/04/18,Wolfsburg,Augsburg,0,0,D,2.1,3.4,3.5,2018-04-13,2017/2018,30,D1,0-0,0,-1.4,2018-04-13WolfsburgAugsburg
14/04/18,Bayern Munich,M'gladbach,5,1,H,1.35,5.5,7.5,2018-04-14,2017/2018,30,D1,5-1,4,-6.15,2018-04-14Bayern MunichM'gladbach
14/04/18,Hertha,FC Koln,2,1,H,2.1,3.4,3.5,2018-04-14,2017/2018,30,D1,2-1,1,-1.4,2018-04-14HerthaFC Koln
14/04/18,Hoffenheim,Hamburg,2,0,H,1.55,4.0,6.2,2018-04-14,2017/2018,30,D1,2-0,2,-4.65,2018-04-14HoffenheimHamburg
14/04/18,Leverkusen,Ein Frankfurt,4,1,H,1.85,3.5,4.3,2018-04-14,2017/2018,30,D1,4-1,3,-2.4499999999999997,2018-04-14LeverkusenEin Frankfurt
14/04/18,Stuttgart,Hannover,1,1,D,1.85,3.5,4.3,2018-04-14,2017/2018,30,D1,1-1,0,-2.4499999999999997,2018-04-14StuttgartHannover
15/04/18,Schalke 04,Dortmund,2,0,H,2.6,3.2,2.8,2018-04-15,2017/2018,30,D1,2-0,2,-0.19999999999999973,2018-04-15Schalke 04Dortmund
15/04/18,Werder Bremen,RB Leipzig,1,1,D,2.85,3.5,2.4,2018-04-15,2017/2018,30,D1,1-1,0,0.4500000000000002,2018-04-15Werder BremenRB Leipzig
16/04/18,Mainz,Freiburg,2,0,H,2.3,3.3,3.15,2018-04-16,2017/2018,30,D1,2-0,2,-0.8500000000000001,2018-04-16MainzFreiburg
20/04/18,M'gladbach,Wolfsburg,3,0,H,1.9,3.5,4.1,2018-04-20,2017/2018,31,D1,3-0,3,-2.1999999999999997,2018-04-20M'gladbachWolfsburg
21/04/18,Dortmund,Leverkusen,4,0,H,2.3,3.3,3.15,2018-04-21,2017/2018,31,D1,4-0,4,-0.8500000000000001,2018-04-21DortmundLeverkusen
21/04/18,Ein Frankfurt,Hertha,0,3,A,1.8,3.6,4.5,2018-04-21,2017/2018,31,D1,0-3,-3,-2.7,2018-04-21Ein FrankfurtHertha
21/04/18,Hamburg,Freiburg,1,0,H,2.1,3.4,3.5,2018-04-21,2017/2018,31,D1,1-0,1,-1.4,2018-04-21HamburgFreiburg
21/04/18,Hannover,Bayern Munich,0,3,A,6.5,4.2,1.5,2018-04-21,2017/2018,31,D1,0-3,-3,5.0,2018-04-21HannoverBayern Munich
21/04/18,RB Leipzig,Hoffenheim,2,5,A,2.0,3.5,3.7,2018-04-21,2017/2018,31,D1,2-5,-3,-1.7000000000000002,2018-04-21RB LeipzigHoffenheim
21/04/18,Stuttgart,Werder Bremen,2,0,H,2.3,3.3,3.15,2018-04-21,2017/2018,31,D1,2-0,2,-0.8500000000000001,2018-04-21StuttgartWerder Bremen
22/04/18,Augsburg,Mainz,2,0,H,2.1,3.4,3.5,2018-04-22,2017/2018,31,D1,2-0,2,-1.4,2018-04-22AugsburgMainz
22/04/18,FC Koln,Schalke 04,2,2,D,4.1,3.9,1.8,2018-04-22,2017/2018,31,D1,2-2,0,2.3,2018-04-22FC KolnSchalke 04
27/04/18,Hoffenheim,Hannover,3,1,H,1.3,5.5,9.5,2018-04-27,2017/2018,32,D1,3-1,2,-8.2,2018-04-27HoffenheimHannover
28/04/18,Bayern Munich,Ein Frankfurt,4,1,H,1.7,4.2,4.3,2018-04-28,2017/2018,32,D1,4-1,3,-2.5999999999999996,2018-04-28Bayern MunichEin Frankfurt
28/04/18,Freiburg,FC Koln,3,2,H,2.0,3.5,3.7,2018-04-28,2017/2018,32,D1,3-2,1,-1.7000000000000002,2018-04-28FreiburgFC Koln
28/04/18,Hertha,Augsburg,2,2,D,2.1,3.4,3.5,2018-04-28,2017/2018,32,D1,2-2,0,-1.4,2018-04-28HerthaAugsburg
28/04/18,Leverkusen,Stuttgart,0,1,A,1.45,4.5,7.0,2018-04-28,2017/2018,32,D1,0-1,-1,-5.55,2018-04-28LeverkusenStuttgart
28/04/18,Schalke 04,M'gladbach,1,1,D,1.85,3.6,4.2,2018-04-28,2017/2018,32,D1,1-1,0,-2.35,2018-04-28Schalke 04M'gladbach
28/04/18,Wolfsburg,Hamburg,1,3,A,2.3,3.5,3.0,2018-04-28,2017/2018,32,D1,1-3,-2,-0.7000000000000002,2018-04-28WolfsburgHamburg
29/04/18,Mainz,RB Leipzig,3,0,H,3.2,3.5,2.2,2018-04-29,2017/2018,32,D1,3-0,3,1.0,2018-04-29MainzRB Leipzig
29/04/18,Werder Bremen,Dortmund,1,1,D,3.8,3.4,2.0,2018-04-29,2017/2018,32,D1,1-1,0,1.7999999999999998,2018-04-29Werder BremenDortmund
05/05/18,Augsburg,Schalke 04,1,2,A,3.4,3.3,2.2,2018-05-05,2017/2018,33,D1,1-2,-1,1.1999999999999997,2018-05-05AugsburgSchalke 04
05/05/18,Dortmund,Mainz,1,2,A,1.35,5.3,8.0,2018-05-05,2017/2018,33,D1,1-2,-1,-6.65,2018-05-05DortmundMainz
05/05/18,Ein Frankfurt,Hamburg,3,0,H,2.0,3.8,3.4,2018-05-05,2017/2018,33,D1,3-0,3,-1.4,2018-05-05Ein FrankfurtHamburg
05/05/18,FC Koln,Bayern Munich,1,3,A,8.0,5.3,1.35,2018-05-05,2017/2018,33,D1,1-3,-2,6.65,2018-05-05FC KolnBayern Munich
05/05/18,Hannover,Hertha,3,1,H,2.6,3.3,2.7,2018-05-05,2017/2018,33,D1,3-1,2,-0.10000000000000009,2018-05-05HannoverHertha
05/05/18,M'gladbach,Freiburg,3,1,H,1.75,3.7,4.6,2018-05-05,2017/2018,33,D1,3-1,2,-2.8499999999999996,2018-05-05M'gladbachFreiburg
05/05/18,RB Leipzig,Wolfsburg,4,1,H,1.65,4.0,5.0,2018-05-05,2017/2018,33,D1,4-1,3,-3.35,2018-05-05RB LeipzigWolfsburg
05/05/18,Stuttgart,Hoffenheim,2,0,H,3.5,3.4,2.1,2018-05-05,2017/2018,33,D1,2-0,2,1.4,2018-05-05StuttgartHoffenheim
05/05/18,Werder Bremen,Leverkusen,0,0,D,4.0,3.6,1.9,2018-05-05,2017/2018,33,D1,0-0,0,2.1,2018-05-05Werder BremenLeverkusen
12/05/18,Bayern Munich,Stuttgart,1,4,A,1.2,7.0,12.5,2018-05-12,2017/2018,34,D1,1-4,-3,-11.3,2018-05-12Bayern MunichStuttgart
12/05/18,Freiburg,Augsburg,2,0,H,2.0,3.1,4.3,2018-05-12,2017/2018,34,D1,2-0,2,-2.3,2018-05-12FreiburgAugsburg
12/05/18,Hamburg,M'gladbach,2,1,H,2.2,3.7,3.0,2018-05-12,2017/2018,34,D1,2-1,1,-0.7999999999999998,2018-05-12HamburgM'gladbach
12/05/18,Hertha,RB Leipzig,2,6,A,4.5,3.6,1.8,2018-05-12,2017/2018,34,D1,2-6,-4,2.7,2018-05-12HerthaRB Leipzig
12/05/18,Hoffenheim,Dortmund,3,1,H,2.4,3.7,2.7,2018-05-12,2017/2018,34,D1,3-1,2,-0.30000000000000027,2018-05-12HoffenheimDortmund
12/05/18,Leverkusen,Hannover,3,2,H,1.17,7.5,15.0,2018-05-12,2017/2018,34,D1,3-2,1,-13.83,2018-05-12LeverkusenHannover
12/05/18,Mainz,Werder Bremen,1,2,A,2.3,3.4,3.05,2018-05-12,2017/2018,34,D1,1-2,-1,-0.75,2018-05-12MainzWerder Bremen
12/05/18,Schalke 04,Ein Frankfurt,1,0,H,2.5,3.4,2.75,2018-05-12,2017/2018,34,D1,1-0,1,-0.25,2018-05-12Schalke 04Ein Frankfurt
12/05/18,Wolfsburg,FC Koln,4,1,H,1.7,3.5,5.5,2018-05-12,2017/2018,34,D1,4-1,3,-3.8,2018-05-12WolfsburgFC Koln
