Date,HomeTeam,AwayTeam,FTHG,FTAG,FTR,IWH,IWD,IWA,datetime,season,game_day,league,result,goal_diff,odds_diff,game_id
08/08/2015,Bournemouth,Aston Villa,0,1,A,2.1,3.3,3.3,2015-08-08,2015/2016,1,E0,0-1,-1,-1.1999999999999997,2015-08-08BournemouthAston Villa
08/08/2015,Chelsea,Swansea,2,2,D,1.33,4.8,8.3,2015-08-08,2015/2016,1,E0,2-2,0,-6.970000000000001,2015-08-08ChelseaSwansea
08/08/2015,Everton,Watford,2,2,D,1.7,3.6,4.7,2015-08-08,2015/2016,1,E0,2-2,0,-3.0,2015-08-08EvertonWatford
08/08/2015,Leicester,Sunderland,4,2,H,2.0,3.3,3.6,2015-08-08,2015/2016,1,E0,4-2,2,-1.6,2015-08-08LeicesterSunderland
08/08/2015,Man United,Tottenham,1,0,H,1.65,3.6,5.1,2015-08-08,2015/2016,1,E0,1-0,1,-3.4499999999999997,2015-08-08Man UnitedTottenham
08/08/2015,Norwich,Crystal Palace,1,3,A,2.4,3.2,2.85,2015-08-08,2015/2016,1,E0,1-3,-2,-0.4500000000000002,2015-08-08NorwichCrystal Palace
09/08/2015,Arsenal,West Ham,0,2,A,1.33,4.8,8.3,2015-08-09,2015/2016,1,E0,0-2,-2,-6.970000000000001,2015-08-09ArsenalWest Ham
09/08/2015,Newcastle,Southampton,2,2,D,2.65,3.3,2.5,2015-08-09,2015/2016,1,E0,2-2,0,0.1499999999999999,2015-08-09NewcastleSouthampton
09/08/2015,Stoke,Liverpool,0,1,A,2.9,3.3,2.3,2015-08-09,2015/2016,1,E0,0-1,-1,0.6000000000000001,2015-08-09StokeLiverpool
10/08/2015,West Brom,Man City,0,3,A,5.1,3.6,1.65,2015-08-10,2015/2016,2,E0,0-3,-3,3.4499999999999997,2015-08-10West BromMan City
14/08/2015,Aston Villa,Man United,0,1,A,5.0,3.6,1.67,2015-08-14,2015/2016,2,E0,0-1,-1,3.33,2015-08-14Aston VillaMan United
15/08/2015,Southampton,Everton,0,3,A,2.1,3.2,3.4,2015-08-15,2015/2016,2,E0,0-3,-3,-1.2999999999999998,2015-08-15SouthamptonEverton
15/08/2015,Sunderland,Norwich,1,3,A,2.3,3.3,2.9,2015-08-15,2015/2016,2,E0,1-3,-2,-0.6000000000000001,2015-08-15SunderlandNorwich
15/08/2015,Swansea,Newcastle,2,0,H,1.9,3.45,3.8,2015-08-15,2015/2016,2,E0,2-0,2,-1.9,2015-08-15SwanseaNewcastle
15/08/2015,Tottenham,Stoke,2,2,D,1.7,3.6,4.7,2015-08-15,2015/2016,2,E0,2-2,0,-3.0,2015-08-15TottenhamStoke
15/08/2015,Watford,West Brom,0,0,D,2.4,3.2,2.85,2015-08-15,2015/2016,2,E0,0-0,0,-0.4500000000000002,2015-08-15WatfordWest Brom
15/08/2015,West Ham,Leicester,1,2,A,2.2,3.3,3.1,2015-08-15,2015/2016,2,E0,1-2,-1,-0.8999999999999999,2015-08-15West HamLeicester
16/08/2015,Crystal Palace,Arsenal,1,2,A,4.7,3.6,1.7,2015-08-16,2015/2016,2,E0,1-2,-1,3.0,2015-08-16Crystal PalaceArsenal
16/08/2015,Man City,Chelsea,3,0,H,2.1,3.3,3.3,2015-08-16,2015/2016,3,E0,3-0,3,-1.1999999999999997,2015-08-16Man CityChelsea
17/08/2015,Liverpool,Bournemouth,1,0,H,1.4,4.4,7.3,2015-08-17,2015/2016,3,E0,1-0,1,-5.9,2015-08-17LiverpoolBournemouth
22/08/2015,Crystal Palace,Aston Villa,2,1,H,1.9,3.4,3.9,2015-08-22,2015/2016,3,E0,2-1,1,-2.0,2015-08-22Crystal PalaceAston Villa
22/08/2015,Leicester,Tottenham,1,1,D,2.6,3.2,2.6,2015-08-22,2015/2016,3,E0,1-1,0,0.0,2015-08-22LeicesterTottenham
22/08/2015,Man United,Newcastle,0,0,D,1.35,4.8,7.6,2015-08-22,2015/2016,3,E0,0-0,0,-6.25,2015-08-22Man UnitedNewcastle
22/08/2015,Norwich,Stoke,1,1,D,2.4,3.2,2.85,2015-08-22,2015/2016,3,E0,1-1,0,-0.4500000000000002,2015-08-22NorwichStoke
22/08/2015,Sunderland,Swansea,1,1,D,3.3,3.3,2.1,2015-08-22,2015/2016,3,E0,1-1,0,1.1999999999999997,2015-08-22SunderlandSwansea
22/08/2015,West Ham,Bournemouth,3,4,A,2.2,3.2,3.2,2015-08-22,2015/2016,3,E0,3-4,-1,-1.0,2015-08-22West HamBournemouth
23/08/2015,Everton,Man City,0,2,A,4.7,3.6,1.7,2015-08-23,2015/2016,3,E0,0-2,-2,3.0,2015-08-23EvertonMan City
23/08/2015,Watford,Southampton,0,0,D,2.6,3.2,2.6,2015-08-23,2015/2016,4,E0,0-0,0,0.0,2015-08-23WatfordSouthampton
23/08/2015,West Brom,Chelsea,2,3,A,5.1,3.6,1.65,2015-08-23,2015/2016,4,E0,2-3,-1,3.4499999999999997,2015-08-23West BromChelsea
24/08/2015,Arsenal,Liverpool,0,0,D,1.8,3.5,4.2,2015-08-24,2015/2016,4,E0,0-0,0,-2.4000000000000004,2015-08-24ArsenalLiverpool
29/08/2015,Aston Villa,Sunderland,2,2,D,1.9,3.45,3.8,2015-08-29,2015/2016,4,E0,2-2,0,-1.9,2015-08-29Aston VillaSunderland
29/08/2015,Bournemouth,Leicester,1,1,D,2.2,3.2,3.2,2015-08-29,2015/2016,4,E0,1-1,0,-1.0,2015-08-29BournemouthLeicester
29/08/2015,Chelsea,Crystal Palace,1,2,A,1.33,4.8,8.3,2015-08-29,2015/2016,4,E0,1-2,-1,-6.970000000000001,2015-08-29ChelseaCrystal Palace
29/08/2015,Liverpool,West Ham,0,3,A,1.4,4.4,7.3,2015-08-29,2015/2016,4,E0,0-3,-3,-5.9,2015-08-29LiverpoolWest Ham
29/08/2015,Man City,Watford,2,0,H,1.2,5.8,13.0,2015-08-29,2015/2016,4,E0,2-0,2,-11.8,2015-08-29Man CityWatford
29/08/2015,Newcastle,Arsenal,0,1,A,5.0,3.9,1.6,2015-08-29,2015/2016,4,E0,0-1,-1,3.4,2015-08-29NewcastleArsenal
29/08/2015,Stoke,West Brom,0,1,A,2.0,3.3,3.6,2015-08-29,2015/2016,5,E0,0-1,-1,-1.6,2015-08-29StokeWest Brom
29/08/2015,Tottenham,Everton,0,0,D,2.0,3.3,3.6,2015-08-29,2015/2016,5,E0,0-0,0,-1.6,2015-08-29TottenhamEverton
30/08/2015,Southampton,Norwich,3,0,H,1.9,3.45,3.8,2015-08-30,2015/2016,5,E0,3-0,3,-1.9,2015-08-30SouthamptonNorwich
30/08/2015,Swansea,Man United,2,1,H,3.2,3.2,2.2,2015-08-30,2015/2016,5,E0,2-1,1,1.0,2015-08-30SwanseaMan United
12/09/2015,Arsenal,Stoke,2,0,H,1.3,5.0,9.0,2015-09-12,2015/2016,5,E0,2-0,2,-7.7,2015-09-12ArsenalStoke
12/09/2015,Crystal Palace,Man City,0,1,A,5.4,3.7,1.6,2015-09-12,2015/2016,5,E0,0-1,-1,3.8000000000000003,2015-09-12Crystal PalaceMan City
12/09/2015,Everton,Chelsea,3,1,H,3.6,3.3,2.0,2015-09-12,2015/2016,5,E0,3-1,2,1.6,2015-09-12EvertonChelsea
12/09/2015,Man United,Liverpool,3,1,H,1.85,3.45,4.0,2015-09-12,2015/2016,5,E0,3-1,2,-2.15,2015-09-12Man UnitedLiverpool
12/09/2015,Norwich,Bournemouth,3,1,H,2.3,3.3,2.9,2015-09-12,2015/2016,5,E0,3-1,2,-0.6000000000000001,2015-09-12NorwichBournemouth
12/09/2015,Watford,Swansea,1,0,H,2.6,3.2,2.6,2015-09-12,2015/2016,6,E0,1-0,1,0.0,2015-09-12WatfordSwansea
12/09/2015,West Brom,Southampton,0,0,D,2.65,3.3,2.5,2015-09-12,2015/2016,6,E0,0-0,0,0.1499999999999999,2015-09-12West BromSouthampton
13/09/2015,Leicester,Aston Villa,3,2,H,1.85,3.45,4.0,2015-09-13,2015/2016,6,E0,3-2,1,-2.15,2015-09-13LeicesterAston Villa
13/09/2015,Sunderland,Tottenham,0,1,A,3.6,3.3,2.0,2015-09-13,2015/2016,6,E0,0-1,-1,1.6,2015-09-13SunderlandTottenham
14/09/2015,West Ham,Newcastle,2,0,H,2.1,3.3,3.3,2015-09-14,2015/2016,6,E0,2-0,2,-1.1999999999999997,2015-09-14West HamNewcastle
19/09/2015,Aston Villa,West Brom,0,1,A,2.3,3.2,3.0,2015-09-19,2015/2016,6,E0,0-1,-1,-0.7000000000000002,2015-09-19Aston VillaWest Brom
19/09/2015,Bournemouth,Sunderland,2,0,H,1.75,3.5,4.5,2015-09-19,2015/2016,6,E0,2-0,2,-2.75,2015-09-19BournemouthSunderland
19/09/2015,Chelsea,Arsenal,2,0,H,2.3,3.2,3.0,2015-09-19,2015/2016,6,E0,2-0,2,-0.7000000000000002,2015-09-19ChelseaArsenal
19/09/2015,Man City,West Ham,1,2,A,1.25,5.5,10.3,2015-09-19,2015/2016,6,E0,1-2,-1,-9.05,2015-09-19Man CityWest Ham
19/09/2015,Newcastle,Watford,1,2,A,2.4,3.3,2.75,2015-09-19,2015/2016,7,E0,1-2,-1,-0.3500000000000001,2015-09-19NewcastleWatford
19/09/2015,Stoke,Leicester,2,2,D,2.4,3.2,2.85,2015-09-19,2015/2016,7,E0,2-2,0,-0.4500000000000002,2015-09-19StokeLeicester
19/09/2015,Swansea,Everton,0,0,D,2.3,3.2,3.0,2015-09-19,2015/2016,7,E0,0-0,0,-0.7000000000000002,2015-09-19SwanseaEverton
20/09/2015,Liverpool,Norwich,1,1,D,1.55,3.9,5.6,2015-09-20,2015/2016,7,E0,1-1,0,-4.05,2015-09-20LiverpoolNorwich
20/09/2015,Southampton,Man United,2,3,A,3.0,3.2,2.3,2015-09-20,2015/2016,7,E0,2-3,-1,0.7000000000000002,2015-09-20SouthamptonMan United
20/09/2015,Tottenham,Crystal Palace,1,0,H,1.85,3.45,4.0,2015-09-20,2015/2016,7,E0,1-0,1,-2.15,2015-09-20TottenhamCrystal Palace
26/09/2015,Leicester,Arsenal,2,5,A,3.8,3.45,1.9,2015-09-26,2015/2016,7,E0,2-5,-3,1.9,2015-09-26LeicesterArsenal
26/09/2015,Liverpool,Aston Villa,3,2,H,1.5,4.0,6.1,2015-09-26,2015/2016,7,E0,3-2,1,-4.6,2015-09-26LiverpoolAston Villa
26/09/2015,Man United,Sunderland,3,0,H,1.2,5.8,13.0,2015-09-26,2015/2016,7,E0,3-0,3,-11.8,2015-09-26Man UnitedSunderland
26/09/2015,Newcastle,Chelsea,2,2,D,5.4,3.7,1.6,2015-09-26,2015/2016,8,E0,2-2,0,3.8000000000000003,2015-09-26NewcastleChelsea
26/09/2015,Southampton,Swansea,3,1,H,2.2,3.2,3.2,2015-09-26,2015/2016,8,E0,3-1,2,-1.0,2015-09-26SouthamptonSwansea
26/09/2015,Stoke,Bournemouth,2,1,H,2.5,3.2,2.75,2015-09-26,2015/2016,8,E0,2-1,1,-0.25,2015-09-26StokeBournemouth
26/09/2015,Tottenham,Man City,4,1,H,3.6,3.3,2.0,2015-09-26,2015/2016,8,E0,4-1,3,1.6,2015-09-26TottenhamMan City
26/09/2015,West Ham,Norwich,2,2,D,2.1,3.3,3.3,2015-09-26,2015/2016,8,E0,2-2,0,-1.1999999999999997,2015-09-26West HamNorwich
27/09/2015,Watford,Crystal Palace,0,1,A,2.5,3.2,2.75,2015-09-27,2015/2016,8,E0,0-1,-1,-0.25,2015-09-27WatfordCrystal Palace
28/09/2015,West Brom,Everton,2,3,A,2.85,3.2,2.4,2015-09-28,2015/2016,8,E0,2-3,-1,0.4500000000000002,2015-09-28West BromEverton
03/10/2015,Aston Villa,Stoke,0,1,A,2.4,3.3,2.75,2015-10-03,2015/2016,8,E0,0-1,-1,-0.3500000000000001,2015-10-03Aston VillaStoke
03/10/2015,Bournemouth,Watford,1,1,D,2.1,3.3,3.3,2015-10-03,2015/2016,8,E0,1-1,0,-1.1999999999999997,2015-10-03BournemouthWatford
03/10/2015,Chelsea,Southampton,1,3,A,1.7,3.6,4.7,2015-10-03,2015/2016,9,E0,1-3,-2,-3.0,2015-10-03ChelseaSouthampton
03/10/2015,Crystal Palace,West Brom,2,0,H,1.8,3.5,4.2,2015-10-03,2015/2016,9,E0,2-0,2,-2.4000000000000004,2015-10-03Crystal PalaceWest Brom
03/10/2015,Man City,Newcastle,6,1,H,1.25,5.5,10.3,2015-10-03,2015/2016,9,E0,6-1,5,-9.05,2015-10-03Man CityNewcastle
03/10/2015,Norwich,Leicester,1,2,A,2.3,3.3,2.9,2015-10-03,2015/2016,9,E0,1-2,-1,-0.6000000000000001,2015-10-03NorwichLeicester
03/10/2015,Sunderland,West Ham,2,2,D,2.9,3.3,2.3,2015-10-03,2015/2016,9,E0,2-2,0,0.6000000000000001,2015-10-03SunderlandWest Ham
04/10/2015,Arsenal,Man United,3,0,H,2.1,3.3,3.3,2015-10-04,2015/2016,9,E0,3-0,3,-1.1999999999999997,2015-10-04ArsenalMan United
04/10/2015,Everton,Liverpool,1,1,D,2.6,3.2,2.6,2015-10-04,2015/2016,9,E0,1-1,0,0.0,2015-10-04EvertonLiverpool
04/10/2015,Swansea,Tottenham,2,2,D,2.6,3.2,2.6,2015-10-04,2015/2016,9,E0,2-2,0,0.0,2015-10-04SwanseaTottenham
17/10/2015,Chelsea,Aston Villa,2,0,H,1.35,4.8,7.6,2015-10-17,2015/2016,9,E0,2-0,2,-6.25,2015-10-17ChelseaAston Villa
17/10/2015,Crystal Palace,West Ham,1,3,A,1.9,3.45,3.8,2015-10-17,2015/2016,10,E0,1-3,-2,-1.9,2015-10-17Crystal PalaceWest Ham
17/10/2015,Everton,Man United,0,3,A,2.9,3.3,2.3,2015-10-17,2015/2016,10,E0,0-3,-3,0.6000000000000001,2015-10-17EvertonMan United
17/10/2015,Man City,Bournemouth,5,1,H,1.3,5.0,9.0,2015-10-17,2015/2016,10,E0,5-1,4,-7.7,2015-10-17Man CityBournemouth
17/10/2015,Southampton,Leicester,2,2,D,1.8,3.5,4.2,2015-10-17,2015/2016,10,E0,2-2,0,-2.4000000000000004,2015-10-17SouthamptonLeicester
17/10/2015,Tottenham,Liverpool,0,0,D,2.5,3.2,2.75,2015-10-17,2015/2016,10,E0,0-0,0,-0.25,2015-10-17TottenhamLiverpool
17/10/2015,Watford,Arsenal,0,3,A,5.0,3.9,1.6,2015-10-17,2015/2016,10,E0,0-3,-3,3.4,2015-10-17WatfordArsenal
17/10/2015,West Brom,Sunderland,1,0,H,1.85,3.45,4.0,2015-10-17,2015/2016,10,E0,1-0,1,-2.15,2015-10-17West BromSunderland
18/10/2015,Newcastle,Norwich,6,2,H,2.5,3.3,2.65,2015-10-18,2015/2016,10,E0,6-2,4,-0.1499999999999999,2015-10-18NewcastleNorwich
19/10/2015,Swansea,Stoke,0,1,A,2.0,3.3,3.6,2015-10-19,2015/2016,10,E0,0-1,-1,-1.6,2015-10-19SwanseaStoke
24/10/2015,Arsenal,Everton,2,1,H,1.45,4.0,7.0,2015-10-24,2015/2016,11,E0,2-1,1,-5.55,2015-10-24ArsenalEverton
24/10/2015,Aston Villa,Swansea,1,2,A,2.75,3.2,2.5,2015-10-24,2015/2016,11,E0,1-2,-1,0.25,2015-10-24Aston VillaSwansea
24/10/2015,Leicester,Crystal Palace,1,0,H,2.2,3.2,3.2,2015-10-24,2015/2016,11,E0,1-0,1,-1.0,2015-10-24LeicesterCrystal Palace
24/10/2015,Norwich,West Brom,0,1,A,2.1,3.3,3.3,2015-10-24,2015/2016,11,E0,0-1,-1,-1.1999999999999997,2015-10-24NorwichWest Brom
24/10/2015,Stoke,Watford,0,2,A,2.0,3.3,3.6,2015-10-24,2015/2016,11,E0,0-2,-2,-1.6,2015-10-24StokeWatford
24/10/2015,West Ham,Chelsea,2,1,H,3.8,3.45,1.9,2015-10-24,2015/2016,11,E0,2-1,1,1.9,2015-10-24West HamChelsea
25/10/2015,Bournemouth,Tottenham,1,5,A,3.2,3.2,2.2,2015-10-25,2015/2016,11,E0,1-5,-4,1.0,2015-10-25BournemouthTottenham
25/10/2015,Liverpool,Southampton,1,1,D,1.85,3.45,4.0,2015-10-25,2015/2016,11,E0,1-1,0,-2.15,2015-10-25LiverpoolSouthampton
25/10/2015,Man United,Man City,0,0,D,2.6,3.2,2.6,2015-10-25,2015/2016,11,E0,0-0,0,0.0,2015-10-25Man UnitedMan City
25/10/2015,Sunderland,Newcastle,3,0,H,2.3,3.3,2.9,2015-10-25,2015/2016,12,E0,3-0,3,-0.6000000000000001,2015-10-25SunderlandNewcastle
31/10/2015,Chelsea,Liverpool,1,3,A,2.1,3.2,3.4,2015-10-31,2015/2016,12,E0,1-3,-2,-1.2999999999999998,2015-10-31ChelseaLiverpool
31/10/2015,Crystal Palace,Man United,0,0,D,3.4,3.2,2.1,2015-10-31,2015/2016,12,E0,0-0,0,1.2999999999999998,2015-10-31Crystal PalaceMan United
31/10/2015,Man City,Norwich,2,1,H,1.22,5.5,12.0,2015-10-31,2015/2016,12,E0,2-1,1,-10.78,2015-10-31Man CityNorwich
31/10/2015,Newcastle,Stoke,0,0,D,2.5,3.3,2.65,2015-10-31,2015/2016,12,E0,0-0,0,-0.1499999999999999,2015-10-31NewcastleStoke
31/10/2015,Swansea,Arsenal,0,3,A,4.7,3.6,1.7,2015-10-31,2015/2016,12,E0,0-3,-3,3.0,2015-10-31SwanseaArsenal
31/10/2015,Watford,West Ham,2,0,H,2.6,3.2,2.6,2015-10-31,2015/2016,12,E0,2-0,2,0.0,2015-10-31WatfordWest Ham
31/10/2015,West Brom,Leicester,2,3,A,2.65,3.3,2.5,2015-10-31,2015/2016,12,E0,2-3,-1,0.1499999999999999,2015-10-31West BromLeicester
01/11/2015,Everton,Sunderland,6,2,H,1.5,4.0,6.1,2015-11-01,2015/2016,12,E0,6-2,4,-4.6,2015-11-01EvertonSunderland
01/11/2015,Southampton,Bournemouth,2,0,H,1.55,4.0,5.5,2015-11-01,2015/2016,13,E0,2-0,2,-3.95,2015-11-01SouthamptonBournemouth
02/11/2015,Tottenham,Aston Villa,3,1,H,1.4,4.4,7.3,2015-11-02,2015/2016,13,E0,3-1,2,-5.9,2015-11-02TottenhamAston Villa
07/11/2015,Bournemouth,Newcastle,0,1,A,2.2,3.3,3.1,2015-11-07,2015/2016,13,E0,0-1,-1,-0.8999999999999999,2015-11-07BournemouthNewcastle
07/11/2015,Leicester,Watford,2,1,H,1.85,3.45,4.0,2015-11-07,2015/2016,13,E0,2-1,1,-2.15,2015-11-07LeicesterWatford
07/11/2015,Man United,West Brom,2,0,H,1.35,4.8,7.6,2015-11-07,2015/2016,13,E0,2-0,2,-6.25,2015-11-07Man UnitedWest Brom
07/11/2015,Norwich,Swansea,1,0,H,2.5,3.3,2.65,2015-11-07,2015/2016,13,E0,1-0,1,-0.1499999999999999,2015-11-07NorwichSwansea
07/11/2015,Stoke,Chelsea,1,0,H,3.3,3.3,2.1,2015-11-07,2015/2016,13,E0,1-0,1,1.1999999999999997,2015-11-07StokeChelsea
07/11/2015,Sunderland,Southampton,0,1,A,4.0,3.45,1.85,2015-11-07,2015/2016,13,E0,0-1,-1,2.15,2015-11-07SunderlandSouthampton
07/11/2015,West Ham,Everton,1,1,D,2.5,3.3,2.65,2015-11-07,2015/2016,13,E0,1-1,0,-0.1499999999999999,2015-11-07West HamEverton
08/11/2015,Arsenal,Tottenham,1,1,D,1.6,3.9,5.0,2015-11-08,2015/2016,14,E0,1-1,0,-3.4,2015-11-08ArsenalTottenham
08/11/2015,Aston Villa,Man City,0,0,D,6.1,4.0,1.5,2015-11-08,2015/2016,14,E0,0-0,0,4.6,2015-11-08Aston VillaMan City
08/11/2015,Liverpool,Crystal Palace,1,2,A,1.6,3.7,5.4,2015-11-08,2015/2016,14,E0,1-2,-1,-3.8000000000000003,2015-11-08LiverpoolCrystal Palace
21/11/2015,Chelsea,Norwich,1,0,H,1.4,4.4,7.3,2015-11-21,2015/2016,14,E0,1-0,1,-5.9,2015-11-21ChelseaNorwich
21/11/2015,Everton,Aston Villa,4,0,H,1.55,3.9,5.6,2015-11-21,2015/2016,14,E0,4-0,4,-4.05,2015-11-21EvertonAston Villa
21/11/2015,Man City,Liverpool,1,4,A,1.7,3.6,4.7,2015-11-21,2015/2016,14,E0,1-4,-3,-3.0,2015-11-21Man CityLiverpool
21/11/2015,Newcastle,Leicester,0,3,A,2.65,3.3,2.5,2015-11-21,2015/2016,14,E0,0-3,-3,0.1499999999999999,2015-11-21NewcastleLeicester
21/11/2015,Southampton,Stoke,0,1,A,1.65,3.6,5.1,2015-11-21,2015/2016,14,E0,0-1,-1,-3.4499999999999997,2015-11-21SouthamptonStoke
21/11/2015,Swansea,Bournemouth,2,2,D,1.9,3.45,3.8,2015-11-21,2015/2016,14,E0,2-2,0,-1.9,2015-11-21SwanseaBournemouth
21/11/2015,Watford,Man United,1,2,A,3.8,3.45,1.9,2015-11-21,2015/2016,15,E0,1-2,-1,1.9,2015-11-21WatfordMan United
21/11/2015,West Brom,Arsenal,2,1,H,5.6,3.9,1.55,2015-11-21,2015/2016,15,E0,2-1,1,4.05,2015-11-21West BromArsenal
22/11/2015,Tottenham,West Ham,4,1,H,1.6,3.7,5.4,2015-11-22,2015/2016,15,E0,4-1,3,-3.8000000000000003,2015-11-22TottenhamWest Ham
23/11/2015,Crystal Palace,Sunderland,0,1,A,1.65,3.6,5.1,2015-11-23,2015/2016,15,E0,0-1,-1,-3.4499999999999997,2015-11-23Crystal PalaceSunderland
28/11/2015,Aston Villa,Watford,2,3,A,2.5,3.3,2.65,2015-11-28,2015/2016,15,E0,2-3,-1,-0.1499999999999999,2015-11-28Aston VillaWatford
28/11/2015,Bournemouth,Everton,3,3,D,2.75,3.3,2.4,2015-11-28,2015/2016,15,E0,3-3,0,0.3500000000000001,2015-11-28BournemouthEverton
28/11/2015,Crystal Palace,Newcastle,5,1,H,1.75,3.5,4.5,2015-11-28,2015/2016,15,E0,5-1,4,-2.75,2015-11-28Crystal PalaceNewcastle
28/11/2015,Leicester,Man United,1,1,D,2.9,3.3,2.3,2015-11-28,2015/2016,15,E0,1-1,0,0.6000000000000001,2015-11-28LeicesterMan United
28/11/2015,Man City,Southampton,3,1,H,1.5,4.0,6.1,2015-11-28,2015/2016,15,E0,3-1,2,-4.6,2015-11-28Man CitySouthampton
28/11/2015,Sunderland,Stoke,2,0,H,2.75,3.3,2.4,2015-11-28,2015/2016,16,E0,2-0,2,0.3500000000000001,2015-11-28SunderlandStoke
29/11/2015,Liverpool,Swansea,1,0,H,1.5,4.0,6.1,2015-11-29,2015/2016,16,E0,1-0,1,-4.6,2015-11-29LiverpoolSwansea
29/11/2015,Norwich,Arsenal,1,1,D,6.1,4.0,1.5,2015-11-29,2015/2016,16,E0,1-1,0,4.6,2015-11-29NorwichArsenal
29/11/2015,Tottenham,Chelsea,0,0,D,2.6,3.2,2.6,2015-11-29,2015/2016,16,E0,0-0,0,0.0,2015-11-29TottenhamChelsea
29/11/2015,West Ham,West Brom,1,1,D,2.0,3.3,3.6,2015-11-29,2015/2016,16,E0,1-1,0,-1.6,2015-11-29West HamWest Brom
05/12/2015,Arsenal,Sunderland,3,1,H,1.22,5.5,12.0,2015-12-05,2015/2016,16,E0,3-1,2,-10.78,2015-12-05ArsenalSunderland
05/12/2015,Chelsea,Bournemouth,0,1,A,1.35,4.8,7.6,2015-12-05,2015/2016,16,E0,0-1,-1,-6.25,2015-12-05ChelseaBournemouth
05/12/2015,Man United,West Ham,0,0,D,1.4,4.4,7.3,2015-12-05,2015/2016,16,E0,0-0,0,-5.9,2015-12-05Man UnitedWest Ham
05/12/2015,Southampton,Aston Villa,1,1,D,1.45,4.0,7.0,2015-12-05,2015/2016,16,E0,1-1,0,-5.55,2015-12-05SouthamptonAston Villa
05/12/2015,Stoke,Man City,2,0,H,4.7,3.6,1.7,2015-12-05,2015/2016,17,E0,2-0,2,3.0,2015-12-05StokeMan City
05/12/2015,Swansea,Leicester,0,3,A,2.65,3.3,2.5,2015-12-05,2015/2016,17,E0,0-3,-3,0.1499999999999999,2015-12-05SwanseaLeicester
05/12/2015,Watford,Norwich,2,0,H,2.0,3.3,3.6,2015-12-05,2015/2016,17,E0,2-0,2,-1.6,2015-12-05WatfordNorwich
05/12/2015,West Brom,Tottenham,1,1,D,3.8,3.45,1.9,2015-12-05,2015/2016,17,E0,1-1,0,1.9,2015-12-05West BromTottenham
06/12/2015,Newcastle,Liverpool,2,0,H,5.4,3.7,1.6,2015-12-06,2015/2016,17,E0,2-0,2,3.8000000000000003,2015-12-06NewcastleLiverpool
07/12/2015,Everton,Crystal Palace,1,1,D,2.0,3.3,3.6,2015-12-07,2015/2016,17,E0,1-1,0,-1.6,2015-12-07EvertonCrystal Palace
12/12/2015,Bournemouth,Man United,2,1,H,3.0,3.2,2.3,2015-12-12,2015/2016,17,E0,2-1,1,0.7000000000000002,2015-12-12BournemouthMan United
12/12/2015,Crystal Palace,Southampton,1,0,H,2.5,3.2,2.75,2015-12-12,2015/2016,17,E0,1-0,1,-0.25,2015-12-12Crystal PalaceSouthampton
12/12/2015,Man City,Swansea,2,1,H,1.3,5.0,9.0,2015-12-12,2015/2016,17,E0,2-1,1,-7.7,2015-12-12Man CitySwansea
12/12/2015,Norwich,Everton,1,1,D,2.65,3.3,2.5,2015-12-12,2015/2016,18,E0,1-1,0,0.1499999999999999,2015-12-12NorwichEverton
12/12/2015,Sunderland,Watford,0,1,A,2.6,3.2,2.6,2015-12-12,2015/2016,18,E0,0-1,-1,0.0,2015-12-12SunderlandWatford
12/12/2015,West Ham,Stoke,0,0,D,2.5,3.3,2.65,2015-12-12,2015/2016,18,E0,0-0,0,-0.1499999999999999,2015-12-12West HamStoke
13/12/2015,Aston Villa,Arsenal,0,2,A,5.5,4.0,1.55,2015-12-13,2015/2016,18,E0,0-2,-2,3.95,2015-12-13Aston VillaArsenal
13/12/2015,Liverpool,West Brom,2,2,D,1.4,4.4,7.3,2015-12-13,2015/2016,18,E0,2-2,0,-5.9,2015-12-13LiverpoolWest Brom
13/12/2015,Tottenham,Newcastle,1,2,A,1.4,4.4,7.3,2015-12-13,2015/2016,18,E0,1-2,-1,-5.9,2015-12-13TottenhamNewcastle
14/12/2015,Leicester,Chelsea,2,1,H,3.0,3.2,2.3,2015-12-14,2015/2016,18,E0,2-1,1,0.7000000000000002,2015-12-14LeicesterChelsea
19/12/2015,Chelsea,Sunderland,3,1,H,1.33,4.8,8.3,2015-12-19,2015/2016,18,E0,3-1,2,-6.970000000000001,2015-12-19ChelseaSunderland
19/12/2015,Everton,Leicester,2,3,A,2.1,3.3,3.3,2015-12-19,2015/2016,18,E0,2-3,-1,-1.1999999999999997,2015-12-19EvertonLeicester
19/12/2015,Man United,Norwich,1,2,A,1.5,4.0,6.1,2015-12-19,2015/2016,19,E0,1-2,-1,-4.6,2015-12-19Man UnitedNorwich
19/12/2015,Newcastle,Aston Villa,1,1,D,2.0,3.3,3.6,2015-12-19,2015/2016,19,E0,1-1,0,-1.6,2015-12-19NewcastleAston Villa
19/12/2015,Southampton,Tottenham,0,2,A,2.6,3.2,2.6,2015-12-19,2015/2016,19,E0,0-2,-2,0.0,2015-12-19SouthamptonTottenham
19/12/2015,Stoke,Crystal Palace,1,2,A,2.4,3.2,2.85,2015-12-19,2015/2016,19,E0,1-2,-1,-0.4500000000000002,2015-12-19StokeCrystal Palace
19/12/2015,West Brom,Bournemouth,1,2,A,2.5,3.2,2.75,2015-12-19,2015/2016,19,E0,1-2,-1,-0.25,2015-12-19West BromBournemouth
20/12/2015,Swansea,West Ham,0,0,D,2.1,3.3,3.3,2015-12-20,2015/2016,19,E0,0-0,0,-1.1999999999999997,2015-12-20SwanseaWest Ham
20/12/2015,Watford,Liverpool,3,0,H,3.6,3.3,2.0,2015-12-20,2015/2016,19,E0,3-0,3,1.6,2015-12-20WatfordLiverpool
21/12/2015,Arsenal,Man City,2,1,H,2.5,3.3,2.65,2015-12-21,2015/2016,19,E0,2-1,1,-0.1499999999999999,2015-12-21ArsenalMan City
26/12/2015,Aston Villa,West Ham,1,1,D,2.65,3.3,2.5,2015-12-26,2015/2016,19,E0,1-1,0,0.1499999999999999,2015-12-26Aston VillaWest Ham
26/12/2015,Bournemouth,Crystal Palace,0,0,D,2.4,3.3,2.75,2015-12-26,2015/2016,20,E0,0-0,0,-0.3500000000000001,2015-12-26BournemouthCrystal Palace
26/12/2015,Chelsea,Watford,2,2,D,1.4,4.4,7.3,2015-12-26,2015/2016,20,E0,2-2,0,-5.9,2015-12-26ChelseaWatford
26/12/2015,Liverpool,Leicester,1,0,H,1.9,3.45,3.8,2015-12-26,2015/2016,20,E0,1-0,1,-1.9,2015-12-26LiverpoolLeicester
26/12/2015,Man City,Sunderland,4,1,H,1.2,5.8,13.0,2015-12-26,2015/2016,20,E0,4-1,3,-11.8,2015-12-26Man CitySunderland
26/12/2015,Newcastle,Everton,0,1,A,2.9,3.3,2.3,2015-12-26,2015/2016,20,E0,0-1,-1,0.6000000000000001,2015-12-26NewcastleEverton
26/12/2015,Southampton,Arsenal,4,0,H,3.3,3.3,2.1,2015-12-26,2015/2016,20,E0,4-0,4,1.1999999999999997,2015-12-26SouthamptonArsenal
26/12/2015,Stoke,Man United,2,0,H,2.75,3.3,2.4,2015-12-26,2015/2016,20,E0,2-0,2,0.3500000000000001,2015-12-26StokeMan United
26/12/2015,Swansea,West Brom,1,0,H,2.0,3.3,3.6,2015-12-26,2015/2016,20,E0,1-0,1,-1.6,2015-12-26SwanseaWest Brom
26/12/2015,Tottenham,Norwich,3,0,H,1.45,4.0,7.0,2015-12-26,2015/2016,20,E0,3-0,3,-5.55,2015-12-26TottenhamNorwich
28/12/2015,Arsenal,Bournemouth,2,0,H,1.42,4.3,7.0,2015-12-28,2015/2016,21,E0,2-0,2,-5.58,2015-12-28ArsenalBournemouth
28/12/2015,Crystal Palace,Swansea,0,0,D,2.0,3.3,3.6,2015-12-28,2015/2016,21,E0,0-0,0,-1.6,2015-12-28Crystal PalaceSwansea
28/12/2015,Everton,Stoke,3,4,A,1.9,3.45,3.8,2015-12-28,2015/2016,21,E0,3-4,-1,-1.9,2015-12-28EvertonStoke
28/12/2015,Man United,Chelsea,0,0,D,2.6,3.2,2.6,2015-12-28,2015/2016,21,E0,0-0,0,0.0,2015-12-28Man UnitedChelsea
28/12/2015,Norwich,Aston Villa,2,0,H,2.0,3.3,3.6,2015-12-28,2015/2016,21,E0,2-0,2,-1.6,2015-12-28NorwichAston Villa
28/12/2015,Watford,Tottenham,1,2,A,3.3,3.3,2.1,2015-12-28,2015/2016,21,E0,1-2,-1,1.1999999999999997,2015-12-28WatfordTottenham
28/12/2015,West Brom,Newcastle,1,0,H,2.1,3.3,3.3,2015-12-28,2015/2016,21,E0,1-0,1,-1.1999999999999997,2015-12-28West BromNewcastle
28/12/2015,West Ham,Southampton,2,1,H,2.9,3.3,2.3,2015-12-28,2015/2016,21,E0,2-1,1,0.6000000000000001,2015-12-28West HamSouthampton
29/12/2015,Leicester,Man City,0,0,D,3.8,3.45,1.9,2015-12-29,2015/2016,21,E0,0-0,0,1.9,2015-12-29LeicesterMan City
30/12/2015,Sunderland,Liverpool,0,1,A,4.5,3.5,1.75,2015-12-30,2015/2016,22,E0,0-1,-1,2.75,2015-12-30SunderlandLiverpool
02/01/2016,Arsenal,Newcastle,1,0,H,1.3,5.0,9.0,2016-01-02,2015/2016,22,E0,1-0,1,-7.7,2016-01-02ArsenalNewcastle
02/01/2016,Leicester,Bournemouth,0,0,D,1.9,3.45,3.8,2016-01-02,2015/2016,22,E0,0-0,0,-1.9,2016-01-02LeicesterBournemouth
02/01/2016,Man United,Swansea,2,1,H,1.5,4.0,6.1,2016-01-02,2015/2016,22,E0,2-1,1,-4.6,2016-01-02Man UnitedSwansea
02/01/2016,Norwich,Southampton,1,0,H,2.9,3.3,2.3,2016-01-02,2015/2016,22,E0,1-0,1,0.6000000000000001,2016-01-02NorwichSouthampton
02/01/2016,Sunderland,Aston Villa,3,1,H,2.3,3.3,2.9,2016-01-02,2015/2016,22,E0,3-1,2,-0.6000000000000001,2016-01-02SunderlandAston Villa
02/01/2016,Watford,Man City,1,2,A,4.7,3.6,1.7,2016-01-02,2015/2016,22,E0,1-2,-1,3.0,2016-01-02WatfordMan City
02/01/2016,West Brom,Stoke,2,1,H,2.55,3.1,2.75,2016-01-02,2015/2016,22,E0,2-1,1,-0.20000000000000018,2016-01-02West BromStoke
02/01/2016,West Ham,Liverpool,2,0,H,3.3,3.3,2.1,2016-01-02,2015/2016,22,E0,2-0,2,1.1999999999999997,2016-01-02West HamLiverpool
03/01/2016,Crystal Palace,Chelsea,0,3,A,3.1,3.3,2.2,2016-01-03,2015/2016,23,E0,0-3,-3,0.8999999999999999,2016-01-03Crystal PalaceChelsea
03/01/2016,Everton,Tottenham,1,1,D,2.6,3.2,2.6,2016-01-03,2015/2016,23,E0,1-1,0,0.0,2016-01-03EvertonTottenham
12/01/2016,Aston Villa,Crystal Palace,1,0,H,2.6,3.2,2.6,2016-01-12,2015/2016,23,E0,1-0,1,0.0,2016-01-12Aston VillaCrystal Palace
12/01/2016,Bournemouth,West Ham,1,3,A,2.1,3.3,3.3,2016-01-12,2015/2016,23,E0,1-3,-2,-1.1999999999999997,2016-01-12BournemouthWest Ham
12/01/2016,Newcastle,Man United,3,3,D,4.2,3.5,1.8,2016-01-12,2015/2016,23,E0,3-3,0,2.4000000000000004,2016-01-12NewcastleMan United
13/01/2016,Chelsea,West Brom,2,2,D,1.4,4.4,7.3,2016-01-13,2015/2016,23,E0,2-2,0,-5.9,2016-01-13ChelseaWest Brom
13/01/2016,Liverpool,Arsenal,3,3,D,2.75,3.3,2.4,2016-01-13,2015/2016,23,E0,3-3,0,0.3500000000000001,2016-01-13LiverpoolArsenal
13/01/2016,Man City,Everton,0,0,D,1.45,4.0,7.0,2016-01-13,2015/2016,23,E0,0-0,0,-5.55,2016-01-13Man CityEverton
13/01/2016,Southampton,Watford,2,0,H,2.0,3.3,3.6,2016-01-13,2015/2016,23,E0,2-0,2,-1.6,2016-01-13SouthamptonWatford
13/01/2016,Stoke,Norwich,3,1,H,2.0,3.3,3.6,2016-01-13,2015/2016,24,E0,3-1,2,-1.6,2016-01-13StokeNorwich
13/01/2016,Swansea,Sunderland,2,4,A,1.75,3.5,4.5,2016-01-13,2015/2016,24,E0,2-4,-2,-2.75,2016-01-13SwanseaSunderland
13/01/2016,Tottenham,Leicester,0,1,A,1.75,3.5,4.5,2016-01-13,2015/2016,24,E0,0-1,-1,-2.75,2016-01-13TottenhamLeicester
16/01/2016,Aston Villa,Leicester,1,1,D,2.9,3.3,2.3,2016-01-16,2015/2016,24,E0,1-1,0,0.6000000000000001,2016-01-16Aston VillaLeicester
16/01/2016,Bournemouth,Norwich,3,0,H,1.9,3.45,3.8,2016-01-16,2015/2016,24,E0,3-0,3,-1.9,2016-01-16BournemouthNorwich
16/01/2016,Chelsea,Everton,3,3,D,1.75,3.5,4.5,2016-01-16,2015/2016,24,E0,3-3,0,-2.75,2016-01-16ChelseaEverton
16/01/2016,Man City,Crystal Palace,4,0,H,1.4,4.4,7.3,2016-01-16,2015/2016,24,E0,4-0,4,-5.9,2016-01-16Man CityCrystal Palace
16/01/2016,Newcastle,West Ham,2,1,H,2.6,3.2,2.6,2016-01-16,2015/2016,24,E0,2-1,1,0.0,2016-01-16NewcastleWest Ham
16/01/2016,Southampton,West Brom,3,0,H,1.8,3.5,4.2,2016-01-16,2015/2016,24,E0,3-0,3,-2.4000000000000004,2016-01-16SouthamptonWest Brom
16/01/2016,Tottenham,Sunderland,4,1,H,1.37,4.6,7.5,2016-01-16,2015/2016,25,E0,4-1,3,-6.13,2016-01-16TottenhamSunderland
17/01/2016,Liverpool,Man United,0,1,A,2.5,3.2,2.75,2016-01-17,2015/2016,25,E0,0-1,-1,-0.25,2016-01-17LiverpoolMan United
17/01/2016,Stoke,Arsenal,0,0,D,3.8,3.45,1.9,2016-01-17,2015/2016,25,E0,0-0,0,1.9,2016-01-17StokeArsenal
18/01/2016,Swansea,Watford,1,0,H,2.3,3.3,2.9,2016-01-18,2015/2016,25,E0,1-0,1,-0.6000000000000001,2016-01-18SwanseaWatford
23/01/2016,Crystal Palace,Tottenham,1,3,A,3.2,3.2,2.2,2016-01-23,2015/2016,25,E0,1-3,-2,1.0,2016-01-23Crystal PalaceTottenham
23/01/2016,Leicester,Stoke,3,0,H,2.0,3.3,3.6,2016-01-23,2015/2016,25,E0,3-0,3,-1.6,2016-01-23LeicesterStoke
23/01/2016,Man United,Southampton,0,1,A,1.8,3.5,4.2,2016-01-23,2015/2016,25,E0,0-1,-1,-2.4000000000000004,2016-01-23Man UnitedSouthampton
23/01/2016,Norwich,Liverpool,4,5,A,3.6,3.3,2.0,2016-01-23,2015/2016,25,E0,4-5,-1,1.6,2016-01-23NorwichLiverpool
23/01/2016,Sunderland,Bournemouth,1,1,D,2.65,3.3,2.5,2016-01-23,2015/2016,25,E0,1-1,0,0.1499999999999999,2016-01-23SunderlandBournemouth
23/01/2016,Watford,Newcastle,2,1,H,2.0,3.3,3.6,2016-01-23,2015/2016,26,E0,2-1,1,-1.6,2016-01-23WatfordNewcastle
23/01/2016,West Brom,Aston Villa,0,0,D,2.15,3.25,3.25,2016-01-23,2015/2016,26,E0,0-0,0,-1.1,2016-01-23West BromAston Villa
23/01/2016,West Ham,Man City,2,2,D,4.7,3.6,1.7,2016-01-23,2015/2016,26,E0,2-2,0,3.0,2016-01-23West HamMan City
24/01/2016,Arsenal,Chelsea,0,1,A,2.2,3.25,3.3,2016-01-24,2015/2016,26,E0,0-1,-1,-1.0999999999999996,2016-01-24ArsenalChelsea
24/01/2016,Everton,Swansea,1,2,A,1.7,3.6,4.7,2016-01-24,2015/2016,26,E0,1-2,-1,-3.0,2016-01-24EvertonSwansea
02/02/2016,Arsenal,Southampton,0,0,D,1.75,3.5,4.5,2016-02-02,2015/2016,26,E0,0-0,0,-2.75,2016-02-02ArsenalSouthampton
02/02/2016,Crystal Palace,Bournemouth,1,2,A,2.3,3.2,3.0,2016-02-02,2015/2016,26,E0,1-2,-1,-0.7000000000000002,2016-02-02Crystal PalaceBournemouth
02/02/2016,Leicester,Liverpool,2,0,H,2.6,3.2,2.6,2016-02-02,2015/2016,26,E0,2-0,2,0.0,2016-02-02LeicesterLiverpool
02/02/2016,Man United,Stoke,3,0,H,1.75,3.5,4.5,2016-02-02,2015/2016,26,E0,3-0,3,-2.75,2016-02-02Man UnitedStoke
02/02/2016,Norwich,Tottenham,0,3,A,3.8,3.45,1.9,2016-02-02,2015/2016,27,E0,0-3,-3,1.9,2016-02-02NorwichTottenham
02/02/2016,Sunderland,Man City,0,1,A,6.1,4.0,1.5,2016-02-02,2015/2016,27,E0,0-1,-1,4.6,2016-02-02SunderlandMan City
02/02/2016,West Brom,Swansea,1,1,D,2.5,3.05,2.85,2016-02-02,2015/2016,27,E0,1-1,0,-0.3500000000000001,2016-02-02West BromSwansea
02/02/2016,West Ham,Aston Villa,2,0,H,1.9,3.45,3.8,2016-02-02,2015/2016,27,E0,2-0,2,-1.9,2016-02-02West HamAston Villa
03/02/2016,Everton,Newcastle,3,0,H,1.65,3.7,4.9,2016-02-03,2015/2016,27,E0,3-0,3,-3.2500000000000004,2016-02-03EvertonNewcastle
03/02/2016,Watford,Chelsea,0,0,D,3.6,3.3,2.0,2016-02-03,2015/2016,27,E0,0-0,0,1.6,2016-02-03WatfordChelsea
06/02/2016,Aston Villa,Norwich,2,0,H,2.4,3.2,2.85,2016-02-06,2015/2016,27,E0,2-0,2,-0.4500000000000002,2016-02-06Aston VillaNorwich
06/02/2016,Liverpool,Sunderland,2,2,D,1.4,4.4,7.3,2016-02-06,2015/2016,27,E0,2-2,0,-5.9,2016-02-06LiverpoolSunderland
06/02/2016,Man City,Leicester,1,3,A,1.6,4.0,5.0,2016-02-06,2015/2016,27,E0,1-3,-2,-3.4,2016-02-06Man CityLeicester
06/02/2016,Newcastle,West Brom,1,0,H,2.1,3.3,3.3,2016-02-06,2015/2016,28,E0,1-0,1,-1.1999999999999997,2016-02-06NewcastleWest Brom
06/02/2016,Southampton,West Ham,1,0,H,1.7,3.6,4.7,2016-02-06,2015/2016,28,E0,1-0,1,-3.0,2016-02-06SouthamptonWest Ham
06/02/2016,Stoke,Everton,0,3,A,2.55,3.3,2.6,2016-02-06,2015/2016,28,E0,0-3,-3,-0.050000000000000266,2016-02-06StokeEverton
06/02/2016,Swansea,Crystal Palace,1,1,D,2.1,3.3,3.3,2016-02-06,2015/2016,28,E0,1-1,0,-1.1999999999999997,2016-02-06SwanseaCrystal Palace
06/02/2016,Tottenham,Watford,1,0,H,1.5,4.0,6.1,2016-02-06,2015/2016,28,E0,1-0,1,-4.6,2016-02-06TottenhamWatford
07/02/2016,Bournemouth,Arsenal,0,2,A,3.6,3.3,2.0,2016-02-07,2015/2016,28,E0,0-2,-2,1.6,2016-02-07BournemouthArsenal
07/02/2016,Chelsea,Man United,1,1,D,2.2,3.3,3.1,2016-02-07,2015/2016,28,E0,1-1,0,-0.8999999999999999,2016-02-07ChelseaMan United
13/02/2016,Bournemouth,Stoke,1,3,A,2.1,3.3,3.3,2016-02-13,2015/2016,28,E0,1-3,-2,-1.1999999999999997,2016-02-13BournemouthStoke
13/02/2016,Chelsea,Newcastle,5,1,H,1.5,4.0,6.1,2016-02-13,2015/2016,28,E0,5-1,4,-4.6,2016-02-13ChelseaNewcastle
13/02/2016,Crystal Palace,Watford,1,2,A,2.2,3.3,3.1,2016-02-13,2015/2016,29,E0,1-2,-1,-0.8999999999999999,2016-02-13Crystal PalaceWatford
13/02/2016,Everton,West Brom,0,1,A,1.6,3.7,5.4,2016-02-13,2015/2016,29,E0,0-1,-1,-3.8000000000000003,2016-02-13EvertonWest Brom
13/02/2016,Norwich,West Ham,2,2,D,2.6,3.2,2.6,2016-02-13,2015/2016,29,E0,2-2,0,0.0,2016-02-13NorwichWest Ham
13/02/2016,Sunderland,Man United,2,1,H,4.5,3.5,1.75,2016-02-13,2015/2016,29,E0,2-1,1,2.75,2016-02-13SunderlandMan United
13/02/2016,Swansea,Southampton,0,1,A,2.6,3.2,2.6,2016-02-13,2015/2016,29,E0,0-1,-1,0.0,2016-02-13SwanseaSouthampton
14/02/2016,Arsenal,Leicester,2,1,H,1.8,3.5,4.2,2016-02-14,2015/2016,29,E0,2-1,1,-2.4000000000000004,2016-02-14ArsenalLeicester
14/02/2016,Aston Villa,Liverpool,0,6,A,3.6,3.3,2.0,2016-02-14,2015/2016,29,E0,0-6,-6,1.6,2016-02-14Aston VillaLiverpool
14/02/2016,Man City,Tottenham,1,2,A,1.9,3.45,3.8,2016-02-14,2015/2016,29,E0,1-2,-1,-1.9,2016-02-14Man CityTottenham
27/02/2016,Leicester,Norwich,1,0,H,1.5,4.0,6.1,2016-02-27,2015/2016,29,E0,1-0,1,-4.6,2016-02-27LeicesterNorwich
27/02/2016,Southampton,Chelsea,1,2,A,2.85,3.2,2.5,2016-02-27,2015/2016,30,E0,1-2,-1,0.3500000000000001,2016-02-27SouthamptonChelsea
27/02/2016,Stoke,Aston Villa,2,1,H,1.65,3.6,5.1,2016-02-27,2015/2016,30,E0,2-1,1,-3.4499999999999997,2016-02-27StokeAston Villa
27/02/2016,Watford,Bournemouth,0,0,D,2.2,3.2,3.2,2016-02-27,2015/2016,30,E0,0-0,0,-1.0,2016-02-27WatfordBournemouth
27/02/2016,West Brom,Crystal Palace,3,2,H,2.5,3.2,2.75,2016-02-27,2015/2016,30,E0,3-2,1,-0.25,2016-02-27West BromCrystal Palace
27/02/2016,West Ham,Sunderland,1,0,H,1.85,3.45,4.0,2016-02-27,2015/2016,30,E0,1-0,1,-2.15,2016-02-27West HamSunderland
28/02/2016,Tottenham,Swansea,2,1,H,1.45,4.0,7.0,2016-02-28,2015/2016,30,E0,2-1,1,-5.55,2016-02-28TottenhamSwansea
28/02/2016,Man United,Arsenal,3,2,H,2.7,3.1,2.6,2016-02-28,2015/2016,30,E0,3-2,1,0.10000000000000009,2016-02-28Man UnitedArsenal
01/03/2016,Aston Villa,Everton,1,3,A,3.8,3.45,1.9,2016-03-01,2015/2016,30,E0,1-3,-2,1.9,2016-03-01Aston VillaEverton
01/03/2016,Bournemouth,Southampton,2,0,H,2.75,3.2,2.5,2016-03-01,2015/2016,30,E0,2-0,2,0.25,2016-03-01BournemouthSouthampton
01/03/2016,Leicester,West Brom,2,2,D,1.7,3.6,4.7,2016-03-01,2015/2016,31,E0,2-2,0,-3.0,2016-03-01LeicesterWest Brom
01/03/2016,Norwich,Chelsea,1,2,A,5.1,3.6,1.65,2016-03-01,2015/2016,31,E0,1-2,-1,3.4499999999999997,2016-03-01NorwichChelsea
01/03/2016,Sunderland,Crystal Palace,2,2,D,2.5,3.3,2.65,2016-03-01,2015/2016,31,E0,2-2,0,-0.1499999999999999,2016-03-01SunderlandCrystal Palace
02/03/2016,Arsenal,Swansea,1,2,A,1.35,4.8,7.6,2016-03-02,2015/2016,31,E0,1-2,-1,-6.25,2016-03-02ArsenalSwansea
02/03/2016,Liverpool,Man City,3,0,H,2.6,3.2,2.6,2016-03-02,2015/2016,31,E0,3-0,3,0.0,2016-03-02LiverpoolMan City
02/03/2016,Man United,Watford,1,0,H,1.65,3.6,5.1,2016-03-02,2015/2016,31,E0,1-0,1,-3.4499999999999997,2016-03-02Man UnitedWatford
02/03/2016,Stoke,Newcastle,1,0,H,1.9,3.45,3.8,2016-03-02,2015/2016,31,E0,1-0,1,-1.9,2016-03-02StokeNewcastle
02/03/2016,West Ham,Tottenham,1,0,H,3.6,3.3,2.0,2016-03-02,2015/2016,31,E0,1-0,1,1.6,2016-03-02West HamTottenham
05/03/2016,Chelsea,Stoke,1,1,D,1.5,4.0,6.1,2016-03-05,2015/2016,31,E0,1-1,0,-4.6,2016-03-05ChelseaStoke
05/03/2016,Everton,West Ham,2,3,A,1.8,3.5,4.2,2016-03-05,2015/2016,32,E0,2-3,-1,-2.4000000000000004,2016-03-05EvertonWest Ham
05/03/2016,Man City,Aston Villa,4,0,H,1.2,5.8,13.0,2016-03-05,2015/2016,32,E0,4-0,4,-11.8,2016-03-05Man CityAston Villa
05/03/2016,Newcastle,Bournemouth,1,3,A,2.6,3.1,2.7,2016-03-05,2015/2016,32,E0,1-3,-2,-0.10000000000000009,2016-03-05NewcastleBournemouth
05/03/2016,Southampton,Sunderland,1,1,D,1.6,3.7,5.4,2016-03-05,2015/2016,32,E0,1-1,0,-3.8000000000000003,2016-03-05SouthamptonSunderland
05/03/2016,Swansea,Norwich,1,0,H,1.9,3.45,3.8,2016-03-05,2015/2016,32,E0,1-0,1,-1.9,2016-03-05SwanseaNorwich
05/03/2016,Tottenham,Arsenal,2,2,D,2.5,3.2,2.75,2016-03-05,2015/2016,32,E0,2-2,0,-0.25,2016-03-05TottenhamArsenal
05/03/2016,Watford,Leicester,0,1,A,3.0,3.2,2.3,2016-03-05,2015/2016,32,E0,0-1,-1,0.7000000000000002,2016-03-05WatfordLeicester
06/03/2016,Crystal Palace,Liverpool,1,2,A,3.3,3.3,2.1,2016-03-06,2015/2016,32,E0,1-2,-1,1.1999999999999997,2016-03-06Crystal PalaceLiverpool
06/03/2016,West Brom,Man United,1,0,H,3.8,3.45,1.9,2016-03-06,2015/2016,32,E0,1-0,1,1.9,2016-03-06West BromMan United
12/03/2016,Bournemouth,Swansea,3,2,H,2.0,3.3,3.6,2016-03-12,2015/2016,33,E0,3-2,1,-1.6,2016-03-12BournemouthSwansea
12/03/2016,Norwich,Man City,0,0,D,5.4,3.7,1.6,2016-03-12,2015/2016,33,E0,0-0,0,3.8000000000000003,2016-03-12NorwichMan City
12/03/2016,Stoke,Southampton,1,2,A,2.65,3.1,2.65,2016-03-12,2015/2016,33,E0,1-2,-1,0.0,2016-03-12StokeSouthampton
13/03/2016,Aston Villa,Tottenham,0,2,A,6.1,4.0,1.5,2016-03-13,2015/2016,33,E0,0-2,-2,4.6,2016-03-13Aston VillaTottenham
14/03/2016,Leicester,Newcastle,1,0,H,1.65,3.6,5.1,2016-03-14,2015/2016,33,E0,1-0,1,-3.4499999999999997,2016-03-14LeicesterNewcastle
19/03/2016,Chelsea,West Ham,2,2,D,1.7,3.7,4.5,2016-03-19,2015/2016,33,E0,2-2,0,-2.8,2016-03-19ChelseaWest Ham
19/03/2016,Crystal Palace,Leicester,0,1,A,3.0,3.2,2.3,2016-03-19,2015/2016,33,E0,0-1,-1,0.7000000000000002,2016-03-19Crystal PalaceLeicester
19/03/2016,Everton,Arsenal,0,2,A,2.6,3.2,2.6,2016-03-19,2015/2016,33,E0,0-2,-2,0.0,2016-03-19EvertonArsenal
19/03/2016,Swansea,Aston Villa,1,0,H,1.55,4.0,5.5,2016-03-19,2015/2016,33,E0,1-0,1,-3.95,2016-03-19SwanseaAston Villa
19/03/2016,Watford,Stoke,1,2,A,2.4,3.2,2.85,2016-03-19,2015/2016,34,E0,1-2,-1,-0.4500000000000002,2016-03-19WatfordStoke
19/03/2016,West Brom,Norwich,0,1,A,2.1,3.3,3.3,2016-03-19,2015/2016,34,E0,0-1,-1,-1.1999999999999997,2016-03-19West BromNorwich
20/03/2016,Man City,Man United,0,1,A,1.8,3.5,4.2,2016-03-20,2015/2016,34,E0,0-1,-1,-2.4000000000000004,2016-03-20Man CityMan United
20/03/2016,Newcastle,Sunderland,1,1,D,2.1,3.3,3.3,2016-03-20,2015/2016,34,E0,1-1,0,-1.1999999999999997,2016-03-20NewcastleSunderland
20/03/2016,Southampton,Liverpool,3,2,H,2.6,3.2,2.6,2016-03-20,2015/2016,34,E0,3-2,1,0.0,2016-03-20SouthamptonLiverpool
20/03/2016,Tottenham,Bournemouth,3,0,H,1.5,4.0,6.1,2016-03-20,2015/2016,34,E0,3-0,3,-4.6,2016-03-20TottenhamBournemouth
02/04/2016,Arsenal,Watford,4,0,H,1.33,4.8,8.3,2016-04-02,2015/2016,34,E0,4-0,4,-6.970000000000001,2016-04-02ArsenalWatford
02/04/2016,Aston Villa,Chelsea,0,4,A,6.1,4.0,1.5,2016-04-02,2015/2016,34,E0,0-4,-4,4.6,2016-04-02Aston VillaChelsea
02/04/2016,Bournemouth,Man City,0,4,A,3.6,3.3,2.0,2016-04-02,2015/2016,34,E0,0-4,-4,1.6,2016-04-02BournemouthMan City
02/04/2016,Liverpool,Tottenham,1,1,D,2.4,3.3,2.75,2016-04-02,2015/2016,35,E0,1-1,0,-0.3500000000000001,2016-04-02LiverpoolTottenham
02/04/2016,Norwich,Newcastle,3,2,H,2.2,3.2,3.2,2016-04-02,2015/2016,35,E0,3-2,1,-1.0,2016-04-02NorwichNewcastle
02/04/2016,Stoke,Swansea,2,2,D,2.2,3.2,3.2,2016-04-02,2015/2016,35,E0,2-2,0,-1.0,2016-04-02StokeSwansea
02/04/2016,Sunderland,West Brom,0,0,D,2.1,3.3,3.3,2016-04-02,2015/2016,35,E0,0-0,0,-1.1999999999999997,2016-04-02SunderlandWest Brom
02/04/2016,West Ham,Crystal Palace,2,2,D,2.0,3.3,3.6,2016-04-02,2015/2016,35,E0,2-2,0,-1.6,2016-04-02West HamCrystal Palace
03/04/2016,Leicester,Southampton,1,0,H,2.2,3.3,3.1,2016-04-03,2015/2016,35,E0,1-0,1,-0.8999999999999999,2016-04-03LeicesterSouthampton
03/04/2016,Man United,Everton,1,0,H,1.9,3.45,3.8,2016-04-03,2015/2016,35,E0,1-0,1,-1.9,2016-04-03Man UnitedEverton
09/04/2016,Aston Villa,Bournemouth,1,2,A,3.3,3.3,2.1,2016-04-09,2015/2016,35,E0,1-2,-1,1.1999999999999997,2016-04-09Aston VillaBournemouth
09/04/2016,Crystal Palace,Norwich,1,0,H,2.05,3.3,3.5,2016-04-09,2015/2016,35,E0,1-0,1,-1.4500000000000002,2016-04-09Crystal PalaceNorwich
09/04/2016,Man City,West Brom,2,1,H,1.37,4.6,7.5,2016-04-09,2015/2016,36,E0,2-1,1,-6.13,2016-04-09Man CityWest Brom
09/04/2016,Southampton,Newcastle,3,1,H,1.6,3.9,5.0,2016-04-09,2015/2016,36,E0,3-1,2,-3.4,2016-04-09SouthamptonNewcastle
09/04/2016,Swansea,Chelsea,1,0,H,3.5,3.3,2.05,2016-04-09,2015/2016,36,E0,1-0,1,1.4500000000000002,2016-04-09SwanseaChelsea
09/04/2016,Watford,Everton,1,1,D,2.95,3.1,2.4,2016-04-09,2015/2016,36,E0,1-1,0,0.5500000000000003,2016-04-09WatfordEverton
09/04/2016,West Ham,Arsenal,3,3,D,3.6,3.3,2.0,2016-04-09,2015/2016,36,E0,3-3,0,1.6,2016-04-09West HamArsenal
10/04/2016,Liverpool,Stoke,4,1,H,1.65,3.6,5.1,2016-04-10,2015/2016,36,E0,4-1,3,-3.4499999999999997,2016-04-10LiverpoolStoke
10/04/2016,Sunderland,Leicester,0,2,A,3.3,3.3,2.1,2016-04-10,2015/2016,36,E0,0-2,-2,1.1999999999999997,2016-04-10SunderlandLeicester
10/04/2016,Tottenham,Man United,3,0,H,2.1,3.3,3.3,2016-04-10,2015/2016,36,E0,3-0,3,-1.1999999999999997,2016-04-10TottenhamMan United
13/04/2016,Crystal Palace,Everton,0,0,D,2.95,3.1,2.4,2016-04-13,2015/2016,36,E0,0-0,0,0.5500000000000003,2016-04-13Crystal PalaceEverton
16/04/2016,Chelsea,Man City,0,3,A,2.6,3.2,2.6,2016-04-16,2015/2016,37,E0,0-3,-3,0.0,2016-04-16ChelseaMan City
16/04/2016,Everton,Southampton,1,1,D,2.5,3.3,2.65,2016-04-16,2015/2016,37,E0,1-1,0,-0.1499999999999999,2016-04-16EvertonSouthampton
16/04/2016,Man United,Aston Villa,1,0,H,1.2,5.8,13.0,2016-04-16,2015/2016,37,E0,1-0,1,-11.8,2016-04-16Man UnitedAston Villa
16/04/2016,Newcastle,Swansea,3,0,H,2.3,3.3,2.9,2016-04-16,2015/2016,37,E0,3-0,3,-0.6000000000000001,2016-04-16NewcastleSwansea
16/04/2016,Norwich,Sunderland,0,3,A,2.3,3.2,3.0,2016-04-16,2015/2016,37,E0,0-3,-3,-0.7000000000000002,2016-04-16NorwichSunderland
16/04/2016,West Brom,Watford,0,1,A,2.3,3.1,3.1,2016-04-16,2015/2016,37,E0,0-1,-1,-0.8000000000000003,2016-04-16West BromWatford
17/04/2016,Arsenal,Crystal Palace,1,1,D,1.3,5.0,9.0,2016-04-17,2015/2016,37,E0,1-1,0,-7.7,2016-04-17ArsenalCrystal Palace
17/04/2016,Bournemouth,Liverpool,1,2,A,3.3,3.3,2.1,2016-04-17,2015/2016,37,E0,1-2,-1,1.1999999999999997,2016-04-17BournemouthLiverpool
17/04/2016,Leicester,West Ham,2,2,D,2.0,3.3,3.6,2016-04-17,2015/2016,37,E0,2-2,0,-1.6,2016-04-17LeicesterWest Ham
18/04/2016,Stoke,Tottenham,0,4,A,4.0,3.45,1.85,2016-04-18,2015/2016,38,E0,0-4,-4,2.15,2016-04-18StokeTottenham
19/04/2016,Newcastle,Man City,1,1,D,5.4,3.7,1.6,2016-04-19,2015/2016,38,E0,1-1,0,3.8000000000000003,2016-04-19NewcastleMan City
20/04/2016,Liverpool,Everton,4,0,H,1.75,3.5,4.5,2016-04-20,2015/2016,38,E0,4-0,4,-2.75,2016-04-20LiverpoolEverton
20/04/2016,Man United,Crystal Palace,2,0,H,1.55,4.0,5.5,2016-04-20,2015/2016,38,E0,2-0,2,-3.95,2016-04-20Man UnitedCrystal Palace
20/04/2016,West Ham,Watford,3,1,H,1.65,3.6,5.1,2016-04-20,2015/2016,38,E0,3-1,2,-3.4499999999999997,2016-04-20West HamWatford
21/04/2016,Arsenal,West Brom,2,0,H,1.25,5.5,10.3,2016-04-21,2015/2016,38,E0,2-0,2,-9.05,2016-04-21ArsenalWest Brom
23/04/2016,Aston Villa,Southampton,2,4,A,6.1,4.0,1.5,2016-04-23,2015/2016,38,E0,2-4,-2,4.6,2016-04-23Aston VillaSouthampton
23/04/2016,Bournemouth,Chelsea,1,4,A,2.65,3.3,2.5,2016-04-23,2015/2016,38,E0,1-4,-3,0.1499999999999999,2016-04-23BournemouthChelsea
23/04/2016,Liverpool,Newcastle,2,2,D,1.5,4.0,6.1,2016-04-23,2015/2016,38,E0,2-2,0,-4.6,2016-04-23LiverpoolNewcastle
23/04/2016,Man City,Stoke,4,0,H,1.3,5.0,9.0,2016-04-23,2015/2016,39,E0,4-0,4,-7.7,2016-04-23Man CityStoke
24/04/2016,Leicester,Swansea,4,0,H,1.7,3.6,4.7,2016-04-24,2015/2016,39,E0,4-0,4,-3.0,2016-04-24LeicesterSwansea
24/04/2016,Sunderland,Arsenal,0,0,D,4.3,3.65,1.75,2016-04-24,2015/2016,39,E0,0-0,0,2.55,2016-04-24SunderlandArsenal
25/04/2016,Tottenham,West Brom,1,1,D,1.25,5.5,10.3,2016-04-25,2015/2016,39,E0,1-1,0,-9.05,2016-04-25TottenhamWest Brom
30/04/2016,Arsenal,Norwich,1,0,H,1.22,5.5,12.0,2016-04-30,2015/2016,39,E0,1-0,1,-10.78,2016-04-30ArsenalNorwich
30/04/2016,Everton,Bournemouth,2,1,H,1.9,3.45,3.8,2016-04-30,2015/2016,39,E0,2-1,1,-1.9,2016-04-30EvertonBournemouth
30/04/2016,Newcastle,Crystal Palace,1,0,H,1.9,3.45,3.8,2016-04-30,2015/2016,39,E0,1-0,1,-1.9,2016-04-30NewcastleCrystal Palace
30/04/2016,Stoke,Sunderland,1,1,D,2.6,3.2,2.6,2016-04-30,2015/2016,39,E0,1-1,0,0.0,2016-04-30StokeSunderland
30/04/2016,Watford,Aston Villa,3,2,H,1.6,3.9,5.0,2016-04-30,2015/2016,39,E0,3-2,1,-3.4,2016-04-30WatfordAston Villa
30/04/2016,West Brom,West Ham,0,3,A,3.1,3.3,2.2,2016-04-30,2015/2016,40,E0,0-3,-3,0.8999999999999999,2016-04-30West BromWest Ham
01/05/2016,Man United,Leicester,1,1,D,1.9,3.45,3.8,2016-05-01,2015/2016,40,E0,1-1,0,-1.9,2016-05-01Man UnitedLeicester
01/05/2016,Southampton,Man City,4,2,H,2.65,3.3,2.5,2016-05-01,2015/2016,40,E0,4-2,2,0.1499999999999999,2016-05-01SouthamptonMan City
01/05/2016,Swansea,Liverpool,3,1,H,3.1,3.3,2.2,2016-05-01,2015/2016,40,E0,3-1,2,0.8999999999999999,2016-05-01SwanseaLiverpool
02/05/2016,Chelsea,Tottenham,2,2,D,2.6,3.2,2.6,2016-05-02,2015/2016,40,E0,2-2,0,0.0,2016-05-02ChelseaTottenham
07/05/2016,Aston Villa,Newcastle,0,0,D,5.0,3.9,1.6,2016-05-07,2015/2016,40,E0,0-0,0,3.4,2016-05-07Aston VillaNewcastle
07/05/2016,Bournemouth,West Brom,1,1,D,1.9,3.15,4.2,2016-05-07,2015/2016,40,E0,1-1,0,-2.3000000000000003,2016-05-07BournemouthWest Brom
07/05/2016,Crystal Palace,Stoke,2,1,H,1.85,3.45,4.0,2016-05-07,2015/2016,40,E0,2-1,1,-2.15,2016-05-07Crystal PalaceStoke
07/05/2016,Leicester,Everton,3,1,H,1.9,3.45,3.8,2016-05-07,2015/2016,40,E0,3-1,2,-1.9,2016-05-07LeicesterEverton
07/05/2016,Norwich,Man United,0,1,A,3.7,3.5,1.9,2016-05-07,2015/2016,41,E0,0-1,-1,1.8000000000000003,2016-05-07NorwichMan United
07/05/2016,Sunderland,Chelsea,3,2,H,2.6,3.2,2.6,2016-05-07,2015/2016,41,E0,3-2,1,0.0,2016-05-07SunderlandChelsea
07/05/2016,West Ham,Swansea,1,4,A,1.47,4.0,6.6,2016-05-07,2015/2016,41,E0,1-4,-3,-5.13,2016-05-07West HamSwansea
08/05/2016,Liverpool,Watford,2,0,H,1.4,4.4,7.3,2016-05-08,2015/2016,41,E0,2-0,2,-5.9,2016-05-08LiverpoolWatford
08/05/2016,Man City,Arsenal,2,2,D,2.4,3.2,2.85,2016-05-08,2015/2016,41,E0,2-2,0,-0.4500000000000002,2016-05-08Man CityArsenal
08/05/2016,Tottenham,Southampton,1,2,A,1.9,3.45,3.8,2016-05-08,2015/2016,41,E0,1-2,-1,-1.9,2016-05-08TottenhamSouthampton
10/05/2016,West Ham,Man United,3,2,H,3.0,3.2,2.3,2016-05-10,2015/2016,41,E0,3-2,1,0.7000000000000002,2016-05-10West HamMan United
11/05/2016,Liverpool,Chelsea,1,1,D,1.9,3.45,3.8,2016-05-11,2015/2016,41,E0,1-1,0,-1.9,2016-05-11LiverpoolChelsea
11/05/2016,Norwich,Watford,4,2,H,1.8,3.6,4.0,2016-05-11,2015/2016,41,E0,4-2,2,-2.2,2016-05-11NorwichWatford
11/05/2016,Sunderland,Everton,3,0,H,1.55,4.0,5.4,2016-05-11,2015/2016,42,E0,3-0,3,-3.8500000000000005,2016-05-11SunderlandEverton
15/05/2016,Arsenal,Aston Villa,4,0,H,1.17,6.5,14.0,2016-05-15,2015/2016,42,E0,4-0,4,-12.83,2016-05-15ArsenalAston Villa
15/05/2016,Chelsea,Leicester,1,1,D,2.1,3.3,3.3,2016-05-15,2015/2016,42,E0,1-1,0,-1.1999999999999997,2016-05-15ChelseaLeicester
15/05/2016,Everton,Norwich,3,0,H,1.85,3.45,4.0,2016-05-15,2015/2016,42,E0,3-0,3,-2.15,2016-05-15EvertonNorwich
15/05/2016,Newcastle,Tottenham,5,1,H,4.5,3.5,1.75,2016-05-15,2015/2016,42,E0,5-1,4,2.75,2016-05-15NewcastleTottenham
15/05/2016,Southampton,Crystal Palace,4,1,H,1.4,4.4,7.3,2016-05-15,2015/2016,42,E0,4-1,3,-5.9,2016-05-15SouthamptonCrystal Palace
15/05/2016,Stoke,West Ham,2,1,H,2.9,3.3,2.3,2016-05-15,2015/2016,42,E0,2-1,1,0.6000000000000001,2016-05-15StokeWest Ham
15/05/2016,Swansea,Man City,1,1,D,7.0,4.0,1.45,2016-05-15,2015/2016,42,E0,1-1,0,5.55,2016-05-15SwanseaMan City
15/05/2016,Watford,Sunderland,2,2,D,2.2,3.3,3.1,2016-05-15,2015/2016,42,E0,2-2,0,-0.8999999999999999,2016-05-15WatfordSunderland
