Date,HomeTeam,AwayTeam,FTHG,FTAG,FTR,IWH,IWD,IWA,datetime,season,game_day,league,result,goal_diff,odds_diff,game_id
16/08/08,Arsenal,West Brom,1,0,H,1.2,5.2,11.0,2008-08-16,2008/2009,1,E0,1-0,1,-9.8,2008-08-16ArsenalWest Brom
16/08/08,Bolton,Stoke,3,1,H,1.75,3.3,4.2,2008-08-16,2008/2009,1,E0,3-1,2,-2.45,2008-08-16BoltonStoke
16/08/08,Everton,Blackburn,2,3,A,2.0,3.2,3.3,2008-08-16,2008/2009,1,E0,2-3,-1,-1.2999999999999998,2008-08-16EvertonBlackburn
16/08/08,Hull,Fulham,2,1,H,2.4,3.2,2.6,2008-08-16,2008/2009,1,E0,2-1,1,-0.20000000000000018,2008-08-16HullFulham
16/08/08,Middlesbrough,Tottenham,2,1,H,2.9,3.2,2.2,2008-08-16,2008/2009,1,E0,2-1,1,0.6999999999999997,2008-08-16MiddlesbroughTottenham
16/08/08,Sunderland,Liverpool,0,1,A,4.5,3.5,1.65,2008-08-16,2008/2009,1,E0,0-1,-1,2.85,2008-08-16SunderlandLiverpool
16/08/08,West Ham,Wigan,2,1,H,1.8,3.3,3.8,2008-08-16,2008/2009,1,E0,2-1,1,-1.9999999999999998,2008-08-16West HamWigan
17/08/08,Aston Villa,Man City,4,2,H,2.0,3.2,3.3,2008-08-17,2008/2009,1,E0,4-2,2,-1.2999999999999998,2008-08-17Aston VillaMan City
17/08/08,Chelsea,Portsmouth,4,0,H,1.3,4.4,8.5,2008-08-17,2008/2009,1,E0,4-0,4,-7.2,2008-08-17ChelseaPortsmouth
17/08/08,Man United,Newcastle,1,1,D,1.3,4.4,8.5,2008-08-17,2008/2009,2,E0,1-1,0,-7.2,2008-08-17Man UnitedNewcastle
23/08/08,Blackburn,Hull,1,1,D,1.6,3.6,4.8,2008-08-23,2008/2009,2,E0,1-1,0,-3.1999999999999997,2008-08-23BlackburnHull
23/08/08,Fulham,Arsenal,1,0,H,5.0,3.5,1.6,2008-08-23,2008/2009,2,E0,1-0,1,3.4,2008-08-23FulhamArsenal
23/08/08,Liverpool,Middlesbrough,2,1,H,1.4,4.0,6.5,2008-08-23,2008/2009,2,E0,2-1,1,-5.1,2008-08-23LiverpoolMiddlesbrough
23/08/08,Newcastle,Bolton,1,0,H,1.75,3.3,4.2,2008-08-23,2008/2009,2,E0,1-0,1,-2.45,2008-08-23NewcastleBolton
23/08/08,Stoke,Aston Villa,3,2,H,4.3,3.4,1.7,2008-08-23,2008/2009,2,E0,3-2,1,2.5999999999999996,2008-08-23StokeAston Villa
23/08/08,Tottenham,Sunderland,1,2,A,1.5,3.8,5.5,2008-08-23,2008/2009,2,E0,1-2,-1,-4.0,2008-08-23TottenhamSunderland
23/08/08,West Brom,Everton,1,2,A,2.8,3.1,2.3,2008-08-23,2008/2009,2,E0,1-2,-1,0.5,2008-08-23West BromEverton
24/08/08,Man City,West Ham,3,0,H,2.1,3.2,3.1,2008-08-24,2008/2009,2,E0,3-0,3,-1.0,2008-08-24Man CityWest Ham
24/08/08,Wigan,Chelsea,0,1,A,6.5,4.0,1.4,2008-08-24,2008/2009,3,E0,0-1,-1,5.1,2008-08-24WiganChelsea
25/08/08,Portsmouth,Man United,0,1,A,4.2,3.3,1.75,2008-08-25,2008/2009,3,E0,0-1,-1,2.45,2008-08-25PortsmouthMan United
30/08/08,Arsenal,Newcastle,3,0,H,1.4,4.0,6.5,2008-08-30,2008/2009,3,E0,3-0,3,-5.1,2008-08-30ArsenalNewcastle
30/08/08,Bolton,West Brom,0,0,D,1.85,3.2,3.8,2008-08-30,2008/2009,3,E0,0-0,0,-1.9499999999999997,2008-08-30BoltonWest Brom
30/08/08,Everton,Portsmouth,0,3,A,2.0,3.2,3.3,2008-08-30,2008/2009,3,E0,0-3,-3,-1.2999999999999998,2008-08-30EvertonPortsmouth
30/08/08,Hull,Wigan,0,5,A,2.4,3.1,2.7,2008-08-30,2008/2009,3,E0,0-5,-5,-0.30000000000000027,2008-08-30HullWigan
30/08/08,Middlesbrough,Stoke,2,1,H,1.55,3.7,5.0,2008-08-30,2008/2009,3,E0,2-1,1,-3.45,2008-08-30MiddlesbroughStoke
30/08/08,West Ham,Blackburn,4,1,H,2.3,3.1,2.8,2008-08-30,2008/2009,3,E0,4-1,3,-0.5,2008-08-30West HamBlackburn
31/08/08,Aston Villa,Liverpool,0,0,D,3.0,3.1,2.2,2008-08-31,2008/2009,3,E0,0-0,0,0.7999999999999998,2008-08-31Aston VillaLiverpool
31/08/08,Chelsea,Tottenham,1,1,D,1.4,4.0,6.5,2008-08-31,2008/2009,4,E0,1-1,0,-5.1,2008-08-31ChelseaTottenham
31/08/08,Sunderland,Man City,0,3,A,2.2,3.1,3.0,2008-08-31,2008/2009,4,E0,0-3,-3,-0.7999999999999998,2008-08-31SunderlandMan City
13/09/08,Blackburn,Arsenal,0,4,A,3.8,3.2,1.85,2008-09-13,2008/2009,4,E0,0-4,-4,1.9499999999999997,2008-09-13BlackburnArsenal
13/09/08,Fulham,Bolton,2,1,H,2.2,3.1,3.0,2008-09-13,2008/2009,4,E0,2-1,1,-0.7999999999999998,2008-09-13FulhamBolton
13/09/08,Liverpool,Man United,2,1,H,2.6,3.0,2.6,2008-09-13,2008/2009,4,E0,2-1,1,0.0,2008-09-13LiverpoolMan United
13/09/08,Man City,Chelsea,1,3,A,3.8,3.2,1.85,2008-09-13,2008/2009,4,E0,1-3,-2,1.9499999999999997,2008-09-13Man CityChelsea
13/09/08,Newcastle,Hull,1,2,A,1.6,3.6,4.8,2008-09-13,2008/2009,4,E0,1-2,-1,-3.1999999999999997,2008-09-13NewcastleHull
13/09/08,Portsmouth,Middlesbrough,2,1,H,1.9,3.2,3.6,2008-09-13,2008/2009,4,E0,2-1,1,-1.7000000000000002,2008-09-13PortsmouthMiddlesbrough
13/09/08,West Brom,West Ham,3,2,H,2.4,3.2,2.6,2008-09-13,2008/2009,4,E0,3-2,1,-0.20000000000000018,2008-09-13West BromWest Ham
13/09/08,Wigan,Sunderland,1,1,D,2.1,3.1,3.2,2008-09-13,2008/2009,5,E0,1-1,0,-1.1,2008-09-13WiganSunderland
14/09/08,Stoke,Everton,2,3,A,3.1,3.2,2.1,2008-09-14,2008/2009,5,E0,2-3,-1,1.0,2008-09-14StokeEverton
15/09/08,Tottenham,Aston Villa,1,2,A,2.0,3.2,3.3,2008-09-15,2008/2009,5,E0,1-2,-1,-1.2999999999999998,2008-09-15TottenhamAston Villa
20/09/08,Blackburn,Fulham,1,0,H,1.9,3.2,3.6,2008-09-20,2008/2009,5,E0,1-0,1,-1.7000000000000002,2008-09-20BlackburnFulham
20/09/08,Bolton,Arsenal,1,3,A,4.5,3.5,1.65,2008-09-20,2008/2009,5,E0,1-3,-2,2.85,2008-09-20BoltonArsenal
20/09/08,Liverpool,Stoke,0,0,D,1.2,5.2,11.0,2008-09-20,2008/2009,5,E0,0-0,0,-9.8,2008-09-20LiverpoolStoke
20/09/08,Sunderland,Middlesbrough,2,0,H,2.25,3.0,3.0,2008-09-20,2008/2009,5,E0,2-0,2,-0.75,2008-09-20SunderlandMiddlesbrough
20/09/08,West Ham,Newcastle,3,1,H,2.0,3.2,3.3,2008-09-20,2008/2009,5,E0,3-1,2,-1.2999999999999998,2008-09-20West HamNewcastle
21/09/08,Chelsea,Man United,1,1,D,2.1,3.0,3.3,2008-09-21,2008/2009,5,E0,1-1,0,-1.1999999999999997,2008-09-21ChelseaMan United
21/09/08,Hull,Everton,2,2,D,2.6,3.2,2.4,2008-09-21,2008/2009,6,E0,2-2,0,0.20000000000000018,2008-09-21HullEverton
21/09/08,Man City,Portsmouth,6,0,H,1.9,3.2,3.6,2008-09-21,2008/2009,6,E0,6-0,6,-1.7000000000000002,2008-09-21Man CityPortsmouth
21/09/08,Tottenham,Wigan,0,0,D,1.6,3.6,4.8,2008-09-21,2008/2009,6,E0,0-0,0,-3.1999999999999997,2008-09-21TottenhamWigan
21/09/08,West Brom,Aston Villa,1,2,A,2.8,3.1,2.3,2008-09-21,2008/2009,6,E0,1-2,-1,0.5,2008-09-21West BromAston Villa
27/09/08,Arsenal,Hull,1,2,A,1.2,5.2,11.0,2008-09-27,2008/2009,6,E0,1-2,-1,-9.8,2008-09-27ArsenalHull
27/09/08,Aston Villa,Sunderland,2,1,H,1.65,3.4,4.7,2008-09-27,2008/2009,6,E0,2-1,1,-3.0500000000000003,2008-09-27Aston VillaSunderland
27/09/08,Everton,Liverpool,0,2,A,3.4,3.1,2.0,2008-09-27,2008/2009,6,E0,0-2,-2,1.4,2008-09-27EvertonLiverpool
27/09/08,Fulham,West Ham,1,2,A,2.2,3.1,3.0,2008-09-27,2008/2009,6,E0,1-2,-1,-0.7999999999999998,2008-09-27FulhamWest Ham
27/09/08,Man United,Bolton,2,0,H,1.25,4.8,9.5,2008-09-27,2008/2009,6,E0,2-0,2,-8.25,2008-09-27Man UnitedBolton
27/09/08,Middlesbrough,West Brom,0,1,A,1.75,3.3,4.2,2008-09-27,2008/2009,7,E0,0-1,-1,-2.45,2008-09-27MiddlesbroughWest Brom
27/09/08,Newcastle,Blackburn,1,2,A,2.5,3.2,2.5,2008-09-27,2008/2009,7,E0,1-2,-1,0.0,2008-09-27NewcastleBlackburn
27/09/08,Stoke,Chelsea,0,2,A,7.5,4.2,1.35,2008-09-27,2008/2009,7,E0,0-2,-2,6.15,2008-09-27StokeChelsea
28/09/08,Portsmouth,Tottenham,2,0,H,2.4,3.1,2.7,2008-09-28,2008/2009,7,E0,2-0,2,-0.30000000000000027,2008-09-28PortsmouthTottenham
28/09/08,Wigan,Man City,2,1,H,2.8,3.1,2.3,2008-09-28,2008/2009,7,E0,2-1,1,0.5,2008-09-28WiganMan City
04/10/08,Blackburn,Man United,0,2,A,4.5,3.5,1.65,2008-10-04,2008/2009,7,E0,0-2,-2,2.85,2008-10-04BlackburnMan United
04/10/08,Sunderland,Arsenal,1,1,D,4.5,3.5,1.65,2008-10-04,2008/2009,7,E0,1-1,0,2.85,2008-10-04SunderlandArsenal
04/10/08,West Brom,Fulham,1,0,H,2.3,3.1,2.8,2008-10-04,2008/2009,7,E0,1-0,1,-0.5,2008-10-04West BromFulham
04/10/08,Wigan,Middlesbrough,0,1,A,2.0,3.2,3.3,2008-10-04,2008/2009,7,E0,0-1,-1,-1.2999999999999998,2008-10-04WiganMiddlesbrough
05/10/08,Chelsea,Aston Villa,2,0,H,1.45,3.7,6.5,2008-10-05,2008/2009,8,E0,2-0,2,-5.05,2008-10-05ChelseaAston Villa
05/10/08,Everton,Newcastle,2,2,D,1.7,3.4,4.3,2008-10-05,2008/2009,8,E0,2-2,0,-2.5999999999999996,2008-10-05EvertonNewcastle
05/10/08,Man City,Liverpool,2,3,A,2.8,3.1,2.3,2008-10-05,2008/2009,8,E0,2-3,-1,0.5,2008-10-05Man CityLiverpool
05/10/08,Portsmouth,Stoke,2,1,H,1.6,3.6,4.8,2008-10-05,2008/2009,8,E0,2-1,1,-3.1999999999999997,2008-10-05PortsmouthStoke
05/10/08,Tottenham,Hull,0,1,A,1.65,3.5,4.5,2008-10-05,2008/2009,8,E0,0-1,-1,-2.85,2008-10-05TottenhamHull
05/10/08,West Ham,Bolton,1,3,A,1.8,3.2,4.0,2008-10-05,2008/2009,8,E0,1-3,-2,-2.2,2008-10-05West HamBolton
18/10/08,Arsenal,Everton,3,1,H,1.37,4.2,7.5,2008-10-18,2008/2009,8,E0,3-1,2,-6.13,2008-10-18ArsenalEverton
18/10/08,Aston Villa,Portsmouth,0,0,D,1.8,3.2,4.0,2008-10-18,2008/2009,8,E0,0-0,0,-2.2,2008-10-18Aston VillaPortsmouth
18/10/08,Bolton,Blackburn,0,0,D,2.2,3.1,3.0,2008-10-18,2008/2009,8,E0,0-0,0,-0.7999999999999998,2008-10-18BoltonBlackburn
18/10/08,Fulham,Sunderland,0,0,D,2.25,3.1,2.9,2008-10-18,2008/2009,9,E0,0-0,0,-0.6499999999999999,2008-10-18FulhamSunderland
18/10/08,Liverpool,Wigan,3,2,H,1.3,4.4,8.5,2008-10-18,2008/2009,9,E0,3-2,1,-7.2,2008-10-18LiverpoolWigan
18/10/08,Man United,West Brom,4,0,H,1.2,5.2,11.0,2008-10-18,2008/2009,9,E0,4-0,4,-9.8,2008-10-18Man UnitedWest Brom
18/10/08,Middlesbrough,Chelsea,0,5,A,5.0,3.5,1.6,2008-10-18,2008/2009,9,E0,0-5,-5,3.4,2008-10-18MiddlesbroughChelsea
19/10/08,Hull,West Ham,1,0,H,2.3,3.1,2.8,2008-10-19,2008/2009,9,E0,1-0,1,-0.5,2008-10-19HullWest Ham
19/10/08,Stoke,Tottenham,2,1,H,3.0,3.1,2.2,2008-10-19,2008/2009,9,E0,2-1,1,0.7999999999999998,2008-10-19StokeTottenham
20/10/08,Newcastle,Man City,2,2,D,2.5,3.2,2.5,2008-10-20,2008/2009,9,E0,2-2,0,0.0,2008-10-20NewcastleMan City
25/10/08,Blackburn,Middlesbrough,1,1,D,1.9,3.2,3.6,2008-10-25,2008/2009,9,E0,1-1,0,-1.7000000000000002,2008-10-25BlackburnMiddlesbrough
25/10/08,Everton,Man United,1,1,D,5.5,3.5,1.55,2008-10-25,2008/2009,9,E0,1-1,0,3.95,2008-10-25EvertonMan United
25/10/08,Sunderland,Newcastle,2,1,H,2.1,3.1,3.2,2008-10-25,2008/2009,10,E0,2-1,1,-1.1,2008-10-25SunderlandNewcastle
25/10/08,West Brom,Hull,0,3,A,2.2,3.1,3.0,2008-10-25,2008/2009,10,E0,0-3,-3,-0.7999999999999998,2008-10-25West BromHull
26/10/08,Chelsea,Liverpool,0,1,A,1.9,3.2,3.6,2008-10-26,2008/2009,10,E0,0-1,-1,-1.7000000000000002,2008-10-26ChelseaLiverpool
26/10/08,Man City,Stoke,3,0,H,1.45,3.7,6.5,2008-10-26,2008/2009,10,E0,3-0,3,-5.05,2008-10-26Man CityStoke
26/10/08,Portsmouth,Fulham,1,1,D,1.75,3.3,4.2,2008-10-26,2008/2009,10,E0,1-1,0,-2.45,2008-10-26PortsmouthFulham
26/10/08,Tottenham,Bolton,2,0,H,1.8,3.2,4.0,2008-10-26,2008/2009,10,E0,2-0,2,-2.2,2008-10-26TottenhamBolton
26/10/08,West Ham,Arsenal,0,2,A,4.5,3.5,1.65,2008-10-26,2008/2009,10,E0,0-2,-2,2.85,2008-10-26West HamArsenal
26/10/08,Wigan,Aston Villa,0,4,A,2.5,3.0,2.7,2008-10-26,2008/2009,10,E0,0-4,-4,-0.20000000000000018,2008-10-26WiganAston Villa
28/10/08,Newcastle,West Brom,2,1,H,1.9,3.2,3.6,2008-10-28,2008/2009,10,E0,2-1,1,-1.7000000000000002,2008-10-28NewcastleWest Brom
29/10/08,Arsenal,Tottenham,4,4,D,1.45,3.7,6.5,2008-10-29,2008/2009,11,E0,4-4,0,-5.05,2008-10-29ArsenalTottenham
29/10/08,Aston Villa,Blackburn,3,2,H,1.75,3.3,4.2,2008-10-29,2008/2009,11,E0,3-2,1,-2.45,2008-10-29Aston VillaBlackburn
29/10/08,Bolton,Everton,0,1,A,2.3,3.0,2.9,2008-10-29,2008/2009,11,E0,0-1,-1,-0.6000000000000001,2008-10-29BoltonEverton
29/10/08,Fulham,Wigan,2,0,H,2.2,3.0,3.1,2008-10-29,2008/2009,11,E0,2-0,2,-0.8999999999999999,2008-10-29FulhamWigan
29/10/08,Hull,Chelsea,0,3,A,6.0,3.6,1.5,2008-10-29,2008/2009,11,E0,0-3,-3,4.5,2008-10-29HullChelsea
29/10/08,Liverpool,Portsmouth,1,0,H,1.35,4.2,7.5,2008-10-29,2008/2009,11,E0,1-0,1,-6.15,2008-10-29LiverpoolPortsmouth
29/10/08,Man United,West Ham,2,0,H,1.2,5.2,11.0,2008-10-29,2008/2009,11,E0,2-0,2,-9.8,2008-10-29Man UnitedWest Ham
29/10/08,Middlesbrough,Man City,2,0,H,2.55,3.1,2.55,2008-10-29,2008/2009,11,E0,2-0,2,0.0,2008-10-29MiddlesbroughMan City
29/10/08,Stoke,Sunderland,1,0,H,2.5,3.0,2.7,2008-10-29,2008/2009,11,E0,1-0,1,-0.20000000000000018,2008-10-29StokeSunderland
01/11/08,Chelsea,Sunderland,5,0,H,1.22,5.0,10.0,2008-11-01,2008/2009,12,E0,5-0,5,-8.78,2008-11-01ChelseaSunderland
01/11/08,Everton,Fulham,1,0,H,1.7,3.4,4.3,2008-11-01,2008/2009,12,E0,1-0,1,-2.5999999999999996,2008-11-01EvertonFulham
01/11/08,Man United,Hull,4,3,H,1.17,5.7,12.0,2008-11-01,2008/2009,12,E0,4-3,1,-10.83,2008-11-01Man UnitedHull
01/11/08,Middlesbrough,West Ham,1,1,D,1.9,3.3,3.5,2008-11-01,2008/2009,12,E0,1-1,0,-1.6,2008-11-01MiddlesbroughWest Ham
01/11/08,Portsmouth,Wigan,1,2,A,1.8,3.2,4.0,2008-11-01,2008/2009,12,E0,1-2,-1,-2.2,2008-11-01PortsmouthWigan
01/11/08,Stoke,Arsenal,2,1,H,6.0,3.9,1.45,2008-11-01,2008/2009,12,E0,2-1,1,4.55,2008-11-01StokeArsenal
01/11/08,Tottenham,Liverpool,2,1,H,3.2,3.1,2.1,2008-11-01,2008/2009,12,E0,2-1,1,1.1,2008-11-01TottenhamLiverpool
01/11/08,West Brom,Blackburn,2,2,D,2.5,3.2,2.5,2008-11-01,2008/2009,12,E0,2-2,0,0.0,2008-11-01West BromBlackburn
02/11/08,Bolton,Man City,2,0,H,2.7,3.2,2.3,2008-11-02,2008/2009,12,E0,2-0,2,0.40000000000000036,2008-11-02BoltonMan City
03/11/08,Newcastle,Aston Villa,2,0,H,2.7,3.2,2.3,2008-11-03,2008/2009,13,E0,2-0,2,0.40000000000000036,2008-11-03NewcastleAston Villa
08/11/08,Arsenal,Man United,2,1,H,2.9,3.0,2.3,2008-11-08,2008/2009,13,E0,2-1,1,0.6000000000000001,2008-11-08ArsenalMan United
08/11/08,Hull,Bolton,0,1,A,2.1,3.1,3.2,2008-11-08,2008/2009,13,E0,0-1,-1,-1.1,2008-11-08HullBolton
08/11/08,Liverpool,West Brom,3,0,H,1.2,5.2,11.0,2008-11-08,2008/2009,13,E0,3-0,3,-9.8,2008-11-08LiverpoolWest Brom
08/11/08,Sunderland,Portsmouth,1,2,A,2.2,3.1,3.0,2008-11-08,2008/2009,13,E0,1-2,-1,-0.7999999999999998,2008-11-08SunderlandPortsmouth
08/11/08,West Ham,Everton,1,3,A,2.4,3.1,2.7,2008-11-08,2008/2009,13,E0,1-3,-2,-0.30000000000000027,2008-11-08West HamEverton
08/11/08,Wigan,Stoke,0,0,D,1.75,3.3,4.2,2008-11-08,2008/2009,13,E0,0-0,0,-2.45,2008-11-08WiganStoke
09/11/08,Aston Villa,Middlesbrough,1,2,A,1.7,3.4,4.3,2008-11-09,2008/2009,13,E0,1-2,-1,-2.5999999999999996,2008-11-09Aston VillaMiddlesbrough
09/11/08,Blackburn,Chelsea,0,2,A,6.0,3.6,1.5,2008-11-09,2008/2009,13,E0,0-2,-2,4.5,2008-11-09BlackburnChelsea
09/11/08,Fulham,Newcastle,2,1,H,2.2,3.1,3.0,2008-11-09,2008/2009,14,E0,2-1,1,-0.7999999999999998,2008-11-09FulhamNewcastle
09/11/08,Man City,Tottenham,1,2,A,2.3,3.1,2.8,2008-11-09,2008/2009,14,E0,1-2,-1,-0.5,2008-11-09Man CityTottenham
15/11/08,Arsenal,Aston Villa,0,2,A,1.5,3.8,5.5,2008-11-15,2008/2009,14,E0,0-2,-2,-4.0,2008-11-15ArsenalAston Villa
15/11/08,Blackburn,Sunderland,1,2,A,2.0,3.2,3.3,2008-11-15,2008/2009,14,E0,1-2,-1,-1.2999999999999998,2008-11-15BlackburnSunderland
15/11/08,Bolton,Liverpool,0,2,A,4.5,3.5,1.65,2008-11-15,2008/2009,14,E0,0-2,-2,2.85,2008-11-15BoltonLiverpool
15/11/08,Fulham,Tottenham,2,1,H,2.8,3.1,2.3,2008-11-15,2008/2009,14,E0,2-1,1,0.5,2008-11-15FulhamTottenham
15/11/08,Man United,Stoke,5,0,H,1.17,5.7,12.0,2008-11-15,2008/2009,14,E0,5-0,5,-10.83,2008-11-15Man UnitedStoke
15/11/08,Newcastle,Wigan,2,2,D,2.0,3.2,3.3,2008-11-15,2008/2009,14,E0,2-2,0,-1.2999999999999998,2008-11-15NewcastleWigan
15/11/08,West Brom,Chelsea,0,3,A,8.5,4.4,1.3,2008-11-15,2008/2009,14,E0,0-3,-3,7.2,2008-11-15West BromChelsea
15/11/08,West Ham,Portsmouth,0,0,D,2.5,3.0,2.7,2008-11-15,2008/2009,15,E0,0-0,0,-0.20000000000000018,2008-11-15West HamPortsmouth
16/11/08,Everton,Middlesbrough,1,1,D,1.85,3.2,3.8,2008-11-16,2008/2009,15,E0,1-1,0,-1.9499999999999997,2008-11-16EvertonMiddlesbrough
16/11/08,Hull,Man City,2,2,D,2.6,3.2,2.4,2008-11-16,2008/2009,15,E0,2-2,0,0.20000000000000018,2008-11-16HullMan City
22/11/08,Aston Villa,Man United,0,0,D,4.2,3.3,1.75,2008-11-22,2008/2009,15,E0,0-0,0,2.45,2008-11-22Aston VillaMan United
22/11/08,Chelsea,Newcastle,0,0,D,1.2,5.2,11.0,2008-11-22,2008/2009,15,E0,0-0,0,-9.8,2008-11-22ChelseaNewcastle
22/11/08,Liverpool,Fulham,0,0,D,1.27,4.6,9.0,2008-11-22,2008/2009,15,E0,0-0,0,-7.73,2008-11-22LiverpoolFulham
22/11/08,Man City,Arsenal,3,0,H,3.1,3.2,2.1,2008-11-22,2008/2009,15,E0,3-0,3,1.0,2008-11-22Man CityArsenal
22/11/08,Middlesbrough,Bolton,1,3,A,1.85,3.2,3.8,2008-11-22,2008/2009,15,E0,1-3,-2,-1.9499999999999997,2008-11-22MiddlesbroughBolton
22/11/08,Portsmouth,Hull,2,2,D,1.75,3.3,4.2,2008-11-22,2008/2009,15,E0,2-2,0,-2.45,2008-11-22PortsmouthHull
22/11/08,Stoke,West Brom,1,0,H,2.0,3.2,3.3,2008-11-22,2008/2009,16,E0,1-0,1,-1.2999999999999998,2008-11-22StokeWest Brom
23/11/08,Sunderland,West Ham,0,1,A,2.15,3.1,3.1,2008-11-23,2008/2009,16,E0,0-1,-1,-0.9500000000000002,2008-11-23SunderlandWest Ham
23/11/08,Tottenham,Blackburn,1,0,H,1.75,3.3,4.2,2008-11-23,2008/2009,16,E0,1-0,1,-2.45,2008-11-23TottenhamBlackburn
24/11/08,Wigan,Everton,1,0,H,2.55,3.1,2.55,2008-11-24,2008/2009,16,E0,1-0,1,0.0,2008-11-24WiganEverton
29/11/08,Aston Villa,Fulham,0,0,D,1.65,3.5,4.5,2008-11-29,2008/2009,16,E0,0-0,0,-2.85,2008-11-29Aston VillaFulham
29/11/08,Middlesbrough,Newcastle,0,0,D,2.1,3.1,3.2,2008-11-29,2008/2009,16,E0,0-0,0,-1.1,2008-11-29MiddlesbroughNewcastle
29/11/08,Stoke,Hull,1,1,D,2.3,3.2,2.7,2008-11-29,2008/2009,16,E0,1-1,0,-0.40000000000000036,2008-11-29StokeHull
29/11/08,Sunderland,Bolton,1,4,A,2.2,3.1,3.0,2008-11-29,2008/2009,16,E0,1-4,-3,-0.7999999999999998,2008-11-29SunderlandBolton
29/11/08,Wigan,West Brom,2,1,H,1.8,3.2,4.0,2008-11-29,2008/2009,16,E0,2-1,1,-2.2,2008-11-29WiganWest Brom
30/11/08,Chelsea,Arsenal,1,2,A,1.7,3.3,4.5,2008-11-30,2008/2009,17,E0,1-2,-1,-2.8,2008-11-30ChelseaArsenal
30/11/08,Man City,Man United,0,1,A,3.8,3.2,1.85,2008-11-30,2008/2009,17,E0,0-1,-1,1.9499999999999997,2008-11-30Man CityMan United
30/11/08,Portsmouth,Blackburn,3,2,H,1.9,3.2,3.6,2008-11-30,2008/2009,17,E0,3-2,1,-1.7000000000000002,2008-11-30PortsmouthBlackburn
30/11/08,Tottenham,Everton,0,1,A,1.9,3.2,3.6,2008-11-30,2008/2009,17,E0,0-1,-1,-1.7000000000000002,2008-11-30TottenhamEverton
01/12/08,Liverpool,West Ham,0,0,D,1.33,4.2,8.0,2008-12-01,2008/2009,17,E0,0-0,0,-6.67,2008-12-01LiverpoolWest Ham
06/12/08,Arsenal,Wigan,1,0,H,1.3,4.4,8.5,2008-12-06,2008/2009,17,E0,1-0,1,-7.2,2008-12-06ArsenalWigan
06/12/08,Blackburn,Liverpool,1,3,A,4.3,3.4,1.7,2008-12-06,2008/2009,17,E0,1-3,-2,2.5999999999999996,2008-12-06BlackburnLiverpool
06/12/08,Bolton,Chelsea,0,2,A,5.5,3.5,1.55,2008-12-06,2008/2009,17,E0,0-2,-2,3.95,2008-12-06BoltonChelsea
06/12/08,Fulham,Man City,1,1,D,2.5,3.1,2.6,2008-12-06,2008/2009,17,E0,1-1,0,-0.10000000000000009,2008-12-06FulhamMan City
06/12/08,Hull,Middlesbrough,2,1,H,2.3,3.2,2.7,2008-12-06,2008/2009,18,E0,2-1,1,-0.40000000000000036,2008-12-06HullMiddlesbrough
06/12/08,Man United,Sunderland,1,0,H,1.2,5.2,11.0,2008-12-06,2008/2009,18,E0,1-0,1,-9.8,2008-12-06Man UnitedSunderland
06/12/08,Newcastle,Stoke,2,2,D,1.75,3.3,4.2,2008-12-06,2008/2009,18,E0,2-2,0,-2.45,2008-12-06NewcastleStoke
07/12/08,Everton,Aston Villa,2,3,A,2.4,3.1,2.7,2008-12-07,2008/2009,18,E0,2-3,-1,-0.30000000000000027,2008-12-07EvertonAston Villa
07/12/08,West Brom,Portsmouth,1,1,D,2.5,3.2,2.5,2008-12-07,2008/2009,18,E0,1-1,0,0.0,2008-12-07West BromPortsmouth
08/12/08,West Ham,Tottenham,0,2,A,2.55,3.1,2.55,2008-12-08,2008/2009,18,E0,0-2,-2,0.0,2008-12-08West HamTottenham
13/12/08,Aston Villa,Bolton,4,2,H,1.65,3.4,4.7,2008-12-13,2008/2009,18,E0,4-2,2,-3.0500000000000003,2008-12-13Aston VillaBolton
13/12/08,Liverpool,Hull,2,2,D,1.3,4.4,8.5,2008-12-13,2008/2009,18,E0,2-2,0,-7.2,2008-12-13LiverpoolHull
13/12/08,Man City,Everton,0,1,A,2.0,3.2,3.3,2008-12-13,2008/2009,18,E0,0-1,-1,-1.2999999999999998,2008-12-13Man CityEverton
13/12/08,Middlesbrough,Arsenal,1,1,D,4.0,3.2,1.8,2008-12-13,2008/2009,19,E0,1-1,0,2.2,2008-12-13MiddlesbroughArsenal
13/12/08,Stoke,Fulham,0,0,D,2.3,3.1,2.8,2008-12-13,2008/2009,19,E0,0-0,0,-0.5,2008-12-13StokeFulham
13/12/08,Sunderland,West Brom,4,0,H,2.0,3.2,3.3,2008-12-13,2008/2009,19,E0,4-0,4,-1.2999999999999998,2008-12-13SunderlandWest Brom
13/12/08,Tottenham,Man United,0,0,D,3.8,3.2,1.85,2008-12-13,2008/2009,19,E0,0-0,0,1.9499999999999997,2008-12-13TottenhamMan United
13/12/08,Wigan,Blackburn,3,0,H,2.0,3.2,3.3,2008-12-13,2008/2009,19,E0,3-0,3,-1.2999999999999998,2008-12-13WiganBlackburn
14/12/08,Chelsea,West Ham,1,1,D,1.25,4.8,9.5,2008-12-14,2008/2009,19,E0,1-1,0,-8.25,2008-12-14ChelseaWest Ham
14/12/08,Portsmouth,Newcastle,0,3,A,2.0,3.2,3.3,2008-12-14,2008/2009,19,E0,0-3,-3,-1.2999999999999998,2008-12-14PortsmouthNewcastle
20/12/08,Blackburn,Stoke,3,0,H,1.9,3.2,3.6,2008-12-20,2008/2009,19,E0,3-0,3,-1.7000000000000002,2008-12-20BlackburnStoke
20/12/08,Bolton,Portsmouth,2,1,H,2.1,3.1,3.2,2008-12-20,2008/2009,19,E0,2-1,1,-1.1,2008-12-20BoltonPortsmouth
20/12/08,Fulham,Middlesbrough,3,0,H,2.1,3.1,3.2,2008-12-20,2008/2009,20,E0,3-0,3,-1.1,2008-12-20FulhamMiddlesbrough
20/12/08,Hull,Sunderland,1,4,A,2.1,3.1,3.2,2008-12-20,2008/2009,20,E0,1-4,-3,-1.1,2008-12-20HullSunderland
20/12/08,West Ham,Aston Villa,0,1,A,2.8,3.1,2.3,2008-12-20,2008/2009,20,E0,0-1,-1,0.5,2008-12-20West HamAston Villa
21/12/08,Arsenal,Liverpool,1,1,D,2.3,3.1,2.8,2008-12-21,2008/2009,20,E0,1-1,0,-0.5,2008-12-21ArsenalLiverpool
21/12/08,Newcastle,Tottenham,2,1,H,2.4,3.1,2.7,2008-12-21,2008/2009,20,E0,2-1,1,-0.30000000000000027,2008-12-21NewcastleTottenham
21/12/08,West Brom,Man City,2,1,H,2.8,3.1,2.3,2008-12-21,2008/2009,20,E0,2-1,1,0.5,2008-12-21West BromMan City
22/12/08,Everton,Chelsea,0,0,D,4.2,3.3,1.75,2008-12-22,2008/2009,20,E0,0-0,0,2.45,2008-12-22EvertonChelsea
26/12/08,Aston Villa,Arsenal,2,2,D,2.5,3.0,2.7,2008-12-26,2008/2009,20,E0,2-2,0,-0.20000000000000018,2008-12-26Aston VillaArsenal
26/12/08,Chelsea,West Brom,2,0,H,1.15,6.0,13.0,2008-12-26,2008/2009,20,E0,2-0,2,-11.85,2008-12-26ChelseaWest Brom
26/12/08,Liverpool,Bolton,3,0,H,1.33,4.2,8.0,2008-12-26,2008/2009,21,E0,3-0,3,-6.67,2008-12-26LiverpoolBolton
26/12/08,Man City,Hull,5,1,H,1.75,3.3,4.2,2008-12-26,2008/2009,21,E0,5-1,4,-2.45,2008-12-26Man CityHull
26/12/08,Middlesbrough,Everton,0,1,A,2.4,3.1,2.7,2008-12-26,2008/2009,21,E0,0-1,-1,-0.30000000000000027,2008-12-26MiddlesbroughEverton
26/12/08,Portsmouth,West Ham,1,4,A,2.0,3.2,3.3,2008-12-26,2008/2009,21,E0,1-4,-3,-1.2999999999999998,2008-12-26PortsmouthWest Ham
26/12/08,Stoke,Man United,0,1,A,8.5,4.4,1.3,2008-12-26,2008/2009,21,E0,0-1,-1,7.2,2008-12-26StokeMan United
26/12/08,Sunderland,Blackburn,0,0,D,2.2,3.1,3.0,2008-12-26,2008/2009,21,E0,0-0,0,-0.7999999999999998,2008-12-26SunderlandBlackburn
26/12/08,Tottenham,Fulham,0,0,D,1.75,3.3,4.2,2008-12-26,2008/2009,21,E0,0-0,0,-2.45,2008-12-26TottenhamFulham
26/12/08,Wigan,Newcastle,2,1,H,2.1,3.1,3.2,2008-12-26,2008/2009,21,E0,2-1,1,-1.1,2008-12-26WiganNewcastle
28/12/08,Arsenal,Portsmouth,1,0,H,1.4,3.8,7.0,2008-12-28,2008/2009,21,E0,1-0,1,-5.6,2008-12-28ArsenalPortsmouth
28/12/08,Blackburn,Man City,2,2,D,2.3,3.1,2.8,2008-12-28,2008/2009,22,E0,2-2,0,-0.5,2008-12-28BlackburnMan City
28/12/08,Bolton,Wigan,0,1,A,2.1,3.1,3.2,2008-12-28,2008/2009,22,E0,0-1,-1,-1.1,2008-12-28BoltonWigan
28/12/08,Everton,Sunderland,3,0,H,1.75,3.3,4.2,2008-12-28,2008/2009,22,E0,3-0,3,-2.45,2008-12-28EvertonSunderland
28/12/08,Fulham,Chelsea,2,2,D,5.0,3.5,1.6,2008-12-28,2008/2009,22,E0,2-2,0,3.4,2008-12-28FulhamChelsea
28/12/08,Newcastle,Liverpool,1,5,A,3.8,3.2,1.85,2008-12-28,2008/2009,22,E0,1-5,-4,1.9499999999999997,2008-12-28NewcastleLiverpool
28/12/08,West Brom,Tottenham,2,0,H,3.0,3.1,2.2,2008-12-28,2008/2009,22,E0,2-0,2,0.7999999999999998,2008-12-28West BromTottenham
28/12/08,West Ham,Stoke,2,1,H,1.75,3.3,4.2,2008-12-28,2008/2009,22,E0,2-1,1,-2.45,2008-12-28West HamStoke
29/12/08,Man United,Middlesbrough,1,0,H,1.25,4.8,9.5,2008-12-29,2008/2009,22,E0,1-0,1,-8.25,2008-12-29Man UnitedMiddlesbrough
30/12/08,Hull,Aston Villa,0,1,A,3.3,3.2,2.0,2008-12-30,2008/2009,22,E0,0-1,-1,1.2999999999999998,2008-12-30HullAston Villa
10/01/09,Arsenal,Bolton,1,0,H,1.33,4.2,8.0,2009-01-10,2008/2009,23,E0,1-0,1,-6.67,2009-01-10ArsenalBolton
10/01/09,Aston Villa,West Brom,2,1,H,1.4,4.0,6.5,2009-01-10,2008/2009,23,E0,2-1,1,-5.1,2009-01-10Aston VillaWest Brom
10/01/09,Everton,Hull,2,0,H,1.6,3.6,4.8,2009-01-10,2008/2009,23,E0,2-0,2,-3.1999999999999997,2009-01-10EvertonHull
10/01/09,Middlesbrough,Sunderland,1,1,D,2.2,3.2,2.9,2009-01-10,2008/2009,23,E0,1-1,0,-0.6999999999999997,2009-01-10MiddlesbroughSunderland
10/01/09,Newcastle,West Ham,2,2,D,2.1,3.2,3.1,2009-01-10,2008/2009,23,E0,2-2,0,-1.0,2009-01-10NewcastleWest Ham
10/01/09,Stoke,Liverpool,0,0,D,7.5,4.0,1.37,2009-01-10,2008/2009,23,E0,0-0,0,6.13,2009-01-10StokeLiverpool
11/01/09,Man United,Chelsea,3,0,H,2.1,3.0,3.3,2009-01-11,2008/2009,23,E0,3-0,3,-1.1999999999999997,2009-01-11Man UnitedChelsea
11/01/09,Wigan,Tottenham,1,0,H,2.4,3.1,2.7,2009-01-11,2008/2009,23,E0,1-0,1,-0.30000000000000027,2009-01-11WiganTottenham
14/01/09,Man United,Wigan,1,0,H,1.22,5.0,10.0,2009-01-14,2008/2009,23,E0,1-0,1,-8.78,2009-01-14Man UnitedWigan
17/01/09,Blackburn,Newcastle,3,0,H,2.1,3.1,3.2,2009-01-17,2008/2009,24,E0,3-0,3,-1.1,2009-01-17BlackburnNewcastle
17/01/09,Bolton,Man United,0,1,A,6.5,3.7,1.45,2009-01-17,2008/2009,24,E0,0-1,-1,5.05,2009-01-17BoltonMan United
17/01/09,Chelsea,Stoke,2,1,H,1.2,5.2,11.0,2009-01-17,2008/2009,24,E0,2-1,1,-9.8,2009-01-17ChelseaStoke
17/01/09,Hull,Arsenal,1,3,A,5.0,3.5,1.6,2009-01-17,2008/2009,24,E0,1-3,-2,3.4,2009-01-17HullArsenal
17/01/09,Man City,Wigan,1,0,H,1.9,3.2,3.6,2009-01-17,2008/2009,24,E0,1-0,1,-1.7000000000000002,2009-01-17Man CityWigan
17/01/09,Sunderland,Aston Villa,1,2,A,3.0,3.1,2.2,2009-01-17,2008/2009,24,E0,1-2,-1,0.7999999999999998,2009-01-17SunderlandAston Villa
17/01/09,West Brom,Middlesbrough,3,0,H,2.4,3.1,2.7,2009-01-17,2008/2009,24,E0,3-0,3,-0.30000000000000027,2009-01-17West BromMiddlesbrough
18/01/09,Tottenham,Portsmouth,1,1,D,1.7,3.4,4.3,2009-01-18,2008/2009,24,E0,1-1,0,-2.5999999999999996,2009-01-18TottenhamPortsmouth
18/01/09,West Ham,Fulham,3,1,H,2.2,3.1,3.0,2009-01-18,2008/2009,24,E0,3-1,2,-0.7999999999999998,2009-01-18West HamFulham
19/01/09,Liverpool,Everton,1,1,D,1.55,3.5,5.5,2009-01-19,2008/2009,25,E0,1-1,0,-3.95,2009-01-19LiverpoolEverton
27/01/09,Portsmouth,Aston Villa,0,1,A,2.8,3.1,2.3,2009-01-27,2008/2009,25,E0,0-1,-1,0.5,2009-01-27PortsmouthAston Villa
27/01/09,Sunderland,Fulham,1,0,H,2.1,3.1,3.2,2009-01-27,2008/2009,25,E0,1-0,1,-1.1,2009-01-27SunderlandFulham
27/01/09,Tottenham,Stoke,3,1,H,1.55,3.5,5.5,2009-01-27,2008/2009,25,E0,3-1,2,-3.95,2009-01-27TottenhamStoke
27/01/09,West Brom,Man United,0,5,A,8.0,4.0,1.35,2009-01-27,2008/2009,25,E0,0-5,-5,6.65,2009-01-27West BromMan United
28/01/09,Blackburn,Bolton,2,2,D,1.9,3.2,3.6,2009-01-28,2008/2009,25,E0,2-2,0,-1.7000000000000002,2009-01-28BlackburnBolton
28/01/09,Chelsea,Middlesbrough,2,0,H,1.22,5.0,10.0,2009-01-28,2008/2009,25,E0,2-0,2,-8.78,2009-01-28ChelseaMiddlesbrough
28/01/09,Everton,Arsenal,1,1,D,2.7,3.1,2.4,2009-01-28,2008/2009,25,E0,1-1,0,0.30000000000000027,2009-01-28EvertonArsenal
28/01/09,Man City,Newcastle,2,1,H,1.75,3.3,4.2,2009-01-28,2008/2009,25,E0,2-1,1,-2.45,2009-01-28Man CityNewcastle
28/01/09,West Ham,Hull,2,0,H,1.7,3.4,4.3,2009-01-28,2008/2009,26,E0,2-0,2,-2.5999999999999996,2009-01-28West HamHull
28/01/09,Wigan,Liverpool,1,1,D,4.5,3.2,1.75,2009-01-28,2008/2009,26,E0,1-1,0,2.75,2009-01-28WiganLiverpool
31/01/09,Arsenal,West Ham,0,0,D,1.37,4.0,8.0,2009-01-31,2008/2009,26,E0,0-0,0,-6.63,2009-01-31ArsenalWest Ham
31/01/09,Aston Villa,Wigan,0,0,D,1.6,3.5,5.0,2009-01-31,2008/2009,26,E0,0-0,0,-3.4,2009-01-31Aston VillaWigan
31/01/09,Bolton,Tottenham,3,2,H,2.5,3.1,2.6,2009-01-31,2008/2009,26,E0,3-2,1,-0.10000000000000009,2009-01-31BoltonTottenham
31/01/09,Fulham,Portsmouth,3,1,H,1.9,3.2,3.6,2009-01-31,2008/2009,26,E0,3-1,2,-1.7000000000000002,2009-01-31FulhamPortsmouth
31/01/09,Hull,West Brom,2,2,D,1.9,3.2,3.6,2009-01-31,2008/2009,26,E0,2-2,0,-1.7000000000000002,2009-01-31HullWest Brom
31/01/09,Man United,Everton,1,0,H,1.35,4.2,8.0,2009-01-31,2008/2009,26,E0,1-0,1,-6.65,2009-01-31Man UnitedEverton
31/01/09,Middlesbrough,Blackburn,0,0,D,2.3,3.2,2.7,2009-01-31,2008/2009,26,E0,0-0,0,-0.40000000000000036,2009-01-31MiddlesbroughBlackburn
31/01/09,Stoke,Man City,1,0,H,3.1,3.2,2.1,2009-01-31,2008/2009,27,E0,1-0,1,1.0,2009-01-31StokeMan City
01/02/09,Liverpool,Chelsea,2,0,H,2.3,3.0,2.9,2009-02-01,2008/2009,27,E0,2-0,2,-0.6000000000000001,2009-02-01LiverpoolChelsea
01/02/09,Newcastle,Sunderland,1,1,D,2.3,3.1,2.8,2009-02-01,2008/2009,27,E0,1-1,0,-0.5,2009-02-01NewcastleSunderland
07/02/09,Blackburn,Aston Villa,0,2,A,2.7,3.1,2.4,2009-02-07,2008/2009,27,E0,0-2,-2,0.30000000000000027,2009-02-07BlackburnAston Villa
07/02/09,Chelsea,Hull,0,0,D,1.2,5.2,11.0,2009-02-07,2008/2009,27,E0,0-0,0,-9.8,2009-02-07ChelseaHull
07/02/09,Everton,Bolton,3,0,H,1.65,3.5,4.5,2009-02-07,2008/2009,27,E0,3-0,3,-2.85,2009-02-07EvertonBolton
07/02/09,Man City,Middlesbrough,1,0,H,1.55,3.7,5.0,2009-02-07,2008/2009,27,E0,1-0,1,-3.45,2009-02-07Man CityMiddlesbrough
07/02/09,Portsmouth,Liverpool,2,3,A,4.8,3.6,1.6,2009-02-07,2008/2009,27,E0,2-3,-1,3.1999999999999997,2009-02-07PortsmouthLiverpool
07/02/09,Sunderland,Stoke,2,0,H,1.8,3.2,4.0,2009-02-07,2008/2009,27,E0,2-0,2,-2.2,2009-02-07SunderlandStoke
07/02/09,West Brom,Newcastle,2,3,A,2.1,3.2,3.1,2009-02-07,2008/2009,28,E0,2-3,-1,-1.0,2009-02-07West BromNewcastle
07/02/09,Wigan,Fulham,0,0,D,1.9,3.2,3.6,2009-02-07,2008/2009,28,E0,0-0,0,-1.7000000000000002,2009-02-07WiganFulham
08/02/09,Tottenham,Arsenal,0,0,D,2.8,3.1,2.3,2009-02-08,2008/2009,28,E0,0-0,0,0.5,2009-02-08TottenhamArsenal
08/02/09,West Ham,Man United,0,1,A,5.0,3.7,1.55,2009-02-08,2008/2009,28,E0,0-1,-1,3.45,2009-02-08West HamMan United
14/02/09,Portsmouth,Man City,2,0,H,2.6,3.2,2.4,2009-02-14,2008/2009,28,E0,2-0,2,0.20000000000000018,2009-02-14PortsmouthMan City
18/02/09,Man United,Fulham,3,0,H,1.25,5.0,12.5,2009-02-18,2008/2009,28,E0,3-0,3,-11.25,2009-02-18Man UnitedFulham
21/02/09,Arsenal,Sunderland,0,0,D,1.4,4.3,7.5,2009-02-21,2008/2009,28,E0,0-0,0,-6.1,2009-02-21ArsenalSunderland
21/02/09,Aston Villa,Chelsea,0,1,A,3.1,3.1,2.3,2009-02-21,2008/2009,28,E0,0-1,-1,0.8000000000000003,2009-02-21Aston VillaChelsea
21/02/09,Bolton,West Ham,2,1,H,2.25,3.2,3.1,2009-02-21,2008/2009,28,E0,2-1,1,-0.8500000000000001,2009-02-21BoltonWest Ham
21/02/09,Man United,Blackburn,2,1,H,1.25,5.0,12.5,2009-02-21,2008/2009,29,E0,2-1,1,-11.25,2009-02-21Man UnitedBlackburn
21/02/09,Middlesbrough,Wigan,0,0,D,2.3,3.1,3.1,2009-02-21,2008/2009,29,E0,0-0,0,-0.8000000000000003,2009-02-21MiddlesbroughWigan
21/02/09,Stoke,Portsmouth,2,2,D,2.35,3.2,2.95,2009-02-21,2008/2009,29,E0,2-2,0,-0.6000000000000001,2009-02-21StokePortsmouth
22/02/09,Fulham,West Brom,2,0,H,1.8,3.4,4.3,2009-02-22,2008/2009,29,E0,2-0,2,-2.5,2009-02-22FulhamWest Brom
22/02/09,Liverpool,Man City,1,1,D,1.55,3.5,6.7,2009-02-22,2008/2009,29,E0,1-1,0,-5.15,2009-02-22LiverpoolMan City
22/02/09,Newcastle,Everton,0,0,D,2.9,3.2,2.4,2009-02-22,2008/2009,29,E0,0-0,0,0.5,2009-02-22NewcastleEverton
23/02/09,Hull,Tottenham,1,2,A,2.9,3.2,2.4,2009-02-23,2008/2009,29,E0,1-2,-1,0.5,2009-02-23HullTottenham
28/02/09,Arsenal,Fulham,0,0,D,1.43,4.0,7.6,2009-02-28,2008/2009,29,E0,0-0,0,-6.17,2009-02-28ArsenalFulham
28/02/09,Chelsea,Wigan,2,1,H,1.3,4.8,9.5,2009-02-28,2008/2009,29,E0,2-1,1,-8.2,2009-02-28ChelseaWigan
28/02/09,Everton,West Brom,2,0,H,1.5,3.8,6.7,2009-02-28,2008/2009,30,E0,2-0,2,-5.2,2009-02-28EvertonWest Brom
28/02/09,Middlesbrough,Liverpool,2,0,H,4.8,3.4,1.75,2009-02-28,2008/2009,30,E0,2-0,2,3.05,2009-02-28MiddlesbroughLiverpool
01/03/09,Aston Villa,Stoke,2,2,D,1.37,4.4,8.0,2009-03-01,2008/2009,30,E0,2-2,0,-6.63,2009-03-01Aston VillaStoke
01/03/09,Bolton,Newcastle,1,0,H,2.0,3.3,3.6,2009-03-01,2008/2009,30,E0,1-0,1,-1.6,2009-03-01BoltonNewcastle
01/03/09,Hull,Blackburn,1,2,A,2.55,3.3,2.55,2009-03-01,2008/2009,30,E0,1-2,-1,0.0,2009-03-01HullBlackburn
01/03/09,West Ham,Man City,1,0,H,2.3,3.3,2.9,2009-03-01,2008/2009,30,E0,1-0,1,-0.6000000000000001,2009-03-01West HamMan City
03/03/09,Liverpool,Sunderland,2,0,H,1.4,4.0,8.5,2009-03-03,2008/2009,30,E0,2-0,2,-7.1,2009-03-03LiverpoolSunderland
03/03/09,Portsmouth,Chelsea,0,1,A,6.7,3.5,1.55,2009-03-03,2008/2009,30,E0,0-1,-1,5.15,2009-03-03PortsmouthChelsea
03/03/09,West Brom,Arsenal,1,3,A,5.9,3.5,1.6,2009-03-03,2008/2009,30,E0,1-3,-2,4.300000000000001,2009-03-03West BromArsenal
04/03/09,Blackburn,Everton,0,0,D,2.4,3.2,2.85,2009-03-04,2008/2009,31,E0,0-0,0,-0.4500000000000002,2009-03-04BlackburnEverton
04/03/09,Fulham,Hull,0,1,A,1.7,3.5,4.9,2009-03-04,2008/2009,31,E0,0-1,-1,-3.2,2009-03-04FulhamHull
04/03/09,Man City,Aston Villa,2,0,H,2.5,3.1,2.8,2009-03-04,2008/2009,31,E0,2-0,2,-0.2999999999999998,2009-03-04Man CityAston Villa
04/03/09,Newcastle,Man United,1,2,A,6.3,3.6,1.55,2009-03-04,2008/2009,31,E0,1-2,-1,4.75,2009-03-04NewcastleMan United
04/03/09,Stoke,Bolton,2,0,H,2.35,3.2,2.9,2009-03-04,2008/2009,31,E0,2-0,2,-0.5499999999999998,2009-03-04StokeBolton
04/03/09,Tottenham,Middlesbrough,4,0,H,1.75,3.4,4.8,2009-03-04,2008/2009,31,E0,4-0,4,-3.05,2009-03-04TottenhamMiddlesbrough
04/03/09,Wigan,West Ham,0,1,A,2.2,3.2,3.2,2009-03-04,2008/2009,31,E0,0-1,-1,-1.0,2009-03-04WiganWest Ham
07/03/09,Sunderland,Tottenham,1,1,D,2.65,3.1,2.6,2009-03-07,2008/2009,31,E0,1-1,0,0.04999999999999982,2009-03-07SunderlandTottenham
11/03/09,Fulham,Blackburn,1,2,A,2.1,3.25,3.4,2009-03-11,2008/2009,31,E0,1-2,-1,-1.2999999999999998,2009-03-11FulhamBlackburn
14/03/09,Arsenal,Blackburn,4,0,H,1.4,4.3,7.5,2009-03-14,2008/2009,32,E0,4-0,4,-6.1,2009-03-14ArsenalBlackburn
14/03/09,Bolton,Fulham,1,3,A,2.05,3.25,3.5,2009-03-14,2008/2009,32,E0,1-3,-2,-1.4500000000000002,2009-03-14BoltonFulham
14/03/09,Everton,Stoke,3,1,H,1.5,3.8,6.7,2009-03-14,2008/2009,32,E0,3-1,2,-5.2,2009-03-14EvertonStoke
14/03/09,Hull,Newcastle,1,1,D,2.3,3.3,2.9,2009-03-14,2008/2009,32,E0,1-1,0,-0.6000000000000001,2009-03-14HullNewcastle
14/03/09,Man United,Liverpool,1,4,A,1.9,3.25,4.0,2009-03-14,2008/2009,32,E0,1-4,-3,-2.1,2009-03-14Man UnitedLiverpool
14/03/09,Middlesbrough,Portsmouth,1,1,D,2.05,3.25,3.5,2009-03-14,2008/2009,32,E0,1-1,0,-1.4500000000000002,2009-03-14MiddlesbroughPortsmouth
14/03/09,Sunderland,Wigan,1,2,A,2.1,3.25,3.4,2009-03-14,2008/2009,32,E0,1-2,-1,-1.2999999999999998,2009-03-14SunderlandWigan
15/03/09,Aston Villa,Tottenham,1,2,A,2.05,3.25,3.5,2009-03-15,2008/2009,32,E0,1-2,-1,-1.4500000000000002,2009-03-15Aston VillaTottenham
15/03/09,Chelsea,Man City,1,0,H,1.4,4.3,7.5,2009-03-15,2008/2009,32,E0,1-0,1,-6.1,2009-03-15ChelseaMan City
16/03/09,West Ham,West Brom,0,0,D,1.65,3.5,5.3,2009-03-16,2008/2009,33,E0,0-0,0,-3.65,2009-03-16West HamWest Brom
21/03/09,Blackburn,West Ham,1,1,D,2.05,3.25,3.5,2009-03-21,2008/2009,33,E0,1-1,0,-1.4500000000000002,2009-03-21BlackburnWest Ham
21/03/09,Fulham,Man United,2,0,H,6.7,3.8,1.5,2009-03-21,2008/2009,33,E0,2-0,2,5.2,2009-03-21FulhamMan United
21/03/09,Newcastle,Arsenal,1,3,A,4.9,3.5,1.7,2009-03-21,2008/2009,33,E0,1-3,-2,3.2,2009-03-21NewcastleArsenal
21/03/09,Portsmouth,Everton,2,1,H,2.65,3.2,2.55,2009-03-21,2008/2009,33,E0,2-1,1,0.10000000000000009,2009-03-21PortsmouthEverton
21/03/09,Stoke,Middlesbrough,1,0,H,2.2,3.2,3.2,2009-03-21,2008/2009,33,E0,1-0,1,-1.0,2009-03-21StokeMiddlesbrough
21/03/09,Tottenham,Chelsea,1,0,H,3.9,3.3,1.9,2009-03-21,2008/2009,33,E0,1-0,1,2.0,2009-03-21TottenhamChelsea
21/03/09,West Brom,Bolton,1,1,D,2.3,3.2,3.0,2009-03-21,2008/2009,33,E0,1-1,0,-0.7000000000000002,2009-03-21West BromBolton
22/03/09,Liverpool,Aston Villa,5,0,H,1.5,3.8,6.7,2009-03-22,2008/2009,33,E0,5-0,5,-5.2,2009-03-22LiverpoolAston Villa
22/03/09,Man City,Sunderland,1,0,H,1.6,3.6,5.6,2009-03-22,2008/2009,34,E0,1-0,1,-3.9999999999999996,2009-03-22Man CitySunderland
22/03/09,Wigan,Hull,1,0,H,1.75,3.5,4.6,2009-03-22,2008/2009,34,E0,1-0,1,-2.8499999999999996,2009-03-22WiganHull
04/04/09,Arsenal,Man City,2,0,H,1.5,3.8,6.7,2009-04-04,2008/2009,34,E0,2-0,2,-5.2,2009-04-04ArsenalMan City
04/04/09,Blackburn,Tottenham,2,1,H,2.6,3.2,2.6,2009-04-04,2008/2009,34,E0,2-1,1,0.0,2009-04-04BlackburnTottenham
04/04/09,Bolton,Middlesbrough,4,1,H,2.0,3.3,3.6,2009-04-04,2008/2009,34,E0,4-1,3,-1.6,2009-04-04BoltonMiddlesbrough
04/04/09,Fulham,Liverpool,0,1,A,6.0,3.7,1.55,2009-04-04,2008/2009,34,E0,0-1,-1,4.45,2009-04-04FulhamLiverpool
04/04/09,Hull,Portsmouth,0,0,D,2.5,3.2,2.75,2009-04-04,2008/2009,34,E0,0-0,0,-0.25,2009-04-04HullPortsmouth
04/04/09,Newcastle,Chelsea,0,2,A,5.3,3.5,1.65,2009-04-04,2008/2009,34,E0,0-2,-2,3.65,2009-04-04NewcastleChelsea
04/04/09,West Brom,Stoke,0,2,A,2.2,3.2,3.2,2009-04-04,2008/2009,34,E0,0-2,-2,-1.0,2009-04-04West BromStoke
04/04/09,West Ham,Sunderland,2,0,H,1.9,3.3,3.9,2009-04-04,2008/2009,35,E0,2-0,2,-2.0,2009-04-04West HamSunderland
05/04/09,Everton,Wigan,4,0,H,1.75,3.5,4.6,2009-04-05,2008/2009,35,E0,4-0,4,-2.8499999999999996,2009-04-05EvertonWigan
05/04/09,Man United,Aston Villa,3,2,H,1.37,4.4,8.0,2009-04-05,2008/2009,35,E0,3-2,1,-6.63,2009-04-05Man UnitedAston Villa
11/04/09,Chelsea,Bolton,4,3,H,1.27,4.9,11.0,2009-04-11,2008/2009,35,E0,4-3,1,-9.73,2009-04-11ChelseaBolton
11/04/09,Liverpool,Blackburn,4,0,H,1.3,4.8,9.5,2009-04-11,2008/2009,35,E0,4-0,4,-8.2,2009-04-11LiverpoolBlackburn
11/04/09,Middlesbrough,Hull,3,1,H,2.0,3.3,3.6,2009-04-11,2008/2009,35,E0,3-1,2,-1.6,2009-04-11MiddlesbroughHull
11/04/09,Portsmouth,West Brom,2,2,D,1.75,3.5,4.6,2009-04-11,2008/2009,35,E0,2-2,0,-2.8499999999999996,2009-04-11PortsmouthWest Brom
11/04/09,Stoke,Newcastle,1,1,D,2.4,3.2,2.85,2009-04-11,2008/2009,35,E0,1-1,0,-0.4500000000000002,2009-04-11StokeNewcastle
11/04/09,Sunderland,Man United,1,2,A,7.0,4.0,1.45,2009-04-11,2008/2009,35,E0,1-2,-1,5.55,2009-04-11SunderlandMan United
11/04/09,Tottenham,West Ham,1,0,H,1.75,3.5,4.6,2009-04-11,2008/2009,36,E0,1-0,1,-2.8499999999999996,2009-04-11TottenhamWest Ham
11/04/09,Wigan,Arsenal,1,4,A,4.6,3.5,1.75,2009-04-11,2008/2009,36,E0,1-4,-3,2.8499999999999996,2009-04-11WiganArsenal
12/04/09,Aston Villa,Everton,3,3,D,2.0,3.3,3.6,2009-04-12,2008/2009,36,E0,3-3,0,-1.6,2009-04-12Aston VillaEverton
12/04/09,Man City,Fulham,1,3,A,1.85,3.4,4.0,2009-04-12,2008/2009,36,E0,1-3,-2,-2.15,2009-04-12Man CityFulham
18/04/09,Aston Villa,West Ham,1,1,D,1.7,3.5,4.9,2009-04-18,2008/2009,36,E0,1-1,0,-3.2,2009-04-18Aston VillaWest Ham
18/04/09,Middlesbrough,Fulham,0,0,D,2.1,3.3,3.35,2009-04-18,2008/2009,36,E0,0-0,0,-1.25,2009-04-18MiddlesbroughFulham
18/04/09,Portsmouth,Bolton,1,0,H,1.9,3.3,3.9,2009-04-18,2008/2009,36,E0,1-0,1,-2.0,2009-04-18PortsmouthBolton
18/04/09,Stoke,Blackburn,1,0,H,2.3,3.2,3.0,2009-04-18,2008/2009,36,E0,1-0,1,-0.7000000000000002,2009-04-18StokeBlackburn
18/04/09,Sunderland,Hull,1,0,H,1.9,3.3,3.9,2009-04-18,2008/2009,36,E0,1-0,1,-2.0,2009-04-18SunderlandHull
19/04/09,Man City,West Brom,4,2,H,1.65,3.5,5.3,2009-04-19,2008/2009,37,E0,4-2,2,-3.65,2009-04-19Man CityWest Brom
19/04/09,Tottenham,Newcastle,1,0,H,1.6,3.6,5.6,2009-04-19,2008/2009,37,E0,1-0,1,-3.9999999999999996,2009-04-19TottenhamNewcastle
21/04/09,Liverpool,Arsenal,4,4,D,1.8,3.4,4.3,2009-04-21,2008/2009,37,E0,4-4,0,-2.5,2009-04-21LiverpoolArsenal
22/04/09,Chelsea,Everton,0,0,D,1.4,4.3,7.5,2009-04-22,2008/2009,37,E0,0-0,0,-6.1,2009-04-22ChelseaEverton
22/04/09,Man United,Portsmouth,2,0,H,1.25,5.0,12.0,2009-04-22,2008/2009,37,E0,2-0,2,-10.75,2009-04-22Man UnitedPortsmouth
25/04/09,Bolton,Aston Villa,1,1,D,2.8,3.1,2.5,2009-04-25,2008/2009,37,E0,1-1,0,0.2999999999999998,2009-04-25BoltonAston Villa
25/04/09,Everton,Man City,1,2,A,1.8,3.4,4.3,2009-04-25,2008/2009,37,E0,1-2,-1,-2.5,2009-04-25EvertonMan City
25/04/09,Fulham,Stoke,1,0,H,1.8,3.25,4.5,2009-04-25,2008/2009,37,E0,1-0,1,-2.7,2009-04-25FulhamStoke
25/04/09,Hull,Liverpool,1,3,A,7.6,4.0,1.43,2009-04-25,2008/2009,37,E0,1-3,-2,6.17,2009-04-25HullLiverpool
25/04/09,Man United,Tottenham,5,2,H,1.43,4.0,7.6,2009-04-25,2008/2009,38,E0,5-2,3,-6.17,2009-04-25Man UnitedTottenham
25/04/09,West Brom,Sunderland,3,0,H,2.5,3.1,2.8,2009-04-25,2008/2009,38,E0,3-0,3,-0.2999999999999998,2009-04-25West BromSunderland
25/04/09,West Ham,Chelsea,0,1,A,4.8,3.4,1.75,2009-04-25,2008/2009,38,E0,0-1,-1,3.05,2009-04-25West HamChelsea
26/04/09,Arsenal,Middlesbrough,2,0,H,1.45,4.0,7.0,2009-04-26,2008/2009,38,E0,2-0,2,-5.55,2009-04-26ArsenalMiddlesbrough
26/04/09,Blackburn,Wigan,2,0,H,1.85,3.4,4.0,2009-04-26,2008/2009,38,E0,2-0,2,-2.15,2009-04-26BlackburnWigan
27/04/09,Newcastle,Portsmouth,0,0,D,2.0,3.3,3.6,2009-04-27,2008/2009,38,E0,0-0,0,-1.6,2009-04-27NewcastlePortsmouth
02/05/09,Chelsea,Fulham,3,1,H,1.45,4.0,7.0,2009-05-02,2008/2009,38,E0,3-1,2,-5.55,2009-05-02ChelseaFulham
02/05/09,Man City,Blackburn,3,1,H,1.8,3.4,4.3,2009-05-02,2008/2009,38,E0,3-1,2,-2.5,2009-05-02Man CityBlackburn
02/05/09,Middlesbrough,Man United,0,2,A,6.7,3.8,1.5,2009-05-02,2008/2009,38,E0,0-2,-2,5.2,2009-05-02MiddlesbroughMan United
02/05/09,Portsmouth,Arsenal,0,3,A,3.3,3.2,2.15,2009-05-02,2008/2009,39,E0,0-3,-3,1.15,2009-05-02PortsmouthArsenal
02/05/09,Stoke,West Ham,0,1,A,2.45,3.2,2.8,2009-05-02,2008/2009,39,E0,0-1,-1,-0.34999999999999964,2009-05-02StokeWest Ham
02/05/09,Tottenham,West Brom,1,0,H,1.45,4.0,7.0,2009-05-02,2008/2009,39,E0,1-0,1,-5.55,2009-05-02TottenhamWest Brom
02/05/09,Wigan,Bolton,0,0,D,2.1,3.25,3.4,2009-05-02,2008/2009,39,E0,0-0,0,-1.2999999999999998,2009-05-02WiganBolton
03/05/09,Liverpool,Newcastle,3,0,H,1.27,5.0,10.5,2009-05-03,2008/2009,39,E0,3-0,3,-9.23,2009-05-03LiverpoolNewcastle
03/05/09,Sunderland,Everton,0,2,A,2.3,3.2,3.0,2009-05-03,2008/2009,39,E0,0-2,-2,-0.7000000000000002,2009-05-03SunderlandEverton
04/05/09,Aston Villa,Hull,1,0,H,1.6,3.6,5.6,2009-05-04,2008/2009,39,E0,1-0,1,-3.9999999999999996,2009-05-04Aston VillaHull
09/05/09,Blackburn,Portsmouth,2,0,H,2.0,3.1,3.9,2009-05-09,2008/2009,39,E0,2-0,2,-1.9,2009-05-09BlackburnPortsmouth
09/05/09,Bolton,Sunderland,0,0,D,2.1,3.3,3.35,2009-05-09,2008/2009,39,E0,0-0,0,-1.25,2009-05-09BoltonSunderland
09/05/09,Everton,Tottenham,0,0,D,2.3,3.3,2.9,2009-05-09,2008/2009,40,E0,0-0,0,-0.6000000000000001,2009-05-09EvertonTottenham
09/05/09,Fulham,Aston Villa,3,1,H,2.5,3.2,2.75,2009-05-09,2008/2009,40,E0,3-1,2,-0.25,2009-05-09FulhamAston Villa
09/05/09,Hull,Stoke,1,2,A,2.1,3.3,3.35,2009-05-09,2008/2009,40,E0,1-2,-1,-1.25,2009-05-09HullStoke
09/05/09,West Brom,Wigan,3,1,H,2.3,3.3,2.9,2009-05-09,2008/2009,40,E0,3-1,2,-0.6000000000000001,2009-05-09West BromWigan
09/05/09,West Ham,Liverpool,0,3,A,6.7,3.8,1.5,2009-05-09,2008/2009,40,E0,0-3,-3,5.2,2009-05-09West HamLiverpool
10/05/09,Arsenal,Chelsea,1,4,A,2.5,3.1,2.8,2009-05-10,2008/2009,40,E0,1-4,-3,-0.2999999999999998,2009-05-10ArsenalChelsea
10/05/09,Man United,Man City,2,0,H,1.37,4.4,8.0,2009-05-10,2008/2009,40,E0,2-0,2,-6.63,2009-05-10Man UnitedMan City
11/05/09,Newcastle,Middlesbrough,3,1,H,1.9,3.3,3.9,2009-05-11,2008/2009,40,E0,3-1,2,-2.0,2009-05-11NewcastleMiddlesbrough
13/05/09,Wigan,Man United,1,2,A,8.5,4.5,1.35,2009-05-13,2008/2009,40,E0,1-2,-1,7.15,2009-05-13WiganMan United
16/05/09,Bolton,Hull,1,1,D,2.1,3.4,3.0,2009-05-16,2008/2009,41,E0,1-1,0,-0.8999999999999999,2009-05-16BoltonHull
16/05/09,Everton,West Ham,3,1,H,1.8,3.4,4.3,2009-05-16,2008/2009,41,E0,3-1,2,-2.5,2009-05-16EvertonWest Ham
16/05/09,Man United,Arsenal,0,0,D,1.65,3.5,5.3,2009-05-16,2008/2009,41,E0,0-0,0,-3.65,2009-05-16Man UnitedArsenal
16/05/09,Middlesbrough,Aston Villa,1,1,D,2.4,3.4,2.7,2009-05-16,2008/2009,41,E0,1-1,0,-0.30000000000000027,2009-05-16MiddlesbroughAston Villa
16/05/09,Newcastle,Fulham,0,1,A,1.9,3.3,3.9,2009-05-16,2008/2009,41,E0,0-1,-1,-2.0,2009-05-16NewcastleFulham
16/05/09,Stoke,Wigan,2,0,H,2.1,3.25,3.4,2009-05-16,2008/2009,41,E0,2-0,2,-1.2999999999999998,2009-05-16StokeWigan
16/05/09,Tottenham,Man City,2,1,H,1.8,3.4,4.3,2009-05-16,2008/2009,41,E0,2-1,1,-2.5,2009-05-16TottenhamMan City
17/05/09,Chelsea,Blackburn,2,0,H,1.37,4.4,8.0,2009-05-17,2008/2009,41,E0,2-0,2,-6.63,2009-05-17ChelseaBlackburn
17/05/09,West Brom,Liverpool,0,2,A,8.5,4.5,1.35,2009-05-17,2008/2009,41,E0,0-2,-2,7.15,2009-05-17West BromLiverpool
24/05/09,Arsenal,Stoke,4,1,H,1.3,4.8,9.5,2009-05-24,2008/2009,42,E0,4-1,3,-8.2,2009-05-24ArsenalStoke
24/05/09,Aston Villa,Newcastle,1,0,H,2.3,3.5,2.6,2009-05-24,2008/2009,42,E0,1-0,1,-0.30000000000000027,2009-05-24Aston VillaNewcastle
24/05/09,Blackburn,West Brom,0,0,D,1.8,3.4,4.3,2009-05-24,2008/2009,42,E0,0-0,0,-2.5,2009-05-24BlackburnWest Brom
24/05/09,Fulham,Everton,0,2,A,2.1,3.4,3.25,2009-05-24,2008/2009,42,E0,0-2,-2,-1.15,2009-05-24FulhamEverton
24/05/09,Hull,Man United,0,1,A,2.8,3.4,2.3,2009-05-24,2008/2009,42,E0,0-1,-1,0.5,2009-05-24HullMan United
24/05/09,Liverpool,Tottenham,3,1,H,1.6,3.7,5.3,2009-05-24,2008/2009,42,E0,3-1,2,-3.6999999999999997,2009-05-24LiverpoolTottenham
24/05/09,Man City,Bolton,1,0,H,1.8,3.4,4.3,2009-05-24,2008/2009,42,E0,1-0,1,-2.5,2009-05-24Man CityBolton
24/05/09,Sunderland,Chelsea,2,3,A,3.3,3.6,2.0,2009-05-24,2008/2009,42,E0,2-3,-1,1.2999999999999998,2009-05-24SunderlandChelsea
24/05/09,West Ham,Middlesbrough,2,1,H,2.2,3.5,2.9,2009-05-24,2008/2009,42,E0,2-1,1,-0.6999999999999997,2009-05-24West HamMiddlesbrough
