Date,HomeTeam,AwayTeam,FTHG,FTAG,FTR,IWH,IWD,IWA,datetime,season,game_day,league,result,goal_diff,odds_diff,game_id
09/08/2019,Liverpool,Norwich,4,1,H,1.15,8.0,18.0,2019-08-09,2019/2020,1,E0,4-1,3,-16.85,2019-08-09LiverpoolNorwich
10/08/2019,West Ham,Man City,0,5,A,11.0,6.1,1.25,2019-08-10,2019/2020,1,E0,0-5,-5,9.75,2019-08-10West HamMan City
10/08/2019,Bournemouth,Sheffield United,1,1,D,1.97,3.55,3.8,2019-08-10,2019/2020,1,E0,1-1,0,-1.8299999999999998,2019-08-10BournemouthSheffield United
10/08/2019,Burnley,Southampton,3,0,H,2.65,3.2,2.75,2019-08-10,2019/2020,1,E0,3-0,3,-0.10000000000000009,2019-08-10BurnleySouthampton
10/08/2019,Crystal Palace,Everton,0,0,D,3.1,3.2,2.4,2019-08-10,2019/2020,1,E0,0-0,0,0.7000000000000002,2019-08-10Crystal PalaceEverton
10/08/2019,Watford,Brighton,0,3,A,1.93,3.4,4.25,2019-08-10,2019/2020,1,E0,0-3,-3,-2.3200000000000003,2019-08-10WatfordBrighton
10/08/2019,Tottenham,Aston Villa,3,1,H,1.3,5.5,9.6,2019-08-10,2019/2020,1,E0,3-1,2,-8.299999999999999,2019-08-10TottenhamAston Villa
11/08/2019,Leicester,Wolves,0,0,D,2.2,3.25,3.45,2019-08-11,2019/2020,1,E0,0-0,0,-1.25,2019-08-11LeicesterWolves
11/08/2019,Newcastle,Arsenal,0,1,A,4.4,3.85,1.77,2019-08-11,2019/2020,1,E0,0-1,-1,2.6300000000000003,2019-08-11NewcastleArsenal
11/08/2019,Man United,Chelsea,4,0,H,2.15,3.35,3.4,2019-08-11,2019/2020,2,E0,4-0,4,-1.25,2019-08-11Man UnitedChelsea
17/08/2019,Arsenal,Burnley,2,1,H,1.3,5.6,9.5,2019-08-17,2019/2020,2,E0,2-1,1,-8.2,2019-08-17ArsenalBurnley
17/08/2019,Aston Villa,Bournemouth,1,2,A,2.3,3.45,3.05,2019-08-17,2019/2020,2,E0,1-2,-1,-0.75,2019-08-17Aston VillaBournemouth
17/08/2019,Brighton,West Ham,1,1,D,2.5,3.3,2.85,2019-08-17,2019/2020,2,E0,1-1,0,-0.3500000000000001,2019-08-17BrightonWest Ham
17/08/2019,Everton,Watford,1,0,H,1.7,3.9,4.65,2019-08-17,2019/2020,2,E0,1-0,1,-2.95,2019-08-17EvertonWatford
17/08/2019,Norwich,Newcastle,3,1,H,2.2,3.35,3.35,2019-08-17,2019/2020,2,E0,3-1,2,-1.15,2019-08-17NorwichNewcastle
17/08/2019,Southampton,Liverpool,1,2,A,7.5,4.8,1.4,2019-08-17,2019/2020,2,E0,1-2,-1,6.1,2019-08-17SouthamptonLiverpool
17/08/2019,Man City,Tottenham,2,2,D,1.35,5.3,8.0,2019-08-17,2019/2020,2,E0,2-2,0,-6.65,2019-08-17Man CityTottenham
18/08/2019,Sheffield United,Crystal Palace,1,0,H,2.55,3.1,2.95,2019-08-18,2019/2020,2,E0,1-0,1,-0.40000000000000036,2019-08-18Sheffield UnitedCrystal Palace
18/08/2019,Chelsea,Leicester,1,1,D,1.73,3.75,4.9,2019-08-18,2019/2020,3,E0,1-1,0,-3.1700000000000004,2019-08-18ChelseaLeicester
19/08/2019,Wolves,Man United,1,1,D,3.25,3.3,2.25,2019-08-19,2019/2020,3,E0,1-1,0,1.0,2019-08-19WolvesMan United
23/08/2019,Aston Villa,Everton,2,0,H,3.1,3.5,2.25,2019-08-23,2019/2020,3,E0,2-0,2,0.8500000000000001,2019-08-23Aston VillaEverton
24/08/2019,Norwich,Chelsea,2,3,A,4.05,3.95,1.8,2019-08-24,2019/2020,3,E0,2-3,-1,2.25,2019-08-24NorwichChelsea
24/08/2019,Brighton,Southampton,0,2,A,2.4,3.25,3.05,2019-08-24,2019/2020,3,E0,0-2,-2,-0.6499999999999999,2019-08-24BrightonSouthampton
24/08/2019,Man United,Crystal Palace,1,2,A,1.36,4.95,8.6,2019-08-24,2019/2020,3,E0,1-2,-1,-7.239999999999999,2019-08-24Man UnitedCrystal Palace
24/08/2019,Sheffield United,Leicester,1,2,A,3.4,3.15,2.25,2019-08-24,2019/2020,3,E0,1-2,-1,1.15,2019-08-24Sheffield UnitedLeicester
24/08/2019,Watford,West Ham,1,3,A,2.1,3.6,3.4,2019-08-24,2019/2020,3,E0,1-3,-2,-1.2999999999999998,2019-08-24WatfordWest Ham
24/08/2019,Liverpool,Arsenal,3,1,H,1.5,4.7,5.7,2019-08-24,2019/2020,3,E0,3-1,2,-4.2,2019-08-24LiverpoolArsenal
25/08/2019,Bournemouth,Man City,1,3,A,15.0,6.5,1.2,2019-08-25,2019/2020,4,E0,1-3,-2,13.8,2019-08-25BournemouthMan City
25/08/2019,Tottenham,Newcastle,0,1,A,1.22,6.2,13.5,2019-08-25,2019/2020,4,E0,0-1,-1,-12.28,2019-08-25TottenhamNewcastle
25/08/2019,Wolves,Burnley,1,1,D,1.85,3.4,4.7,2019-08-25,2019/2020,4,E0,1-1,0,-2.85,2019-08-25WolvesBurnley
31/08/2019,Southampton,Man United,1,1,D,3.65,3.35,2.1,2019-08-31,2019/2020,4,E0,1-1,0,1.5499999999999998,2019-08-31SouthamptonMan United
31/08/2019,Chelsea,Sheffield United,2,2,D,1.35,5.3,8.0,2019-08-31,2019/2020,4,E0,2-2,0,-6.65,2019-08-31ChelseaSheffield United
31/08/2019,Crystal Palace,Aston Villa,1,0,H,2.2,3.4,3.35,2019-08-31,2019/2020,4,E0,1-0,1,-1.15,2019-08-31Crystal PalaceAston Villa
31/08/2019,Leicester,Bournemouth,3,1,H,1.73,4.05,4.5,2019-08-31,2019/2020,4,E0,3-1,2,-2.77,2019-08-31LeicesterBournemouth
31/08/2019,Man City,Brighton,4,0,H,1.08,10.5,29.0,2019-08-31,2019/2020,4,E0,4-0,4,-27.92,2019-08-31Man CityBrighton
31/08/2019,Newcastle,Watford,1,1,D,2.6,3.25,2.8,2019-08-31,2019/2020,4,E0,1-1,0,-0.19999999999999973,2019-08-31NewcastleWatford
31/08/2019,West Ham,Norwich,2,0,H,1.87,3.95,3.75,2019-08-31,2019/2020,5,E0,2-0,2,-1.88,2019-08-31West HamNorwich
31/08/2019,Burnley,Liverpool,0,3,A,8.4,5.5,1.33,2019-08-31,2019/2020,5,E0,0-3,-3,7.07,2019-08-31BurnleyLiverpool
01/09/2019,Everton,Wolves,3,2,H,2.1,3.25,3.65,2019-09-01,2019/2020,5,E0,3-2,1,-1.5499999999999998,2019-09-01EvertonWolves
01/09/2019,Arsenal,Tottenham,2,2,D,2.35,3.6,2.85,2019-09-01,2019/2020,5,E0,2-2,0,-0.5,2019-09-01ArsenalTottenham
14/09/2019,Liverpool,Newcastle,3,1,H,1.15,8.0,17.5,2019-09-14,2019/2020,5,E0,3-1,2,-16.35,2019-09-14LiverpoolNewcastle
14/09/2019,Brighton,Burnley,1,1,D,2.1,3.35,3.55,2019-09-14,2019/2020,5,E0,1-1,0,-1.4499999999999997,2019-09-14BrightonBurnley
14/09/2019,Man United,Leicester,1,0,H,1.8,3.6,4.5,2019-09-14,2019/2020,5,E0,1-0,1,-2.7,2019-09-14Man UnitedLeicester
14/09/2019,Sheffield United,Southampton,0,1,A,2.45,3.2,3.05,2019-09-14,2019/2020,5,E0,0-1,-1,-0.5999999999999996,2019-09-14Sheffield UnitedSouthampton
14/09/2019,Tottenham,Crystal Palace,4,0,H,1.45,4.6,6.8,2019-09-14,2019/2020,5,E0,4-0,4,-5.35,2019-09-14TottenhamCrystal Palace
14/09/2019,Wolves,Chelsea,2,5,A,2.95,3.35,2.4,2019-09-14,2019/2020,6,E0,2-5,-3,0.5500000000000003,2019-09-14WolvesChelsea
14/09/2019,Norwich,Man City,3,2,H,15.0,8.5,1.15,2019-09-14,2019/2020,6,E0,3-2,1,13.85,2019-09-14NorwichMan City
15/09/2019,Bournemouth,Everton,3,1,H,2.95,3.5,2.3,2019-09-15,2019/2020,6,E0,3-1,2,0.6500000000000004,2019-09-15BournemouthEverton
15/09/2019,Watford,Arsenal,2,2,D,3.9,3.7,1.9,2019-09-15,2019/2020,6,E0,2-2,0,2.0,2019-09-15WatfordArsenal
16/09/2019,Aston Villa,West Ham,0,0,D,2.6,3.6,2.55,2019-09-16,2019/2020,6,E0,0-0,0,0.050000000000000266,2019-09-16Aston VillaWest Ham
20/09/2019,Southampton,Bournemouth,1,3,A,2.1,3.6,3.4,2019-09-20,2019/2020,6,E0,1-3,-2,-1.2999999999999998,2019-09-20SouthamptonBournemouth
21/09/2019,Leicester,Tottenham,2,1,H,2.85,3.45,2.4,2019-09-21,2019/2020,6,E0,2-1,1,0.4500000000000002,2019-09-21LeicesterTottenham
21/09/2019,Burnley,Norwich,2,0,H,2.0,3.6,3.6,2019-09-21,2019/2020,6,E0,2-0,2,-1.6,2019-09-21BurnleyNorwich
21/09/2019,Everton,Sheffield United,0,2,A,1.67,3.75,5.3,2019-09-21,2019/2020,6,E0,0-2,-2,-3.63,2019-09-21EvertonSheffield United
21/09/2019,Man City,Watford,8,0,H,1.12,9.0,20.0,2019-09-21,2019/2020,7,E0,8-0,8,-18.88,2019-09-21Man CityWatford
21/09/2019,Newcastle,Brighton,0,0,D,2.5,3.1,3.05,2019-09-21,2019/2020,7,E0,0-0,0,-0.5499999999999998,2019-09-21NewcastleBrighton
22/09/2019,Crystal Palace,Wolves,1,1,D,2.6,3.1,2.9,2019-09-22,2019/2020,7,E0,1-1,0,-0.2999999999999998,2019-09-22Crystal PalaceWolves
22/09/2019,West Ham,Man United,2,0,H,3.4,3.5,2.1,2019-09-22,2019/2020,7,E0,2-0,2,1.2999999999999998,2019-09-22West HamMan United
22/09/2019,Arsenal,Aston Villa,3,2,H,1.4,4.8,7.5,2019-09-22,2019/2020,7,E0,3-2,1,-6.1,2019-09-22ArsenalAston Villa
22/09/2019,Chelsea,Liverpool,1,2,A,3.4,3.5,2.1,2019-09-22,2019/2020,7,E0,1-2,-1,1.2999999999999998,2019-09-22ChelseaLiverpool
28/09/2019,Sheffield United,Liverpool,0,1,A,8.1,5.1,1.36,2019-09-28,2019/2020,7,E0,0-1,-1,6.739999999999999,2019-09-28Sheffield UnitedLiverpool
28/09/2019,Aston Villa,Burnley,2,2,D,2.35,3.35,3.0,2019-09-28,2019/2020,7,E0,2-2,0,-0.6499999999999999,2019-09-28Aston VillaBurnley
28/09/2019,Bournemouth,West Ham,2,2,D,2.4,3.6,2.75,2019-09-28,2019/2020,7,E0,2-2,0,-0.3500000000000001,2019-09-28BournemouthWest Ham
28/09/2019,Chelsea,Brighton,2,0,H,1.45,4.65,6.8,2019-09-28,2019/2020,8,E0,2-0,2,-5.35,2019-09-28ChelseaBrighton
28/09/2019,Crystal Palace,Norwich,2,0,H,1.9,3.75,3.85,2019-09-28,2019/2020,8,E0,2-0,2,-1.9500000000000002,2019-09-28Crystal PalaceNorwich
28/09/2019,Tottenham,Southampton,2,1,H,1.45,4.7,6.7,2019-09-28,2019/2020,8,E0,2-1,1,-5.25,2019-09-28TottenhamSouthampton
28/09/2019,Wolves,Watford,2,0,H,1.87,3.4,4.5,2019-09-28,2019/2020,8,E0,2-0,2,-2.63,2019-09-28WolvesWatford
28/09/2019,Everton,Man City,1,3,A,9.6,5.5,1.3,2019-09-28,2019/2020,8,E0,1-3,-2,8.299999999999999,2019-09-28EvertonMan City
29/09/2019,Leicester,Newcastle,5,0,H,1.53,4.0,6.7,2019-09-29,2019/2020,8,E0,5-0,5,-5.17,2019-09-29LeicesterNewcastle
30/09/2019,Man United,Arsenal,1,1,D,2.35,3.6,2.9,2019-09-30,2019/2020,8,E0,1-1,0,-0.5499999999999998,2019-09-30Man UnitedArsenal
05/10/2019,Brighton,Tottenham,3,0,H,3.8,3.6,1.95,2019-10-05,2019/2020,8,E0,3-0,3,1.8499999999999999,2019-10-05BrightonTottenham
05/10/2019,Burnley,Everton,1,0,H,2.9,3.25,2.5,2019-10-05,2019/2020,8,E0,1-0,1,0.3999999999999999,2019-10-05BurnleyEverton
05/10/2019,Liverpool,Leicester,2,1,H,1.47,4.6,6.5,2019-10-05,2019/2020,9,E0,2-1,1,-5.03,2019-10-05LiverpoolLeicester
05/10/2019,Norwich,Aston Villa,1,5,A,2.35,3.65,2.8,2019-10-05,2019/2020,9,E0,1-5,-4,-0.44999999999999973,2019-10-05NorwichAston Villa
05/10/2019,Watford,Sheffield United,0,0,D,2.1,3.4,3.5,2019-10-05,2019/2020,9,E0,0-0,0,-1.4,2019-10-05WatfordSheffield United
05/10/2019,West Ham,Crystal Palace,1,2,A,2.0,3.55,3.7,2019-10-05,2019/2020,9,E0,1-2,-1,-1.7000000000000002,2019-10-05West HamCrystal Palace
06/10/2019,Arsenal,Bournemouth,1,0,H,1.46,5.0,6.0,2019-10-06,2019/2020,9,E0,1-0,1,-4.54,2019-10-06ArsenalBournemouth
06/10/2019,Man City,Wolves,0,2,A,1.13,9.0,18.0,2019-10-06,2019/2020,9,E0,0-2,-2,-16.87,2019-10-06Man CityWolves
06/10/2019,Southampton,Chelsea,1,4,A,3.95,3.8,1.87,2019-10-06,2019/2020,9,E0,1-4,-3,2.08,2019-10-06SouthamptonChelsea
06/10/2019,Newcastle,Man United,1,0,H,4.35,3.4,1.9,2019-10-06,2019/2020,9,E0,1-0,1,2.4499999999999997,2019-10-06NewcastleMan United
19/10/2019,Everton,West Ham,2,0,H,1.97,3.65,3.7,2019-10-19,2019/2020,9,E0,2-0,2,-1.7300000000000002,2019-10-19EvertonWest Ham
19/10/2019,Aston Villa,Brighton,2,1,H,2.35,3.4,3.0,2019-10-19,2019/2020,10,E0,2-1,1,-0.6499999999999999,2019-10-19Aston VillaBrighton
19/10/2019,Bournemouth,Norwich,0,0,D,1.75,4.0,4.3,2019-10-19,2019/2020,10,E0,0-0,0,-2.55,2019-10-19BournemouthNorwich
19/10/2019,Chelsea,Newcastle,1,0,H,1.3,5.5,9.6,2019-10-19,2019/2020,10,E0,1-0,1,-8.299999999999999,2019-10-19ChelseaNewcastle
19/10/2019,Leicester,Burnley,2,1,H,1.57,4.05,6.1,2019-10-19,2019/2020,10,E0,2-1,1,-4.529999999999999,2019-10-19LeicesterBurnley
19/10/2019,Tottenham,Watford,1,1,D,1.45,4.5,7.0,2019-10-19,2019/2020,10,E0,1-1,0,-5.55,2019-10-19TottenhamWatford
19/10/2019,Wolves,Southampton,1,1,D,1.85,3.5,4.4,2019-10-19,2019/2020,10,E0,1-1,0,-2.5500000000000003,2019-10-19WolvesSouthampton
19/10/2019,Crystal Palace,Man City,0,2,A,10.0,6.5,1.25,2019-10-19,2019/2020,10,E0,0-2,-2,8.75,2019-10-19Crystal PalaceMan City
20/10/2019,Man United,Liverpool,1,1,D,4.8,3.95,1.7,2019-10-20,2019/2020,10,E0,1-1,0,3.0999999999999996,2019-10-20Man UnitedLiverpool
21/10/2019,Sheffield United,Arsenal,1,0,H,3.9,3.75,1.9,2019-10-21,2019/2020,10,E0,1-0,1,2.0,2019-10-21Sheffield UnitedArsenal
25/10/2019,Southampton,Leicester,0,9,A,3.15,3.3,2.3,2019-10-25,2019/2020,11,E0,0-9,-9,0.8500000000000001,2019-10-25SouthamptonLeicester
26/10/2019,Man City,Aston Villa,3,0,H,1.09,11.0,26.0,2019-10-26,2019/2020,11,E0,3-0,3,-24.91,2019-10-26Man CityAston Villa
26/10/2019,Brighton,Everton,3,2,H,2.85,3.25,2.55,2019-10-26,2019/2020,11,E0,3-2,1,0.30000000000000027,2019-10-26BrightonEverton
26/10/2019,Watford,Bournemouth,0,0,D,2.2,3.55,3.25,2019-10-26,2019/2020,11,E0,0-0,0,-1.0499999999999998,2019-10-26WatfordBournemouth
26/10/2019,West Ham,Sheffield United,1,1,D,2.1,3.45,3.6,2019-10-26,2019/2020,11,E0,1-1,0,-1.5,2019-10-26West HamSheffield United
26/10/2019,Burnley,Chelsea,2,4,A,4.5,3.95,1.73,2019-10-26,2019/2020,11,E0,2-4,-2,2.77,2019-10-26BurnleyChelsea
27/10/2019,Newcastle,Wolves,1,1,D,3.0,3.0,2.55,2019-10-27,2019/2020,11,E0,1-1,0,0.4500000000000002,2019-10-27NewcastleWolves
27/10/2019,Arsenal,Crystal Palace,2,2,D,1.5,4.6,6.1,2019-10-27,2019/2020,11,E0,2-2,0,-4.6,2019-10-27ArsenalCrystal Palace
27/10/2019,Liverpool,Tottenham,2,1,H,1.55,4.4,5.8,2019-10-27,2019/2020,11,E0,2-1,1,-4.25,2019-10-27LiverpoolTottenham
27/10/2019,Norwich,Man United,1,3,A,4.25,3.85,1.8,2019-10-27,2019/2020,12,E0,1-3,-2,2.45,2019-10-27NorwichMan United
02/11/2019,Bournemouth,Man United,1,0,H,3.3,3.5,2.15,2019-11-02,2019/2020,12,E0,1-0,1,1.15,2019-11-02BournemouthMan United
02/11/2019,Arsenal,Wolves,1,1,D,1.77,3.8,4.4,2019-11-02,2019/2020,12,E0,1-1,0,-2.6300000000000003,2019-11-02ArsenalWolves
02/11/2019,Aston Villa,Liverpool,1,2,A,7.9,5.3,1.36,2019-11-02,2019/2020,12,E0,1-2,-1,6.54,2019-11-02Aston VillaLiverpool
02/11/2019,Brighton,Norwich,2,0,H,1.7,4.05,4.6,2019-11-02,2019/2020,12,E0,2-0,2,-2.8999999999999995,2019-11-02BrightonNorwich
02/11/2019,Man City,Southampton,2,1,H,1.08,11.0,27.0,2019-11-02,2019/2020,12,E0,2-1,1,-25.92,2019-11-02Man CitySouthampton
02/11/2019,Sheffield United,Burnley,3,0,H,2.25,3.15,3.45,2019-11-02,2019/2020,12,E0,3-0,3,-1.2000000000000002,2019-11-02Sheffield UnitedBurnley
02/11/2019,West Ham,Newcastle,2,3,A,1.77,3.7,4.6,2019-11-02,2019/2020,12,E0,2-3,-1,-2.8299999999999996,2019-11-02West HamNewcastle
02/11/2019,Watford,Chelsea,1,2,A,4.9,4.2,1.65,2019-11-02,2019/2020,12,E0,1-2,-1,3.2500000000000004,2019-11-02WatfordChelsea
03/11/2019,Crystal Palace,Leicester,0,2,A,3.45,3.4,2.15,2019-11-03,2019/2020,13,E0,0-2,-2,1.3000000000000003,2019-11-03Crystal PalaceLeicester
03/11/2019,Everton,Tottenham,1,1,D,2.65,3.5,2.55,2019-11-03,2019/2020,13,E0,1-1,0,0.10000000000000009,2019-11-03EvertonTottenham
08/11/2019,Norwich,Watford,0,2,A,2.6,3.55,2.55,2019-11-08,2019/2020,13,E0,0-2,-2,0.050000000000000266,2019-11-08NorwichWatford
09/11/2019,Chelsea,Crystal Palace,2,0,H,1.33,5.3,8.9,2019-11-09,2019/2020,13,E0,2-0,2,-7.57,2019-11-09ChelseaCrystal Palace
09/11/2019,Burnley,West Ham,3,0,H,2.25,3.55,3.1,2019-11-09,2019/2020,13,E0,3-0,3,-0.8500000000000001,2019-11-09BurnleyWest Ham
09/11/2019,Newcastle,Bournemouth,2,1,H,2.6,3.2,2.8,2019-11-09,2019/2020,13,E0,2-1,1,-0.19999999999999973,2019-11-09NewcastleBournemouth
09/11/2019,Southampton,Everton,1,2,A,2.95,3.35,2.4,2019-11-09,2019/2020,13,E0,1-2,-1,0.5500000000000003,2019-11-09SouthamptonEverton
09/11/2019,Tottenham,Sheffield United,1,1,D,1.57,4.15,5.8,2019-11-09,2019/2020,13,E0,1-1,0,-4.2299999999999995,2019-11-09TottenhamSheffield United
09/11/2019,Leicester,Arsenal,2,0,H,1.97,3.75,3.6,2019-11-09,2019/2020,13,E0,2-0,2,-1.6300000000000001,2019-11-09LeicesterArsenal
10/11/2019,Man United,Brighton,3,1,H,1.7,3.65,5.4,2019-11-10,2019/2020,14,E0,3-1,2,-3.7,2019-11-10Man UnitedBrighton
10/11/2019,Wolves,Aston Villa,2,1,H,1.87,3.6,4.15,2019-11-10,2019/2020,14,E0,2-1,1,-2.2800000000000002,2019-11-10WolvesAston Villa
10/11/2019,Liverpool,Man City,3,1,H,2.5,3.5,2.7,2019-11-10,2019/2020,14,E0,3-1,2,-0.20000000000000018,2019-11-10LiverpoolMan City
23/11/2019,West Ham,Tottenham,2,3,A,4.3,4.05,1.75,2019-11-23,2019/2020,14,E0,2-3,-1,2.55,2019-11-23West HamTottenham
23/11/2019,Arsenal,Southampton,2,2,D,1.45,4.5,7.0,2019-11-23,2019/2020,14,E0,2-2,0,-5.55,2019-11-23ArsenalSouthampton
23/11/2019,Bournemouth,Wolves,1,2,A,2.8,3.25,2.6,2019-11-23,2019/2020,14,E0,1-2,-1,0.19999999999999973,2019-11-23BournemouthWolves
23/11/2019,Brighton,Leicester,0,2,A,3.6,3.5,2.05,2019-11-23,2019/2020,14,E0,0-2,-2,1.5500000000000003,2019-11-23BrightonLeicester
23/11/2019,Crystal Palace,Liverpool,1,2,A,7.2,4.4,1.45,2019-11-23,2019/2020,14,E0,1-2,-1,5.75,2019-11-23Crystal PalaceLiverpool
23/11/2019,Everton,Norwich,0,2,A,1.4,4.8,7.5,2019-11-23,2019/2020,14,E0,0-2,-2,-6.1,2019-11-23EvertonNorwich
23/11/2019,Watford,Burnley,0,3,A,2.35,3.25,3.15,2019-11-23,2019/2020,15,E0,0-3,-3,-0.7999999999999998,2019-11-23WatfordBurnley
23/11/2019,Man City,Chelsea,2,1,H,1.45,4.5,7.0,2019-11-23,2019/2020,15,E0,2-1,1,-5.55,2019-11-23Man CityChelsea
24/11/2019,Sheffield United,Man United,3,3,D,3.55,3.25,2.15,2019-11-24,2019/2020,15,E0,3-3,0,1.4,2019-11-24Sheffield UnitedMan United
25/11/2019,Aston Villa,Newcastle,2,0,H,2.1,3.45,3.5,2019-11-25,2019/2020,15,E0,2-0,2,-1.4,2019-11-25Aston VillaNewcastle
30/11/2019,Newcastle,Man City,2,2,D,14.0,7.1,1.2,2019-11-30,2019/2020,15,E0,2-2,0,12.8,2019-11-30NewcastleMan City
30/11/2019,Burnley,Crystal Palace,0,2,A,2.3,3.2,3.25,2019-11-30,2019/2020,15,E0,0-2,-2,-0.9500000000000002,2019-11-30BurnleyCrystal Palace
30/11/2019,Chelsea,West Ham,0,1,A,1.3,5.8,8.8,2019-11-30,2019/2020,15,E0,0-1,-1,-7.500000000000001,2019-11-30ChelseaWest Ham
30/11/2019,Liverpool,Brighton,2,1,H,1.22,6.5,13.0,2019-11-30,2019/2020,15,E0,2-1,1,-11.78,2019-11-30LiverpoolBrighton
30/11/2019,Tottenham,Bournemouth,3,2,H,1.4,5.1,7.5,2019-11-30,2019/2020,15,E0,3-2,1,-6.1,2019-11-30TottenhamBournemouth
30/11/2019,Southampton,Watford,2,1,H,2.1,3.45,3.5,2019-11-30,2019/2020,16,E0,2-1,1,-1.4,2019-11-30SouthamptonWatford
01/12/2019,Norwich,Arsenal,2,2,D,4.05,4.15,1.77,2019-12-01,2019/2020,16,E0,2-2,0,2.28,2019-12-01NorwichArsenal
01/12/2019,Wolves,Sheffield United,1,1,D,1.9,3.35,4.35,2019-12-01,2019/2020,16,E0,1-1,0,-2.4499999999999997,2019-12-01WolvesSheffield United
01/12/2019,Leicester,Everton,2,1,H,1.65,4.0,5.2,2019-12-01,2019/2020,16,E0,2-1,1,-3.5500000000000003,2019-12-01LeicesterEverton
01/12/2019,Man United,Aston Villa,2,2,D,1.5,4.35,6.4,2019-12-01,2019/2020,16,E0,2-2,0,-4.9,2019-12-01Man UnitedAston Villa
03/12/2019,Crystal Palace,Bournemouth,1,0,H,2.2,3.35,3.3,2019-12-03,2019/2020,16,E0,1-0,1,-1.0999999999999996,2019-12-03Crystal PalaceBournemouth
03/12/2019,Burnley,Man City,1,4,A,10.5,6.0,1.27,2019-12-03,2019/2020,16,E0,1-4,-3,9.23,2019-12-03BurnleyMan City
04/12/2019,Chelsea,Aston Villa,2,1,H,1.33,5.5,8.3,2019-12-04,2019/2020,16,E0,2-1,1,-6.970000000000001,2019-12-04ChelseaAston Villa
04/12/2019,Leicester,Watford,2,0,H,1.4,4.8,7.5,2019-12-04,2019/2020,16,E0,2-0,2,-6.1,2019-12-04LeicesterWatford
04/12/2019,Man United,Tottenham,2,1,H,2.65,3.3,2.65,2019-12-04,2019/2020,17,E0,2-1,1,0.0,2019-12-04Man UnitedTottenham
04/12/2019,Southampton,Norwich,2,1,H,1.85,3.7,4.1,2019-12-04,2019/2020,17,E0,2-1,1,-2.2499999999999996,2019-12-04SouthamptonNorwich
04/12/2019,Wolves,West Ham,2,0,H,1.77,3.7,4.6,2019-12-04,2019/2020,17,E0,2-0,2,-2.8299999999999996,2019-12-04WolvesWest Ham
04/12/2019,Liverpool,Everton,5,2,H,1.4,4.8,7.5,2019-12-04,2019/2020,17,E0,5-2,3,-6.1,2019-12-04LiverpoolEverton
05/12/2019,Sheffield United,Newcastle,0,2,A,1.95,3.3,4.2,2019-12-05,2019/2020,17,E0,0-2,-2,-2.25,2019-12-05Sheffield UnitedNewcastle
05/12/2019,Arsenal,Brighton,1,2,A,1.63,4.25,5.1,2019-12-05,2019/2020,17,E0,1-2,-1,-3.4699999999999998,2019-12-05ArsenalBrighton
07/12/2019,Everton,Chelsea,3,1,H,3.45,3.7,2.05,2019-12-07,2019/2020,17,E0,3-1,2,1.4000000000000004,2019-12-07EvertonChelsea
07/12/2019,Bournemouth,Liverpool,0,3,A,6.7,4.9,1.43,2019-12-07,2019/2020,17,E0,0-3,-3,5.2700000000000005,2019-12-07BournemouthLiverpool
07/12/2019,Tottenham,Burnley,5,0,H,1.42,4.8,7.1,2019-12-07,2019/2020,17,E0,5-0,5,-5.68,2019-12-07TottenhamBurnley
07/12/2019,Watford,Crystal Palace,0,0,D,2.35,3.3,3.1,2019-12-07,2019/2020,18,E0,0-0,0,-0.75,2019-12-07WatfordCrystal Palace
07/12/2019,Man City,Man United,1,2,A,1.3,5.6,9.4,2019-12-07,2019/2020,18,E0,1-2,-1,-8.1,2019-12-07Man CityMan United
08/12/2019,Aston Villa,Leicester,1,4,A,4.1,3.85,1.83,2019-12-08,2019/2020,18,E0,1-4,-3,2.2699999999999996,2019-12-08Aston VillaLeicester
08/12/2019,Newcastle,Southampton,2,1,H,2.6,3.2,2.85,2019-12-08,2019/2020,18,E0,2-1,1,-0.25,2019-12-08NewcastleSouthampton
08/12/2019,Norwich,Sheffield United,1,2,A,2.95,3.4,2.4,2019-12-08,2019/2020,18,E0,1-2,-1,0.5500000000000003,2019-12-08NorwichSheffield United
08/12/2019,Brighton,Wolves,2,2,D,2.7,3.1,2.8,2019-12-08,2019/2020,18,E0,2-2,0,-0.09999999999999964,2019-12-08BrightonWolves
09/12/2019,West Ham,Arsenal,1,3,A,3.4,3.95,1.97,2019-12-09,2019/2020,18,E0,1-3,-2,1.43,2019-12-09West HamArsenal
14/12/2019,Liverpool,Watford,2,0,H,1.17,7.5,15.0,2019-12-14,2019/2020,18,E0,2-0,2,-13.83,2019-12-14LiverpoolWatford
14/12/2019,Burnley,Newcastle,1,0,H,1.93,3.45,4.15,2019-12-14,2019/2020,18,E0,1-0,1,-2.2200000000000006,2019-12-14BurnleyNewcastle
14/12/2019,Chelsea,Bournemouth,0,1,A,1.25,6.1,11.0,2019-12-14,2019/2020,19,E0,0-1,-1,-9.75,2019-12-14ChelseaBournemouth
14/12/2019,Leicester,Norwich,1,1,D,1.22,6.6,12.0,2019-12-14,2019/2020,19,E0,1-1,0,-10.78,2019-12-14LeicesterNorwich
14/12/2019,Sheffield United,Aston Villa,2,0,H,1.85,3.7,4.15,2019-12-14,2019/2020,19,E0,2-0,2,-2.3000000000000003,2019-12-14Sheffield UnitedAston Villa
14/12/2019,Southampton,West Ham,0,1,A,1.9,3.8,3.8,2019-12-14,2019/2020,19,E0,0-1,-1,-1.9,2019-12-14SouthamptonWest Ham
15/12/2019,Man United,Everton,1,1,D,1.7,3.8,5.0,2019-12-15,2019/2020,19,E0,1-1,0,-3.3,2019-12-15Man UnitedEverton
15/12/2019,Wolves,Tottenham,1,2,A,3.2,3.4,2.25,2019-12-15,2019/2020,19,E0,1-2,-1,0.9500000000000002,2019-12-15WolvesTottenham
15/12/2019,Arsenal,Man City,0,3,A,6.0,5.2,1.45,2019-12-15,2019/2020,19,E0,0-3,-3,4.55,2019-12-15ArsenalMan City
16/12/2019,Crystal Palace,Brighton,1,1,D,2.55,3.2,2.85,2019-12-16,2019/2020,19,E0,1-1,0,-0.30000000000000027,2019-12-16Crystal PalaceBrighton
21/12/2019,Everton,Arsenal,0,0,D,2.3,3.65,2.85,2019-12-21,2019/2020,19,E0,0-0,0,-0.5500000000000003,2019-12-21EvertonArsenal
21/12/2019,Aston Villa,Southampton,1,3,A,2.4,3.55,2.8,2019-12-21,2019/2020,20,E0,1-3,-2,-0.3999999999999999,2019-12-21Aston VillaSouthampton
21/12/2019,Bournemouth,Burnley,0,1,A,2.4,3.35,2.95,2019-12-21,2019/2020,20,E0,0-1,-1,-0.5500000000000003,2019-12-21BournemouthBurnley
21/12/2019,Brighton,Sheffield United,0,1,A,2.2,3.25,3.45,2019-12-21,2019/2020,20,E0,0-1,-1,-1.25,2019-12-21BrightonSheffield United
21/12/2019,Newcastle,Crystal Palace,1,0,H,2.4,3.1,3.2,2019-12-21,2019/2020,20,E0,1-0,1,-0.8000000000000003,2019-12-21NewcastleCrystal Palace
21/12/2019,Norwich,Wolves,1,2,A,3.65,3.7,1.97,2019-12-21,2019/2020,20,E0,1-2,-1,1.68,2019-12-21NorwichWolves
21/12/2019,Man City,Leicester,3,1,H,1.37,5.3,7.4,2019-12-21,2019/2020,20,E0,3-1,2,-6.03,2019-12-21Man CityLeicester
22/12/2019,Watford,Man United,2,0,H,4.4,3.75,1.8,2019-12-22,2019/2020,20,E0,2-0,2,2.6000000000000005,2019-12-22WatfordMan United
22/12/2019,Tottenham,Chelsea,0,2,A,2.3,3.4,3.05,2019-12-22,2019/2020,20,E0,0-2,-2,-0.75,2019-12-22TottenhamChelsea
26/12/2019,Tottenham,Brighton,2,1,H,1.57,4.35,5.5,2019-12-26,2019/2020,20,E0,2-1,1,-3.9299999999999997,2019-12-26TottenhamBrighton
26/12/2019,Aston Villa,Norwich,1,0,H,2.1,3.75,3.2,2019-12-26,2019/2020,21,E0,1-0,1,-1.1,2019-12-26Aston VillaNorwich
26/12/2019,Bournemouth,Arsenal,1,1,D,3.45,3.8,2.0,2019-12-26,2019/2020,21,E0,1-1,0,1.4500000000000002,2019-12-26BournemouthArsenal
26/12/2019,Chelsea,Southampton,0,2,A,1.37,5.2,7.9,2019-12-26,2019/2020,21,E0,0-2,-2,-6.53,2019-12-26ChelseaSouthampton
26/12/2019,Crystal Palace,West Ham,2,1,H,2.3,3.35,3.1,2019-12-26,2019/2020,21,E0,2-1,1,-0.8000000000000003,2019-12-26Crystal PalaceWest Ham
26/12/2019,Everton,Burnley,1,0,H,1.7,3.7,5.0,2019-12-26,2019/2020,21,E0,1-0,1,-3.3,2019-12-26EvertonBurnley
26/12/2019,Sheffield United,Watford,1,1,D,1.85,3.5,4.45,2019-12-26,2019/2020,21,E0,1-1,0,-2.6,2019-12-26Sheffield UnitedWatford
26/12/2019,Man United,Newcastle,4,1,H,1.35,5.0,8.9,2019-12-26,2019/2020,21,E0,4-1,3,-7.550000000000001,2019-12-26Man UnitedNewcastle
26/12/2019,Leicester,Liverpool,0,4,A,3.35,3.7,2.05,2019-12-26,2019/2020,21,E0,0-4,-4,1.3000000000000003,2019-12-26LeicesterLiverpool
27/12/2019,Wolves,Man City,3,2,H,7.3,4.9,1.41,2019-12-27,2019/2020,21,E0,3-2,1,5.89,2019-12-27WolvesMan City
28/12/2019,Brighton,Bournemouth,2,0,H,1.77,3.75,4.45,2019-12-28,2019/2020,22,E0,2-0,2,-2.68,2019-12-28BrightonBournemouth
28/12/2019,Newcastle,Everton,1,2,A,3.5,3.35,2.15,2019-12-28,2019/2020,22,E0,1-2,-1,1.35,2019-12-28NewcastleEverton
28/12/2019,Southampton,Crystal Palace,1,1,D,1.97,3.5,3.9,2019-12-28,2019/2020,22,E0,1-1,0,-1.93,2019-12-28SouthamptonCrystal Palace
28/12/2019,Watford,Aston Villa,3,0,H,2.0,3.7,3.6,2019-12-28,2019/2020,22,E0,3-0,3,-1.6,2019-12-28WatfordAston Villa
28/12/2019,Norwich,Tottenham,2,2,D,4.7,4.05,1.67,2019-12-28,2019/2020,22,E0,2-2,0,3.0300000000000002,2019-12-28NorwichTottenham
28/12/2019,West Ham,Leicester,1,2,A,3.95,3.85,1.85,2019-12-28,2019/2020,22,E0,1-2,-1,2.1,2019-12-28West HamLeicester
28/12/2019,Burnley,Man United,0,2,A,4.25,3.65,1.85,2019-12-28,2019/2020,22,E0,0-2,-2,2.4,2019-12-28BurnleyMan United
29/12/2019,Arsenal,Chelsea,1,2,A,2.85,3.7,2.35,2019-12-29,2019/2020,22,E0,1-2,-1,0.5,2019-12-29ArsenalChelsea
29/12/2019,Liverpool,Wolves,1,0,H,1.25,6.1,11.0,2019-12-29,2019/2020,22,E0,1-0,1,-9.75,2019-12-29LiverpoolWolves
29/12/2019,Man City,Sheffield United,2,0,H,1.17,7.5,15.0,2019-12-29,2019/2020,23,E0,2-0,2,-13.83,2019-12-29Man CitySheffield United
01/01/2020,Brighton,Chelsea,1,1,D,3.6,3.6,2.0,2020-01-01,2019/2020,23,E0,1-1,0,1.6,2020-01-01BrightonChelsea
01/01/2020,Burnley,Aston Villa,1,2,A,1.8,3.7,4.35,2020-01-01,2019/2020,23,E0,1-2,-1,-2.55,2020-01-01BurnleyAston Villa
01/01/2020,Newcastle,Leicester,0,3,A,5.3,3.8,1.67,2020-01-01,2019/2020,23,E0,0-3,-3,3.63,2020-01-01NewcastleLeicester
01/01/2020,Southampton,Tottenham,1,0,H,3.25,3.55,2.15,2020-01-01,2019/2020,23,E0,1-0,1,1.1,2020-01-01SouthamptonTottenham
01/01/2020,Watford,Wolves,2,1,H,3.1,3.35,2.3,2020-01-01,2019/2020,23,E0,2-1,1,0.8000000000000003,2020-01-01WatfordWolves
01/01/2020,Man City,Everton,2,1,H,1.28,6.1,9.5,2020-01-01,2019/2020,23,E0,2-1,1,-8.22,2020-01-01Man CityEverton
01/01/2020,Norwich,Crystal Palace,1,1,D,2.5,3.4,2.75,2020-01-01,2019/2020,23,E0,1-1,0,-0.25,2020-01-01NorwichCrystal Palace
01/01/2020,West Ham,Bournemouth,4,0,H,1.95,3.8,3.65,2020-01-01,2019/2020,23,E0,4-0,4,-1.7,2020-01-01West HamBournemouth
01/01/2020,Arsenal,Man United,2,0,H,2.55,3.6,2.6,2020-01-01,2019/2020,24,E0,2-0,2,-0.050000000000000266,2020-01-01ArsenalMan United
02/01/2020,Liverpool,Sheffield United,2,0,H,1.22,6.5,13.0,2020-01-02,2019/2020,24,E0,2-0,2,-11.78,2020-01-02LiverpoolSheffield United
10/01/2020,Sheffield United,West Ham,1,0,H,2.0,3.4,3.85,2020-01-10,2019/2020,24,E0,1-0,1,-1.85,2020-01-10Sheffield UnitedWest Ham
11/01/2020,Crystal Palace,Arsenal,1,1,D,4.15,3.8,1.83,2020-01-11,2019/2020,24,E0,1-1,0,2.3200000000000003,2020-01-11Crystal PalaceArsenal
11/01/2020,Chelsea,Burnley,3,0,H,1.28,5.6,10.5,2020-01-11,2019/2020,24,E0,3-0,3,-9.22,2020-01-11ChelseaBurnley
11/01/2020,Everton,Brighton,1,0,H,1.9,3.6,4.05,2020-01-11,2019/2020,24,E0,1-0,1,-2.15,2020-01-11EvertonBrighton
11/01/2020,Leicester,Southampton,1,2,A,1.65,4.05,5.0,2020-01-11,2019/2020,24,E0,1-2,-1,-3.35,2020-01-11LeicesterSouthampton
11/01/2020,Man United,Norwich,4,0,H,1.37,5.1,7.8,2020-01-11,2019/2020,24,E0,4-0,4,-6.43,2020-01-11Man UnitedNorwich
11/01/2020,Wolves,Newcastle,1,1,D,1.46,4.3,7.5,2020-01-11,2019/2020,24,E0,1-1,0,-6.04,2020-01-11WolvesNewcastle
11/01/2020,Tottenham,Liverpool,0,1,A,4.5,4.1,1.7,2020-01-11,2019/2020,25,E0,0-1,-1,2.8,2020-01-11TottenhamLiverpool
12/01/2020,Bournemouth,Watford,0,3,A,2.6,3.35,2.7,2020-01-12,2019/2020,25,E0,0-3,-3,-0.10000000000000009,2020-01-12BournemouthWatford
12/01/2020,Aston Villa,Man City,1,6,A,13.5,8.0,1.17,2020-01-12,2019/2020,25,E0,1-6,-5,12.33,2020-01-12Aston VillaMan City
18/01/2020,Watford,Tottenham,0,0,D,3.15,3.5,2.2,2020-01-18,2019/2020,25,E0,0-0,0,0.9499999999999997,2020-01-18WatfordTottenham
18/01/2020,Arsenal,Sheffield United,1,1,D,1.83,3.6,4.4,2020-01-18,2019/2020,25,E0,1-1,0,-2.5700000000000003,2020-01-18ArsenalSheffield United
18/01/2020,Brighton,Aston Villa,1,1,D,1.65,4.0,5.0,2020-01-18,2019/2020,25,E0,1-1,0,-3.35,2020-01-18BrightonAston Villa
18/01/2020,Man City,Crystal Palace,2,2,D,1.1,10.0,23.0,2020-01-18,2019/2020,25,E0,2-2,0,-21.9,2020-01-18Man CityCrystal Palace
18/01/2020,Norwich,Bournemouth,1,0,H,2.2,3.55,3.15,2020-01-18,2019/2020,25,E0,1-0,1,-0.9499999999999997,2020-01-18NorwichBournemouth
18/01/2020,Southampton,Wolves,2,3,A,2.4,3.3,3.0,2020-01-18,2019/2020,25,E0,2-3,-1,-0.6000000000000001,2020-01-18SouthamptonWolves
18/01/2020,West Ham,Everton,1,1,D,2.9,3.4,2.4,2020-01-18,2019/2020,26,E0,1-1,0,0.5,2020-01-18West HamEverton
18/01/2020,Newcastle,Chelsea,1,0,H,5.9,4.4,1.53,2020-01-18,2019/2020,26,E0,1-0,1,4.37,2020-01-18NewcastleChelsea
19/01/2020,Burnley,Leicester,2,1,H,4.1,3.65,1.87,2020-01-19,2019/2020,26,E0,2-1,1,2.2299999999999995,2020-01-19BurnleyLeicester
19/01/2020,Liverpool,Man United,2,0,H,1.37,5.0,8.2,2020-01-19,2019/2020,26,E0,2-0,2,-6.829999999999999,2020-01-19LiverpoolMan United
21/01/2020,Aston Villa,Watford,2,1,H,2.8,3.4,2.5,2020-01-21,2019/2020,26,E0,2-1,1,0.2999999999999998,2020-01-21Aston VillaWatford
21/01/2020,Bournemouth,Brighton,3,1,H,2.9,3.3,2.45,2020-01-21,2019/2020,26,E0,3-1,2,0.44999999999999973,2020-01-21BournemouthBrighton
21/01/2020,Crystal Palace,Southampton,0,2,A,2.7,3.15,2.7,2020-01-21,2019/2020,26,E0,0-2,-2,0.0,2020-01-21Crystal PalaceSouthampton
21/01/2020,Everton,Newcastle,2,2,D,1.6,4.0,5.6,2020-01-21,2019/2020,26,E0,2-2,0,-3.9999999999999996,2020-01-21EvertonNewcastle
21/01/2020,Sheffield United,Man City,0,1,A,6.8,4.6,1.45,2020-01-21,2019/2020,26,E0,0-1,-1,5.35,2020-01-21Sheffield UnitedMan City
21/01/2020,Chelsea,Arsenal,2,2,D,1.75,3.9,4.4,2020-01-21,2019/2020,27,E0,2-2,0,-2.6500000000000004,2020-01-21ChelseaArsenal
22/01/2020,Leicester,West Ham,4,1,H,1.53,4.4,5.8,2020-01-22,2019/2020,27,E0,4-1,3,-4.27,2020-01-22LeicesterWest Ham
22/01/2020,Tottenham,Norwich,2,1,H,1.43,4.8,6.8,2020-01-22,2019/2020,27,E0,2-1,1,-5.37,2020-01-22TottenhamNorwich
22/01/2020,Man United,Burnley,0,2,A,1.42,4.55,7.6,2020-01-22,2019/2020,27,E0,0-2,-2,-6.18,2020-01-22Man UnitedBurnley
23/01/2020,Wolves,Liverpool,1,2,A,5.4,3.95,1.65,2020-01-23,2019/2020,27,E0,1-2,-1,3.7500000000000004,2020-01-23WolvesLiverpool
29/01/2020,West Ham,Liverpool,0,2,A,8.4,5.4,1.35,2020-01-29,2019/2020,27,E0,0-2,-2,7.050000000000001,2020-01-29West HamLiverpool
01/02/2020,Leicester,Chelsea,2,2,D,2.5,3.55,2.7,2020-02-01,2019/2020,27,E0,2-2,0,-0.20000000000000018,2020-02-01LeicesterChelsea
01/02/2020,Bournemouth,Aston Villa,2,1,H,2.1,3.55,3.35,2020-02-01,2019/2020,27,E0,2-1,1,-1.25,2020-02-01BournemouthAston Villa
01/02/2020,Crystal Palace,Sheffield United,0,1,A,3.1,3.0,2.55,2020-02-01,2019/2020,27,E0,0-1,-1,0.5500000000000003,2020-02-01Crystal PalaceSheffield United
01/02/2020,Liverpool,Southampton,4,0,H,1.3,5.7,9.8,2020-02-01,2019/2020,28,E0,4-0,4,-8.5,2020-02-01LiverpoolSouthampton
01/02/2020,Newcastle,Norwich,0,0,D,2.2,3.35,3.3,2020-02-01,2019/2020,28,E0,0-0,0,-1.0999999999999996,2020-02-01NewcastleNorwich
01/02/2020,Watford,Everton,2,3,A,2.75,3.3,2.6,2020-02-01,2019/2020,28,E0,2-3,-1,0.1499999999999999,2020-02-01WatfordEverton
01/02/2020,West Ham,Brighton,3,3,D,2.55,3.35,2.8,2020-02-01,2019/2020,28,E0,3-3,0,-0.25,2020-02-01West HamBrighton
01/02/2020,Man United,Wolves,0,0,D,2.2,3.2,3.45,2020-02-01,2019/2020,28,E0,0-0,0,-1.25,2020-02-01Man UnitedWolves
02/02/2020,Burnley,Arsenal,0,0,D,3.7,3.5,2.0,2020-02-02,2019/2020,28,E0,0-0,0,1.7000000000000002,2020-02-02BurnleyArsenal
02/02/2020,Tottenham,Man City,2,0,H,5.3,4.4,1.57,2020-02-02,2019/2020,28,E0,2-0,2,3.7299999999999995,2020-02-02TottenhamMan City
08/02/2020,Everton,Crystal Palace,3,1,H,1.65,3.75,5.7,2020-02-08,2019/2020,28,E0,3-1,2,-4.050000000000001,2020-02-08EvertonCrystal Palace
08/02/2020,Brighton,Watford,1,1,D,2.15,3.4,3.5,2020-02-08,2019/2020,28,E0,1-1,0,-1.35,2020-02-08BrightonWatford
09/02/2020,Sheffield United,Bournemouth,2,1,H,1.7,3.5,5.5,2020-02-09,2019/2020,29,E0,2-1,1,-3.8,2020-02-09Sheffield UnitedBournemouth
14/02/2020,Wolves,Leicester,0,0,D,2.5,3.25,2.85,2020-02-14,2019/2020,29,E0,0-0,0,-0.3500000000000001,2020-02-14WolvesLeicester
15/02/2020,Southampton,Burnley,1,2,A,1.77,3.65,4.65,2020-02-15,2019/2020,29,E0,1-2,-1,-2.8800000000000003,2020-02-15SouthamptonBurnley
15/02/2020,Norwich,Liverpool,0,1,A,9.6,5.5,1.3,2020-02-15,2019/2020,29,E0,0-1,-1,8.299999999999999,2020-02-15NorwichLiverpool
16/02/2020,Aston Villa,Tottenham,2,3,A,3.95,3.8,1.87,2020-02-16,2019/2020,29,E0,2-3,-1,2.08,2020-02-16Aston VillaTottenham
16/02/2020,Arsenal,Newcastle,4,0,H,1.45,4.5,7.0,2020-02-16,2019/2020,29,E0,4-0,4,-5.55,2020-02-16ArsenalNewcastle
17/02/2020,Chelsea,Man United,0,2,A,1.85,3.6,4.3,2020-02-17,2019/2020,29,E0,0-2,-2,-2.4499999999999997,2020-02-17ChelseaMan United
19/02/2020,Man City,West Ham,2,0,H,1.13,9.1,17.0,2020-02-19,2019/2020,29,E0,2-0,2,-15.870000000000001,2020-02-19Man CityWest Ham
22/02/2020,Chelsea,Tottenham,2,1,H,1.73,3.85,4.65,2020-02-22,2019/2020,29,E0,2-1,1,-2.9200000000000004,2020-02-22ChelseaTottenham
22/02/2020,Burnley,Bournemouth,3,0,H,2.15,3.25,3.65,2020-02-22,2019/2020,30,E0,3-0,3,-1.5,2020-02-22BurnleyBournemouth
22/02/2020,Crystal Palace,Newcastle,1,0,H,1.97,3.25,4.35,2020-02-22,2019/2020,30,E0,1-0,1,-2.38,2020-02-22Crystal PalaceNewcastle
22/02/2020,Sheffield United,Brighton,1,1,D,1.95,3.35,4.2,2020-02-22,2019/2020,30,E0,1-1,0,-2.25,2020-02-22Sheffield UnitedBrighton
22/02/2020,Southampton,Aston Villa,2,0,H,1.65,4.15,4.9,2020-02-22,2019/2020,30,E0,2-0,2,-3.2500000000000004,2020-02-22SouthamptonAston Villa
22/02/2020,Leicester,Man City,0,1,A,4.35,4.1,1.73,2020-02-22,2019/2020,30,E0,0-1,-1,2.6199999999999997,2020-02-22LeicesterMan City
23/02/2020,Man United,Watford,3,0,H,1.6,3.95,5.6,2020-02-23,2019/2020,30,E0,3-0,3,-3.9999999999999996,2020-02-23Man UnitedWatford
23/02/2020,Wolves,Norwich,3,0,H,1.53,4.15,6.2,2020-02-23,2019/2020,30,E0,3-0,3,-4.67,2020-02-23WolvesNorwich
23/02/2020,Arsenal,Everton,3,2,H,2.05,3.6,3.55,2020-02-23,2019/2020,30,E0,3-2,1,-1.5,2020-02-23ArsenalEverton
24/02/2020,Liverpool,West Ham,3,2,H,1.18,7.5,14.5,2020-02-24,2019/2020,30,E0,3-2,1,-13.32,2020-02-24LiverpoolWest Ham
28/02/2020,Norwich,Leicester,1,0,H,4.4,3.9,1.75,2020-02-28,2019/2020,31,E0,1-0,1,2.6500000000000004,2020-02-28NorwichLeicester
29/02/2020,Brighton,Crystal Palace,0,1,A,2.05,3.25,3.9,2020-02-29,2019/2020,31,E0,0-1,-1,-1.85,2020-02-29BrightonCrystal Palace
29/02/2020,Bournemouth,Chelsea,2,2,D,4.55,3.8,1.77,2020-02-29,2019/2020,31,E0,2-2,0,2.78,2020-02-29BournemouthChelsea
29/02/2020,Newcastle,Burnley,0,0,D,2.6,3.1,2.9,2020-02-29,2019/2020,31,E0,0-0,0,-0.2999999999999998,2020-02-29NewcastleBurnley
29/02/2020,West Ham,Southampton,3,1,H,2.7,3.5,2.55,2020-02-29,2019/2020,31,E0,3-1,2,0.15000000000000036,2020-02-29West HamSouthampton
29/02/2020,Watford,Liverpool,3,0,H,6.9,4.75,1.43,2020-02-29,2019/2020,31,E0,3-0,3,5.470000000000001,2020-02-29WatfordLiverpool
01/03/2020,Everton,Man United,1,1,D,2.55,3.3,2.85,2020-03-01,2019/2020,31,E0,1-1,0,-0.30000000000000027,2020-03-01EvertonMan United
01/03/2020,Tottenham,Wolves,2,3,A,2.45,3.15,3.1,2020-03-01,2019/2020,31,E0,2-3,-1,-0.6499999999999999,2020-03-01TottenhamWolves
07/03/2020,Liverpool,Bournemouth,2,1,H,1.27,6.0,10.5,2020-03-07,2019/2020,31,E0,2-1,1,-9.23,2020-03-07LiverpoolBournemouth
07/03/2020,Arsenal,West Ham,1,0,H,1.57,4.3,5.4,2020-03-07,2019/2020,32,E0,1-0,1,-3.83,2020-03-07ArsenalWest Ham
07/03/2020,Crystal Palace,Watford,1,0,H,2.55,3.15,2.95,2020-03-07,2019/2020,32,E0,1-0,1,-0.40000000000000036,2020-03-07Crystal PalaceWatford
07/03/2020,Sheffield United,Norwich,1,0,H,1.67,3.75,5.4,2020-03-07,2019/2020,32,E0,1-0,1,-3.7300000000000004,2020-03-07Sheffield UnitedNorwich
07/03/2020,Southampton,Newcastle,0,1,A,1.67,3.9,5.0,2020-03-07,2019/2020,32,E0,0-1,-1,-3.33,2020-03-07SouthamptonNewcastle
07/03/2020,Wolves,Brighton,0,0,D,1.65,3.9,5.4,2020-03-07,2019/2020,32,E0,0-0,0,-3.7500000000000004,2020-03-07WolvesBrighton
07/03/2020,Burnley,Tottenham,1,1,D,2.7,3.25,2.65,2020-03-07,2019/2020,32,E0,1-1,0,0.050000000000000266,2020-03-07BurnleyTottenham
08/03/2020,Chelsea,Everton,4,0,H,1.87,3.75,4.05,2020-03-08,2019/2020,32,E0,4-0,4,-2.1799999999999997,2020-03-08ChelseaEverton
08/03/2020,Man United,Man City,2,0,H,4.95,4.2,1.65,2020-03-08,2019/2020,32,E0,2-0,2,3.3000000000000003,2020-03-08Man UnitedMan City
09/03/2020,Leicester,Aston Villa,4,0,H,1.4,5.0,7.5,2020-03-09,2019/2020,32,E0,4-0,4,-6.1,2020-03-09LeicesterAston Villa
17/06/2020,Aston Villa,Sheffield United,0,0,D,3.25,3.3,2.25,2020-06-17,2019/2020,33,E0,0-0,0,1.0,2020-06-17Aston VillaSheffield United
17/06/2020,Man City,Arsenal,3,0,H,1.35,5.5,7.8,2020-06-17,2019/2020,33,E0,3-0,3,-6.449999999999999,2020-06-17Man CityArsenal
19/06/2020,Norwich,Southampton,0,3,A,2.8,3.35,2.5,2020-06-19,2019/2020,33,E0,0-3,-3,0.2999999999999998,2020-06-19NorwichSouthampton
19/06/2020,Tottenham,Man United,1,1,D,3.0,3.35,2.4,2020-06-19,2019/2020,33,E0,1-1,0,0.6000000000000001,2020-06-19TottenhamMan United
20/06/2020,Watford,Leicester,1,1,D,3.6,3.5,2.05,2020-06-20,2019/2020,33,E0,1-1,0,1.5500000000000003,2020-06-20WatfordLeicester
20/06/2020,Brighton,Arsenal,2,1,H,2.95,3.35,2.4,2020-06-20,2019/2020,33,E0,2-1,1,0.5500000000000003,2020-06-20BrightonArsenal
20/06/2020,West Ham,Wolves,0,2,A,3.55,3.35,2.15,2020-06-20,2019/2020,33,E0,0-2,-2,1.4,2020-06-20West HamWolves
20/06/2020,Bournemouth,Crystal Palace,0,2,A,2.5,3.2,2.95,2020-06-20,2019/2020,33,E0,0-2,-2,-0.4500000000000002,2020-06-20BournemouthCrystal Palace
21/06/2020,Newcastle,Sheffield United,3,0,H,3.3,3.05,2.35,2020-06-21,2019/2020,33,E0,3-0,3,0.9499999999999997,2020-06-21NewcastleSheffield United
21/06/2020,Aston Villa,Chelsea,1,2,A,5.9,4.45,1.53,2020-06-21,2019/2020,34,E0,1-2,-1,4.37,2020-06-21Aston VillaChelsea
21/06/2020,Everton,Liverpool,0,0,D,5.5,4.2,1.57,2020-06-21,2019/2020,34,E0,0-0,0,3.9299999999999997,2020-06-21EvertonLiverpool
22/06/2020,Man City,Burnley,5,0,H,1.13,8.6,18.5,2020-06-22,2019/2020,34,E0,5-0,5,-17.37,2020-06-22Man CityBurnley
23/06/2020,Leicester,Brighton,0,0,D,1.65,3.8,5.4,2020-06-23,2019/2020,34,E0,0-0,0,-3.7500000000000004,2020-06-23LeicesterBrighton
23/06/2020,Tottenham,West Ham,2,0,H,1.65,3.9,5.2,2020-06-23,2019/2020,34,E0,2-0,2,-3.5500000000000003,2020-06-23TottenhamWest Ham
24/06/2020,Man United,Sheffield United,3,0,H,1.41,4.4,8.5,2020-06-24,2019/2020,34,E0,3-0,3,-7.09,2020-06-24Man UnitedSheffield United
24/06/2020,Newcastle,Aston Villa,1,1,D,2.3,3.3,3.15,2020-06-24,2019/2020,34,E0,1-1,0,-0.8500000000000001,2020-06-24NewcastleAston Villa
24/06/2020,Norwich,Everton,0,1,A,3.95,3.65,1.9,2020-06-24,2019/2020,34,E0,0-1,-1,2.0500000000000003,2020-06-24NorwichEverton
24/06/2020,Wolves,Bournemouth,1,0,H,1.57,3.95,6.0,2020-06-24,2019/2020,34,E0,1-0,1,-4.43,2020-06-24WolvesBournemouth
24/06/2020,Liverpool,Crystal Palace,4,0,H,1.26,5.7,12.0,2020-06-24,2019/2020,35,E0,4-0,4,-10.74,2020-06-24LiverpoolCrystal Palace
25/06/2020,Burnley,Watford,1,0,H,3.0,3.2,2.5,2020-06-25,2019/2020,35,E0,1-0,1,0.5,2020-06-25BurnleyWatford
25/06/2020,Southampton,Arsenal,0,2,A,2.6,3.45,2.65,2020-06-25,2019/2020,35,E0,0-2,-2,-0.04999999999999982,2020-06-25SouthamptonArsenal
25/06/2020,Chelsea,Man City,2,1,H,4.15,4.0,1.8,2020-06-25,2019/2020,35,E0,2-1,1,2.3500000000000005,2020-06-25ChelseaMan City
27/06/2020,Aston Villa,Wolves,0,1,A,4.8,3.65,1.77,2020-06-27,2019/2020,35,E0,0-1,-1,3.03,2020-06-27Aston VillaWolves
28/06/2020,Watford,Southampton,1,3,A,2.5,3.3,2.9,2020-06-28,2019/2020,35,E0,1-3,-2,-0.3999999999999999,2020-06-28WatfordSouthampton
29/06/2020,Crystal Palace,Burnley,0,1,A,2.3,3.1,3.35,2020-06-29,2019/2020,35,E0,0-1,-1,-1.0500000000000003,2020-06-29Crystal PalaceBurnley
30/06/2020,Brighton,Man United,0,3,A,6.1,3.85,1.6,2020-06-30,2019/2020,35,E0,0-3,-3,4.5,2020-06-30BrightonMan United
01/07/2020,Arsenal,Norwich,4,0,H,1.45,4.65,6.9,2020-07-01,2019/2020,35,E0,4-0,4,-5.45,2020-07-01ArsenalNorwich
01/07/2020,Bournemouth,Newcastle,1,4,A,2.4,3.1,3.15,2020-07-01,2019/2020,36,E0,1-4,-3,-0.75,2020-07-01BournemouthNewcastle
01/07/2020,Everton,Leicester,2,1,H,2.5,3.25,2.85,2020-07-01,2019/2020,36,E0,2-1,1,-0.3500000000000001,2020-07-01EvertonLeicester
01/07/2020,West Ham,Chelsea,3,2,H,5.4,4.2,1.6,2020-07-01,2019/2020,36,E0,3-2,1,3.8000000000000003,2020-07-01West HamChelsea
02/07/2020,Sheffield United,Tottenham,3,1,H,4.05,3.4,1.97,2020-07-02,2019/2020,36,E0,3-1,2,2.08,2020-07-02Sheffield UnitedTottenham
02/07/2020,Man City,Liverpool,4,0,H,2.05,3.8,3.3,2020-07-02,2019/2020,36,E0,4-0,4,-1.25,2020-07-02Man CityLiverpool
04/07/2020,Norwich,Brighton,0,1,A,3.35,3.3,2.2,2020-07-04,2019/2020,36,E0,0-1,-1,1.15,2020-07-04NorwichBrighton
04/07/2020,Leicester,Crystal Palace,3,0,H,1.67,3.6,5.6,2020-07-04,2019/2020,36,E0,3-0,3,-3.9299999999999997,2020-07-04LeicesterCrystal Palace
04/07/2020,Man United,Bournemouth,5,2,H,1.18,7.1,16.0,2020-07-04,2019/2020,36,E0,5-2,3,-14.82,2020-07-04Man UnitedBournemouth
04/07/2020,Wolves,Arsenal,0,2,A,2.25,3.25,3.3,2020-07-04,2019/2020,36,E0,0-2,-2,-1.0499999999999998,2020-07-04WolvesArsenal
04/07/2020,Chelsea,Watford,3,0,H,1.45,4.55,7.4,2020-07-04,2019/2020,37,E0,3-0,3,-5.95,2020-07-04ChelseaWatford
05/07/2020,Burnley,Sheffield United,1,1,D,2.9,2.95,2.7,2020-07-05,2019/2020,37,E0,1-1,0,0.19999999999999973,2020-07-05BurnleySheffield United
05/07/2020,Newcastle,West Ham,2,2,D,2.65,3.25,2.7,2020-07-05,2019/2020,37,E0,2-2,0,-0.050000000000000266,2020-07-05NewcastleWest Ham
05/07/2020,Liverpool,Aston Villa,2,0,H,1.35,5.3,8.0,2020-07-05,2019/2020,37,E0,2-0,2,-6.65,2020-07-05LiverpoolAston Villa
05/07/2020,Southampton,Man City,1,0,H,8.6,5.4,1.33,2020-07-05,2019/2020,37,E0,1-0,1,7.27,2020-07-05SouthamptonMan City
06/07/2020,Tottenham,Everton,1,0,H,2.1,3.5,3.4,2020-07-06,2019/2020,37,E0,1-0,1,-1.2999999999999998,2020-07-06TottenhamEverton
07/07/2020,Crystal Palace,Chelsea,2,3,A,8.5,4.5,1.4,2020-07-07,2019/2020,37,E0,2-3,-1,7.1,2020-07-07Crystal PalaceChelsea
07/07/2020,Watford,Norwich,2,1,H,1.77,3.65,4.8,2020-07-07,2019/2020,37,E0,2-1,1,-3.03,2020-07-07WatfordNorwich
07/07/2020,Arsenal,Leicester,1,1,D,2.35,3.4,3.0,2020-07-07,2019/2020,37,E0,1-1,0,-0.6499999999999999,2020-07-07ArsenalLeicester
08/07/2020,Man City,Newcastle,5,0,H,1.13,8.5,20.0,2020-07-08,2019/2020,38,E0,5-0,5,-18.87,2020-07-08Man CityNewcastle
08/07/2020,Sheffield United,Wolves,1,0,H,3.95,3.05,2.15,2020-07-08,2019/2020,38,E0,1-0,1,1.8000000000000003,2020-07-08Sheffield UnitedWolves
08/07/2020,West Ham,Burnley,0,1,A,2.0,3.4,3.85,2020-07-08,2019/2020,38,E0,0-1,-1,-1.85,2020-07-08West HamBurnley
08/07/2020,Brighton,Liverpool,1,3,A,5.9,4.2,1.55,2020-07-08,2019/2020,38,E0,1-3,-2,4.3500000000000005,2020-07-08BrightonLiverpool
09/07/2020,Bournemouth,Tottenham,0,0,D,4.85,3.95,1.7,2020-07-09,2019/2020,38,E0,0-0,0,3.1499999999999995,2020-07-09BournemouthTottenham
09/07/2020,Everton,Southampton,1,1,D,2.05,3.45,3.6,2020-07-09,2019/2020,38,E0,1-1,0,-1.5500000000000003,2020-07-09EvertonSouthampton
09/07/2020,Aston Villa,Man United,0,3,A,8.7,5.1,1.35,2020-07-09,2019/2020,38,E0,0-3,-3,7.35,2020-07-09Aston VillaMan United
11/07/2020,Norwich,West Ham,0,4,A,3.9,3.55,1.95,2020-07-11,2019/2020,38,E0,0-4,-4,1.95,2020-07-11NorwichWest Ham
11/07/2020,Watford,Newcastle,2,1,H,1.8,3.55,4.55,2020-07-11,2019/2020,38,E0,2-1,1,-2.75,2020-07-11WatfordNewcastle
11/07/2020,Liverpool,Burnley,1,1,D,1.26,6.1,11.0,2020-07-11,2019/2020,39,E0,1-1,0,-9.74,2020-07-11LiverpoolBurnley
11/07/2020,Sheffield United,Chelsea,3,0,H,5.8,3.9,1.6,2020-07-11,2019/2020,39,E0,3-0,3,4.199999999999999,2020-07-11Sheffield UnitedChelsea
11/07/2020,Brighton,Man City,0,5,A,9.6,5.6,1.3,2020-07-11,2019/2020,39,E0,0-5,-5,8.299999999999999,2020-07-11BrightonMan City
12/07/2020,Wolves,Everton,3,0,H,2.05,3.2,4.0,2020-07-12,2019/2020,39,E0,3-0,3,-1.9500000000000002,2020-07-12WolvesEverton
12/07/2020,Aston Villa,Crystal Palace,2,0,H,2.25,3.35,3.2,2020-07-12,2019/2020,39,E0,2-0,2,-0.9500000000000002,2020-07-12Aston VillaCrystal Palace
12/07/2020,Tottenham,Arsenal,2,1,H,2.6,3.45,2.65,2020-07-12,2019/2020,39,E0,2-1,1,-0.04999999999999982,2020-07-12TottenhamArsenal
12/07/2020,Bournemouth,Leicester,4,1,H,4.95,3.8,1.7,2020-07-12,2019/2020,39,E0,4-1,3,3.25,2020-07-12BournemouthLeicester
13/07/2020,Man United,Southampton,2,2,D,1.3,5.5,9.7,2020-07-13,2019/2020,39,E0,2-2,0,-8.399999999999999,2020-07-13Man UnitedSouthampton
14/07/2020,Chelsea,Norwich,1,0,H,1.12,9.0,20.0,2020-07-14,2019/2020,39,E0,1-0,1,-18.88,2020-07-14ChelseaNorwich
15/07/2020,Burnley,Wolves,1,1,D,4.6,3.25,1.9,2020-07-15,2019/2020,40,E0,1-1,0,2.6999999999999997,2020-07-15BurnleyWolves
15/07/2020,Man City,Bournemouth,2,1,H,1.17,8.0,14.0,2020-07-15,2019/2020,40,E0,2-1,1,-12.83,2020-07-15Man CityBournemouth
15/07/2020,Newcastle,Tottenham,1,3,A,4.45,3.7,1.8,2020-07-15,2019/2020,40,E0,1-3,-2,2.6500000000000004,2020-07-15NewcastleTottenham
15/07/2020,Arsenal,Liverpool,2,1,H,3.85,3.85,1.87,2020-07-15,2019/2020,40,E0,2-1,1,1.98,2020-07-15ArsenalLiverpool
16/07/2020,Everton,Aston Villa,1,1,D,2.0,3.55,3.65,2020-07-16,2019/2020,40,E0,1-1,0,-1.65,2020-07-16EvertonAston Villa
16/07/2020,Leicester,Sheffield United,2,0,H,2.0,3.35,3.95,2020-07-16,2019/2020,40,E0,2-0,2,-1.9500000000000002,2020-07-16LeicesterSheffield United
16/07/2020,Crystal Palace,Man United,0,2,A,9.6,5.0,1.35,2020-07-16,2019/2020,40,E0,0-2,-2,8.25,2020-07-16Crystal PalaceMan United
16/07/2020,Southampton,Brighton,1,1,D,2.15,3.25,3.5,2020-07-16,2019/2020,40,E0,1-1,0,-1.35,2020-07-16SouthamptonBrighton
17/07/2020,West Ham,Watford,3,1,H,2.4,3.0,3.3,2020-07-17,2019/2020,40,E0,3-1,2,-0.8999999999999999,2020-07-17West HamWatford
18/07/2020,Norwich,Burnley,0,2,A,3.3,3.15,2.25,2020-07-18,2019/2020,41,E0,0-2,-2,1.0499999999999998,2020-07-18NorwichBurnley
19/07/2020,Bournemouth,Southampton,0,2,A,2.45,3.4,2.85,2020-07-19,2019/2020,41,E0,0-2,-2,-0.3999999999999999,2020-07-19BournemouthSouthampton
19/07/2020,Tottenham,Leicester,3,0,H,2.35,3.25,3.05,2020-07-19,2019/2020,41,E0,3-0,3,-0.6999999999999997,2020-07-19TottenhamLeicester
20/07/2020,Brighton,Newcastle,0,0,D,1.95,3.25,4.1,2020-07-20,2019/2020,41,E0,0-0,0,-2.1499999999999995,2020-07-20BrightonNewcastle
20/07/2020,Sheffield United,Everton,0,1,A,2.2,3.1,3.55,2020-07-20,2019/2020,41,E0,0-1,-1,-1.3499999999999996,2020-07-20Sheffield UnitedEverton
20/07/2020,Wolves,Crystal Palace,2,0,H,1.53,3.8,7.5,2020-07-20,2019/2020,41,E0,2-0,2,-5.97,2020-07-20WolvesCrystal Palace
21/07/2020,Watford,Man City,0,4,A,8.0,5.25,1.35,2020-07-21,2019/2020,41,E0,0-4,-4,6.65,2020-07-21WatfordMan City
21/07/2020,Aston Villa,Arsenal,1,0,H,3.25,3.55,2.15,2020-07-21,2019/2020,41,E0,1-0,1,1.1,2020-07-21Aston VillaArsenal
22/07/2020,Man United,West Ham,1,1,D,1.27,6.0,11.0,2020-07-22,2019/2020,41,E0,1-1,0,-9.73,2020-07-22Man UnitedWest Ham
22/07/2020,Liverpool,Chelsea,5,3,H,2.1,3.5,3.4,2020-07-22,2019/2020,42,E0,5-3,2,-1.2999999999999998,2020-07-22LiverpoolChelsea
26/07/2020,Arsenal,Watford,3,2,H,1.95,3.85,3.7,2020-07-26,2019/2020,42,E0,3-2,1,-1.7500000000000002,2020-07-26ArsenalWatford
26/07/2020,Burnley,Brighton,1,2,A,2.35,3.25,3.1,2020-07-26,2019/2020,42,E0,1-2,-1,-0.75,2020-07-26BurnleyBrighton
26/07/2020,Chelsea,Wolves,2,0,H,1.9,3.5,4.2,2020-07-26,2019/2020,42,E0,2-0,2,-2.3000000000000003,2020-07-26ChelseaWolves
26/07/2020,Crystal Palace,Tottenham,1,1,D,6.0,4.0,1.57,2020-07-26,2019/2020,42,E0,1-1,0,4.43,2020-07-26Crystal PalaceTottenham
26/07/2020,Everton,Bournemouth,1,3,A,2.25,3.55,3.0,2020-07-26,2019/2020,42,E0,1-3,-2,-0.75,2020-07-26EvertonBournemouth
26/07/2020,Leicester,Man United,0,2,A,3.15,3.25,2.3,2020-07-26,2019/2020,42,E0,0-2,-2,0.8500000000000001,2020-07-26LeicesterMan United
26/07/2020,Man City,Norwich,5,0,H,1.07,12.0,30.0,2020-07-26,2019/2020,42,E0,5-0,5,-28.93,2020-07-26Man CityNorwich
26/07/2020,Newcastle,Liverpool,1,3,A,7.5,4.8,1.4,2020-07-26,2019/2020,42,E0,1-3,-2,6.1,2020-07-26NewcastleLiverpool
