Date,HomeTeam,AwayTeam,FTHG,FTAG,FTR,IWH,IWD,IWA,datetime,season,game_day,league,result,goal_diff,odds_diff,game_id
15/08/09,Aston Villa,Wigan,0,2,A,1.7,3.5,4.9,2009-08-15,2009/2010,1,E0,0-2,-2,-3.2,2009-08-15Aston VillaWigan
15/08/09,Blackburn,Man City,0,2,A,3.2,3.2,2.2,2009-08-15,2009/2010,1,E0,0-2,-2,1.0,2009-08-15BlackburnMan City
15/08/09,Bolton,Sunderland,0,1,A,2.2,3.2,3.2,2009-08-15,2009/2010,1,E0,0-1,-1,-1.0,2009-08-15BoltonSunderland
15/08/09,Chelsea,Hull,2,1,H,1.2,5.5,14.0,2009-08-15,2009/2010,1,E0,2-1,1,-12.8,2009-08-15ChelseaHull
15/08/09,Everton,Arsenal,1,6,A,3.1,3.1,2.3,2009-08-15,2009/2010,1,E0,1-6,-5,0.8000000000000003,2009-08-15EvertonArsenal
15/08/09,Portsmouth,Fulham,0,1,A,2.5,3.2,2.7,2009-08-15,2009/2010,1,E0,0-1,-1,-0.20000000000000018,2009-08-15PortsmouthFulham
15/08/09,Stoke,Burnley,2,0,H,1.9,3.3,3.9,2009-08-15,2009/2010,1,E0,2-0,2,-2.0,2009-08-15StokeBurnley
15/08/09,Wolves,West Ham,0,2,A,2.55,3.3,2.55,2009-08-15,2009/2010,1,E0,0-2,-2,0.0,2009-08-15WolvesWest Ham
16/08/09,Man United,Birmingham,1,0,H,1.2,5.7,12.0,2009-08-16,2009/2010,1,E0,1-0,1,-10.8,2009-08-16Man UnitedBirmingham
16/08/09,Tottenham,Liverpool,2,1,H,3.1,3.1,2.3,2009-08-16,2009/2010,2,E0,2-1,1,0.8000000000000003,2009-08-16TottenhamLiverpool
18/08/09,Sunderland,Chelsea,1,3,A,6.7,3.8,1.5,2009-08-18,2009/2010,2,E0,1-3,-2,5.2,2009-08-18SunderlandChelsea
18/08/09,Wigan,Wolves,0,1,A,1.75,3.5,4.6,2009-08-18,2009/2010,2,E0,0-1,-1,-2.8499999999999996,2009-08-18WiganWolves
19/08/09,Birmingham,Portsmouth,1,0,H,2.15,3.25,3.25,2009-08-19,2009/2010,2,E0,1-0,1,-1.1,2009-08-19BirminghamPortsmouth
19/08/09,Burnley,Man United,1,0,H,8.5,4.5,1.35,2009-08-19,2009/2010,2,E0,1-0,1,7.15,2009-08-19BurnleyMan United
19/08/09,Hull,Tottenham,1,5,A,3.6,3.3,2.0,2009-08-19,2009/2010,2,E0,1-5,-4,1.6,2009-08-19HullTottenham
19/08/09,Liverpool,Stoke,4,0,H,1.22,5.3,13.0,2009-08-19,2009/2010,2,E0,4-0,4,-11.78,2009-08-19LiverpoolStoke
22/08/09,Arsenal,Portsmouth,4,1,H,1.2,5.5,14.0,2009-08-22,2009/2010,2,E0,4-1,3,-12.8,2009-08-22ArsenalPortsmouth
22/08/09,Birmingham,Stoke,0,0,D,2.2,3.2,3.2,2009-08-22,2009/2010,2,E0,0-0,0,-1.0,2009-08-22BirminghamStoke
22/08/09,Hull,Bolton,1,0,H,2.3,3.25,2.95,2009-08-22,2009/2010,3,E0,1-0,1,-0.6500000000000004,2009-08-22HullBolton
22/08/09,Man City,Wolves,1,0,H,1.35,4.5,8.5,2009-08-22,2009/2010,3,E0,1-0,1,-7.15,2009-08-22Man CityWolves
22/08/09,Sunderland,Blackburn,2,1,H,2.1,3.25,3.4,2009-08-22,2009/2010,3,E0,2-1,1,-1.2999999999999998,2009-08-22SunderlandBlackburn
22/08/09,Wigan,Man United,0,5,A,5.6,3.6,1.6,2009-08-22,2009/2010,3,E0,0-5,-5,3.9999999999999996,2009-08-22WiganMan United
23/08/09,Burnley,Everton,1,0,H,3.0,3.2,2.3,2009-08-23,2009/2010,3,E0,1-0,1,0.7000000000000002,2009-08-23BurnleyEverton
23/08/09,Fulham,Chelsea,0,2,A,6.0,3.7,1.55,2009-08-23,2009/2010,3,E0,0-2,-2,4.45,2009-08-23FulhamChelsea
23/08/09,West Ham,Tottenham,1,2,A,3.05,3.2,2.25,2009-08-23,2009/2010,3,E0,1-2,-1,0.7999999999999998,2009-08-23West HamTottenham
24/08/09,Liverpool,Aston Villa,1,3,A,1.4,4.3,7.5,2009-08-24,2009/2010,3,E0,1-3,-2,-6.1,2009-08-24LiverpoolAston Villa
29/08/09,Blackburn,West Ham,0,0,D,2.2,3.2,3.2,2009-08-29,2009/2010,3,E0,0-0,0,-1.0,2009-08-29BlackburnWest Ham
29/08/09,Bolton,Liverpool,2,3,A,6.0,3.7,1.55,2009-08-29,2009/2010,4,E0,2-3,-1,4.45,2009-08-29BoltonLiverpool
29/08/09,Chelsea,Burnley,3,0,H,1.17,6.0,15.0,2009-08-29,2009/2010,4,E0,3-0,3,-13.83,2009-08-29ChelseaBurnley
29/08/09,Man United,Arsenal,2,1,H,2.0,3.3,3.6,2009-08-29,2009/2010,4,E0,2-1,1,-1.6,2009-08-29Man UnitedArsenal
29/08/09,Stoke,Sunderland,1,0,H,2.3,3.2,3.0,2009-08-29,2009/2010,4,E0,1-0,1,-0.7000000000000002,2009-08-29StokeSunderland
29/08/09,Tottenham,Birmingham,2,1,H,1.35,4.5,8.5,2009-08-29,2009/2010,4,E0,2-1,1,-7.15,2009-08-29TottenhamBirmingham
29/08/09,Wolves,Hull,1,1,D,2.2,3.2,3.2,2009-08-29,2009/2010,4,E0,1-1,0,-1.0,2009-08-29WolvesHull
30/08/09,Aston Villa,Fulham,2,0,H,1.77,3.45,4.45,2009-08-30,2009/2010,4,E0,2-0,2,-2.68,2009-08-30Aston VillaFulham
30/08/09,Everton,Wigan,2,1,H,1.7,3.5,4.9,2009-08-30,2009/2010,4,E0,2-1,1,-3.2,2009-08-30EvertonWigan
30/08/09,Portsmouth,Man City,0,1,A,5.3,3.5,1.65,2009-08-30,2009/2010,4,E0,0-1,-1,3.65,2009-08-30PortsmouthMan City
12/09/09,Blackburn,Wolves,3,1,H,1.85,3.4,4.0,2009-09-12,2009/2010,5,E0,3-1,2,-2.15,2009-09-12BlackburnWolves
12/09/09,Liverpool,Burnley,4,0,H,1.22,5.3,13.0,2009-09-12,2009/2010,5,E0,4-0,4,-11.78,2009-09-12LiverpoolBurnley
12/09/09,Man City,Arsenal,4,2,H,2.7,3.2,2.5,2009-09-12,2009/2010,5,E0,4-2,2,0.20000000000000018,2009-09-12Man CityArsenal
12/09/09,Portsmouth,Bolton,2,3,A,2.4,3.2,2.85,2009-09-12,2009/2010,5,E0,2-3,-1,-0.4500000000000002,2009-09-12PortsmouthBolton
12/09/09,Stoke,Chelsea,1,2,A,7.5,4.3,1.4,2009-09-12,2009/2010,5,E0,1-2,-1,6.1,2009-09-12StokeChelsea
12/09/09,Sunderland,Hull,4,1,H,1.8,3.4,4.3,2009-09-12,2009/2010,5,E0,4-1,3,-2.5,2009-09-12SunderlandHull
12/09/09,Tottenham,Man United,1,3,A,3.0,3.1,2.35,2009-09-12,2009/2010,5,E0,1-3,-2,0.6499999999999999,2009-09-12TottenhamMan United
12/09/09,Wigan,West Ham,1,0,H,2.2,3.2,3.2,2009-09-12,2009/2010,5,E0,1-0,1,-1.0,2009-09-12WiganWest Ham
13/09/09,Birmingham,Aston Villa,0,1,A,3.0,3.2,2.3,2009-09-13,2009/2010,5,E0,0-1,-1,0.7000000000000002,2009-09-13BirminghamAston Villa
13/09/09,Fulham,Everton,2,1,H,2.4,3.2,2.85,2009-09-13,2009/2010,6,E0,2-1,1,-0.4500000000000002,2009-09-13FulhamEverton
19/09/09,Arsenal,Wigan,4,0,H,1.22,5.3,13.0,2009-09-19,2009/2010,6,E0,4-0,4,-11.78,2009-09-19ArsenalWigan
19/09/09,Aston Villa,Portsmouth,2,0,H,1.43,4.0,7.6,2009-09-19,2009/2010,6,E0,2-0,2,-6.17,2009-09-19Aston VillaPortsmouth
19/09/09,Bolton,Stoke,1,1,D,2.1,3.25,3.4,2009-09-19,2009/2010,6,E0,1-1,0,-1.2999999999999998,2009-09-19BoltonStoke
19/09/09,Burnley,Sunderland,3,1,H,2.55,3.2,2.65,2009-09-19,2009/2010,6,E0,3-1,2,-0.10000000000000009,2009-09-19BurnleySunderland
19/09/09,Hull,Birmingham,0,1,A,2.3,3.2,3.0,2009-09-19,2009/2010,6,E0,0-1,-1,-0.7000000000000002,2009-09-19HullBirmingham
19/09/09,West Ham,Liverpool,2,3,A,6.0,3.7,1.55,2009-09-19,2009/2010,6,E0,2-3,-1,4.45,2009-09-19West HamLiverpool
20/09/09,Chelsea,Tottenham,3,0,H,1.55,3.7,6.0,2009-09-20,2009/2010,6,E0,3-0,3,-4.45,2009-09-20ChelseaTottenham
20/09/09,Everton,Blackburn,3,0,H,1.75,3.5,4.6,2009-09-20,2009/2010,6,E0,3-0,3,-2.8499999999999996,2009-09-20EvertonBlackburn
20/09/09,Man United,Man City,4,3,H,1.6,3.6,5.6,2009-09-20,2009/2010,7,E0,4-3,1,-3.9999999999999996,2009-09-20Man UnitedMan City
20/09/09,Wolves,Fulham,2,1,H,2.4,3.2,2.85,2009-09-20,2009/2010,7,E0,2-1,1,-0.4500000000000002,2009-09-20WolvesFulham
26/09/09,Birmingham,Bolton,1,2,A,2.1,3.25,3.4,2009-09-26,2009/2010,7,E0,1-2,-1,-1.2999999999999998,2009-09-26BirminghamBolton
26/09/09,Blackburn,Aston Villa,2,1,H,2.85,3.2,2.4,2009-09-26,2009/2010,7,E0,2-1,1,0.4500000000000002,2009-09-26BlackburnAston Villa
26/09/09,Fulham,Arsenal,0,1,A,6.0,3.7,1.55,2009-09-26,2009/2010,7,E0,0-1,-1,4.45,2009-09-26FulhamArsenal
26/09/09,Liverpool,Hull,6,1,H,1.15,6.5,15.0,2009-09-26,2009/2010,7,E0,6-1,5,-13.85,2009-09-26LiverpoolHull
26/09/09,Portsmouth,Everton,0,1,A,3.9,3.3,1.9,2009-09-26,2009/2010,7,E0,0-1,-1,2.0,2009-09-26PortsmouthEverton
26/09/09,Stoke,Man United,0,2,A,7.5,4.3,1.4,2009-09-26,2009/2010,7,E0,0-2,-2,6.1,2009-09-26StokeMan United
26/09/09,Tottenham,Burnley,5,0,H,1.35,4.5,8.5,2009-09-26,2009/2010,7,E0,5-0,5,-7.15,2009-09-26TottenhamBurnley
26/09/09,Wigan,Chelsea,3,1,H,8.5,4.5,1.35,2009-09-26,2009/2010,8,E0,3-1,2,7.15,2009-09-26WiganChelsea
27/09/09,Sunderland,Wolves,5,2,H,1.75,3.5,4.6,2009-09-27,2009/2010,8,E0,5-2,3,-2.8499999999999996,2009-09-27SunderlandWolves
28/09/09,Man City,West Ham,3,1,H,1.45,4.0,7.0,2009-09-28,2009/2010,8,E0,3-1,2,-5.55,2009-09-28Man CityWest Ham
03/10/09,Bolton,Tottenham,2,2,D,3.6,3.3,2.0,2009-10-03,2009/2010,8,E0,2-2,0,1.6,2009-10-03BoltonTottenham
03/10/09,Burnley,Birmingham,2,1,H,2.3,3.3,2.9,2009-10-03,2009/2010,8,E0,2-1,1,-0.6000000000000001,2009-10-03BurnleyBirmingham
03/10/09,Hull,Wigan,2,1,H,2.6,3.2,2.6,2009-10-03,2009/2010,8,E0,2-1,1,0.0,2009-10-03HullWigan
03/10/09,Man United,Sunderland,2,2,D,1.17,6.0,15.0,2009-10-03,2009/2010,8,E0,2-2,0,-13.83,2009-10-03Man UnitedSunderland
03/10/09,Wolves,Portsmouth,0,1,A,2.2,3.3,3.1,2009-10-03,2009/2010,8,E0,0-1,-1,-0.8999999999999999,2009-10-03WolvesPortsmouth
04/10/09,Arsenal,Blackburn,6,2,H,1.2,5.5,14.0,2009-10-04,2009/2010,8,E0,6-2,4,-12.8,2009-10-04ArsenalBlackburn
04/10/09,Chelsea,Liverpool,2,0,H,2.1,3.2,3.45,2009-10-04,2009/2010,9,E0,2-0,2,-1.35,2009-10-04ChelseaLiverpool
04/10/09,Everton,Stoke,1,1,D,1.5,3.9,6.5,2009-10-04,2009/2010,9,E0,1-1,0,-5.0,2009-10-04EvertonStoke
04/10/09,West Ham,Fulham,2,2,D,2.1,3.3,3.35,2009-10-04,2009/2010,9,E0,2-2,0,-1.25,2009-10-04West HamFulham
05/10/09,Aston Villa,Man City,1,1,D,2.6,3.2,2.6,2009-10-05,2009/2010,9,E0,1-1,0,0.0,2009-10-05Aston VillaMan City
17/10/09,Arsenal,Birmingham,3,1,H,1.2,5.5,14.0,2009-10-17,2009/2010,9,E0,3-1,2,-12.8,2009-10-17ArsenalBirmingham
17/10/09,Aston Villa,Chelsea,2,1,H,4.0,3.4,1.85,2009-10-17,2009/2010,9,E0,2-1,1,2.15,2009-10-17Aston VillaChelsea
17/10/09,Everton,Wolves,1,1,D,1.45,4.0,7.0,2009-10-17,2009/2010,9,E0,1-1,0,-5.55,2009-10-17EvertonWolves
17/10/09,Man United,Bolton,2,1,H,1.2,5.5,14.0,2009-10-17,2009/2010,9,E0,2-1,1,-12.8,2009-10-17Man UnitedBolton
17/10/09,Portsmouth,Tottenham,1,2,A,4.3,3.4,1.8,2009-10-17,2009/2010,9,E0,1-2,-1,2.5,2009-10-17PortsmouthTottenham
17/10/09,Stoke,West Ham,2,1,H,2.1,3.25,3.4,2009-10-17,2009/2010,10,E0,2-1,1,-1.2999999999999998,2009-10-17StokeWest Ham
17/10/09,Sunderland,Liverpool,1,0,H,4.6,3.5,1.75,2009-10-17,2009/2010,10,E0,1-0,1,2.8499999999999996,2009-10-17SunderlandLiverpool
18/10/09,Blackburn,Burnley,3,2,H,1.75,3.5,4.6,2009-10-18,2009/2010,10,E0,3-2,1,-2.8499999999999996,2009-10-18BlackburnBurnley
18/10/09,Wigan,Man City,1,1,D,4.6,3.5,1.75,2009-10-18,2009/2010,10,E0,1-1,0,2.8499999999999996,2009-10-18WiganMan City
19/10/09,Fulham,Hull,2,0,H,1.7,3.5,4.9,2009-10-19,2009/2010,10,E0,2-0,2,-3.2,2009-10-19FulhamHull
24/10/09,Birmingham,Sunderland,2,1,H,2.65,3.2,2.55,2009-10-24,2009/2010,10,E0,2-1,1,0.10000000000000009,2009-10-24BirminghamSunderland
24/10/09,Burnley,Wigan,1,3,A,2.4,3.2,2.85,2009-10-24,2009/2010,10,E0,1-3,-2,-0.4500000000000002,2009-10-24BurnleyWigan
24/10/09,Chelsea,Blackburn,5,0,H,1.22,5.3,13.0,2009-10-24,2009/2010,10,E0,5-0,5,-11.78,2009-10-24ChelseaBlackburn
24/10/09,Hull,Portsmouth,0,0,D,2.4,3.2,2.85,2009-10-24,2009/2010,10,E0,0-0,0,-0.4500000000000002,2009-10-24HullPortsmouth
24/10/09,Tottenham,Stoke,0,1,A,1.45,4.0,7.0,2009-10-24,2009/2010,11,E0,0-1,-1,-5.55,2009-10-24TottenhamStoke
24/10/09,Wolves,Aston Villa,1,1,D,3.4,3.25,2.1,2009-10-24,2009/2010,11,E0,1-1,0,1.2999999999999998,2009-10-24WolvesAston Villa
25/10/09,Bolton,Everton,3,2,H,2.6,3.2,2.6,2009-10-25,2009/2010,11,E0,3-2,1,0.0,2009-10-25BoltonEverton
25/10/09,Liverpool,Man United,2,0,H,2.7,3.2,2.5,2009-10-25,2009/2010,11,E0,2-0,2,0.20000000000000018,2009-10-25LiverpoolMan United
25/10/09,Man City,Fulham,2,2,D,1.4,4.3,7.5,2009-10-25,2009/2010,11,E0,2-2,0,-6.1,2009-10-25Man CityFulham
25/10/09,West Ham,Arsenal,2,2,D,7.0,4.0,1.45,2009-10-25,2009/2010,11,E0,2-2,0,5.55,2009-10-25West HamArsenal
31/10/09,Arsenal,Tottenham,3,0,H,1.6,3.6,5.6,2009-10-31,2009/2010,11,E0,3-0,3,-3.9999999999999996,2009-10-31ArsenalTottenham
31/10/09,Bolton,Chelsea,0,4,A,7.0,4.0,1.45,2009-10-31,2009/2010,11,E0,0-4,-4,5.55,2009-10-31BoltonChelsea
31/10/09,Burnley,Hull,2,0,H,1.9,3.3,3.9,2009-10-31,2009/2010,11,E0,2-0,2,-2.0,2009-10-31BurnleyHull
31/10/09,Everton,Aston Villa,1,1,D,2.4,3.3,2.8,2009-10-31,2009/2010,12,E0,1-1,0,-0.3999999999999999,2009-10-31EvertonAston Villa
31/10/09,Fulham,Liverpool,3,1,H,3.9,3.3,1.9,2009-10-31,2009/2010,12,E0,3-1,2,2.0,2009-10-31FulhamLiverpool
31/10/09,Man United,Blackburn,2,0,H,1.17,6.0,15.0,2009-10-31,2009/2010,12,E0,2-0,2,-13.83,2009-10-31Man UnitedBlackburn
31/10/09,Portsmouth,Wigan,4,0,H,2.3,3.3,2.9,2009-10-31,2009/2010,12,E0,4-0,4,-0.6000000000000001,2009-10-31PortsmouthWigan
31/10/09,Stoke,Wolves,2,2,D,1.9,3.4,3.7,2009-10-31,2009/2010,12,E0,2-2,0,-1.8000000000000003,2009-10-31StokeWolves
31/10/09,Sunderland,West Ham,2,2,D,1.9,3.3,3.9,2009-10-31,2009/2010,12,E0,2-2,0,-2.0,2009-10-31SunderlandWest Ham
01/11/09,Birmingham,Man City,0,0,D,3.7,3.4,1.9,2009-11-01,2009/2010,12,E0,0-0,0,1.8000000000000003,2009-11-01BirminghamMan City
04/11/09,West Ham,Aston Villa,2,1,H,2.7,3.2,2.5,2009-11-04,2009/2010,12,E0,2-1,1,0.20000000000000018,2009-11-04West HamAston Villa
07/11/09,Aston Villa,Bolton,5,1,H,1.75,3.5,4.6,2009-11-07,2009/2010,12,E0,5-1,4,-2.8499999999999996,2009-11-07Aston VillaBolton
07/11/09,Blackburn,Portsmouth,3,1,H,2.0,3.3,3.6,2009-11-07,2009/2010,13,E0,3-1,2,-1.6,2009-11-07BlackburnPortsmouth
07/11/09,Man City,Burnley,3,3,D,1.35,4.7,8.0,2009-11-07,2009/2010,13,E0,3-3,0,-6.65,2009-11-07Man CityBurnley
07/11/09,Tottenham,Sunderland,2,0,H,1.6,3.6,5.6,2009-11-07,2009/2010,13,E0,2-0,2,-3.9999999999999996,2009-11-07TottenhamSunderland
07/11/09,Wolves,Arsenal,1,4,A,7.0,4.5,1.4,2009-11-07,2009/2010,13,E0,1-4,-3,5.6,2009-11-07WolvesArsenal
08/11/09,Chelsea,Man United,1,0,H,2.1,3.15,3.5,2009-11-08,2009/2010,13,E0,1-0,1,-1.4,2009-11-08ChelseaMan United
08/11/09,Hull,Stoke,2,1,H,2.6,3.2,2.6,2009-11-08,2009/2010,13,E0,2-1,1,0.0,2009-11-08HullStoke
08/11/09,West Ham,Everton,1,2,A,2.5,3.2,2.7,2009-11-08,2009/2010,13,E0,1-2,-1,-0.20000000000000018,2009-11-08West HamEverton
08/11/09,Wigan,Fulham,1,1,D,2.2,3.2,3.2,2009-11-08,2009/2010,13,E0,1-1,0,-1.0,2009-11-08WiganFulham
09/11/09,Liverpool,Birmingham,2,2,D,1.3,4.9,9.0,2009-11-09,2009/2010,13,E0,2-2,0,-7.7,2009-11-09LiverpoolBirmingham
21/11/09,Birmingham,Fulham,1,0,H,2.4,3.2,2.85,2009-11-21,2009/2010,14,E0,1-0,1,-0.4500000000000002,2009-11-21BirminghamFulham
21/11/09,Burnley,Aston Villa,1,1,D,3.2,3.2,2.2,2009-11-21,2009/2010,14,E0,1-1,0,1.0,2009-11-21BurnleyAston Villa
21/11/09,Chelsea,Wolves,4,0,H,1.15,6.5,15.0,2009-11-21,2009/2010,14,E0,4-0,4,-13.85,2009-11-21ChelseaWolves
21/11/09,Hull,West Ham,3,3,D,2.7,3.2,2.5,2009-11-21,2009/2010,14,E0,3-3,0,0.20000000000000018,2009-11-21HullWest Ham
21/11/09,Liverpool,Man City,2,2,D,1.9,3.3,3.9,2009-11-21,2009/2010,14,E0,2-2,0,-2.0,2009-11-21LiverpoolMan City
21/11/09,Man United,Everton,3,0,H,1.35,4.5,8.5,2009-11-21,2009/2010,14,E0,3-0,3,-7.15,2009-11-21Man UnitedEverton
21/11/09,Sunderland,Arsenal,1,0,H,5.2,3.8,1.6,2009-11-21,2009/2010,14,E0,1-0,1,3.6,2009-11-21SunderlandArsenal
22/11/09,Bolton,Blackburn,0,2,A,2.2,3.2,3.2,2009-11-22,2009/2010,14,E0,0-2,-2,-1.0,2009-11-22BoltonBlackburn
22/11/09,Stoke,Portsmouth,1,0,H,2.0,3.3,3.6,2009-11-22,2009/2010,14,E0,1-0,1,-1.6,2009-11-22StokePortsmouth
22/11/09,Tottenham,Wigan,9,1,H,1.5,3.9,6.5,2009-11-22,2009/2010,15,E0,9-1,8,-5.0,2009-11-22TottenhamWigan
25/11/09,Fulham,Blackburn,3,0,H,2.2,3.2,3.2,2009-11-25,2009/2010,15,E0,3-0,3,-1.0,2009-11-25FulhamBlackburn
25/11/09,Hull,Everton,3,2,H,3.1,3.3,2.2,2009-11-25,2009/2010,15,E0,3-2,1,0.8999999999999999,2009-11-25HullEverton
28/11/09,Aston Villa,Tottenham,1,1,D,2.6,3.2,2.6,2009-11-28,2009/2010,15,E0,1-1,0,0.0,2009-11-28Aston VillaTottenham
28/11/09,Blackburn,Stoke,0,0,D,1.95,3.3,3.8,2009-11-28,2009/2010,15,E0,0-0,0,-1.8499999999999999,2009-11-28BlackburnStoke
28/11/09,Fulham,Bolton,1,1,D,1.9,3.3,3.9,2009-11-28,2009/2010,15,E0,1-1,0,-2.0,2009-11-28FulhamBolton
28/11/09,Man City,Hull,1,1,D,1.3,5.0,9.0,2009-11-28,2009/2010,15,E0,1-1,0,-7.7,2009-11-28Man CityHull
28/11/09,Portsmouth,Man United,1,4,A,7.5,4.3,1.42,2009-11-28,2009/2010,15,E0,1-4,-3,6.08,2009-11-28PortsmouthMan United
28/11/09,West Ham,Burnley,5,3,H,1.8,3.4,4.3,2009-11-28,2009/2010,15,E0,5-3,2,-2.5,2009-11-28West HamBurnley
28/11/09,Wigan,Sunderland,1,0,H,2.5,3.2,2.7,2009-11-28,2009/2010,16,E0,1-0,1,-0.20000000000000018,2009-11-28WiganSunderland
29/11/09,Arsenal,Chelsea,0,3,A,2.6,3.2,2.6,2009-11-29,2009/2010,16,E0,0-3,-3,0.0,2009-11-29ArsenalChelsea
29/11/09,Everton,Liverpool,0,2,A,3.35,3.3,2.1,2009-11-29,2009/2010,16,E0,0-2,-2,1.25,2009-11-29EvertonLiverpool
29/11/09,Wolves,Birmingham,0,1,A,2.5,3.2,2.7,2009-11-29,2009/2010,16,E0,0-1,-1,-0.20000000000000018,2009-11-29WolvesBirmingham
05/12/09,Arsenal,Stoke,2,0,H,1.27,4.9,11.0,2009-12-05,2009/2010,16,E0,2-0,2,-9.73,2009-12-05ArsenalStoke
05/12/09,Aston Villa,Hull,3,0,H,1.5,3.8,6.7,2009-12-05,2009/2010,16,E0,3-0,3,-5.2,2009-12-05Aston VillaHull
05/12/09,Blackburn,Liverpool,0,0,D,4.6,3.5,1.75,2009-12-05,2009/2010,16,E0,0-0,0,2.8499999999999996,2009-12-05BlackburnLiverpool
05/12/09,Man City,Chelsea,2,1,H,3.9,3.3,1.9,2009-12-05,2009/2010,16,E0,2-1,1,2.0,2009-12-05Man CityChelsea
05/12/09,Portsmouth,Burnley,2,0,H,1.85,3.4,4.0,2009-12-05,2009/2010,16,E0,2-0,2,-2.15,2009-12-05PortsmouthBurnley
05/12/09,West Ham,Man United,0,4,A,6.5,3.9,1.5,2009-12-05,2009/2010,17,E0,0-4,-4,5.0,2009-12-05West HamMan United
05/12/09,Wigan,Birmingham,2,3,A,2.1,3.25,3.4,2009-12-05,2009/2010,17,E0,2-3,-1,-1.2999999999999998,2009-12-05WiganBirmingham
05/12/09,Wolves,Bolton,2,1,H,2.4,3.2,2.85,2009-12-05,2009/2010,17,E0,2-1,1,-0.4500000000000002,2009-12-05WolvesBolton
06/12/09,Everton,Tottenham,2,2,D,2.6,3.2,2.6,2009-12-06,2009/2010,17,E0,2-2,0,0.0,2009-12-06EvertonTottenham
06/12/09,Fulham,Sunderland,1,0,H,2.0,3.3,3.6,2009-12-06,2009/2010,17,E0,1-0,1,-1.6,2009-12-06FulhamSunderland
12/12/09,Birmingham,West Ham,1,0,H,2.1,3.25,3.4,2009-12-12,2009/2010,17,E0,1-0,1,-1.2999999999999998,2009-12-12BirminghamWest Ham
12/12/09,Bolton,Man City,3,3,D,4.0,3.4,1.85,2009-12-12,2009/2010,17,E0,3-3,0,2.15,2009-12-12BoltonMan City
12/12/09,Burnley,Fulham,1,1,D,2.6,3.2,2.6,2009-12-12,2009/2010,17,E0,1-1,0,0.0,2009-12-12BurnleyFulham
12/12/09,Chelsea,Everton,3,3,D,1.27,4.9,11.0,2009-12-12,2009/2010,17,E0,3-3,0,-9.73,2009-12-12ChelseaEverton
12/12/09,Hull,Blackburn,0,0,D,2.7,3.2,2.5,2009-12-12,2009/2010,18,E0,0-0,0,0.20000000000000018,2009-12-12HullBlackburn
12/12/09,Man United,Aston Villa,0,1,A,1.4,4.3,7.5,2009-12-12,2009/2010,18,E0,0-1,-1,-6.1,2009-12-12Man UnitedAston Villa
12/12/09,Stoke,Wigan,2,2,D,2.0,3.3,3.6,2009-12-12,2009/2010,18,E0,2-2,0,-1.6,2009-12-12StokeWigan
12/12/09,Sunderland,Portsmouth,1,1,D,1.75,3.5,4.6,2009-12-12,2009/2010,18,E0,1-1,0,-2.8499999999999996,2009-12-12SunderlandPortsmouth
12/12/09,Tottenham,Wolves,0,1,A,1.3,4.8,9.5,2009-12-12,2009/2010,18,E0,0-1,-1,-8.2,2009-12-12TottenhamWolves
13/12/09,Liverpool,Arsenal,1,2,A,2.2,3.2,3.2,2009-12-13,2009/2010,18,E0,1-2,-1,-1.0,2009-12-13LiverpoolArsenal
15/12/09,Birmingham,Blackburn,2,1,H,2.1,3.3,3.35,2009-12-15,2009/2010,18,E0,2-1,1,-1.25,2009-12-15BirminghamBlackburn
15/12/09,Bolton,West Ham,3,1,H,2.2,3.3,3.1,2009-12-15,2009/2010,18,E0,3-1,2,-0.8999999999999999,2009-12-15BoltonWest Ham
15/12/09,Man United,Wolves,3,0,H,1.17,6.0,15.0,2009-12-15,2009/2010,18,E0,3-0,3,-13.83,2009-12-15Man UnitedWolves
15/12/09,Sunderland,Aston Villa,0,2,A,2.7,3.2,2.5,2009-12-15,2009/2010,19,E0,0-2,-2,0.20000000000000018,2009-12-15SunderlandAston Villa
16/12/09,Burnley,Arsenal,1,1,D,6.5,3.9,1.5,2009-12-16,2009/2010,19,E0,1-1,0,5.0,2009-12-16BurnleyArsenal
16/12/09,Chelsea,Portsmouth,2,1,H,1.17,6.0,15.0,2009-12-16,2009/2010,19,E0,2-1,1,-13.83,2009-12-16ChelseaPortsmouth
16/12/09,Liverpool,Wigan,2,1,H,1.35,4.5,8.5,2009-12-16,2009/2010,19,E0,2-1,1,-7.15,2009-12-16LiverpoolWigan
16/12/09,Tottenham,Man City,3,0,H,2.1,3.3,3.35,2009-12-16,2009/2010,19,E0,3-0,3,-1.25,2009-12-16TottenhamMan City
19/12/09,Arsenal,Hull,3,0,H,1.17,6.5,13.0,2009-12-19,2009/2010,19,E0,3-0,3,-11.83,2009-12-19ArsenalHull
19/12/09,Aston Villa,Stoke,1,0,H,1.45,4.0,7.0,2009-12-19,2009/2010,19,E0,1-0,1,-5.55,2009-12-19Aston VillaStoke
19/12/09,Blackburn,Tottenham,0,2,A,3.0,3.2,2.3,2009-12-19,2009/2010,19,E0,0-2,-2,0.7000000000000002,2009-12-19BlackburnTottenham
19/12/09,Fulham,Man United,3,0,H,6.0,3.7,1.55,2009-12-19,2009/2010,19,E0,3-0,3,4.45,2009-12-19FulhamMan United
19/12/09,Man City,Sunderland,4,3,H,1.45,4.0,7.0,2009-12-19,2009/2010,20,E0,4-3,1,-5.55,2009-12-19Man CitySunderland
19/12/09,Portsmouth,Liverpool,2,0,H,5.3,3.5,1.65,2009-12-19,2009/2010,20,E0,2-0,2,3.65,2009-12-19PortsmouthLiverpool
20/12/09,Everton,Birmingham,1,1,D,1.9,3.4,3.7,2009-12-20,2009/2010,20,E0,1-1,0,-1.8000000000000003,2009-12-20EvertonBirmingham
20/12/09,West Ham,Chelsea,1,1,D,7.6,4.0,1.43,2009-12-20,2009/2010,20,E0,1-1,0,6.17,2009-12-20West HamChelsea
20/12/09,Wolves,Burnley,2,0,H,2.0,3.3,3.6,2009-12-20,2009/2010,20,E0,2-0,2,-1.6,2009-12-20WolvesBurnley
26/12/09,Birmingham,Chelsea,0,0,D,6.0,3.7,1.55,2009-12-26,2009/2010,20,E0,0-0,0,4.45,2009-12-26BirminghamChelsea
26/12/09,Burnley,Bolton,1,1,D,2.3,3.3,2.9,2009-12-26,2009/2010,20,E0,1-1,0,-0.6000000000000001,2009-12-26BurnleyBolton
26/12/09,Fulham,Tottenham,0,0,D,2.85,3.2,2.4,2009-12-26,2009/2010,20,E0,0-0,0,0.4500000000000002,2009-12-26FulhamTottenham
26/12/09,Liverpool,Wolves,2,0,H,1.27,4.9,11.0,2009-12-26,2009/2010,20,E0,2-0,2,-9.73,2009-12-26LiverpoolWolves
26/12/09,Man City,Stoke,2,0,H,1.45,4.0,7.0,2009-12-26,2009/2010,21,E0,2-0,2,-5.55,2009-12-26Man CityStoke
26/12/09,Sunderland,Everton,1,1,D,2.3,3.3,2.9,2009-12-26,2009/2010,21,E0,1-1,0,-0.6000000000000001,2009-12-26SunderlandEverton
26/12/09,West Ham,Portsmouth,2,0,H,2.15,3.3,3.2,2009-12-26,2009/2010,21,E0,2-0,2,-1.0500000000000003,2009-12-26West HamPortsmouth
26/12/09,Wigan,Blackburn,1,1,D,2.2,3.3,3.1,2009-12-26,2009/2010,21,E0,1-1,0,-0.8999999999999999,2009-12-26WiganBlackburn
27/12/09,Arsenal,Aston Villa,3,0,H,1.65,3.5,5.3,2009-12-27,2009/2010,21,E0,3-0,3,-3.65,2009-12-27ArsenalAston Villa
27/12/09,Hull,Man United,1,3,A,8.0,4.7,1.35,2009-12-27,2009/2010,21,E0,1-3,-2,6.65,2009-12-27HullMan United
28/12/09,Blackburn,Sunderland,2,2,D,2.0,3.3,3.6,2009-12-28,2009/2010,21,E0,2-2,0,-1.6,2009-12-28BlackburnSunderland
28/12/09,Chelsea,Fulham,2,1,H,1.4,4.3,7.5,2009-12-28,2009/2010,21,E0,2-1,1,-6.1,2009-12-28ChelseaFulham
28/12/09,Everton,Burnley,2,0,H,1.6,3.6,5.6,2009-12-28,2009/2010,21,E0,2-0,2,-3.9999999999999996,2009-12-28EvertonBurnley
28/12/09,Stoke,Birmingham,0,1,A,2.4,3.2,2.85,2009-12-28,2009/2010,22,E0,0-1,-1,-0.4500000000000002,2009-12-28StokeBirmingham
28/12/09,Tottenham,West Ham,2,0,H,1.45,4.0,7.0,2009-12-28,2009/2010,22,E0,2-0,2,-5.55,2009-12-28TottenhamWest Ham
28/12/09,Wolves,Man City,0,3,A,4.3,3.4,1.8,2009-12-28,2009/2010,22,E0,0-3,-3,2.5,2009-12-28WolvesMan City
29/12/09,Aston Villa,Liverpool,0,1,A,2.6,3.2,2.6,2009-12-29,2009/2010,22,E0,0-1,-1,0.0,2009-12-29Aston VillaLiverpool
29/12/09,Bolton,Hull,2,2,D,1.85,3.4,4.0,2009-12-29,2009/2010,22,E0,2-2,0,-2.15,2009-12-29BoltonHull
30/12/09,Man United,Wigan,5,0,H,1.22,5.3,13.0,2009-12-30,2009/2010,22,E0,5-0,5,-11.78,2009-12-30Man UnitedWigan
30/12/09,Portsmouth,Arsenal,1,4,A,6.0,3.7,1.55,2009-12-30,2009/2010,22,E0,1-4,-3,4.45,2009-12-30PortsmouthArsenal
05/01/10,Stoke,Fulham,3,2,H,2.6,3.2,2.6,2010-01-05,2009/2010,22,E0,3-2,1,0.0,2010-01-05StokeFulham
09/01/10,Arsenal,Everton,2,2,D,1.4,4.3,7.5,2010-01-09,2009/2010,22,E0,2-2,0,-6.1,2010-01-09ArsenalEverton
09/01/10,Birmingham,Man United,1,1,D,5.3,3.5,1.65,2010-01-09,2009/2010,23,E0,1-1,0,3.65,2010-01-09BirminghamMan United
11/01/10,Man City,Blackburn,4,1,H,1.45,4.0,7.0,2010-01-11,2009/2010,23,E0,4-1,3,-5.55,2010-01-11Man CityBlackburn
16/01/10,Chelsea,Sunderland,7,2,H,1.22,5.3,13.0,2010-01-16,2009/2010,23,E0,7-2,5,-11.78,2010-01-16ChelseaSunderland
16/01/10,Everton,Man City,2,0,H,2.7,3.2,2.5,2010-01-16,2009/2010,23,E0,2-0,2,0.20000000000000018,2010-01-16EvertonMan City
16/01/10,Man United,Burnley,3,0,H,1.17,6.0,15.0,2010-01-16,2009/2010,23,E0,3-0,3,-13.83,2010-01-16Man UnitedBurnley
16/01/10,Stoke,Liverpool,1,1,D,3.6,3.3,2.0,2010-01-16,2009/2010,23,E0,1-1,0,1.6,2010-01-16StokeLiverpool
16/01/10,Tottenham,Hull,0,0,D,1.3,4.8,9.5,2010-01-16,2009/2010,23,E0,0-0,0,-8.2,2010-01-16TottenhamHull
16/01/10,Wolves,Wigan,0,2,A,2.2,3.2,3.2,2010-01-16,2009/2010,23,E0,0-2,-2,-1.0,2010-01-16WolvesWigan
17/01/10,Aston Villa,West Ham,0,0,D,1.55,3.7,6.0,2010-01-17,2009/2010,23,E0,0-0,0,-4.45,2010-01-17Aston VillaWest Ham
17/01/10,Blackburn,Fulham,2,0,H,2.2,3.2,3.2,2010-01-17,2009/2010,24,E0,2-0,2,-1.0,2010-01-17BlackburnFulham
17/01/10,Bolton,Arsenal,0,2,A,6.0,3.7,1.55,2010-01-17,2009/2010,24,E0,0-2,-2,4.45,2010-01-17BoltonArsenal
20/01/10,Arsenal,Bolton,4,2,H,1.2,5.7,13.0,2010-01-20,2009/2010,24,E0,4-2,2,-11.8,2010-01-20ArsenalBolton
20/01/10,Liverpool,Tottenham,2,0,H,2.3,3.3,2.9,2010-01-20,2009/2010,24,E0,2-0,2,-0.6000000000000001,2010-01-20LiverpoolTottenham
23/01/10,Man United,Hull,4,0,H,1.17,6.5,14.0,2010-01-23,2009/2010,24,E0,4-0,4,-12.83,2010-01-23Man UnitedHull
26/01/10,Bolton,Burnley,1,0,H,1.8,3.4,4.3,2010-01-26,2009/2010,24,E0,1-0,1,-2.5,2010-01-26BoltonBurnley
26/01/10,Portsmouth,West Ham,1,1,D,2.4,3.2,2.85,2010-01-26,2009/2010,24,E0,1-1,0,-0.4500000000000002,2010-01-26PortsmouthWest Ham
26/01/10,Tottenham,Fulham,2,0,H,1.57,3.6,6.0,2010-01-26,2009/2010,24,E0,2-0,2,-4.43,2010-01-26TottenhamFulham
26/01/10,Wolves,Liverpool,0,0,D,4.6,3.5,1.75,2010-01-26,2009/2010,24,E0,0-0,0,2.8499999999999996,2010-01-26WolvesLiverpool
27/01/10,Aston Villa,Arsenal,0,0,D,3.4,3.25,2.1,2010-01-27,2009/2010,25,E0,0-0,0,1.2999999999999998,2010-01-27Aston VillaArsenal
27/01/10,Blackburn,Wigan,2,1,H,1.9,3.3,3.9,2010-01-27,2009/2010,25,E0,2-1,1,-2.0,2010-01-27BlackburnWigan
27/01/10,Chelsea,Birmingham,3,0,H,1.25,5.0,12.0,2010-01-27,2009/2010,25,E0,3-0,3,-10.75,2010-01-27ChelseaBirmingham
27/01/10,Everton,Sunderland,2,0,H,1.65,3.5,5.3,2010-01-27,2009/2010,25,E0,2-0,2,-3.65,2010-01-27EvertonSunderland
30/01/10,Birmingham,Tottenham,1,1,D,3.0,3.2,2.3,2010-01-30,2009/2010,25,E0,1-1,0,0.7000000000000002,2010-01-30BirminghamTottenham
30/01/10,Burnley,Chelsea,1,2,A,9.0,4.6,1.33,2010-01-30,2009/2010,25,E0,1-2,-1,7.67,2010-01-30BurnleyChelsea
30/01/10,Fulham,Aston Villa,0,2,A,2.6,3.2,2.6,2010-01-30,2009/2010,25,E0,0-2,-2,0.0,2010-01-30FulhamAston Villa
30/01/10,Hull,Wolves,2,2,D,2.2,3.2,3.2,2010-01-30,2009/2010,25,E0,2-2,0,-1.0,2010-01-30HullWolves
30/01/10,Liverpool,Bolton,2,0,H,1.45,4.0,7.0,2010-01-30,2009/2010,25,E0,2-0,2,-5.55,2010-01-30LiverpoolBolton
30/01/10,West Ham,Blackburn,0,0,D,2.1,3.25,3.4,2010-01-30,2009/2010,26,E0,0-0,0,-1.2999999999999998,2010-01-30West HamBlackburn
30/01/10,Wigan,Everton,0,1,A,2.85,3.2,2.4,2010-01-30,2009/2010,26,E0,0-1,-1,0.4500000000000002,2010-01-30WiganEverton
31/01/10,Arsenal,Man United,1,3,A,2.3,3.2,3.0,2010-01-31,2009/2010,26,E0,1-3,-2,-0.7000000000000002,2010-01-31ArsenalMan United
31/01/10,Man City,Portsmouth,2,0,H,1.35,4.5,8.5,2010-01-31,2009/2010,26,E0,2-0,2,-7.15,2010-01-31Man CityPortsmouth
01/02/10,Sunderland,Stoke,0,0,D,2.05,3.25,3.5,2010-02-01,2009/2010,26,E0,0-0,0,-1.4500000000000002,2010-02-01SunderlandStoke
02/02/10,Hull,Chelsea,1,1,D,9.5,4.8,1.3,2010-02-02,2009/2010,26,E0,1-1,0,8.2,2010-02-02HullChelsea
03/02/10,Fulham,Portsmouth,1,0,H,1.7,3.5,4.9,2010-02-03,2009/2010,26,E0,1-0,1,-3.2,2010-02-03FulhamPortsmouth
06/02/10,Bolton,Fulham,0,0,D,2.2,3.2,3.2,2010-02-06,2009/2010,26,E0,0-0,0,-1.0,2010-02-06BoltonFulham
06/02/10,Burnley,West Ham,2,1,H,2.45,3.1,2.9,2010-02-06,2009/2010,26,E0,2-1,1,-0.44999999999999973,2010-02-06BurnleyWest Ham
06/02/10,Hull,Man City,2,1,H,4.9,3.5,1.7,2010-02-06,2009/2010,27,E0,2-1,1,3.2,2010-02-06HullMan City
06/02/10,Liverpool,Everton,1,0,H,1.75,3.5,4.6,2010-02-06,2009/2010,27,E0,1-0,1,-2.8499999999999996,2010-02-06LiverpoolEverton
06/02/10,Man United,Portsmouth,5,0,H,1.12,7.0,22.0,2010-02-06,2009/2010,27,E0,5-0,5,-20.88,2010-02-06Man UnitedPortsmouth
06/02/10,Stoke,Blackburn,3,0,H,2.2,3.2,3.2,2010-02-06,2009/2010,27,E0,3-0,3,-1.0,2010-02-06StokeBlackburn
06/02/10,Sunderland,Wigan,1,1,D,2.1,3.25,3.4,2010-02-06,2009/2010,27,E0,1-1,0,-1.2999999999999998,2010-02-06SunderlandWigan
06/02/10,Tottenham,Aston Villa,0,0,D,2.1,3.25,3.4,2010-02-06,2009/2010,27,E0,0-0,0,-1.2999999999999998,2010-02-06TottenhamAston Villa
07/02/10,Birmingham,Wolves,2,1,H,1.8,3.4,4.3,2010-02-07,2009/2010,27,E0,2-1,1,-2.5,2010-02-07BirminghamWolves
07/02/10,Chelsea,Arsenal,2,0,H,1.7,3.5,4.9,2010-02-07,2009/2010,27,E0,2-0,2,-3.2,2010-02-07ChelseaArsenal
09/02/10,Fulham,Burnley,3,0,H,1.7,3.5,4.9,2010-02-09,2009/2010,27,E0,3-0,3,-3.2,2010-02-09FulhamBurnley
09/02/10,Man City,Bolton,2,0,H,1.4,4.3,7.5,2010-02-09,2009/2010,28,E0,2-0,2,-6.1,2010-02-09Man CityBolton
09/02/10,Portsmouth,Sunderland,1,1,D,2.4,3.2,2.85,2010-02-09,2009/2010,28,E0,1-1,0,-0.4500000000000002,2010-02-09PortsmouthSunderland
09/02/10,Wigan,Stoke,1,1,D,2.2,3.2,3.2,2010-02-09,2009/2010,28,E0,1-1,0,-1.0,2010-02-09WiganStoke
10/02/10,Arsenal,Liverpool,1,0,H,2.1,3.25,3.4,2010-02-10,2009/2010,28,E0,1-0,1,-1.2999999999999998,2010-02-10ArsenalLiverpool
10/02/10,Aston Villa,Man United,1,1,D,3.9,3.3,1.9,2010-02-10,2009/2010,28,E0,1-1,0,2.0,2010-02-10Aston VillaMan United
10/02/10,Blackburn,Hull,1,0,H,1.8,3.4,4.3,2010-02-10,2009/2010,28,E0,1-0,1,-2.5,2010-02-10BlackburnHull
10/02/10,Everton,Chelsea,2,1,H,4.9,3.5,1.7,2010-02-10,2009/2010,28,E0,2-1,1,3.2,2010-02-10EvertonChelsea
10/02/10,West Ham,Birmingham,2,0,H,2.35,3.2,2.95,2010-02-10,2009/2010,28,E0,2-0,2,-0.6000000000000001,2010-02-10West HamBirmingham
10/02/10,Wolves,Tottenham,1,0,H,4.0,3.4,1.85,2010-02-10,2009/2010,28,E0,1-0,1,2.15,2010-02-10WolvesTottenham
16/02/10,Stoke,Man City,1,1,D,3.2,3.2,2.2,2010-02-16,2009/2010,29,E0,1-1,0,1.0,2010-02-16StokeMan City
17/02/10,Wigan,Bolton,0,0,D,2.2,3.2,3.2,2010-02-17,2009/2010,29,E0,0-0,0,-1.0,2010-02-17WiganBolton
20/02/10,Arsenal,Sunderland,2,0,H,1.2,5.5,14.0,2010-02-20,2009/2010,29,E0,2-0,2,-12.8,2010-02-20ArsenalSunderland
20/02/10,Everton,Man United,3,1,H,4.3,3.4,1.8,2010-02-20,2009/2010,29,E0,3-1,2,2.5,2010-02-20EvertonMan United
20/02/10,Portsmouth,Stoke,1,2,A,2.3,3.2,3.0,2010-02-20,2009/2010,29,E0,1-2,-1,-0.7000000000000002,2010-02-20PortsmouthStoke
20/02/10,West Ham,Hull,3,0,H,1.8,3.4,4.3,2010-02-20,2009/2010,29,E0,3-0,3,-2.5,2010-02-20West HamHull
20/02/10,Wolves,Chelsea,0,2,A,9.0,4.6,1.33,2010-02-20,2009/2010,29,E0,0-2,-2,7.67,2010-02-20WolvesChelsea
21/02/10,Aston Villa,Burnley,5,2,H,1.4,4.3,7.5,2010-02-21,2009/2010,29,E0,5-2,3,-6.1,2010-02-21Aston VillaBurnley
21/02/10,Blackburn,Bolton,3,0,H,2.0,3.3,3.6,2010-02-21,2009/2010,29,E0,3-0,3,-1.6,2010-02-21BlackburnBolton
21/02/10,Fulham,Birmingham,2,1,H,2.1,3.25,3.4,2010-02-21,2009/2010,30,E0,2-1,1,-1.2999999999999998,2010-02-21FulhamBirmingham
21/02/10,Man City,Liverpool,0,0,D,2.4,3.3,2.8,2010-02-21,2009/2010,30,E0,0-0,0,-0.3999999999999999,2010-02-21Man CityLiverpool
21/02/10,Wigan,Tottenham,0,3,A,3.35,3.3,2.1,2010-02-21,2009/2010,30,E0,0-3,-3,1.25,2010-02-21WiganTottenham
23/02/10,Man United,West Ham,3,0,H,1.2,5.5,14.0,2010-02-23,2009/2010,30,E0,3-0,3,-12.8,2010-02-23Man UnitedWest Ham
27/02/10,Birmingham,Wigan,1,0,H,2.0,3.3,3.6,2010-02-27,2009/2010,30,E0,1-0,1,-1.6,2010-02-27BirminghamWigan
27/02/10,Bolton,Wolves,1,0,H,1.9,3.3,3.9,2010-02-27,2009/2010,30,E0,1-0,1,-2.0,2010-02-27BoltonWolves
27/02/10,Burnley,Portsmouth,1,2,A,2.0,3.3,3.6,2010-02-27,2009/2010,30,E0,1-2,-1,-1.6,2010-02-27BurnleyPortsmouth
27/02/10,Chelsea,Man City,2,4,A,1.45,4.0,7.0,2010-02-27,2009/2010,30,E0,2-4,-2,-5.55,2010-02-27ChelseaMan City
27/02/10,Stoke,Arsenal,1,3,A,4.9,3.5,1.7,2010-02-27,2009/2010,30,E0,1-3,-2,3.2,2010-02-27StokeArsenal
28/02/10,Liverpool,Blackburn,2,1,H,1.37,4.5,8.2,2010-02-28,2009/2010,31,E0,2-1,1,-6.829999999999999,2010-02-28LiverpoolBlackburn
28/02/10,Sunderland,Fulham,0,0,D,2.2,3.2,3.2,2010-02-28,2009/2010,31,E0,0-0,0,-1.0,2010-02-28SunderlandFulham
28/02/10,Tottenham,Everton,2,1,H,1.9,3.3,3.9,2010-02-28,2009/2010,31,E0,2-1,1,-2.0,2010-02-28TottenhamEverton
06/03/10,Arsenal,Burnley,3,1,H,1.15,6.5,15.0,2010-03-06,2009/2010,31,E0,3-1,2,-13.85,2010-03-06ArsenalBurnley
06/03/10,West Ham,Bolton,1,2,A,1.8,3.4,4.3,2010-03-06,2009/2010,31,E0,1-2,-1,-2.5,2010-03-06West HamBolton
06/03/10,Wolves,Man United,0,1,A,8.5,4.5,1.35,2010-03-06,2009/2010,31,E0,0-1,-1,7.15,2010-03-06WolvesMan United
07/03/10,Everton,Hull,5,1,H,1.4,4.3,7.5,2010-03-07,2009/2010,31,E0,5-1,4,-6.1,2010-03-07EvertonHull
08/03/10,Wigan,Liverpool,1,0,H,5.3,3.5,1.65,2010-03-08,2009/2010,31,E0,1-0,1,3.65,2010-03-08WiganLiverpool
09/03/10,Portsmouth,Birmingham,1,2,A,2.4,3.2,2.85,2010-03-09,2009/2010,31,E0,1-2,-1,-0.4500000000000002,2010-03-09PortsmouthBirmingham
09/03/10,Sunderland,Bolton,4,0,H,2.1,3.25,3.4,2010-03-09,2009/2010,32,E0,4-0,4,-1.2999999999999998,2010-03-09SunderlandBolton
10/03/10,Burnley,Stoke,1,1,D,2.4,3.2,2.85,2010-03-10,2009/2010,32,E0,1-1,0,-0.4500000000000002,2010-03-10BurnleyStoke
13/03/10,Birmingham,Everton,2,2,D,2.7,3.2,2.5,2010-03-13,2009/2010,32,E0,2-2,0,0.20000000000000018,2010-03-13BirminghamEverton
13/03/10,Bolton,Wigan,4,0,H,2.0,3.3,3.6,2010-03-13,2009/2010,32,E0,4-0,4,-1.6,2010-03-13BoltonWigan
13/03/10,Burnley,Wolves,1,2,A,2.2,3.2,3.2,2010-03-13,2009/2010,32,E0,1-2,-1,-1.0,2010-03-13BurnleyWolves
13/03/10,Chelsea,West Ham,4,1,H,1.25,5.0,12.0,2010-03-13,2009/2010,32,E0,4-1,3,-10.75,2010-03-13ChelseaWest Ham
13/03/10,Hull,Arsenal,1,2,A,7.0,4.5,1.4,2010-03-13,2009/2010,32,E0,1-2,-1,5.6,2010-03-13HullArsenal
13/03/10,Stoke,Aston Villa,0,0,D,2.9,3.2,2.35,2010-03-13,2009/2010,32,E0,0-0,0,0.5499999999999998,2010-03-13StokeAston Villa
13/03/10,Tottenham,Blackburn,3,1,H,1.5,3.9,6.5,2010-03-13,2009/2010,32,E0,3-1,2,-5.0,2010-03-13TottenhamBlackburn
14/03/10,Man United,Fulham,3,0,H,1.22,5.3,13.0,2010-03-14,2009/2010,33,E0,3-0,3,-11.78,2010-03-14Man UnitedFulham
14/03/10,Sunderland,Man City,1,1,D,3.6,3.3,2.0,2010-03-14,2009/2010,33,E0,1-1,0,1.6,2010-03-14SunderlandMan City
15/03/10,Liverpool,Portsmouth,4,1,H,1.25,5.0,12.0,2010-03-15,2009/2010,33,E0,4-1,3,-10.75,2010-03-15LiverpoolPortsmouth
16/03/10,Wigan,Aston Villa,1,2,A,3.2,3.2,2.2,2010-03-16,2009/2010,33,E0,1-2,-1,1.0,2010-03-16WiganAston Villa
20/03/10,Arsenal,West Ham,2,0,H,1.22,5.5,12.0,2010-03-20,2009/2010,33,E0,2-0,2,-10.78,2010-03-20ArsenalWest Ham
20/03/10,Aston Villa,Wolves,2,2,D,1.4,4.3,7.5,2010-03-20,2009/2010,33,E0,2-2,0,-6.1,2010-03-20Aston VillaWolves
20/03/10,Everton,Bolton,2,0,H,1.5,3.9,6.5,2010-03-20,2009/2010,33,E0,2-0,2,-5.0,2010-03-20EvertonBolton
20/03/10,Portsmouth,Hull,3,2,H,2.1,3.3,3.35,2010-03-20,2009/2010,33,E0,3-2,1,-1.25,2010-03-20PortsmouthHull
20/03/10,Stoke,Tottenham,1,2,A,3.4,3.25,2.1,2010-03-20,2009/2010,33,E0,1-2,-1,1.2999999999999998,2010-03-20StokeTottenham
20/03/10,Sunderland,Birmingham,3,1,H,2.2,3.2,3.2,2010-03-20,2009/2010,34,E0,3-1,2,-1.0,2010-03-20SunderlandBirmingham
20/03/10,Wigan,Burnley,1,0,H,1.8,3.4,4.3,2010-03-20,2009/2010,34,E0,1-0,1,-2.5,2010-03-20WiganBurnley
21/03/10,Blackburn,Chelsea,1,1,D,7.0,4.0,1.45,2010-03-21,2009/2010,34,E0,1-1,0,5.55,2010-03-21BlackburnChelsea
21/03/10,Fulham,Man City,1,2,A,2.85,3.2,2.4,2010-03-21,2009/2010,34,E0,1-2,-1,0.4500000000000002,2010-03-21FulhamMan City
21/03/10,Man United,Liverpool,2,1,H,1.7,3.5,4.9,2010-03-21,2009/2010,34,E0,2-1,1,-3.2,2010-03-21Man UnitedLiverpool
23/03/10,West Ham,Wolves,1,3,A,1.75,3.5,4.6,2010-03-23,2009/2010,34,E0,1-3,-2,-2.8499999999999996,2010-03-23West HamWolves
24/03/10,Aston Villa,Sunderland,1,1,D,1.5,3.9,6.5,2010-03-24,2009/2010,34,E0,1-1,0,-5.0,2010-03-24Aston VillaSunderland
24/03/10,Blackburn,Birmingham,2,1,H,2.05,3.25,3.5,2010-03-24,2009/2010,34,E0,2-1,1,-1.4500000000000002,2010-03-24BlackburnBirmingham
24/03/10,Man City,Everton,0,2,A,1.8,3.4,4.3,2010-03-24,2009/2010,34,E0,0-2,-2,-2.5,2010-03-24Man CityEverton
24/03/10,Portsmouth,Chelsea,0,5,A,10.0,5.0,1.27,2010-03-24,2009/2010,35,E0,0-5,-5,8.73,2010-03-24PortsmouthChelsea
27/03/10,Birmingham,Arsenal,1,1,D,6.0,3.7,1.55,2010-03-27,2009/2010,35,E0,1-1,0,4.45,2010-03-27BirminghamArsenal
27/03/10,Bolton,Man United,0,4,A,7.3,4.1,1.43,2010-03-27,2009/2010,35,E0,0-4,-4,5.87,2010-03-27BoltonMan United
27/03/10,Chelsea,Aston Villa,7,1,H,1.35,4.7,8.0,2010-03-27,2009/2010,35,E0,7-1,6,-6.65,2010-03-27ChelseaAston Villa
27/03/10,Hull,Fulham,2,0,H,2.2,3.3,3.1,2010-03-27,2009/2010,35,E0,2-0,2,-0.8999999999999999,2010-03-27HullFulham
27/03/10,Tottenham,Portsmouth,2,0,H,1.25,5.5,10.0,2010-03-27,2009/2010,35,E0,2-0,2,-8.75,2010-03-27TottenhamPortsmouth
27/03/10,West Ham,Stoke,0,1,A,2.0,3.3,3.6,2010-03-27,2009/2010,35,E0,0-1,-1,-1.6,2010-03-27West HamStoke
27/03/10,Wolves,Everton,0,0,D,3.4,3.3,2.05,2010-03-27,2009/2010,35,E0,0-0,0,1.35,2010-03-27WolvesEverton
28/03/10,Burnley,Blackburn,0,1,A,2.6,3.2,2.6,2010-03-28,2009/2010,35,E0,0-1,-1,0.0,2010-03-28BurnleyBlackburn
28/03/10,Liverpool,Sunderland,3,0,H,1.25,5.5,10.0,2010-03-28,2009/2010,36,E0,3-0,3,-8.75,2010-03-28LiverpoolSunderland
29/03/10,Man City,Wigan,3,0,H,1.35,4.7,8.0,2010-03-29,2009/2010,36,E0,3-0,3,-6.65,2010-03-29Man CityWigan
03/04/10,Arsenal,Wolves,1,0,H,1.2,5.5,14.0,2010-04-03,2009/2010,36,E0,1-0,1,-12.8,2010-04-03ArsenalWolves
03/04/10,Bolton,Aston Villa,0,1,A,2.95,3.1,2.4,2010-04-03,2009/2010,36,E0,0-1,-1,0.5500000000000003,2010-04-03BoltonAston Villa
03/04/10,Burnley,Man City,1,6,A,4.9,3.5,1.7,2010-04-03,2009/2010,36,E0,1-6,-5,3.2,2010-04-03BurnleyMan City
03/04/10,Man United,Chelsea,1,2,A,2.5,3.1,2.8,2010-04-03,2009/2010,36,E0,1-2,-1,-0.2999999999999998,2010-04-03Man UnitedChelsea
03/04/10,Portsmouth,Blackburn,0,0,D,3.0,3.2,2.3,2010-04-03,2009/2010,36,E0,0-0,0,0.7000000000000002,2010-04-03PortsmouthBlackburn
03/04/10,Stoke,Hull,2,0,H,1.8,3.4,4.3,2010-04-03,2009/2010,36,E0,2-0,2,-2.5,2010-04-03StokeHull
03/04/10,Sunderland,Tottenham,3,1,H,3.2,3.2,2.2,2010-04-03,2009/2010,36,E0,3-1,2,1.0,2010-04-03SunderlandTottenham
04/04/10,Birmingham,Liverpool,1,1,D,4.3,3.4,1.8,2010-04-04,2009/2010,37,E0,1-1,0,2.5,2010-04-04BirminghamLiverpool
04/04/10,Everton,West Ham,2,2,D,1.45,4.0,7.0,2010-04-04,2009/2010,37,E0,2-2,0,-5.55,2010-04-04EvertonWest Ham
04/04/10,Fulham,Wigan,2,1,H,2.1,3.25,3.4,2010-04-04,2009/2010,37,E0,2-1,1,-1.2999999999999998,2010-04-04FulhamWigan
10/04/10,Hull,Burnley,1,4,A,1.8,3.4,4.3,2010-04-10,2009/2010,37,E0,1-4,-3,-2.5,2010-04-10HullBurnley
10/04/10,West Ham,Sunderland,1,0,H,1.85,3.4,4.0,2010-04-10,2009/2010,37,E0,1-0,1,-2.15,2010-04-10West HamSunderland
11/04/10,Blackburn,Man United,0,0,D,7.0,4.0,1.45,2010-04-11,2009/2010,37,E0,0-0,0,5.55,2010-04-11BlackburnMan United
11/04/10,Liverpool,Fulham,0,0,D,1.3,4.8,9.5,2010-04-11,2009/2010,37,E0,0-0,0,-8.2,2010-04-11LiverpoolFulham
11/04/10,Man City,Birmingham,5,1,H,1.4,4.3,7.5,2010-04-11,2009/2010,37,E0,5-1,4,-6.1,2010-04-11Man CityBirmingham
11/04/10,Wolves,Stoke,0,0,D,2.2,3.2,3.2,2010-04-11,2009/2010,37,E0,0-0,0,-1.0,2010-04-11WolvesStoke
13/04/10,Chelsea,Bolton,1,0,H,1.15,6.5,15.0,2010-04-13,2009/2010,38,E0,1-0,1,-13.85,2010-04-13ChelseaBolton
14/04/10,Aston Villa,Everton,2,2,D,2.1,3.2,3.2,2010-04-14,2009/2010,38,E0,2-2,0,-1.1,2010-04-14Aston VillaEverton
14/04/10,Tottenham,Arsenal,2,1,H,2.9,3.3,2.3,2010-04-14,2009/2010,38,E0,2-1,1,0.6000000000000001,2010-04-14TottenhamArsenal
14/04/10,Wigan,Portsmouth,0,0,D,1.55,3.6,5.6,2010-04-14,2009/2010,38,E0,0-0,0,-4.05,2010-04-14WiganPortsmouth
17/04/10,Birmingham,Hull,0,0,D,1.75,3.5,4.1,2010-04-17,2009/2010,38,E0,0-0,0,-2.3499999999999996,2010-04-17BirminghamHull
17/04/10,Blackburn,Everton,2,3,A,2.55,3.1,2.55,2010-04-17,2009/2010,38,E0,2-3,-1,0.0,2010-04-17BlackburnEverton
17/04/10,Fulham,Wolves,0,0,D,2.05,3.1,3.4,2010-04-17,2009/2010,38,E0,0-0,0,-1.35,2010-04-17FulhamWolves
17/04/10,Man City,Man United,0,1,A,2.7,3.2,2.4,2010-04-17,2009/2010,38,E0,0-1,-1,0.30000000000000027,2010-04-17Man CityMan United
17/04/10,Stoke,Bolton,1,2,A,2.0,3.0,3.7,2010-04-17,2009/2010,38,E0,1-2,-1,-1.7000000000000002,2010-04-17StokeBolton
17/04/10,Sunderland,Burnley,2,1,H,1.65,3.5,4.6,2010-04-17,2009/2010,39,E0,2-1,1,-2.9499999999999997,2010-04-17SunderlandBurnley
17/04/10,Tottenham,Chelsea,2,1,H,3.3,3.3,2.0,2010-04-17,2009/2010,39,E0,2-1,1,1.2999999999999998,2010-04-17TottenhamChelsea
18/04/10,Portsmouth,Aston Villa,1,2,A,4.4,3.5,1.7,2010-04-18,2009/2010,39,E0,1-2,-1,2.7,2010-04-18PortsmouthAston Villa
18/04/10,Wigan,Arsenal,3,2,H,5.2,3.8,1.55,2010-04-18,2009/2010,39,E0,3-2,1,3.6500000000000004,2010-04-18WiganArsenal
19/04/10,Liverpool,West Ham,3,0,H,1.3,4.8,8.5,2010-04-19,2009/2010,39,E0,3-0,3,-7.2,2010-04-19LiverpoolWest Ham
21/04/10,Hull,Aston Villa,0,2,A,3.3,3.3,2.0,2010-04-21,2009/2010,39,E0,0-2,-2,1.2999999999999998,2010-04-21HullAston Villa
24/04/10,Arsenal,Man City,0,0,D,1.9,3.4,3.55,2010-04-24,2009/2010,39,E0,0-0,0,-1.65,2010-04-24ArsenalMan City
24/04/10,Bolton,Portsmouth,2,2,D,1.55,3.7,5.4,2010-04-24,2009/2010,39,E0,2-2,0,-3.8500000000000005,2010-04-24BoltonPortsmouth
24/04/10,Hull,Sunderland,0,1,A,2.1,3.3,3.1,2010-04-24,2009/2010,39,E0,0-1,-1,-1.0,2010-04-24HullSunderland
24/04/10,Man United,Tottenham,3,1,H,1.45,3.9,6.5,2010-04-24,2009/2010,40,E0,3-1,2,-5.05,2010-04-24Man UnitedTottenham
24/04/10,West Ham,Wigan,3,2,H,1.8,3.4,4.0,2010-04-24,2009/2010,40,E0,3-2,1,-2.2,2010-04-24West HamWigan
24/04/10,Wolves,Blackburn,1,1,D,2.1,3.1,3.3,2010-04-24,2009/2010,40,E0,1-1,0,-1.1999999999999997,2010-04-24WolvesBlackburn
25/04/10,Aston Villa,Birmingham,1,0,H,1.65,3.5,4.6,2010-04-25,2009/2010,40,E0,1-0,1,-2.9499999999999997,2010-04-25Aston VillaBirmingham
25/04/10,Burnley,Liverpool,0,4,A,5.4,3.7,1.55,2010-04-25,2009/2010,40,E0,0-4,-4,3.8500000000000005,2010-04-25BurnleyLiverpool
25/04/10,Chelsea,Stoke,7,0,H,1.15,6.2,14.0,2010-04-25,2009/2010,40,E0,7-0,7,-12.85,2010-04-25ChelseaStoke
25/04/10,Everton,Fulham,2,1,H,1.4,4.1,7.0,2010-04-25,2009/2010,40,E0,2-1,1,-5.6,2010-04-25EvertonFulham
01/05/10,Birmingham,Burnley,2,1,H,1.55,3.7,5.4,2010-05-01,2009/2010,40,E0,2-1,1,-3.8500000000000005,2010-05-01BirminghamBurnley
01/05/10,Man City,Aston Villa,3,1,H,1.85,3.4,3.8,2010-05-01,2009/2010,40,E0,3-1,2,-1.9499999999999997,2010-05-01Man CityAston Villa
01/05/10,Portsmouth,Wolves,3,1,H,2.3,3.2,2.8,2010-05-01,2009/2010,41,E0,3-1,2,-0.5,2010-05-01PortsmouthWolves
01/05/10,Stoke,Everton,0,0,D,3.1,3.3,2.1,2010-05-01,2009/2010,41,E0,0-0,0,1.0,2010-05-01StokeEverton
01/05/10,Tottenham,Bolton,1,0,H,1.2,5.5,12.0,2010-05-01,2009/2010,41,E0,1-0,1,-10.8,2010-05-01TottenhamBolton
02/05/10,Fulham,West Ham,3,2,H,2.1,3.1,3.3,2010-05-02,2009/2010,41,E0,3-2,1,-1.1999999999999997,2010-05-02FulhamWest Ham
02/05/10,Liverpool,Chelsea,0,2,A,3.8,3.4,1.85,2010-05-02,2009/2010,41,E0,0-2,-2,1.9499999999999997,2010-05-02LiverpoolChelsea
02/05/10,Sunderland,Man United,0,1,A,7.3,4.5,1.35,2010-05-02,2009/2010,41,E0,0-1,-1,5.949999999999999,2010-05-02SunderlandMan United
03/05/10,Blackburn,Arsenal,2,1,H,3.3,3.1,2.1,2010-05-03,2009/2010,41,E0,2-1,1,1.1999999999999997,2010-05-03BlackburnArsenal
03/05/10,Wigan,Hull,2,2,D,1.8,3.4,4.0,2010-05-03,2009/2010,41,E0,2-2,0,-2.2,2010-05-03WiganHull
05/05/10,Fulham,Stoke,0,1,A,2.0,3.2,3.4,2010-05-05,2009/2010,41,E0,0-1,-1,-1.4,2010-05-05FulhamStoke
05/05/10,Man City,Tottenham,0,1,A,1.9,3.3,3.7,2010-05-05,2009/2010,42,E0,0-1,-1,-1.8000000000000003,2010-05-05Man CityTottenham
09/05/10,Arsenal,Fulham,4,0,H,1.15,6.2,14.0,2010-05-09,2009/2010,42,E0,4-0,4,-12.85,2010-05-09ArsenalFulham
09/05/10,Aston Villa,Blackburn,0,1,A,1.5,3.8,5.7,2010-05-09,2009/2010,42,E0,0-1,-1,-4.2,2010-05-09Aston VillaBlackburn
09/05/10,Bolton,Birmingham,2,1,H,2.2,3.2,3.0,2010-05-09,2009/2010,42,E0,2-1,1,-0.7999999999999998,2010-05-09BoltonBirmingham
09/05/10,Burnley,Tottenham,4,2,H,7.0,4.1,1.4,2010-05-09,2009/2010,42,E0,4-2,2,5.6,2010-05-09BurnleyTottenham
09/05/10,Chelsea,Wigan,8,0,H,1.05,10.0,25.0,2010-05-09,2009/2010,42,E0,8-0,8,-23.95,2010-05-09ChelseaWigan
09/05/10,Everton,Portsmouth,1,0,H,1.3,4.8,8.5,2010-05-09,2009/2010,42,E0,1-0,1,-7.2,2010-05-09EvertonPortsmouth
09/05/10,Hull,Liverpool,0,0,D,5.5,3.9,1.5,2010-05-09,2009/2010,42,E0,0-0,0,4.0,2010-05-09HullLiverpool
09/05/10,Man United,Stoke,4,0,H,1.1,7.3,15.0,2010-05-09,2009/2010,42,E0,4-0,4,-13.9,2010-05-09Man UnitedStoke
