Date,HomeTeam,AwayTeam,FTHG,FTAG,FTR,IWH,IWD,IWA,datetime,season,game_day,league,result,goal_diff,odds_diff,game_id
14/08/10,Aston Villa,West Ham,3,0,H,1.8,3.4,4.0,2010-08-14,2010/2011,1,E0,3-0,3,-2.2,2010-08-14Aston VillaWest Ham
14/08/10,Blackburn,Everton,1,0,H,2.55,3.2,2.5,2010-08-14,2010/2011,1,E0,1-0,1,0.04999999999999982,2010-08-14BlackburnEverton
14/08/10,Bolton,Fulham,0,0,D,2.2,3.2,3.0,2010-08-14,2010/2011,1,E0,0-0,0,-0.7999999999999998,2010-08-14BoltonFulham
14/08/10,Chelsea,West Brom,6,0,H,1.15,6.2,14.0,2010-08-14,2010/2011,1,E0,6-0,6,-12.85,2010-08-14ChelseaWest Brom
14/08/10,Sunderland,Birmingham,2,2,D,2.1,3.2,3.2,2010-08-14,2010/2011,1,E0,2-2,0,-1.1,2010-08-14SunderlandBirmingham
14/08/10,Tottenham,Man City,0,0,D,2.4,3.2,2.7,2010-08-14,2010/2011,1,E0,0-0,0,-0.30000000000000027,2010-08-14TottenhamMan City
14/08/10,Wigan,Blackpool,0,4,A,1.9,3.3,3.7,2010-08-14,2010/2011,1,E0,0-4,-4,-1.8000000000000003,2010-08-14WiganBlackpool
14/08/10,Wolves,Stoke,2,1,H,2.3,3.2,2.8,2010-08-14,2010/2011,1,E0,2-1,1,-0.5,2010-08-14WolvesStoke
15/08/10,Liverpool,Arsenal,1,1,D,2.4,3.2,2.7,2010-08-15,2010/2011,1,E0,1-1,0,-0.30000000000000027,2010-08-15LiverpoolArsenal
16/08/10,Man United,Newcastle,3,0,H,1.22,5.3,11.0,2010-08-16,2010/2011,2,E0,3-0,3,-9.78,2010-08-16Man UnitedNewcastle
21/08/10,Arsenal,Blackpool,6,0,H,1.17,5.8,13.0,2010-08-21,2010/2011,2,E0,6-0,6,-11.83,2010-08-21ArsenalBlackpool
21/08/10,Birmingham,Blackburn,2,1,H,2.3,3.2,2.8,2010-08-21,2010/2011,2,E0,2-1,1,-0.5,2010-08-21BirminghamBlackburn
21/08/10,Everton,Wolves,1,1,D,1.5,3.8,5.7,2010-08-21,2010/2011,2,E0,1-1,0,-4.2,2010-08-21EvertonWolves
21/08/10,Stoke,Tottenham,1,2,A,3.2,3.2,2.1,2010-08-21,2010/2011,2,E0,1-2,-1,1.1,2010-08-21StokeTottenham
21/08/10,West Brom,Sunderland,1,0,H,2.4,3.2,2.7,2010-08-21,2010/2011,2,E0,1-0,1,-0.30000000000000027,2010-08-21West BromSunderland
21/08/10,West Ham,Bolton,1,3,A,2.2,3.3,2.9,2010-08-21,2010/2011,2,E0,1-3,-2,-0.6999999999999997,2010-08-21West HamBolton
21/08/10,Wigan,Chelsea,0,6,A,9.0,4.9,1.28,2010-08-21,2010/2011,2,E0,0-6,-6,7.72,2010-08-21WiganChelsea
22/08/10,Fulham,Man United,2,2,D,5.4,3.7,1.55,2010-08-22,2010/2011,2,E0,2-2,0,3.8500000000000005,2010-08-22FulhamMan United
22/08/10,Newcastle,Aston Villa,6,0,H,2.8,3.2,2.3,2010-08-22,2010/2011,3,E0,6-0,6,0.5,2010-08-22NewcastleAston Villa
23/08/10,Man City,Liverpool,3,0,H,2.4,3.2,2.7,2010-08-23,2010/2011,3,E0,3-0,3,-0.30000000000000027,2010-08-23Man CityLiverpool
28/08/10,Blackburn,Arsenal,1,2,A,5.0,3.6,1.6,2010-08-28,2010/2011,3,E0,1-2,-1,3.4,2010-08-28BlackburnArsenal
28/08/10,Blackpool,Fulham,2,2,D,2.7,3.2,2.4,2010-08-28,2010/2011,3,E0,2-2,0,0.30000000000000027,2010-08-28BlackpoolFulham
28/08/10,Chelsea,Stoke,2,0,H,1.12,7.0,14.0,2010-08-28,2010/2011,3,E0,2-0,2,-12.879999999999999,2010-08-28ChelseaStoke
28/08/10,Man United,West Ham,3,0,H,1.17,5.8,13.0,2010-08-28,2010/2011,3,E0,3-0,3,-11.83,2010-08-28Man UnitedWest Ham
28/08/10,Tottenham,Wigan,0,1,A,1.25,5.0,10.0,2010-08-28,2010/2011,3,E0,0-1,-1,-8.75,2010-08-28TottenhamWigan
28/08/10,Wolves,Newcastle,1,1,D,2.4,3.2,2.7,2010-08-28,2010/2011,3,E0,1-1,0,-0.30000000000000027,2010-08-28WolvesNewcastle
29/08/10,Aston Villa,Everton,1,0,H,2.4,3.2,2.7,2010-08-29,2010/2011,3,E0,1-0,1,-0.30000000000000027,2010-08-29Aston VillaEverton
29/08/10,Bolton,Birmingham,2,2,D,2.2,3.2,3.0,2010-08-29,2010/2011,4,E0,2-2,0,-0.7999999999999998,2010-08-29BoltonBirmingham
29/08/10,Liverpool,West Brom,1,0,H,1.2,5.5,12.0,2010-08-29,2010/2011,4,E0,1-0,1,-10.8,2010-08-29LiverpoolWest Brom
29/08/10,Sunderland,Man City,1,0,H,3.7,3.3,1.9,2010-08-29,2010/2011,4,E0,1-0,1,1.8000000000000003,2010-08-29SunderlandMan City
11/09/10,Arsenal,Bolton,4,1,H,1.2,5.5,12.0,2010-09-11,2010/2011,4,E0,4-1,3,-10.8,2010-09-11ArsenalBolton
11/09/10,Everton,Man United,3,3,D,3.8,3.4,1.85,2010-09-11,2010/2011,4,E0,3-3,0,1.9499999999999997,2010-09-11EvertonMan United
11/09/10,Fulham,Wolves,2,1,H,1.8,3.4,4.0,2010-09-11,2010/2011,4,E0,2-1,1,-2.2,2010-09-11FulhamWolves
11/09/10,Man City,Blackburn,1,1,D,1.35,4.5,7.3,2010-09-11,2010/2011,4,E0,1-1,0,-5.949999999999999,2010-09-11Man CityBlackburn
11/09/10,Newcastle,Blackpool,0,2,A,1.6,3.6,5.0,2010-09-11,2010/2011,4,E0,0-2,-2,-3.4,2010-09-11NewcastleBlackpool
11/09/10,West Brom,Tottenham,1,1,D,3.3,3.3,2.0,2010-09-11,2010/2011,4,E0,1-1,0,1.2999999999999998,2010-09-11West BromTottenham
11/09/10,West Ham,Chelsea,1,3,A,7.3,4.5,1.35,2010-09-11,2010/2011,5,E0,1-3,-2,5.949999999999999,2010-09-11West HamChelsea
11/09/10,Wigan,Sunderland,1,1,D,2.3,3.2,2.8,2010-09-11,2010/2011,5,E0,1-1,0,-0.5,2010-09-11WiganSunderland
12/09/10,Birmingham,Liverpool,0,0,D,2.8,3.2,2.3,2010-09-12,2010/2011,5,E0,0-0,0,0.5,2010-09-12BirminghamLiverpool
13/09/10,Stoke,Aston Villa,2,1,H,2.55,3.2,2.55,2010-09-13,2010/2011,5,E0,2-1,1,0.0,2010-09-13StokeAston Villa
18/09/10,Aston Villa,Bolton,1,1,D,1.8,3.4,4.0,2010-09-18,2010/2011,5,E0,1-1,0,-2.2,2010-09-18Aston VillaBolton
18/09/10,Blackburn,Fulham,1,1,D,2.05,3.2,3.3,2010-09-18,2010/2011,5,E0,1-1,0,-1.25,2010-09-18BlackburnFulham
18/09/10,Everton,Newcastle,0,1,A,1.7,3.5,4.4,2010-09-18,2010/2011,5,E0,0-1,-1,-2.7,2010-09-18EvertonNewcastle
18/09/10,Stoke,West Ham,1,1,D,2.0,3.3,3.3,2010-09-18,2010/2011,5,E0,1-1,0,-1.2999999999999998,2010-09-18StokeWest Ham
18/09/10,Sunderland,Arsenal,1,1,D,4.4,3.5,1.7,2010-09-18,2010/2011,5,E0,1-1,0,2.7,2010-09-18SunderlandArsenal
18/09/10,Tottenham,Wolves,3,1,H,1.4,4.1,7.0,2010-09-18,2010/2011,6,E0,3-1,2,-5.6,2010-09-18TottenhamWolves
18/09/10,West Brom,Birmingham,3,1,H,2.4,3.1,2.8,2010-09-18,2010/2011,6,E0,3-1,2,-0.3999999999999999,2010-09-18West BromBirmingham
19/09/10,Chelsea,Blackpool,4,0,H,1.12,7.0,14.0,2010-09-19,2010/2011,6,E0,4-0,4,-12.879999999999999,2010-09-19ChelseaBlackpool
19/09/10,Man United,Liverpool,3,2,H,1.75,3.4,4.3,2010-09-19,2010/2011,6,E0,3-2,1,-2.55,2010-09-19Man UnitedLiverpool
19/09/10,Wigan,Man City,0,2,A,4.0,3.4,1.8,2010-09-19,2010/2011,6,E0,0-2,-2,2.2,2010-09-19WiganMan City
25/09/10,Arsenal,West Brom,2,3,A,1.2,5.5,12.0,2010-09-25,2010/2011,6,E0,2-3,-1,-10.8,2010-09-25ArsenalWest Brom
25/09/10,Birmingham,Wigan,0,0,D,1.85,3.4,3.8,2010-09-25,2010/2011,6,E0,0-0,0,-1.9499999999999997,2010-09-25BirminghamWigan
25/09/10,Blackpool,Blackburn,1,2,A,2.75,3.2,2.35,2010-09-25,2010/2011,6,E0,1-2,-1,0.3999999999999999,2010-09-25BlackpoolBlackburn
25/09/10,Fulham,Everton,0,0,D,2.5,3.2,2.6,2010-09-25,2010/2011,6,E0,0-0,0,-0.10000000000000009,2010-09-25FulhamEverton
25/09/10,Liverpool,Sunderland,2,2,D,1.45,3.9,6.5,2010-09-25,2010/2011,7,E0,2-2,0,-5.05,2010-09-25LiverpoolSunderland
25/09/10,Man City,Chelsea,1,0,H,3.0,3.2,2.2,2010-09-25,2010/2011,7,E0,1-0,1,0.7999999999999998,2010-09-25Man CityChelsea
25/09/10,West Ham,Tottenham,1,0,H,3.1,3.3,2.1,2010-09-25,2010/2011,7,E0,1-0,1,1.0,2010-09-25West HamTottenham
26/09/10,Bolton,Man United,2,2,D,5.5,3.9,1.5,2010-09-26,2010/2011,7,E0,2-2,0,4.0,2010-09-26BoltonMan United
26/09/10,Newcastle,Stoke,1,2,A,2.0,3.3,3.3,2010-09-26,2010/2011,7,E0,1-2,-1,-1.2999999999999998,2010-09-26NewcastleStoke
26/09/10,Wolves,Aston Villa,1,2,A,2.6,3.2,2.5,2010-09-26,2010/2011,7,E0,1-2,-1,0.10000000000000009,2010-09-26WolvesAston Villa
02/10/10,Birmingham,Everton,0,2,A,2.55,3.2,2.55,2010-10-02,2010/2011,7,E0,0-2,-2,0.0,2010-10-02BirminghamEverton
02/10/10,Stoke,Blackburn,1,0,H,2.2,3.2,3.0,2010-10-02,2010/2011,7,E0,1-0,1,-0.7999999999999998,2010-10-02StokeBlackburn
02/10/10,Sunderland,Man United,0,0,D,4.4,3.5,1.7,2010-10-02,2010/2011,7,E0,0-0,0,2.7,2010-10-02SunderlandMan United
02/10/10,Tottenham,Aston Villa,2,1,H,1.85,3.4,3.8,2010-10-02,2010/2011,8,E0,2-1,1,-1.9499999999999997,2010-10-02TottenhamAston Villa
02/10/10,West Brom,Bolton,1,1,D,2.1,3.2,3.2,2010-10-02,2010/2011,8,E0,1-1,0,-1.1,2010-10-02West BromBolton
02/10/10,West Ham,Fulham,1,1,D,2.3,3.2,2.8,2010-10-02,2010/2011,8,E0,1-1,0,-0.5,2010-10-02West HamFulham
02/10/10,Wigan,Wolves,2,0,H,2.1,3.2,3.2,2010-10-02,2010/2011,8,E0,2-0,2,-1.1,2010-10-02WiganWolves
03/10/10,Chelsea,Arsenal,2,0,H,1.75,3.4,4.3,2010-10-03,2010/2011,8,E0,2-0,2,-2.55,2010-10-03ChelseaArsenal
03/10/10,Liverpool,Blackpool,1,2,A,1.27,5.0,9.0,2010-10-03,2010/2011,8,E0,1-2,-1,-7.73,2010-10-03LiverpoolBlackpool
03/10/10,Man City,Newcastle,2,1,H,1.43,3.9,7.0,2010-10-03,2010/2011,8,E0,2-1,1,-5.57,2010-10-03Man CityNewcastle
16/10/10,Arsenal,Birmingham,2,1,H,1.33,4.6,7.8,2010-10-16,2010/2011,8,E0,2-1,1,-6.47,2010-10-16ArsenalBirmingham
16/10/10,Aston Villa,Chelsea,0,0,D,4.3,3.4,1.75,2010-10-16,2010/2011,8,E0,0-0,0,2.55,2010-10-16Aston VillaChelsea
16/10/10,Bolton,Stoke,2,1,H,2.15,3.1,3.1,2010-10-16,2010/2011,9,E0,2-1,1,-0.9500000000000002,2010-10-16BoltonStoke
16/10/10,Fulham,Tottenham,1,2,A,2.7,3.2,2.4,2010-10-16,2010/2011,9,E0,1-2,-1,0.30000000000000027,2010-10-16FulhamTottenham
16/10/10,Man United,West Brom,2,2,D,1.25,5.0,10.0,2010-10-16,2010/2011,9,E0,2-2,0,-8.75,2010-10-16Man UnitedWest Brom
16/10/10,Newcastle,Wigan,2,2,D,1.8,3.4,4.0,2010-10-16,2010/2011,9,E0,2-2,0,-2.2,2010-10-16NewcastleWigan
16/10/10,Wolves,West Ham,1,1,D,2.25,3.2,2.9,2010-10-16,2010/2011,9,E0,1-1,0,-0.6499999999999999,2010-10-16WolvesWest Ham
17/10/10,Blackpool,Man City,2,3,A,4.6,3.5,1.65,2010-10-17,2010/2011,9,E0,2-3,-1,2.9499999999999997,2010-10-17BlackpoolMan City
17/10/10,Everton,Liverpool,2,0,H,2.5,3.2,2.6,2010-10-17,2010/2011,9,E0,2-0,2,-0.10000000000000009,2010-10-17EvertonLiverpool
18/10/10,Blackburn,Sunderland,0,0,D,2.1,3.2,3.2,2010-10-18,2010/2011,9,E0,0-0,0,-1.1,2010-10-18BlackburnSunderland
23/10/10,Birmingham,Blackpool,2,0,H,1.9,3.3,3.7,2010-10-23,2010/2011,9,E0,2-0,2,-1.8000000000000003,2010-10-23BirminghamBlackpool
23/10/10,Chelsea,Wolves,2,0,H,1.12,7.0,14.0,2010-10-23,2010/2011,10,E0,2-0,2,-12.879999999999999,2010-10-23ChelseaWolves
23/10/10,Sunderland,Aston Villa,1,0,H,2.4,3.2,2.7,2010-10-23,2010/2011,10,E0,1-0,1,-0.30000000000000027,2010-10-23SunderlandAston Villa
23/10/10,Tottenham,Everton,1,1,D,1.95,3.2,3.6,2010-10-23,2010/2011,10,E0,1-1,0,-1.6500000000000001,2010-10-23TottenhamEverton
23/10/10,West Brom,Fulham,2,1,H,2.2,3.2,3.0,2010-10-23,2010/2011,10,E0,2-1,1,-0.7999999999999998,2010-10-23West BromFulham
23/10/10,West Ham,Newcastle,1,2,A,2.2,3.2,3.0,2010-10-23,2010/2011,10,E0,1-2,-1,-0.7999999999999998,2010-10-23West HamNewcastle
23/10/10,Wigan,Bolton,1,1,D,2.3,3.2,2.8,2010-10-23,2010/2011,10,E0,1-1,0,-0.5,2010-10-23WiganBolton
24/10/10,Liverpool,Blackburn,2,1,H,1.65,3.5,4.6,2010-10-24,2010/2011,10,E0,2-1,1,-2.9499999999999997,2010-10-24LiverpoolBlackburn
24/10/10,Man City,Arsenal,0,3,A,2.2,3.2,3.0,2010-10-24,2010/2011,10,E0,0-3,-3,-0.7999999999999998,2010-10-24Man CityArsenal
24/10/10,Stoke,Man United,1,2,A,4.4,3.5,1.7,2010-10-24,2010/2011,10,E0,1-2,-1,2.7,2010-10-24StokeMan United
30/10/10,Arsenal,West Ham,1,0,H,1.2,5.5,12.0,2010-10-30,2010/2011,11,E0,1-0,1,-10.8,2010-10-30ArsenalWest Ham
30/10/10,Blackburn,Chelsea,1,2,A,6.5,3.8,1.47,2010-10-30,2010/2011,11,E0,1-2,-1,5.03,2010-10-30BlackburnChelsea
30/10/10,Everton,Stoke,1,0,H,1.6,3.6,5.0,2010-10-30,2010/2011,11,E0,1-0,1,-3.4,2010-10-30EvertonStoke
30/10/10,Fulham,Wigan,2,0,H,1.9,3.3,3.7,2010-10-30,2010/2011,11,E0,2-0,2,-1.8000000000000003,2010-10-30FulhamWigan
30/10/10,Man United,Tottenham,2,0,H,1.6,3.6,5.0,2010-10-30,2010/2011,11,E0,2-0,2,-3.4,2010-10-30Man UnitedTottenham
30/10/10,Wolves,Man City,2,1,H,4.4,3.5,1.7,2010-10-30,2010/2011,11,E0,2-1,1,2.7,2010-10-30WolvesMan City
31/10/10,Aston Villa,Birmingham,0,0,D,1.8,3.4,4.0,2010-10-31,2010/2011,11,E0,0-0,0,-2.2,2010-10-31Aston VillaBirmingham
31/10/10,Bolton,Liverpool,0,1,A,2.8,3.2,2.3,2010-10-31,2010/2011,11,E0,0-1,-1,0.5,2010-10-31BoltonLiverpool
31/10/10,Newcastle,Sunderland,5,1,H,2.1,3.2,3.2,2010-10-31,2010/2011,11,E0,5-1,4,-1.1,2010-10-31NewcastleSunderland
01/11/10,Blackpool,West Brom,2,1,H,2.55,3.2,2.55,2010-11-01,2010/2011,12,E0,2-1,1,0.0,2010-11-01BlackpoolWest Brom
06/11/10,Birmingham,West Ham,2,2,D,2.0,3.2,3.4,2010-11-06,2010/2011,12,E0,2-2,0,-1.4,2010-11-06BirminghamWest Ham
06/11/10,Blackburn,Wigan,2,1,H,1.85,3.3,3.9,2010-11-06,2010/2011,12,E0,2-1,1,-2.05,2010-11-06BlackburnWigan
06/11/10,Blackpool,Everton,2,2,D,4.0,3.4,1.8,2010-11-06,2010/2011,12,E0,2-2,0,2.2,2010-11-06BlackpoolEverton
06/11/10,Bolton,Tottenham,4,2,H,2.8,3.2,2.3,2010-11-06,2010/2011,12,E0,4-2,2,0.5,2010-11-06BoltonTottenham
06/11/10,Fulham,Aston Villa,1,1,D,2.3,3.1,2.9,2010-11-06,2010/2011,12,E0,1-1,0,-0.6000000000000001,2010-11-06FulhamAston Villa
06/11/10,Man United,Wolves,2,1,H,1.2,5.5,12.0,2010-11-06,2010/2011,12,E0,2-1,1,-10.8,2010-11-06Man UnitedWolves
06/11/10,Sunderland,Stoke,2,0,H,2.0,3.2,3.4,2010-11-06,2010/2011,12,E0,2-0,2,-1.4,2010-11-06SunderlandStoke
07/11/10,Arsenal,Newcastle,0,1,A,1.25,5.0,10.0,2010-11-07,2010/2011,12,E0,0-1,-1,-8.75,2010-11-07ArsenalNewcastle
07/11/10,Liverpool,Chelsea,2,0,H,3.2,3.2,2.1,2010-11-07,2010/2011,13,E0,2-0,2,1.1,2010-11-07LiverpoolChelsea
07/11/10,West Brom,Man City,0,2,A,3.2,3.2,2.1,2010-11-07,2010/2011,13,E0,0-2,-2,1.1,2010-11-07West BromMan City
09/11/10,Stoke,Birmingham,3,2,H,2.1,3.2,3.2,2010-11-09,2010/2011,13,E0,3-2,1,-1.1,2010-11-09StokeBirmingham
09/11/10,Tottenham,Sunderland,1,1,D,1.55,3.7,5.4,2010-11-09,2010/2011,13,E0,1-1,0,-3.8500000000000005,2010-11-09TottenhamSunderland
10/11/10,Aston Villa,Blackpool,3,2,H,1.6,3.6,5.0,2010-11-10,2010/2011,13,E0,3-2,1,-3.4,2010-11-10Aston VillaBlackpool
10/11/10,Chelsea,Fulham,1,0,H,1.2,5.5,12.0,2010-11-10,2010/2011,13,E0,1-0,1,-10.8,2010-11-10ChelseaFulham
10/11/10,Everton,Bolton,1,1,D,1.65,3.5,4.6,2010-11-10,2010/2011,13,E0,1-1,0,-2.9499999999999997,2010-11-10EvertonBolton
10/11/10,Man City,Man United,0,0,D,2.65,3.3,2.4,2010-11-10,2010/2011,13,E0,0-0,0,0.25,2010-11-10Man CityMan United
10/11/10,Newcastle,Blackburn,1,2,A,1.9,3.3,3.7,2010-11-10,2010/2011,13,E0,1-2,-1,-1.8000000000000003,2010-11-10NewcastleBlackburn
10/11/10,West Ham,West Brom,2,2,D,2.2,3.2,3.0,2010-11-10,2010/2011,14,E0,2-2,0,-0.7999999999999998,2010-11-10West HamWest Brom
10/11/10,Wigan,Liverpool,1,1,D,4.3,3.4,1.75,2010-11-10,2010/2011,14,E0,1-1,0,2.55,2010-11-10WiganLiverpool
10/11/10,Wolves,Arsenal,0,2,A,4.6,3.5,1.65,2010-11-10,2010/2011,14,E0,0-2,-2,2.9499999999999997,2010-11-10WolvesArsenal
13/11/10,Aston Villa,Man United,2,2,D,3.7,3.3,1.9,2010-11-13,2010/2011,14,E0,2-2,0,1.8000000000000003,2010-11-13Aston VillaMan United
13/11/10,Man City,Birmingham,0,0,D,1.4,4.1,7.0,2010-11-13,2010/2011,14,E0,0-0,0,-5.6,2010-11-13Man CityBirmingham
13/11/10,Newcastle,Fulham,0,0,D,1.9,3.3,3.7,2010-11-13,2010/2011,14,E0,0-0,0,-1.8000000000000003,2010-11-13NewcastleFulham
13/11/10,Stoke,Liverpool,2,0,H,3.7,3.3,1.9,2010-11-13,2010/2011,14,E0,2-0,2,1.8000000000000003,2010-11-13StokeLiverpool
13/11/10,Tottenham,Blackburn,4,2,H,1.55,3.7,5.4,2010-11-13,2010/2011,14,E0,4-2,2,-3.8500000000000005,2010-11-13TottenhamBlackburn
13/11/10,West Ham,Blackpool,0,0,D,1.9,3.3,3.7,2010-11-13,2010/2011,14,E0,0-0,0,-1.8000000000000003,2010-11-13West HamBlackpool
13/11/10,Wigan,West Brom,1,0,H,2.3,3.2,2.8,2010-11-13,2010/2011,15,E0,1-0,1,-0.5,2010-11-13WiganWest Brom
13/11/10,Wolves,Bolton,2,3,A,2.4,3.2,2.7,2010-11-13,2010/2011,15,E0,2-3,-1,-0.30000000000000027,2010-11-13WolvesBolton
14/11/10,Chelsea,Sunderland,0,3,A,1.22,5.3,11.0,2010-11-14,2010/2011,15,E0,0-3,-3,-9.78,2010-11-14ChelseaSunderland
14/11/10,Everton,Arsenal,1,2,A,3.2,3.2,2.1,2010-11-14,2010/2011,15,E0,1-2,-1,1.1,2010-11-14EvertonArsenal
20/11/10,Arsenal,Tottenham,2,3,A,1.7,3.5,4.4,2010-11-20,2010/2011,15,E0,2-3,-1,-2.7,2010-11-20ArsenalTottenham
20/11/10,Birmingham,Chelsea,1,0,H,4.4,3.5,1.7,2010-11-20,2010/2011,15,E0,1-0,1,2.7,2010-11-20BirminghamChelsea
20/11/10,Blackpool,Wolves,2,1,H,2.3,3.2,2.8,2010-11-20,2010/2011,15,E0,2-1,1,-0.5,2010-11-20BlackpoolWolves
20/11/10,Bolton,Newcastle,5,1,H,2.1,3.2,3.2,2010-11-20,2010/2011,15,E0,5-1,4,-1.1,2010-11-20BoltonNewcastle
20/11/10,Liverpool,West Ham,3,0,H,1.55,3.7,5.4,2010-11-20,2010/2011,15,E0,3-0,3,-3.8500000000000005,2010-11-20LiverpoolWest Ham
20/11/10,Man United,Wigan,2,0,H,1.22,5.3,11.0,2010-11-20,2010/2011,16,E0,2-0,2,-9.78,2010-11-20Man UnitedWigan
20/11/10,West Brom,Stoke,0,3,A,2.2,3.2,3.0,2010-11-20,2010/2011,16,E0,0-3,-3,-0.7999999999999998,2010-11-20West BromStoke
21/11/10,Blackburn,Aston Villa,2,0,H,2.4,3.2,2.7,2010-11-21,2010/2011,16,E0,2-0,2,-0.30000000000000027,2010-11-21BlackburnAston Villa
21/11/10,Fulham,Man City,1,4,A,2.9,3.1,2.3,2010-11-21,2010/2011,16,E0,1-4,-3,0.6000000000000001,2010-11-21FulhamMan City
22/11/10,Sunderland,Everton,2,2,D,2.4,3.2,2.7,2010-11-22,2010/2011,16,E0,2-2,0,-0.30000000000000027,2010-11-22SunderlandEverton
27/11/10,Aston Villa,Arsenal,2,4,A,3.3,3.3,2.0,2010-11-27,2010/2011,16,E0,2-4,-2,1.2999999999999998,2010-11-27Aston VillaArsenal
27/11/10,Bolton,Blackpool,2,2,D,1.65,3.5,4.6,2010-11-27,2010/2011,16,E0,2-2,0,-2.9499999999999997,2010-11-27BoltonBlackpool
27/11/10,Everton,West Brom,1,4,A,1.6,3.6,5.0,2010-11-27,2010/2011,16,E0,1-4,-3,-3.4,2010-11-27EvertonWest Brom
27/11/10,Fulham,Birmingham,1,1,D,2.0,3.2,3.4,2010-11-27,2010/2011,16,E0,1-1,0,-1.4,2010-11-27FulhamBirmingham
27/11/10,Man United,Blackburn,7,1,H,1.2,5.5,12.0,2010-11-27,2010/2011,17,E0,7-1,6,-10.8,2010-11-27Man UnitedBlackburn
27/11/10,Stoke,Man City,1,1,D,2.8,3.2,2.3,2010-11-27,2010/2011,17,E0,1-1,0,0.5,2010-11-27StokeMan City
27/11/10,West Ham,Wigan,3,1,H,2.0,3.2,3.4,2010-11-27,2010/2011,17,E0,3-1,2,-1.4,2010-11-27West HamWigan
27/11/10,Wolves,Sunderland,3,2,H,2.4,3.2,2.7,2010-11-27,2010/2011,17,E0,3-2,1,-0.30000000000000027,2010-11-27WolvesSunderland
28/11/10,Newcastle,Chelsea,1,1,D,4.6,3.5,1.65,2010-11-28,2010/2011,17,E0,1-1,0,2.9499999999999997,2010-11-28NewcastleChelsea
28/11/10,Tottenham,Liverpool,2,1,H,2.1,3.2,3.2,2010-11-28,2010/2011,17,E0,2-1,1,-1.1,2010-11-28TottenhamLiverpool
04/12/10,Arsenal,Fulham,2,1,H,1.25,5.0,10.0,2010-12-04,2010/2011,17,E0,2-1,1,-8.75,2010-12-04ArsenalFulham
04/12/10,Birmingham,Tottenham,1,1,D,3.0,3.2,2.2,2010-12-04,2010/2011,17,E0,1-1,0,0.7999999999999998,2010-12-04BirminghamTottenham
04/12/10,Blackburn,Wolves,3,0,H,1.7,3.5,4.4,2010-12-04,2010/2011,17,E0,3-0,3,-2.7,2010-12-04BlackburnWolves
04/12/10,Chelsea,Everton,1,1,D,1.35,4.5,7.3,2010-12-04,2010/2011,18,E0,1-1,0,-5.949999999999999,2010-12-04ChelseaEverton
04/12/10,Man City,Bolton,1,0,H,1.55,3.7,5.4,2010-12-04,2010/2011,18,E0,1-0,1,-3.8500000000000005,2010-12-04Man CityBolton
04/12/10,Wigan,Stoke,2,2,D,2.3,3.2,2.8,2010-12-04,2010/2011,18,E0,2-2,0,-0.5,2010-12-04WiganStoke
05/12/10,Sunderland,West Ham,1,0,H,1.9,3.3,3.7,2010-12-05,2010/2011,18,E0,1-0,1,-1.8000000000000003,2010-12-05SunderlandWest Ham
05/12/10,West Brom,Newcastle,3,1,H,2.2,3.2,3.0,2010-12-05,2010/2011,18,E0,3-1,2,-0.7999999999999998,2010-12-05West BromNewcastle
06/12/10,Liverpool,Aston Villa,3,0,H,1.55,3.7,5.4,2010-12-06,2010/2011,18,E0,3-0,3,-3.8500000000000005,2010-12-06LiverpoolAston Villa
11/12/10,Aston Villa,West Brom,2,1,H,1.9,3.3,3.7,2010-12-11,2010/2011,18,E0,2-1,1,-1.8000000000000003,2010-12-11Aston VillaWest Brom
11/12/10,Everton,Wigan,0,0,D,1.45,3.9,6.5,2010-12-11,2010/2011,18,E0,0-0,0,-5.05,2010-12-11EvertonWigan
11/12/10,Fulham,Sunderland,0,0,D,2.2,3.2,3.0,2010-12-11,2010/2011,18,E0,0-0,0,-0.7999999999999998,2010-12-11FulhamSunderland
11/12/10,Newcastle,Liverpool,3,1,H,3.0,3.2,2.2,2010-12-11,2010/2011,19,E0,3-1,2,0.7999999999999998,2010-12-11NewcastleLiverpool
11/12/10,Stoke,Blackpool,0,1,A,1.6,3.6,5.0,2010-12-11,2010/2011,19,E0,0-1,-1,-3.4,2010-12-11StokeBlackpool
11/12/10,West Ham,Man City,1,3,A,4.0,3.4,1.8,2010-12-11,2010/2011,19,E0,1-3,-2,2.2,2010-12-11West HamMan City
12/12/10,Bolton,Blackburn,2,1,H,2.0,3.2,3.4,2010-12-12,2010/2011,19,E0,2-1,1,-1.4,2010-12-12BoltonBlackburn
12/12/10,Tottenham,Chelsea,1,1,D,2.8,3.2,2.3,2010-12-12,2010/2011,19,E0,1-1,0,0.5,2010-12-12TottenhamChelsea
12/12/10,Wolves,Birmingham,1,0,H,2.5,3.2,2.6,2010-12-12,2010/2011,19,E0,1-0,1,-0.10000000000000009,2010-12-12WolvesBirmingham
13/12/10,Man United,Arsenal,1,0,H,1.85,3.3,3.9,2010-12-13,2010/2011,19,E0,1-0,1,-2.05,2010-12-13Man UnitedArsenal
18/12/10,Blackburn,West Ham,1,1,D,1.8,3.4,4.0,2010-12-18,2010/2011,19,E0,1-1,0,-2.2,2010-12-18BlackburnWest Ham
18/12/10,Sunderland,Bolton,1,0,H,2.2,3.2,3.0,2010-12-18,2010/2011,19,E0,1-0,1,-0.7999999999999998,2010-12-18SunderlandBolton
20/12/10,Man City,Everton,1,2,A,1.6,3.6,5.0,2010-12-20,2010/2011,20,E0,1-2,-1,-3.4,2010-12-20Man CityEverton
26/12/10,Aston Villa,Tottenham,1,2,A,2.7,3.2,2.4,2010-12-26,2010/2011,20,E0,1-2,-1,0.30000000000000027,2010-12-26Aston VillaTottenham
26/12/10,Blackburn,Stoke,0,2,A,2.0,3.2,3.4,2010-12-26,2010/2011,20,E0,0-2,-2,-1.4,2010-12-26BlackburnStoke
26/12/10,Bolton,West Brom,2,0,H,1.9,3.3,3.7,2010-12-26,2010/2011,20,E0,2-0,2,-1.8000000000000003,2010-12-26BoltonWest Brom
26/12/10,Fulham,West Ham,1,3,A,2.0,3.2,3.4,2010-12-26,2010/2011,20,E0,1-3,-2,-1.4,2010-12-26FulhamWest Ham
26/12/10,Man United,Sunderland,2,0,H,1.25,5.0,10.0,2010-12-26,2010/2011,20,E0,2-0,2,-8.75,2010-12-26Man UnitedSunderland
26/12/10,Newcastle,Man City,1,3,A,3.1,3.3,2.1,2010-12-26,2010/2011,20,E0,1-3,-2,1.0,2010-12-26NewcastleMan City
26/12/10,Wolves,Wigan,1,2,A,2.0,3.3,3.3,2010-12-26,2010/2011,20,E0,1-2,-1,-1.2999999999999998,2010-12-26WolvesWigan
27/12/10,Arsenal,Chelsea,3,1,H,2.4,3.2,2.7,2010-12-27,2010/2011,20,E0,3-1,2,-0.30000000000000027,2010-12-27ArsenalChelsea
28/12/10,Birmingham,Man United,1,1,D,5.4,3.7,1.55,2010-12-28,2010/2011,21,E0,1-1,0,3.8500000000000005,2010-12-28BirminghamMan United
28/12/10,Man City,Aston Villa,4,0,H,1.5,3.8,5.7,2010-12-28,2010/2011,21,E0,4-0,4,-4.2,2010-12-28Man CityAston Villa
28/12/10,Stoke,Fulham,0,2,A,1.9,3.3,3.7,2010-12-28,2010/2011,21,E0,0-2,-2,-1.8000000000000003,2010-12-28StokeFulham
28/12/10,Sunderland,Blackpool,0,2,A,1.7,3.5,4.4,2010-12-28,2010/2011,21,E0,0-2,-2,-2.7,2010-12-28SunderlandBlackpool
28/12/10,Tottenham,Newcastle,2,0,H,1.57,3.7,5.4,2010-12-28,2010/2011,21,E0,2-0,2,-3.83,2010-12-28TottenhamNewcastle
28/12/10,West Brom,Blackburn,1,3,A,1.9,3.3,3.7,2010-12-28,2010/2011,21,E0,1-3,-2,-1.8000000000000003,2010-12-28West BromBlackburn
28/12/10,West Ham,Everton,1,1,D,2.7,3.2,2.4,2010-12-28,2010/2011,21,E0,1-1,0,0.30000000000000027,2010-12-28West HamEverton
29/12/10,Chelsea,Bolton,1,0,H,1.27,5.0,9.0,2010-12-29,2010/2011,21,E0,1-0,1,-7.73,2010-12-29ChelseaBolton
29/12/10,Liverpool,Wolves,0,1,A,1.33,4.6,7.8,2010-12-29,2010/2011,21,E0,0-1,-1,-6.47,2010-12-29LiverpoolWolves
29/12/10,Wigan,Arsenal,2,2,D,5.4,3.7,1.55,2010-12-29,2010/2011,22,E0,2-2,0,3.8500000000000005,2010-12-29WiganArsenal
01/01/11,Birmingham,Arsenal,0,3,A,4.4,3.5,1.7,2011-01-01,2010/2011,22,E0,0-3,-3,2.7,2011-01-01BirminghamArsenal
01/01/11,Liverpool,Bolton,2,1,H,1.6,3.6,5.0,2011-01-01,2010/2011,22,E0,2-1,1,-3.4,2011-01-01LiverpoolBolton
01/01/11,Man City,Blackpool,1,0,H,1.35,4.5,7.3,2011-01-01,2010/2011,22,E0,1-0,1,-5.949999999999999,2011-01-01Man CityBlackpool
01/01/11,Stoke,Everton,2,0,H,2.55,3.1,2.55,2011-01-01,2010/2011,22,E0,2-0,2,0.0,2011-01-01StokeEverton
01/01/11,Sunderland,Blackburn,3,0,H,1.9,3.3,3.7,2011-01-01,2010/2011,22,E0,3-0,3,-1.8000000000000003,2011-01-01SunderlandBlackburn
01/01/11,Tottenham,Fulham,1,0,H,1.45,3.9,6.5,2011-01-01,2010/2011,22,E0,1-0,1,-5.05,2011-01-01TottenhamFulham
01/01/11,West Brom,Man United,1,2,A,5.4,3.7,1.55,2011-01-01,2010/2011,22,E0,1-2,-1,3.8500000000000005,2011-01-01West BromMan United
01/01/11,West Ham,Wolves,2,0,H,2.0,3.3,3.3,2011-01-01,2010/2011,22,E0,2-0,2,-1.2999999999999998,2011-01-01West HamWolves
02/01/11,Chelsea,Aston Villa,3,3,D,1.3,4.8,8.5,2011-01-02,2010/2011,23,E0,3-3,0,-7.2,2011-01-02ChelseaAston Villa
02/01/11,Wigan,Newcastle,0,1,A,2.2,3.2,3.0,2011-01-02,2010/2011,23,E0,0-1,-1,-0.7999999999999998,2011-01-02WiganNewcastle
04/01/11,Blackpool,Birmingham,1,2,A,2.2,3.2,3.0,2011-01-04,2010/2011,23,E0,1-2,-1,-0.7999999999999998,2011-01-04BlackpoolBirmingham
04/01/11,Fulham,West Brom,3,0,H,2.0,3.3,3.3,2011-01-04,2010/2011,23,E0,3-0,3,-1.2999999999999998,2011-01-04FulhamWest Brom
04/01/11,Man United,Stoke,2,1,H,1.25,5.0,10.0,2011-01-04,2010/2011,23,E0,2-1,1,-8.75,2011-01-04Man UnitedStoke
05/01/11,Arsenal,Man City,0,0,D,2.0,3.3,3.3,2011-01-05,2010/2011,23,E0,0-0,0,-1.2999999999999998,2011-01-05ArsenalMan City
05/01/11,Aston Villa,Sunderland,0,1,A,2.1,3.3,3.1,2011-01-05,2010/2011,23,E0,0-1,-1,-1.0,2011-01-05Aston VillaSunderland
05/01/11,Blackburn,Liverpool,3,1,H,3.0,3.2,2.2,2011-01-05,2010/2011,23,E0,3-1,2,0.7999999999999998,2011-01-05BlackburnLiverpool
05/01/11,Bolton,Wigan,1,1,D,1.75,3.4,4.3,2011-01-05,2010/2011,23,E0,1-1,0,-2.55,2011-01-05BoltonWigan
05/01/11,Everton,Tottenham,2,1,H,2.55,3.2,2.55,2011-01-05,2010/2011,24,E0,2-1,1,0.0,2011-01-05EvertonTottenham
05/01/11,Newcastle,West Ham,5,0,H,1.9,3.3,3.7,2011-01-05,2010/2011,24,E0,5-0,5,-1.8000000000000003,2011-01-05NewcastleWest Ham
05/01/11,Wolves,Chelsea,1,0,H,6.5,3.9,1.45,2011-01-05,2010/2011,24,E0,1-0,1,5.05,2011-01-05WolvesChelsea
12/01/11,Blackpool,Liverpool,2,1,H,3.7,3.3,1.9,2011-01-12,2010/2011,24,E0,2-1,1,1.8000000000000003,2011-01-12BlackpoolLiverpool
15/01/11,Chelsea,Blackburn,2,0,H,1.3,4.8,8.5,2011-01-15,2010/2011,24,E0,2-0,2,-7.2,2011-01-15ChelseaBlackburn
15/01/11,Man City,Wolves,4,3,H,1.27,5.0,9.0,2011-01-15,2010/2011,24,E0,4-3,1,-7.73,2011-01-15Man CityWolves
15/01/11,Stoke,Bolton,2,0,H,2.1,3.2,3.2,2011-01-15,2010/2011,24,E0,2-0,2,-1.1,2011-01-15StokeBolton
15/01/11,West Brom,Blackpool,3,2,H,1.85,3.4,3.8,2011-01-15,2010/2011,24,E0,3-2,1,-1.9499999999999997,2011-01-15West BromBlackpool
15/01/11,West Ham,Arsenal,0,3,A,5.0,3.6,1.6,2011-01-15,2010/2011,24,E0,0-3,-3,3.4,2011-01-15West HamArsenal
15/01/11,Wigan,Fulham,1,1,D,2.4,3.2,2.7,2011-01-15,2010/2011,25,E0,1-1,0,-0.30000000000000027,2011-01-15WiganFulham
16/01/11,Birmingham,Aston Villa,1,1,D,2.5,3.2,2.6,2011-01-16,2010/2011,25,E0,1-1,0,-0.10000000000000009,2011-01-16BirminghamAston Villa
16/01/11,Liverpool,Everton,2,2,D,2.1,3.2,3.2,2011-01-16,2010/2011,25,E0,2-2,0,-1.1,2011-01-16LiverpoolEverton
16/01/11,Sunderland,Newcastle,1,1,D,2.2,3.2,3.0,2011-01-16,2010/2011,25,E0,1-1,0,-0.7999999999999998,2011-01-16SunderlandNewcastle
16/01/11,Tottenham,Man United,0,0,D,3.0,3.2,2.2,2011-01-16,2010/2011,25,E0,0-0,0,0.7999999999999998,2011-01-16TottenhamMan United
22/01/11,Arsenal,Wigan,3,0,H,1.23,5.3,11.0,2011-01-22,2010/2011,25,E0,3-0,3,-9.77,2011-01-22ArsenalWigan
22/01/11,Aston Villa,Man City,1,0,H,3.3,3.3,2.0,2011-01-22,2010/2011,25,E0,1-0,1,1.2999999999999998,2011-01-22Aston VillaMan City
22/01/11,Blackpool,Sunderland,1,2,A,2.5,3.3,2.5,2011-01-22,2010/2011,25,E0,1-2,-1,0.0,2011-01-22BlackpoolSunderland
22/01/11,Everton,West Ham,2,2,D,1.6,3.6,5.0,2011-01-22,2010/2011,25,E0,2-2,0,-3.4,2011-01-22EvertonWest Ham
22/01/11,Fulham,Stoke,2,0,H,2.25,3.2,2.9,2011-01-22,2010/2011,26,E0,2-0,2,-0.6499999999999999,2011-01-22FulhamStoke
22/01/11,Man United,Birmingham,5,0,H,1.23,5.3,11.0,2011-01-22,2010/2011,26,E0,5-0,5,-9.77,2011-01-22Man UnitedBirmingham
22/01/11,Newcastle,Tottenham,1,1,D,2.9,3.3,2.2,2011-01-22,2010/2011,26,E0,1-1,0,0.6999999999999997,2011-01-22NewcastleTottenham
22/01/11,Wolves,Liverpool,0,3,A,3.1,3.3,2.1,2011-01-22,2010/2011,26,E0,0-3,-3,1.0,2011-01-22WolvesLiverpool
23/01/11,Blackburn,West Brom,2,0,H,2.0,3.3,3.3,2011-01-23,2010/2011,26,E0,2-0,2,-1.2999999999999998,2011-01-23BlackburnWest Brom
24/01/11,Bolton,Chelsea,0,4,A,5.0,3.6,1.6,2011-01-24,2010/2011,26,E0,0-4,-4,3.4,2011-01-24BoltonChelsea
25/01/11,Blackpool,Man United,2,3,A,7.0,4.1,1.4,2011-01-25,2010/2011,26,E0,2-3,-1,5.6,2011-01-25BlackpoolMan United
25/01/11,Wigan,Aston Villa,1,2,A,2.7,3.2,2.4,2011-01-25,2010/2011,26,E0,1-2,-1,0.30000000000000027,2011-01-25WiganAston Villa
26/01/11,Liverpool,Fulham,1,0,H,1.55,3.7,5.4,2011-01-26,2010/2011,26,E0,1-0,1,-3.8500000000000005,2011-01-26LiverpoolFulham
01/02/11,Arsenal,Everton,2,1,H,1.45,3.9,6.5,2011-02-01,2010/2011,27,E0,2-1,1,-5.05,2011-02-01ArsenalEverton
01/02/11,Man United,Aston Villa,3,1,H,1.3,4.8,8.5,2011-02-01,2010/2011,27,E0,3-1,2,-7.2,2011-02-01Man UnitedAston Villa
01/02/11,Sunderland,Chelsea,2,4,A,4.4,3.5,1.7,2011-02-01,2010/2011,27,E0,2-4,-2,2.7,2011-02-01SunderlandChelsea
01/02/11,West Brom,Wigan,2,2,D,1.8,3.4,4.0,2011-02-01,2010/2011,27,E0,2-2,0,-2.2,2011-02-01West BromWigan
02/02/11,Birmingham,Man City,2,2,D,4.0,3.4,1.8,2011-02-02,2010/2011,27,E0,2-2,0,2.2,2011-02-02BirminghamMan City
02/02/11,Blackburn,Tottenham,0,1,A,2.8,3.2,2.3,2011-02-02,2010/2011,27,E0,0-1,-1,0.5,2011-02-02BlackburnTottenham
02/02/11,Blackpool,West Ham,1,3,A,2.3,3.2,2.8,2011-02-02,2010/2011,27,E0,1-3,-2,-0.5,2011-02-02BlackpoolWest Ham
02/02/11,Bolton,Wolves,1,0,H,1.8,3.4,4.0,2011-02-02,2010/2011,27,E0,1-0,1,-2.2,2011-02-02BoltonWolves
02/02/11,Fulham,Newcastle,1,0,H,2.1,3.3,3.1,2011-02-02,2010/2011,27,E0,1-0,1,-1.0,2011-02-02FulhamNewcastle
02/02/11,Liverpool,Stoke,2,0,H,1.55,3.7,5.4,2011-02-02,2010/2011,28,E0,2-0,2,-3.8500000000000005,2011-02-02LiverpoolStoke
05/02/11,Aston Villa,Fulham,2,2,D,1.95,3.2,3.6,2011-02-05,2010/2011,28,E0,2-2,0,-1.6500000000000001,2011-02-05Aston VillaFulham
05/02/11,Everton,Blackpool,5,3,H,1.55,3.7,5.4,2011-02-05,2010/2011,28,E0,5-3,2,-3.8500000000000005,2011-02-05EvertonBlackpool
05/02/11,Man City,West Brom,3,0,H,1.37,4.4,7.3,2011-02-05,2010/2011,28,E0,3-0,3,-5.93,2011-02-05Man CityWest Brom
05/02/11,Newcastle,Arsenal,4,4,D,4.4,3.5,1.7,2011-02-05,2010/2011,28,E0,4-4,0,2.7,2011-02-05NewcastleArsenal
05/02/11,Stoke,Sunderland,3,2,H,2.1,3.2,3.2,2011-02-05,2010/2011,28,E0,3-2,1,-1.1,2011-02-05StokeSunderland
05/02/11,Tottenham,Bolton,2,1,H,1.5,3.8,5.7,2011-02-05,2010/2011,28,E0,2-1,1,-4.2,2011-02-05TottenhamBolton
05/02/11,Wigan,Blackburn,4,3,H,2.4,3.2,2.7,2011-02-05,2010/2011,28,E0,4-3,1,-0.30000000000000027,2011-02-05WiganBlackburn
05/02/11,Wolves,Man United,2,1,H,7.3,4.4,1.37,2011-02-05,2010/2011,28,E0,2-1,1,5.93,2011-02-05WolvesMan United
06/02/11,Chelsea,Liverpool,0,1,A,1.6,3.6,5.0,2011-02-06,2010/2011,29,E0,0-1,-1,-3.4,2011-02-06ChelseaLiverpool
06/02/11,West Ham,Birmingham,0,1,A,2.0,3.2,3.4,2011-02-06,2010/2011,29,E0,0-1,-1,-1.4,2011-02-06West HamBirmingham
12/02/11,Arsenal,Wolves,2,0,H,1.25,5.0,10.0,2011-02-12,2010/2011,29,E0,2-0,2,-8.75,2011-02-12ArsenalWolves
12/02/11,Birmingham,Stoke,1,0,H,2.2,3.2,3.0,2011-02-12,2010/2011,29,E0,1-0,1,-0.7999999999999998,2011-02-12BirminghamStoke
12/02/11,Blackburn,Newcastle,0,0,D,2.1,3.3,3.1,2011-02-12,2010/2011,29,E0,0-0,0,-1.0,2011-02-12BlackburnNewcastle
12/02/11,Blackpool,Aston Villa,1,1,D,3.0,3.2,2.2,2011-02-12,2010/2011,29,E0,1-1,0,0.7999999999999998,2011-02-12BlackpoolAston Villa
12/02/11,Liverpool,Wigan,1,1,D,1.35,4.5,7.3,2011-02-12,2010/2011,29,E0,1-1,0,-5.949999999999999,2011-02-12LiverpoolWigan
12/02/11,Man United,Man City,2,1,H,1.8,3.4,4.0,2011-02-12,2010/2011,29,E0,2-1,1,-2.2,2011-02-12Man UnitedMan City
12/02/11,Sunderland,Tottenham,1,2,A,2.55,3.1,2.55,2011-02-12,2010/2011,29,E0,1-2,-1,0.0,2011-02-12SunderlandTottenham
12/02/11,West Brom,West Ham,3,3,D,2.0,3.3,3.3,2011-02-12,2010/2011,30,E0,3-3,0,-1.2999999999999998,2011-02-12West BromWest Ham
13/02/11,Bolton,Everton,2,0,H,2.5,3.2,2.55,2011-02-13,2010/2011,30,E0,2-0,2,-0.04999999999999982,2011-02-13BoltonEverton
14/02/11,Fulham,Chelsea,0,0,D,4.4,3.5,1.7,2011-02-14,2010/2011,30,E0,0-0,0,2.7,2011-02-14FulhamChelsea
15/02/11,Birmingham,Newcastle,0,2,A,2.4,3.2,2.7,2011-02-15,2010/2011,30,E0,0-2,-2,-0.30000000000000027,2011-02-15BirminghamNewcastle
20/02/11,West Brom,Wolves,1,1,D,1.9,3.3,3.7,2011-02-20,2010/2011,30,E0,1-1,0,-1.8000000000000003,2011-02-20West BromWolves
22/02/11,Blackpool,Tottenham,3,1,H,4.0,3.4,1.8,2011-02-22,2010/2011,30,E0,3-1,2,2.2,2011-02-22BlackpoolTottenham
23/02/11,Arsenal,Stoke,1,0,H,1.27,5.0,9.0,2011-02-23,2010/2011,30,E0,1-0,1,-7.73,2011-02-23ArsenalStoke
26/02/11,Aston Villa,Blackburn,4,1,H,1.85,3.4,3.8,2011-02-26,2010/2011,30,E0,4-1,3,-1.9499999999999997,2011-02-26Aston VillaBlackburn
26/02/11,Everton,Sunderland,2,0,H,1.8,3.4,4.0,2011-02-26,2010/2011,30,E0,2-0,2,-2.2,2011-02-26EvertonSunderland
26/02/11,Newcastle,Bolton,1,1,D,2.0,3.3,3.3,2011-02-26,2010/2011,31,E0,1-1,0,-1.2999999999999998,2011-02-26NewcastleBolton
26/02/11,Wigan,Man United,0,4,A,7.2,4.3,1.37,2011-02-26,2010/2011,31,E0,0-4,-4,5.83,2011-02-26WiganMan United
26/02/11,Wolves,Blackpool,4,0,H,1.95,3.4,3.5,2011-02-26,2010/2011,31,E0,4-0,4,-1.55,2011-02-26WolvesBlackpool
27/02/11,Man City,Fulham,1,1,D,1.5,3.8,5.7,2011-02-27,2010/2011,31,E0,1-1,0,-4.2,2011-02-27Man CityFulham
27/02/11,West Ham,Liverpool,3,1,H,3.3,3.3,2.0,2011-02-27,2010/2011,31,E0,3-1,2,1.2999999999999998,2011-02-27West HamLiverpool
28/02/11,Stoke,West Brom,1,1,D,1.8,3.4,4.0,2011-02-28,2010/2011,31,E0,1-1,0,-2.2,2011-02-28StokeWest Brom
01/03/11,Chelsea,Man United,2,1,H,2.2,3.1,3.1,2011-03-01,2010/2011,31,E0,2-1,1,-0.8999999999999999,2011-03-01ChelseaMan United
05/03/11,Arsenal,Sunderland,0,0,D,1.37,4.3,7.2,2011-03-05,2010/2011,31,E0,0-0,0,-5.83,2011-03-05ArsenalSunderland
05/03/11,Birmingham,West Brom,1,3,A,2.0,3.2,3.4,2011-03-05,2010/2011,31,E0,1-3,-2,-1.4,2011-03-05BirminghamWest Brom
05/03/11,Bolton,Aston Villa,3,2,H,2.2,3.2,3.0,2011-03-05,2010/2011,32,E0,3-2,1,-0.7999999999999998,2011-03-05BoltonAston Villa
05/03/11,Fulham,Blackburn,3,2,H,1.8,3.4,4.0,2011-03-05,2010/2011,32,E0,3-2,1,-2.2,2011-03-05FulhamBlackburn
05/03/11,Man City,Wigan,1,0,H,1.4,4.1,7.0,2011-03-05,2010/2011,32,E0,1-0,1,-5.6,2011-03-05Man CityWigan
05/03/11,Newcastle,Everton,1,2,A,2.3,3.3,2.75,2011-03-05,2010/2011,32,E0,1-2,-1,-0.4500000000000002,2011-03-05NewcastleEverton
05/03/11,West Ham,Stoke,3,0,H,2.0,3.3,3.3,2011-03-05,2010/2011,32,E0,3-0,3,-1.2999999999999998,2011-03-05West HamStoke
06/03/11,Liverpool,Man United,3,1,H,2.8,3.2,2.3,2011-03-06,2010/2011,32,E0,3-1,2,0.5,2011-03-06LiverpoolMan United
06/03/11,Wolves,Tottenham,3,3,D,2.8,3.2,2.3,2011-03-06,2010/2011,32,E0,3-3,0,0.5,2011-03-06WolvesTottenham
07/03/11,Blackpool,Chelsea,1,3,A,7.3,4.5,1.35,2011-03-07,2010/2011,32,E0,1-3,-2,5.949999999999999,2011-03-07BlackpoolChelsea
09/03/11,Everton,Birmingham,1,1,D,1.6,3.6,5.0,2011-03-09,2010/2011,32,E0,1-1,0,-3.4,2011-03-09EvertonBirmingham
19/03/11,Aston Villa,Wolves,0,1,A,1.85,3.4,3.8,2011-03-19,2010/2011,33,E0,0-1,-1,-1.9499999999999997,2011-03-19Aston VillaWolves
19/03/11,Blackburn,Blackpool,2,2,D,1.85,3.4,3.8,2011-03-19,2010/2011,33,E0,2-2,0,-1.9499999999999997,2011-03-19BlackburnBlackpool
19/03/11,Everton,Fulham,2,1,H,1.8,3.4,4.0,2011-03-19,2010/2011,33,E0,2-1,1,-2.2,2011-03-19EvertonFulham
19/03/11,Man United,Bolton,1,0,H,1.35,4.5,7.3,2011-03-19,2010/2011,33,E0,1-0,1,-5.949999999999999,2011-03-19Man UnitedBolton
19/03/11,Stoke,Newcastle,4,0,H,2.1,3.15,3.25,2011-03-19,2010/2011,33,E0,4-0,4,-1.15,2011-03-19StokeNewcastle
19/03/11,Tottenham,West Ham,0,0,D,1.6,3.6,5.0,2011-03-19,2010/2011,33,E0,0-0,0,-3.4,2011-03-19TottenhamWest Ham
19/03/11,West Brom,Arsenal,2,2,D,4.5,3.5,1.67,2011-03-19,2010/2011,33,E0,2-2,0,2.83,2011-03-19West BromArsenal
19/03/11,Wigan,Birmingham,2,1,H,2.25,3.2,2.9,2011-03-19,2010/2011,33,E0,2-1,1,-0.6499999999999999,2011-03-19WiganBirmingham
20/03/11,Chelsea,Man City,2,0,H,1.7,3.5,4.4,2011-03-20,2010/2011,33,E0,2-0,2,-2.7,2011-03-20ChelseaMan City
20/03/11,Sunderland,Liverpool,0,2,A,2.7,3.2,2.4,2011-03-20,2010/2011,34,E0,0-2,-2,0.30000000000000027,2011-03-20SunderlandLiverpool
02/04/11,Arsenal,Blackburn,0,0,D,1.25,5.0,10.0,2011-04-02,2010/2011,34,E0,0-0,0,-8.75,2011-04-02ArsenalBlackburn
02/04/11,Birmingham,Bolton,2,1,H,2.2,3.3,2.9,2011-04-02,2010/2011,34,E0,2-1,1,-0.6999999999999997,2011-04-02BirminghamBolton
02/04/11,Everton,Aston Villa,2,2,D,1.85,3.4,3.8,2011-04-02,2010/2011,34,E0,2-2,0,-1.9499999999999997,2011-04-02EvertonAston Villa
02/04/11,Newcastle,Wolves,4,1,H,2.0,3.3,3.3,2011-04-02,2010/2011,34,E0,4-1,3,-1.2999999999999998,2011-04-02NewcastleWolves
02/04/11,Stoke,Chelsea,1,1,D,5.0,3.6,1.6,2011-04-02,2010/2011,34,E0,1-1,0,3.4,2011-04-02StokeChelsea
02/04/11,West Brom,Liverpool,2,1,H,2.9,3.3,2.2,2011-04-02,2010/2011,34,E0,2-1,1,0.6999999999999997,2011-04-02West BromLiverpool
02/04/11,West Ham,Man United,2,4,A,3.8,3.4,1.85,2011-04-02,2010/2011,34,E0,2-4,-2,1.9499999999999997,2011-04-02West HamMan United
02/04/11,Wigan,Tottenham,0,0,D,2.75,3.3,2.3,2011-04-02,2010/2011,34,E0,0-0,0,0.4500000000000002,2011-04-02WiganTottenham
03/04/11,Fulham,Blackpool,3,0,H,1.55,3.7,5.4,2011-04-03,2010/2011,35,E0,3-0,3,-3.8500000000000005,2011-04-03FulhamBlackpool
03/04/11,Man City,Sunderland,5,0,H,1.4,3.9,7.5,2011-04-03,2010/2011,35,E0,5-0,5,-6.1,2011-04-03Man CitySunderland
09/04/11,Blackburn,Birmingham,1,1,D,2.0,3.1,3.5,2011-04-09,2010/2011,35,E0,1-1,0,-1.5,2011-04-09BlackburnBirmingham
09/04/11,Bolton,West Ham,3,0,H,1.9,3.3,3.7,2011-04-09,2010/2011,35,E0,3-0,3,-1.8000000000000003,2011-04-09BoltonWest Ham
09/04/11,Chelsea,Wigan,1,0,H,1.25,5.0,10.0,2011-04-09,2010/2011,35,E0,1-0,1,-8.75,2011-04-09ChelseaWigan
09/04/11,Man United,Fulham,2,0,H,1.4,4.1,7.0,2011-04-09,2010/2011,35,E0,2-0,2,-5.6,2011-04-09Man UnitedFulham
09/04/11,Sunderland,West Brom,2,3,A,2.1,3.1,3.3,2011-04-09,2010/2011,35,E0,2-3,-1,-1.1999999999999997,2011-04-09SunderlandWest Brom
09/04/11,Tottenham,Stoke,3,2,H,1.7,3.5,4.4,2011-04-09,2010/2011,35,E0,3-2,1,-2.7,2011-04-09TottenhamStoke
09/04/11,Wolves,Everton,0,3,A,2.5,3.2,2.6,2011-04-09,2010/2011,35,E0,0-3,-3,-0.10000000000000009,2011-04-09WolvesEverton
10/04/11,Aston Villa,Newcastle,1,0,H,1.9,3.3,3.7,2011-04-10,2010/2011,36,E0,1-0,1,-1.8000000000000003,2011-04-10Aston VillaNewcastle
10/04/11,Blackpool,Arsenal,1,3,A,6.5,3.9,1.45,2011-04-10,2010/2011,36,E0,1-3,-2,5.05,2011-04-10BlackpoolArsenal
11/04/11,Liverpool,Man City,3,0,H,2.3,3.2,2.8,2011-04-11,2010/2011,36,E0,3-0,3,-0.5,2011-04-11LiverpoolMan City
16/04/11,Birmingham,Sunderland,2,0,H,2.0,3.2,3.4,2011-04-16,2010/2011,36,E0,2-0,2,-1.4,2011-04-16BirminghamSunderland
16/04/11,Blackpool,Wigan,1,3,A,2.3,3.3,2.75,2011-04-16,2010/2011,36,E0,1-3,-2,-0.4500000000000002,2011-04-16BlackpoolWigan
16/04/11,Everton,Blackburn,2,0,H,1.8,3.4,4.0,2011-04-16,2010/2011,36,E0,2-0,2,-2.2,2011-04-16EvertonBlackburn
16/04/11,West Brom,Chelsea,1,3,A,4.4,3.5,1.7,2011-04-16,2010/2011,36,E0,1-3,-2,2.7,2011-04-16West BromChelsea
16/04/11,West Ham,Aston Villa,1,2,A,2.1,3.2,3.2,2011-04-16,2010/2011,36,E0,1-2,-1,-1.1,2011-04-16West HamAston Villa
17/04/11,Arsenal,Liverpool,1,1,D,1.75,3.4,4.3,2011-04-17,2010/2011,36,E0,1-1,0,-2.55,2011-04-17ArsenalLiverpool
19/04/11,Newcastle,Man United,0,0,D,4.8,3.4,1.65,2011-04-19,2010/2011,37,E0,0-0,0,3.15,2011-04-19NewcastleMan United
20/04/11,Chelsea,Birmingham,3,1,H,1.22,5.3,11.0,2011-04-20,2010/2011,37,E0,3-1,2,-9.78,2011-04-20ChelseaBirmingham
20/04/11,Tottenham,Arsenal,3,3,D,2.5,3.3,2.5,2011-04-20,2010/2011,37,E0,3-3,0,0.0,2011-04-20TottenhamArsenal
23/04/11,Aston Villa,Stoke,1,1,D,1.8,3.4,4.0,2011-04-23,2010/2011,37,E0,1-1,0,-2.2,2011-04-23Aston VillaStoke
23/04/11,Blackpool,Newcastle,1,1,D,2.6,3.35,2.4,2011-04-23,2010/2011,37,E0,1-1,0,0.20000000000000018,2011-04-23BlackpoolNewcastle
23/04/11,Chelsea,West Ham,3,0,H,1.25,5.0,10.0,2011-04-23,2010/2011,37,E0,3-0,3,-8.75,2011-04-23ChelseaWest Ham
23/04/11,Liverpool,Birmingham,5,0,H,1.5,3.8,5.7,2011-04-23,2010/2011,37,E0,5-0,5,-4.2,2011-04-23LiverpoolBirmingham
23/04/11,Man United,Everton,1,0,H,1.45,3.9,6.5,2011-04-23,2010/2011,37,E0,1-0,1,-5.05,2011-04-23Man UnitedEverton
23/04/11,Sunderland,Wigan,4,2,H,2.1,3.2,3.2,2011-04-23,2010/2011,37,E0,4-2,2,-1.1,2011-04-23SunderlandWigan
23/04/11,Tottenham,West Brom,2,2,D,1.65,3.5,4.6,2011-04-23,2010/2011,38,E0,2-2,0,-2.9499999999999997,2011-04-23TottenhamWest Brom
23/04/11,Wolves,Fulham,1,1,D,2.3,3.2,2.8,2011-04-23,2010/2011,38,E0,1-1,0,-0.5,2011-04-23WolvesFulham
24/04/11,Bolton,Arsenal,2,1,H,4.3,3.4,1.75,2011-04-24,2010/2011,38,E0,2-1,1,2.55,2011-04-24BoltonArsenal
25/04/11,Blackburn,Man City,0,1,A,3.1,3.3,2.1,2011-04-25,2010/2011,38,E0,0-1,-1,1.0,2011-04-25BlackburnMan City
26/04/11,Stoke,Wolves,3,0,H,1.85,3.3,3.9,2011-04-26,2010/2011,38,E0,3-0,3,-2.05,2011-04-26StokeWolves
27/04/11,Fulham,Bolton,3,0,H,1.8,3.4,4.0,2011-04-27,2010/2011,38,E0,3-0,3,-2.2,2011-04-27FulhamBolton
30/04/11,Blackburn,Bolton,1,0,H,1.85,3.4,3.8,2011-04-30,2010/2011,38,E0,1-0,1,-1.9499999999999997,2011-04-30BlackburnBolton
30/04/11,Blackpool,Stoke,0,0,D,2.5,3.3,2.5,2011-04-30,2010/2011,38,E0,0-0,0,0.0,2011-04-30BlackpoolStoke
30/04/11,Chelsea,Tottenham,2,1,H,1.55,3.8,5.2,2011-04-30,2010/2011,38,E0,2-1,1,-3.6500000000000004,2011-04-30ChelseaTottenham
30/04/11,Sunderland,Fulham,0,3,A,2.3,3.0,3.0,2011-04-30,2010/2011,39,E0,0-3,-3,-0.7000000000000002,2011-04-30SunderlandFulham
30/04/11,West Brom,Aston Villa,2,1,H,2.4,3.0,2.9,2011-04-30,2010/2011,39,E0,2-1,1,-0.5,2011-04-30West BromAston Villa
30/04/11,Wigan,Everton,1,1,D,2.5,3.3,2.5,2011-04-30,2010/2011,39,E0,1-1,0,0.0,2011-04-30WiganEverton
01/05/11,Arsenal,Man United,1,0,H,2.5,3.2,2.6,2011-05-01,2010/2011,39,E0,1-0,1,-0.10000000000000009,2011-05-01ArsenalMan United
01/05/11,Birmingham,Wolves,1,1,D,2.0,3.3,3.3,2011-05-01,2010/2011,39,E0,1-1,0,-1.2999999999999998,2011-05-01BirminghamWolves
01/05/11,Liverpool,Newcastle,3,0,H,1.4,4.1,7.0,2011-05-01,2010/2011,39,E0,3-0,3,-5.6,2011-05-01LiverpoolNewcastle
01/05/11,Man City,West Ham,2,1,H,1.42,4.0,7.0,2011-05-01,2010/2011,39,E0,2-1,1,-5.58,2011-05-01Man CityWest Ham
07/05/11,Aston Villa,Wigan,1,1,D,1.9,3.4,3.6,2011-05-07,2010/2011,39,E0,1-1,0,-1.7000000000000002,2011-05-07Aston VillaWigan
07/05/11,Bolton,Sunderland,1,2,A,1.85,3.4,3.8,2011-05-07,2010/2011,39,E0,1-2,-1,-1.9499999999999997,2011-05-07BoltonSunderland
07/05/11,Everton,Man City,2,1,H,2.6,3.2,2.5,2011-05-07,2010/2011,40,E0,2-1,1,0.10000000000000009,2011-05-07EvertonMan City
07/05/11,Newcastle,Birmingham,2,1,H,2.0,3.4,3.2,2011-05-07,2010/2011,40,E0,2-1,1,-1.2000000000000002,2011-05-07NewcastleBirmingham
07/05/11,Tottenham,Blackpool,1,1,D,1.25,5.0,10.0,2011-05-07,2010/2011,40,E0,1-1,0,-8.75,2011-05-07TottenhamBlackpool
07/05/11,West Ham,Blackburn,1,1,D,1.9,3.4,3.6,2011-05-07,2010/2011,40,E0,1-1,0,-1.7000000000000002,2011-05-07West HamBlackburn
08/05/11,Man United,Chelsea,2,1,H,2.1,3.2,3.2,2011-05-08,2010/2011,40,E0,2-1,1,-1.1,2011-05-08Man UnitedChelsea
08/05/11,Stoke,Arsenal,3,1,H,4.6,3.5,1.67,2011-05-08,2010/2011,40,E0,3-1,2,2.9299999999999997,2011-05-08StokeArsenal
08/05/11,Wolves,West Brom,3,1,H,2.2,3.3,2.9,2011-05-08,2010/2011,40,E0,3-1,2,-0.6999999999999997,2011-05-08WolvesWest Brom
09/05/11,Fulham,Liverpool,2,5,A,2.8,3.2,2.3,2011-05-09,2010/2011,40,E0,2-5,-3,0.5,2011-05-09FulhamLiverpool
10/05/11,Man City,Tottenham,1,0,H,2.0,3.4,3.2,2011-05-10,2010/2011,40,E0,1-0,1,-1.2000000000000002,2011-05-10Man CityTottenham
14/05/11,Blackburn,Man United,1,1,D,4.5,3.1,1.8,2011-05-14,2010/2011,41,E0,1-1,0,2.7,2011-05-14BlackburnMan United
14/05/11,Blackpool,Bolton,4,3,H,2.0,3.4,3.2,2011-05-14,2010/2011,41,E0,4-3,1,-1.2000000000000002,2011-05-14BlackpoolBolton
14/05/11,Sunderland,Wolves,1,3,A,2.4,3.3,2.6,2011-05-14,2010/2011,41,E0,1-3,-2,-0.20000000000000018,2011-05-14SunderlandWolves
14/05/11,West Brom,Everton,1,0,H,2.5,3.3,2.5,2011-05-14,2010/2011,41,E0,1-0,1,0.0,2011-05-14West BromEverton
15/05/11,Arsenal,Aston Villa,1,2,A,1.25,5.0,10.0,2011-05-15,2010/2011,41,E0,1-2,-1,-8.75,2011-05-15ArsenalAston Villa
15/05/11,Birmingham,Fulham,0,2,A,1.9,3.4,3.6,2011-05-15,2010/2011,41,E0,0-2,-2,-1.7000000000000002,2011-05-15BirminghamFulham
15/05/11,Chelsea,Newcastle,2,2,D,1.22,5.3,11.0,2011-05-15,2010/2011,41,E0,2-2,0,-9.78,2011-05-15ChelseaNewcastle
15/05/11,Liverpool,Tottenham,0,2,A,1.85,3.4,3.8,2011-05-15,2010/2011,41,E0,0-2,-2,-1.9499999999999997,2011-05-15LiverpoolTottenham
15/05/11,Wigan,West Ham,3,2,H,1.9,3.4,3.6,2011-05-15,2010/2011,41,E0,3-2,1,-1.7000000000000002,2011-05-15WiganWest Ham
17/05/11,Man City,Stoke,3,0,H,1.35,4.5,7.3,2011-05-17,2010/2011,42,E0,3-0,3,-5.949999999999999,2011-05-17Man CityStoke
22/05/11,Aston Villa,Liverpool,1,0,H,2.8,3.2,2.3,2011-05-22,2010/2011,42,E0,1-0,1,0.5,2011-05-22Aston VillaLiverpool
22/05/11,Bolton,Man City,0,2,A,4.4,3.5,1.7,2011-05-22,2010/2011,42,E0,0-2,-2,2.7,2011-05-22BoltonMan City
22/05/11,Everton,Chelsea,1,0,H,2.8,3.1,2.4,2011-05-22,2010/2011,42,E0,1-0,1,0.3999999999999999,2011-05-22EvertonChelsea
22/05/11,Fulham,Arsenal,2,2,D,3.3,3.3,2.0,2011-05-22,2010/2011,42,E0,2-2,0,1.2999999999999998,2011-05-22FulhamArsenal
22/05/11,Man United,Blackpool,4,2,H,1.65,3.8,4.0,2011-05-22,2010/2011,42,E0,4-2,2,-2.35,2011-05-22Man UnitedBlackpool
22/05/11,Newcastle,West Brom,3,3,D,1.9,3.3,3.7,2011-05-22,2010/2011,42,E0,3-3,0,-1.8000000000000003,2011-05-22NewcastleWest Brom
22/05/11,Stoke,Wigan,0,1,A,2.8,3.2,2.3,2011-05-22,2010/2011,42,E0,0-1,-1,0.5,2011-05-22StokeWigan
22/05/11,Tottenham,Birmingham,2,1,H,1.55,4.0,4.6,2011-05-22,2010/2011,42,E0,2-1,1,-3.05,2011-05-22TottenhamBirmingham
