Date,HomeTeam,AwayTeam,FTHG,FTAG,FTR,IWH,IWD,IWA,datetime,season,game_day,league,result,goal_diff,odds_diff,game_id
11/08/07,Aston Villa,Liverpool,1,2,A,3.6,3.2,1.9,2007-08-11,2007/2008,1,E0,1-2,-1,1.7000000000000002,2007-08-11Aston VillaLiverpool
11/08/07,Bolton,Newcastle,1,3,A,2.2,3.1,3.0,2007-08-11,2007/2008,1,E0,1-3,-2,-0.7999999999999998,2007-08-11BoltonNewcastle
11/08/07,Derby,Portsmouth,2,2,D,2.7,3.1,2.4,2007-08-11,2007/2008,1,E0,2-2,0,0.30000000000000027,2007-08-11DerbyPortsmouth
11/08/07,Everton,Wigan,2,1,H,1.65,3.5,4.5,2007-08-11,2007/2008,1,E0,2-1,1,-2.85,2007-08-11EvertonWigan
11/08/07,Middlesbrough,Blackburn,1,2,A,2.3,3.1,2.8,2007-08-11,2007/2008,1,E0,1-2,-1,-0.5,2007-08-11MiddlesbroughBlackburn
11/08/07,Sunderland,Tottenham,1,0,H,3.0,3.1,2.2,2007-08-11,2007/2008,1,E0,1-0,1,0.7999999999999998,2007-08-11SunderlandTottenham
11/08/07,West Ham,Man City,0,2,A,2.0,3.2,3.3,2007-08-11,2007/2008,1,E0,0-2,-2,-1.2999999999999998,2007-08-11West HamMan City
12/08/07,Arsenal,Fulham,2,1,H,1.35,4.2,7.5,2007-08-12,2007/2008,1,E0,2-1,1,-6.15,2007-08-12ArsenalFulham
12/08/07,Chelsea,Birmingham,3,2,H,1.2,5.2,11.0,2007-08-12,2007/2008,1,E0,3-2,1,-9.8,2007-08-12ChelseaBirmingham
12/08/07,Man United,Reading,0,0,D,1.2,5.2,11.0,2007-08-12,2007/2008,2,E0,0-0,0,-9.8,2007-08-12Man UnitedReading
14/08/07,Tottenham,Everton,1,3,A,1.8,3.2,4.0,2007-08-14,2007/2008,2,E0,1-3,-2,-2.2,2007-08-14TottenhamEverton
15/08/07,Birmingham,Sunderland,2,2,D,2.2,3.1,3.0,2007-08-15,2007/2008,2,E0,2-2,0,-0.7999999999999998,2007-08-15BirminghamSunderland
15/08/07,Fulham,Bolton,2,1,H,2.1,3.1,3.2,2007-08-15,2007/2008,2,E0,2-1,1,-1.1,2007-08-15FulhamBolton
15/08/07,Man City,Derby,1,0,H,1.6,3.5,5.0,2007-08-15,2007/2008,2,E0,1-0,1,-3.4,2007-08-15Man CityDerby
15/08/07,Portsmouth,Man United,1,1,D,4.3,3.4,1.7,2007-08-15,2007/2008,2,E0,1-1,0,2.5999999999999996,2007-08-15PortsmouthMan United
15/08/07,Reading,Chelsea,1,2,A,4.8,3.6,1.6,2007-08-15,2007/2008,2,E0,1-2,-1,3.1999999999999997,2007-08-15ReadingChelsea
15/08/07,Wigan,Middlesbrough,1,0,H,2.3,3.1,2.8,2007-08-15,2007/2008,2,E0,1-0,1,-0.5,2007-08-15WiganMiddlesbrough
18/08/07,Birmingham,West Ham,0,1,A,2.4,3.1,2.7,2007-08-18,2007/2008,2,E0,0-1,-1,-0.30000000000000027,2007-08-18BirminghamWest Ham
18/08/07,Fulham,Middlesbrough,1,2,A,2.1,3.2,3.1,2007-08-18,2007/2008,3,E0,1-2,-1,-1.0,2007-08-18FulhamMiddlesbrough
18/08/07,Newcastle,Aston Villa,0,0,D,1.8,3.2,4.0,2007-08-18,2007/2008,3,E0,0-0,0,-2.2,2007-08-18NewcastleAston Villa
18/08/07,Portsmouth,Bolton,3,1,H,1.85,3.2,3.8,2007-08-18,2007/2008,3,E0,3-1,2,-1.9499999999999997,2007-08-18PortsmouthBolton
18/08/07,Reading,Everton,1,0,H,2.3,3.1,2.8,2007-08-18,2007/2008,3,E0,1-0,1,-0.5,2007-08-18ReadingEverton
18/08/07,Tottenham,Derby,4,0,H,1.5,3.8,5.5,2007-08-18,2007/2008,3,E0,4-0,4,-4.0,2007-08-18TottenhamDerby
18/08/07,Wigan,Sunderland,3,0,H,2.3,3.1,2.8,2007-08-18,2007/2008,3,E0,3-0,3,-0.5,2007-08-18WiganSunderland
19/08/07,Blackburn,Arsenal,1,1,D,3.0,3.1,2.2,2007-08-19,2007/2008,3,E0,1-1,0,0.7999999999999998,2007-08-19BlackburnArsenal
19/08/07,Liverpool,Chelsea,1,1,D,2.3,3.0,2.9,2007-08-19,2007/2008,3,E0,1-1,0,-0.6000000000000001,2007-08-19LiverpoolChelsea
19/08/07,Man City,Man United,1,0,H,3.6,3.2,1.9,2007-08-19,2007/2008,3,E0,1-0,1,1.7000000000000002,2007-08-19Man CityMan United
25/08/07,Arsenal,Man City,1,0,H,1.65,3.5,4.5,2007-08-25,2007/2008,4,E0,1-0,1,-2.85,2007-08-25ArsenalMan City
25/08/07,Aston Villa,Fulham,2,1,H,1.85,3.2,3.8,2007-08-25,2007/2008,4,E0,2-1,1,-1.9499999999999997,2007-08-25Aston VillaFulham
25/08/07,Bolton,Reading,3,0,H,2.2,3.2,2.9,2007-08-25,2007/2008,4,E0,3-0,3,-0.6999999999999997,2007-08-25BoltonReading
25/08/07,Chelsea,Portsmouth,1,0,H,1.27,4.6,9.0,2007-08-25,2007/2008,4,E0,1-0,1,-7.73,2007-08-25ChelseaPortsmouth
25/08/07,Derby,Birmingham,1,2,A,2.3,3.1,2.8,2007-08-25,2007/2008,4,E0,1-2,-1,-0.5,2007-08-25DerbyBirmingham
25/08/07,Everton,Blackburn,1,1,D,2.1,3.1,3.2,2007-08-25,2007/2008,4,E0,1-1,0,-1.1,2007-08-25EvertonBlackburn
25/08/07,Sunderland,Liverpool,0,2,A,4.5,3.5,1.65,2007-08-25,2007/2008,4,E0,0-2,-2,2.85,2007-08-25SunderlandLiverpool
25/08/07,West Ham,Wigan,1,1,D,1.9,3.2,3.6,2007-08-25,2007/2008,4,E0,1-1,0,-1.7000000000000002,2007-08-25West HamWigan
26/08/07,Man United,Tottenham,1,0,H,1.55,3.7,5.0,2007-08-26,2007/2008,4,E0,1-0,1,-3.45,2007-08-26Man UnitedTottenham
26/08/07,Middlesbrough,Newcastle,2,2,D,2.5,3.2,2.5,2007-08-26,2007/2008,5,E0,2-2,0,0.0,2007-08-26MiddlesbroughNewcastle
01/09/07,Bolton,Everton,1,2,A,2.3,3.1,2.8,2007-09-01,2007/2008,5,E0,1-2,-1,-0.5,2007-09-01BoltonEverton
01/09/07,Fulham,Tottenham,3,3,D,2.8,3.1,2.3,2007-09-01,2007/2008,5,E0,3-3,0,0.5,2007-09-01FulhamTottenham
01/09/07,Liverpool,Derby,6,0,H,1.2,5.2,11.0,2007-09-01,2007/2008,5,E0,6-0,6,-9.8,2007-09-01LiverpoolDerby
01/09/07,Man United,Sunderland,1,0,H,1.2,5.2,11.0,2007-09-01,2007/2008,5,E0,1-0,1,-9.8,2007-09-01Man UnitedSunderland
01/09/07,Middlesbrough,Birmingham,2,0,H,2.0,3.2,3.3,2007-09-01,2007/2008,5,E0,2-0,2,-1.2999999999999998,2007-09-01MiddlesbroughBirmingham
01/09/07,Newcastle,Wigan,1,0,H,1.7,3.4,4.3,2007-09-01,2007/2008,5,E0,1-0,1,-2.5999999999999996,2007-09-01NewcastleWigan
01/09/07,Reading,West Ham,0,3,A,2.1,3.1,3.2,2007-09-01,2007/2008,5,E0,0-3,-3,-1.1,2007-09-01ReadingWest Ham
02/09/07,Arsenal,Portsmouth,3,1,H,1.5,3.8,5.5,2007-09-02,2007/2008,5,E0,3-1,2,-4.0,2007-09-02ArsenalPortsmouth
02/09/07,Aston Villa,Chelsea,2,0,H,4.0,3.2,1.8,2007-09-02,2007/2008,6,E0,2-0,2,2.2,2007-09-02Aston VillaChelsea
02/09/07,Blackburn,Man City,1,0,H,2.1,3.1,3.2,2007-09-02,2007/2008,6,E0,1-0,1,-1.1,2007-09-02BlackburnMan City
15/09/07,Birmingham,Bolton,1,0,H,2.3,3.1,2.8,2007-09-15,2007/2008,6,E0,1-0,1,-0.5,2007-09-15BirminghamBolton
15/09/07,Chelsea,Blackburn,0,0,D,1.35,4.2,7.5,2007-09-15,2007/2008,6,E0,0-0,0,-6.15,2007-09-15ChelseaBlackburn
15/09/07,Everton,Man United,0,1,A,4.0,3.2,1.8,2007-09-15,2007/2008,6,E0,0-1,-1,2.2,2007-09-15EvertonMan United
15/09/07,Portsmouth,Liverpool,0,0,D,4.2,3.3,1.75,2007-09-15,2007/2008,6,E0,0-0,0,2.45,2007-09-15PortsmouthLiverpool
15/09/07,Sunderland,Reading,2,1,H,2.3,3.1,2.8,2007-09-15,2007/2008,6,E0,2-1,1,-0.5,2007-09-15SunderlandReading
15/09/07,Tottenham,Arsenal,1,3,A,2.8,3.1,2.3,2007-09-15,2007/2008,6,E0,1-3,-2,0.5,2007-09-15TottenhamArsenal
15/09/07,West Ham,Middlesbrough,3,0,H,1.9,3.2,3.6,2007-09-15,2007/2008,6,E0,3-0,3,-1.7000000000000002,2007-09-15West HamMiddlesbrough
15/09/07,Wigan,Fulham,1,1,D,1.9,3.2,3.6,2007-09-15,2007/2008,7,E0,1-1,0,-1.7000000000000002,2007-09-15WiganFulham
16/09/07,Man City,Aston Villa,1,0,H,2.0,3.2,3.3,2007-09-16,2007/2008,7,E0,1-0,1,-1.2999999999999998,2007-09-16Man CityAston Villa
17/09/07,Derby,Newcastle,1,0,H,3.8,3.2,1.85,2007-09-17,2007/2008,7,E0,1-0,1,1.9499999999999997,2007-09-17DerbyNewcastle
22/09/07,Arsenal,Derby,5,0,H,1.17,5.7,12.0,2007-09-22,2007/2008,7,E0,5-0,5,-10.83,2007-09-22ArsenalDerby
22/09/07,Fulham,Man City,3,3,D,2.55,3.1,2.55,2007-09-22,2007/2008,7,E0,3-3,0,0.0,2007-09-22FulhamMan City
22/09/07,Liverpool,Birmingham,0,0,D,1.25,4.8,9.5,2007-09-22,2007/2008,7,E0,0-0,0,-8.25,2007-09-22LiverpoolBirmingham
22/09/07,Middlesbrough,Sunderland,2,2,D,1.9,3.2,3.6,2007-09-22,2007/2008,7,E0,2-2,0,-1.7000000000000002,2007-09-22MiddlesbroughSunderland
22/09/07,Reading,Wigan,2,1,H,2.2,3.1,3.0,2007-09-22,2007/2008,7,E0,2-1,1,-0.7999999999999998,2007-09-22ReadingWigan
23/09/07,Aston Villa,Everton,2,0,H,2.1,3.1,3.2,2007-09-23,2007/2008,7,E0,2-0,2,-1.1,2007-09-23Aston VillaEverton
23/09/07,Blackburn,Portsmouth,0,1,A,1.85,3.2,3.8,2007-09-23,2007/2008,8,E0,0-1,-1,-1.9499999999999997,2007-09-23BlackburnPortsmouth
23/09/07,Bolton,Tottenham,1,1,D,2.5,3.2,2.5,2007-09-23,2007/2008,8,E0,1-1,0,0.0,2007-09-23BoltonTottenham
23/09/07,Man United,Chelsea,2,0,H,2.2,3.0,3.1,2007-09-23,2007/2008,8,E0,2-0,2,-0.8999999999999999,2007-09-23Man UnitedChelsea
23/09/07,Newcastle,West Ham,3,1,H,1.9,3.2,3.6,2007-09-23,2007/2008,8,E0,3-1,2,-1.7000000000000002,2007-09-23NewcastleWest Ham
29/09/07,Birmingham,Man United,0,1,A,5.0,3.7,1.55,2007-09-29,2007/2008,8,E0,0-1,-1,3.45,2007-09-29BirminghamMan United
29/09/07,Chelsea,Fulham,0,0,D,1.3,4.4,8.5,2007-09-29,2007/2008,8,E0,0-0,0,-7.2,2007-09-29ChelseaFulham
29/09/07,Derby,Bolton,1,1,D,2.55,3.1,2.55,2007-09-29,2007/2008,8,E0,1-1,0,0.0,2007-09-29DerbyBolton
29/09/07,Man City,Newcastle,3,1,H,2.1,3.1,3.2,2007-09-29,2007/2008,8,E0,3-1,2,-1.1,2007-09-29Man CityNewcastle
29/09/07,Portsmouth,Reading,7,4,H,1.75,3.3,4.2,2007-09-29,2007/2008,8,E0,7-4,3,-2.45,2007-09-29PortsmouthReading
29/09/07,Sunderland,Blackburn,1,2,A,2.55,3.1,2.55,2007-09-29,2007/2008,9,E0,1-2,-1,0.0,2007-09-29SunderlandBlackburn
29/09/07,West Ham,Arsenal,0,1,A,4.0,3.2,1.8,2007-09-29,2007/2008,9,E0,0-1,-1,2.2,2007-09-29West HamArsenal
29/09/07,Wigan,Liverpool,0,1,A,4.8,3.6,1.6,2007-09-29,2007/2008,9,E0,0-1,-1,3.1999999999999997,2007-09-29WiganLiverpool
30/09/07,Everton,Middlesbrough,2,0,H,1.8,3.2,4.0,2007-09-30,2007/2008,9,E0,2-0,2,-2.2,2007-09-30EvertonMiddlesbrough
01/10/07,Tottenham,Aston Villa,4,4,D,1.9,3.2,3.6,2007-10-01,2007/2008,9,E0,4-4,0,-1.7000000000000002,2007-10-01TottenhamAston Villa
06/10/07,Aston Villa,West Ham,1,0,H,1.85,3.2,3.8,2007-10-06,2007/2008,9,E0,1-0,1,-1.9499999999999997,2007-10-06Aston VillaWest Ham
06/10/07,Man United,Wigan,4,0,H,1.2,5.2,11.0,2007-10-06,2007/2008,9,E0,4-0,4,-9.8,2007-10-06Man UnitedWigan
07/10/07,Arsenal,Sunderland,3,2,H,1.17,5.7,12.0,2007-10-07,2007/2008,9,E0,3-2,1,-10.83,2007-10-07ArsenalSunderland
07/10/07,Blackburn,Birmingham,2,1,H,1.7,3.4,4.3,2007-10-07,2007/2008,9,E0,2-1,1,-2.5999999999999996,2007-10-07BlackburnBirmingham
07/10/07,Bolton,Chelsea,0,1,A,4.3,3.4,1.7,2007-10-07,2007/2008,10,E0,0-1,-1,2.5999999999999996,2007-10-07BoltonChelsea
07/10/07,Fulham,Portsmouth,0,2,A,2.45,3.1,2.65,2007-10-07,2007/2008,10,E0,0-2,-2,-0.19999999999999973,2007-10-07FulhamPortsmouth
07/10/07,Liverpool,Tottenham,2,2,D,1.5,3.6,6.0,2007-10-07,2007/2008,10,E0,2-2,0,-4.5,2007-10-07LiverpoolTottenham
07/10/07,Man City,Middlesbrough,3,1,H,1.7,3.4,4.3,2007-10-07,2007/2008,10,E0,3-1,2,-2.5999999999999996,2007-10-07Man CityMiddlesbrough
07/10/07,Newcastle,Everton,3,2,H,1.9,3.2,3.6,2007-10-07,2007/2008,10,E0,3-2,1,-1.7000000000000002,2007-10-07NewcastleEverton
07/10/07,Reading,Derby,1,0,H,1.75,3.3,4.2,2007-10-07,2007/2008,10,E0,1-0,1,-2.45,2007-10-07ReadingDerby
20/10/07,Arsenal,Bolton,2,0,H,1.25,4.8,9.5,2007-10-20,2007/2008,10,E0,2-0,2,-8.25,2007-10-20ArsenalBolton
20/10/07,Aston Villa,Man United,1,4,A,4.3,3.4,1.7,2007-10-20,2007/2008,10,E0,1-4,-3,2.5999999999999996,2007-10-20Aston VillaMan United
20/10/07,Blackburn,Reading,4,2,H,1.7,3.4,4.3,2007-10-20,2007/2008,10,E0,4-2,2,-2.5999999999999996,2007-10-20BlackburnReading
20/10/07,Everton,Liverpool,1,2,A,3.3,3.2,2.0,2007-10-20,2007/2008,11,E0,1-2,-1,1.2999999999999998,2007-10-20EvertonLiverpool
20/10/07,Fulham,Derby,0,0,D,1.75,3.3,4.2,2007-10-20,2007/2008,11,E0,0-0,0,-2.45,2007-10-20FulhamDerby
20/10/07,Man City,Birmingham,1,0,H,1.5,3.8,5.5,2007-10-20,2007/2008,11,E0,1-0,1,-4.0,2007-10-20Man CityBirmingham
20/10/07,Middlesbrough,Chelsea,0,2,A,4.5,3.5,1.65,2007-10-20,2007/2008,11,E0,0-2,-2,2.85,2007-10-20MiddlesbroughChelsea
20/10/07,Wigan,Portsmouth,0,2,A,2.7,3.1,2.4,2007-10-20,2007/2008,11,E0,0-2,-2,0.30000000000000027,2007-10-20WiganPortsmouth
21/10/07,West Ham,Sunderland,3,1,H,1.75,3.3,4.2,2007-10-21,2007/2008,11,E0,3-1,2,-2.45,2007-10-21West HamSunderland
22/10/07,Newcastle,Tottenham,3,1,H,2.2,3.1,3.0,2007-10-22,2007/2008,11,E0,3-1,2,-0.7999999999999998,2007-10-22NewcastleTottenham
27/10/07,Birmingham,Wigan,3,2,H,2.0,3.2,3.3,2007-10-27,2007/2008,11,E0,3-2,1,-1.2999999999999998,2007-10-27BirminghamWigan
27/10/07,Chelsea,Man City,6,0,H,1.55,3.5,5.5,2007-10-27,2007/2008,11,E0,6-0,6,-3.95,2007-10-27ChelseaMan City
27/10/07,Man United,Middlesbrough,4,1,H,1.22,5.0,10.0,2007-10-27,2007/2008,12,E0,4-1,3,-8.78,2007-10-27Man UnitedMiddlesbrough
27/10/07,Portsmouth,West Ham,0,0,D,1.85,3.2,3.8,2007-10-27,2007/2008,12,E0,0-0,0,-1.9499999999999997,2007-10-27PortsmouthWest Ham
27/10/07,Reading,Newcastle,2,1,H,2.55,3.1,2.55,2007-10-27,2007/2008,12,E0,2-1,1,0.0,2007-10-27ReadingNewcastle
27/10/07,Sunderland,Fulham,1,1,D,2.2,3.1,3.0,2007-10-27,2007/2008,12,E0,1-1,0,-0.7999999999999998,2007-10-27SunderlandFulham
28/10/07,Bolton,Aston Villa,1,1,D,2.4,3.1,2.7,2007-10-28,2007/2008,12,E0,1-1,0,-0.30000000000000027,2007-10-28BoltonAston Villa
28/10/07,Derby,Everton,0,2,A,3.0,3.1,2.2,2007-10-28,2007/2008,12,E0,0-2,-2,0.7999999999999998,2007-10-28DerbyEverton
28/10/07,Liverpool,Arsenal,1,1,D,2.2,3.1,3.0,2007-10-28,2007/2008,12,E0,1-1,0,-0.7999999999999998,2007-10-28LiverpoolArsenal
28/10/07,Tottenham,Blackburn,1,2,A,2.0,3.2,3.3,2007-10-28,2007/2008,12,E0,1-2,-1,-1.2999999999999998,2007-10-28TottenhamBlackburn
03/11/07,Arsenal,Man United,2,2,D,2.3,3.0,2.9,2007-11-03,2007/2008,12,E0,2-2,0,-0.6000000000000001,2007-11-03ArsenalMan United
03/11/07,Aston Villa,Derby,2,0,H,1.4,4.0,6.5,2007-11-03,2007/2008,13,E0,2-0,2,-5.1,2007-11-03Aston VillaDerby
03/11/07,Blackburn,Liverpool,0,0,D,2.9,3.0,2.3,2007-11-03,2007/2008,13,E0,0-0,0,0.6000000000000001,2007-11-03BlackburnLiverpool
03/11/07,Everton,Birmingham,3,1,H,1.65,3.5,4.5,2007-11-03,2007/2008,13,E0,3-1,2,-2.85,2007-11-03EvertonBirmingham
03/11/07,Fulham,Reading,3,1,H,2.2,3.1,3.0,2007-11-03,2007/2008,13,E0,3-1,2,-0.7999999999999998,2007-11-03FulhamReading
03/11/07,Middlesbrough,Tottenham,1,1,D,2.6,3.2,2.4,2007-11-03,2007/2008,13,E0,1-1,0,0.20000000000000018,2007-11-03MiddlesbroughTottenham
03/11/07,Newcastle,Portsmouth,1,4,A,2.0,3.1,3.4,2007-11-03,2007/2008,13,E0,1-4,-3,-1.4,2007-11-03NewcastlePortsmouth
03/11/07,Wigan,Chelsea,0,2,A,6.5,3.7,1.45,2007-11-03,2007/2008,13,E0,0-2,-2,5.05,2007-11-03WiganChelsea
04/11/07,West Ham,Bolton,1,1,D,1.85,3.2,3.8,2007-11-04,2007/2008,13,E0,1-1,0,-1.9499999999999997,2007-11-04West HamBolton
05/11/07,Man City,Sunderland,1,0,H,1.5,3.6,6.0,2007-11-05,2007/2008,13,E0,1-0,1,-4.5,2007-11-05Man CitySunderland
10/11/07,Derby,West Ham,0,5,A,3.0,3.1,2.2,2007-11-10,2007/2008,14,E0,0-5,-5,0.7999999999999998,2007-11-10DerbyWest Ham
10/11/07,Liverpool,Fulham,2,0,H,1.27,4.6,9.0,2007-11-10,2007/2008,14,E0,2-0,2,-7.73,2007-11-10LiverpoolFulham
10/11/07,Sunderland,Newcastle,1,1,D,2.55,3.1,2.55,2007-11-10,2007/2008,14,E0,1-1,0,0.0,2007-11-10SunderlandNewcastle
11/11/07,Birmingham,Aston Villa,1,2,A,2.55,3.1,2.55,2007-11-11,2007/2008,14,E0,1-2,-1,0.0,2007-11-11BirminghamAston Villa
11/11/07,Bolton,Middlesbrough,0,0,D,2.2,3.1,3.0,2007-11-11,2007/2008,14,E0,0-0,0,-0.7999999999999998,2007-11-11BoltonMiddlesbrough
11/11/07,Chelsea,Everton,1,1,D,1.33,4.2,8.0,2007-11-11,2007/2008,14,E0,1-1,0,-6.67,2007-11-11ChelseaEverton
11/11/07,Man United,Blackburn,2,0,H,1.37,3.9,7.5,2007-11-11,2007/2008,14,E0,2-0,2,-6.13,2007-11-11Man UnitedBlackburn
11/11/07,Portsmouth,Man City,0,0,D,2.0,3.2,3.3,2007-11-11,2007/2008,14,E0,0-0,0,-1.2999999999999998,2007-11-11PortsmouthMan City
11/11/07,Tottenham,Wigan,4,0,H,1.5,3.8,5.5,2007-11-11,2007/2008,14,E0,4-0,4,-4.0,2007-11-11TottenhamWigan
12/11/07,Reading,Arsenal,1,3,A,5.5,3.8,1.5,2007-11-12,2007/2008,15,E0,1-3,-2,4.0,2007-11-12ReadingArsenal
24/11/07,Arsenal,Wigan,2,0,H,1.17,5.7,12.0,2007-11-24,2007/2008,15,E0,2-0,2,-10.83,2007-11-24ArsenalWigan
24/11/07,Birmingham,Portsmouth,0,2,A,2.7,3.1,2.4,2007-11-24,2007/2008,15,E0,0-2,-2,0.30000000000000027,2007-11-24BirminghamPortsmouth
24/11/07,Bolton,Man United,1,0,H,5.5,3.8,1.5,2007-11-24,2007/2008,15,E0,1-0,1,4.0,2007-11-24BoltonMan United
24/11/07,Derby,Chelsea,0,2,A,8.5,4.4,1.3,2007-11-24,2007/2008,15,E0,0-2,-2,7.2,2007-11-24DerbyChelsea
24/11/07,Everton,Sunderland,7,1,H,1.6,3.5,5.0,2007-11-24,2007/2008,15,E0,7-1,6,-3.4,2007-11-24EvertonSunderland
24/11/07,Man City,Reading,2,1,H,1.5,3.8,5.5,2007-11-24,2007/2008,15,E0,2-1,1,-4.0,2007-11-24Man CityReading
24/11/07,Middlesbrough,Aston Villa,0,3,A,2.55,3.1,2.55,2007-11-24,2007/2008,15,E0,0-3,-3,0.0,2007-11-24MiddlesbroughAston Villa
24/11/07,Newcastle,Liverpool,0,3,A,3.3,3.2,2.0,2007-11-24,2007/2008,15,E0,0-3,-3,1.2999999999999998,2007-11-24NewcastleLiverpool
25/11/07,Fulham,Blackburn,2,2,D,2.7,3.0,2.5,2007-11-25,2007/2008,16,E0,2-2,0,0.20000000000000018,2007-11-25FulhamBlackburn
25/11/07,West Ham,Tottenham,1,1,D,2.55,3.1,2.55,2007-11-25,2007/2008,16,E0,1-1,0,0.0,2007-11-25West HamTottenham
28/11/07,Blackburn,Aston Villa,0,4,A,2.1,3.1,3.2,2007-11-28,2007/2008,16,E0,0-4,-4,-1.1,2007-11-28BlackburnAston Villa
01/12/07,Aston Villa,Arsenal,1,2,A,3.6,3.2,1.9,2007-12-01,2007/2008,16,E0,1-2,-1,1.7000000000000002,2007-12-01Aston VillaArsenal
01/12/07,Blackburn,Newcastle,3,1,H,2.0,3.2,3.3,2007-12-01,2007/2008,16,E0,3-1,2,-1.2999999999999998,2007-12-01BlackburnNewcastle
01/12/07,Chelsea,West Ham,1,0,H,1.3,4.4,8.5,2007-12-01,2007/2008,16,E0,1-0,1,-7.2,2007-12-01ChelseaWest Ham
01/12/07,Portsmouth,Everton,0,0,D,2.1,3.1,3.2,2007-12-01,2007/2008,16,E0,0-0,0,-1.1,2007-12-01PortsmouthEverton
01/12/07,Reading,Middlesbrough,1,1,D,2.0,3.2,3.3,2007-12-01,2007/2008,16,E0,1-1,0,-1.2999999999999998,2007-12-01ReadingMiddlesbrough
01/12/07,Sunderland,Derby,1,0,H,1.7,3.4,4.3,2007-12-01,2007/2008,16,E0,1-0,1,-2.5999999999999996,2007-12-01SunderlandDerby
01/12/07,Wigan,Man City,1,1,D,2.8,3.1,2.3,2007-12-01,2007/2008,17,E0,1-1,0,0.5,2007-12-01WiganMan City
02/12/07,Liverpool,Bolton,4,0,H,1.3,4.4,8.5,2007-12-02,2007/2008,17,E0,4-0,4,-7.2,2007-12-02LiverpoolBolton
02/12/07,Tottenham,Birmingham,2,3,A,1.45,3.9,6.0,2007-12-02,2007/2008,17,E0,2-3,-1,-4.55,2007-12-02TottenhamBirmingham
03/12/07,Man United,Fulham,2,0,H,1.2,5.2,11.0,2007-12-03,2007/2008,17,E0,2-0,2,-9.8,2007-12-03Man UnitedFulham
05/12/07,Newcastle,Arsenal,1,1,D,4.3,3.4,1.7,2007-12-05,2007/2008,17,E0,1-1,0,2.5999999999999996,2007-12-05NewcastleArsenal
08/12/07,Aston Villa,Portsmouth,1,3,A,2.0,3.2,3.3,2007-12-08,2007/2008,17,E0,1-3,-2,-1.2999999999999998,2007-12-08Aston VillaPortsmouth
08/12/07,Chelsea,Sunderland,2,0,H,1.17,5.7,12.0,2007-12-08,2007/2008,17,E0,2-0,2,-10.83,2007-12-08ChelseaSunderland
08/12/07,Everton,Fulham,3,0,H,1.6,3.6,4.8,2007-12-08,2007/2008,17,E0,3-0,3,-3.1999999999999997,2007-12-08EvertonFulham
08/12/07,Man United,Derby,4,1,H,1.12,6.5,14.0,2007-12-08,2007/2008,17,E0,4-1,3,-12.879999999999999,2007-12-08Man UnitedDerby
08/12/07,Newcastle,Birmingham,2,1,H,1.8,3.2,4.0,2007-12-08,2007/2008,18,E0,2-1,1,-2.2,2007-12-08NewcastleBirmingham
08/12/07,Reading,Liverpool,3,1,H,4.5,3.5,1.65,2007-12-08,2007/2008,18,E0,3-1,2,2.85,2007-12-08ReadingLiverpool
09/12/07,Blackburn,West Ham,0,1,A,1.8,3.2,4.0,2007-12-09,2007/2008,18,E0,0-1,-1,-2.2,2007-12-09BlackburnWest Ham
09/12/07,Bolton,Wigan,4,1,H,1.85,3.2,3.8,2007-12-09,2007/2008,18,E0,4-1,3,-1.9499999999999997,2007-12-09BoltonWigan
09/12/07,Middlesbrough,Arsenal,2,1,H,5.0,3.7,1.55,2007-12-09,2007/2008,18,E0,2-1,1,3.45,2007-12-09MiddlesbroughArsenal
09/12/07,Tottenham,Man City,2,1,H,2.0,3.2,3.3,2007-12-09,2007/2008,18,E0,2-1,1,-1.2999999999999998,2007-12-09TottenhamMan City
15/12/07,Birmingham,Reading,1,1,D,2.0,3.2,3.3,2007-12-15,2007/2008,18,E0,1-1,0,-1.2999999999999998,2007-12-15BirminghamReading
15/12/07,Derby,Middlesbrough,0,1,A,2.7,3.2,2.3,2007-12-15,2007/2008,18,E0,0-1,-1,0.40000000000000036,2007-12-15DerbyMiddlesbrough
15/12/07,Fulham,Newcastle,0,1,A,2.4,3.1,2.7,2007-12-15,2007/2008,18,E0,0-1,-1,-0.30000000000000027,2007-12-15FulhamNewcastle
15/12/07,Man City,Bolton,4,2,H,1.8,3.2,4.0,2007-12-15,2007/2008,19,E0,4-2,2,-2.2,2007-12-15Man CityBolton
15/12/07,Portsmouth,Tottenham,0,1,A,2.2,3.1,3.0,2007-12-15,2007/2008,19,E0,0-1,-1,-0.7999999999999998,2007-12-15PortsmouthTottenham
15/12/07,Sunderland,Aston Villa,1,1,D,2.7,3.2,2.3,2007-12-15,2007/2008,19,E0,1-1,0,0.40000000000000036,2007-12-15SunderlandAston Villa
15/12/07,West Ham,Everton,0,2,A,2.4,3.1,2.7,2007-12-15,2007/2008,19,E0,0-2,-2,-0.30000000000000027,2007-12-15West HamEverton
15/12/07,Wigan,Blackburn,5,3,H,2.9,3.2,2.2,2007-12-15,2007/2008,19,E0,5-3,2,0.6999999999999997,2007-12-15WiganBlackburn
16/12/07,Arsenal,Chelsea,1,0,H,2.4,3.0,2.8,2007-12-16,2007/2008,19,E0,1-0,1,-0.3999999999999999,2007-12-16ArsenalChelsea
16/12/07,Liverpool,Man United,0,1,A,2.5,3.0,2.7,2007-12-16,2007/2008,19,E0,0-1,-1,-0.20000000000000018,2007-12-16LiverpoolMan United
22/12/07,Arsenal,Tottenham,2,1,H,1.45,3.7,6.5,2007-12-22,2007/2008,19,E0,2-1,1,-5.05,2007-12-22ArsenalTottenham
22/12/07,Aston Villa,Man City,1,1,D,2.1,3.1,3.2,2007-12-22,2007/2008,19,E0,1-1,0,-1.1,2007-12-22Aston VillaMan City
22/12/07,Bolton,Birmingham,3,0,H,1.8,3.2,4.0,2007-12-22,2007/2008,20,E0,3-0,3,-2.2,2007-12-22BoltonBirmingham
22/12/07,Fulham,Wigan,1,1,D,2.0,3.2,3.3,2007-12-22,2007/2008,20,E0,1-1,0,-1.2999999999999998,2007-12-22FulhamWigan
22/12/07,Liverpool,Portsmouth,4,1,H,1.45,3.7,6.5,2007-12-22,2007/2008,20,E0,4-1,3,-5.05,2007-12-22LiverpoolPortsmouth
22/12/07,Middlesbrough,West Ham,1,2,A,2.2,3.1,3.0,2007-12-22,2007/2008,20,E0,1-2,-1,-0.7999999999999998,2007-12-22MiddlesbroughWest Ham
22/12/07,Reading,Sunderland,2,1,H,1.8,3.2,4.0,2007-12-22,2007/2008,20,E0,2-1,1,-2.2,2007-12-22ReadingSunderland
23/12/07,Blackburn,Chelsea,0,1,A,3.8,3.2,1.85,2007-12-23,2007/2008,20,E0,0-1,-1,1.9499999999999997,2007-12-23BlackburnChelsea
23/12/07,Man United,Everton,2,1,H,1.35,4.2,7.5,2007-12-23,2007/2008,20,E0,2-1,1,-6.15,2007-12-23Man UnitedEverton
23/12/07,Newcastle,Derby,2,2,D,1.35,4.2,7.5,2007-12-23,2007/2008,20,E0,2-2,0,-6.15,2007-12-23NewcastleDerby
26/12/07,Birmingham,Middlesbrough,3,0,H,2.1,3.1,3.2,2007-12-26,2007/2008,20,E0,3-0,3,-1.1,2007-12-26BirminghamMiddlesbrough
26/12/07,Chelsea,Aston Villa,4,4,D,1.37,4.0,7.2,2007-12-26,2007/2008,21,E0,4-4,0,-5.83,2007-12-26ChelseaAston Villa
26/12/07,Derby,Liverpool,1,2,A,8.5,4.4,1.3,2007-12-26,2007/2008,21,E0,1-2,-1,7.2,2007-12-26DerbyLiverpool
26/12/07,Everton,Bolton,2,0,H,1.7,3.4,4.3,2007-12-26,2007/2008,21,E0,2-0,2,-2.5999999999999996,2007-12-26EvertonBolton
26/12/07,Portsmouth,Arsenal,0,0,D,4.2,3.3,1.75,2007-12-26,2007/2008,21,E0,0-0,0,2.45,2007-12-26PortsmouthArsenal
26/12/07,Sunderland,Man United,0,4,A,6.5,4.0,1.4,2007-12-26,2007/2008,21,E0,0-4,-4,5.1,2007-12-26SunderlandMan United
26/12/07,Tottenham,Fulham,5,1,H,1.45,3.9,6.0,2007-12-26,2007/2008,21,E0,5-1,4,-4.55,2007-12-26TottenhamFulham
26/12/07,West Ham,Reading,1,1,D,1.85,3.2,3.8,2007-12-26,2007/2008,21,E0,1-1,0,-1.9499999999999997,2007-12-26West HamReading
26/12/07,Wigan,Newcastle,1,0,H,2.5,3.1,2.6,2007-12-26,2007/2008,21,E0,1-0,1,-0.10000000000000009,2007-12-26WiganNewcastle
27/12/07,Man City,Blackburn,2,2,D,2.0,3.2,3.3,2007-12-27,2007/2008,21,E0,2-2,0,-1.2999999999999998,2007-12-27Man CityBlackburn
29/12/07,Birmingham,Fulham,1,1,D,2.0,3.2,3.3,2007-12-29,2007/2008,22,E0,1-1,0,-1.2999999999999998,2007-12-29BirminghamFulham
29/12/07,Chelsea,Newcastle,2,1,H,1.37,4.1,7.0,2007-12-29,2007/2008,22,E0,2-1,1,-5.63,2007-12-29ChelseaNewcastle
29/12/07,Everton,Arsenal,1,4,A,3.2,3.1,2.1,2007-12-29,2007/2008,22,E0,1-4,-3,1.1,2007-12-29EvertonArsenal
29/12/07,Portsmouth,Middlesbrough,0,1,A,1.7,3.4,4.3,2007-12-29,2007/2008,22,E0,0-1,-1,-2.5999999999999996,2007-12-29PortsmouthMiddlesbrough
29/12/07,Sunderland,Bolton,3,1,H,2.4,3.1,2.7,2007-12-29,2007/2008,22,E0,3-1,2,-0.30000000000000027,2007-12-29SunderlandBolton
29/12/07,Tottenham,Reading,6,4,H,1.5,3.8,5.5,2007-12-29,2007/2008,22,E0,6-4,2,-4.0,2007-12-29TottenhamReading
29/12/07,West Ham,Man United,2,1,H,5.0,3.7,1.55,2007-12-29,2007/2008,22,E0,2-1,1,3.45,2007-12-29West HamMan United
29/12/07,Wigan,Aston Villa,1,2,A,2.7,3.1,2.4,2007-12-29,2007/2008,22,E0,1-2,-1,0.30000000000000027,2007-12-29WiganAston Villa
30/12/07,Derby,Blackburn,1,2,A,3.8,3.2,1.85,2007-12-30,2007/2008,22,E0,1-2,-1,1.9499999999999997,2007-12-30DerbyBlackburn
30/12/07,Man City,Liverpool,0,0,D,3.2,3.1,2.1,2007-12-30,2007/2008,23,E0,0-0,0,1.1,2007-12-30Man CityLiverpool
01/01/08,Arsenal,West Ham,2,0,H,1.33,4.2,8.0,2008-01-01,2007/2008,23,E0,2-0,2,-6.67,2008-01-01ArsenalWest Ham
01/01/08,Aston Villa,Tottenham,2,1,H,2.3,3.1,2.8,2008-01-01,2007/2008,23,E0,2-1,1,-0.5,2008-01-01Aston VillaTottenham
01/01/08,Fulham,Chelsea,1,2,A,6.0,3.6,1.5,2008-01-01,2007/2008,23,E0,1-2,-1,4.5,2008-01-01FulhamChelsea
01/01/08,Man United,Birmingham,1,0,H,1.17,5.7,12.0,2008-01-01,2007/2008,23,E0,1-0,1,-10.83,2008-01-01Man UnitedBirmingham
01/01/08,Middlesbrough,Everton,0,2,A,2.6,3.2,2.4,2008-01-01,2007/2008,23,E0,0-2,-2,0.20000000000000018,2008-01-01MiddlesbroughEverton
01/01/08,Reading,Portsmouth,0,2,A,2.55,3.1,2.55,2008-01-01,2007/2008,23,E0,0-2,-2,0.0,2008-01-01ReadingPortsmouth
02/01/08,Blackburn,Sunderland,1,0,H,1.5,3.8,5.5,2008-01-02,2007/2008,23,E0,1-0,1,-4.0,2008-01-02BlackburnSunderland
02/01/08,Bolton,Derby,1,0,H,1.5,3.8,5.5,2008-01-02,2007/2008,23,E0,1-0,1,-4.0,2008-01-02BoltonDerby
02/01/08,Liverpool,Wigan,1,1,D,1.25,4.8,9.5,2008-01-02,2007/2008,24,E0,1-1,0,-8.25,2008-01-02LiverpoolWigan
02/01/08,Newcastle,Man City,0,2,A,2.2,3.1,3.0,2008-01-02,2007/2008,24,E0,0-2,-2,-0.7999999999999998,2008-01-02NewcastleMan City
12/01/08,Arsenal,Birmingham,1,1,D,1.17,5.7,12.0,2008-01-12,2007/2008,24,E0,1-1,0,-10.83,2008-01-12ArsenalBirmingham
12/01/08,Aston Villa,Reading,3,1,H,1.6,3.6,4.8,2008-01-12,2007/2008,24,E0,3-1,2,-3.1999999999999997,2008-01-12Aston VillaReading
12/01/08,Chelsea,Tottenham,2,0,H,1.65,3.4,4.7,2008-01-12,2007/2008,24,E0,2-0,2,-3.0500000000000003,2008-01-12ChelseaTottenham
12/01/08,Derby,Wigan,0,1,A,2.55,3.1,2.55,2008-01-12,2007/2008,24,E0,0-1,-1,0.0,2008-01-12DerbyWigan
12/01/08,Everton,Man City,1,0,H,2.1,3.1,3.2,2008-01-12,2007/2008,24,E0,1-0,1,-1.1,2008-01-12EvertonMan City
12/01/08,Man United,Newcastle,6,0,H,1.25,4.8,9.5,2008-01-12,2007/2008,24,E0,6-0,6,-8.25,2008-01-12Man UnitedNewcastle
12/01/08,Middlesbrough,Liverpool,1,1,D,4.2,3.3,1.75,2008-01-12,2007/2008,24,E0,1-1,0,2.45,2008-01-12MiddlesbroughLiverpool
12/01/08,West Ham,Fulham,2,1,H,1.75,3.3,4.2,2008-01-12,2007/2008,25,E0,2-1,1,-2.45,2008-01-12West HamFulham
13/01/08,Bolton,Blackburn,1,2,A,2.4,3.1,2.7,2008-01-13,2007/2008,25,E0,1-2,-1,-0.30000000000000027,2008-01-13BoltonBlackburn
13/01/08,Sunderland,Portsmouth,2,0,H,2.55,3.1,2.55,2008-01-13,2007/2008,25,E0,2-0,2,0.0,2008-01-13SunderlandPortsmouth
19/01/08,Birmingham,Chelsea,0,1,A,5.0,3.5,1.6,2008-01-19,2007/2008,25,E0,0-1,-1,3.4,2008-01-19BirminghamChelsea
19/01/08,Blackburn,Middlesbrough,1,1,D,1.7,3.4,4.3,2008-01-19,2007/2008,25,E0,1-1,0,-2.5999999999999996,2008-01-19BlackburnMiddlesbrough
19/01/08,Fulham,Arsenal,0,3,A,6.5,3.7,1.45,2008-01-19,2007/2008,25,E0,0-3,-3,5.05,2008-01-19FulhamArsenal
19/01/08,Newcastle,Bolton,0,0,D,1.85,3.2,3.8,2008-01-19,2007/2008,25,E0,0-0,0,-1.9499999999999997,2008-01-19NewcastleBolton
19/01/08,Portsmouth,Derby,3,1,H,1.4,3.8,7.0,2008-01-19,2007/2008,25,E0,3-1,2,-5.6,2008-01-19PortsmouthDerby
19/01/08,Reading,Man United,0,2,A,7.0,3.8,1.4,2008-01-19,2007/2008,25,E0,0-2,-2,5.6,2008-01-19ReadingMan United
19/01/08,Tottenham,Sunderland,2,0,H,1.4,3.8,7.0,2008-01-19,2007/2008,26,E0,2-0,2,-5.6,2008-01-19TottenhamSunderland
20/01/08,Man City,West Ham,1,1,D,1.85,3.2,3.8,2008-01-20,2007/2008,26,E0,1-1,0,-1.9499999999999997,2008-01-20Man CityWest Ham
20/01/08,Wigan,Everton,1,2,A,2.8,3.1,2.3,2008-01-20,2007/2008,26,E0,1-2,-1,0.5,2008-01-20WiganEverton
21/01/08,Liverpool,Aston Villa,2,2,D,1.55,3.7,5.0,2008-01-21,2007/2008,26,E0,2-2,0,-3.45,2008-01-21LiverpoolAston Villa
26/01/08,Aston Villa,Blackburn,1,1,D,1.9,3.2,3.6,2008-01-26,2007/2008,26,E0,1-1,0,-1.7000000000000002,2008-01-26Aston VillaBlackburn
29/01/08,Arsenal,Newcastle,3,0,H,1.3,4.4,8.5,2008-01-29,2007/2008,26,E0,3-0,3,-7.2,2008-01-29ArsenalNewcastle
29/01/08,Bolton,Fulham,0,0,D,1.8,3.2,4.0,2008-01-29,2007/2008,26,E0,0-0,0,-2.2,2008-01-29BoltonFulham
29/01/08,Middlesbrough,Wigan,1,0,H,1.9,3.2,3.6,2008-01-29,2007/2008,26,E0,1-0,1,-1.7000000000000002,2008-01-29MiddlesbroughWigan
29/01/08,Sunderland,Birmingham,2,0,H,2.2,3.1,3.0,2008-01-29,2007/2008,26,E0,2-0,2,-0.7999999999999998,2008-01-29SunderlandBirmingham
30/01/08,Chelsea,Reading,1,0,H,1.2,5.2,11.0,2008-01-30,2007/2008,27,E0,1-0,1,-9.8,2008-01-30ChelseaReading
30/01/08,Derby,Man City,1,1,D,4.3,3.4,1.7,2008-01-30,2007/2008,27,E0,1-1,0,2.5999999999999996,2008-01-30DerbyMan City
30/01/08,Everton,Tottenham,0,0,D,2.2,3.1,3.0,2008-01-30,2007/2008,27,E0,0-0,0,-0.7999999999999998,2008-01-30EvertonTottenham
30/01/08,Man United,Portsmouth,2,0,H,1.25,4.8,9.5,2008-01-30,2007/2008,27,E0,2-0,2,-8.25,2008-01-30Man UnitedPortsmouth
30/01/08,West Ham,Liverpool,1,0,H,3.6,3.2,1.9,2008-01-30,2007/2008,27,E0,1-0,1,1.7000000000000002,2008-01-30West HamLiverpool
02/02/08,Birmingham,Derby,1,1,D,1.6,3.6,4.8,2008-02-02,2007/2008,27,E0,1-1,0,-3.1999999999999997,2008-02-02BirminghamDerby
02/02/08,Blackburn,Everton,0,0,D,2.3,3.1,2.8,2008-02-02,2007/2008,27,E0,0-0,0,-0.5,2008-02-02BlackburnEverton
02/02/08,Liverpool,Sunderland,3,0,H,1.27,4.6,9.0,2008-02-02,2007/2008,27,E0,3-0,3,-7.73,2008-02-02LiverpoolSunderland
02/02/08,Man City,Arsenal,1,3,A,4.0,3.2,1.8,2008-02-02,2007/2008,27,E0,1-3,-2,2.2,2008-02-02Man CityArsenal
02/02/08,Portsmouth,Chelsea,1,1,D,4.2,3.3,1.75,2008-02-02,2007/2008,28,E0,1-1,0,2.45,2008-02-02PortsmouthChelsea
02/02/08,Reading,Bolton,0,2,A,2.1,3.1,3.2,2008-02-02,2007/2008,28,E0,0-2,-2,-1.1,2008-02-02ReadingBolton
02/02/08,Tottenham,Man United,1,1,D,4.0,3.2,1.8,2008-02-02,2007/2008,28,E0,1-1,0,2.2,2008-02-02TottenhamMan United
02/02/08,Wigan,West Ham,1,0,H,2.6,3.1,2.5,2008-02-02,2007/2008,28,E0,1-0,1,0.10000000000000009,2008-02-02WiganWest Ham
03/02/08,Fulham,Aston Villa,2,1,H,2.8,3.1,2.3,2008-02-03,2007/2008,28,E0,2-1,1,0.5,2008-02-03FulhamAston Villa
03/02/08,Newcastle,Middlesbrough,1,1,D,1.9,3.2,3.6,2008-02-03,2007/2008,28,E0,1-1,0,-1.7000000000000002,2008-02-03NewcastleMiddlesbrough
09/02/08,Aston Villa,Newcastle,4,1,H,1.85,3.2,3.8,2008-02-09,2007/2008,28,E0,4-1,3,-1.9499999999999997,2008-02-09Aston VillaNewcastle
09/02/08,Bolton,Portsmouth,0,1,A,2.3,3.1,2.8,2008-02-09,2007/2008,28,E0,0-1,-1,-0.5,2008-02-09BoltonPortsmouth
09/02/08,Derby,Tottenham,0,3,A,5.0,3.5,1.6,2008-02-09,2007/2008,28,E0,0-3,-3,3.4,2008-02-09DerbyTottenham
09/02/08,Everton,Reading,1,0,H,1.55,3.5,5.5,2008-02-09,2007/2008,29,E0,1-0,1,-3.95,2008-02-09EvertonReading
09/02/08,Middlesbrough,Fulham,1,0,H,1.85,3.2,3.8,2008-02-09,2007/2008,29,E0,1-0,1,-1.9499999999999997,2008-02-09MiddlesbroughFulham
09/02/08,Sunderland,Wigan,2,0,H,2.0,3.2,3.3,2008-02-09,2007/2008,29,E0,2-0,2,-1.2999999999999998,2008-02-09SunderlandWigan
09/02/08,West Ham,Birmingham,1,1,D,1.75,3.3,4.2,2008-02-09,2007/2008,29,E0,1-1,0,-2.45,2008-02-09West HamBirmingham
10/02/08,Chelsea,Liverpool,0,0,D,1.9,3.1,3.8,2008-02-10,2007/2008,29,E0,0-0,0,-1.9,2008-02-10ChelseaLiverpool
10/02/08,Man United,Man City,1,2,A,1.33,4.2,8.0,2008-02-10,2007/2008,29,E0,1-2,-1,-6.67,2008-02-10Man UnitedMan City
11/02/08,Arsenal,Blackburn,2,0,H,1.37,3.9,7.5,2008-02-11,2007/2008,29,E0,2-0,2,-6.13,2008-02-11ArsenalBlackburn
23/02/08,Birmingham,Arsenal,2,2,D,5.5,3.8,1.5,2008-02-23,2007/2008,29,E0,2-2,0,4.0,2008-02-23BirminghamArsenal
23/02/08,Fulham,West Ham,0,1,A,2.55,3.1,2.55,2008-02-23,2007/2008,29,E0,0-1,-1,0.0,2008-02-23FulhamWest Ham
23/02/08,Liverpool,Middlesbrough,3,2,H,1.4,3.8,7.0,2008-02-23,2007/2008,30,E0,3-2,1,-5.6,2008-02-23LiverpoolMiddlesbrough
23/02/08,Newcastle,Man United,1,5,A,5.5,3.8,1.5,2008-02-23,2007/2008,30,E0,1-5,-4,4.0,2008-02-23NewcastleMan United
23/02/08,Portsmouth,Sunderland,1,0,H,1.55,3.5,5.5,2008-02-23,2007/2008,30,E0,1-0,1,-3.95,2008-02-23PortsmouthSunderland
23/02/08,Wigan,Derby,2,0,H,1.55,3.5,5.5,2008-02-23,2007/2008,30,E0,2-0,2,-3.95,2008-02-23WiganDerby
24/02/08,Blackburn,Bolton,4,1,H,1.85,3.2,3.8,2008-02-24,2007/2008,30,E0,4-1,3,-1.9499999999999997,2008-02-24BlackburnBolton
24/02/08,Reading,Aston Villa,1,2,A,2.7,3.1,2.4,2008-02-24,2007/2008,30,E0,1-2,-1,0.30000000000000027,2008-02-24ReadingAston Villa
25/02/08,Man City,Everton,0,2,A,2.25,3.1,2.9,2008-02-25,2007/2008,30,E0,0-2,-2,-0.6499999999999999,2008-02-25Man CityEverton
01/03/08,Arsenal,Aston Villa,1,1,D,1.5,3.6,6.0,2008-03-01,2007/2008,30,E0,1-1,0,-4.5,2008-03-01ArsenalAston Villa
01/03/08,Birmingham,Tottenham,4,1,H,3.2,3.1,2.1,2008-03-01,2007/2008,30,E0,4-1,3,1.1,2008-03-01BirminghamTottenham
01/03/08,Derby,Sunderland,0,0,D,2.8,3.1,2.3,2008-03-01,2007/2008,31,E0,0-0,0,0.5,2008-03-01DerbySunderland
01/03/08,Fulham,Man United,0,3,A,7.5,4.2,1.35,2008-03-01,2007/2008,31,E0,0-3,-3,6.15,2008-03-01FulhamMan United
01/03/08,Man City,Wigan,0,0,D,1.7,3.4,4.3,2008-03-01,2007/2008,31,E0,0-0,0,-2.5999999999999996,2008-03-01Man CityWigan
01/03/08,Middlesbrough,Reading,0,1,A,1.8,3.2,4.0,2008-03-01,2007/2008,31,E0,0-1,-1,-2.2,2008-03-01MiddlesbroughReading
01/03/08,Newcastle,Blackburn,0,1,A,2.5,3.1,2.6,2008-03-01,2007/2008,31,E0,0-1,-1,-0.10000000000000009,2008-03-01NewcastleBlackburn
01/03/08,West Ham,Chelsea,0,4,A,4.0,3.2,1.8,2008-03-01,2007/2008,31,E0,0-4,-4,2.2,2008-03-01West HamChelsea
02/03/08,Bolton,Liverpool,1,3,A,4.0,3.2,1.8,2008-03-02,2007/2008,31,E0,1-3,-2,2.2,2008-03-02BoltonLiverpool
02/03/08,Everton,Portsmouth,3,1,H,1.85,3.2,3.8,2008-03-02,2007/2008,31,E0,3-1,2,-1.9499999999999997,2008-03-02EvertonPortsmouth
05/03/08,Liverpool,West Ham,4,0,H,1.4,3.8,7.0,2008-03-05,2007/2008,31,E0,4-0,4,-5.6,2008-03-05LiverpoolWest Ham
08/03/08,Blackburn,Fulham,1,1,D,1.45,3.7,6.5,2008-03-08,2007/2008,32,E0,1-1,0,-5.05,2008-03-08BlackburnFulham
08/03/08,Liverpool,Newcastle,3,0,H,1.4,3.8,7.0,2008-03-08,2007/2008,32,E0,3-0,3,-5.6,2008-03-08LiverpoolNewcastle
08/03/08,Reading,Man City,2,0,H,2.5,3.1,2.6,2008-03-08,2007/2008,32,E0,2-0,2,-0.10000000000000009,2008-03-08ReadingMan City
09/03/08,Sunderland,Everton,0,1,A,3.0,3.0,2.25,2008-03-09,2007/2008,32,E0,0-1,-1,0.75,2008-03-09SunderlandEverton
09/03/08,Tottenham,West Ham,4,0,H,1.85,3.2,3.8,2008-03-09,2007/2008,32,E0,4-0,4,-1.9499999999999997,2008-03-09TottenhamWest Ham
09/03/08,Wigan,Arsenal,0,0,D,5.5,3.5,1.55,2008-03-09,2007/2008,32,E0,0-0,0,3.95,2008-03-09WiganArsenal
12/03/08,Aston Villa,Middlesbrough,1,1,D,1.65,3.5,4.5,2008-03-12,2007/2008,32,E0,1-1,0,-2.85,2008-03-12Aston VillaMiddlesbrough
12/03/08,Chelsea,Derby,6,1,H,1.12,6.5,14.0,2008-03-12,2007/2008,32,E0,6-1,5,-12.879999999999999,2008-03-12ChelseaDerby
12/03/08,Portsmouth,Birmingham,4,2,H,1.7,3.4,4.3,2008-03-12,2007/2008,32,E0,4-2,2,-2.5999999999999996,2008-03-12PortsmouthBirmingham
15/03/08,Arsenal,Middlesbrough,1,1,D,1.27,4.6,9.0,2008-03-15,2007/2008,33,E0,1-1,0,-7.73,2008-03-15ArsenalMiddlesbrough
15/03/08,Derby,Man United,0,1,A,11.0,5.2,1.2,2008-03-15,2007/2008,33,E0,0-1,-1,9.8,2008-03-15DerbyMan United
15/03/08,Liverpool,Reading,2,1,H,1.27,4.6,9.0,2008-03-15,2007/2008,33,E0,2-1,1,-7.73,2008-03-15LiverpoolReading
15/03/08,Portsmouth,Aston Villa,2,0,H,2.4,3.1,2.7,2008-03-15,2007/2008,33,E0,2-0,2,-0.30000000000000027,2008-03-15PortsmouthAston Villa
15/03/08,Sunderland,Chelsea,0,1,A,6.0,3.6,1.5,2008-03-15,2007/2008,33,E0,0-1,-1,4.5,2008-03-15SunderlandChelsea
15/03/08,West Ham,Blackburn,2,1,H,2.4,3.2,2.6,2008-03-15,2007/2008,33,E0,2-1,1,-0.20000000000000018,2008-03-15West HamBlackburn
16/03/08,Fulham,Everton,1,0,H,3.2,3.1,2.1,2008-03-16,2007/2008,33,E0,1-0,1,1.1,2008-03-16FulhamEverton
16/03/08,Man City,Tottenham,2,1,H,2.4,3.1,2.7,2008-03-16,2007/2008,33,E0,2-1,1,-0.30000000000000027,2008-03-16Man CityTottenham
16/03/08,Wigan,Bolton,1,0,H,2.2,3.1,3.0,2008-03-16,2007/2008,33,E0,1-0,1,-0.7999999999999998,2008-03-16WiganBolton
17/03/08,Birmingham,Newcastle,1,1,D,2.2,3.1,3.0,2008-03-17,2007/2008,34,E0,1-1,0,-0.7999999999999998,2008-03-17BirminghamNewcastle
19/03/08,Man United,Bolton,2,0,H,1.2,5.2,11.0,2008-03-19,2007/2008,34,E0,2-0,2,-9.8,2008-03-19Man UnitedBolton
19/03/08,Tottenham,Chelsea,4,4,D,3.2,3.1,2.1,2008-03-19,2007/2008,34,E0,4-4,0,1.1,2008-03-19TottenhamChelsea
22/03/08,Aston Villa,Sunderland,0,1,A,1.55,3.7,5.0,2008-03-22,2007/2008,34,E0,0-1,-1,-3.45,2008-03-22Aston VillaSunderland
22/03/08,Blackburn,Wigan,3,1,H,1.75,3.3,4.2,2008-03-22,2007/2008,34,E0,3-1,2,-2.45,2008-03-22BlackburnWigan
22/03/08,Bolton,Man City,0,0,D,2.3,3.1,2.8,2008-03-22,2007/2008,34,E0,0-0,0,-0.5,2008-03-22BoltonMan City
22/03/08,Everton,West Ham,1,1,D,1.65,3.5,4.5,2008-03-22,2007/2008,34,E0,1-1,0,-2.85,2008-03-22EvertonWest Ham
22/03/08,Middlesbrough,Derby,1,0,H,1.45,3.9,6.0,2008-03-22,2007/2008,34,E0,1-0,1,-4.55,2008-03-22MiddlesbroughDerby
22/03/08,Newcastle,Fulham,2,0,H,1.85,3.2,3.8,2008-03-22,2007/2008,34,E0,2-0,2,-1.9499999999999997,2008-03-22NewcastleFulham
22/03/08,Reading,Birmingham,2,1,H,2.1,3.1,3.2,2008-03-22,2007/2008,35,E0,2-1,1,-1.1,2008-03-22ReadingBirmingham
22/03/08,Tottenham,Portsmouth,2,0,H,1.85,3.2,3.8,2008-03-22,2007/2008,35,E0,2-0,2,-1.9499999999999997,2008-03-22TottenhamPortsmouth
23/03/08,Chelsea,Arsenal,2,1,H,2.1,3.0,3.3,2008-03-23,2007/2008,35,E0,2-1,1,-1.1999999999999997,2008-03-23ChelseaArsenal
23/03/08,Man United,Liverpool,3,0,H,1.85,3.2,3.8,2008-03-23,2007/2008,35,E0,3-0,3,-1.9499999999999997,2008-03-23Man UnitedLiverpool
29/03/08,Birmingham,Man City,3,1,H,2.3,3.1,2.8,2008-03-29,2007/2008,35,E0,3-1,2,-0.5,2008-03-29BirminghamMan City
29/03/08,Bolton,Arsenal,2,3,A,4.2,3.3,1.75,2008-03-29,2007/2008,35,E0,2-3,-1,2.45,2008-03-29BoltonArsenal
29/03/08,Derby,Fulham,2,2,D,2.55,3.1,2.55,2008-03-29,2007/2008,35,E0,2-2,0,0.0,2008-03-29DerbyFulham
29/03/08,Man United,Aston Villa,4,0,H,1.33,4.2,8.0,2008-03-29,2007/2008,35,E0,4-0,4,-6.67,2008-03-29Man UnitedAston Villa
29/03/08,Portsmouth,Wigan,2,0,H,1.75,3.3,4.2,2008-03-29,2007/2008,35,E0,2-0,2,-2.45,2008-03-29PortsmouthWigan
29/03/08,Reading,Blackburn,0,0,D,2.3,3.1,2.8,2008-03-29,2007/2008,36,E0,0-0,0,-0.5,2008-03-29ReadingBlackburn
29/03/08,Sunderland,West Ham,2,1,H,2.3,3.1,2.8,2008-03-29,2007/2008,36,E0,2-1,1,-0.5,2008-03-29SunderlandWest Ham
30/03/08,Chelsea,Middlesbrough,1,0,H,1.33,4.2,8.0,2008-03-30,2007/2008,36,E0,1-0,1,-6.67,2008-03-30ChelseaMiddlesbrough
30/03/08,Liverpool,Everton,1,0,H,1.75,3.3,4.2,2008-03-30,2007/2008,36,E0,1-0,1,-2.45,2008-03-30LiverpoolEverton
30/03/08,Tottenham,Newcastle,1,4,A,1.6,3.5,5.0,2008-03-30,2007/2008,36,E0,1-4,-3,-3.4,2008-03-30TottenhamNewcastle
05/04/08,Arsenal,Liverpool,1,1,D,2.1,3.1,3.2,2008-04-05,2007/2008,36,E0,1-1,0,-1.1,2008-04-05ArsenalLiverpool
05/04/08,Aston Villa,Bolton,4,0,H,1.7,3.4,4.3,2008-04-05,2007/2008,36,E0,4-0,4,-2.5999999999999996,2008-04-05Aston VillaBolton
05/04/08,Blackburn,Tottenham,1,1,D,2.2,3.1,3.0,2008-04-05,2007/2008,36,E0,1-1,0,-0.7999999999999998,2008-04-05BlackburnTottenham
05/04/08,Fulham,Sunderland,1,3,A,2.2,3.1,3.0,2008-04-05,2007/2008,36,E0,1-3,-2,-0.7999999999999998,2008-04-05FulhamSunderland
05/04/08,Man City,Chelsea,0,2,A,4.2,3.3,1.75,2008-04-05,2007/2008,37,E0,0-2,-2,2.45,2008-04-05Man CityChelsea
05/04/08,Newcastle,Reading,3,0,H,1.8,3.2,4.0,2008-04-05,2007/2008,37,E0,3-0,3,-2.2,2008-04-05NewcastleReading
05/04/08,Wigan,Birmingham,2,0,H,2.1,3.0,3.3,2008-04-05,2007/2008,37,E0,2-0,2,-1.1999999999999997,2008-04-05WiganBirmingham
06/04/08,Everton,Derby,1,0,H,1.27,4.6,9.0,2008-04-06,2007/2008,37,E0,1-0,1,-7.73,2008-04-06EvertonDerby
06/04/08,Middlesbrough,Man United,2,2,D,6.5,3.7,1.45,2008-04-06,2007/2008,37,E0,2-2,0,5.05,2008-04-06MiddlesbroughMan United
08/04/08,West Ham,Portsmouth,0,1,A,2.2,3.1,3.0,2008-04-08,2007/2008,37,E0,0-1,-1,-0.7999999999999998,2008-04-08West HamPortsmouth
12/04/08,Birmingham,Everton,1,1,D,2.65,3.1,2.45,2008-04-12,2007/2008,37,E0,1-1,0,0.19999999999999973,2008-04-12BirminghamEverton
12/04/08,Bolton,West Ham,1,0,H,2.1,3.1,3.2,2008-04-12,2007/2008,37,E0,1-0,1,-1.1,2008-04-12BoltonWest Ham
12/04/08,Derby,Aston Villa,0,6,A,4.5,3.5,1.65,2008-04-12,2007/2008,37,E0,0-6,-6,2.85,2008-04-12DerbyAston Villa
12/04/08,Portsmouth,Newcastle,0,0,D,1.9,3.2,3.6,2008-04-12,2007/2008,38,E0,0-0,0,-1.7000000000000002,2008-04-12PortsmouthNewcastle
12/04/08,Reading,Fulham,0,2,A,1.85,3.2,3.8,2008-04-12,2007/2008,38,E0,0-2,-2,-1.9499999999999997,2008-04-12ReadingFulham
12/04/08,Sunderland,Man City,1,2,A,2.3,3.1,2.8,2008-04-12,2007/2008,38,E0,1-2,-1,-0.5,2008-04-12SunderlandMan City
12/04/08,Tottenham,Middlesbrough,1,1,D,1.75,3.3,4.2,2008-04-12,2007/2008,38,E0,1-1,0,-2.45,2008-04-12TottenhamMiddlesbrough
13/04/08,Liverpool,Blackburn,3,1,H,1.5,3.6,6.0,2008-04-13,2007/2008,38,E0,3-1,2,-4.5,2008-04-13LiverpoolBlackburn
13/04/08,Man United,Arsenal,2,1,H,1.85,3.2,3.8,2008-04-13,2007/2008,38,E0,2-1,1,-1.9499999999999997,2008-04-13Man UnitedArsenal
14/04/08,Chelsea,Wigan,1,1,D,1.22,5.0,10.0,2008-04-14,2007/2008,38,E0,1-1,0,-8.78,2008-04-14ChelseaWigan
17/04/08,Everton,Chelsea,0,1,A,3.3,3.1,2.05,2008-04-17,2007/2008,38,E0,0-1,-1,1.25,2008-04-17EvertonChelsea
19/04/08,Arsenal,Reading,2,0,H,1.25,4.8,9.5,2008-04-19,2007/2008,38,E0,2-0,2,-8.25,2008-04-19ArsenalReading
19/04/08,Blackburn,Man United,1,1,D,4.7,3.4,1.65,2008-04-19,2007/2008,39,E0,1-1,0,3.0500000000000003,2008-04-19BlackburnMan United
19/04/08,Fulham,Liverpool,0,2,A,3.3,3.2,2.0,2008-04-19,2007/2008,39,E0,0-2,-2,1.2999999999999998,2008-04-19FulhamLiverpool
19/04/08,Middlesbrough,Bolton,0,1,A,2.1,3.2,3.1,2008-04-19,2007/2008,39,E0,0-1,-1,-1.0,2008-04-19MiddlesbroughBolton
19/04/08,West Ham,Derby,2,1,H,1.35,4.2,7.5,2008-04-19,2007/2008,39,E0,2-1,1,-6.15,2008-04-19West HamDerby
19/04/08,Wigan,Tottenham,1,1,D,2.5,3.0,2.7,2008-04-19,2007/2008,39,E0,1-1,0,-0.20000000000000018,2008-04-19WiganTottenham
20/04/08,Aston Villa,Birmingham,5,1,H,1.75,3.3,4.2,2008-04-20,2007/2008,39,E0,5-1,4,-2.45,2008-04-20Aston VillaBirmingham
20/04/08,Man City,Portsmouth,3,1,H,2.2,3.1,3.0,2008-04-20,2007/2008,39,E0,3-1,2,-0.7999999999999998,2008-04-20Man CityPortsmouth
20/04/08,Newcastle,Sunderland,2,0,H,1.8,3.1,4.2,2008-04-20,2007/2008,39,E0,2-0,2,-2.4000000000000004,2008-04-20NewcastleSunderland
26/04/08,Birmingham,Liverpool,2,2,D,2.5,3.2,2.5,2008-04-26,2007/2008,39,E0,2-2,0,0.0,2008-04-26BirminghamLiverpool
26/04/08,Chelsea,Man United,2,1,H,2.3,3.0,2.9,2008-04-26,2007/2008,40,E0,2-1,1,-0.6000000000000001,2008-04-26ChelseaMan United
26/04/08,Man City,Fulham,2,3,A,1.75,3.3,4.2,2008-04-26,2007/2008,40,E0,2-3,-1,-2.45,2008-04-26Man CityFulham
26/04/08,Sunderland,Middlesbrough,3,2,H,2.2,2.6,3.6,2008-04-26,2007/2008,40,E0,3-2,1,-1.4,2008-04-26SunderlandMiddlesbrough
26/04/08,Tottenham,Bolton,1,1,D,1.9,3.2,3.6,2008-04-26,2007/2008,40,E0,1-1,0,-1.7000000000000002,2008-04-26TottenhamBolton
26/04/08,West Ham,Newcastle,2,2,D,2.4,3.2,2.6,2008-04-26,2007/2008,40,E0,2-2,0,-0.20000000000000018,2008-04-26West HamNewcastle
26/04/08,Wigan,Reading,0,0,D,2.0,3.2,3.3,2008-04-26,2007/2008,40,E0,0-0,0,-1.2999999999999998,2008-04-26WiganReading
27/04/08,Everton,Aston Villa,2,2,D,2.0,3.2,3.3,2008-04-27,2007/2008,40,E0,2-2,0,-1.2999999999999998,2008-04-27EvertonAston Villa
27/04/08,Portsmouth,Blackburn,0,1,A,2.1,3.1,3.2,2008-04-27,2007/2008,40,E0,0-1,-1,-1.1,2008-04-27PortsmouthBlackburn
28/04/08,Derby,Arsenal,2,6,A,9.5,4.8,1.25,2008-04-28,2007/2008,40,E0,2-6,-4,8.25,2008-04-28DerbyArsenal
03/05/08,Aston Villa,Wigan,0,2,A,1.55,3.5,4.8,2008-05-03,2007/2008,41,E0,0-2,-2,-3.25,2008-05-03Aston VillaWigan
03/05/08,Blackburn,Derby,3,1,H,1.25,4.8,9.5,2008-05-03,2007/2008,41,E0,3-1,2,-8.25,2008-05-03BlackburnDerby
03/05/08,Bolton,Sunderland,2,0,H,1.4,3.9,6.0,2008-05-03,2007/2008,41,E0,2-0,2,-4.6,2008-05-03BoltonSunderland
03/05/08,Fulham,Birmingham,2,0,H,2.2,3.2,2.9,2008-05-03,2007/2008,41,E0,2-0,2,-0.6999999999999997,2008-05-03FulhamBirmingham
03/05/08,Man United,West Ham,4,1,H,1.15,6.0,13.0,2008-05-03,2007/2008,41,E0,4-1,3,-11.85,2008-05-03Man UnitedWest Ham
03/05/08,Middlesbrough,Portsmouth,2,0,H,1.8,3.2,4.0,2008-05-03,2007/2008,41,E0,2-0,2,-2.2,2008-05-03MiddlesbroughPortsmouth
03/05/08,Reading,Tottenham,0,1,A,1.9,3.1,3.5,2008-05-03,2007/2008,41,E0,0-1,-1,-1.6,2008-05-03ReadingTottenham
04/05/08,Arsenal,Everton,1,0,H,1.6,3.5,5.0,2008-05-04,2007/2008,41,E0,1-0,1,-3.4,2008-05-04ArsenalEverton
04/05/08,Liverpool,Man City,1,0,H,1.7,3.4,4.3,2008-05-04,2007/2008,41,E0,1-0,1,-2.5999999999999996,2008-05-04LiverpoolMan City
05/05/08,Newcastle,Chelsea,0,2,A,5.0,3.7,1.55,2008-05-05,2007/2008,42,E0,0-2,-2,3.45,2008-05-05NewcastleChelsea
11/05/08,Birmingham,Blackburn,4,1,H,2.0,3.2,3.3,2008-05-11,2007/2008,42,E0,4-1,3,-1.2999999999999998,2008-05-11BirminghamBlackburn
11/05/08,Chelsea,Bolton,1,1,D,1.15,5.0,13.0,2008-05-11,2007/2008,42,E0,1-1,0,-11.85,2008-05-11ChelseaBolton
11/05/08,Derby,Reading,0,4,A,4.2,3.6,1.6,2008-05-11,2007/2008,42,E0,0-4,-4,2.6,2008-05-11DerbyReading
11/05/08,Everton,Newcastle,3,1,H,1.85,2.5,4.8,2008-05-11,2007/2008,42,E0,3-1,2,-2.9499999999999997,2008-05-11EvertonNewcastle
11/05/08,Middlesbrough,Man City,8,1,H,2.1,3.1,3.2,2008-05-11,2007/2008,42,E0,8-1,7,-1.1,2008-05-11MiddlesbroughMan City
11/05/08,Portsmouth,Fulham,0,1,A,3.4,3.4,1.9,2008-05-11,2007/2008,42,E0,0-1,-1,1.5,2008-05-11PortsmouthFulham
11/05/08,Sunderland,Arsenal,0,1,A,3.6,3.2,1.9,2008-05-11,2007/2008,42,E0,0-1,-1,1.7000000000000002,2008-05-11SunderlandArsenal
11/05/08,Tottenham,Liverpool,0,2,A,2.4,3.1,2.7,2008-05-11,2007/2008,42,E0,0-2,-2,-0.30000000000000027,2008-05-11TottenhamLiverpool
