Date,HomeTeam,AwayTeam,FTHG,FTAG,FTR,IWH,IWD,IWA,datetime,season,game_day,league,result,goal_diff,odds_diff,game_id
22/08/15,Lazio,Bologna,2.0,1.0,H,1.5,4.0,6.1,2015-08-22,2015/2016,1,I1,2-1,1.0,-4.6,2015-08-22LazioBologna
22/08/15,Verona,Roma,1.0,1.0,D,4.5,3.5,1.75,2015-08-22,2015/2016,1,I1,1-1,0.0,2.75,2015-08-22VeronaRoma
23/08/15,Empoli,Chievo,1.0,3.0,A,2.3,3.2,3.0,2015-08-23,2015/2016,1,I1,1-3,-2.0,-0.7000000000000002,2015-08-23EmpoliChievo
23/08/15,Fiorentina,Milan,2.0,0.0,H,2.3,3.3,2.9,2015-08-23,2015/2016,1,I1,2-0,2.0,-0.6000000000000001,2015-08-23FiorentinaMilan
23/08/15,Frosinone,Torino,1.0,2.0,A,2.9,3.3,2.3,2015-08-23,2015/2016,1,I1,1-2,-1.0,0.6000000000000001,2015-08-23FrosinoneTorino
23/08/15,Inter,Atalanta,1.0,0.0,H,1.5,4.0,6.1,2015-08-23,2015/2016,1,I1,1-0,1.0,-4.6,2015-08-23InterAtalanta
23/08/15,Juventus,Udinese,0.0,1.0,A,1.3,5.0,9.0,2015-08-23,2015/2016,1,I1,0-1,-1.0,-7.7,2015-08-23JuventusUdinese
23/08/15,Palermo,Genoa,1.0,0.0,H,2.3,3.3,2.9,2015-08-23,2015/2016,1,I1,1-0,1.0,-0.6000000000000001,2015-08-23PalermoGenoa
23/08/15,Sampdoria,Carpi,5.0,2.0,H,1.8,3.5,4.2,2015-08-23,2015/2016,1,I1,5-2,3.0,-2.4000000000000004,2015-08-23SampdoriaCarpi
23/08/15,Sassuolo,Napoli,2.0,1.0,H,4.0,3.45,1.85,2015-08-23,2015/2016,2,I1,2-1,1.0,2.15,2015-08-23SassuoloNapoli
29/08/15,Bologna,Sassuolo,0.0,1.0,A,2.3,3.2,3.0,2015-08-29,2015/2016,2,I1,0-1,-1.0,-0.7000000000000002,2015-08-29BolognaSassuolo
29/08/15,Milan,Empoli,2.0,1.0,H,1.45,4.0,7.0,2015-08-29,2015/2016,2,I1,2-1,1.0,-5.55,2015-08-29MilanEmpoli
30/08/15,Atalanta,Frosinone,2.0,0.0,H,1.8,3.5,4.2,2015-08-30,2015/2016,2,I1,2-0,2.0,-2.4000000000000004,2015-08-30AtalantaFrosinone
30/08/15,Carpi,Inter,1.0,2.0,A,4.5,3.5,1.75,2015-08-30,2015/2016,2,I1,1-2,-1.0,2.75,2015-08-30CarpiInter
30/08/15,Chievo,Lazio,4.0,0.0,H,3.1,3.2,2.25,2015-08-30,2015/2016,2,I1,4-0,4.0,0.8500000000000001,2015-08-30ChievoLazio
30/08/15,Genoa,Verona,2.0,0.0,H,2.0,3.3,3.6,2015-08-30,2015/2016,2,I1,2-0,2.0,-1.6,2015-08-30GenoaVerona
30/08/15,Napoli,Sampdoria,2.0,2.0,D,1.55,3.9,5.6,2015-08-30,2015/2016,2,I1,2-2,0.0,-4.05,2015-08-30NapoliSampdoria
30/08/15,Roma,Juventus,2.0,1.0,H,2.6,3.2,2.6,2015-08-30,2015/2016,2,I1,2-1,1.0,0.0,2015-08-30RomaJuventus
30/08/15,Torino,Fiorentina,3.0,1.0,H,2.6,3.2,2.6,2015-08-30,2015/2016,3,I1,3-1,2.0,0.0,2015-08-30TorinoFiorentina
30/08/15,Udinese,Palermo,0.0,1.0,A,2.1,3.3,3.3,2015-08-30,2015/2016,3,I1,0-1,-1.0,-1.1999999999999997,2015-08-30UdinesePalermo
12/09/15,Fiorentina,Genoa,1.0,0.0,H,1.65,3.6,5.1,2015-09-12,2015/2016,3,I1,1-0,1.0,-3.4499999999999997,2015-09-12FiorentinaGenoa
12/09/15,Frosinone,Roma,0.0,2.0,A,7.0,4.0,1.45,2015-09-12,2015/2016,3,I1,0-2,-2.0,5.55,2015-09-12FrosinoneRoma
12/09/15,Juventus,Chievo,1.0,1.0,D,1.4,4.4,7.3,2015-09-12,2015/2016,3,I1,1-1,0.0,-5.9,2015-09-12JuventusChievo
13/09/15,Empoli,Napoli,2.0,2.0,D,4.2,3.5,1.8,2015-09-13,2015/2016,3,I1,2-2,0.0,2.4000000000000004,2015-09-13EmpoliNapoli
13/09/15,Inter,Milan,1.0,0.0,H,2.5,3.3,2.65,2015-09-13,2015/2016,3,I1,1-0,1.0,-0.1499999999999999,2015-09-13InterMilan
13/09/15,Lazio,Udinese,2.0,0.0,H,1.65,3.6,5.1,2015-09-13,2015/2016,3,I1,2-0,2.0,-3.4499999999999997,2015-09-13LazioUdinese
13/09/15,Palermo,Carpi,2.0,2.0,D,1.5,4.0,6.1,2015-09-13,2015/2016,3,I1,2-2,0.0,-4.6,2015-09-13PalermoCarpi
13/09/15,Sassuolo,Atalanta,2.0,2.0,D,2.2,3.2,3.2,2015-09-13,2015/2016,4,I1,2-2,0.0,-1.0,2015-09-13SassuoloAtalanta
13/09/15,Verona,Torino,2.0,2.0,D,2.75,3.3,2.4,2015-09-13,2015/2016,4,I1,2-2,0.0,0.3500000000000001,2015-09-13VeronaTorino
14/09/15,Sampdoria,Bologna,2.0,0.0,H,1.8,3.5,4.2,2015-09-14,2015/2016,4,I1,2-0,2.0,-2.4000000000000004,2015-09-14SampdoriaBologna
19/09/15,Milan,Palermo,3.0,2.0,H,1.75,3.5,4.5,2015-09-19,2015/2016,4,I1,3-2,1.0,-2.75,2015-09-19MilanPalermo
19/09/15,Udinese,Empoli,1.0,2.0,A,2.1,3.3,3.3,2015-09-19,2015/2016,4,I1,1-2,-1.0,-1.1999999999999997,2015-09-19UdineseEmpoli
20/09/15,Atalanta,Verona,1.0,1.0,D,1.9,3.45,3.8,2015-09-20,2015/2016,4,I1,1-1,0.0,-1.9,2015-09-20AtalantaVerona
20/09/15,Bologna,Frosinone,1.0,0.0,H,1.85,3.45,4.0,2015-09-20,2015/2016,4,I1,1-0,1.0,-2.15,2015-09-20BolognaFrosinone
20/09/15,Carpi,Fiorentina,0.0,1.0,A,4.0,3.45,1.85,2015-09-20,2015/2016,4,I1,0-1,-1.0,2.15,2015-09-20CarpiFiorentina
20/09/15,Chievo,Inter,0.0,1.0,A,3.2,3.2,2.2,2015-09-20,2015/2016,4,I1,0-1,-1.0,1.0,2015-09-20ChievoInter
20/09/15,Genoa,Juventus,0.0,2.0,A,4.2,3.5,1.8,2015-09-20,2015/2016,5,I1,0-2,-2.0,2.4000000000000004,2015-09-20GenoaJuventus
20/09/15,Napoli,Lazio,5.0,0.0,H,1.85,3.45,4.0,2015-09-20,2015/2016,5,I1,5-0,5.0,-2.15,2015-09-20NapoliLazio
20/09/15,Roma,Sassuolo,2.0,2.0,D,1.4,4.4,7.3,2015-09-20,2015/2016,5,I1,2-2,0.0,-5.9,2015-09-20RomaSassuolo
20/09/15,Torino,Sampdoria,2.0,0.0,H,1.85,3.45,4.0,2015-09-20,2015/2016,5,I1,2-0,2.0,-2.15,2015-09-20TorinoSampdoria
22/09/15,Udinese,Milan,2.0,3.0,A,2.9,3.3,2.3,2015-09-22,2015/2016,5,I1,2-3,-1.0,0.6000000000000001,2015-09-22UdineseMilan
23/09/15,Carpi,Napoli,0.0,0.0,D,5.6,3.9,1.55,2015-09-23,2015/2016,5,I1,0-0,0.0,4.05,2015-09-23CarpiNapoli
23/09/15,Chievo,Torino,1.0,0.0,H,2.75,3.2,2.5,2015-09-23,2015/2016,5,I1,1-0,1.0,0.25,2015-09-23ChievoTorino
23/09/15,Fiorentina,Bologna,2.0,0.0,H,1.55,3.9,5.6,2015-09-23,2015/2016,5,I1,2-0,2.0,-4.05,2015-09-23FiorentinaBologna
23/09/15,Inter,Verona,1.0,0.0,H,1.4,4.4,7.3,2015-09-23,2015/2016,5,I1,1-0,1.0,-5.9,2015-09-23InterVerona
23/09/15,Juventus,Frosinone,1.0,1.0,D,1.15,7.0,15.0,2015-09-23,2015/2016,6,I1,1-1,0.0,-13.85,2015-09-23JuventusFrosinone
23/09/15,Lazio,Genoa,2.0,0.0,H,1.7,3.6,4.7,2015-09-23,2015/2016,6,I1,2-0,2.0,-3.0,2015-09-23LazioGenoa
23/09/15,Palermo,Sassuolo,0.0,1.0,A,2.0,3.3,3.6,2015-09-23,2015/2016,6,I1,0-1,-1.0,-1.6,2015-09-23PalermoSassuolo
23/09/15,Sampdoria,Roma,2.0,1.0,H,3.8,3.45,1.9,2015-09-23,2015/2016,6,I1,2-1,1.0,1.9,2015-09-23SampdoriaRoma
24/09/15,Empoli,Atalanta,0.0,1.0,A,2.2,3.3,3.1,2015-09-24,2015/2016,6,I1,0-1,-1.0,-0.8999999999999999,2015-09-24EmpoliAtalanta
26/09/15,Napoli,Juventus,2.0,1.0,H,2.2,3.2,3.2,2015-09-26,2015/2016,6,I1,2-1,1.0,-1.0,2015-09-26NapoliJuventus
26/09/15,Roma,Carpi,5.0,1.0,H,1.25,5.5,10.3,2015-09-26,2015/2016,6,I1,5-1,4.0,-9.05,2015-09-26RomaCarpi
27/09/15,Bologna,Udinese,1.0,2.0,A,2.4,3.2,2.85,2015-09-27,2015/2016,6,I1,1-2,-1.0,-0.4500000000000002,2015-09-27BolognaUdinese
27/09/15,Genoa,Milan,1.0,0.0,H,2.9,3.3,2.3,2015-09-27,2015/2016,6,I1,1-0,1.0,0.6000000000000001,2015-09-27GenoaMilan
27/09/15,Inter,Fiorentina,1.0,4.0,A,1.8,3.5,4.2,2015-09-27,2015/2016,7,I1,1-4,-3.0,-2.4000000000000004,2015-09-27InterFiorentina
27/09/15,Sassuolo,Chievo,1.0,1.0,D,2.2,3.1,3.3,2015-09-27,2015/2016,7,I1,1-1,0.0,-1.0999999999999996,2015-09-27SassuoloChievo
27/09/15,Torino,Palermo,2.0,1.0,H,1.8,3.4,4.4,2015-09-27,2015/2016,7,I1,2-1,1.0,-2.6000000000000005,2015-09-27TorinoPalermo
27/09/15,Verona,Lazio,1.0,2.0,A,3.6,3.3,2.0,2015-09-27,2015/2016,7,I1,1-2,-1.0,1.6,2015-09-27VeronaLazio
28/09/15,Atalanta,Sampdoria,2.0,1.0,H,2.2,3.2,3.2,2015-09-28,2015/2016,7,I1,2-1,1.0,-1.0,2015-09-28AtalantaSampdoria
28/09/15,Frosinone,Empoli,2.0,0.0,H,2.85,3.2,2.4,2015-09-28,2015/2016,7,I1,2-0,2.0,0.4500000000000002,2015-09-28FrosinoneEmpoli
03/10/15,Carpi,Torino,2.0,1.0,H,3.3,3.3,2.1,2015-10-03,2015/2016,7,I1,2-1,1.0,1.1999999999999997,2015-10-03CarpiTorino
03/10/15,Chievo,Verona,1.0,1.0,D,2.1,3.3,3.3,2015-10-03,2015/2016,7,I1,1-1,0.0,-1.1999999999999997,2015-10-03ChievoVerona
04/10/15,Empoli,Sassuolo,1.0,0.0,H,2.5,3.2,2.75,2015-10-04,2015/2016,7,I1,1-0,1.0,-0.25,2015-10-04EmpoliSassuolo
04/10/15,Fiorentina,Atalanta,3.0,0.0,H,1.6,3.7,5.4,2015-10-04,2015/2016,8,I1,3-0,3.0,-3.8000000000000003,2015-10-04FiorentinaAtalanta
04/10/15,Juventus,Bologna,3.0,1.0,H,1.25,5.5,10.3,2015-10-04,2015/2016,8,I1,3-1,2.0,-9.05,2015-10-04JuventusBologna
04/10/15,Lazio,Frosinone,2.0,0.0,H,1.3,5.0,9.0,2015-10-04,2015/2016,8,I1,2-0,2.0,-7.7,2015-10-04LazioFrosinone
04/10/15,Milan,Napoli,0.0,4.0,A,2.6,3.2,2.6,2015-10-04,2015/2016,8,I1,0-4,-4.0,0.0,2015-10-04MilanNapoli
04/10/15,Palermo,Roma,2.0,4.0,A,3.8,3.45,1.9,2015-10-04,2015/2016,8,I1,2-4,-2.0,1.9,2015-10-04PalermoRoma
04/10/15,Sampdoria,Inter,1.0,1.0,D,3.6,3.3,2.0,2015-10-04,2015/2016,8,I1,1-1,0.0,1.6,2015-10-04SampdoriaInter
04/10/15,Udinese,Genoa,1.0,1.0,D,2.4,3.2,2.85,2015-10-04,2015/2016,8,I1,1-1,0.0,-0.4500000000000002,2015-10-04UdineseGenoa
17/10/15,Roma,Empoli,3.0,1.0,H,1.4,4.4,7.3,2015-10-17,2015/2016,8,I1,3-1,2.0,-5.9,2015-10-17RomaEmpoli
17/10/15,Torino,Milan,1.0,1.0,D,2.3,3.3,2.9,2015-10-17,2015/2016,8,I1,1-1,0.0,-0.6000000000000001,2015-10-17TorinoMilan
18/10/15,Atalanta,Carpi,3.0,0.0,H,1.8,3.5,4.2,2015-10-18,2015/2016,9,I1,3-0,3.0,-2.4000000000000004,2015-10-18AtalantaCarpi
18/10/15,Bologna,Palermo,0.0,1.0,A,2.5,3.2,2.75,2015-10-18,2015/2016,9,I1,0-1,-1.0,-0.25,2015-10-18BolognaPalermo
18/10/15,Frosinone,Sampdoria,2.0,0.0,H,2.9,3.3,2.3,2015-10-18,2015/2016,9,I1,2-0,2.0,0.6000000000000001,2015-10-18FrosinoneSampdoria
18/10/15,Genoa,Chievo,3.0,2.0,H,2.0,3.3,3.6,2015-10-18,2015/2016,9,I1,3-2,1.0,-1.6,2015-10-18GenoaChievo
18/10/15,Inter,Juventus,0.0,0.0,D,2.6,3.2,2.6,2015-10-18,2015/2016,9,I1,0-0,0.0,0.0,2015-10-18InterJuventus
18/10/15,Napoli,Fiorentina,2.0,1.0,H,1.75,3.5,4.5,2015-10-18,2015/2016,9,I1,2-1,1.0,-2.75,2015-10-18NapoliFiorentina
18/10/15,Sassuolo,Lazio,2.0,1.0,H,3.0,3.2,2.3,2015-10-18,2015/2016,9,I1,2-1,1.0,0.7000000000000002,2015-10-18SassuoloLazio
18/10/15,Verona,Udinese,1.0,1.0,D,2.3,3.3,2.9,2015-10-18,2015/2016,9,I1,1-1,0.0,-0.6000000000000001,2015-10-18VeronaUdinese
24/10/15,Carpi,Bologna,1.0,2.0,A,2.2,3.2,3.2,2015-10-24,2015/2016,9,I1,1-2,-1.0,-1.0,2015-10-24CarpiBologna
24/10/15,Empoli,Genoa,2.0,0.0,H,2.3,3.2,3.0,2015-10-24,2015/2016,10,I1,2-0,2.0,-0.7000000000000002,2015-10-24EmpoliGenoa
24/10/15,Palermo,Inter,1.0,1.0,D,3.6,3.3,2.0,2015-10-24,2015/2016,10,I1,1-1,0.0,1.6,2015-10-24PalermoInter
25/10/15,Chievo,Napoli,0.0,1.0,A,4.2,3.5,1.8,2015-10-25,2015/2016,10,I1,0-1,-1.0,2.4000000000000004,2015-10-25ChievoNapoli
25/10/15,Fiorentina,Roma,1.0,2.0,A,2.6,3.2,2.6,2015-10-25,2015/2016,10,I1,1-2,-1.0,0.0,2015-10-25FiorentinaRoma
25/10/15,Juventus,Atalanta,2.0,0.0,H,1.4,4.4,7.3,2015-10-25,2015/2016,10,I1,2-0,2.0,-5.9,2015-10-25JuventusAtalanta
25/10/15,Lazio,Torino,3.0,0.0,H,1.9,3.45,3.8,2015-10-25,2015/2016,10,I1,3-0,3.0,-1.9,2015-10-25LazioTorino
25/10/15,Milan,Sassuolo,2.0,1.0,H,1.75,3.5,4.5,2015-10-25,2015/2016,10,I1,2-1,1.0,-2.75,2015-10-25MilanSassuolo
25/10/15,Sampdoria,Verona,4.0,1.0,H,1.9,3.45,3.8,2015-10-25,2015/2016,10,I1,4-1,3.0,-1.9,2015-10-25SampdoriaVerona
25/10/15,Udinese,Frosinone,1.0,0.0,H,1.8,3.5,4.2,2015-10-25,2015/2016,10,I1,1-0,1.0,-2.4000000000000004,2015-10-25UdineseFrosinone
27/10/15,Bologna,Inter,0.0,1.0,A,4.2,3.5,1.8,2015-10-27,2015/2016,11,I1,0-1,-1.0,2.4000000000000004,2015-10-27BolognaInter
28/10/15,Atalanta,Lazio,2.0,1.0,H,2.9,3.3,2.3,2015-10-28,2015/2016,11,I1,2-1,1.0,0.6000000000000001,2015-10-28AtalantaLazio
28/10/15,Frosinone,Carpi,2.0,1.0,H,2.3,3.2,3.0,2015-10-28,2015/2016,11,I1,2-1,1.0,-0.7000000000000002,2015-10-28FrosinoneCarpi
28/10/15,Milan,Chievo,1.0,0.0,H,1.7,3.6,4.7,2015-10-28,2015/2016,11,I1,1-0,1.0,-3.0,2015-10-28MilanChievo
28/10/15,Napoli,Palermo,2.0,0.0,H,1.3,5.0,9.0,2015-10-28,2015/2016,11,I1,2-0,2.0,-7.7,2015-10-28NapoliPalermo
28/10/15,Roma,Udinese,3.0,1.0,H,1.4,4.4,7.3,2015-10-28,2015/2016,11,I1,3-1,2.0,-5.9,2015-10-28RomaUdinese
28/10/15,Sassuolo,Juventus,1.0,0.0,H,4.5,3.5,1.75,2015-10-28,2015/2016,11,I1,1-0,1.0,2.75,2015-10-28SassuoloJuventus
28/10/15,Torino,Genoa,3.0,3.0,D,2.0,3.3,3.6,2015-10-28,2015/2016,11,I1,3-3,0.0,-1.6,2015-10-28TorinoGenoa
28/10/15,Verona,Fiorentina,0.0,2.0,A,3.8,3.45,1.9,2015-10-28,2015/2016,11,I1,0-2,-2.0,1.9,2015-10-28VeronaFiorentina
29/10/15,Sampdoria,Empoli,1.0,1.0,D,2.2,3.2,3.2,2015-10-29,2015/2016,12,I1,1-1,0.0,-1.0,2015-10-29SampdoriaEmpoli
31/10/15,Inter,Roma,1.0,0.0,H,2.6,3.2,2.6,2015-10-31,2015/2016,12,I1,1-0,1.0,0.0,2015-10-31InterRoma
31/10/15,Juventus,Torino,2.0,1.0,H,1.65,3.6,5.1,2015-10-31,2015/2016,12,I1,2-1,1.0,-3.4499999999999997,2015-10-31JuventusTorino
01/11/15,Bologna,Atalanta,3.0,0.0,H,2.6,3.2,2.6,2015-11-01,2015/2016,12,I1,3-0,3.0,0.0,2015-11-01BolognaAtalanta
01/11/15,Carpi,Verona,0.0,0.0,D,2.2,3.3,3.1,2015-11-01,2015/2016,12,I1,0-0,0.0,-0.8999999999999999,2015-11-01CarpiVerona
01/11/15,Fiorentina,Frosinone,4.0,1.0,H,1.25,5.5,10.3,2015-11-01,2015/2016,12,I1,4-1,3.0,-9.05,2015-11-01FiorentinaFrosinone
01/11/15,Genoa,Napoli,0.0,0.0,D,3.8,3.45,1.9,2015-11-01,2015/2016,12,I1,0-0,0.0,1.9,2015-11-01GenoaNapoli
01/11/15,Lazio,Milan,1.0,3.0,A,2.0,3.3,3.6,2015-11-01,2015/2016,12,I1,1-3,-2.0,-1.6,2015-11-01LazioMilan
01/11/15,Udinese,Sassuolo,0.0,0.0,D,2.3,3.2,3.0,2015-11-01,2015/2016,12,I1,0-0,0.0,-0.7000000000000002,2015-11-01UdineseSassuolo
02/11/15,Chievo,Sampdoria,1.0,1.0,D,2.2,3.2,3.2,2015-11-02,2015/2016,13,I1,1-1,0.0,-1.0,2015-11-02ChievoSampdoria
02/11/15,Palermo,Empoli,0.0,1.0,A,2.1,3.2,3.4,2015-11-02,2015/2016,13,I1,0-1,-1.0,-1.2999999999999998,2015-11-02PalermoEmpoli
07/11/15,Milan,Atalanta,0.0,0.0,D,1.65,3.6,5.1,2015-11-07,2015/2016,13,I1,0-0,0.0,-3.4499999999999997,2015-11-07MilanAtalanta
07/11/15,Verona,Bologna,0.0,2.0,A,2.3,3.2,3.0,2015-11-07,2015/2016,13,I1,0-2,-2.0,-0.7000000000000002,2015-11-07VeronaBologna
08/11/15,Empoli,Juventus,1.0,3.0,A,4.7,3.6,1.7,2015-11-08,2015/2016,13,I1,1-3,-2.0,3.0,2015-11-08EmpoliJuventus
08/11/15,Frosinone,Genoa,2.0,2.0,D,3.0,3.2,2.3,2015-11-08,2015/2016,13,I1,2-2,0.0,0.7000000000000002,2015-11-08FrosinoneGenoa
08/11/15,Napoli,Udinese,1.0,0.0,H,1.27,5.2,10.0,2015-11-08,2015/2016,13,I1,1-0,1.0,-8.73,2015-11-08NapoliUdinese
08/11/15,Palermo,Chievo,1.0,0.0,H,2.3,3.2,3.0,2015-11-08,2015/2016,13,I1,1-0,1.0,-0.7000000000000002,2015-11-08PalermoChievo
08/11/15,Roma,Lazio,2.0,0.0,H,2.0,3.3,3.6,2015-11-08,2015/2016,13,I1,2-0,2.0,-1.6,2015-11-08RomaLazio
08/11/15,Sampdoria,Fiorentina,0.0,2.0,A,3.6,3.3,2.0,2015-11-08,2015/2016,14,I1,0-2,-2.0,1.6,2015-11-08SampdoriaFiorentina
08/11/15,Sassuolo,Carpi,1.0,0.0,H,1.7,3.6,4.7,2015-11-08,2015/2016,14,I1,1-0,1.0,-3.0,2015-11-08SassuoloCarpi
08/11/15,Torino,Inter,0.0,1.0,A,2.6,3.2,2.6,2015-11-08,2015/2016,14,I1,0-1,-1.0,0.0,2015-11-08TorinoInter
21/11/15,Bologna,Roma,2.0,2.0,D,4.7,3.6,1.7,2015-11-21,2015/2016,14,I1,2-2,0.0,3.0,2015-11-21BolognaRoma
21/11/15,Juventus,Milan,1.0,0.0,H,1.6,3.7,5.4,2015-11-21,2015/2016,14,I1,1-0,1.0,-3.8000000000000003,2015-11-21JuventusMilan
22/11/15,Atalanta,Torino,0.0,1.0,A,2.5,3.15,2.8,2015-11-22,2015/2016,14,I1,0-1,-1.0,-0.2999999999999998,2015-11-22AtalantaTorino
22/11/15,Carpi,Chievo,1.0,2.0,A,2.7,3.1,2.6,2015-11-22,2015/2016,14,I1,1-2,-1.0,0.10000000000000009,2015-11-22CarpiChievo
22/11/15,Fiorentina,Empoli,2.0,2.0,D,1.5,4.0,6.1,2015-11-22,2015/2016,14,I1,2-2,0.0,-4.6,2015-11-22FiorentinaEmpoli
22/11/15,Genoa,Sassuolo,2.0,1.0,H,2.1,3.3,3.3,2015-11-22,2015/2016,14,I1,2-1,1.0,-1.1999999999999997,2015-11-22GenoaSassuolo
22/11/15,Inter,Frosinone,4.0,0.0,H,1.2,5.8,13.0,2015-11-22,2015/2016,15,I1,4-0,4.0,-11.8,2015-11-22InterFrosinone
22/11/15,Lazio,Palermo,1.0,1.0,D,1.5,4.0,6.1,2015-11-22,2015/2016,15,I1,1-1,0.0,-4.6,2015-11-22LazioPalermo
22/11/15,Udinese,Sampdoria,1.0,0.0,H,2.1,3.3,3.3,2015-11-22,2015/2016,15,I1,1-0,1.0,-1.1999999999999997,2015-11-22UdineseSampdoria
22/11/15,Verona,Napoli,0.0,2.0,A,7.3,4.4,1.4,2015-11-22,2015/2016,15,I1,0-2,-2.0,5.9,2015-11-22VeronaNapoli
28/11/15,Milan,Sampdoria,4.0,1.0,H,1.65,3.6,5.1,2015-11-28,2015/2016,15,I1,4-1,3.0,-3.4499999999999997,2015-11-28MilanSampdoria
28/11/15,Torino,Bologna,2.0,0.0,H,1.7,3.6,4.7,2015-11-28,2015/2016,15,I1,2-0,2.0,-3.0,2015-11-28TorinoBologna
29/11/15,Chievo,Udinese,2.0,3.0,A,2.2,3.2,3.2,2015-11-29,2015/2016,15,I1,2-3,-1.0,-1.0,2015-11-29ChievoUdinese
29/11/15,Empoli,Lazio,1.0,0.0,H,2.9,3.3,2.3,2015-11-29,2015/2016,15,I1,1-0,1.0,0.6000000000000001,2015-11-29EmpoliLazio
29/11/15,Frosinone,Verona,3.0,2.0,H,2.4,3.2,2.85,2015-11-29,2015/2016,15,I1,3-2,1.0,-0.4500000000000002,2015-11-29FrosinoneVerona
29/11/15,Genoa,Carpi,1.0,2.0,A,1.55,3.9,5.6,2015-11-29,2015/2016,16,I1,1-2,-1.0,-4.05,2015-11-29GenoaCarpi
29/11/15,Palermo,Juventus,0.0,3.0,A,5.4,3.7,1.6,2015-11-29,2015/2016,16,I1,0-3,-3.0,3.8000000000000003,2015-11-29PalermoJuventus
29/11/15,Roma,Atalanta,0.0,2.0,A,1.45,4.0,7.0,2015-11-29,2015/2016,16,I1,0-2,-2.0,-5.55,2015-11-29RomaAtalanta
30/11/15,Napoli,Inter,2.0,1.0,H,1.75,3.5,4.5,2015-11-30,2015/2016,16,I1,2-1,1.0,-2.75,2015-11-30NapoliInter
30/11/15,Sassuolo,Fiorentina,1.0,1.0,D,3.2,3.2,2.2,2015-11-30,2015/2016,16,I1,1-1,0.0,1.0,2015-11-30SassuoloFiorentina
04/12/15,Lazio,Juventus,0.0,2.0,A,3.3,3.3,2.1,2015-12-04,2015/2016,16,I1,0-2,-2.0,1.1999999999999997,2015-12-04LazioJuventus
05/12/15,Inter,Genoa,1.0,0.0,H,1.5,4.0,6.1,2015-12-05,2015/2016,16,I1,1-0,1.0,-4.6,2015-12-05InterGenoa
05/12/15,Torino,Roma,1.0,1.0,D,2.65,3.1,2.65,2015-12-05,2015/2016,16,I1,1-1,0.0,0.0,2015-12-05TorinoRoma
06/12/15,Atalanta,Palermo,3.0,0.0,H,1.85,3.4,4.1,2015-12-06,2015/2016,16,I1,3-0,3.0,-2.2499999999999996,2015-12-06AtalantaPalermo
06/12/15,Bologna,Napoli,3.0,2.0,H,7.0,4.0,1.45,2015-12-06,2015/2016,17,I1,3-2,1.0,5.55,2015-12-06BolognaNapoli
06/12/15,Carpi,Milan,0.0,0.0,D,4.5,3.5,1.75,2015-12-06,2015/2016,17,I1,0-0,0.0,2.75,2015-12-06CarpiMilan
06/12/15,Fiorentina,Udinese,3.0,0.0,H,1.55,3.9,5.6,2015-12-06,2015/2016,17,I1,3-0,3.0,-4.05,2015-12-06FiorentinaUdinese
06/12/15,Frosinone,Chievo,0.0,2.0,A,2.75,3.2,2.5,2015-12-06,2015/2016,17,I1,0-2,-2.0,0.25,2015-12-06FrosinoneChievo
06/12/15,Sampdoria,Sassuolo,1.0,3.0,A,2.3,3.2,3.0,2015-12-06,2015/2016,17,I1,1-3,-2.0,-0.7000000000000002,2015-12-06SampdoriaSassuolo
06/12/15,Verona,Empoli,0.0,1.0,A,2.75,3.2,2.5,2015-12-06,2015/2016,17,I1,0-1,-1.0,0.25,2015-12-06VeronaEmpoli
12/12/15,Genoa,Bologna,0.0,1.0,A,2.0,3.2,3.75,2015-12-12,2015/2016,17,I1,0-1,-1.0,-1.75,2015-12-12GenoaBologna
12/12/15,Palermo,Frosinone,4.0,1.0,H,1.75,3.5,4.5,2015-12-12,2015/2016,17,I1,4-1,3.0,-2.75,2015-12-12PalermoFrosinone
12/12/15,Udinese,Inter,0.0,4.0,A,3.6,3.3,2.0,2015-12-12,2015/2016,17,I1,0-4,-4.0,1.6,2015-12-12UdineseInter
13/12/15,Chievo,Atalanta,1.0,0.0,H,2.5,3.1,2.8,2015-12-13,2015/2016,18,I1,1-0,1.0,-0.2999999999999998,2015-12-13ChievoAtalanta
13/12/15,Empoli,Carpi,3.0,0.0,H,1.7,3.6,4.7,2015-12-13,2015/2016,18,I1,3-0,3.0,-3.0,2015-12-13EmpoliCarpi
13/12/15,Juventus,Fiorentina,3.0,1.0,H,1.65,3.6,5.1,2015-12-13,2015/2016,18,I1,3-1,2.0,-3.4499999999999997,2015-12-13JuventusFiorentina
13/12/15,Milan,Verona,1.0,1.0,D,1.35,4.8,7.6,2015-12-13,2015/2016,18,I1,1-1,0.0,-6.25,2015-12-13MilanVerona
13/12/15,Napoli,Roma,0.0,0.0,D,1.6,3.7,5.4,2015-12-13,2015/2016,18,I1,0-0,0.0,-3.8000000000000003,2015-12-13NapoliRoma
14/12/15,Lazio,Sampdoria,1.0,1.0,D,1.5,4.0,6.1,2015-12-14,2015/2016,18,I1,1-1,0.0,-4.6,2015-12-14LazioSampdoria
19/12/15,Bologna,Empoli,2.0,3.0,A,2.3,3.2,3.0,2015-12-19,2015/2016,18,I1,2-3,-1.0,-0.7000000000000002,2015-12-19BolognaEmpoli
20/12/15,Atalanta,Napoli,1.0,3.0,A,4.7,3.6,1.7,2015-12-20,2015/2016,18,I1,1-3,-2.0,3.0,2015-12-20AtalantaNapoli
20/12/15,Carpi,Juventus,2.0,3.0,A,7.3,4.4,1.4,2015-12-20,2015/2016,18,I1,2-3,-1.0,5.9,2015-12-20CarpiJuventus
20/12/15,Fiorentina,Chievo,2.0,0.0,H,1.5,4.0,6.1,2015-12-20,2015/2016,19,I1,2-0,2.0,-4.6,2015-12-20FiorentinaChievo
20/12/15,Frosinone,Milan,2.0,4.0,A,4.2,3.5,1.8,2015-12-20,2015/2016,19,I1,2-4,-2.0,2.4000000000000004,2015-12-20FrosinoneMilan
20/12/15,Inter,Lazio,1.0,2.0,A,1.75,3.5,4.5,2015-12-20,2015/2016,19,I1,1-2,-1.0,-2.75,2015-12-20InterLazio
20/12/15,Roma,Genoa,2.0,0.0,H,1.5,4.0,6.1,2015-12-20,2015/2016,19,I1,2-0,2.0,-4.6,2015-12-20RomaGenoa
20/12/15,Sampdoria,Palermo,2.0,0.0,H,2.1,3.3,3.3,2015-12-20,2015/2016,19,I1,2-0,2.0,-1.1999999999999997,2015-12-20SampdoriaPalermo
20/12/15,Torino,Udinese,0.0,1.0,A,1.75,3.5,4.5,2015-12-20,2015/2016,19,I1,0-1,-1.0,-2.75,2015-12-20TorinoUdinese
20/12/15,Verona,Sassuolo,1.0,1.0,D,2.6,3.2,2.6,2015-12-20,2015/2016,19,I1,1-1,0.0,0.0,2015-12-20VeronaSassuolo
05/01/16,Genoa,Sampdoria,2.0,3.0,A,2.2,3.2,3.2,2016-01-05,2015/2016,19,I1,2-3,-1.0,-1.0,2016-01-05GenoaSampdoria
06/01/16,Chievo,Roma,3.0,3.0,D,2.9,3.3,2.3,2016-01-06,2015/2016,19,I1,3-3,0.0,0.6000000000000001,2016-01-06ChievoRoma
06/01/16,Empoli,Inter,0.0,1.0,A,3.2,3.2,2.2,2016-01-06,2015/2016,20,I1,0-1,-1.0,1.0,2016-01-06EmpoliInter
06/01/16,Juventus,Verona,3.0,0.0,H,1.15,7.0,15.0,2016-01-06,2015/2016,20,I1,3-0,3.0,-13.85,2016-01-06JuventusVerona
06/01/16,Lazio,Carpi,0.0,0.0,D,1.4,4.4,7.3,2016-01-06,2015/2016,20,I1,0-0,0.0,-5.9,2016-01-06LazioCarpi
06/01/16,Milan,Bologna,0.0,1.0,A,1.5,4.0,6.1,2016-01-06,2015/2016,20,I1,0-1,-1.0,-4.6,2016-01-06MilanBologna
06/01/16,Napoli,Torino,2.0,1.0,H,1.4,4.4,7.3,2016-01-06,2015/2016,20,I1,2-1,1.0,-5.9,2016-01-06NapoliTorino
06/01/16,Palermo,Fiorentina,1.0,3.0,A,3.8,3.45,1.9,2016-01-06,2015/2016,20,I1,1-3,-2.0,1.9,2016-01-06PalermoFiorentina
06/01/16,Sassuolo,Frosinone,2.0,2.0,D,1.65,3.6,5.1,2016-01-06,2015/2016,20,I1,2-2,0.0,-3.4499999999999997,2016-01-06SassuoloFrosinone
06/01/16,Udinese,Atalanta,2.0,1.0,H,2.3,3.2,3.0,2016-01-06,2015/2016,20,I1,2-1,1.0,-0.7000000000000002,2016-01-06UdineseAtalanta
09/01/16,Carpi,Udinese,2.0,1.0,H,2.6,3.2,2.6,2016-01-09,2015/2016,20,I1,2-1,1.0,0.0,2016-01-09CarpiUdinese
09/01/16,Fiorentina,Lazio,1.0,3.0,A,1.85,3.45,4.0,2016-01-09,2015/2016,21,I1,1-3,-2.0,-2.15,2016-01-09FiorentinaLazio
09/01/16,Roma,Milan,1.0,1.0,D,2.0,3.3,3.6,2016-01-09,2015/2016,21,I1,1-1,0.0,-1.6,2016-01-09RomaMilan
10/01/16,Atalanta,Genoa,0.0,2.0,A,2.3,3.1,3.1,2016-01-10,2015/2016,21,I1,0-2,-2.0,-0.8000000000000003,2016-01-10AtalantaGenoa
10/01/16,Bologna,Chievo,0.0,1.0,A,2.4,3.1,2.95,2016-01-10,2015/2016,21,I1,0-1,-1.0,-0.5500000000000003,2016-01-10BolognaChievo
10/01/16,Frosinone,Napoli,1.0,5.0,A,9.0,5.0,1.3,2016-01-10,2015/2016,21,I1,1-5,-4.0,7.7,2016-01-10FrosinoneNapoli
10/01/16,Inter,Sassuolo,0.0,1.0,A,1.55,3.9,5.6,2016-01-10,2015/2016,21,I1,0-1,-1.0,-4.05,2016-01-10InterSassuolo
10/01/16,Sampdoria,Juventus,1.0,2.0,A,7.0,4.0,1.45,2016-01-10,2015/2016,21,I1,1-2,-1.0,5.55,2016-01-10SampdoriaJuventus
10/01/16,Torino,Empoli,0.0,1.0,A,1.9,3.3,4.0,2016-01-10,2015/2016,21,I1,0-1,-1.0,-2.1,2016-01-10TorinoEmpoli
10/01/16,Verona,Palermo,0.0,1.0,A,2.3,3.1,3.1,2016-01-10,2015/2016,21,I1,0-1,-1.0,-0.8000000000000003,2016-01-10VeronaPalermo
16/01/16,Atalanta,Inter,1.0,1.0,D,3.3,3.3,2.1,2016-01-16,2015/2016,22,I1,1-1,0.0,1.1999999999999997,2016-01-16AtalantaInter
16/01/16,Napoli,Sassuolo,3.0,1.0,H,1.3,5.0,9.0,2016-01-16,2015/2016,22,I1,3-1,2.0,-7.7,2016-01-16NapoliSassuolo
16/01/16,Torino,Frosinone,4.0,2.0,H,1.33,4.8,8.3,2016-01-16,2015/2016,22,I1,4-2,2.0,-6.970000000000001,2016-01-16TorinoFrosinone
17/01/16,Bologna,Lazio,2.0,2.0,D,3.1,3.1,2.3,2016-01-17,2015/2016,22,I1,2-2,0.0,0.8000000000000003,2016-01-17BolognaLazio
17/01/16,Carpi,Sampdoria,2.0,1.0,H,2.6,3.2,2.6,2016-01-17,2015/2016,22,I1,2-1,1.0,0.0,2016-01-17CarpiSampdoria
17/01/16,Chievo,Empoli,1.0,1.0,D,2.5,3.1,2.8,2016-01-17,2015/2016,22,I1,1-1,0.0,-0.2999999999999998,2016-01-17ChievoEmpoli
17/01/16,Genoa,Palermo,4.0,0.0,H,1.9,3.45,3.8,2016-01-17,2015/2016,22,I1,4-0,4.0,-1.9,2016-01-17GenoaPalermo
17/01/16,Milan,Fiorentina,2.0,0.0,H,2.5,3.2,2.75,2016-01-17,2015/2016,22,I1,2-0,2.0,-0.25,2016-01-17MilanFiorentina
17/01/16,Roma,Verona,1.0,1.0,D,1.37,4.6,7.5,2016-01-17,2015/2016,22,I1,1-1,0.0,-6.13,2016-01-17RomaVerona
17/01/16,Udinese,Juventus,0.0,4.0,A,6.1,4.0,1.5,2016-01-17,2015/2016,23,I1,0-4,-4.0,4.6,2016-01-17UdineseJuventus
20/01/16,Sassuolo,Torino,1.0,1.0,D,2.4,3.3,2.75,2016-01-20,2015/2016,23,I1,1-1,0.0,-0.3500000000000001,2016-01-20SassuoloTorino
23/01/16,Empoli,Milan,2.0,2.0,D,2.75,3.2,2.5,2016-01-23,2015/2016,23,I1,2-2,0.0,0.25,2016-01-23EmpoliMilan
23/01/16,Frosinone,Atalanta,0.0,0.0,D,3.1,3.3,2.2,2016-01-23,2015/2016,23,I1,0-0,0.0,0.8999999999999999,2016-01-23FrosinoneAtalanta
24/01/16,Fiorentina,Torino,2.0,0.0,H,1.8,3.4,4.4,2016-01-24,2015/2016,23,I1,2-0,2.0,-2.6000000000000005,2016-01-24FiorentinaTorino
24/01/16,Inter,Carpi,1.0,1.0,D,1.45,4.0,7.0,2016-01-24,2015/2016,23,I1,1-1,0.0,-5.55,2016-01-24InterCarpi
24/01/16,Juventus,Roma,1.0,0.0,H,1.6,3.7,5.4,2016-01-24,2015/2016,23,I1,1-0,1.0,-3.8000000000000003,2016-01-24JuventusRoma
24/01/16,Lazio,Chievo,4.0,1.0,H,1.7,3.6,4.7,2016-01-24,2015/2016,23,I1,4-1,3.0,-3.0,2016-01-24LazioChievo
24/01/16,Palermo,Udinese,4.0,1.0,H,2.65,3.1,2.65,2016-01-24,2015/2016,23,I1,4-1,3.0,0.0,2016-01-24PalermoUdinese
24/01/16,Sampdoria,Napoli,2.0,4.0,A,7.0,4.0,1.45,2016-01-24,2015/2016,24,I1,2-4,-2.0,5.55,2016-01-24SampdoriaNapoli
24/01/16,Sassuolo,Bologna,0.0,2.0,A,1.85,3.4,4.1,2016-01-24,2015/2016,24,I1,0-2,-2.0,-2.2499999999999996,2016-01-24SassuoloBologna
24/01/16,Verona,Genoa,1.0,1.0,D,2.65,3.3,2.5,2016-01-24,2015/2016,24,I1,1-1,0.0,0.1499999999999999,2016-01-24VeronaGenoa
30/01/16,Atalanta,Sassuolo,1.0,1.0,D,2.4,3.1,2.95,2016-01-30,2015/2016,24,I1,1-1,0.0,-0.5500000000000003,2016-01-30AtalantaSassuolo
30/01/16,Carpi,Palermo,1.0,1.0,D,2.3,3.1,3.1,2016-01-30,2015/2016,24,I1,1-1,0.0,-0.8000000000000003,2016-01-30CarpiPalermo
30/01/16,Roma,Frosinone,3.0,1.0,H,1.22,5.5,12.0,2016-01-30,2015/2016,24,I1,3-1,2.0,-10.78,2016-01-30RomaFrosinone
31/01/16,Bologna,Sampdoria,3.0,2.0,H,2.3,3.1,3.1,2016-01-31,2015/2016,24,I1,3-2,1.0,-0.8000000000000003,2016-01-31BolognaSampdoria
31/01/16,Chievo,Juventus,0.0,4.0,A,6.1,4.0,1.5,2016-01-31,2015/2016,24,I1,0-4,-4.0,4.6,2016-01-31ChievoJuventus
31/01/16,Genoa,Fiorentina,0.0,0.0,D,2.85,3.2,2.4,2016-01-31,2015/2016,24,I1,0-0,0.0,0.4500000000000002,2016-01-31GenoaFiorentina
31/01/16,Milan,Inter,3.0,0.0,H,2.6,3.2,2.6,2016-01-31,2015/2016,25,I1,3-0,3.0,0.0,2016-01-31MilanInter
31/01/16,Napoli,Empoli,5.0,1.0,H,1.3,5.0,9.0,2016-01-31,2015/2016,25,I1,5-1,4.0,-7.7,2016-01-31NapoliEmpoli
31/01/16,Torino,Verona,0.0,0.0,D,1.5,4.0,6.1,2016-01-31,2015/2016,25,I1,0-0,0.0,-4.6,2016-01-31TorinoVerona
31/01/16,Udinese,Lazio,0.0,0.0,D,2.85,3.2,2.4,2016-01-31,2015/2016,25,I1,0-0,0.0,0.4500000000000002,2016-01-31UdineseLazio
02/02/16,Sassuolo,Roma,0.0,2.0,A,3.2,3.2,2.2,2016-02-02,2015/2016,25,I1,0-2,-2.0,1.0,2016-02-02SassuoloRoma
03/02/16,Empoli,Udinese,1.0,1.0,D,2.0,3.3,3.6,2016-02-03,2015/2016,25,I1,1-1,0.0,-1.6,2016-02-03EmpoliUdinese
03/02/16,Fiorentina,Carpi,2.0,1.0,H,1.4,4.4,7.3,2016-02-03,2015/2016,25,I1,2-1,1.0,-5.9,2016-02-03FiorentinaCarpi
03/02/16,Frosinone,Bologna,1.0,0.0,H,2.9,3.3,2.3,2016-02-03,2015/2016,25,I1,1-0,1.0,0.6000000000000001,2016-02-03FrosinoneBologna
03/02/16,Inter,Chievo,1.0,0.0,H,1.55,3.9,5.6,2016-02-03,2015/2016,25,I1,1-0,1.0,-4.05,2016-02-03InterChievo
03/02/16,Juventus,Genoa,1.0,0.0,H,1.25,5.5,10.3,2016-02-03,2015/2016,26,I1,1-0,1.0,-9.05,2016-02-03JuventusGenoa
03/02/16,Lazio,Napoli,0.0,2.0,A,3.6,3.3,2.0,2016-02-03,2015/2016,26,I1,0-2,-2.0,1.6,2016-02-03LazioNapoli
03/02/16,Palermo,Milan,0.0,2.0,A,3.6,3.3,2.0,2016-02-03,2015/2016,26,I1,0-2,-2.0,1.6,2016-02-03PalermoMilan
03/02/16,Sampdoria,Torino,2.0,2.0,D,2.6,3.2,2.6,2016-02-03,2015/2016,26,I1,2-2,0.0,0.0,2016-02-03SampdoriaTorino
03/02/16,Verona,Atalanta,2.0,1.0,H,2.5,3.3,2.65,2016-02-03,2015/2016,26,I1,2-1,1.0,-0.1499999999999999,2016-02-03VeronaAtalanta
06/02/16,Bologna,Fiorentina,1.0,1.0,D,3.3,3.3,2.1,2016-02-06,2015/2016,26,I1,1-1,0.0,1.1999999999999997,2016-02-06BolognaFiorentina
06/02/16,Genoa,Lazio,0.0,0.0,D,2.6,3.2,2.6,2016-02-06,2015/2016,26,I1,0-0,0.0,0.0,2016-02-06GenoaLazio
07/02/16,Atalanta,Empoli,0.0,0.0,D,2.5,3.1,2.8,2016-02-07,2015/2016,26,I1,0-0,0.0,-0.2999999999999998,2016-02-07AtalantaEmpoli
07/02/16,Frosinone,Juventus,0.0,2.0,A,10.3,5.5,1.25,2016-02-07,2015/2016,26,I1,0-2,-2.0,9.05,2016-02-07FrosinoneJuventus
07/02/16,Milan,Udinese,1.0,1.0,D,1.5,4.0,6.1,2016-02-07,2015/2016,27,I1,1-1,0.0,-4.6,2016-02-07MilanUdinese
07/02/16,Napoli,Carpi,1.0,0.0,H,1.15,7.0,15.0,2016-02-07,2015/2016,27,I1,1-0,1.0,-13.85,2016-02-07NapoliCarpi
07/02/16,Roma,Sampdoria,2.0,1.0,H,1.4,4.4,7.3,2016-02-07,2015/2016,27,I1,2-1,1.0,-5.9,2016-02-07RomaSampdoria
07/02/16,Sassuolo,Palermo,2.0,2.0,D,1.9,3.45,3.8,2016-02-07,2015/2016,27,I1,2-2,0.0,-1.9,2016-02-07SassuoloPalermo
07/02/16,Torino,Chievo,1.0,2.0,A,1.75,3.5,4.5,2016-02-07,2015/2016,27,I1,1-2,-1.0,-2.75,2016-02-07TorinoChievo
07/02/16,Verona,Inter,3.0,3.0,D,4.0,3.45,1.85,2016-02-07,2015/2016,27,I1,3-3,0.0,2.15,2016-02-07VeronaInter
11/02/16,Lazio,Verona,5.0,2.0,H,1.6,3.7,5.4,2016-02-11,2015/2016,27,I1,5-2,3.0,-3.8000000000000003,2016-02-11LazioVerona
12/02/16,Carpi,Roma,1.0,3.0,A,4.0,3.45,1.85,2016-02-12,2015/2016,27,I1,1-3,-2.0,2.15,2016-02-12CarpiRoma
13/02/16,Chievo,Sassuolo,1.0,1.0,D,2.5,3.0,2.9,2016-02-13,2015/2016,27,I1,1-1,0.0,-0.3999999999999999,2016-02-13ChievoSassuolo
13/02/16,Empoli,Frosinone,1.0,2.0,A,1.65,3.7,4.9,2016-02-13,2015/2016,28,I1,1-2,-1.0,-3.2500000000000004,2016-02-13EmpoliFrosinone
13/02/16,Juventus,Napoli,1.0,0.0,H,1.9,3.45,3.8,2016-02-13,2015/2016,28,I1,1-0,1.0,-1.9,2016-02-13JuventusNapoli
14/02/16,Fiorentina,Inter,2.0,1.0,H,2.2,3.2,3.2,2016-02-14,2015/2016,28,I1,2-1,1.0,-1.0,2016-02-14FiorentinaInter
14/02/16,Milan,Genoa,2.0,1.0,H,1.7,3.6,4.7,2016-02-14,2015/2016,28,I1,2-1,1.0,-3.0,2016-02-14MilanGenoa
14/02/16,Palermo,Torino,1.0,3.0,A,2.8,3.1,2.5,2016-02-14,2015/2016,28,I1,1-3,-2.0,0.2999999999999998,2016-02-14PalermoTorino
14/02/16,Sampdoria,Atalanta,0.0,0.0,D,2.0,3.3,3.6,2016-02-14,2015/2016,28,I1,0-0,0.0,-1.6,2016-02-14SampdoriaAtalanta
14/02/16,Udinese,Bologna,0.0,1.0,A,2.0,3.3,3.6,2016-02-14,2015/2016,28,I1,0-1,-1.0,-1.6,2016-02-14UdineseBologna
19/02/16,Bologna,Juventus,0.0,0.0,D,6.1,4.0,1.5,2016-02-19,2015/2016,28,I1,0-0,0.0,4.6,2016-02-19BolognaJuventus
20/02/16,Inter,Sampdoria,3.0,1.0,H,1.55,3.9,5.6,2016-02-20,2015/2016,28,I1,3-1,2.0,-4.05,2016-02-20InterSampdoria
20/02/16,Verona,Chievo,3.0,1.0,H,2.3,3.2,3.0,2016-02-20,2015/2016,29,I1,3-1,2.0,-0.7000000000000002,2016-02-20VeronaChievo
21/02/16,Atalanta,Fiorentina,2.0,3.0,A,3.5,3.3,2.05,2016-02-21,2015/2016,29,I1,2-3,-1.0,1.4500000000000002,2016-02-21AtalantaFiorentina
21/02/16,Frosinone,Lazio,0.0,0.0,D,4.2,3.5,1.8,2016-02-21,2015/2016,29,I1,0-0,0.0,2.4000000000000004,2016-02-21FrosinoneLazio
21/02/16,Genoa,Udinese,2.0,1.0,H,2.2,3.1,3.3,2016-02-21,2015/2016,29,I1,2-1,1.0,-1.0999999999999996,2016-02-21GenoaUdinese
21/02/16,Roma,Palermo,5.0,0.0,H,1.35,4.8,7.6,2016-02-21,2015/2016,29,I1,5-0,5.0,-6.25,2016-02-21RomaPalermo
21/02/16,Sassuolo,Empoli,3.0,2.0,H,2.2,3.1,3.3,2016-02-21,2015/2016,29,I1,3-2,1.0,-1.0999999999999996,2016-02-21SassuoloEmpoli
21/02/16,Torino,Carpi,0.0,0.0,D,1.6,3.9,5.0,2016-02-21,2015/2016,29,I1,0-0,0.0,-3.4,2016-02-21TorinoCarpi
22/02/16,Napoli,Milan,1.0,1.0,D,1.65,3.6,5.1,2016-02-22,2015/2016,29,I1,1-1,0.0,-3.4499999999999997,2016-02-22NapoliMilan
27/02/16,Empoli,Roma,1.0,3.0,A,4.2,3.5,1.8,2016-02-27,2015/2016,29,I1,1-3,-2.0,2.4000000000000004,2016-02-27EmpoliRoma
27/02/16,Milan,Torino,1.0,0.0,H,1.7,3.5,4.9,2016-02-27,2015/2016,30,I1,1-0,1.0,-3.2,2016-02-27MilanTorino
28/02/16,Carpi,Atalanta,1.0,1.0,D,2.4,3.2,2.85,2016-02-28,2015/2016,30,I1,1-1,0.0,-0.4500000000000002,2016-02-28CarpiAtalanta
28/02/16,Chievo,Genoa,1.0,0.0,H,2.75,3.2,2.5,2016-02-28,2015/2016,30,I1,1-0,1.0,0.25,2016-02-28ChievoGenoa
28/02/16,Juventus,Inter,2.0,0.0,H,1.55,3.9,5.6,2016-02-28,2015/2016,30,I1,2-0,2.0,-4.05,2016-02-28JuventusInter
28/02/16,Palermo,Bologna,0.0,0.0,D,2.4,3.2,2.85,2016-02-28,2015/2016,30,I1,0-0,0.0,-0.4500000000000002,2016-02-28PalermoBologna
28/02/16,Sampdoria,Frosinone,2.0,0.0,H,1.75,3.5,4.5,2016-02-28,2015/2016,30,I1,2-0,2.0,-2.75,2016-02-28SampdoriaFrosinone
28/02/16,Udinese,Verona,2.0,0.0,H,1.9,3.45,3.8,2016-02-28,2015/2016,30,I1,2-0,2.0,-1.9,2016-02-28UdineseVerona
29/02/16,Fiorentina,Napoli,1.0,1.0,D,2.85,3.2,2.4,2016-02-29,2015/2016,30,I1,1-1,0.0,0.4500000000000002,2016-02-29FiorentinaNapoli
29/02/16,Lazio,Sassuolo,0.0,2.0,A,1.75,3.5,4.5,2016-02-29,2015/2016,30,I1,0-2,-2.0,-2.75,2016-02-29LazioSassuolo
04/03/16,Roma,Fiorentina,4.0,1.0,H,2.1,3.3,3.3,2016-03-04,2015/2016,31,I1,4-1,3.0,-1.1999999999999997,2016-03-04RomaFiorentina
05/03/16,Napoli,Chievo,3.0,1.0,H,1.2,5.8,13.0,2016-03-05,2015/2016,31,I1,3-1,2.0,-11.8,2016-03-05NapoliChievo
05/03/16,Verona,Sampdoria,0.0,3.0,A,2.5,3.3,2.65,2016-03-05,2015/2016,31,I1,0-3,-3.0,-0.1499999999999999,2016-03-05VeronaSampdoria
06/03/16,Atalanta,Juventus,0.0,2.0,A,7.0,4.0,1.45,2016-03-06,2015/2016,31,I1,0-2,-2.0,5.55,2016-03-06AtalantaJuventus
06/03/16,Bologna,Carpi,0.0,0.0,D,1.85,3.45,4.0,2016-03-06,2015/2016,31,I1,0-0,0.0,-2.15,2016-03-06BolognaCarpi
06/03/16,Frosinone,Udinese,2.0,0.0,H,2.9,3.3,2.3,2016-03-06,2015/2016,31,I1,2-0,2.0,0.6000000000000001,2016-03-06FrosinoneUdinese
06/03/16,Genoa,Empoli,1.0,0.0,H,2.0,3.3,3.6,2016-03-06,2015/2016,31,I1,1-0,1.0,-1.6,2016-03-06GenoaEmpoli
06/03/16,Inter,Palermo,3.0,1.0,H,1.3,5.0,9.0,2016-03-06,2015/2016,31,I1,3-1,2.0,-7.7,2016-03-06InterPalermo
06/03/16,Sassuolo,Milan,2.0,0.0,H,3.0,3.2,2.3,2016-03-06,2015/2016,31,I1,2-0,2.0,0.7000000000000002,2016-03-06SassuoloMilan
06/03/16,Torino,Lazio,1.0,1.0,D,2.5,3.1,2.8,2016-03-06,2015/2016,32,I1,1-1,0.0,-0.2999999999999998,2016-03-06TorinoLazio
11/03/16,Juventus,Sassuolo,1.0,0.0,H,1.37,4.6,7.5,2016-03-11,2015/2016,32,I1,1-0,1.0,-6.13,2016-03-11JuventusSassuolo
12/03/16,Empoli,Sampdoria,1.0,1.0,D,2.3,3.1,3.1,2016-03-12,2015/2016,32,I1,1-1,0.0,-0.8000000000000003,2016-03-12EmpoliSampdoria
12/03/16,Inter,Bologna,2.0,1.0,H,1.5,4.0,6.1,2016-03-12,2015/2016,32,I1,2-1,1.0,-4.6,2016-03-12InterBologna
13/03/16,Carpi,Frosinone,2.0,1.0,H,2.0,3.3,3.6,2016-03-13,2015/2016,32,I1,2-1,1.0,-1.6,2016-03-13CarpiFrosinone
13/03/16,Chievo,Milan,0.0,0.0,D,3.6,3.3,2.0,2016-03-13,2015/2016,32,I1,0-0,0.0,1.6,2016-03-13ChievoMilan
13/03/16,Fiorentina,Verona,1.0,1.0,D,1.3,5.0,9.0,2016-03-13,2015/2016,32,I1,1-1,0.0,-7.7,2016-03-13FiorentinaVerona
13/03/16,Genoa,Torino,3.0,2.0,H,2.6,3.0,2.75,2016-03-13,2015/2016,32,I1,3-2,1.0,-0.1499999999999999,2016-03-13GenoaTorino
13/03/16,Lazio,Atalanta,2.0,0.0,H,1.65,3.6,5.1,2016-03-13,2015/2016,32,I1,2-0,2.0,-3.4499999999999997,2016-03-13LazioAtalanta
13/03/16,Palermo,Napoli,0.0,1.0,A,7.6,4.8,1.35,2016-03-13,2015/2016,33,I1,0-1,-1.0,6.25,2016-03-13PalermoNapoli
13/03/16,Udinese,Roma,1.0,2.0,A,4.2,3.5,1.8,2016-03-13,2015/2016,33,I1,1-2,-1.0,2.4000000000000004,2016-03-13UdineseRoma
19/03/16,Empoli,Palermo,0.0,0.0,D,1.8,3.5,4.2,2016-03-19,2015/2016,33,I1,0-0,0.0,-2.4000000000000004,2016-03-19EmpoliPalermo
19/03/16,Roma,Inter,1.0,1.0,D,1.8,3.5,4.2,2016-03-19,2015/2016,33,I1,1-1,0.0,-2.4000000000000004,2016-03-19RomaInter
20/03/16,Atalanta,Bologna,2.0,0.0,H,2.1,3.1,3.5,2016-03-20,2015/2016,33,I1,2-0,2.0,-1.4,2016-03-20AtalantaBologna
20/03/16,Frosinone,Fiorentina,0.0,0.0,D,5.5,4.0,1.55,2016-03-20,2015/2016,33,I1,0-0,0.0,3.95,2016-03-20FrosinoneFiorentina
20/03/16,Milan,Lazio,1.0,1.0,D,2.0,3.3,3.6,2016-03-20,2015/2016,33,I1,1-1,0.0,-1.6,2016-03-20MilanLazio
20/03/16,Napoli,Genoa,3.0,1.0,H,1.25,5.5,10.3,2016-03-20,2015/2016,33,I1,3-1,2.0,-9.05,2016-03-20NapoliGenoa
20/03/16,Sampdoria,Chievo,0.0,1.0,A,1.9,3.3,4.0,2016-03-20,2015/2016,33,I1,0-1,-1.0,-2.1,2016-03-20SampdoriaChievo
20/03/16,Sassuolo,Udinese,1.0,1.0,D,1.9,3.3,4.0,2016-03-20,2015/2016,34,I1,1-1,0.0,-2.1,2016-03-20SassuoloUdinese
20/03/16,Torino,Juventus,1.0,4.0,A,4.4,3.4,1.8,2016-03-20,2015/2016,34,I1,1-4,-3.0,2.6000000000000005,2016-03-20TorinoJuventus
20/03/16,Verona,Carpi,1.0,2.0,A,2.3,3.2,3.0,2016-03-20,2015/2016,34,I1,1-2,-1.0,-0.7000000000000002,2016-03-20VeronaCarpi
02/04/16,Carpi,Sassuolo,1.0,3.0,A,2.6,3.2,2.6,2016-04-02,2015/2016,34,I1,1-3,-2.0,0.0,2016-04-02CarpiSassuolo
02/04/16,Juventus,Empoli,1.0,0.0,H,1.2,5.8,13.0,2016-04-02,2015/2016,34,I1,1-0,1.0,-11.8,2016-04-02JuventusEmpoli
03/04/16,Atalanta,Milan,2.0,1.0,H,3.2,3.2,2.2,2016-04-03,2015/2016,34,I1,2-1,1.0,1.0,2016-04-03AtalantaMilan
03/04/16,Chievo,Palermo,3.0,1.0,H,2.3,3.2,3.0,2016-04-03,2015/2016,34,I1,3-1,2.0,-0.7000000000000002,2016-04-03ChievoPalermo
03/04/16,Fiorentina,Sampdoria,1.0,1.0,D,1.6,3.7,5.4,2016-04-03,2015/2016,34,I1,1-1,0.0,-3.8000000000000003,2016-04-03FiorentinaSampdoria
03/04/16,Genoa,Frosinone,4.0,0.0,H,1.55,3.9,5.6,2016-04-03,2015/2016,34,I1,4-0,4.0,-4.05,2016-04-03GenoaFrosinone
03/04/16,Inter,Torino,1.0,2.0,A,1.7,3.6,4.7,2016-04-03,2015/2016,35,I1,1-2,-1.0,-3.0,2016-04-03InterTorino
03/04/16,Lazio,Roma,1.0,4.0,A,3.2,3.2,2.2,2016-04-03,2015/2016,35,I1,1-4,-3.0,1.0,2016-04-03LazioRoma
03/04/16,Udinese,Napoli,3.0,1.0,H,7.0,4.0,1.45,2016-04-03,2015/2016,35,I1,3-1,2.0,5.55,2016-04-03UdineseNapoli
04/04/16,Bologna,Verona,0.0,1.0,A,2.0,3.3,3.6,2016-04-04,2015/2016,35,I1,0-1,-1.0,-1.6,2016-04-04BolognaVerona
09/04/16,Chievo,Carpi,1.0,0.0,H,2.3,3.1,3.1,2016-04-09,2015/2016,35,I1,1-0,1.0,-0.8000000000000003,2016-04-09ChievoCarpi
09/04/16,Frosinone,Inter,0.0,1.0,A,5.5,4.0,1.55,2016-04-09,2015/2016,35,I1,0-1,-1.0,3.95,2016-04-09FrosinoneInter
09/04/16,Milan,Juventus,1.0,2.0,A,3.6,3.3,2.0,2016-04-09,2015/2016,35,I1,1-2,-1.0,1.6,2016-04-09MilanJuventus
09/04/16,Sassuolo,Genoa,0.0,1.0,A,2.1,3.2,3.4,2016-04-09,2015/2016,35,I1,0-1,-1.0,-1.2999999999999998,2016-04-09SassuoloGenoa
10/04/16,Empoli,Fiorentina,2.0,0.0,H,2.85,3.2,2.4,2016-04-10,2015/2016,35,I1,2-0,2.0,0.4500000000000002,2016-04-10EmpoliFiorentina
10/04/16,Napoli,Verona,3.0,0.0,H,1.22,5.5,12.0,2016-04-10,2015/2016,36,I1,3-0,3.0,-10.78,2016-04-10NapoliVerona
10/04/16,Palermo,Lazio,0.0,3.0,A,2.9,3.3,2.3,2016-04-10,2015/2016,36,I1,0-3,-3.0,0.6000000000000001,2016-04-10PalermoLazio
10/04/16,Sampdoria,Udinese,2.0,0.0,H,2.1,3.1,3.5,2016-04-10,2015/2016,36,I1,2-0,2.0,-1.4,2016-04-10SampdoriaUdinese
10/04/16,Torino,Atalanta,2.0,1.0,H,1.9,3.3,4.0,2016-04-10,2015/2016,36,I1,2-1,1.0,-2.1,2016-04-10TorinoAtalanta
11/04/16,Roma,Bologna,1.0,1.0,D,1.35,4.8,7.6,2016-04-11,2015/2016,36,I1,1-1,0.0,-6.25,2016-04-11RomaBologna
16/04/16,Bologna,Torino,0.0,1.0,A,2.75,3.0,2.65,2016-04-16,2015/2016,36,I1,0-1,-1.0,0.10000000000000009,2016-04-16BolognaTorino
16/04/16,Carpi,Genoa,4.0,1.0,H,2.4,3.2,2.85,2016-04-16,2015/2016,36,I1,4-1,3.0,-0.4500000000000002,2016-04-16CarpiGenoa
16/04/16,Inter,Napoli,2.0,0.0,H,2.75,3.2,2.5,2016-04-16,2015/2016,36,I1,2-0,2.0,0.25,2016-04-16InterNapoli
17/04/16,Atalanta,Roma,3.0,3.0,D,4.5,3.5,1.75,2016-04-17,2015/2016,36,I1,3-3,0.0,2.75,2016-04-17AtalantaRoma
17/04/16,Fiorentina,Sassuolo,3.0,1.0,H,1.8,3.5,4.2,2016-04-17,2015/2016,37,I1,3-1,2.0,-2.4000000000000004,2016-04-17FiorentinaSassuolo
17/04/16,Juventus,Palermo,4.0,0.0,H,1.15,7.0,15.0,2016-04-17,2015/2016,37,I1,4-0,4.0,-13.85,2016-04-17JuventusPalermo
17/04/16,Lazio,Empoli,2.0,0.0,H,1.7,3.6,4.7,2016-04-17,2015/2016,37,I1,2-0,2.0,-3.0,2016-04-17LazioEmpoli
17/04/16,Sampdoria,Milan,0.0,1.0,A,2.85,3.2,2.4,2016-04-17,2015/2016,37,I1,0-1,-1.0,0.4500000000000002,2016-04-17SampdoriaMilan
17/04/16,Udinese,Chievo,0.0,0.0,D,1.9,3.45,3.8,2016-04-17,2015/2016,37,I1,0-0,0.0,-1.9,2016-04-17UdineseChievo
17/04/16,Verona,Frosinone,1.0,2.0,A,1.85,3.45,4.0,2016-04-17,2015/2016,37,I1,1-2,-1.0,-2.15,2016-04-17VeronaFrosinone
19/04/16,Napoli,Bologna,6.0,0.0,H,1.22,5.5,12.0,2016-04-19,2015/2016,37,I1,6-0,6.0,-10.78,2016-04-19NapoliBologna
20/04/16,Chievo,Frosinone,5.0,1.0,H,1.9,3.45,3.8,2016-04-20,2015/2016,37,I1,5-1,4.0,-1.9,2016-04-20ChievoFrosinone
20/04/16,Empoli,Verona,1.0,0.0,H,1.85,3.45,4.0,2016-04-20,2015/2016,37,I1,1-0,1.0,-2.15,2016-04-20EmpoliVerona
20/04/16,Genoa,Inter,1.0,0.0,H,3.1,3.3,2.2,2016-04-20,2015/2016,38,I1,1-0,1.0,0.8999999999999999,2016-04-20GenoaInter
20/04/16,Juventus,Lazio,3.0,0.0,H,1.5,4.0,6.1,2016-04-20,2015/2016,38,I1,3-0,3.0,-4.6,2016-04-20JuventusLazio
20/04/16,Palermo,Atalanta,2.0,2.0,D,2.5,3.3,2.65,2016-04-20,2015/2016,38,I1,2-2,0.0,-0.1499999999999999,2016-04-20PalermoAtalanta
20/04/16,Roma,Torino,3.0,2.0,H,1.5,4.0,6.1,2016-04-20,2015/2016,38,I1,3-2,1.0,-4.6,2016-04-20RomaTorino
20/04/16,Sassuolo,Sampdoria,0.0,0.0,D,2.0,3.3,3.6,2016-04-20,2015/2016,38,I1,0-0,0.0,-1.6,2016-04-20SassuoloSampdoria
20/04/16,Udinese,Fiorentina,2.0,1.0,H,3.1,3.3,2.2,2016-04-20,2015/2016,38,I1,2-1,1.0,0.8999999999999999,2016-04-20UdineseFiorentina
21/04/16,Milan,Carpi,0.0,0.0,D,1.45,4.0,7.0,2016-04-21,2015/2016,38,I1,0-0,0.0,-5.55,2016-04-21MilanCarpi
23/04/16,Inter,Udinese,3.0,1.0,H,1.45,4.0,7.0,2016-04-23,2015/2016,38,I1,3-1,2.0,-5.55,2016-04-23InterUdinese
24/04/16,Atalanta,Chievo,1.0,0.0,H,2.0,3.2,3.7,2016-04-24,2015/2016,38,I1,1-0,1.0,-1.7000000000000002,2016-04-24AtalantaChievo
24/04/16,Bologna,Genoa,2.0,0.0,H,2.1,3.2,3.4,2016-04-24,2015/2016,39,I1,2-0,2.0,-1.2999999999999998,2016-04-24BolognaGenoa
24/04/16,Fiorentina,Juventus,1.0,2.0,A,3.8,3.45,1.9,2016-04-24,2015/2016,39,I1,1-2,-1.0,1.9,2016-04-24FiorentinaJuventus
24/04/16,Frosinone,Palermo,0.0,2.0,A,2.4,3.3,2.75,2016-04-24,2015/2016,39,I1,0-2,-2.0,-0.3500000000000001,2016-04-24FrosinonePalermo
24/04/16,Sampdoria,Lazio,2.0,1.0,H,2.5,3.3,2.65,2016-04-24,2015/2016,39,I1,2-1,1.0,-0.1499999999999999,2016-04-24SampdoriaLazio
24/04/16,Torino,Sassuolo,1.0,3.0,A,2.0,3.3,3.6,2016-04-24,2015/2016,39,I1,1-3,-2.0,-1.6,2016-04-24TorinoSassuolo
25/04/16,Carpi,Empoli,1.0,0.0,H,1.8,3.5,4.2,2016-04-25,2015/2016,39,I1,1-0,1.0,-2.4000000000000004,2016-04-25CarpiEmpoli
25/04/16,Roma,Napoli,1.0,0.0,H,2.5,3.3,2.65,2016-04-25,2015/2016,39,I1,1-0,1.0,-0.1499999999999999,2016-04-25RomaNapoli
25/04/16,Verona,Milan,2.0,1.0,H,5.0,3.9,1.6,2016-04-25,2015/2016,39,I1,2-1,1.0,3.4,2016-04-25VeronaMilan
30/04/16,Chievo,Fiorentina,0.0,0.0,D,3.1,3.3,2.2,2016-04-30,2015/2016,39,I1,0-0,0.0,0.8999999999999999,2016-04-30ChievoFiorentina
30/04/16,Udinese,Torino,1.0,5.0,A,1.9,3.45,3.8,2016-04-30,2015/2016,40,I1,1-5,-4.0,-1.9,2016-04-30UdineseTorino
01/05/16,Empoli,Bologna,0.0,0.0,D,2.3,3.3,2.9,2016-05-01,2015/2016,40,I1,0-0,0.0,-0.6000000000000001,2016-05-01EmpoliBologna
01/05/16,Juventus,Carpi,2.0,0.0,H,1.35,4.8,7.6,2016-05-01,2015/2016,40,I1,2-0,2.0,-6.25,2016-05-01JuventusCarpi
01/05/16,Lazio,Inter,2.0,0.0,H,2.5,3.3,2.65,2016-05-01,2015/2016,40,I1,2-0,2.0,-0.1499999999999999,2016-05-01LazioInter
01/05/16,Milan,Frosinone,3.0,3.0,D,1.3,5.5,8.0,2016-05-01,2015/2016,40,I1,3-3,0.0,-6.7,2016-05-01MilanFrosinone
01/05/16,Palermo,Sampdoria,2.0,0.0,H,1.9,3.45,3.8,2016-05-01,2015/2016,40,I1,2-0,2.0,-1.9,2016-05-01PalermoSampdoria
01/05/16,Sassuolo,Verona,1.0,0.0,H,1.55,4.0,5.5,2016-05-01,2015/2016,40,I1,1-0,1.0,-3.95,2016-05-01SassuoloVerona
02/05/16,Genoa,Roma,2.0,3.0,A,4.7,3.6,1.7,2016-05-02,2015/2016,40,I1,2-3,-1.0,3.0,2016-05-02GenoaRoma
02/05/16,Napoli,Atalanta,2.0,1.0,H,1.17,6.5,14.0,2016-05-02,2015/2016,40,I1,2-1,1.0,-12.83,2016-05-02NapoliAtalanta
07/05/16,Bologna,Milan,0.0,1.0,A,3.6,3.3,2.0,2016-05-07,2015/2016,41,I1,0-1,-1.0,1.6,2016-05-07BolognaMilan
07/05/16,Inter,Empoli,2.0,1.0,H,1.37,4.6,7.5,2016-05-07,2015/2016,41,I1,2-1,1.0,-6.13,2016-05-07InterEmpoli
08/05/16,Atalanta,Udinese,1.0,1.0,D,3.3,3.3,2.1,2016-05-08,2015/2016,41,I1,1-1,0.0,1.1999999999999997,2016-05-08AtalantaUdinese
08/05/16,Carpi,Lazio,1.0,3.0,A,2.3,3.4,2.8,2016-05-08,2015/2016,41,I1,1-3,-2.0,-0.5,2016-05-08CarpiLazio
08/05/16,Fiorentina,Palermo,0.0,0.0,D,1.9,3.5,3.7,2016-05-08,2015/2016,41,I1,0-0,0.0,-1.8000000000000003,2016-05-08FiorentinaPalermo
08/05/16,Frosinone,Sassuolo,0.0,1.0,A,3.4,3.5,2.0,2016-05-08,2015/2016,41,I1,0-1,-1.0,1.4,2016-05-08FrosinoneSassuolo
08/05/16,Roma,Chievo,3.0,0.0,H,1.22,6.0,10.5,2016-05-08,2015/2016,41,I1,3-0,3.0,-9.28,2016-05-08RomaChievo
08/05/16,Sampdoria,Genoa,0.0,3.0,A,2.3,3.3,2.9,2016-05-08,2015/2016,41,I1,0-3,-3.0,-0.6000000000000001,2016-05-08SampdoriaGenoa
08/05/16,Torino,Napoli,1.0,2.0,A,6.8,4.6,1.4,2016-05-08,2015/2016,41,I1,1-2,-1.0,5.4,2016-05-08TorinoNapoli
08/05/16,Verona,Juventus,2.0,1.0,H,7.0,4.0,1.45,2016-05-08,2015/2016,42,I1,2-1,1.0,5.55,2016-05-08VeronaJuventus
14/05/16,Juventus,Sampdoria,5.0,0.0,H,1.35,4.8,7.6,2016-05-14,2015/2016,42,I1,5-0,5.0,-6.25,2016-05-14JuventusSampdoria
14/05/16,Milan,Roma,1.0,3.0,A,2.8,3.4,2.3,2016-05-14,2015/2016,42,I1,1-3,-2.0,0.5,2016-05-14MilanRoma
14/05/16,Napoli,Frosinone,4.0,0.0,H,1.1,8.0,20.0,2016-05-14,2015/2016,42,I1,4-0,4.0,-18.9,2016-05-14NapoliFrosinone
14/05/16,Sassuolo,Inter,3.0,1.0,H,1.85,3.6,3.8,2016-05-14,2015/2016,42,I1,3-1,2.0,-1.9499999999999997,2016-05-14SassuoloInter
15/05/16,Chievo,Bologna,0.0,0.0,D,2.2,3.2,3.2,2016-05-15,2015/2016,42,I1,0-0,0.0,-1.0,2016-05-15ChievoBologna
15/05/16,Empoli,Torino,2.0,1.0,H,2.3,3.2,3.0,2016-05-15,2015/2016,42,I1,2-1,1.0,-0.7000000000000002,2016-05-15EmpoliTorino
15/05/16,Genoa,Atalanta,1.0,2.0,A,1.9,3.45,3.8,2016-05-15,2015/2016,42,I1,1-2,-1.0,-1.9,2016-05-15GenoaAtalanta
15/05/16,Lazio,Fiorentina,2.0,4.0,A,2.1,3.3,3.3,2016-05-15,2015/2016,42,I1,2-4,-2.0,-1.1999999999999997,2016-05-15LazioFiorentina
