Date,HomeTeam,AwayTeam,FTHG,FTAG,FTR,IWH,IWD,IWA,datetime,season,game_day,league,result,goal_diff,odds_diff,game_id
20/08/16,Juventus,Fiorentina,2,1,H,1.5,4.0,6.1,2016-08-20,2016/2017,1,I1,2-1,1,-4.6,2016-08-20JuventusFiorentina
20/08/16,Roma,Udinese,4,0,H,1.45,4.0,7.0,2016-08-20,2016/2017,1,I1,4-0,4,-5.55,2016-08-20RomaUdinese
21/08/16,Atalanta,Lazio,3,4,A,2.85,3.2,2.4,2016-08-21,2016/2017,1,I1,3-4,-1,0.4500000000000002,2016-08-21AtalantaLazio
21/08/16,Bologna,Crotone,1,0,H,1.9,3.3,4.0,2016-08-21,2016/2017,1,I1,1-0,1,-2.1,2016-08-21BolognaCrotone
21/08/16,Chievo,Inter,2,0,H,3.3,3.3,2.1,2016-08-21,2016/2017,1,I1,2-0,2,1.1999999999999997,2016-08-21ChievoInter
21/08/16,Empoli,Sampdoria,0,1,A,2.4,3.1,2.95,2016-08-21,2016/2017,1,I1,0-1,-1,-0.5500000000000003,2016-08-21EmpoliSampdoria
21/08/16,Genoa,Cagliari,3,1,H,2.0,3.3,3.6,2016-08-21,2016/2017,1,I1,3-1,2,-1.6,2016-08-21GenoaCagliari
21/08/16,Milan,Torino,3,2,H,1.85,3.3,4.3,2016-08-21,2016/2017,1,I1,3-2,1,-2.4499999999999997,2016-08-21MilanTorino
21/08/16,Palermo,Sassuolo,0,1,A,2.7,3.1,2.6,2016-08-21,2016/2017,1,I1,0-1,-1,0.10000000000000009,2016-08-21PalermoSassuolo
21/08/16,Pescara,Napoli,2,2,D,7.0,4.0,1.45,2016-08-21,2016/2017,2,I1,2-2,0,5.55,2016-08-21PescaraNapoli
27/08/16,Lazio,Juventus,0,1,A,4.2,3.5,1.8,2016-08-27,2016/2017,2,I1,0-1,-1,2.4000000000000004,2016-08-27LazioJuventus
27/08/16,Napoli,Milan,4,2,H,1.65,3.6,5.1,2016-08-27,2016/2017,2,I1,4-2,2,-3.4499999999999997,2016-08-27NapoliMilan
28/08/16,Cagliari,Roma,2,2,D,3.8,3.45,1.9,2016-08-28,2016/2017,2,I1,2-2,0,1.9,2016-08-28CagliariRoma
28/08/16,Crotone,Genoa,1,3,A,3.6,3.3,2.0,2016-08-28,2016/2017,2,I1,1-3,-2,1.6,2016-08-28CrotoneGenoa
28/08/16,Fiorentina,Chievo,1,0,H,1.65,3.6,5.1,2016-08-28,2016/2017,2,I1,1-0,1,-3.4499999999999997,2016-08-28FiorentinaChievo
28/08/16,Inter,Palermo,1,1,D,1.35,4.8,7.6,2016-08-28,2016/2017,2,I1,1-1,0,-6.25,2016-08-28InterPalermo
28/08/16,Sampdoria,Atalanta,2,1,H,2.1,3.2,3.4,2016-08-28,2016/2017,2,I1,2-1,1,-1.2999999999999998,2016-08-28SampdoriaAtalanta
28/08/16,Sassuolo,Pescara,0,3,A,1.6,3.7,5.4,2016-08-28,2016/2017,2,I1,0-3,-3,-3.8000000000000003,2016-08-28SassuoloPescara
28/08/16,Torino,Bologna,5,1,H,1.8,3.4,4.4,2016-08-28,2016/2017,3,I1,5-1,4,-2.6000000000000005,2016-08-28TorinoBologna
28/08/16,Udinese,Empoli,2,0,H,2.1,3.2,3.4,2016-08-28,2016/2017,3,I1,2-0,2,-1.2999999999999998,2016-08-28UdineseEmpoli
10/09/16,Juventus,Sassuolo,3,1,H,1.35,4.8,7.6,2016-09-10,2016/2017,3,I1,3-1,2,-6.25,2016-09-10JuventusSassuolo
10/09/16,Palermo,Napoli,0,3,A,7.3,4.4,1.4,2016-09-10,2016/2017,3,I1,0-3,-3,5.9,2016-09-10PalermoNapoli
11/09/16,Atalanta,Torino,2,1,H,2.6,3.2,2.6,2016-09-11,2016/2017,3,I1,2-1,1,0.0,2016-09-11AtalantaTorino
11/09/16,Bologna,Cagliari,2,1,H,2.1,3.3,3.3,2016-09-11,2016/2017,3,I1,2-1,1,-1.1999999999999997,2016-09-11BolognaCagliari
11/09/16,Chievo,Lazio,1,1,D,2.6,3.2,2.6,2016-09-11,2016/2017,3,I1,1-1,0,0.0,2016-09-11ChievoLazio
11/09/16,Milan,Udinese,0,1,A,1.65,3.6,5.1,2016-09-11,2016/2017,3,I1,0-1,-1,-3.4499999999999997,2016-09-11MilanUdinese
11/09/16,Pescara,Inter,1,2,A,4.5,3.5,1.75,2016-09-11,2016/2017,3,I1,1-2,-1,2.75,2016-09-11PescaraInter
11/09/16,Roma,Sampdoria,3,2,H,1.4,4.4,7.3,2016-09-11,2016/2017,4,I1,3-2,1,-5.9,2016-09-11RomaSampdoria
12/09/16,Empoli,Crotone,2,1,H,1.6,3.7,5.4,2016-09-12,2016/2017,4,I1,2-1,1,-3.8000000000000003,2016-09-12EmpoliCrotone
16/09/16,Sampdoria,Milan,0,1,A,2.75,3.3,2.4,2016-09-16,2016/2017,4,I1,0-1,-1,0.3500000000000001,2016-09-16SampdoriaMilan
17/09/16,Lazio,Pescara,3,0,H,1.5,4.0,6.1,2016-09-17,2016/2017,4,I1,3-0,3,-4.6,2016-09-17LazioPescara
17/09/16,Napoli,Bologna,3,1,H,1.3,5.0,9.0,2016-09-17,2016/2017,4,I1,3-1,2,-7.7,2016-09-17NapoliBologna
18/09/16,Cagliari,Atalanta,3,0,H,2.4,3.2,2.85,2016-09-18,2016/2017,4,I1,3-0,3,-0.4500000000000002,2016-09-18CagliariAtalanta
18/09/16,Crotone,Palermo,1,1,D,2.65,3.3,2.5,2016-09-18,2016/2017,4,I1,1-1,0,0.1499999999999999,2016-09-18CrotonePalermo
18/09/16,Fiorentina,Roma,1,0,H,2.6,3.2,2.6,2016-09-18,2016/2017,4,I1,1-0,1,0.0,2016-09-18FiorentinaRoma
18/09/16,Inter,Juventus,2,1,H,3.6,3.3,2.0,2016-09-18,2016/2017,4,I1,2-1,1,1.6,2016-09-18InterJuventus
18/09/16,Sassuolo,Genoa,2,0,H,2.4,3.3,2.75,2016-09-18,2016/2017,5,I1,2-0,2,-0.3500000000000001,2016-09-18SassuoloGenoa
18/09/16,Torino,Empoli,0,0,D,1.8,3.5,4.2,2016-09-18,2016/2017,5,I1,0-0,0,-2.4000000000000004,2016-09-18TorinoEmpoli
18/09/16,Udinese,Chievo,1,2,A,2.1,3.2,3.4,2016-09-18,2016/2017,5,I1,1-2,-1,-1.2999999999999998,2016-09-18UdineseChievo
20/09/16,Milan,Lazio,2,0,H,2.2,3.2,3.2,2016-09-20,2016/2017,5,I1,2-0,2,-1.0,2016-09-20MilanLazio
21/09/16,Atalanta,Palermo,0,1,A,1.65,3.6,5.1,2016-09-21,2016/2017,5,I1,0-1,-1,-3.4499999999999997,2016-09-21AtalantaPalermo
21/09/16,Bologna,Sampdoria,2,0,H,2.3,3.2,3.0,2016-09-21,2016/2017,5,I1,2-0,2,-0.7000000000000002,2016-09-21BolognaSampdoria
21/09/16,Chievo,Sassuolo,2,1,H,2.5,3.2,2.75,2016-09-21,2016/2017,5,I1,2-1,1,-0.25,2016-09-21ChievoSassuolo
21/09/16,Empoli,Inter,0,2,A,3.6,3.3,2.0,2016-09-21,2016/2017,5,I1,0-2,-2,1.6,2016-09-21EmpoliInter
21/09/16,Genoa,Napoli,0,0,D,4.5,3.5,1.75,2016-09-21,2016/2017,5,I1,0-0,0,2.75,2016-09-21GenoaNapoli
21/09/16,Juventus,Cagliari,4,0,H,1.15,7.0,15.0,2016-09-21,2016/2017,6,I1,4-0,4,-13.85,2016-09-21JuventusCagliari
21/09/16,Pescara,Torino,0,0,D,2.9,3.3,2.3,2016-09-21,2016/2017,6,I1,0-0,0,0.6000000000000001,2016-09-21PescaraTorino
21/09/16,Roma,Crotone,4,0,H,1.15,7.0,15.0,2016-09-21,2016/2017,6,I1,4-0,4,-13.85,2016-09-21RomaCrotone
21/09/16,Udinese,Fiorentina,2,2,D,2.85,3.2,2.4,2016-09-21,2016/2017,6,I1,2-2,0,0.4500000000000002,2016-09-21UdineseFiorentina
24/09/16,Napoli,Chievo,2,0,H,1.35,4.8,7.6,2016-09-24,2016/2017,6,I1,2-0,2,-6.25,2016-09-24NapoliChievo
24/09/16,Palermo,Juventus,0,1,A,7.6,4.8,1.35,2016-09-24,2016/2017,6,I1,0-1,-1,6.25,2016-09-24PalermoJuventus
25/09/16,Fiorentina,Milan,0,0,D,2.4,3.2,2.85,2016-09-25,2016/2017,6,I1,0-0,0,-0.4500000000000002,2016-09-25FiorentinaMilan
25/09/16,Genoa,Pescara,1,1,D,1.55,3.9,5.6,2016-09-25,2016/2017,6,I1,1-1,0,-4.05,2016-09-25GenoaPescara
25/09/16,Inter,Bologna,1,1,D,1.5,4.0,6.1,2016-09-25,2016/2017,6,I1,1-1,0,-4.6,2016-09-25InterBologna
25/09/16,Lazio,Empoli,2,0,H,1.55,3.9,5.6,2016-09-25,2016/2017,7,I1,2-0,2,-4.05,2016-09-25LazioEmpoli
25/09/16,Sassuolo,Udinese,1,0,H,2.2,3.3,3.1,2016-09-25,2016/2017,7,I1,1-0,1,-0.8999999999999999,2016-09-25SassuoloUdinese
25/09/16,Torino,Roma,3,1,H,3.3,3.3,2.1,2016-09-25,2016/2017,7,I1,3-1,2,1.1999999999999997,2016-09-25TorinoRoma
26/09/16,Cagliari,Sampdoria,2,1,H,2.3,3.3,2.9,2016-09-26,2016/2017,7,I1,2-1,1,-0.6000000000000001,2016-09-26CagliariSampdoria
26/09/16,Crotone,Atalanta,1,3,A,3.6,3.3,2.0,2016-09-26,2016/2017,7,I1,1-3,-2,1.6,2016-09-26CrotoneAtalanta
01/10/16,Pescara,Chievo,0,2,A,2.6,3.2,2.6,2016-10-01,2016/2017,7,I1,0-2,-2,0.0,2016-10-01PescaraChievo
01/10/16,Udinese,Lazio,0,3,A,2.75,3.3,2.4,2016-10-01,2016/2017,7,I1,0-3,-3,0.3500000000000001,2016-10-01UdineseLazio
02/10/16,Atalanta,Napoli,1,0,H,5.4,3.7,1.6,2016-10-02,2016/2017,7,I1,1-0,1,3.8000000000000003,2016-10-02AtalantaNapoli
02/10/16,Bologna,Genoa,0,1,A,2.2,3.2,3.2,2016-10-02,2016/2017,7,I1,0-1,-1,-1.0,2016-10-02BolognaGenoa
02/10/16,Cagliari,Crotone,2,1,H,1.55,4.0,5.5,2016-10-02,2016/2017,8,I1,2-1,1,-3.95,2016-10-02CagliariCrotone
02/10/16,Empoli,Juventus,0,3,A,7.6,4.8,1.35,2016-10-02,2016/2017,8,I1,0-3,-3,6.25,2016-10-02EmpoliJuventus
02/10/16,Milan,Sassuolo,4,3,H,1.7,3.6,4.7,2016-10-02,2016/2017,8,I1,4-3,1,-3.0,2016-10-02MilanSassuolo
02/10/16,Roma,Inter,2,1,H,2.1,3.2,3.4,2016-10-02,2016/2017,8,I1,2-1,1,-1.2999999999999998,2016-10-02RomaInter
02/10/16,Sampdoria,Palermo,1,1,D,1.7,3.6,4.7,2016-10-02,2016/2017,8,I1,1-1,0,-3.0,2016-10-02SampdoriaPalermo
02/10/16,Torino,Fiorentina,2,1,H,2.5,3.1,2.8,2016-10-02,2016/2017,8,I1,2-1,1,-0.2999999999999998,2016-10-02TorinoFiorentina
15/10/16,Juventus,Udinese,2,1,H,1.2,5.8,13.0,2016-10-15,2016/2017,8,I1,2-1,1,-11.8,2016-10-15JuventusUdinese
15/10/16,Napoli,Roma,1,3,A,2.0,3.3,3.6,2016-10-15,2016/2017,8,I1,1-3,-2,-1.6,2016-10-15NapoliRoma
15/10/16,Pescara,Sampdoria,1,1,D,2.6,3.2,2.6,2016-10-15,2016/2017,8,I1,1-1,0,0.0,2016-10-15PescaraSampdoria
16/10/16,Chievo,Milan,1,3,A,2.9,3.15,2.4,2016-10-16,2016/2017,9,I1,1-3,-2,0.5,2016-10-16ChievoMilan
16/10/16,Fiorentina,Atalanta,0,0,D,1.7,3.6,4.7,2016-10-16,2016/2017,9,I1,0-0,0,-3.0,2016-10-16FiorentinaAtalanta
16/10/16,Genoa,Empoli,0,0,D,1.75,3.5,4.5,2016-10-16,2016/2017,9,I1,0-0,0,-2.75,2016-10-16GenoaEmpoli
16/10/16,Inter,Cagliari,1,2,A,1.45,4.0,7.0,2016-10-16,2016/2017,9,I1,1-2,-1,-5.55,2016-10-16InterCagliari
16/10/16,Lazio,Bologna,1,1,D,1.55,3.9,5.6,2016-10-16,2016/2017,9,I1,1-1,0,-4.05,2016-10-16LazioBologna
16/10/16,Sassuolo,Crotone,2,1,H,1.45,4.0,7.0,2016-10-16,2016/2017,9,I1,2-1,1,-5.55,2016-10-16SassuoloCrotone
17/10/16,Palermo,Torino,1,4,A,3.8,3.45,1.9,2016-10-17,2016/2017,9,I1,1-4,-3,1.9,2016-10-17PalermoTorino
22/10/16,Milan,Juventus,1,0,H,4.0,3.45,1.85,2016-10-22,2016/2017,9,I1,1-0,1,2.15,2016-10-22MilanJuventus
22/10/16,Sampdoria,Genoa,2,1,H,2.8,3.1,2.5,2016-10-22,2016/2017,9,I1,2-1,1,0.2999999999999998,2016-10-22SampdoriaGenoa
23/10/16,Atalanta,Inter,2,1,H,3.0,3.2,2.3,2016-10-23,2016/2017,10,I1,2-1,1,0.7000000000000002,2016-10-23AtalantaInter
23/10/16,Bologna,Sassuolo,1,1,D,2.4,3.3,2.75,2016-10-23,2016/2017,10,I1,1-1,0,-0.3500000000000001,2016-10-23BolognaSassuolo
23/10/16,Cagliari,Fiorentina,3,5,A,2.85,3.2,2.4,2016-10-23,2016/2017,10,I1,3-5,-2,0.4500000000000002,2016-10-23CagliariFiorentina
23/10/16,Crotone,Napoli,1,2,A,12.0,5.5,1.22,2016-10-23,2016/2017,10,I1,1-2,-1,10.78,2016-10-23CrotoneNapoli
23/10/16,Empoli,Chievo,0,0,D,2.5,3.2,2.75,2016-10-23,2016/2017,10,I1,0-0,0,-0.25,2016-10-23EmpoliChievo
23/10/16,Roma,Palermo,4,1,H,1.22,5.5,12.0,2016-10-23,2016/2017,10,I1,4-1,3,-10.78,2016-10-23RomaPalermo
23/10/16,Torino,Lazio,2,2,D,2.4,3.2,2.85,2016-10-23,2016/2017,10,I1,2-2,0,-0.4500000000000002,2016-10-23TorinoLazio
23/10/16,Udinese,Pescara,3,1,H,1.8,3.5,4.2,2016-10-23,2016/2017,10,I1,3-1,2,-2.4000000000000004,2016-10-23UdinesePescara
25/10/16,Genoa,Milan,3,0,H,2.85,3.2,2.4,2016-10-25,2016/2017,10,I1,3-0,3,0.4500000000000002,2016-10-25GenoaMilan
26/10/16,Chievo,Bologna,1,1,D,2.1,3.1,3.6,2016-10-26,2016/2017,11,I1,1-1,0,-1.5,2016-10-26ChievoBologna
26/10/16,Fiorentina,Crotone,1,1,D,1.2,6.0,12.5,2016-10-26,2016/2017,11,I1,1-1,0,-11.3,2016-10-26FiorentinaCrotone
26/10/16,Inter,Torino,2,1,H,2.0,3.3,3.6,2016-10-26,2016/2017,11,I1,2-1,1,-1.6,2016-10-26InterTorino
26/10/16,Juventus,Sampdoria,4,1,H,1.2,5.8,13.0,2016-10-26,2016/2017,11,I1,4-1,3,-11.8,2016-10-26JuventusSampdoria
26/10/16,Lazio,Cagliari,4,1,H,1.6,3.7,5.4,2016-10-26,2016/2017,11,I1,4-1,3,-3.8000000000000003,2016-10-26LazioCagliari
26/10/16,Napoli,Empoli,2,0,H,1.22,5.5,12.0,2016-10-26,2016/2017,11,I1,2-0,2,-10.78,2016-10-26NapoliEmpoli
26/10/16,Pescara,Atalanta,0,1,A,2.85,3.2,2.4,2016-10-26,2016/2017,11,I1,0-1,-1,0.4500000000000002,2016-10-26PescaraAtalanta
26/10/16,Sassuolo,Roma,1,3,A,3.8,3.45,1.9,2016-10-26,2016/2017,11,I1,1-3,-2,1.9,2016-10-26SassuoloRoma
27/10/16,Palermo,Udinese,1,3,A,2.65,3.1,2.65,2016-10-27,2016/2017,11,I1,1-3,-2,0.0,2016-10-27PalermoUdinese
29/10/16,Bologna,Fiorentina,0,1,A,2.95,3.1,2.4,2016-10-29,2016/2017,12,I1,0-1,-1,0.5500000000000003,2016-10-29BolognaFiorentina
29/10/16,Juventus,Napoli,2,1,H,1.75,3.5,4.5,2016-10-29,2016/2017,12,I1,2-1,1,-2.75,2016-10-29JuventusNapoli
30/10/16,Atalanta,Genoa,3,0,H,2.3,3.2,3.0,2016-10-30,2016/2017,12,I1,3-0,3,-0.7000000000000002,2016-10-30AtalantaGenoa
30/10/16,Crotone,Chievo,2,0,H,3.2,3.2,2.2,2016-10-30,2016/2017,12,I1,2-0,2,1.0,2016-10-30CrotoneChievo
30/10/16,Empoli,Roma,0,0,D,5.4,3.7,1.6,2016-10-30,2016/2017,12,I1,0-0,0,3.8000000000000003,2016-10-30EmpoliRoma
30/10/16,Lazio,Sassuolo,2,1,H,1.65,3.6,5.1,2016-10-30,2016/2017,12,I1,2-1,1,-3.4499999999999997,2016-10-30LazioSassuolo
30/10/16,Milan,Pescara,1,0,H,1.4,4.4,7.3,2016-10-30,2016/2017,12,I1,1-0,1,-5.9,2016-10-30MilanPescara
30/10/16,Sampdoria,Inter,1,0,H,3.3,3.3,2.1,2016-10-30,2016/2017,12,I1,1-0,1,1.1999999999999997,2016-10-30SampdoriaInter
31/10/16,Cagliari,Palermo,2,1,H,1.8,3.5,4.2,2016-10-31,2016/2017,12,I1,2-1,1,-2.4000000000000004,2016-10-31CagliariPalermo
31/10/16,Udinese,Torino,2,2,D,2.75,3.2,2.5,2016-10-31,2016/2017,13,I1,2-2,0,0.25,2016-10-31UdineseTorino
05/11/16,Napoli,Lazio,1,1,D,1.75,3.5,4.5,2016-11-05,2016/2017,13,I1,1-1,0,-2.75,2016-11-05NapoliLazio
05/11/16,Torino,Cagliari,5,1,H,1.55,3.9,5.6,2016-11-05,2016/2017,13,I1,5-1,4,-4.05,2016-11-05TorinoCagliari
06/11/16,Chievo,Juventus,1,2,A,7.0,4.0,1.45,2016-11-06,2016/2017,13,I1,1-2,-1,5.55,2016-11-06ChievoJuventus
06/11/16,Fiorentina,Sampdoria,1,1,D,1.57,3.8,5.5,2016-11-06,2016/2017,13,I1,1-1,0,-3.9299999999999997,2016-11-06FiorentinaSampdoria
06/11/16,Genoa,Udinese,1,1,D,1.8,3.4,4.4,2016-11-06,2016/2017,13,I1,1-1,0,-2.6000000000000005,2016-11-06GenoaUdinese
06/11/16,Inter,Crotone,3,0,H,1.25,5.5,10.3,2016-11-06,2016/2017,13,I1,3-0,3,-9.05,2016-11-06InterCrotone
06/11/16,Palermo,Milan,1,2,A,5.1,3.6,1.65,2016-11-06,2016/2017,13,I1,1-2,-1,3.4499999999999997,2016-11-06PalermoMilan
06/11/16,Pescara,Empoli,0,4,A,2.4,3.2,2.85,2016-11-06,2016/2017,13,I1,0-4,-4,-0.4500000000000002,2016-11-06PescaraEmpoli
06/11/16,Roma,Bologna,3,0,H,1.28,5.2,10.0,2016-11-06,2016/2017,14,I1,3-0,3,-8.72,2016-11-06RomaBologna
06/11/16,Sassuolo,Atalanta,0,3,A,2.3,3.2,3.0,2016-11-06,2016/2017,14,I1,0-3,-3,-0.7000000000000002,2016-11-06SassuoloAtalanta
19/11/16,Chievo,Cagliari,1,0,H,1.9,3.3,4.0,2016-11-19,2016/2017,14,I1,1-0,1,-2.1,2016-11-19ChievoCagliari
19/11/16,Juventus,Pescara,3,0,H,1.15,7.0,15.0,2016-11-19,2016/2017,14,I1,3-0,3,-13.85,2016-11-19JuventusPescara
19/11/16,Udinese,Napoli,1,2,A,4.2,3.5,1.8,2016-11-19,2016/2017,14,I1,1-2,-1,2.4000000000000004,2016-11-19UdineseNapoli
20/11/16,Atalanta,Roma,2,1,H,3.6,3.3,2.0,2016-11-20,2016/2017,14,I1,2-1,1,1.6,2016-11-20AtalantaRoma
20/11/16,Bologna,Palermo,3,1,H,1.85,3.3,4.2,2016-11-20,2016/2017,14,I1,3-1,2,-2.35,2016-11-20BolognaPalermo
20/11/16,Crotone,Torino,0,2,A,4.5,3.5,1.75,2016-11-20,2016/2017,14,I1,0-2,-2,2.75,2016-11-20CrotoneTorino
20/11/16,Empoli,Fiorentina,0,4,A,3.4,3.2,2.1,2016-11-20,2016/2017,14,I1,0-4,-4,1.2999999999999998,2016-11-20EmpoliFiorentina
20/11/16,Lazio,Genoa,3,1,H,1.6,3.7,5.4,2016-11-20,2016/2017,15,I1,3-1,2,-3.8000000000000003,2016-11-20LazioGenoa
20/11/16,Milan,Inter,2,2,D,2.5,3.2,2.75,2016-11-20,2016/2017,15,I1,2-2,0,-0.25,2016-11-20MilanInter
20/11/16,Sampdoria,Sassuolo,3,2,H,2.1,3.2,3.4,2016-11-20,2016/2017,15,I1,3-2,1,-1.2999999999999998,2016-11-20SampdoriaSassuolo
26/11/16,Empoli,Milan,1,4,A,3.6,3.3,2.0,2016-11-26,2016/2017,15,I1,1-4,-3,1.6,2016-11-26EmpoliMilan
26/11/16,Torino,Chievo,2,1,H,1.7,3.6,4.7,2016-11-26,2016/2017,15,I1,2-1,1,-3.0,2016-11-26TorinoChievo
27/11/16,Bologna,Atalanta,0,2,A,2.85,3.2,2.4,2016-11-27,2016/2017,15,I1,0-2,-2,0.4500000000000002,2016-11-27BolognaAtalanta
27/11/16,Cagliari,Udinese,2,1,H,2.2,3.3,3.1,2016-11-27,2016/2017,15,I1,2-1,1,-0.8999999999999999,2016-11-27CagliariUdinese
27/11/16,Crotone,Sampdoria,1,1,D,3.1,3.3,2.2,2016-11-27,2016/2017,15,I1,1-1,0,0.8999999999999999,2016-11-27CrotoneSampdoria
27/11/16,Genoa,Juventus,3,1,H,5.6,3.9,1.55,2016-11-27,2016/2017,15,I1,3-1,2,4.05,2016-11-27GenoaJuventus
27/11/16,Palermo,Lazio,0,1,A,5.1,3.6,1.65,2016-11-27,2016/2017,16,I1,0-1,-1,3.4499999999999997,2016-11-27PalermoLazio
27/11/16,Roma,Pescara,3,2,H,1.15,7.0,15.0,2016-11-27,2016/2017,16,I1,3-2,1,-13.85,2016-11-27RomaPescara
28/11/16,Inter,Fiorentina,4,2,H,2.0,3.3,3.6,2016-11-28,2016/2017,16,I1,4-2,2,-1.6,2016-11-28InterFiorentina
28/11/16,Napoli,Sassuolo,1,1,D,1.3,5.0,9.0,2016-11-28,2016/2017,16,I1,1-1,0,-7.7,2016-11-28NapoliSassuolo
02/12/16,Napoli,Inter,3,0,H,1.9,3.45,3.8,2016-12-02,2016/2017,16,I1,3-0,3,-1.9,2016-12-02NapoliInter
03/12/16,Juventus,Atalanta,3,1,H,1.4,4.4,7.3,2016-12-03,2016/2017,16,I1,3-1,2,-5.9,2016-12-03JuventusAtalanta
04/12/16,Fiorentina,Palermo,2,1,H,1.3,5.0,9.0,2016-12-04,2016/2017,16,I1,2-1,1,-7.7,2016-12-04FiorentinaPalermo
04/12/16,Lazio,Roma,0,2,A,2.75,3.2,2.5,2016-12-04,2016/2017,16,I1,0-2,-2,0.25,2016-12-04LazioRoma
04/12/16,Milan,Crotone,2,1,H,1.25,5.5,10.3,2016-12-04,2016/2017,16,I1,2-1,1,-9.05,2016-12-04MilanCrotone
04/12/16,Pescara,Cagliari,1,1,D,2.6,3.2,2.6,2016-12-04,2016/2017,17,I1,1-1,0,0.0,2016-12-04PescaraCagliari
04/12/16,Sampdoria,Torino,2,0,H,2.65,3.1,2.65,2016-12-04,2016/2017,17,I1,2-0,2,0.0,2016-12-04SampdoriaTorino
04/12/16,Sassuolo,Empoli,3,0,H,2.0,3.3,3.6,2016-12-04,2016/2017,17,I1,3-0,3,-1.6,2016-12-04SassuoloEmpoli
05/12/16,Chievo,Genoa,0,0,D,2.4,3.3,2.75,2016-12-05,2016/2017,17,I1,0-0,0,-0.3500000000000001,2016-12-05ChievoGenoa
05/12/16,Udinese,Bologna,1,0,H,2.1,3.3,3.3,2016-12-05,2016/2017,17,I1,1-0,1,-1.1999999999999997,2016-12-05UdineseBologna
10/12/16,Crotone,Pescara,2,1,H,2.3,3.3,2.9,2016-12-10,2016/2017,17,I1,2-1,1,-0.6000000000000001,2016-12-10CrotonePescara
10/12/16,Sampdoria,Lazio,1,2,A,2.75,3.2,2.5,2016-12-10,2016/2017,17,I1,1-2,-1,0.25,2016-12-10SampdoriaLazio
11/12/16,Atalanta,Udinese,1,3,A,1.75,3.5,4.5,2016-12-11,2016/2017,17,I1,1-3,-2,-2.75,2016-12-11AtalantaUdinese
11/12/16,Bologna,Empoli,0,0,D,2.0,3.3,3.6,2016-12-11,2016/2017,17,I1,0-0,0,-1.6,2016-12-11BolognaEmpoli
11/12/16,Cagliari,Napoli,0,5,A,5.0,4.0,1.6,2016-12-11,2016/2017,18,I1,0-5,-5,3.4,2016-12-11CagliariNapoli
11/12/16,Inter,Genoa,2,0,H,1.7,3.6,4.7,2016-12-11,2016/2017,18,I1,2-0,2,-3.0,2016-12-11InterGenoa
11/12/16,Palermo,Chievo,0,2,A,2.6,3.2,2.6,2016-12-11,2016/2017,18,I1,0-2,-2,0.0,2016-12-11PalermoChievo
11/12/16,Torino,Juventus,1,3,A,4.2,3.5,1.8,2016-12-11,2016/2017,18,I1,1-3,-2,2.4000000000000004,2016-12-11TorinoJuventus
12/12/16,Fiorentina,Sassuolo,2,1,H,1.6,3.7,5.4,2016-12-12,2016/2017,18,I1,2-1,1,-3.8000000000000003,2016-12-12FiorentinaSassuolo
12/12/16,Roma,Milan,1,0,H,1.75,3.5,4.5,2016-12-12,2016/2017,18,I1,1-0,1,-2.75,2016-12-12RomaMilan
15/12/16,Genoa,Fiorentina,1,0,H,2.6,3.2,2.6,2016-12-15,2016/2017,18,I1,1-0,1,0.0,2016-12-15GenoaFiorentina
17/12/16,Empoli,Cagliari,2,0,H,2.0,3.3,3.6,2016-12-17,2016/2017,18,I1,2-0,2,-1.6,2016-12-17EmpoliCagliari
17/12/16,Juventus,Roma,1,0,H,1.75,3.5,4.5,2016-12-17,2016/2017,18,I1,1-0,1,-2.75,2016-12-17JuventusRoma
17/12/16,Milan,Atalanta,0,0,D,1.85,3.45,4.0,2016-12-17,2016/2017,19,I1,0-0,0,-2.15,2016-12-17MilanAtalanta
18/12/16,Chievo,Sampdoria,2,1,H,2.2,3.2,3.2,2016-12-18,2016/2017,19,I1,2-1,1,-1.0,2016-12-18ChievoSampdoria
18/12/16,Genoa,Palermo,3,4,A,1.55,3.9,5.6,2016-12-18,2016/2017,19,I1,3-4,-1,-4.05,2016-12-18GenoaPalermo
18/12/16,Lazio,Fiorentina,3,1,H,1.9,3.45,3.8,2016-12-18,2016/2017,19,I1,3-1,2,-1.9,2016-12-18LazioFiorentina
18/12/16,Napoli,Torino,5,3,H,1.55,3.9,5.6,2016-12-18,2016/2017,19,I1,5-3,2,-4.05,2016-12-18NapoliTorino
18/12/16,Pescara,Bologna,0,3,A,2.5,3.1,2.8,2016-12-18,2016/2017,19,I1,0-3,-3,-0.2999999999999998,2016-12-18PescaraBologna
18/12/16,Sassuolo,Inter,0,1,A,3.3,3.3,2.1,2016-12-18,2016/2017,19,I1,0-1,-1,1.1999999999999997,2016-12-18SassuoloInter
18/12/16,Udinese,Crotone,2,0,H,1.5,4.0,6.1,2016-12-18,2016/2017,19,I1,2-0,2,-4.6,2016-12-18UdineseCrotone
20/12/16,Atalanta,Empoli,2,1,H,1.65,3.6,5.1,2016-12-20,2016/2017,19,I1,2-1,1,-3.4499999999999997,2016-12-20AtalantaEmpoli
21/12/16,Inter,Lazio,3,0,H,2.1,3.3,3.3,2016-12-21,2016/2017,20,I1,3-0,3,-1.1999999999999997,2016-12-21InterLazio
22/12/16,Cagliari,Sassuolo,4,3,H,2.3,3.2,3.0,2016-12-22,2016/2017,20,I1,4-3,1,-0.7000000000000002,2016-12-22CagliariSassuolo
22/12/16,Fiorentina,Napoli,3,3,D,3.1,3.3,2.2,2016-12-22,2016/2017,20,I1,3-3,0,0.8999999999999999,2016-12-22FiorentinaNapoli
22/12/16,Palermo,Pescara,1,1,D,2.2,3.2,3.2,2016-12-22,2016/2017,20,I1,1-1,0,-1.0,2016-12-22PalermoPescara
22/12/16,Roma,Chievo,3,1,H,1.3,5.0,9.0,2016-12-22,2016/2017,20,I1,3-1,2,-7.7,2016-12-22RomaChievo
22/12/16,Sampdoria,Udinese,0,0,D,2.1,3.1,3.55,2016-12-22,2016/2017,20,I1,0-0,0,-1.4499999999999997,2016-12-22SampdoriaUdinese
22/12/16,Torino,Genoa,1,0,H,1.85,3.45,4.0,2016-12-22,2016/2017,20,I1,1-0,1,-2.15,2016-12-22TorinoGenoa
07/01/17,Empoli,Palermo,1,0,H,2.0,3.3,3.6,2017-01-07,2016/2017,20,I1,1-0,1,-1.6,2017-01-07EmpoliPalermo
07/01/17,Napoli,Sampdoria,2,1,H,1.27,5.2,10.0,2017-01-07,2016/2017,20,I1,2-1,1,-8.73,2017-01-07NapoliSampdoria
08/01/17,Chievo,Atalanta,1,4,A,2.65,3.1,2.65,2017-01-08,2016/2017,21,I1,1-4,-3,0.0,2017-01-08ChievoAtalanta
08/01/17,Genoa,Roma,0,1,A,4.2,3.5,1.8,2017-01-08,2016/2017,21,I1,0-1,-1,2.4000000000000004,2017-01-08GenoaRoma
08/01/17,Juventus,Bologna,3,0,H,1.17,6.5,14.0,2017-01-08,2016/2017,21,I1,3-0,3,-12.83,2017-01-08JuventusBologna
08/01/17,Lazio,Crotone,1,0,H,1.27,5.2,10.0,2017-01-08,2016/2017,21,I1,1-0,1,-8.73,2017-01-08LazioCrotone
08/01/17,Milan,Cagliari,1,0,H,1.4,4.4,7.3,2017-01-08,2016/2017,21,I1,1-0,1,-5.9,2017-01-08MilanCagliari
08/01/17,Sassuolo,Torino,0,0,D,2.6,3.2,2.6,2017-01-08,2016/2017,21,I1,0-0,0,0.0,2017-01-08SassuoloTorino
08/01/17,Udinese,Inter,1,2,A,3.3,3.3,2.1,2017-01-08,2016/2017,21,I1,1-2,-1,1.1999999999999997,2017-01-08UdineseInter
14/01/17,Crotone,Bologna,0,1,A,2.6,3.2,2.6,2017-01-14,2016/2017,21,I1,0-1,-1,0.0,2017-01-14CrotoneBologna
14/01/17,Inter,Chievo,3,1,H,1.5,4.0,6.1,2017-01-14,2016/2017,21,I1,3-1,2,-4.6,2017-01-14InterChievo
15/01/17,Cagliari,Genoa,4,1,H,2.4,3.2,2.85,2017-01-15,2016/2017,22,I1,4-1,3,-0.4500000000000002,2017-01-15CagliariGenoa
15/01/17,Fiorentina,Juventus,2,1,H,4.5,3.5,1.75,2017-01-15,2016/2017,22,I1,2-1,1,2.75,2017-01-15FiorentinaJuventus
15/01/17,Lazio,Atalanta,2,1,H,1.9,3.45,3.8,2017-01-15,2016/2017,22,I1,2-1,1,-1.9,2017-01-15LazioAtalanta
15/01/17,Napoli,Pescara,3,1,H,1.12,8.0,16.0,2017-01-15,2016/2017,22,I1,3-1,2,-14.879999999999999,2017-01-15NapoliPescara
15/01/17,Sampdoria,Empoli,0,0,D,1.8,3.4,4.4,2017-01-15,2016/2017,22,I1,0-0,0,-2.6000000000000005,2017-01-15SampdoriaEmpoli
15/01/17,Sassuolo,Palermo,4,1,H,1.8,3.5,4.2,2017-01-15,2016/2017,22,I1,4-1,3,-2.4000000000000004,2017-01-15SassuoloPalermo
15/01/17,Udinese,Roma,0,1,A,4.0,3.45,1.85,2017-01-15,2016/2017,22,I1,0-1,-1,2.15,2017-01-15UdineseRoma
16/01/17,Torino,Milan,2,2,D,2.5,3.1,2.8,2017-01-16,2016/2017,22,I1,2-2,0,-0.2999999999999998,2017-01-16TorinoMilan
21/01/17,Chievo,Fiorentina,0,3,A,3.2,3.2,2.2,2017-01-21,2016/2017,22,I1,0-3,-3,1.0,2017-01-21ChievoFiorentina
21/01/17,Milan,Napoli,1,2,A,3.0,3.2,2.3,2017-01-21,2016/2017,23,I1,1-2,-1,0.7000000000000002,2017-01-21MilanNapoli
22/01/17,Atalanta,Sampdoria,1,0,H,1.75,3.5,4.5,2017-01-22,2016/2017,23,I1,1-0,1,-2.75,2017-01-22AtalantaSampdoria
22/01/17,Bologna,Torino,2,0,H,2.85,3.2,2.4,2017-01-22,2016/2017,23,I1,2-0,2,0.4500000000000002,2017-01-22BolognaTorino
22/01/17,Empoli,Udinese,1,0,H,2.3,3.2,3.0,2017-01-22,2016/2017,23,I1,1-0,1,-0.7000000000000002,2017-01-22EmpoliUdinese
22/01/17,Genoa,Crotone,2,2,D,1.55,4.0,5.5,2017-01-22,2016/2017,23,I1,2-2,0,-3.95,2017-01-22GenoaCrotone
22/01/17,Juventus,Lazio,2,0,H,1.5,4.0,6.1,2017-01-22,2016/2017,23,I1,2-0,2,-4.6,2017-01-22JuventusLazio
22/01/17,Palermo,Inter,0,1,A,5.5,4.0,1.55,2017-01-22,2016/2017,23,I1,0-1,-1,3.95,2017-01-22PalermoInter
22/01/17,Pescara,Sassuolo,1,3,A,2.9,3.3,2.3,2017-01-22,2016/2017,23,I1,1-3,-2,0.6000000000000001,2017-01-22PescaraSassuolo
22/01/17,Roma,Cagliari,1,0,H,1.25,5.5,10.3,2017-01-22,2016/2017,23,I1,1-0,1,-9.05,2017-01-22RomaCagliari
28/01/17,Inter,Pescara,3,0,H,1.2,5.8,13.0,2017-01-28,2016/2017,24,I1,3-0,3,-11.8,2017-01-28InterPescara
28/01/17,Lazio,Chievo,0,1,A,1.5,4.0,6.1,2017-01-28,2016/2017,24,I1,0-1,-1,-4.6,2017-01-28LazioChievo
29/01/17,Cagliari,Bologna,1,1,D,2.3,3.1,3.1,2017-01-29,2016/2017,24,I1,1-1,0,-0.8000000000000003,2017-01-29CagliariBologna
29/01/17,Crotone,Empoli,4,1,H,2.5,3.2,2.75,2017-01-29,2016/2017,24,I1,4-1,3,-0.25,2017-01-29CrotoneEmpoli
29/01/17,Fiorentina,Genoa,3,3,D,1.65,3.6,5.1,2017-01-29,2016/2017,24,I1,3-3,0,-3.4499999999999997,2017-01-29FiorentinaGenoa
29/01/17,Napoli,Palermo,1,1,D,1.12,8.0,16.0,2017-01-29,2016/2017,24,I1,1-1,0,-14.879999999999999,2017-01-29NapoliPalermo
29/01/17,Sampdoria,Roma,3,2,H,4.7,3.6,1.7,2017-01-29,2016/2017,24,I1,3-2,1,3.0,2017-01-29SampdoriaRoma
29/01/17,Sassuolo,Juventus,0,2,A,7.3,4.4,1.4,2017-01-29,2016/2017,24,I1,0-2,-2,5.9,2017-01-29SassuoloJuventus
29/01/17,Torino,Atalanta,1,1,D,2.3,3.2,3.0,2017-01-29,2016/2017,24,I1,1-1,0,-0.7000000000000002,2017-01-29TorinoAtalanta
29/01/17,Udinese,Milan,2,1,H,3.1,3.3,2.2,2017-01-29,2016/2017,25,I1,2-1,1,0.8999999999999999,2017-01-29UdineseMilan
01/02/17,Pescara,Fiorentina,1,2,A,4.2,3.5,1.8,2017-02-01,2016/2017,25,I1,1-2,-1,2.4000000000000004,2017-02-01PescaraFiorentina
04/02/17,Bologna,Napoli,1,7,A,5.4,3.7,1.6,2017-02-04,2016/2017,25,I1,1-7,-6,3.8000000000000003,2017-02-04BolognaNapoli
05/02/17,Atalanta,Cagliari,2,0,H,1.55,3.9,5.6,2017-02-05,2016/2017,25,I1,2-0,2,-4.05,2017-02-05AtalantaCagliari
05/02/17,Chievo,Udinese,0,0,D,2.2,3.1,3.3,2017-02-05,2016/2017,25,I1,0-0,0,-1.0999999999999996,2017-02-05ChievoUdinese
05/02/17,Empoli,Torino,1,1,D,2.85,3.2,2.4,2017-02-05,2016/2017,25,I1,1-1,0,0.4500000000000002,2017-02-05EmpoliTorino
05/02/17,Genoa,Sassuolo,0,1,A,2.0,3.3,3.6,2017-02-05,2016/2017,25,I1,0-1,-1,-1.6,2017-02-05GenoaSassuolo
05/02/17,Juventus,Inter,1,0,H,1.65,3.6,5.1,2017-02-05,2016/2017,25,I1,1-0,1,-3.4499999999999997,2017-02-05JuventusInter
05/02/17,Milan,Sampdoria,0,1,A,1.6,3.7,5.4,2017-02-05,2016/2017,25,I1,0-1,-1,-3.8000000000000003,2017-02-05MilanSampdoria
05/02/17,Palermo,Crotone,1,0,H,2.1,3.3,3.3,2017-02-05,2016/2017,26,I1,1-0,1,-1.1999999999999997,2017-02-05PalermoCrotone
05/02/17,Pescara,Lazio,2,6,A,5.0,4.0,1.6,2017-02-05,2016/2017,26,I1,2-6,-4,3.4,2017-02-05PescaraLazio
07/02/17,Roma,Fiorentina,4,0,H,1.6,3.7,5.4,2017-02-07,2016/2017,26,I1,4-0,4,-3.8000000000000003,2017-02-07RomaFiorentina
08/02/17,Bologna,Milan,0,1,A,3.2,3.2,2.2,2017-02-08,2016/2017,26,I1,0-1,-1,1.0,2017-02-08BolognaMilan
08/02/17,Crotone,Juventus,0,2,A,13.0,5.8,1.2,2017-02-08,2016/2017,26,I1,0-2,-2,11.8,2017-02-08CrotoneJuventus
10/02/17,Napoli,Genoa,2,0,H,1.3,5.0,9.0,2017-02-10,2016/2017,26,I1,2-0,2,-7.7,2017-02-10NapoliGenoa
11/02/17,Fiorentina,Udinese,3,0,H,1.6,3.7,5.4,2017-02-11,2016/2017,26,I1,3-0,3,-3.8000000000000003,2017-02-11FiorentinaUdinese
12/02/17,Cagliari,Juventus,0,2,A,7.6,4.8,1.35,2017-02-12,2016/2017,26,I1,0-2,-2,6.25,2017-02-12CagliariJuventus
12/02/17,Crotone,Roma,0,2,A,7.6,4.8,1.35,2017-02-12,2016/2017,26,I1,0-2,-2,6.25,2017-02-12CrotoneRoma
12/02/17,Inter,Empoli,2,0,H,1.3,5.0,9.0,2017-02-12,2016/2017,27,I1,2-0,2,-7.7,2017-02-12InterEmpoli
12/02/17,Palermo,Atalanta,1,3,A,4.0,3.45,1.85,2017-02-12,2016/2017,27,I1,1-3,-2,2.15,2017-02-12PalermoAtalanta
12/02/17,Sampdoria,Bologna,3,1,H,1.85,3.45,4.0,2017-02-12,2016/2017,27,I1,3-1,2,-2.15,2017-02-12SampdoriaBologna
12/02/17,Sassuolo,Chievo,1,3,A,1.95,3.35,3.7,2017-02-12,2016/2017,27,I1,1-3,-2,-1.7500000000000002,2017-02-12SassuoloChievo
12/02/17,Torino,Pescara,5,3,H,1.35,4.8,7.6,2017-02-12,2016/2017,27,I1,5-3,2,-6.25,2017-02-12TorinoPescara
13/02/17,Lazio,Milan,1,1,D,1.75,3.5,4.5,2017-02-13,2016/2017,27,I1,1-1,0,-2.75,2017-02-13LazioMilan
17/02/17,Juventus,Palermo,4,1,H,1.17,6.5,14.0,2017-02-17,2016/2017,27,I1,4-1,3,-12.83,2017-02-17JuventusPalermo
18/02/17,Atalanta,Crotone,1,0,H,1.3,5.0,9.0,2017-02-18,2016/2017,27,I1,1-0,1,-7.7,2017-02-18AtalantaCrotone
18/02/17,Empoli,Lazio,1,2,A,4.5,3.5,1.75,2017-02-18,2016/2017,27,I1,1-2,-1,2.75,2017-02-18EmpoliLazio
19/02/17,Bologna,Inter,0,1,A,4.2,3.5,1.8,2017-02-19,2016/2017,28,I1,0-1,-1,2.4000000000000004,2017-02-19BolognaInter
19/02/17,Chievo,Napoli,1,3,A,6.1,4.0,1.5,2017-02-19,2016/2017,28,I1,1-3,-2,4.6,2017-02-19ChievoNapoli
19/02/17,Milan,Fiorentina,2,1,H,2.2,3.2,3.2,2017-02-19,2016/2017,28,I1,2-1,1,-1.0,2017-02-19MilanFiorentina
19/02/17,Pescara,Genoa,5,0,H,3.8,3.45,1.9,2017-02-19,2016/2017,28,I1,5-0,5,1.9,2017-02-19PescaraGenoa
19/02/17,Roma,Torino,4,1,H,1.4,4.4,7.3,2017-02-19,2016/2017,28,I1,4-1,3,-5.9,2017-02-19RomaTorino
19/02/17,Sampdoria,Cagliari,1,1,D,1.65,3.6,5.1,2017-02-19,2016/2017,28,I1,1-1,0,-3.4499999999999997,2017-02-19SampdoriaCagliari
19/02/17,Udinese,Sassuolo,1,2,A,2.0,3.3,3.6,2017-02-19,2016/2017,28,I1,1-2,-1,-1.6,2017-02-19UdineseSassuolo
25/02/17,Juventus,Empoli,2,0,H,1.15,7.0,15.0,2017-02-25,2016/2017,28,I1,2-0,2,-13.85,2017-02-25JuventusEmpoli
25/02/17,Napoli,Atalanta,0,2,A,1.5,4.0,6.1,2017-02-25,2016/2017,28,I1,0-2,-2,-4.6,2017-02-25NapoliAtalanta
26/02/17,Chievo,Pescara,2,0,H,1.7,3.7,4.5,2017-02-26,2016/2017,29,I1,2-0,2,-2.8,2017-02-26ChievoPescara
26/02/17,Crotone,Cagliari,1,2,A,2.6,3.2,2.6,2017-02-26,2016/2017,29,I1,1-2,-1,0.0,2017-02-26CrotoneCagliari
26/02/17,Genoa,Bologna,1,1,D,2.2,3.0,3.4,2017-02-26,2016/2017,29,I1,1-1,0,-1.1999999999999997,2017-02-26GenoaBologna
26/02/17,Inter,Roma,1,3,A,2.5,3.3,2.65,2017-02-26,2016/2017,29,I1,1-3,-2,-0.1499999999999999,2017-02-26InterRoma
26/02/17,Lazio,Udinese,1,0,H,1.5,4.0,6.1,2017-02-26,2016/2017,29,I1,1-0,1,-4.6,2017-02-26LazioUdinese
26/02/17,Palermo,Sampdoria,1,1,D,2.75,3.3,2.4,2017-02-26,2016/2017,29,I1,1-1,0,0.3500000000000001,2017-02-26PalermoSampdoria
26/02/17,Sassuolo,Milan,0,1,A,3.1,3.3,2.2,2017-02-26,2016/2017,29,I1,0-1,-1,0.8999999999999999,2017-02-26SassuoloMilan
27/02/17,Fiorentina,Torino,2,2,D,1.9,3.45,3.8,2017-02-27,2016/2017,29,I1,2-2,0,-1.9,2017-02-27FiorentinaTorino
04/03/17,Milan,Chievo,3,1,H,1.6,3.7,5.4,2017-03-04,2016/2017,29,I1,3-1,2,-3.8000000000000003,2017-03-04MilanChievo
04/03/17,Roma,Napoli,1,2,A,2.0,3.3,3.6,2017-03-04,2016/2017,30,I1,1-2,-1,-1.6,2017-03-04RomaNapoli
04/03/17,Sampdoria,Pescara,3,1,H,1.6,4.0,4.8,2017-03-04,2016/2017,30,I1,3-1,2,-3.1999999999999997,2017-03-04SampdoriaPescara
05/03/17,Atalanta,Fiorentina,0,0,D,2.0,3.3,3.6,2017-03-05,2016/2017,30,I1,0-0,0,-1.6,2017-03-05AtalantaFiorentina
05/03/17,Bologna,Lazio,0,2,A,4.5,3.5,1.75,2017-03-05,2016/2017,30,I1,0-2,-2,2.75,2017-03-05BolognaLazio
05/03/17,Cagliari,Inter,1,5,A,4.8,3.8,1.65,2017-03-05,2016/2017,30,I1,1-5,-4,3.15,2017-03-05CagliariInter
05/03/17,Crotone,Sassuolo,0,0,D,3.1,3.3,2.2,2017-03-05,2016/2017,30,I1,0-0,0,0.8999999999999999,2017-03-05CrotoneSassuolo
05/03/17,Empoli,Genoa,0,2,A,2.4,3.0,3.0,2017-03-05,2016/2017,30,I1,0-2,-2,-0.6000000000000001,2017-03-05EmpoliGenoa
05/03/17,Torino,Palermo,3,1,H,1.45,4.0,7.0,2017-03-05,2016/2017,30,I1,3-1,2,-5.55,2017-03-05TorinoPalermo
05/03/17,Udinese,Juventus,1,1,D,6.1,4.0,1.5,2017-03-05,2016/2017,30,I1,1-1,0,4.6,2017-03-05UdineseJuventus
10/03/17,Juventus,Milan,2,1,H,1.5,4.0,6.1,2017-03-10,2016/2017,31,I1,2-1,1,-4.6,2017-03-10JuventusMilan
11/03/17,Genoa,Sampdoria,0,1,A,2.65,3.1,2.65,2017-03-11,2016/2017,31,I1,0-1,-1,0.0,2017-03-11GenoaSampdoria
12/03/17,Chievo,Empoli,4,0,H,2.0,3.3,3.6,2017-03-12,2016/2017,31,I1,4-0,4,-1.6,2017-03-12ChievoEmpoli
12/03/17,Fiorentina,Cagliari,1,0,H,1.5,4.0,6.1,2017-03-12,2016/2017,31,I1,1-0,1,-4.6,2017-03-12FiorentinaCagliari
12/03/17,Inter,Atalanta,7,1,H,1.85,3.45,4.0,2017-03-12,2016/2017,31,I1,7-1,6,-2.15,2017-03-12InterAtalanta
12/03/17,Napoli,Crotone,3,0,H,1.12,8.0,16.0,2017-03-12,2016/2017,31,I1,3-0,3,-14.879999999999999,2017-03-12NapoliCrotone
12/03/17,Palermo,Roma,0,3,A,7.2,4.5,1.4,2017-03-12,2016/2017,31,I1,0-3,-3,5.800000000000001,2017-03-12PalermoRoma
12/03/17,Pescara,Udinese,1,3,A,2.9,3.3,2.3,2017-03-12,2016/2017,31,I1,1-3,-2,0.6000000000000001,2017-03-12PescaraUdinese
12/03/17,Sassuolo,Bologna,0,1,A,2.0,3.3,3.6,2017-03-12,2016/2017,31,I1,0-1,-1,-1.6,2017-03-12SassuoloBologna
13/03/17,Lazio,Torino,3,1,H,1.55,4.0,5.5,2017-03-13,2016/2017,32,I1,3-1,2,-3.95,2017-03-13LazioTorino
18/03/17,Milan,Genoa,1,0,H,1.55,4.0,5.5,2017-03-18,2016/2017,32,I1,1-0,1,-3.95,2017-03-18MilanGenoa
18/03/17,Torino,Inter,2,2,D,3.4,3.5,2.0,2017-03-18,2016/2017,32,I1,2-2,0,1.4,2017-03-18TorinoInter
19/03/17,Atalanta,Pescara,3,0,H,1.22,6.0,11.0,2017-03-19,2016/2017,32,I1,3-0,3,-9.78,2017-03-19AtalantaPescara
19/03/17,Bologna,Chievo,4,1,H,2.3,2.9,3.3,2017-03-19,2016/2017,32,I1,4-1,3,-1.0,2017-03-19BolognaChievo
19/03/17,Cagliari,Lazio,0,0,D,5.5,4.0,1.55,2017-03-19,2016/2017,32,I1,0-0,0,3.95,2017-03-19CagliariLazio
19/03/17,Crotone,Fiorentina,0,1,A,5.0,3.9,1.6,2017-03-19,2016/2017,32,I1,0-1,-1,3.4,2017-03-19CrotoneFiorentina
19/03/17,Empoli,Napoli,2,3,A,9.0,5.0,1.3,2017-03-19,2016/2017,32,I1,2-3,-1,7.7,2017-03-19EmpoliNapoli
19/03/17,Roma,Sassuolo,3,1,H,1.25,6.0,9.0,2017-03-19,2016/2017,32,I1,3-1,2,-7.75,2017-03-19RomaSassuolo
19/03/17,Sampdoria,Juventus,0,1,A,5.6,3.9,1.55,2017-03-19,2016/2017,33,I1,0-1,-1,4.05,2017-03-19SampdoriaJuventus
19/03/17,Udinese,Palermo,4,1,H,1.65,3.9,4.6,2017-03-19,2016/2017,33,I1,4-1,3,-2.9499999999999997,2017-03-19UdinesePalermo
01/04/17,Roma,Empoli,2,0,H,1.17,6.5,14.0,2017-04-01,2016/2017,33,I1,2-0,2,-12.83,2017-04-01RomaEmpoli
01/04/17,Sassuolo,Lazio,1,2,A,4.9,3.7,1.65,2017-04-01,2016/2017,33,I1,1-2,-1,3.2500000000000004,2017-04-01SassuoloLazio
02/04/17,Chievo,Crotone,1,2,A,1.75,3.5,4.5,2017-04-02,2016/2017,33,I1,1-2,-1,-2.75,2017-04-02ChievoCrotone
02/04/17,Fiorentina,Bologna,1,0,H,1.5,4.0,6.1,2017-04-02,2016/2017,33,I1,1-0,1,-4.6,2017-04-02FiorentinaBologna
02/04/17,Genoa,Atalanta,0,5,A,3.5,3.4,2.0,2017-04-02,2016/2017,33,I1,0-5,-5,1.5,2017-04-02GenoaAtalanta
02/04/17,Napoli,Juventus,1,1,D,2.6,3.2,2.6,2017-04-02,2016/2017,33,I1,1-1,0,0.0,2017-04-02NapoliJuventus
02/04/17,Palermo,Cagliari,1,3,A,2.2,3.3,3.1,2017-04-02,2016/2017,33,I1,1-3,-2,-0.8999999999999999,2017-04-02PalermoCagliari
02/04/17,Pescara,Milan,1,1,D,7.1,4.5,1.4,2017-04-02,2016/2017,34,I1,1-1,0,5.699999999999999,2017-04-02PescaraMilan
02/04/17,Torino,Udinese,2,2,D,1.85,3.45,4.0,2017-04-02,2016/2017,34,I1,2-2,0,-2.15,2017-04-02TorinoUdinese
03/04/17,Inter,Sampdoria,1,2,A,1.4,4.4,7.3,2017-04-03,2016/2017,34,I1,1-2,-1,-5.9,2017-04-03InterSampdoria
08/04/17,Atalanta,Sassuolo,1,1,D,1.5,4.0,6.1,2017-04-08,2016/2017,34,I1,1-1,0,-4.6,2017-04-08AtalantaSassuolo
08/04/17,Empoli,Pescara,1,1,D,1.85,3.5,4.0,2017-04-08,2016/2017,34,I1,1-1,0,-2.15,2017-04-08EmpoliPescara
08/04/17,Juventus,Chievo,2,0,H,1.2,6.0,13.0,2017-04-08,2016/2017,34,I1,2-0,2,-11.8,2017-04-08JuventusChievo
09/04/17,Bologna,Roma,0,3,A,7.0,4.0,1.45,2017-04-09,2016/2017,34,I1,0-3,-3,5.55,2017-04-09BolognaRoma
09/04/17,Cagliari,Torino,2,3,A,2.9,3.3,2.3,2017-04-09,2016/2017,34,I1,2-3,-1,0.6000000000000001,2017-04-09CagliariTorino
09/04/17,Crotone,Inter,2,1,H,7.6,4.8,1.35,2017-04-09,2016/2017,34,I1,2-1,1,6.25,2017-04-09CrotoneInter
09/04/17,Lazio,Napoli,0,3,A,2.65,3.3,2.5,2017-04-09,2016/2017,35,I1,0-3,-3,0.1499999999999999,2017-04-09LazioNapoli
09/04/17,Milan,Palermo,4,0,H,1.3,5.0,9.0,2017-04-09,2016/2017,35,I1,4-0,4,-7.7,2017-04-09MilanPalermo
09/04/17,Sampdoria,Fiorentina,2,2,D,2.6,3.2,2.6,2017-04-09,2016/2017,35,I1,2-2,0,0.0,2017-04-09SampdoriaFiorentina
09/04/17,Udinese,Genoa,3,0,H,1.8,3.5,4.2,2017-04-09,2016/2017,35,I1,3-0,3,-2.4000000000000004,2017-04-09UdineseGenoa
15/04/17,Cagliari,Chievo,4,0,H,2.2,3.3,3.1,2017-04-15,2016/2017,35,I1,4-0,4,-0.8999999999999999,2017-04-15CagliariChievo
15/04/17,Fiorentina,Empoli,1,2,A,1.35,4.8,7.6,2017-04-15,2016/2017,35,I1,1-2,-1,-6.25,2017-04-15FiorentinaEmpoli
15/04/17,Genoa,Lazio,2,2,D,4.7,3.6,1.7,2017-04-15,2016/2017,35,I1,2-2,0,3.0,2017-04-15GenoaLazio
15/04/17,Inter,Milan,2,2,D,2.2,3.3,3.1,2017-04-15,2016/2017,35,I1,2-2,0,-0.8999999999999999,2017-04-15InterMilan
15/04/17,Napoli,Udinese,3,0,H,1.25,5.5,10.3,2017-04-15,2016/2017,35,I1,3-0,3,-9.05,2017-04-15NapoliUdinese
15/04/17,Palermo,Bologna,0,0,D,2.3,3.3,2.9,2017-04-15,2016/2017,36,I1,0-0,0,-0.6000000000000001,2017-04-15PalermoBologna
15/04/17,Pescara,Juventus,0,2,A,10.3,5.5,1.25,2017-04-15,2016/2017,36,I1,0-2,-2,9.05,2017-04-15PescaraJuventus
15/04/17,Roma,Atalanta,1,1,D,1.5,4.0,6.1,2017-04-15,2016/2017,36,I1,1-1,0,-4.6,2017-04-15RomaAtalanta
15/04/17,Sassuolo,Sampdoria,2,1,H,2.3,3.3,2.9,2017-04-15,2016/2017,36,I1,2-1,1,-0.6000000000000001,2017-04-15SassuoloSampdoria
15/04/17,Torino,Crotone,1,1,D,1.55,4.2,5.0,2017-04-15,2016/2017,36,I1,1-1,0,-3.45,2017-04-15TorinoCrotone
22/04/17,Atalanta,Bologna,3,2,H,1.35,4.8,7.6,2017-04-22,2016/2017,36,I1,3-2,1,-6.25,2017-04-22AtalantaBologna
22/04/17,Fiorentina,Inter,5,4,H,2.5,3.3,2.65,2017-04-22,2016/2017,36,I1,5-4,1,-0.1499999999999999,2017-04-22FiorentinaInter
23/04/17,Chievo,Torino,1,3,A,2.9,3.3,2.3,2017-04-23,2016/2017,36,I1,1-3,-2,0.6000000000000001,2017-04-23ChievoTorino
23/04/17,Juventus,Genoa,4,0,H,1.15,7.0,15.0,2017-04-23,2016/2017,36,I1,4-0,4,-13.85,2017-04-23JuventusGenoa
23/04/17,Lazio,Palermo,6,2,H,1.15,7.0,15.0,2017-04-23,2016/2017,37,I1,6-2,4,-13.85,2017-04-23LazioPalermo
23/04/17,Milan,Empoli,1,2,A,1.3,5.0,9.0,2017-04-23,2016/2017,37,I1,1-2,-1,-7.7,2017-04-23MilanEmpoli
23/04/17,Sampdoria,Crotone,1,2,A,1.85,3.6,3.8,2017-04-23,2016/2017,37,I1,1-2,-1,-1.9499999999999997,2017-04-23SampdoriaCrotone
23/04/17,Sassuolo,Napoli,2,2,D,7.3,4.4,1.4,2017-04-23,2016/2017,37,I1,2-2,0,5.9,2017-04-23SassuoloNapoli
23/04/17,Udinese,Cagliari,2,1,H,1.8,3.5,4.2,2017-04-23,2016/2017,37,I1,2-1,1,-2.4000000000000004,2017-04-23UdineseCagliari
24/04/17,Pescara,Roma,1,4,A,10.3,5.5,1.25,2017-04-24,2016/2017,37,I1,1-4,-3,9.05,2017-04-24PescaraRoma
28/04/17,Atalanta,Juventus,2,2,D,3.1,3.3,2.2,2017-04-28,2016/2017,37,I1,2-2,0,0.8999999999999999,2017-04-28AtalantaJuventus
29/04/17,Torino,Sampdoria,1,1,D,1.7,3.7,4.5,2017-04-29,2016/2017,37,I1,1-1,0,-2.8,2017-04-29TorinoSampdoria
30/04/17,Bologna,Udinese,4,0,H,2.4,3.0,3.05,2017-04-30,2016/2017,37,I1,4-0,4,-0.6499999999999999,2017-04-30BolognaUdinese
30/04/17,Cagliari,Pescara,1,0,H,1.55,4.2,5.0,2017-04-30,2016/2017,38,I1,1-0,1,-3.45,2017-04-30CagliariPescara
30/04/17,Crotone,Milan,1,1,D,3.4,3.5,2.0,2017-04-30,2016/2017,38,I1,1-1,0,1.4,2017-04-30CrotoneMilan
30/04/17,Empoli,Sassuolo,1,3,A,1.9,3.45,3.8,2017-04-30,2016/2017,38,I1,1-3,-2,-1.9,2017-04-30EmpoliSassuolo
30/04/17,Genoa,Chievo,1,2,A,1.7,3.7,4.5,2017-04-30,2016/2017,38,I1,1-2,-1,-2.8,2017-04-30GenoaChievo
30/04/17,Inter,Napoli,0,1,A,3.2,3.4,2.1,2017-04-30,2016/2017,38,I1,0-1,-1,1.1,2017-04-30InterNapoli
30/04/17,Palermo,Fiorentina,2,0,H,6.5,4.2,1.45,2017-04-30,2016/2017,38,I1,2-0,2,5.05,2017-04-30PalermoFiorentina
30/04/17,Roma,Lazio,1,3,A,2.0,3.3,3.6,2017-04-30,2016/2017,38,I1,1-3,-2,-1.6,2017-04-30RomaLazio
06/05/17,Juventus,Torino,1,1,D,1.5,4.0,6.1,2017-05-06,2016/2017,38,I1,1-1,0,-4.6,2017-05-06JuventusTorino
06/05/17,Napoli,Cagliari,3,1,H,1.1,8.0,20.0,2017-05-06,2016/2017,38,I1,3-1,2,-18.9,2017-05-06NapoliCagliari
07/05/17,Chievo,Palermo,1,1,D,1.65,3.8,4.7,2017-05-07,2016/2017,39,I1,1-1,0,-3.0500000000000003,2017-05-07ChievoPalermo
07/05/17,Empoli,Bologna,3,1,H,1.6,3.9,5.0,2017-05-07,2016/2017,39,I1,3-1,2,-3.4,2017-05-07EmpoliBologna
07/05/17,Genoa,Inter,1,0,H,3.9,3.7,1.8,2017-05-07,2016/2017,39,I1,1-0,1,2.0999999999999996,2017-05-07GenoaInter
07/05/17,Lazio,Sampdoria,7,3,H,1.27,5.5,9.0,2017-05-07,2016/2017,39,I1,7-3,4,-7.73,2017-05-07LazioSampdoria
07/05/17,Milan,Roma,1,4,A,3.8,3.5,1.9,2017-05-07,2016/2017,39,I1,1-4,-3,1.9,2017-05-07MilanRoma
07/05/17,Pescara,Crotone,0,1,A,4.9,4.0,1.6,2017-05-07,2016/2017,39,I1,0-1,-1,3.3000000000000003,2017-05-07PescaraCrotone
07/05/17,Sassuolo,Fiorentina,2,2,D,3.4,3.5,2.0,2017-05-07,2016/2017,39,I1,2-2,0,1.4,2017-05-07SassuoloFiorentina
07/05/17,Udinese,Atalanta,1,1,D,3.8,3.6,1.85,2017-05-07,2016/2017,39,I1,1-1,0,1.9499999999999997,2017-05-07UdineseAtalanta
13/05/17,Atalanta,Milan,1,1,D,2.0,3.5,3.4,2017-05-13,2016/2017,39,I1,1-1,0,-1.4,2017-05-13AtalantaMilan
13/05/17,Fiorentina,Lazio,3,2,H,2.3,3.5,2.8,2017-05-13,2016/2017,40,I1,3-2,1,-0.5,2017-05-13FiorentinaLazio
14/05/17,Bologna,Pescara,3,1,H,1.65,3.8,4.7,2017-05-14,2016/2017,40,I1,3-1,2,-3.0500000000000003,2017-05-14BolognaPescara
14/05/17,Cagliari,Empoli,3,2,H,2.95,3.5,2.2,2017-05-14,2016/2017,40,I1,3-2,1,0.75,2017-05-14CagliariEmpoli
14/05/17,Crotone,Udinese,1,0,H,1.75,3.7,4.2,2017-05-14,2016/2017,40,I1,1-0,1,-2.45,2017-05-14CrotoneUdinese
14/05/17,Inter,Sassuolo,1,2,A,1.45,4.2,6.5,2017-05-14,2016/2017,40,I1,1-2,-1,-5.05,2017-05-14InterSassuolo
14/05/17,Palermo,Genoa,1,0,H,4.3,3.8,1.7,2017-05-14,2016/2017,40,I1,1-0,1,2.5999999999999996,2017-05-14PalermoGenoa
14/05/17,Roma,Juventus,3,1,H,2.4,3.3,2.75,2017-05-14,2016/2017,40,I1,3-1,2,-0.3500000000000001,2017-05-14RomaJuventus
14/05/17,Sampdoria,Chievo,1,1,D,2.0,3.3,3.6,2017-05-14,2016/2017,40,I1,1-1,0,-1.6,2017-05-14SampdoriaChievo
14/05/17,Torino,Napoli,0,5,A,5.5,4.3,1.5,2017-05-14,2016/2017,40,I1,0-5,-5,4.0,2017-05-14TorinoNapoli
20/05/17,Chievo,Roma,3,5,A,10.3,5.5,1.25,2017-05-20,2016/2017,41,I1,3-5,-2,9.05,2017-05-20ChievoRoma
20/05/17,Napoli,Fiorentina,4,1,H,1.35,4.8,7.6,2017-05-20,2016/2017,41,I1,4-1,3,-6.25,2017-05-20NapoliFiorentina
21/05/17,Empoli,Atalanta,0,1,A,2.0,3.4,3.5,2017-05-21,2016/2017,41,I1,0-1,-1,-1.5,2017-05-21EmpoliAtalanta
21/05/17,Genoa,Torino,2,1,H,1.7,3.6,4.7,2017-05-21,2016/2017,41,I1,2-1,1,-3.0,2017-05-21GenoaTorino
21/05/17,Juventus,Crotone,3,0,H,1.17,7.0,12.0,2017-05-21,2016/2017,41,I1,3-0,3,-10.83,2017-05-21JuventusCrotone
21/05/17,Lazio,Inter,1,3,A,2.0,3.5,3.4,2017-05-21,2016/2017,41,I1,1-3,-2,-1.4,2017-05-21LazioInter
21/05/17,Milan,Bologna,3,0,H,1.35,4.8,7.6,2017-05-21,2016/2017,41,I1,3-0,3,-6.25,2017-05-21MilanBologna
21/05/17,Sassuolo,Cagliari,6,2,H,1.8,3.6,4.0,2017-05-21,2016/2017,41,I1,6-2,4,-2.2,2017-05-21SassuoloCagliari
21/05/17,Udinese,Sampdoria,1,1,D,2.1,3.3,3.3,2017-05-21,2016/2017,41,I1,1-1,0,-1.1999999999999997,2017-05-21UdineseSampdoria
22/05/17,Pescara,Palermo,2,0,H,2.2,3.3,3.1,2017-05-22,2016/2017,42,I1,2-0,2,-0.8999999999999999,2017-05-22PescaraPalermo
27/05/17,Atalanta,Chievo,1,0,H,1.27,5.2,10.0,2017-05-27,2016/2017,42,I1,1-0,1,-8.73,2017-05-27AtalantaChievo
27/05/17,Bologna,Juventus,1,2,A,3.5,3.4,2.0,2017-05-27,2016/2017,42,I1,1-2,-1,1.5,2017-05-27BolognaJuventus
28/05/17,Cagliari,Milan,2,1,H,3.6,3.6,1.9,2017-05-28,2016/2017,42,I1,2-1,1,1.7000000000000002,2017-05-28CagliariMilan
28/05/17,Fiorentina,Pescara,2,2,D,1.17,6.5,14.0,2017-05-28,2016/2017,42,I1,2-2,0,-12.83,2017-05-28FiorentinaPescara
28/05/17,Inter,Udinese,5,2,H,1.4,4.5,7.0,2017-05-28,2016/2017,42,I1,5-2,3,-5.6,2017-05-28InterUdinese
28/05/17,Palermo,Empoli,2,1,H,4.4,4.0,1.65,2017-05-28,2016/2017,42,I1,2-1,1,2.7500000000000004,2017-05-28PalermoEmpoli
28/05/17,Roma,Genoa,3,2,H,1.07,9.5,22.0,2017-05-28,2016/2017,42,I1,3-2,1,-20.93,2017-05-28RomaGenoa
28/05/17,Sampdoria,Napoli,2,4,A,13.0,5.8,1.2,2017-05-28,2016/2017,42,I1,2-4,-2,11.8,2017-05-28SampdoriaNapoli
