Date,HomeTeam,AwayTeam,FTHG,FTAG,FTR,IWH,IWD,IWA,datetime,season,game_day,league,result,goal_diff,odds_diff,game_id
19/08/16,La Coruna,Eibar,2,1,H,2.0,3.3,3.6,2016-08-19,2016/2017,1,SP1,2-1,1,-1.6,2016-08-19La CorunaEibar
19/08/16,Malaga,Osasuna,1,1,D,1.7,3.6,4.7,2016-08-19,2016/2017,1,SP1,1-1,0,-3.0,2016-08-19MalagaOsasuna
20/08/16,Barcelona,Betis,6,2,H,1.1,8.0,20.0,2016-08-20,2016/2017,1,SP1,6-2,4,-18.9,2016-08-20BarcelonaBetis
20/08/16,Granada,Villarreal,1,1,D,2.6,3.2,2.6,2016-08-20,2016/2017,1,SP1,1-1,0,0.0,2016-08-20GranadaVillarreal
20/08/16,Sevilla,Espanol,6,4,H,1.6,3.7,5.4,2016-08-20,2016/2017,1,SP1,6-4,2,-3.8000000000000003,2016-08-20SevillaEspanol
21/08/16,Ath Madrid,Alaves,1,1,D,1.22,5.5,12.0,2016-08-21,2016/2017,1,SP1,1-1,0,-10.78,2016-08-21Ath MadridAlaves
21/08/16,Sociedad,Real Madrid,0,3,A,4.5,3.7,1.7,2016-08-21,2016/2017,1,SP1,0-3,-3,2.8,2016-08-21SociedadReal Madrid
21/08/16,Sp Gijon,Ath Bilbao,2,1,H,3.6,3.3,2.0,2016-08-21,2016/2017,1,SP1,2-1,1,1.6,2016-08-21Sp GijonAth Bilbao
22/08/16,Celta,Leganes,0,1,A,1.6,3.7,5.4,2016-08-22,2016/2017,1,SP1,0-1,-1,-3.8000000000000003,2016-08-22CeltaLeganes
22/08/16,Valencia,Las Palmas,2,4,A,1.75,3.5,4.5,2016-08-22,2016/2017,2,SP1,2-4,-2,-2.75,2016-08-22ValenciaLas Palmas
26/08/16,Betis,La Coruna,0,0,D,2.3,3.3,2.9,2016-08-26,2016/2017,2,SP1,0-0,0,-0.6000000000000001,2016-08-26BetisLa Coruna
26/08/16,Espanol,Malaga,2,2,D,2.3,3.2,3.0,2016-08-26,2016/2017,2,SP1,2-2,0,-0.7000000000000002,2016-08-26EspanolMalaga
27/08/16,Eibar,Valencia,1,0,H,2.6,3.2,2.6,2016-08-27,2016/2017,2,SP1,1-0,1,0.0,2016-08-27EibarValencia
27/08/16,Leganes,Ath Madrid,0,0,D,5.4,3.7,1.6,2016-08-27,2016/2017,2,SP1,0-0,0,3.8000000000000003,2016-08-27LeganesAth Madrid
27/08/16,Osasuna,Sociedad,0,2,A,2.6,3.2,2.6,2016-08-27,2016/2017,2,SP1,0-2,-2,0.0,2016-08-27OsasunaSociedad
27/08/16,Real Madrid,Celta,2,1,H,1.2,5.8,13.0,2016-08-27,2016/2017,2,SP1,2-1,1,-11.8,2016-08-27Real MadridCelta
28/08/16,Alaves,Sp Gijon,0,0,D,2.2,3.2,3.2,2016-08-28,2016/2017,2,SP1,0-0,0,-1.0,2016-08-28AlavesSp Gijon
28/08/16,Ath Bilbao,Barcelona,0,1,A,6.0,4.5,1.45,2016-08-28,2016/2017,2,SP1,0-1,-1,4.55,2016-08-28Ath BilbaoBarcelona
28/08/16,Las Palmas,Granada,5,1,H,2.0,3.2,3.75,2016-08-28,2016/2017,3,SP1,5-1,4,-1.75,2016-08-28Las PalmasGranada
28/08/16,Villarreal,Sevilla,0,0,D,2.5,3.3,2.65,2016-08-28,2016/2017,3,SP1,0-0,0,-0.1499999999999999,2016-08-28VillarrealSevilla
09/09/16,Sociedad,Espanol,1,1,D,2.0,3.3,3.6,2016-09-09,2016/2017,3,SP1,1-1,0,-1.6,2016-09-09SociedadEspanol
10/09/16,Barcelona,Alaves,1,2,A,1.08,9.0,22.0,2016-09-10,2016/2017,3,SP1,1-2,-1,-20.92,2016-09-10BarcelonaAlaves
10/09/16,Celta,Ath Madrid,0,4,A,4.2,3.5,1.8,2016-09-10,2016/2017,3,SP1,0-4,-4,2.4000000000000004,2016-09-10CeltaAth Madrid
10/09/16,Malaga,Villarreal,0,2,A,2.4,3.2,2.85,2016-09-10,2016/2017,3,SP1,0-2,-2,-0.4500000000000002,2016-09-10MalagaVillarreal
10/09/16,Real Madrid,Osasuna,5,2,H,1.07,9.5,22.0,2016-09-10,2016/2017,3,SP1,5-2,3,-20.93,2016-09-10Real MadridOsasuna
10/09/16,Sevilla,Las Palmas,2,1,H,1.7,3.7,4.5,2016-09-10,2016/2017,3,SP1,2-1,1,-2.8,2016-09-10SevillaLas Palmas
11/09/16,Granada,Eibar,1,2,A,2.3,3.1,3.1,2016-09-11,2016/2017,3,SP1,1-2,-1,-0.8000000000000003,2016-09-11GranadaEibar
11/09/16,La Coruna,Ath Bilbao,0,1,A,3.1,3.3,2.2,2016-09-11,2016/2017,4,SP1,0-1,-1,0.8999999999999999,2016-09-11La CorunaAth Bilbao
11/09/16,Sp Gijon,Leganes,2,1,H,2.2,3.15,3.25,2016-09-11,2016/2017,4,SP1,2-1,1,-1.0499999999999998,2016-09-11Sp GijonLeganes
11/09/16,Valencia,Betis,2,3,A,1.75,3.5,4.5,2016-09-11,2016/2017,4,SP1,2-3,-1,-2.75,2016-09-11ValenciaBetis
16/09/16,Betis,Granada,2,2,D,1.9,3.45,3.8,2016-09-16,2016/2017,4,SP1,2-2,0,-1.9,2016-09-16BetisGranada
17/09/16,Ath Madrid,Sp Gijon,5,0,H,1.22,5.5,12.0,2016-09-17,2016/2017,4,SP1,5-0,5,-10.78,2016-09-17Ath MadridSp Gijon
17/09/16,Eibar,Sevilla,1,1,D,2.75,3.3,2.4,2016-09-17,2016/2017,4,SP1,1-1,0,0.3500000000000001,2016-09-17EibarSevilla
17/09/16,Las Palmas,Malaga,1,0,H,2.25,3.2,3.1,2016-09-17,2016/2017,4,SP1,1-0,1,-0.8500000000000001,2016-09-17Las PalmasMalaga
17/09/16,Leganes,Barcelona,1,5,A,12.5,6.0,1.2,2016-09-17,2016/2017,4,SP1,1-5,-4,11.3,2016-09-17LeganesBarcelona
18/09/16,Ath Bilbao,Valencia,2,1,H,1.8,3.5,4.2,2016-09-18,2016/2017,4,SP1,2-1,1,-2.4000000000000004,2016-09-18Ath BilbaoValencia
18/09/16,Espanol,Real Madrid,0,2,A,9.0,5.0,1.3,2016-09-18,2016/2017,5,SP1,0-2,-2,7.7,2016-09-18EspanolReal Madrid
18/09/16,Osasuna,Celta,0,0,D,2.6,3.2,2.6,2016-09-18,2016/2017,5,SP1,0-0,0,0.0,2016-09-18OsasunaCelta
18/09/16,Villarreal,Sociedad,2,1,H,1.9,3.45,3.8,2016-09-18,2016/2017,5,SP1,2-1,1,-1.9,2016-09-18VillarrealSociedad
19/09/16,Alaves,La Coruna,0,0,D,2.2,3.2,3.2,2016-09-19,2016/2017,5,SP1,0-0,0,-1.0,2016-09-19AlavesLa Coruna
20/09/16,Malaga,Eibar,2,1,H,1.75,3.5,5.0,2016-09-20,2016/2017,5,SP1,2-1,1,-3.25,2016-09-20MalagaEibar
20/09/16,Sevilla,Betis,1,0,H,1.5,4.5,6.0,2016-09-20,2016/2017,5,SP1,1-0,1,-4.5,2016-09-20SevillaBetis
21/09/16,Barcelona,Ath Madrid,1,1,D,1.6,4.0,5.5,2016-09-21,2016/2017,5,SP1,1-1,0,-3.9,2016-09-21BarcelonaAth Madrid
21/09/16,Celta,Sp Gijon,2,1,H,1.65,3.8,5.3,2016-09-21,2016/2017,5,SP1,2-1,1,-3.65,2016-09-21CeltaSp Gijon
21/09/16,Granada,Ath Bilbao,1,2,A,3.8,3.4,2.0,2016-09-21,2016/2017,5,SP1,1-2,-1,1.7999999999999998,2016-09-21GranadaAth Bilbao
21/09/16,Real Madrid,Villarreal,1,1,D,1.2,6.5,15.0,2016-09-21,2016/2017,6,SP1,1-1,0,-13.8,2016-09-21Real MadridVillarreal
21/09/16,Sociedad,Las Palmas,4,1,H,2.0,3.3,3.9,2016-09-21,2016/2017,6,SP1,4-1,3,-1.9,2016-09-21SociedadLas Palmas
22/09/16,La Coruna,Leganes,1,2,A,2.0,3.2,4.1,2016-09-22,2016/2017,6,SP1,1-2,-1,-2.0999999999999996,2016-09-22La CorunaLeganes
22/09/16,Osasuna,Espanol,1,2,A,2.65,3.3,2.65,2016-09-22,2016/2017,6,SP1,1-2,-1,0.0,2016-09-22OsasunaEspanol
22/09/16,Valencia,Alaves,2,1,H,1.75,3.8,4.5,2016-09-22,2016/2017,6,SP1,2-1,1,-2.75,2016-09-22ValenciaAlaves
23/09/16,Betis,Malaga,1,0,H,2.55,3.15,2.9,2016-09-23,2016/2017,6,SP1,1-0,1,-0.3500000000000001,2016-09-23BetisMalaga
24/09/16,Ath Bilbao,Sevilla,3,1,H,2.1,3.4,3.5,2016-09-24,2016/2017,6,SP1,3-1,2,-1.4,2016-09-24Ath BilbaoSevilla
24/09/16,Eibar,Sociedad,2,0,H,2.6,3.2,2.8,2016-09-24,2016/2017,6,SP1,2-0,2,-0.19999999999999973,2016-09-24EibarSociedad
24/09/16,Las Palmas,Real Madrid,2,2,D,8.0,5.0,1.37,2016-09-24,2016/2017,6,SP1,2-2,0,6.63,2016-09-24Las PalmasReal Madrid
24/09/16,Sp Gijon,Barcelona,0,5,A,9.5,5.5,1.3,2016-09-24,2016/2017,7,SP1,0-5,-5,8.2,2016-09-24Sp GijonBarcelona
25/09/16,Ath Madrid,La Coruna,1,0,H,1.22,6.5,12.5,2016-09-25,2016/2017,7,SP1,1-0,1,-11.28,2016-09-25Ath MadridLa Coruna
25/09/16,Espanol,Celta,0,2,A,2.2,3.35,3.3,2016-09-25,2016/2017,7,SP1,0-2,-2,-1.0999999999999996,2016-09-25EspanolCelta
25/09/16,Leganes,Valencia,1,2,A,2.85,3.3,2.5,2016-09-25,2016/2017,7,SP1,1-2,-1,0.3500000000000001,2016-09-25LeganesValencia
25/09/16,Villarreal,Osasuna,3,1,H,1.4,4.8,7.5,2016-09-25,2016/2017,7,SP1,3-1,2,-6.1,2016-09-25VillarrealOsasuna
26/09/16,Alaves,Granada,3,1,H,2.0,3.4,3.8,2016-09-26,2016/2017,7,SP1,3-1,2,-1.7999999999999998,2016-09-26AlavesGranada
30/09/16,Sociedad,Betis,1,0,H,1.85,3.5,4.3,2016-09-30,2016/2017,7,SP1,1-0,1,-2.4499999999999997,2016-09-30SociedadBetis
01/10/16,Granada,Leganes,0,1,A,2.4,3.2,3.05,2016-10-01,2016/2017,7,SP1,0-1,-1,-0.6499999999999999,2016-10-01GranadaLeganes
01/10/16,La Coruna,Sp Gijon,2,1,H,2.0,3.3,3.95,2016-10-01,2016/2017,7,SP1,2-1,1,-1.9500000000000002,2016-10-01La CorunaSp Gijon
01/10/16,Osasuna,Las Palmas,2,2,D,2.75,3.25,2.6,2016-10-01,2016/2017,8,SP1,2-2,0,0.1499999999999999,2016-10-01OsasunaLas Palmas
01/10/16,Sevilla,Alaves,2,1,H,1.5,4.2,6.5,2016-10-01,2016/2017,8,SP1,2-1,1,-5.0,2016-10-01SevillaAlaves
02/10/16,Celta,Barcelona,4,3,H,7.5,4.8,1.4,2016-10-02,2016/2017,8,SP1,4-3,1,6.1,2016-10-02CeltaBarcelona
02/10/16,Espanol,Villarreal,0,0,D,2.77,3.2,2.6,2016-10-02,2016/2017,8,SP1,0-0,0,0.16999999999999993,2016-10-02EspanolVillarreal
02/10/16,Malaga,Ath Bilbao,2,1,H,2.75,3.25,2.6,2016-10-02,2016/2017,8,SP1,2-1,1,0.1499999999999999,2016-10-02MalagaAth Bilbao
02/10/16,Real Madrid,Eibar,1,1,D,1.11,9.0,23.0,2016-10-02,2016/2017,8,SP1,1-1,0,-21.89,2016-10-02Real MadridEibar
02/10/16,Valencia,Ath Madrid,0,2,A,4.1,3.5,1.9,2016-10-02,2016/2017,8,SP1,0-2,-2,2.1999999999999997,2016-10-02ValenciaAth Madrid
14/10/16,Las Palmas,Espanol,0,0,D,2.1,3.4,3.5,2016-10-14,2016/2017,8,SP1,0-0,0,-1.4,2016-10-14Las PalmasEspanol
15/10/16,Ath Madrid,Granada,7,1,H,1.15,7.5,18.0,2016-10-15,2016/2017,8,SP1,7-1,6,-16.85,2016-10-15Ath MadridGranada
15/10/16,Barcelona,La Coruna,4,0,H,1.12,9.0,20.0,2016-10-15,2016/2017,9,SP1,4-0,4,-18.88,2016-10-15BarcelonaLa Coruna
15/10/16,Betis,Real Madrid,1,6,A,8.0,5.0,1.37,2016-10-15,2016/2017,9,SP1,1-6,-5,6.63,2016-10-15BetisReal Madrid
15/10/16,Leganes,Sevilla,2,3,A,3.15,3.3,2.3,2016-10-15,2016/2017,9,SP1,2-3,-1,0.8500000000000001,2016-10-15LeganesSevilla
16/10/16,Alaves,Malaga,1,1,D,2.7,3.1,2.75,2016-10-16,2016/2017,9,SP1,1-1,0,-0.04999999999999982,2016-10-16AlavesMalaga
16/10/16,Ath Bilbao,Sociedad,3,2,H,1.8,3.6,4.5,2016-10-16,2016/2017,9,SP1,3-2,1,-2.7,2016-10-16Ath BilbaoSociedad
16/10/16,Sp Gijon,Valencia,1,2,A,3.3,3.35,2.2,2016-10-16,2016/2017,9,SP1,1-2,-1,1.0999999999999996,2016-10-16Sp GijonValencia
16/10/16,Villarreal,Celta,5,0,H,1.9,3.5,4.1,2016-10-16,2016/2017,9,SP1,5-0,5,-2.1999999999999997,2016-10-16VillarrealCelta
17/10/16,Eibar,Osasuna,2,3,A,1.75,3.6,4.8,2016-10-17,2016/2017,9,SP1,2-3,-1,-3.05,2016-10-17EibarOsasuna
21/10/16,Osasuna,Betis,1,2,A,2.5,3.3,2.85,2016-10-21,2016/2017,9,SP1,1-2,-1,-0.3500000000000001,2016-10-21OsasunaBetis
22/10/16,Espanol,Eibar,3,3,D,2.0,3.4,3.8,2016-10-22,2016/2017,10,SP1,3-3,0,-1.7999999999999998,2016-10-22EspanolEibar
22/10/16,Granada,Sp Gijon,0,0,D,2.3,3.2,3.25,2016-10-22,2016/2017,10,SP1,0-0,0,-0.9500000000000002,2016-10-22GranadaSp Gijon
22/10/16,Sociedad,Alaves,3,0,H,1.75,3.6,4.8,2016-10-22,2016/2017,10,SP1,3-0,3,-3.05,2016-10-22SociedadAlaves
22/10/16,Valencia,Barcelona,2,3,A,7.0,4.5,1.45,2016-10-22,2016/2017,10,SP1,2-3,-1,5.55,2016-10-22ValenciaBarcelona
23/10/16,Celta,La Coruna,4,1,H,1.7,3.7,5.0,2016-10-23,2016/2017,10,SP1,4-1,3,-3.3,2016-10-23CeltaLa Coruna
23/10/16,Malaga,Leganes,4,0,H,1.8,3.6,4.5,2016-10-23,2016/2017,10,SP1,4-0,4,-2.7,2016-10-23MalagaLeganes
23/10/16,Real Madrid,Ath Bilbao,2,1,H,1.25,6.0,11.0,2016-10-23,2016/2017,10,SP1,2-1,1,-9.75,2016-10-23Real MadridAth Bilbao
23/10/16,Sevilla,Ath Madrid,1,0,H,3.5,3.4,2.1,2016-10-23,2016/2017,10,SP1,1-0,1,1.4,2016-10-23SevillaAth Madrid
23/10/16,Villarreal,Las Palmas,2,1,H,1.6,3.9,5.7,2016-10-23,2016/2017,10,SP1,2-1,1,-4.1,2016-10-23VillarrealLas Palmas
28/10/16,Leganes,Sociedad,0,2,A,2.7,3.2,2.7,2016-10-28,2016/2017,11,SP1,0-2,-2,0.0,2016-10-28LeganesSociedad
29/10/16,Alaves,Real Madrid,1,4,A,13.5,6.2,1.22,2016-10-29,2016/2017,11,SP1,1-4,-3,12.28,2016-10-29AlavesReal Madrid
29/10/16,Ath Madrid,Malaga,4,2,H,1.25,6.0,11.0,2016-10-29,2016/2017,11,SP1,4-2,2,-9.75,2016-10-29Ath MadridMalaga
29/10/16,Barcelona,Granada,1,0,H,1.05,13.0,36.0,2016-10-29,2016/2017,11,SP1,1-0,1,-34.95,2016-10-29BarcelonaGranada
29/10/16,Sp Gijon,Sevilla,1,1,D,4.1,3.5,1.9,2016-10-29,2016/2017,11,SP1,1-1,0,2.1999999999999997,2016-10-29Sp GijonSevilla
30/10/16,Ath Bilbao,Osasuna,1,1,D,1.45,4.5,7.0,2016-10-30,2016/2017,11,SP1,1-1,0,-5.55,2016-10-30Ath BilbaoOsasuna
30/10/16,Betis,Espanol,0,1,A,2.1,3.4,3.5,2016-10-30,2016/2017,11,SP1,0-1,-1,-1.4,2016-10-30BetisEspanol
30/10/16,Eibar,Villarreal,2,1,H,3.15,3.1,2.4,2016-10-30,2016/2017,11,SP1,2-1,1,0.75,2016-10-30EibarVillarreal
30/10/16,Las Palmas,Celta,3,3,D,2.4,3.3,2.95,2016-10-30,2016/2017,11,SP1,3-3,0,-0.5500000000000003,2016-10-30Las PalmasCelta
31/10/16,La Coruna,Valencia,1,1,D,2.85,3.3,2.5,2016-10-31,2016/2017,12,SP1,1-1,0,0.3500000000000001,2016-10-31La CorunaValencia
04/11/16,Malaga,Sp Gijon,3,2,H,1.75,3.6,4.8,2016-11-04,2016/2017,12,SP1,3-2,1,-3.05,2016-11-04MalagaSp Gijon
05/11/16,Granada,La Coruna,1,1,D,2.6,3.25,2.75,2016-11-05,2016/2017,12,SP1,1-1,0,-0.1499999999999999,2016-11-05GranadaLa Coruna
05/11/16,Las Palmas,Eibar,1,0,H,2.05,3.3,3.8,2016-11-05,2016/2017,12,SP1,1-0,1,-1.75,2016-11-05Las PalmasEibar
05/11/16,Osasuna,Alaves,0,1,A,2.2,3.2,3.45,2016-11-05,2016/2017,12,SP1,0-1,-1,-1.25,2016-11-05OsasunaAlaves
05/11/16,Sociedad,Ath Madrid,2,0,H,5.0,3.7,1.7,2016-11-05,2016/2017,12,SP1,2-0,2,3.3,2016-11-05SociedadAth Madrid
06/11/16,Celta,Valencia,2,1,H,2.3,3.3,3.15,2016-11-06,2016/2017,12,SP1,2-1,1,-0.8500000000000001,2016-11-06CeltaValencia
06/11/16,Espanol,Ath Bilbao,0,0,D,2.85,3.3,2.5,2016-11-06,2016/2017,12,SP1,0-0,0,0.3500000000000001,2016-11-06EspanolAth Bilbao
06/11/16,Real Madrid,Leganes,3,0,H,1.05,13.0,36.0,2016-11-06,2016/2017,12,SP1,3-0,3,-34.95,2016-11-06Real MadridLeganes
06/11/16,Sevilla,Barcelona,1,2,A,5.3,3.8,1.65,2016-11-06,2016/2017,13,SP1,1-2,-1,3.65,2016-11-06SevillaBarcelona
06/11/16,Villarreal,Betis,2,0,H,1.5,4.2,6.5,2016-11-06,2016/2017,13,SP1,2-0,2,-5.0,2016-11-06VillarrealBetis
18/11/16,Betis,Las Palmas,2,0,H,2.4,3.3,2.95,2016-11-18,2016/2017,13,SP1,2-0,2,-0.5500000000000003,2016-11-18BetisLas Palmas
19/11/16,Ath Madrid,Real Madrid,0,3,A,2.5,3.3,2.85,2016-11-19,2016/2017,13,SP1,0-3,-3,-0.3500000000000001,2016-11-19Ath MadridReal Madrid
19/11/16,Barcelona,Malaga,0,0,D,1.12,9.0,20.0,2016-11-19,2016/2017,13,SP1,0-0,0,-18.88,2016-11-19BarcelonaMalaga
19/11/16,Eibar,Celta,1,0,H,2.5,3.3,2.85,2016-11-19,2016/2017,13,SP1,1-0,1,-0.3500000000000001,2016-11-19EibarCelta
19/11/16,La Coruna,Sevilla,2,3,A,3.3,3.35,2.2,2016-11-19,2016/2017,13,SP1,2-3,-1,1.0999999999999996,2016-11-19La CorunaSevilla
20/11/16,Alaves,Espanol,0,1,A,2.5,3.1,3.0,2016-11-20,2016/2017,13,SP1,0-1,-1,-0.5,2016-11-20AlavesEspanol
20/11/16,Ath Bilbao,Villarreal,1,0,H,2.0,3.4,3.8,2016-11-20,2016/2017,13,SP1,1-0,1,-1.7999999999999998,2016-11-20Ath BilbaoVillarreal
20/11/16,Sp Gijon,Sociedad,1,3,A,3.35,3.3,2.2,2016-11-20,2016/2017,14,SP1,1-3,-2,1.15,2016-11-20Sp GijonSociedad
20/11/16,Valencia,Granada,1,1,D,1.4,4.8,7.5,2016-11-20,2016/2017,14,SP1,1-1,0,-6.1,2016-11-20ValenciaGranada
21/11/16,Leganes,Osasuna,2,0,H,1.9,3.5,4.1,2016-11-21,2016/2017,14,SP1,2-0,2,-2.1999999999999997,2016-11-21LeganesOsasuna
25/11/16,Eibar,Betis,3,1,H,2.0,3.4,3.8,2016-11-25,2016/2017,14,SP1,3-1,2,-1.7999999999999998,2016-11-25EibarBetis
26/11/16,Espanol,Leganes,3,0,H,1.85,3.5,4.3,2016-11-26,2016/2017,14,SP1,3-0,3,-2.4499999999999997,2016-11-26EspanolLeganes
26/11/16,Malaga,La Coruna,4,3,H,1.85,3.5,4.3,2016-11-26,2016/2017,14,SP1,4-3,1,-2.4499999999999997,2016-11-26MalagaLa Coruna
26/11/16,Real Madrid,Sp Gijon,2,1,H,1.05,13.0,36.0,2016-11-26,2016/2017,14,SP1,2-1,1,-34.95,2016-11-26Real MadridSp Gijon
26/11/16,Sevilla,Valencia,2,1,H,1.75,3.6,4.8,2016-11-26,2016/2017,14,SP1,2-1,1,-3.05,2016-11-26SevillaValencia
27/11/16,Celta,Granada,3,1,H,1.5,4.2,6.5,2016-11-27,2016/2017,14,SP1,3-1,2,-5.0,2016-11-27CeltaGranada
27/11/16,Osasuna,Ath Madrid,0,3,A,8.0,5.3,1.35,2016-11-27,2016/2017,15,SP1,0-3,-3,6.65,2016-11-27OsasunaAth Madrid
27/11/16,Sociedad,Barcelona,1,1,D,5.2,4.2,1.6,2016-11-27,2016/2017,15,SP1,1-1,0,3.6,2016-11-27SociedadBarcelona
27/11/16,Villarreal,Alaves,0,2,A,1.5,4.2,6.5,2016-11-27,2016/2017,15,SP1,0-2,-2,-5.0,2016-11-27VillarrealAlaves
28/11/16,Las Palmas,Ath Bilbao,3,1,H,2.4,3.3,2.95,2016-11-28,2016/2017,15,SP1,3-1,2,-0.5500000000000003,2016-11-28Las PalmasAth Bilbao
03/12/16,Ath Madrid,Espanol,0,0,D,1.3,5.5,9.5,2016-12-03,2016/2017,15,SP1,0-0,0,-8.2,2016-12-03Ath MadridEspanol
03/12/16,Barcelona,Real Madrid,1,1,D,1.85,3.8,4.0,2016-12-03,2016/2017,15,SP1,1-1,0,-2.15,2016-12-03BarcelonaReal Madrid
03/12/16,Granada,Sevilla,2,1,H,4.3,3.5,1.85,2016-12-03,2016/2017,15,SP1,2-1,1,2.4499999999999997,2016-12-03GranadaSevilla
03/12/16,Leganes,Villarreal,0,0,D,2.95,3.3,2.4,2016-12-03,2016/2017,15,SP1,0-0,0,0.5500000000000003,2016-12-03LeganesVillarreal
04/12/16,Alaves,Las Palmas,1,1,D,2.4,3.2,3.05,2016-12-04,2016/2017,15,SP1,1-1,0,-0.6499999999999999,2016-12-04AlavesLas Palmas
04/12/16,Ath Bilbao,Eibar,3,1,H,1.75,3.7,4.7,2016-12-04,2016/2017,16,SP1,3-1,2,-2.95,2016-12-04Ath BilbaoEibar
04/12/16,Betis,Celta,3,3,D,2.4,3.3,2.95,2016-12-04,2016/2017,16,SP1,3-3,0,-0.5500000000000003,2016-12-04BetisCelta
04/12/16,Sp Gijon,Osasuna,3,1,H,2.15,3.2,3.6,2016-12-04,2016/2017,16,SP1,3-1,2,-1.4500000000000002,2016-12-04Sp GijonOsasuna
04/12/16,Valencia,Malaga,2,2,D,1.9,3.5,4.1,2016-12-04,2016/2017,16,SP1,2-2,0,-2.1999999999999997,2016-12-04ValenciaMalaga
05/12/16,La Coruna,Sociedad,5,1,H,2.85,3.3,2.5,2016-12-05,2016/2017,16,SP1,5-1,4,0.3500000000000001,2016-12-05La CorunaSociedad
09/12/16,Malaga,Granada,1,1,D,1.7,3.7,5.0,2016-12-09,2016/2017,16,SP1,1-1,0,-3.3,2016-12-09MalagaGranada
10/12/16,Las Palmas,Leganes,1,1,D,1.8,3.6,4.5,2016-12-10,2016/2017,16,SP1,1-1,0,-2.7,2016-12-10Las PalmasLeganes
10/12/16,Osasuna,Barcelona,0,3,A,11.0,6.0,1.25,2016-12-10,2016/2017,16,SP1,0-3,-3,9.75,2016-12-10OsasunaBarcelona
10/12/16,Sociedad,Valencia,3,2,H,2.0,3.4,3.8,2016-12-10,2016/2017,16,SP1,3-2,1,-1.7999999999999998,2016-12-10SociedadValencia
11/12/16,Betis,Ath Bilbao,1,0,H,3.15,3.3,2.3,2016-12-11,2016/2017,17,SP1,1-0,1,0.8500000000000001,2016-12-11BetisAth Bilbao
11/12/16,Celta,Sevilla,0,3,A,2.85,3.3,2.5,2016-12-11,2016/2017,17,SP1,0-3,-3,0.3500000000000001,2016-12-11CeltaSevilla
11/12/16,Eibar,Alaves,0,0,D,2.0,3.4,3.8,2016-12-11,2016/2017,17,SP1,0-0,0,-1.7999999999999998,2016-12-11EibarAlaves
11/12/16,Espanol,Sp Gijon,2,1,H,1.75,3.6,4.8,2016-12-11,2016/2017,17,SP1,2-1,1,-3.05,2016-12-11EspanolSp Gijon
12/12/16,Villarreal,Ath Madrid,3,0,H,3.8,3.4,2.0,2016-12-12,2016/2017,17,SP1,3-0,3,1.7999999999999998,2016-12-12VillarrealAth Madrid
16/12/16,Alaves,Betis,1,0,H,2.2,3.35,3.3,2016-12-16,2016/2017,17,SP1,1-0,1,-1.0999999999999996,2016-12-16AlavesBetis
17/12/16,Ath Madrid,Las Palmas,1,0,H,1.3,5.5,9.5,2016-12-17,2016/2017,17,SP1,1-0,1,-8.2,2016-12-17Ath MadridLas Palmas
17/12/16,Granada,Sociedad,0,2,A,3.5,3.4,2.1,2016-12-17,2016/2017,17,SP1,0-2,-2,1.4,2016-12-17GranadaSociedad
17/12/16,Sevilla,Malaga,4,1,H,1.55,4.0,6.2,2016-12-17,2016/2017,17,SP1,4-1,3,-4.65,2016-12-17SevillaMalaga
17/12/16,Sp Gijon,Villarreal,1,3,A,3.5,3.4,2.1,2016-12-17,2016/2017,18,SP1,1-3,-2,1.4,2016-12-17Sp GijonVillarreal
18/12/16,Barcelona,Espanol,4,1,H,1.17,7.5,15.0,2016-12-18,2016/2017,18,SP1,4-1,3,-13.83,2016-12-18BarcelonaEspanol
18/12/16,La Coruna,Osasuna,2,0,H,1.7,3.7,5.0,2016-12-18,2016/2017,18,SP1,2-0,2,-3.3,2016-12-18La CorunaOsasuna
18/12/16,Leganes,Eibar,1,1,D,2.4,3.1,3.15,2016-12-18,2016/2017,18,SP1,1-1,0,-0.75,2016-12-18LeganesEibar
19/12/16,Ath Bilbao,Celta,2,1,H,1.8,3.6,4.5,2016-12-19,2016/2017,18,SP1,2-1,1,-2.7,2016-12-19Ath BilbaoCelta
06/01/17,Espanol,La Coruna,1,1,D,2.0,3.4,3.8,2017-01-06,2016/2017,18,SP1,1-1,0,-1.7999999999999998,2017-01-06EspanolLa Coruna
07/01/17,Eibar,Ath Madrid,0,2,A,5.3,3.8,1.65,2017-01-07,2016/2017,18,SP1,0-2,-2,3.65,2017-01-07EibarAth Madrid
07/01/17,Las Palmas,Sp Gijon,1,0,H,1.7,3.7,5.0,2017-01-07,2016/2017,18,SP1,1-0,1,-3.3,2017-01-07Las PalmasSp Gijon
07/01/17,Real Madrid,Granada,5,0,H,1.07,12.0,26.0,2017-01-07,2016/2017,18,SP1,5-0,5,-24.93,2017-01-07Real MadridGranada
07/01/17,Sociedad,Sevilla,0,4,A,2.3,3.3,3.15,2017-01-07,2016/2017,19,SP1,0-4,-4,-0.8500000000000001,2017-01-07SociedadSevilla
08/01/17,Ath Bilbao,Alaves,0,0,D,1.57,3.9,6.1,2017-01-08,2016/2017,19,SP1,0-0,0,-4.529999999999999,2017-01-08Ath BilbaoAlaves
08/01/17,Betis,Leganes,2,0,H,2.0,3.4,3.8,2017-01-08,2016/2017,19,SP1,2-0,2,-1.7999999999999998,2017-01-08BetisLeganes
08/01/17,Celta,Malaga,3,1,H,1.9,3.5,4.1,2017-01-08,2016/2017,19,SP1,3-1,2,-2.1999999999999997,2017-01-08CeltaMalaga
08/01/17,Villarreal,Barcelona,1,1,D,6.2,4.0,1.55,2017-01-08,2016/2017,19,SP1,1-1,0,4.65,2017-01-08VillarrealBarcelona
09/01/17,Osasuna,Valencia,3,3,D,3.8,3.4,2.0,2017-01-09,2016/2017,19,SP1,3-3,0,1.7999999999999998,2017-01-09OsasunaValencia
14/01/17,Ath Madrid,Betis,1,0,H,1.22,6.2,13.5,2017-01-14,2016/2017,19,SP1,1-0,1,-12.28,2017-01-14Ath MadridBetis
14/01/17,Barcelona,Las Palmas,5,0,H,1.07,12.0,26.0,2017-01-14,2016/2017,19,SP1,5-0,5,-24.93,2017-01-14BarcelonaLas Palmas
14/01/17,La Coruna,Villarreal,0,0,D,2.75,3.25,2.6,2017-01-14,2016/2017,19,SP1,0-0,0,0.1499999999999999,2017-01-14La CorunaVillarreal
14/01/17,Leganes,Ath Bilbao,0,0,D,3.15,3.3,2.3,2017-01-14,2016/2017,20,SP1,0-0,0,0.8500000000000001,2017-01-14LeganesAth Bilbao
15/01/17,Celta,Alaves,1,0,H,1.7,3.7,5.0,2017-01-15,2016/2017,20,SP1,1-0,1,-3.3,2017-01-15CeltaAlaves
15/01/17,Granada,Osasuna,1,1,D,2.0,3.4,3.8,2017-01-15,2016/2017,20,SP1,1-1,0,-1.7999999999999998,2017-01-15GranadaOsasuna
15/01/17,Sevilla,Real Madrid,2,1,H,3.6,3.6,2.0,2017-01-15,2016/2017,20,SP1,2-1,1,1.6,2017-01-15SevillaReal Madrid
15/01/17,Sp Gijon,Eibar,2,3,A,2.7,3.2,2.7,2017-01-15,2016/2017,20,SP1,2-3,-1,0.0,2017-01-15Sp GijonEibar
15/01/17,Valencia,Espanol,2,1,H,1.9,3.5,4.1,2017-01-15,2016/2017,20,SP1,2-1,1,-2.1999999999999997,2017-01-15ValenciaEspanol
16/01/17,Malaga,Sociedad,0,2,A,2.5,3.3,2.85,2017-01-16,2016/2017,20,SP1,0-2,-2,-0.3500000000000001,2017-01-16MalagaSociedad
20/01/17,Las Palmas,La Coruna,1,1,D,2.3,3.3,3.15,2017-01-20,2016/2017,20,SP1,1-1,0,-0.8500000000000001,2017-01-20Las PalmasLa Coruna
21/01/17,Alaves,Leganes,2,2,D,2.2,3.15,3.5,2017-01-21,2016/2017,20,SP1,2-2,0,-1.2999999999999998,2017-01-21AlavesLeganes
21/01/17,Espanol,Granada,3,1,H,1.65,3.8,5.3,2017-01-21,2016/2017,21,SP1,3-1,2,-3.65,2017-01-21EspanolGranada
21/01/17,Real Madrid,Malaga,2,1,H,1.17,7.5,15.0,2017-01-21,2016/2017,21,SP1,2-1,1,-13.83,2017-01-21Real MadridMalaga
21/01/17,Villarreal,Valencia,0,2,A,1.9,3.5,4.1,2017-01-21,2016/2017,21,SP1,0-2,-2,-2.1999999999999997,2017-01-21VillarrealValencia
22/01/17,Ath Bilbao,Ath Madrid,2,2,D,3.5,3.4,2.1,2017-01-22,2016/2017,21,SP1,2-2,0,1.4,2017-01-22Ath BilbaoAth Madrid
22/01/17,Betis,Sp Gijon,0,0,D,1.7,3.7,5.0,2017-01-22,2016/2017,21,SP1,0-0,0,-3.3,2017-01-22BetisSp Gijon
22/01/17,Eibar,Barcelona,0,4,A,11.0,6.0,1.25,2017-01-22,2016/2017,21,SP1,0-4,-4,9.75,2017-01-22EibarBarcelona
22/01/17,Osasuna,Sevilla,3,4,A,5.3,3.8,1.65,2017-01-22,2016/2017,21,SP1,3-4,-1,3.65,2017-01-22OsasunaSevilla
22/01/17,Sociedad,Celta,1,0,H,2.1,3.4,3.5,2017-01-22,2016/2017,21,SP1,1-0,1,-1.4,2017-01-22SociedadCelta
27/01/17,Osasuna,Malaga,1,1,D,2.95,3.3,2.4,2017-01-27,2016/2017,21,SP1,1-1,0,0.5500000000000003,2017-01-27OsasunaMalaga
28/01/17,Alaves,Ath Madrid,0,0,D,5.3,3.8,1.65,2017-01-28,2016/2017,22,SP1,0-0,0,3.65,2017-01-28AlavesAth Madrid
28/01/17,Eibar,La Coruna,3,1,H,2.2,3.25,3.4,2017-01-28,2016/2017,22,SP1,3-1,2,-1.1999999999999997,2017-01-28EibarLa Coruna
28/01/17,Leganes,Celta,0,2,A,2.6,3.2,2.8,2017-01-28,2016/2017,22,SP1,0-2,-2,-0.19999999999999973,2017-01-28LeganesCelta
28/01/17,Villarreal,Granada,2,0,H,1.37,5.0,8.0,2017-01-28,2016/2017,22,SP1,2-0,2,-6.63,2017-01-28VillarrealGranada
29/01/17,Ath Bilbao,Sp Gijon,2,1,H,1.37,5.0,8.0,2017-01-29,2016/2017,22,SP1,2-1,1,-6.63,2017-01-29Ath BilbaoSp Gijon
29/01/17,Betis,Barcelona,1,1,D,11.0,6.0,1.25,2017-01-29,2016/2017,22,SP1,1-1,0,9.75,2017-01-29BetisBarcelona
29/01/17,Espanol,Sevilla,3,1,H,3.5,3.4,2.1,2017-01-29,2016/2017,22,SP1,3-1,2,1.4,2017-01-29EspanolSevilla
29/01/17,Real Madrid,Sociedad,3,0,H,1.25,6.5,10.0,2017-01-29,2016/2017,22,SP1,3-0,3,-8.75,2017-01-29Real MadridSociedad
30/01/17,Las Palmas,Valencia,3,1,H,2.5,3.3,2.85,2017-01-30,2016/2017,22,SP1,3-1,2,-0.3500000000000001,2017-01-30Las PalmasValencia
04/02/17,Ath Madrid,Leganes,2,0,H,1.3,5.5,9.5,2017-02-04,2016/2017,23,SP1,2-0,2,-8.2,2017-02-04Ath MadridLeganes
04/02/17,Barcelona,Ath Bilbao,3,0,H,1.25,6.0,11.0,2017-02-04,2016/2017,23,SP1,3-0,3,-9.75,2017-02-04BarcelonaAth Bilbao
04/02/17,Malaga,Espanol,0,1,A,2.1,3.4,3.5,2017-02-04,2016/2017,23,SP1,0-1,-1,-1.4,2017-02-04MalagaEspanol
04/02/17,Valencia,Eibar,0,4,A,1.8,3.6,4.5,2017-02-04,2016/2017,23,SP1,0-4,-4,-2.7,2017-02-04ValenciaEibar
05/02/17,Sevilla,Villarreal,0,0,D,1.7,3.7,5.0,2017-02-05,2016/2017,23,SP1,0-0,0,-3.3,2017-02-05SevillaVillarreal
05/02/17,Sociedad,Osasuna,3,2,H,1.37,5.0,8.0,2017-02-05,2016/2017,23,SP1,3-2,1,-6.63,2017-02-05SociedadOsasuna
05/02/17,Sp Gijon,Alaves,2,4,A,2.2,3.35,3.3,2017-02-05,2016/2017,23,SP1,2-4,-2,-1.0999999999999996,2017-02-05Sp GijonAlaves
06/02/17,Granada,Las Palmas,1,0,H,2.9,3.2,2.5,2017-02-06,2016/2017,23,SP1,1-0,1,0.3999999999999999,2017-02-06GranadaLas Palmas
10/02/17,Espanol,Sociedad,1,2,A,2.6,3.25,2.75,2017-02-10,2016/2017,23,SP1,1-2,-1,-0.1499999999999999,2017-02-10EspanolSociedad
11/02/17,Alaves,Barcelona,0,6,A,8.7,5.3,1.33,2017-02-11,2016/2017,24,SP1,0-6,-6,7.369999999999999,2017-02-11AlavesBarcelona
11/02/17,Ath Bilbao,La Coruna,2,1,H,1.65,3.8,5.3,2017-02-11,2016/2017,24,SP1,2-1,1,-3.65,2017-02-11Ath BilbaoLa Coruna
11/02/17,Betis,Valencia,0,0,D,2.6,3.25,2.75,2017-02-11,2016/2017,24,SP1,0-0,0,-0.1499999999999999,2017-02-11BetisValencia
11/02/17,Osasuna,Real Madrid,1,3,A,11.0,6.0,1.25,2017-02-11,2016/2017,24,SP1,1-3,-2,9.75,2017-02-11OsasunaReal Madrid
12/02/17,Ath Madrid,Celta,3,2,H,1.35,5.0,8.5,2017-02-12,2016/2017,24,SP1,3-2,1,-7.15,2017-02-12Ath MadridCelta
12/02/17,Las Palmas,Sevilla,0,1,A,3.3,3.35,2.2,2017-02-12,2016/2017,24,SP1,0-1,-1,1.0999999999999996,2017-02-12Las PalmasSevilla
12/02/17,Leganes,Sp Gijon,0,2,A,1.8,3.6,4.5,2017-02-12,2016/2017,24,SP1,0-2,-2,-2.7,2017-02-12LeganesSp Gijon
12/02/17,Villarreal,Malaga,1,1,D,1.7,3.7,5.0,2017-02-12,2016/2017,24,SP1,1-1,0,-3.3,2017-02-12VillarrealMalaga
13/02/17,Eibar,Granada,4,0,H,1.6,3.9,5.7,2017-02-13,2016/2017,24,SP1,4-0,4,-4.1,2017-02-13EibarGranada
17/02/17,Granada,Betis,4,1,H,2.65,3.3,2.65,2017-02-17,2016/2017,25,SP1,4-1,3,0.0,2017-02-17GranadaBetis
18/02/17,La Coruna,Alaves,0,1,A,2.1,3.4,3.5,2017-02-18,2016/2017,25,SP1,0-1,-1,-1.4,2017-02-18La CorunaAlaves
18/02/17,Real Madrid,Espanol,2,0,H,1.2,6.5,15.0,2017-02-18,2016/2017,25,SP1,2-0,2,-13.8,2017-02-18Real MadridEspanol
18/02/17,Sevilla,Eibar,2,0,H,1.5,4.2,6.5,2017-02-18,2016/2017,25,SP1,2-0,2,-5.0,2017-02-18SevillaEibar
18/02/17,Sp Gijon,Ath Madrid,1,4,A,6.5,4.2,1.5,2017-02-18,2016/2017,25,SP1,1-4,-3,5.0,2017-02-18Sp GijonAth Madrid
19/02/17,Barcelona,Leganes,2,1,H,1.1,9.0,27.0,2017-02-19,2016/2017,25,SP1,2-1,1,-25.9,2017-02-19BarcelonaLeganes
19/02/17,Celta,Osasuna,3,0,H,1.55,4.0,6.2,2017-02-19,2016/2017,25,SP1,3-0,3,-4.65,2017-02-19CeltaOsasuna
19/02/17,Sociedad,Villarreal,0,1,A,1.9,3.5,4.1,2017-02-19,2016/2017,25,SP1,0-1,-1,-2.1999999999999997,2017-02-19SociedadVillarreal
19/02/17,Valencia,Ath Bilbao,2,0,H,2.3,3.3,3.15,2017-02-19,2016/2017,25,SP1,2-0,2,-0.8500000000000001,2017-02-19ValenciaAth Bilbao
20/02/17,Malaga,Las Palmas,2,1,H,2.0,3.4,3.8,2017-02-20,2016/2017,26,SP1,2-1,1,-1.7999999999999998,2017-02-20MalagaLas Palmas
22/02/17,Valencia,Real Madrid,2,1,H,5.5,4.0,1.6,2017-02-22,2016/2017,26,SP1,2-1,1,3.9,2017-02-22ValenciaReal Madrid
24/02/17,Las Palmas,Sociedad,0,1,A,2.7,3.3,2.6,2017-02-24,2016/2017,26,SP1,0-1,-1,0.10000000000000009,2017-02-24Las PalmasSociedad
25/02/17,Alaves,Valencia,2,1,H,2.65,3.3,2.65,2017-02-25,2016/2017,26,SP1,2-1,1,0.0,2017-02-25AlavesValencia
25/02/17,Betis,Sevilla,1,2,A,3.8,3.4,2.0,2017-02-25,2016/2017,26,SP1,1-2,-1,1.7999999999999998,2017-02-25BetisSevilla
25/02/17,Eibar,Malaga,3,0,H,2.2,3.35,3.3,2017-02-25,2016/2017,26,SP1,3-0,3,-1.0999999999999996,2017-02-25EibarMalaga
25/02/17,Leganes,La Coruna,4,0,H,2.3,3.3,3.15,2017-02-25,2016/2017,26,SP1,4-0,4,-0.8500000000000001,2017-02-25LeganesLa Coruna
26/02/17,Ath Bilbao,Granada,3,1,H,1.4,4.8,7.5,2017-02-26,2016/2017,26,SP1,3-1,2,-6.1,2017-02-26Ath BilbaoGranada
26/02/17,Ath Madrid,Barcelona,1,2,A,2.95,3.3,2.4,2017-02-26,2016/2017,26,SP1,1-2,-1,0.5500000000000003,2017-02-26Ath MadridBarcelona
26/02/17,Espanol,Osasuna,3,0,H,1.65,3.8,5.3,2017-02-26,2016/2017,27,SP1,3-0,3,-3.65,2017-02-26EspanolOsasuna
26/02/17,Sp Gijon,Celta,1,1,D,2.7,3.3,2.6,2017-02-26,2016/2017,27,SP1,1-1,0,0.10000000000000009,2017-02-26Sp GijonCelta
26/02/17,Villarreal,Real Madrid,2,3,A,5.3,3.8,1.65,2017-02-26,2016/2017,27,SP1,2-3,-1,3.65,2017-02-26VillarrealReal Madrid
28/02/17,Malaga,Betis,1,2,A,1.9,3.5,4.1,2017-02-28,2016/2017,27,SP1,1-2,-1,-2.1999999999999997,2017-02-28MalagaBetis
28/02/17,Sociedad,Eibar,2,2,D,1.8,3.6,4.5,2017-02-28,2016/2017,27,SP1,2-2,0,-2.7,2017-02-28SociedadEibar
28/02/17,Valencia,Leganes,1,0,H,1.7,3.9,4.8,2017-02-28,2016/2017,27,SP1,1-0,1,-3.0999999999999996,2017-02-28ValenciaLeganes
01/03/17,Barcelona,Sp Gijon,6,1,H,1.07,12.0,26.0,2017-03-01,2016/2017,27,SP1,6-1,5,-24.93,2017-03-01BarcelonaSp Gijon
01/03/17,Celta,Espanol,2,2,D,1.85,3.5,4.3,2017-03-01,2016/2017,27,SP1,2-2,0,-2.4499999999999997,2017-03-01CeltaEspanol
01/03/17,Granada,Alaves,2,1,H,2.65,3.3,2.65,2017-03-01,2016/2017,27,SP1,2-1,1,0.0,2017-03-01GranadaAlaves
01/03/17,Osasuna,Villarreal,1,4,A,4.3,3.5,1.85,2017-03-01,2016/2017,28,SP1,1-4,-3,2.4499999999999997,2017-03-01OsasunaVillarreal
01/03/17,Real Madrid,Las Palmas,3,3,D,1.12,9.0,20.0,2017-03-01,2016/2017,28,SP1,3-3,0,-18.88,2017-03-01Real MadridLas Palmas
02/03/17,La Coruna,Ath Madrid,1,1,D,5.0,4.0,1.65,2017-03-02,2016/2017,28,SP1,1-1,0,3.35,2017-03-02La CorunaAth Madrid
02/03/17,Sevilla,Ath Bilbao,1,0,H,1.65,4.0,5.0,2017-03-02,2016/2017,28,SP1,1-0,1,-3.35,2017-03-02SevillaAth Bilbao
03/03/17,Betis,Sociedad,2,3,A,2.6,3.1,2.85,2017-03-03,2016/2017,28,SP1,2-3,-1,-0.25,2017-03-03BetisSociedad
04/03/17,Barcelona,Celta,5,0,H,1.15,8.0,16.0,2017-03-04,2016/2017,28,SP1,5-0,5,-14.85,2017-03-04BarcelonaCelta
04/03/17,Eibar,Real Madrid,1,4,A,6.2,4.0,1.55,2017-03-04,2016/2017,28,SP1,1-4,-3,4.65,2017-03-04EibarReal Madrid
04/03/17,Leganes,Granada,1,0,H,1.8,3.6,4.5,2017-03-04,2016/2017,28,SP1,1-0,1,-2.7,2017-03-04LeganesGranada
04/03/17,Villarreal,Espanol,2,0,H,1.75,3.7,4.7,2017-03-04,2016/2017,28,SP1,2-0,2,-2.95,2017-03-04VillarrealEspanol
05/03/17,Ath Bilbao,Malaga,1,0,H,1.7,3.7,5.0,2017-03-05,2016/2017,29,SP1,1-0,1,-3.3,2017-03-05Ath BilbaoMalaga
05/03/17,Ath Madrid,Valencia,3,0,H,1.45,4.5,7.0,2017-03-05,2016/2017,29,SP1,3-0,3,-5.55,2017-03-05Ath MadridValencia
05/03/17,Las Palmas,Osasuna,5,2,H,1.5,4.2,6.0,2017-03-05,2016/2017,29,SP1,5-2,3,-4.5,2017-03-05Las PalmasOsasuna
05/03/17,Sp Gijon,La Coruna,0,1,A,2.4,3.3,2.95,2017-03-05,2016/2017,29,SP1,0-1,-1,-0.5500000000000003,2017-03-05Sp GijonLa Coruna
06/03/17,Alaves,Sevilla,1,1,D,4.1,3.5,1.9,2017-03-06,2016/2017,29,SP1,1-1,0,2.1999999999999997,2017-03-06AlavesSevilla
08/03/17,La Coruna,Betis,1,1,D,2.1,3.3,3.6,2017-03-08,2016/2017,29,SP1,1-1,0,-1.5,2017-03-08La CorunaBetis
10/03/17,Espanol,Las Palmas,4,3,H,2.1,3.4,3.5,2017-03-10,2016/2017,29,SP1,4-3,1,-1.4,2017-03-10EspanolLas Palmas
11/03/17,Granada,Ath Madrid,0,1,A,6.5,4.2,1.5,2017-03-11,2016/2017,29,SP1,0-1,-1,5.0,2017-03-11GranadaAth Madrid
11/03/17,Malaga,Alaves,1,2,A,1.9,3.5,4.1,2017-03-11,2016/2017,29,SP1,1-2,-1,-2.1999999999999997,2017-03-11MalagaAlaves
11/03/17,Sevilla,Leganes,1,1,D,1.4,4.8,7.5,2017-03-11,2016/2017,30,SP1,1-1,0,-6.1,2017-03-11SevillaLeganes
11/03/17,Valencia,Sp Gijon,1,1,D,1.4,4.8,7.5,2017-03-11,2016/2017,30,SP1,1-1,0,-6.1,2017-03-11ValenciaSp Gijon
12/03/17,Celta,Villarreal,0,1,A,2.65,3.3,2.65,2017-03-12,2016/2017,30,SP1,0-1,-1,0.0,2017-03-12CeltaVillarreal
12/03/17,La Coruna,Barcelona,2,1,H,15.0,6.5,1.2,2017-03-12,2016/2017,30,SP1,2-1,1,13.8,2017-03-12La CorunaBarcelona
12/03/17,Real Madrid,Betis,2,1,H,1.12,9.0,20.0,2017-03-12,2016/2017,30,SP1,2-1,1,-18.88,2017-03-12Real MadridBetis
12/03/17,Sociedad,Ath Bilbao,0,2,A,2.1,3.4,3.5,2017-03-12,2016/2017,30,SP1,0-2,-2,-1.4,2017-03-12SociedadAth Bilbao
13/03/17,Osasuna,Eibar,1,1,D,3.9,3.6,1.9,2017-03-13,2016/2017,30,SP1,1-1,0,2.0,2017-03-13OsasunaEibar
17/03/17,Las Palmas,Villarreal,1,0,H,2.65,3.3,2.65,2017-03-17,2016/2017,30,SP1,1-0,1,0.0,2017-03-17Las PalmasVillarreal
18/03/17,Alaves,Sociedad,1,0,H,2.75,3.25,2.6,2017-03-18,2016/2017,30,SP1,1-0,1,0.1499999999999999,2017-03-18AlavesSociedad
18/03/17,Ath Bilbao,Real Madrid,1,2,A,5.0,4.0,1.65,2017-03-18,2016/2017,31,SP1,1-2,-1,3.35,2017-03-18Ath BilbaoReal Madrid
18/03/17,Betis,Osasuna,2,0,H,1.45,4.5,7.0,2017-03-18,2016/2017,31,SP1,2-0,2,-5.55,2017-03-18BetisOsasuna
18/03/17,Eibar,Espanol,1,1,D,1.9,3.5,4.1,2017-03-18,2016/2017,31,SP1,1-1,0,-2.1999999999999997,2017-03-18EibarEspanol
19/03/17,Ath Madrid,Sevilla,3,1,H,1.65,4.0,5.0,2017-03-19,2016/2017,31,SP1,3-1,2,-3.35,2017-03-19Ath MadridSevilla
19/03/17,Barcelona,Valencia,4,2,H,1.15,8.0,16.0,2017-03-19,2016/2017,31,SP1,4-2,2,-14.85,2017-03-19BarcelonaValencia
19/03/17,La Coruna,Celta,0,1,A,2.1,3.4,3.5,2017-03-19,2016/2017,31,SP1,0-1,-1,-1.4,2017-03-19La CorunaCelta
19/03/17,Leganes,Malaga,0,0,D,2.3,3.1,3.35,2017-03-19,2016/2017,31,SP1,0-0,0,-1.0500000000000003,2017-03-19LeganesMalaga
19/03/17,Sp Gijon,Granada,3,1,H,2.0,3.4,3.8,2017-03-19,2016/2017,31,SP1,3-1,2,-1.7999999999999998,2017-03-19Sp GijonGranada
31/03/17,Espanol,Betis,2,1,H,2.1,3.4,3.5,2017-03-31,2016/2017,31,SP1,2-1,1,-1.4,2017-03-31EspanolBetis
01/04/17,Malaga,Ath Madrid,0,2,A,5.3,3.8,1.65,2017-04-01,2016/2017,32,SP1,0-2,-2,3.65,2017-04-01MalagaAth Madrid
01/04/17,Osasuna,Ath Bilbao,1,2,A,6.5,4.2,1.5,2017-04-01,2016/2017,32,SP1,1-2,-1,5.0,2017-04-01OsasunaAth Bilbao
01/04/17,Sociedad,Leganes,1,1,D,1.7,3.7,5.0,2017-04-01,2016/2017,32,SP1,1-1,0,-3.3,2017-04-01SociedadLeganes
01/04/17,Villarreal,Eibar,2,3,A,1.8,3.6,4.5,2017-04-01,2016/2017,32,SP1,2-3,-1,-2.7,2017-04-01VillarrealEibar
02/04/17,Granada,Barcelona,1,4,A,18.0,7.5,1.15,2017-04-02,2016/2017,32,SP1,1-4,-3,16.85,2017-04-02GranadaBarcelona
02/04/17,Real Madrid,Alaves,3,0,H,1.12,9.0,20.0,2017-04-02,2016/2017,32,SP1,3-0,3,-18.88,2017-04-02Real MadridAlaves
02/04/17,Sevilla,Sp Gijon,0,0,D,1.3,5.5,9.5,2017-04-02,2016/2017,32,SP1,0-0,0,-8.2,2017-04-02SevillaSp Gijon
02/04/17,Valencia,La Coruna,3,0,H,1.8,3.6,4.5,2017-04-02,2016/2017,32,SP1,3-0,3,-2.7,2017-04-02ValenciaLa Coruna
03/04/17,Celta,Las Palmas,3,1,H,1.85,3.5,4.3,2017-04-03,2016/2017,32,SP1,3-1,2,-2.4499999999999997,2017-04-03CeltaLas Palmas
04/04/17,Ath Bilbao,Espanol,2,0,H,1.65,3.8,5.3,2017-04-04,2016/2017,33,SP1,2-0,2,-3.65,2017-04-04Ath BilbaoEspanol
04/04/17,Ath Madrid,Sociedad,1,0,H,1.4,4.8,7.5,2017-04-04,2016/2017,33,SP1,1-0,1,-6.1,2017-04-04Ath MadridSociedad
04/04/17,Betis,Villarreal,0,1,A,2.65,3.3,2.65,2017-04-04,2016/2017,33,SP1,0-1,-1,0.0,2017-04-04BetisVillarreal
05/04/17,Alaves,Osasuna,0,1,A,1.45,4.5,7.0,2017-04-05,2016/2017,33,SP1,0-1,-1,-5.55,2017-04-05AlavesOsasuna
05/04/17,Barcelona,Sevilla,3,0,H,1.25,6.0,11.0,2017-04-05,2016/2017,33,SP1,3-0,3,-9.75,2017-04-05BarcelonaSevilla
05/04/17,La Coruna,Granada,0,0,D,1.6,4.0,5.5,2017-04-05,2016/2017,33,SP1,0-0,0,-3.9,2017-04-05La CorunaGranada
05/04/17,Leganes,Real Madrid,2,4,A,8.0,5.3,1.35,2017-04-05,2016/2017,33,SP1,2-4,-2,6.65,2017-04-05LeganesReal Madrid
05/04/17,Sp Gijon,Malaga,0,1,A,2.5,3.3,2.85,2017-04-05,2016/2017,33,SP1,0-1,-1,-0.3500000000000001,2017-04-05Sp GijonMalaga
06/04/17,Eibar,Las Palmas,3,1,H,1.8,3.6,4.5,2017-04-06,2016/2017,33,SP1,3-1,2,-2.7,2017-04-06EibarLas Palmas
06/04/17,Valencia,Celta,3,2,H,2.0,3.4,3.8,2017-04-06,2016/2017,34,SP1,3-2,1,-1.7999999999999998,2017-04-06ValenciaCelta
07/04/17,Villarreal,Ath Bilbao,3,1,H,2.2,3.35,3.3,2017-04-07,2016/2017,34,SP1,3-1,2,-1.0999999999999996,2017-04-07VillarrealAth Bilbao
08/04/17,Espanol,Alaves,1,0,H,2.1,3.4,3.5,2017-04-08,2016/2017,34,SP1,1-0,1,-1.4,2017-04-08EspanolAlaves
08/04/17,Malaga,Barcelona,2,0,H,9.5,5.5,1.3,2017-04-08,2016/2017,34,SP1,2-0,2,8.2,2017-04-08MalagaBarcelona
08/04/17,Real Madrid,Ath Madrid,1,1,D,1.8,3.6,4.5,2017-04-08,2016/2017,34,SP1,1-1,0,-2.7,2017-04-08Real MadridAth Madrid
08/04/17,Sevilla,La Coruna,4,2,H,1.5,4.2,6.5,2017-04-08,2016/2017,34,SP1,4-2,2,-5.0,2017-04-08SevillaLa Coruna
09/04/17,Celta,Eibar,0,2,A,2.4,3.3,2.95,2017-04-09,2016/2017,34,SP1,0-2,-2,-0.5500000000000003,2017-04-09CeltaEibar
09/04/17,Granada,Valencia,1,3,A,3.3,3.35,2.2,2017-04-09,2016/2017,34,SP1,1-3,-2,1.0999999999999996,2017-04-09GranadaValencia
09/04/17,Las Palmas,Betis,4,1,H,2.1,3.4,3.5,2017-04-09,2016/2017,34,SP1,4-1,3,-1.4,2017-04-09Las PalmasBetis
09/04/17,Osasuna,Leganes,2,1,H,3.8,3.4,2.0,2017-04-09,2016/2017,35,SP1,2-1,1,1.7999999999999998,2017-04-09OsasunaLeganes
10/04/17,Sociedad,Sp Gijon,3,1,H,1.5,4.2,6.5,2017-04-10,2016/2017,35,SP1,3-1,2,-5.0,2017-04-10SociedadSp Gijon
14/04/17,Ath Bilbao,Las Palmas,5,1,H,1.4,4.8,7.5,2017-04-14,2016/2017,35,SP1,5-1,4,-6.1,2017-04-14Ath BilbaoLas Palmas
15/04/17,Ath Madrid,Osasuna,3,0,H,1.17,7.5,15.0,2017-04-15,2016/2017,35,SP1,3-0,3,-13.83,2017-04-15Ath MadridOsasuna
15/04/17,Barcelona,Sociedad,3,2,H,1.2,7.0,12.5,2017-04-15,2016/2017,35,SP1,3-2,1,-11.3,2017-04-15BarcelonaSociedad
15/04/17,La Coruna,Malaga,2,0,H,2.3,3.2,3.25,2017-04-15,2016/2017,35,SP1,2-0,2,-0.9500000000000002,2017-04-15La CorunaMalaga
15/04/17,Sp Gijon,Real Madrid,2,3,A,8.0,5.3,1.35,2017-04-15,2016/2017,35,SP1,2-3,-1,6.65,2017-04-15Sp GijonReal Madrid
16/04/17,Betis,Eibar,2,0,H,2.65,3.3,2.65,2017-04-16,2016/2017,35,SP1,2-0,2,0.0,2017-04-16BetisEibar
16/04/17,Granada,Celta,0,3,A,2.5,3.4,2.75,2017-04-16,2016/2017,35,SP1,0-3,-3,-0.25,2017-04-16GranadaCelta
16/04/17,Leganes,Espanol,0,1,A,2.1,3.4,3.5,2017-04-16,2016/2017,36,SP1,0-1,-1,-1.4,2017-04-16LeganesEspanol
16/04/17,Valencia,Sevilla,0,0,D,2.65,3.3,2.65,2017-04-16,2016/2017,36,SP1,0-0,0,0.0,2017-04-16ValenciaSevilla
17/04/17,Alaves,Villarreal,2,1,H,2.95,3.3,2.4,2017-04-17,2016/2017,36,SP1,2-1,1,0.5500000000000003,2017-04-17AlavesVillarreal
21/04/17,Sevilla,Granada,2,0,H,1.22,6.5,12.0,2017-04-21,2016/2017,36,SP1,2-0,2,-10.78,2017-04-21SevillaGranada
22/04/17,Espanol,Ath Madrid,0,1,A,5.0,3.7,1.7,2017-04-22,2016/2017,36,SP1,0-1,-1,3.3,2017-04-22EspanolAth Madrid
22/04/17,Malaga,Valencia,2,0,H,2.3,3.3,3.15,2017-04-22,2016/2017,36,SP1,2-0,2,-0.8500000000000001,2017-04-22MalagaValencia
22/04/17,Osasuna,Sp Gijon,2,2,D,2.5,3.3,2.85,2017-04-22,2016/2017,36,SP1,2-2,0,-0.3500000000000001,2017-04-22OsasunaSp Gijon
22/04/17,Villarreal,Leganes,2,1,H,1.6,3.9,5.7,2017-04-22,2016/2017,36,SP1,2-1,1,-4.1,2017-04-22VillarrealLeganes
23/04/17,Celta,Betis,0,1,A,1.9,3.5,4.1,2017-04-23,2016/2017,36,SP1,0-1,-1,-2.1999999999999997,2017-04-23CeltaBetis
23/04/17,Las Palmas,Alaves,1,1,D,2.0,3.4,3.8,2017-04-23,2016/2017,37,SP1,1-1,0,-1.7999999999999998,2017-04-23Las PalmasAlaves
23/04/17,Real Madrid,Barcelona,2,3,A,2.1,3.8,3.15,2017-04-23,2016/2017,37,SP1,2-3,-1,-1.0499999999999998,2017-04-23Real MadridBarcelona
23/04/17,Sociedad,La Coruna,1,0,H,1.65,3.8,5.3,2017-04-23,2016/2017,37,SP1,1-0,1,-3.65,2017-04-23SociedadLa Coruna
24/04/17,Eibar,Ath Bilbao,0,1,A,2.5,3.3,2.85,2017-04-24,2016/2017,37,SP1,0-1,-1,-0.3500000000000001,2017-04-24EibarAth Bilbao
25/04/17,Ath Madrid,Villarreal,0,1,A,1.45,4.5,7.0,2017-04-25,2016/2017,37,SP1,0-1,-1,-5.55,2017-04-25Ath MadridVillarreal
25/04/17,Granada,Malaga,0,2,A,3.15,3.5,2.2,2017-04-25,2016/2017,37,SP1,0-2,-2,0.9499999999999997,2017-04-25GranadaMalaga
25/04/17,Sp Gijon,Espanol,1,1,D,2.0,3.5,3.7,2017-04-25,2016/2017,37,SP1,1-1,0,-1.7000000000000002,2017-04-25Sp GijonEspanol
26/04/17,Barcelona,Osasuna,7,1,H,1.03,16.0,42.0,2017-04-26,2016/2017,37,SP1,7-1,6,-40.97,2017-04-26BarcelonaOsasuna
26/04/17,La Coruna,Real Madrid,2,6,A,7.5,4.8,1.4,2017-04-26,2016/2017,37,SP1,2-6,-4,6.1,2017-04-26La CorunaReal Madrid
26/04/17,Leganes,Las Palmas,3,0,H,1.7,3.9,4.7,2017-04-26,2016/2017,38,SP1,3-0,3,-3.0,2017-04-26LeganesLas Palmas
26/04/17,Valencia,Sociedad,2,3,A,2.4,3.5,2.8,2017-04-26,2016/2017,38,SP1,2-3,-1,-0.3999999999999999,2017-04-26ValenciaSociedad
27/04/17,Alaves,Eibar,0,0,D,2.5,3.4,2.75,2017-04-27,2016/2017,38,SP1,0-0,0,-0.25,2017-04-27AlavesEibar
27/04/17,Ath Bilbao,Betis,2,1,H,1.4,4.8,7.5,2017-04-27,2016/2017,38,SP1,2-1,1,-6.1,2017-04-27Ath BilbaoBetis
27/04/17,Sevilla,Celta,2,1,H,1.35,5.3,8.0,2017-04-27,2016/2017,38,SP1,2-1,1,-6.65,2017-04-27SevillaCelta
28/04/17,Villarreal,Sp Gijon,3,1,H,1.35,5.3,8.0,2017-04-28,2016/2017,38,SP1,3-1,2,-6.65,2017-04-28VillarrealSp Gijon
29/04/17,Espanol,Barcelona,0,3,A,15.0,7.5,1.17,2017-04-29,2016/2017,38,SP1,0-3,-3,13.83,2017-04-29EspanolBarcelona
29/04/17,Las Palmas,Ath Madrid,0,5,A,4.5,3.6,1.8,2017-04-29,2016/2017,38,SP1,0-5,-5,2.7,2017-04-29Las PalmasAth Madrid
29/04/17,Real Madrid,Valencia,2,1,H,1.17,7.5,15.0,2017-04-29,2016/2017,38,SP1,2-1,1,-13.83,2017-04-29Real MadridValencia
29/04/17,Sociedad,Granada,2,1,H,1.17,7.5,15.0,2017-04-29,2016/2017,39,SP1,2-1,1,-13.83,2017-04-29SociedadGranada
30/04/17,Betis,Alaves,1,4,A,2.1,3.3,3.6,2017-04-30,2016/2017,39,SP1,1-4,-3,-1.5,2017-04-30BetisAlaves
30/04/17,Osasuna,La Coruna,2,2,D,4.2,3.6,1.85,2017-04-30,2016/2017,39,SP1,2-2,0,2.35,2017-04-30OsasunaLa Coruna
01/05/17,Malaga,Sevilla,4,2,H,4.1,3.5,1.9,2017-05-01,2016/2017,39,SP1,4-2,2,2.1999999999999997,2017-05-01MalagaSevilla
05/05/17,Sevilla,Sociedad,1,1,D,1.7,3.9,4.7,2017-05-05,2016/2017,39,SP1,1-1,0,-3.0,2017-05-05SevillaSociedad
06/05/17,Ath Madrid,Eibar,1,0,H,1.25,6.0,11.0,2017-05-06,2016/2017,39,SP1,1-0,1,-9.75,2017-05-06Ath MadridEibar
06/05/17,Barcelona,Villarreal,4,1,H,1.17,7.5,15.0,2017-05-06,2016/2017,39,SP1,4-1,3,-13.83,2017-05-06BarcelonaVillarreal
06/05/17,Granada,Real Madrid,0,4,A,20.0,9.0,1.12,2017-05-06,2016/2017,39,SP1,0-4,-4,18.88,2017-05-06GranadaReal Madrid
06/05/17,Sp Gijon,Las Palmas,1,0,H,1.5,4.5,5.5,2017-05-06,2016/2017,39,SP1,1-0,1,-4.0,2017-05-06Sp GijonLas Palmas
07/05/17,Alaves,Ath Bilbao,1,0,H,4.6,3.7,1.75,2017-05-07,2016/2017,40,SP1,1-0,1,2.8499999999999996,2017-05-07AlavesAth Bilbao
07/05/17,La Coruna,Espanol,1,2,A,2.0,3.4,3.8,2017-05-07,2016/2017,40,SP1,1-2,-1,-1.7999999999999998,2017-05-07La CorunaEspanol
07/05/17,Malaga,Celta,3,0,H,1.4,5.0,7.0,2017-05-07,2016/2017,40,SP1,3-0,3,-5.6,2017-05-07MalagaCelta
07/05/17,Valencia,Osasuna,4,1,H,1.3,5.5,9.5,2017-05-07,2016/2017,40,SP1,4-1,3,-8.2,2017-05-07ValenciaOsasuna
08/05/17,Leganes,Betis,4,0,H,1.55,4.0,6.2,2017-05-08,2016/2017,40,SP1,4-0,4,-4.65,2017-05-08LeganesBetis
13/05/17,Espanol,Valencia,0,1,A,2.2,3.4,3.25,2017-05-13,2016/2017,40,SP1,0-1,-1,-1.0499999999999998,2017-05-13EspanolValencia
13/05/17,Osasuna,Granada,2,1,H,1.9,3.5,4.1,2017-05-13,2016/2017,40,SP1,2-1,1,-2.1999999999999997,2017-05-13OsasunaGranada
14/05/17,Alaves,Celta,3,1,H,1.65,4.0,5.0,2017-05-14,2016/2017,40,SP1,3-1,2,-3.35,2017-05-14AlavesCelta
14/05/17,Ath Bilbao,Leganes,1,1,D,1.4,5.0,7.0,2017-05-14,2016/2017,40,SP1,1-1,0,-5.6,2017-05-14Ath BilbaoLeganes
14/05/17,Betis,Ath Madrid,1,1,D,6.2,4.0,1.55,2017-05-14,2016/2017,41,SP1,1-1,0,4.65,2017-05-14BetisAth Madrid
14/05/17,Eibar,Sp Gijon,0,1,A,2.1,3.6,3.3,2017-05-14,2016/2017,41,SP1,0-1,-1,-1.1999999999999997,2017-05-14EibarSp Gijon
14/05/17,Las Palmas,Barcelona,1,4,A,20.0,9.0,1.12,2017-05-14,2016/2017,41,SP1,1-4,-3,18.88,2017-05-14Las PalmasBarcelona
14/05/17,Real Madrid,Sevilla,4,1,H,1.17,8.0,13.0,2017-05-14,2016/2017,41,SP1,4-1,3,-11.83,2017-05-14Real MadridSevilla
14/05/17,Sociedad,Malaga,2,2,D,1.5,4.2,6.5,2017-05-14,2016/2017,41,SP1,2-2,0,-5.0,2017-05-14SociedadMalaga
14/05/17,Villarreal,La Coruna,0,0,D,1.5,4.2,6.5,2017-05-14,2016/2017,41,SP1,0-0,0,-5.0,2017-05-14VillarrealLa Coruna
17/05/17,Celta,Real Madrid,1,4,A,15.0,6.5,1.2,2017-05-17,2016/2017,41,SP1,1-4,-3,13.8,2017-05-17CeltaReal Madrid
19/05/17,Granada,Espanol,1,2,A,4.6,3.9,1.7,2017-05-19,2016/2017,41,SP1,1-2,-1,2.8999999999999995,2017-05-19GranadaEspanol
20/05/17,La Coruna,Las Palmas,3,0,H,1.75,3.7,4.6,2017-05-20,2016/2017,41,SP1,3-0,3,-2.8499999999999996,2017-05-20La CorunaLas Palmas
