Date,HomeTeam,AwayTeam,FTHG,FTAG,FTR,IWH,IWD,IWA,datetime,season,game_day,league,result,goal_diff,odds_diff,game_id
17/08/13,Sociedad,Getafe,2,0,H,1.7,3.6,4.7,2013-08-17,2013/2014,1,SP1,2-0,2,-3.0,2013-08-17SociedadGetafe
17/08/13,Valencia,Malaga,1,0,H,1.55,3.9,5.6,2013-08-17,2013/2014,1,SP1,1-0,1,-4.05,2013-08-17ValenciaMalaga
17/08/13,Valladolid,Ath Bilbao,1,2,A,2.4,3.3,2.75,2013-08-17,2013/2014,1,SP1,1-2,-1,-0.3500000000000001,2013-08-17ValladolidAth Bilbao
18/08/13,Barcelona,Levante,7,0,H,1.1,8.0,20.0,2013-08-18,2013/2014,1,SP1,7-0,7,-18.9,2013-08-18BarcelonaLevante
18/08/13,Osasuna,Granada,1,2,A,2.0,3.3,3.6,2013-08-18,2013/2014,1,SP1,1-2,-1,-1.6,2013-08-18OsasunaGranada
18/08/13,Real Madrid,Betis,2,1,H,1.17,6.5,14.0,2013-08-18,2013/2014,1,SP1,2-1,1,-12.83,2013-08-18Real MadridBetis
18/08/13,Sevilla,Ath Madrid,1,3,A,2.6,3.2,2.6,2013-08-18,2013/2014,1,SP1,1-3,-2,0.0,2013-08-18SevillaAth Madrid
19/08/13,Almeria,Villarreal,2,3,A,2.5,3.3,2.65,2013-08-19,2013/2014,1,SP1,2-3,-1,-0.1499999999999999,2013-08-19AlmeriaVillarreal
19/08/13,Celta,Espanol,2,2,D,2.2,3.3,3.1,2013-08-19,2013/2014,1,SP1,2-2,0,-0.8999999999999999,2013-08-19CeltaEspanol
19/08/13,Vallecano,Elche,3,0,H,2.1,3.3,3.3,2013-08-19,2013/2014,2,SP1,3-0,3,-1.1999999999999997,2013-08-19VallecanoElche
23/08/13,Ath Bilbao,Osasuna,2,0,H,1.7,3.6,4.7,2013-08-23,2013/2014,2,SP1,2-0,2,-3.0,2013-08-23Ath BilbaoOsasuna
23/08/13,Getafe,Almeria,2,2,D,1.85,3.45,4.0,2013-08-23,2013/2014,2,SP1,2-2,0,-2.15,2013-08-23GetafeAlmeria
24/08/13,Elche,Sociedad,1,1,D,3.0,3.3,2.25,2013-08-24,2013/2014,2,SP1,1-1,0,0.75,2013-08-24ElcheSociedad
24/08/13,Espanol,Valencia,3,1,H,2.9,3.3,2.3,2013-08-24,2013/2014,2,SP1,3-1,2,0.6000000000000001,2013-08-24EspanolValencia
24/08/13,Villarreal,Valladolid,2,1,H,1.85,3.45,4.0,2013-08-24,2013/2014,2,SP1,2-1,1,-2.15,2013-08-24VillarrealValladolid
25/08/13,Ath Madrid,Vallecano,5,0,H,1.35,4.8,7.6,2013-08-25,2013/2014,2,SP1,5-0,5,-6.25,2013-08-25Ath MadridVallecano
25/08/13,Betis,Celta,1,2,A,1.7,3.7,4.5,2013-08-25,2013/2014,2,SP1,1-2,-1,-2.8,2013-08-25BetisCelta
25/08/13,Levante,Sevilla,0,0,D,2.85,3.3,2.35,2013-08-25,2013/2014,2,SP1,0-0,0,0.5,2013-08-25LevanteSevilla
25/08/13,Malaga,Barcelona,0,1,A,10.3,5.5,1.25,2013-08-25,2013/2014,3,SP1,0-1,-1,9.05,2013-08-25MalagaBarcelona
26/08/13,Granada,Real Madrid,0,1,A,10.0,5.2,1.27,2013-08-26,2013/2014,3,SP1,0-1,-1,8.73,2013-08-26GranadaReal Madrid
30/08/13,Almeria,Elche,2,2,D,2.1,3.3,3.3,2013-08-30,2013/2014,3,SP1,2-2,0,-1.1999999999999997,2013-08-30AlmeriaElche
30/08/13,Vallecano,Levante,1,2,A,2.0,3.3,3.6,2013-08-30,2013/2014,3,SP1,1-2,-1,-1.6,2013-08-30VallecanoLevante
31/08/13,Celta,Granada,1,1,D,2.1,3.3,3.3,2013-08-31,2013/2014,3,SP1,1-1,0,-1.1999999999999997,2013-08-31CeltaGranada
31/08/13,Osasuna,Villarreal,0,3,A,2.5,3.3,2.65,2013-08-31,2013/2014,3,SP1,0-3,-3,-0.1499999999999999,2013-08-31OsasunaVillarreal
31/08/13,Valladolid,Getafe,1,0,H,2.0,3.3,3.6,2013-08-31,2013/2014,3,SP1,1-0,1,-1.6,2013-08-31ValladolidGetafe
01/09/13,Espanol,Betis,0,0,D,1.9,3.45,3.8,2013-09-01,2013/2014,3,SP1,0-0,0,-1.9,2013-09-01EspanolBetis
01/09/13,Real Madrid,Ath Bilbao,3,1,H,1.2,6.5,10.3,2013-09-01,2013/2014,3,SP1,3-1,2,-9.100000000000001,2013-09-01Real MadridAth Bilbao
01/09/13,Sevilla,Malaga,2,2,D,1.65,3.8,4.7,2013-09-01,2013/2014,4,SP1,2-2,0,-3.0500000000000003,2013-09-01SevillaMalaga
01/09/13,Sociedad,Ath Madrid,1,2,A,2.75,3.3,2.4,2013-09-01,2013/2014,4,SP1,1-2,-1,0.3500000000000001,2013-09-01SociedadAth Madrid
01/09/13,Valencia,Barcelona,2,3,A,5.0,3.9,1.6,2013-09-01,2013/2014,4,SP1,2-3,-1,3.4,2013-09-01ValenciaBarcelona
14/09/13,Ath Madrid,Almeria,4,2,H,1.27,5.2,10.0,2013-09-14,2013/2014,4,SP1,4-2,2,-8.73,2013-09-14Ath MadridAlmeria
14/09/13,Barcelona,Sevilla,3,2,H,1.15,7.0,15.0,2013-09-14,2013/2014,4,SP1,3-2,1,-13.85,2013-09-14BarcelonaSevilla
14/09/13,Levante,Sociedad,0,0,D,2.9,3.3,2.3,2013-09-14,2013/2014,4,SP1,0-0,0,0.6000000000000001,2013-09-14LevanteSociedad
14/09/13,Villarreal,Real Madrid,2,2,D,6.1,4.0,1.5,2013-09-14,2013/2014,4,SP1,2-2,0,4.6,2013-09-14VillarrealReal Madrid
15/09/13,Betis,Valencia,3,1,H,2.75,3.3,2.4,2013-09-15,2013/2014,4,SP1,3-1,2,0.3500000000000001,2013-09-15BetisValencia
15/09/13,Getafe,Osasuna,2,1,H,1.9,3.45,3.8,2013-09-15,2013/2014,4,SP1,2-1,1,-1.9,2013-09-15GetafeOsasuna
15/09/13,Granada,Espanol,0,1,A,2.3,3.3,2.9,2013-09-15,2013/2014,5,SP1,0-1,-1,-0.6000000000000001,2013-09-15GranadaEspanol
15/09/13,Malaga,Vallecano,5,0,H,2.0,3.3,3.6,2013-09-15,2013/2014,5,SP1,5-0,5,-1.6,2013-09-15MalagaVallecano
16/09/13,Ath Bilbao,Celta,3,2,H,1.65,3.6,5.1,2013-09-16,2013/2014,5,SP1,3-2,1,-3.4499999999999997,2013-09-16Ath BilbaoCelta
16/09/13,Elche,Valladolid,0,0,D,2.3,3.3,2.9,2013-09-16,2013/2014,5,SP1,0-0,0,-0.6000000000000001,2013-09-16ElcheValladolid
20/09/13,Osasuna,Elche,2,1,H,2.0,3.3,3.6,2013-09-20,2013/2014,5,SP1,2-1,1,-1.6,2013-09-20OsasunaElche
21/09/13,Almeria,Levante,2,2,D,2.1,3.3,3.3,2013-09-21,2013/2014,5,SP1,2-2,0,-1.1999999999999997,2013-09-21AlmeriaLevante
21/09/13,Sociedad,Malaga,0,0,D,1.85,3.6,3.8,2013-09-21,2013/2014,5,SP1,0-0,0,-1.9499999999999997,2013-09-21SociedadMalaga
21/09/13,Valladolid,Ath Madrid,0,2,A,5.1,3.6,1.65,2013-09-21,2013/2014,5,SP1,0-2,-2,3.4499999999999997,2013-09-21ValladolidAth Madrid
21/09/13,Vallecano,Barcelona,0,4,A,9.0,6.0,1.25,2013-09-21,2013/2014,5,SP1,0-4,-4,7.75,2013-09-21VallecanoBarcelona
22/09/13,Betis,Granada,0,0,D,1.75,3.5,4.5,2013-09-22,2013/2014,6,SP1,0-0,0,-2.75,2013-09-22BetisGranada
22/09/13,Celta,Villarreal,0,0,D,2.75,3.3,2.4,2013-09-22,2013/2014,6,SP1,0-0,0,0.3500000000000001,2013-09-22CeltaVillarreal
22/09/13,Real Madrid,Getafe,4,1,H,1.15,7.0,15.0,2013-09-22,2013/2014,6,SP1,4-1,3,-13.85,2013-09-22Real MadridGetafe
22/09/13,Valencia,Sevilla,3,1,H,1.9,3.45,3.8,2013-09-22,2013/2014,6,SP1,3-1,2,-1.9,2013-09-22ValenciaSevilla
23/09/13,Espanol,Ath Bilbao,3,2,H,2.25,3.3,3.0,2013-09-23,2013/2014,6,SP1,3-2,1,-0.75,2013-09-23EspanolAth Bilbao
24/09/13,Ath Madrid,Osasuna,2,1,H,1.22,5.5,12.0,2013-09-24,2013/2014,6,SP1,2-1,1,-10.78,2013-09-24Ath MadridOsasuna
24/09/13,Barcelona,Sociedad,4,1,H,1.13,8.0,16.0,2013-09-24,2013/2014,6,SP1,4-1,3,-14.870000000000001,2013-09-24BarcelonaSociedad
24/09/13,Levante,Valladolid,1,1,D,2.0,3.4,3.5,2013-09-24,2013/2014,6,SP1,1-1,0,-1.5,2013-09-24LevanteValladolid
24/09/13,Malaga,Almeria,2,0,H,1.7,3.7,4.5,2013-09-24,2013/2014,6,SP1,2-0,2,-2.8,2013-09-24MalagaAlmeria
25/09/13,Elche,Real Madrid,1,2,A,10.5,6.0,1.22,2013-09-25,2013/2014,7,SP1,1-2,-1,9.28,2013-09-25ElcheReal Madrid
25/09/13,Granada,Valencia,0,1,A,2.75,3.3,2.4,2013-09-25,2013/2014,7,SP1,0-1,-1,0.3500000000000001,2013-09-25GranadaValencia
25/09/13,Sevilla,Vallecano,4,1,H,1.6,3.9,5.0,2013-09-25,2013/2014,7,SP1,4-1,3,-3.4,2013-09-25SevillaVallecano
26/09/13,Ath Bilbao,Betis,2,1,H,1.8,3.5,4.2,2013-09-26,2013/2014,7,SP1,2-1,1,-2.4000000000000004,2013-09-26Ath BilbaoBetis
26/09/13,Getafe,Celta,2,0,H,2.0,3.3,3.6,2013-09-26,2013/2014,7,SP1,2-0,2,-1.6,2013-09-26GetafeCelta
26/09/13,Villarreal,Espanol,2,1,H,1.8,3.5,4.2,2013-09-26,2013/2014,7,SP1,2-1,1,-2.4000000000000004,2013-09-26VillarrealEspanol
27/09/13,Valladolid,Malaga,2,2,D,2.6,3.2,2.6,2013-09-27,2013/2014,7,SP1,2-2,0,0.0,2013-09-27ValladolidMalaga
28/09/13,Almeria,Barcelona,0,2,A,13.0,7.0,1.17,2013-09-28,2013/2014,7,SP1,0-2,-2,11.83,2013-09-28AlmeriaBarcelona
28/09/13,Real Madrid,Ath Madrid,0,1,A,1.6,3.8,5.2,2013-09-28,2013/2014,7,SP1,0-1,-1,-3.6,2013-09-28Real MadridAth Madrid
28/09/13,Sociedad,Sevilla,1,1,D,2.0,3.45,3.45,2013-09-28,2013/2014,8,SP1,1-1,0,-1.4500000000000002,2013-09-28SociedadSevilla
28/09/13,Valencia,Vallecano,1,0,H,1.3,5.0,9.0,2013-09-28,2013/2014,8,SP1,1-0,1,-7.7,2013-09-28ValenciaVallecano
29/09/13,Betis,Villarreal,1,0,H,2.4,3.3,2.75,2013-09-29,2013/2014,8,SP1,1-0,1,-0.3500000000000001,2013-09-29BetisVillarreal
29/09/13,Celta,Elche,0,1,A,1.85,3.45,4.0,2013-09-29,2013/2014,8,SP1,0-1,-1,-2.15,2013-09-29CeltaElche
29/09/13,Espanol,Getafe,0,2,A,1.75,3.5,4.5,2013-09-29,2013/2014,8,SP1,0-2,-2,-2.75,2013-09-29EspanolGetafe
29/09/13,Osasuna,Levante,0,1,A,2.0,3.3,3.6,2013-09-29,2013/2014,8,SP1,0-1,-1,-1.6,2013-09-29OsasunaLevante
30/09/13,Granada,Ath Bilbao,2,0,H,2.5,3.3,2.65,2013-09-30,2013/2014,8,SP1,2-0,2,-0.1499999999999999,2013-09-30GranadaAth Bilbao
04/10/13,Malaga,Osasuna,0,1,A,1.57,3.8,5.5,2013-10-04,2013/2014,8,SP1,0-1,-1,-3.9299999999999997,2013-10-04MalagaOsasuna
04/10/13,Villarreal,Granada,3,0,H,1.45,4.0,7.0,2013-10-04,2013/2014,8,SP1,3-0,3,-5.55,2013-10-04VillarrealGranada
05/10/13,Barcelona,Valladolid,4,1,H,1.11,8.0,19.0,2013-10-05,2013/2014,9,SP1,4-1,3,-17.89,2013-10-05BarcelonaValladolid
05/10/13,Elche,Espanol,2,1,H,2.4,3.3,2.75,2013-10-05,2013/2014,9,SP1,2-1,1,-0.3500000000000001,2013-10-05ElcheEspanol
05/10/13,Levante,Real Madrid,2,3,A,7.6,4.8,1.35,2013-10-05,2013/2014,9,SP1,2-3,-1,6.25,2013-10-05LevanteReal Madrid
05/10/13,Vallecano,Sociedad,1,0,H,3.3,3.3,2.1,2013-10-05,2013/2014,9,SP1,1-0,1,1.1999999999999997,2013-10-05VallecanoSociedad
06/10/13,Ath Bilbao,Valencia,1,1,D,2.2,3.3,3.1,2013-10-06,2013/2014,9,SP1,1-1,0,-0.8999999999999999,2013-10-06Ath BilbaoValencia
06/10/13,Ath Madrid,Celta,2,1,H,1.22,5.5,12.0,2013-10-06,2013/2014,9,SP1,2-1,1,-10.78,2013-10-06Ath MadridCelta
06/10/13,Getafe,Betis,3,1,H,2.25,3.3,3.0,2013-10-06,2013/2014,9,SP1,3-1,2,-0.75,2013-10-06GetafeBetis
06/10/13,Sevilla,Almeria,2,1,H,1.45,4.0,7.0,2013-10-06,2013/2014,9,SP1,2-1,1,-5.55,2013-10-06SevillaAlmeria
19/10/13,Espanol,Ath Madrid,1,0,H,4.7,3.6,1.7,2013-10-19,2013/2014,9,SP1,1-0,1,3.0,2013-10-19EspanolAth Madrid
19/10/13,Osasuna,Barcelona,0,0,D,11.0,6.0,1.22,2013-10-19,2013/2014,10,SP1,0-0,0,9.78,2013-10-19OsasunaBarcelona
19/10/13,Real Madrid,Malaga,2,0,H,1.2,6.0,12.5,2013-10-19,2013/2014,10,SP1,2-0,2,-11.3,2013-10-19Real MadridMalaga
19/10/13,Valencia,Sociedad,1,2,A,1.7,3.6,4.7,2013-10-19,2013/2014,10,SP1,1-2,-1,-3.0,2013-10-19ValenciaSociedad
20/10/13,Almeria,Vallecano,0,1,A,1.85,3.45,4.0,2013-10-20,2013/2014,10,SP1,0-1,-1,-2.15,2013-10-20AlmeriaVallecano
20/10/13,Betis,Elche,1,2,A,1.7,3.6,4.7,2013-10-20,2013/2014,10,SP1,1-2,-1,-3.0,2013-10-20BetisElche
20/10/13,Granada,Getafe,0,2,A,2.2,3.3,3.1,2013-10-20,2013/2014,10,SP1,0-2,-2,-0.8999999999999999,2013-10-20GranadaGetafe
20/10/13,Valladolid,Sevilla,2,2,D,2.9,3.3,2.3,2013-10-20,2013/2014,10,SP1,2-2,0,0.6000000000000001,2013-10-20ValladolidSevilla
21/10/13,Ath Bilbao,Villarreal,2,0,H,2.3,3.3,2.9,2013-10-21,2013/2014,10,SP1,2-0,2,-0.6000000000000001,2013-10-21Ath BilbaoVillarreal
21/10/13,Celta,Levante,0,1,A,2.15,3.3,3.2,2013-10-21,2013/2014,10,SP1,0-1,-1,-1.0500000000000003,2013-10-21CeltaLevante
25/10/13,Vallecano,Valladolid,0,3,A,2.1,3.3,3.3,2013-10-25,2013/2014,11,SP1,0-3,-3,-1.1999999999999997,2013-10-25VallecanoValladolid
26/10/13,Barcelona,Real Madrid,2,1,H,1.8,3.5,4.2,2013-10-26,2013/2014,11,SP1,2-1,1,-2.4000000000000004,2013-10-26BarcelonaReal Madrid
26/10/13,Elche,Granada,0,1,A,1.9,3.45,3.8,2013-10-26,2013/2014,11,SP1,0-1,-1,-1.9,2013-10-26ElcheGranada
26/10/13,Levante,Espanol,3,0,H,2.2,3.3,3.1,2013-10-26,2013/2014,11,SP1,3-0,3,-0.8999999999999999,2013-10-26LevanteEspanol
26/10/13,Malaga,Celta,0,5,A,1.6,3.8,5.2,2013-10-26,2013/2014,11,SP1,0-5,-5,-3.6,2013-10-26MalagaCelta
27/10/13,Ath Madrid,Betis,5,0,H,1.27,5.2,10.0,2013-10-27,2013/2014,11,SP1,5-0,5,-8.73,2013-10-27Ath MadridBetis
27/10/13,Sevilla,Osasuna,2,1,H,1.45,4.0,7.0,2013-10-27,2013/2014,11,SP1,2-1,1,-5.55,2013-10-27SevillaOsasuna
27/10/13,Sociedad,Almeria,3,0,H,1.55,3.9,5.6,2013-10-27,2013/2014,11,SP1,3-0,3,-4.05,2013-10-27SociedadAlmeria
27/10/13,Villarreal,Valencia,4,1,H,2.1,3.3,3.3,2013-10-27,2013/2014,11,SP1,4-1,3,-1.1999999999999997,2013-10-27VillarrealValencia
28/10/13,Getafe,Ath Bilbao,0,1,A,2.5,3.3,2.65,2013-10-28,2013/2014,12,SP1,0-1,-1,-0.1499999999999999,2013-10-28GetafeAth Bilbao
29/10/13,Celta,Barcelona,0,3,A,12.0,5.5,1.22,2013-10-29,2013/2014,12,SP1,0-3,-3,10.78,2013-10-29CeltaBarcelona
29/10/13,Espanol,Malaga,0,0,D,2.0,3.3,3.6,2013-10-29,2013/2014,12,SP1,0-0,0,-1.6,2013-10-29EspanolMalaga
30/10/13,Osasuna,Vallecano,3,1,H,2.0,3.3,3.6,2013-10-30,2013/2014,12,SP1,3-1,2,-1.6,2013-10-30OsasunaVallecano
30/10/13,Real Madrid,Sevilla,7,3,H,1.2,6.0,12.5,2013-10-30,2013/2014,12,SP1,7-3,4,-11.3,2013-10-30Real MadridSevilla
30/10/13,Valencia,Almeria,1,2,A,1.37,4.6,7.5,2013-10-30,2013/2014,12,SP1,1-2,-1,-6.13,2013-10-30ValenciaAlmeria
30/10/13,Valladolid,Sociedad,2,2,D,2.65,3.3,2.5,2013-10-30,2013/2014,12,SP1,2-2,0,0.1499999999999999,2013-10-30ValladolidSociedad
31/10/13,Ath Bilbao,Elche,2,2,D,1.6,3.7,5.4,2013-10-31,2013/2014,12,SP1,2-2,0,-3.8000000000000003,2013-10-31Ath BilbaoElche
31/10/13,Betis,Levante,0,0,D,1.8,3.5,4.2,2013-10-31,2013/2014,12,SP1,0-0,0,-2.4000000000000004,2013-10-31BetisLevante
31/10/13,Granada,Ath Madrid,1,2,A,5.4,3.7,1.6,2013-10-31,2013/2014,13,SP1,1-2,-1,3.8000000000000003,2013-10-31GranadaAth Madrid
31/10/13,Villarreal,Getafe,0,2,A,1.55,3.9,5.6,2013-10-31,2013/2014,13,SP1,0-2,-2,-4.05,2013-10-31VillarrealGetafe
01/11/13,Barcelona,Espanol,1,0,H,1.12,8.0,16.0,2013-11-01,2013/2014,13,SP1,1-0,1,-14.879999999999999,2013-11-01BarcelonaEspanol
02/11/13,Almeria,Valladolid,1,0,H,2.2,3.3,3.1,2013-11-02,2013/2014,13,SP1,1-0,1,-0.8999999999999999,2013-11-02AlmeriaValladolid
02/11/13,Sevilla,Celta,0,1,A,1.45,4.0,7.0,2013-11-02,2013/2014,13,SP1,0-1,-1,-5.55,2013-11-02SevillaCelta
02/11/13,Sociedad,Osasuna,5,0,H,1.65,3.6,5.1,2013-11-02,2013/2014,13,SP1,5-0,5,-3.4499999999999997,2013-11-02SociedadOsasuna
02/11/13,Vallecano,Real Madrid,2,3,A,12.0,5.5,1.22,2013-11-02,2013/2014,13,SP1,2-3,-1,10.78,2013-11-02VallecanoReal Madrid
03/11/13,Ath Madrid,Ath Bilbao,2,0,H,1.3,5.0,9.0,2013-11-03,2013/2014,13,SP1,2-0,2,-7.7,2013-11-03Ath MadridAth Bilbao
03/11/13,Getafe,Valencia,0,1,A,2.6,3.2,2.6,2013-11-03,2013/2014,13,SP1,0-1,-1,0.0,2013-11-03GetafeValencia
03/11/13,Levante,Granada,0,1,A,1.9,3.45,3.8,2013-11-03,2013/2014,14,SP1,0-1,-1,-1.9,2013-11-03LevanteGranada
03/11/13,Malaga,Betis,3,2,H,2.0,3.3,3.6,2013-11-03,2013/2014,14,SP1,3-2,1,-1.6,2013-11-03MalagaBetis
04/11/13,Elche,Villarreal,0,1,A,3.3,3.3,2.1,2013-11-04,2013/2014,14,SP1,0-1,-1,1.1999999999999997,2013-11-04ElcheVillarreal
08/11/13,Granada,Malaga,3,1,H,2.2,3.3,3.1,2013-11-08,2013/2014,14,SP1,3-1,2,-0.8999999999999999,2013-11-08GranadaMalaga
08/11/13,Osasuna,Almeria,0,1,A,2.1,3.3,3.3,2013-11-08,2013/2014,14,SP1,0-1,-1,-1.1999999999999997,2013-11-08OsasunaAlmeria
09/11/13,Ath Bilbao,Levante,2,1,H,1.6,3.7,5.4,2013-11-09,2013/2014,14,SP1,2-1,1,-3.8000000000000003,2013-11-09Ath BilbaoLevante
09/11/13,Celta,Vallecano,0,2,A,1.9,3.45,3.8,2013-11-09,2013/2014,14,SP1,0-2,-2,-1.9,2013-11-09CeltaVallecano
09/11/13,Getafe,Elche,1,1,D,2.0,3.3,3.6,2013-11-09,2013/2014,14,SP1,1-1,0,-1.6,2013-11-09GetafeElche
09/11/13,Real Madrid,Sociedad,5,1,H,1.17,6.5,14.0,2013-11-09,2013/2014,14,SP1,5-1,4,-12.83,2013-11-09Real MadridSociedad
10/11/13,Betis,Barcelona,1,4,A,9.0,6.0,1.25,2013-11-10,2013/2014,15,SP1,1-4,-3,7.75,2013-11-10BetisBarcelona
10/11/13,Espanol,Sevilla,1,3,A,2.3,3.3,2.9,2013-11-10,2013/2014,15,SP1,1-3,-2,-0.6000000000000001,2013-11-10EspanolSevilla
10/11/13,Valencia,Valladolid,2,2,D,1.5,4.0,6.1,2013-11-10,2013/2014,15,SP1,2-2,0,-4.6,2013-11-10ValenciaValladolid
10/11/13,Villarreal,Ath Madrid,1,1,D,3.5,3.4,2.0,2013-11-10,2013/2014,15,SP1,1-1,0,1.5,2013-11-10VillarrealAth Madrid
22/11/13,Valladolid,Osasuna,0,1,A,2.05,3.3,3.5,2013-11-22,2013/2014,15,SP1,0-1,-1,-1.4500000000000002,2013-11-22ValladolidOsasuna
23/11/13,Almeria,Real Madrid,0,5,A,10.3,5.5,1.25,2013-11-23,2013/2014,15,SP1,0-5,-5,9.05,2013-11-23AlmeriaReal Madrid
23/11/13,Ath Madrid,Getafe,7,0,H,1.3,5.0,9.0,2013-11-23,2013/2014,15,SP1,7-0,7,-7.7,2013-11-23Ath MadridGetafe
23/11/13,Barcelona,Granada,4,0,H,1.1,8.0,20.0,2013-11-23,2013/2014,15,SP1,4-0,4,-18.9,2013-11-23BarcelonaGranada
23/11/13,Sociedad,Celta,4,3,H,1.7,3.6,4.7,2013-11-23,2013/2014,15,SP1,4-3,1,-3.0,2013-11-23SociedadCelta
24/11/13,Elche,Valencia,2,1,H,2.75,3.3,2.4,2013-11-24,2013/2014,16,SP1,2-1,1,0.3500000000000001,2013-11-24ElcheValencia
24/11/13,Levante,Villarreal,0,3,A,3.1,3.3,2.2,2013-11-24,2013/2014,16,SP1,0-3,-3,0.8999999999999999,2013-11-24LevanteVillarreal
24/11/13,Sevilla,Betis,4,0,H,1.7,3.7,4.5,2013-11-24,2013/2014,16,SP1,4-0,4,-2.8,2013-11-24SevillaBetis
24/11/13,Vallecano,Espanol,1,4,A,2.3,3.3,2.9,2013-11-24,2013/2014,16,SP1,1-4,-3,-0.6000000000000001,2013-11-24VallecanoEspanol
25/11/13,Malaga,Ath Bilbao,1,2,A,2.45,3.3,2.7,2013-11-25,2013/2014,16,SP1,1-2,-1,-0.25,2013-11-25MalagaAth Bilbao
29/11/13,Getafe,Levante,1,0,H,1.85,3.45,4.0,2013-11-29,2013/2014,16,SP1,1-0,1,-2.15,2013-11-29GetafeLevante
29/11/13,Villarreal,Malaga,1,1,D,1.55,3.9,5.6,2013-11-29,2013/2014,16,SP1,1-1,0,-4.05,2013-11-29VillarrealMalaga
30/11/13,Celta,Almeria,3,1,H,2.05,3.3,3.5,2013-11-30,2013/2014,16,SP1,3-1,2,-1.4500000000000002,2013-11-30CeltaAlmeria
30/11/13,Elche,Ath Madrid,0,2,A,5.5,3.8,1.57,2013-11-30,2013/2014,16,SP1,0-2,-2,3.9299999999999997,2013-11-30ElcheAth Madrid
30/11/13,Espanol,Sociedad,1,2,A,2.2,3.3,3.1,2013-11-30,2013/2014,17,SP1,1-2,-1,-0.8999999999999999,2013-11-30EspanolSociedad
30/11/13,Real Madrid,Valladolid,4,0,H,1.1,8.0,20.0,2013-11-30,2013/2014,17,SP1,4-0,4,-18.9,2013-11-30Real MadridValladolid
01/12/13,Ath Bilbao,Barcelona,1,0,H,6.1,4.0,1.5,2013-12-01,2013/2014,17,SP1,1-0,1,4.6,2013-12-01Ath BilbaoBarcelona
01/12/13,Betis,Vallecano,2,2,D,1.9,3.45,3.8,2013-12-01,2013/2014,17,SP1,2-2,0,-1.9,2013-12-01BetisVallecano
01/12/13,Granada,Sevilla,1,2,A,2.55,3.4,2.55,2013-12-01,2013/2014,17,SP1,1-2,-1,0.0,2013-12-01GranadaSevilla
01/12/13,Valencia,Osasuna,3,0,H,1.5,4.0,6.1,2013-12-01,2013/2014,17,SP1,3-0,3,-4.6,2013-12-01ValenciaOsasuna
13/12/13,Levante,Elche,2,1,H,2.1,3.3,3.3,2013-12-13,2013/2014,17,SP1,2-1,1,-1.1999999999999997,2013-12-13LevanteElche
14/12/13,Barcelona,Villarreal,2,1,H,1.25,6.0,9.0,2013-12-14,2013/2014,17,SP1,2-1,1,-7.75,2013-12-14BarcelonaVillarreal
14/12/13,Malaga,Getafe,1,0,H,2.1,3.3,3.3,2013-12-14,2013/2014,17,SP1,1-0,1,-1.1999999999999997,2013-12-14MalagaGetafe
14/12/13,Osasuna,Real Madrid,2,2,D,9.0,6.0,1.25,2013-12-14,2013/2014,18,SP1,2-2,0,7.75,2013-12-14OsasunaReal Madrid
14/12/13,Vallecano,Granada,0,2,A,2.0,3.3,3.6,2013-12-14,2013/2014,18,SP1,0-2,-2,-1.6,2013-12-14VallecanoGranada
15/12/13,Almeria,Espanol,0,0,D,2.4,3.3,2.75,2013-12-15,2013/2014,18,SP1,0-0,0,-0.3500000000000001,2013-12-15AlmeriaEspanol
15/12/13,Ath Madrid,Valencia,3,0,H,1.4,4.6,6.8,2013-12-15,2013/2014,18,SP1,3-0,3,-5.4,2013-12-15Ath MadridValencia
15/12/13,Sevilla,Ath Bilbao,1,1,D,2.2,3.3,3.1,2013-12-15,2013/2014,18,SP1,1-1,0,-0.8999999999999999,2013-12-15SevillaAth Bilbao
15/12/13,Sociedad,Betis,5,1,H,1.65,3.6,5.1,2013-12-15,2013/2014,18,SP1,5-1,4,-3.4499999999999997,2013-12-15SociedadBetis
16/12/13,Valladolid,Celta,3,0,H,2.2,3.3,3.1,2013-12-16,2013/2014,18,SP1,3-0,3,-0.8999999999999999,2013-12-16ValladolidCelta
20/12/13,Elche,Malaga,0,1,A,2.3,3.3,2.9,2013-12-20,2013/2014,18,SP1,0-1,-1,-0.6000000000000001,2013-12-20ElcheMalaga
21/12/13,Ath Madrid,Levante,3,2,H,1.17,7.0,12.5,2013-12-21,2013/2014,18,SP1,3-2,1,-11.33,2013-12-21Ath MadridLevante
21/12/13,Betis,Almeria,0,1,A,1.8,3.5,4.2,2013-12-21,2013/2014,19,SP1,0-1,-1,-2.4000000000000004,2013-12-21BetisAlmeria
21/12/13,Granada,Sociedad,1,3,A,2.5,3.3,2.65,2013-12-21,2013/2014,19,SP1,1-3,-2,-0.1499999999999999,2013-12-21GranadaSociedad
21/12/13,Villarreal,Sevilla,1,2,A,1.85,3.45,4.0,2013-12-21,2013/2014,19,SP1,1-2,-1,-2.15,2013-12-21VillarrealSevilla
22/12/13,Ath Bilbao,Vallecano,2,1,H,1.42,4.2,7.3,2013-12-22,2013/2014,19,SP1,2-1,1,-5.88,2013-12-22Ath BilbaoVallecano
22/12/13,Celta,Osasuna,1,1,D,1.85,3.45,4.0,2013-12-22,2013/2014,19,SP1,1-1,0,-2.15,2013-12-22CeltaOsasuna
22/12/13,Espanol,Valladolid,4,2,H,1.8,3.5,4.2,2013-12-22,2013/2014,19,SP1,4-2,2,-2.4000000000000004,2013-12-22EspanolValladolid
22/12/13,Getafe,Barcelona,2,5,A,7.2,5.0,1.35,2013-12-22,2013/2014,19,SP1,2-5,-3,5.85,2013-12-22GetafeBarcelona
22/12/13,Valencia,Real Madrid,2,3,A,5.2,4.0,1.57,2013-12-22,2013/2014,19,SP1,2-3,-1,3.63,2013-12-22ValenciaReal Madrid
04/01/14,Almeria,Granada,3,0,H,2.3,3.3,2.9,2014-01-04,2013/2014,19,SP1,3-0,3,-0.6000000000000001,2014-01-04AlmeriaGranada
04/01/14,Malaga,Ath Madrid,0,1,A,5.6,3.75,1.57,2014-01-04,2013/2014,20,SP1,0-1,-1,4.029999999999999,2014-01-04MalagaAth Madrid
04/01/14,Valencia,Levante,2,0,H,1.55,3.9,5.6,2014-01-04,2013/2014,20,SP1,2-0,2,-4.05,2014-01-04ValenciaLevante
04/01/14,Valladolid,Betis,0,0,D,2.2,3.3,3.1,2014-01-04,2013/2014,20,SP1,0-0,0,-0.8999999999999999,2014-01-04ValladolidBetis
05/01/14,Barcelona,Elche,4,0,H,1.1,8.0,20.0,2014-01-05,2013/2014,20,SP1,4-0,4,-18.9,2014-01-05BarcelonaElche
05/01/14,Osasuna,Espanol,1,0,H,2.4,3.3,2.75,2014-01-05,2013/2014,20,SP1,1-0,1,-0.3500000000000001,2014-01-05OsasunaEspanol
05/01/14,Sevilla,Getafe,3,0,H,1.55,3.9,5.6,2014-01-05,2013/2014,20,SP1,3-0,3,-4.05,2014-01-05SevillaGetafe
05/01/14,Sociedad,Ath Bilbao,2,0,H,2.3,3.2,3.0,2014-01-05,2013/2014,20,SP1,2-0,2,-0.7000000000000002,2014-01-05SociedadAth Bilbao
06/01/14,Real Madrid,Celta,3,0,H,1.1,8.0,20.0,2014-01-06,2013/2014,20,SP1,3-0,3,-18.9,2014-01-06Real MadridCelta
06/01/14,Vallecano,Villarreal,2,5,A,3.6,3.3,2.0,2014-01-06,2013/2014,20,SP1,2-5,-3,1.6,2014-01-06VallecanoVillarreal
10/01/14,Granada,Valladolid,4,0,H,2.0,3.3,3.6,2014-01-10,2013/2014,21,SP1,4-0,4,-1.6,2014-01-10GranadaValladolid
11/01/14,Ath Bilbao,Almeria,6,1,H,1.42,4.2,7.3,2014-01-11,2013/2014,21,SP1,6-1,5,-5.88,2014-01-11Ath BilbaoAlmeria
11/01/14,Ath Madrid,Barcelona,0,0,D,3.3,3.5,2.1,2014-01-11,2013/2014,21,SP1,0-0,0,1.1999999999999997,2014-01-11Ath MadridBarcelona
11/01/14,Celta,Valencia,2,1,H,2.75,3.3,2.4,2014-01-11,2013/2014,21,SP1,2-1,1,0.3500000000000001,2014-01-11CeltaValencia
11/01/14,Elche,Sevilla,1,1,D,3.3,3.3,2.1,2014-01-11,2013/2014,21,SP1,1-1,0,1.1999999999999997,2014-01-11ElcheSevilla
12/01/14,Betis,Osasuna,1,2,A,1.9,3.45,3.8,2014-01-12,2013/2014,21,SP1,1-2,-1,-1.9,2014-01-12BetisOsasuna
12/01/14,Espanol,Real Madrid,0,1,A,9.0,5.0,1.3,2014-01-12,2013/2014,21,SP1,0-1,-1,7.7,2014-01-12EspanolReal Madrid
12/01/14,Getafe,Vallecano,0,1,A,1.9,3.5,3.7,2014-01-12,2013/2014,21,SP1,0-1,-1,-1.8000000000000003,2014-01-12GetafeVallecano
12/01/14,Levante,Malaga,1,0,H,2.4,3.3,2.75,2014-01-12,2013/2014,21,SP1,1-0,1,-0.3500000000000001,2014-01-12LevanteMalaga
13/01/14,Villarreal,Sociedad,5,1,H,1.9,3.5,3.7,2014-01-13,2013/2014,22,SP1,5-1,4,-1.8000000000000003,2014-01-13VillarrealSociedad
17/01/14,Malaga,Valencia,0,0,D,2.6,3.2,2.6,2014-01-17,2013/2014,22,SP1,0-0,0,0.0,2014-01-17MalagaValencia
18/01/14,Betis,Real Madrid,0,5,A,10.5,6.0,1.22,2014-01-18,2013/2014,22,SP1,0-5,-5,9.28,2014-01-18BetisReal Madrid
18/01/14,Elche,Vallecano,2,0,H,2.2,3.2,3.2,2014-01-18,2013/2014,22,SP1,2-0,2,-1.0,2014-01-18ElcheVallecano
18/01/14,Espanol,Celta,1,0,H,1.9,3.45,3.8,2014-01-18,2013/2014,22,SP1,1-0,1,-1.9,2014-01-18EspanolCelta
18/01/14,Granada,Osasuna,0,0,D,2.1,3.3,3.3,2014-01-18,2013/2014,22,SP1,0-0,0,-1.1999999999999997,2014-01-18GranadaOsasuna
19/01/14,Ath Madrid,Sevilla,1,1,D,1.37,4.6,7.5,2014-01-19,2013/2014,22,SP1,1-1,0,-6.13,2014-01-19Ath MadridSevilla
19/01/14,Getafe,Sociedad,2,2,D,2.75,3.3,2.4,2014-01-19,2013/2014,22,SP1,2-2,0,0.3500000000000001,2014-01-19GetafeSociedad
19/01/14,Levante,Barcelona,1,1,D,14.0,6.5,1.17,2014-01-19,2013/2014,22,SP1,1-1,0,12.83,2014-01-19LevanteBarcelona
19/01/14,Villarreal,Almeria,2,0,H,1.35,4.8,7.6,2014-01-19,2013/2014,23,SP1,2-0,2,-6.25,2014-01-19VillarrealAlmeria
20/01/14,Ath Bilbao,Valladolid,4,2,H,1.4,4.6,6.8,2014-01-20,2013/2014,23,SP1,4-2,2,-5.4,2014-01-20Ath BilbaoValladolid
24/01/14,Celta,Betis,4,2,H,1.9,3.45,3.8,2014-01-24,2013/2014,23,SP1,4-2,2,-1.9,2014-01-24CeltaBetis
25/01/14,Real Madrid,Granada,2,0,H,1.07,9.5,22.0,2014-01-25,2013/2014,23,SP1,2-0,2,-20.93,2014-01-25Real MadridGranada
25/01/14,Sevilla,Levante,2,3,A,1.4,4.4,7.3,2014-01-25,2013/2014,23,SP1,2-3,-1,-5.9,2014-01-25SevillaLevante
25/01/14,Valencia,Espanol,2,2,D,1.6,3.7,5.4,2014-01-25,2013/2014,23,SP1,2-2,0,-3.8000000000000003,2014-01-25ValenciaEspanol
25/01/14,Valladolid,Villarreal,1,0,H,4.0,3.45,1.85,2014-01-25,2013/2014,23,SP1,1-0,1,2.15,2014-01-25ValladolidVillarreal
26/01/14,Almeria,Getafe,1,0,H,2.3,3.3,2.9,2014-01-26,2013/2014,23,SP1,1-0,1,-0.6000000000000001,2014-01-26AlmeriaGetafe
26/01/14,Barcelona,Malaga,3,0,H,1.1,8.0,20.0,2014-01-26,2013/2014,23,SP1,3-0,3,-18.9,2014-01-26BarcelonaMalaga
26/01/14,Osasuna,Ath Bilbao,1,5,A,3.1,3.3,2.2,2014-01-26,2013/2014,24,SP1,1-5,-4,0.8999999999999999,2014-01-26OsasunaAth Bilbao
26/01/14,Vallecano,Ath Madrid,2,4,A,7.3,4.4,1.4,2014-01-26,2013/2014,24,SP1,2-4,-2,5.9,2014-01-26VallecanoAth Madrid
27/01/14,Sociedad,Elche,4,0,H,1.4,4.6,6.8,2014-01-27,2013/2014,24,SP1,4-0,4,-5.4,2014-01-27SociedadElche
31/01/14,Granada,Celta,1,2,A,2.0,3.3,3.6,2014-01-31,2013/2014,24,SP1,1-2,-1,-1.6,2014-01-31GranadaCelta
01/02/14,Barcelona,Valencia,2,3,A,1.15,7.0,15.0,2014-02-01,2013/2014,24,SP1,2-3,-1,-13.85,2014-02-01BarcelonaValencia
01/02/14,Getafe,Valladolid,0,0,D,2.0,3.3,3.6,2014-02-01,2013/2014,24,SP1,0-0,0,-1.6,2014-02-01GetafeValladolid
01/02/14,Levante,Vallecano,0,0,D,2.0,3.3,3.6,2014-02-01,2013/2014,24,SP1,0-0,0,-1.6,2014-02-01LevanteVallecano
01/02/14,Malaga,Sevilla,3,2,H,2.75,3.3,2.4,2014-02-01,2013/2014,24,SP1,3-2,1,0.3500000000000001,2014-02-01MalagaSevilla
02/02/14,Ath Bilbao,Real Madrid,1,1,D,5.4,3.9,1.57,2014-02-02,2013/2014,24,SP1,1-1,0,3.83,2014-02-02Ath BilbaoReal Madrid
02/02/14,Ath Madrid,Sociedad,4,0,H,1.37,4.6,7.5,2014-02-02,2013/2014,25,SP1,4-0,4,-6.13,2014-02-02Ath MadridSociedad
02/02/14,Betis,Espanol,2,0,H,2.2,3.4,3.0,2014-02-02,2013/2014,25,SP1,2-0,2,-0.7999999999999998,2014-02-02BetisEspanol
02/02/14,Elche,Almeria,1,0,H,2.0,3.3,3.6,2014-02-02,2013/2014,25,SP1,1-0,1,-1.6,2014-02-02ElcheAlmeria
03/02/14,Villarreal,Osasuna,3,1,H,1.4,4.6,6.8,2014-02-03,2013/2014,25,SP1,3-1,2,-5.4,2014-02-03VillarrealOsasuna
07/02/14,Espanol,Granada,1,0,H,1.9,3.45,3.8,2014-02-07,2013/2014,25,SP1,1-0,1,-1.9,2014-02-07EspanolGranada
08/02/14,Almeria,Ath Madrid,2,0,H,9.0,5.0,1.3,2014-02-08,2013/2014,25,SP1,2-0,2,7.7,2014-02-08AlmeriaAth Madrid
08/02/14,Real Madrid,Villarreal,4,2,H,1.3,5.0,9.0,2014-02-08,2013/2014,25,SP1,4-2,2,-7.7,2014-02-08Real MadridVillarreal
08/02/14,Valencia,Betis,5,0,H,1.45,4.0,7.0,2014-02-08,2013/2014,25,SP1,5-0,5,-5.55,2014-02-08ValenciaBetis
08/02/14,Vallecano,Malaga,4,1,H,2.4,3.3,2.75,2014-02-08,2013/2014,25,SP1,4-1,3,-0.3500000000000001,2014-02-08VallecanoMalaga
09/02/14,Osasuna,Getafe,2,0,H,2.1,3.3,3.3,2014-02-09,2013/2014,26,SP1,2-0,2,-1.1999999999999997,2014-02-09OsasunaGetafe
09/02/14,Sevilla,Barcelona,1,4,A,6.1,4.0,1.5,2014-02-09,2013/2014,26,SP1,1-4,-3,4.6,2014-02-09SevillaBarcelona
09/02/14,Sociedad,Levante,0,0,D,1.5,4.0,6.1,2014-02-09,2013/2014,26,SP1,0-0,0,-4.6,2014-02-09SociedadLevante
09/02/14,Valladolid,Elche,2,2,D,2.0,3.3,3.6,2014-02-09,2013/2014,26,SP1,2-2,0,-1.6,2014-02-09ValladolidElche
10/02/14,Celta,Ath Bilbao,0,0,D,3.1,3.3,2.2,2014-02-10,2013/2014,26,SP1,0-0,0,0.8999999999999999,2014-02-10CeltaAth Bilbao
14/02/14,Elche,Osasuna,0,0,D,2.1,3.3,3.3,2014-02-14,2013/2014,26,SP1,0-0,0,-1.1999999999999997,2014-02-14ElcheOsasuna
15/02/14,Ath Madrid,Valladolid,3,0,H,1.2,5.8,13.0,2014-02-15,2013/2014,26,SP1,3-0,3,-11.8,2014-02-15Ath MadridValladolid
15/02/14,Barcelona,Vallecano,6,0,H,1.08,9.5,22.0,2014-02-15,2013/2014,26,SP1,6-0,6,-20.92,2014-02-15BarcelonaVallecano
15/02/14,Levante,Almeria,1,0,H,2.0,3.3,3.6,2014-02-15,2013/2014,26,SP1,1-0,1,-1.6,2014-02-15LevanteAlmeria
15/02/14,Villarreal,Celta,0,2,A,1.5,4.0,6.1,2014-02-15,2013/2014,27,SP1,0-2,-2,-4.6,2014-02-15VillarrealCelta
16/02/14,Ath Bilbao,Espanol,1,2,A,1.55,3.9,5.6,2014-02-16,2013/2014,27,SP1,1-2,-1,-4.05,2014-02-16Ath BilbaoEspanol
16/02/14,Getafe,Real Madrid,0,3,A,9.0,5.0,1.3,2014-02-16,2013/2014,27,SP1,0-3,-3,7.7,2014-02-16GetafeReal Madrid
16/02/14,Granada,Betis,1,0,H,2.1,3.3,3.3,2014-02-16,2013/2014,27,SP1,1-0,1,-1.1999999999999997,2014-02-16GranadaBetis
16/02/14,Sevilla,Valencia,0,0,D,2.1,3.3,3.3,2014-02-16,2013/2014,27,SP1,0-0,0,-1.1999999999999997,2014-02-16SevillaValencia
17/02/14,Malaga,Sociedad,0,1,A,2.65,3.3,2.5,2014-02-17,2013/2014,27,SP1,0-1,-1,0.1499999999999999,2014-02-17MalagaSociedad
21/02/14,Valladolid,Levante,1,1,D,2.1,3.3,3.3,2014-02-21,2013/2014,27,SP1,1-1,0,-1.1999999999999997,2014-02-21ValladolidLevante
22/02/14,Almeria,Malaga,0,0,D,2.4,3.3,2.75,2014-02-22,2013/2014,27,SP1,0-0,0,-0.3500000000000001,2014-02-22AlmeriaMalaga
22/02/14,Celta,Getafe,1,1,D,1.85,3.45,4.0,2014-02-22,2013/2014,27,SP1,1-1,0,-2.15,2014-02-22CeltaGetafe
22/02/14,Real Madrid,Elche,3,0,H,1.07,9.5,22.0,2014-02-22,2013/2014,28,SP1,3-0,3,-20.93,2014-02-22Real MadridElche
22/02/14,Sociedad,Barcelona,3,1,H,7.6,4.8,1.35,2014-02-22,2013/2014,28,SP1,3-1,2,6.25,2014-02-22SociedadBarcelona
23/02/14,Betis,Ath Bilbao,0,2,A,3.1,3.3,2.2,2014-02-23,2013/2014,28,SP1,0-2,-2,0.8999999999999999,2014-02-23BetisAth Bilbao
23/02/14,Osasuna,Ath Madrid,3,0,H,7.0,4.0,1.45,2014-02-23,2013/2014,28,SP1,3-0,3,5.55,2014-02-23OsasunaAth Madrid
23/02/14,Valencia,Granada,2,1,H,1.45,4.0,7.0,2014-02-23,2013/2014,28,SP1,2-1,1,-5.55,2014-02-23ValenciaGranada
23/02/14,Vallecano,Sevilla,0,1,A,3.1,3.3,2.2,2014-02-23,2013/2014,28,SP1,0-1,-1,0.8999999999999999,2014-02-23VallecanoSevilla
24/02/14,Espanol,Villarreal,1,2,A,2.6,3.2,2.6,2014-02-24,2013/2014,28,SP1,1-2,-1,0.0,2014-02-24EspanolVillarreal
28/02/14,Ath Bilbao,Granada,4,0,H,1.45,4.0,7.0,2014-02-28,2013/2014,28,SP1,4-0,4,-5.55,2014-02-28Ath BilbaoGranada
01/03/14,Elche,Celta,1,0,H,2.3,3.3,2.9,2014-03-01,2013/2014,28,SP1,1-0,1,-0.6000000000000001,2014-03-01ElcheCelta
01/03/14,Getafe,Espanol,0,0,D,2.4,3.3,2.75,2014-03-01,2013/2014,29,SP1,0-0,0,-0.3500000000000001,2014-03-01GetafeEspanol
01/03/14,Levante,Osasuna,2,0,H,2.1,3.3,3.3,2014-03-01,2013/2014,29,SP1,2-0,2,-1.1999999999999997,2014-03-01LevanteOsasuna
01/03/14,Malaga,Valladolid,1,1,D,1.8,3.5,4.2,2014-03-01,2013/2014,29,SP1,1-1,0,-2.4000000000000004,2014-03-01MalagaValladolid
02/03/14,Ath Madrid,Real Madrid,2,2,D,3.3,3.3,2.1,2014-03-02,2013/2014,29,SP1,2-2,0,1.1999999999999997,2014-03-02Ath MadridReal Madrid
02/03/14,Barcelona,Almeria,4,1,H,1.07,9.5,22.0,2014-03-02,2013/2014,29,SP1,4-1,3,-20.93,2014-03-02BarcelonaAlmeria
02/03/14,Sevilla,Sociedad,1,0,H,2.1,3.3,3.3,2014-03-02,2013/2014,29,SP1,1-0,1,-1.1999999999999997,2014-03-02SevillaSociedad
02/03/14,Vallecano,Valencia,1,0,H,3.6,3.3,2.0,2014-03-02,2013/2014,29,SP1,1-0,1,1.6,2014-03-02VallecanoValencia
02/03/14,Villarreal,Betis,1,1,D,1.4,4.4,7.3,2014-03-02,2013/2014,29,SP1,1-1,0,-5.9,2014-03-02VillarrealBetis
08/03/14,Betis,Getafe,2,0,H,1.95,3.35,3.7,2014-03-08,2013/2014,29,SP1,2-0,2,-1.7500000000000002,2014-03-08BetisGetafe
08/03/14,Celta,Ath Madrid,0,2,A,4.2,3.5,1.8,2014-03-08,2013/2014,30,SP1,0-2,-2,2.4000000000000004,2014-03-08CeltaAth Madrid
08/03/14,Granada,Villarreal,2,0,H,3.1,3.3,2.2,2014-03-08,2013/2014,30,SP1,2-0,2,0.8999999999999999,2014-03-08GranadaVillarreal
08/03/14,Valladolid,Barcelona,1,0,H,10.5,6.0,1.22,2014-03-08,2013/2014,30,SP1,1-0,1,9.28,2014-03-08ValladolidBarcelona
09/03/14,Almeria,Sevilla,1,3,A,3.2,3.2,2.2,2014-03-09,2013/2014,30,SP1,1-3,-2,1.0,2014-03-09AlmeriaSevilla
09/03/14,Espanol,Elche,3,1,H,1.8,3.5,4.2,2014-03-09,2013/2014,30,SP1,3-1,2,-2.4000000000000004,2014-03-09EspanolElche
09/03/14,Real Madrid,Levante,3,0,H,1.07,9.5,22.0,2014-03-09,2013/2014,30,SP1,3-0,3,-20.93,2014-03-09Real MadridLevante
09/03/14,Valencia,Ath Bilbao,1,1,D,2.2,3.3,3.1,2014-03-09,2013/2014,30,SP1,1-1,0,-0.8999999999999999,2014-03-09ValenciaAth Bilbao
10/03/14,Osasuna,Malaga,0,2,A,2.2,3.2,3.2,2014-03-10,2013/2014,30,SP1,0-2,-2,-1.0,2014-03-10OsasunaMalaga
10/03/14,Sociedad,Vallecano,2,3,A,1.45,4.0,7.0,2014-03-10,2013/2014,30,SP1,2-3,-1,-5.55,2014-03-10SociedadVallecano
14/03/14,Getafe,Granada,3,3,D,2.1,3.3,3.3,2014-03-14,2013/2014,31,SP1,3-3,0,-1.1999999999999997,2014-03-14GetafeGranada
15/03/14,Ath Madrid,Espanol,1,0,H,1.28,5.2,10.0,2014-03-15,2013/2014,31,SP1,1-0,1,-8.72,2014-03-15Ath MadridEspanol
15/03/14,Levante,Celta,0,1,A,2.3,3.2,3.0,2014-03-15,2013/2014,31,SP1,0-1,-1,-0.7000000000000002,2014-03-15LevanteCelta
15/03/14,Malaga,Real Madrid,0,1,A,9.0,6.0,1.25,2014-03-15,2013/2014,31,SP1,0-1,-1,7.75,2014-03-15MalagaReal Madrid
15/03/14,Vallecano,Almeria,3,1,H,1.9,3.45,3.8,2014-03-15,2013/2014,31,SP1,3-1,2,-1.9,2014-03-15VallecanoAlmeria
16/03/14,Barcelona,Osasuna,7,0,H,1.08,9.5,22.0,2014-03-16,2013/2014,31,SP1,7-0,7,-20.92,2014-03-16BarcelonaOsasuna
16/03/14,Elche,Betis,0,0,D,2.3,3.3,2.9,2014-03-16,2013/2014,31,SP1,0-0,0,-0.6000000000000001,2014-03-16ElcheBetis
16/03/14,Sevilla,Valladolid,4,1,H,1.4,4.4,7.3,2014-03-16,2013/2014,31,SP1,4-1,3,-5.9,2014-03-16SevillaValladolid
16/03/14,Sociedad,Valencia,1,0,H,2.1,3.3,3.3,2014-03-16,2013/2014,31,SP1,1-0,1,-1.1999999999999997,2014-03-16SociedadValencia
17/03/14,Villarreal,Ath Bilbao,1,1,D,2.2,3.3,3.1,2014-03-17,2013/2014,32,SP1,1-1,0,-0.8999999999999999,2014-03-17VillarrealAth Bilbao
21/03/14,Celta,Malaga,0,2,A,2.2,3.2,3.2,2014-03-21,2013/2014,32,SP1,0-2,-2,-1.0,2014-03-21CeltaMalaga
22/03/14,Ath Bilbao,Getafe,1,0,H,1.4,4.4,7.3,2014-03-22,2013/2014,32,SP1,1-0,1,-5.9,2014-03-22Ath BilbaoGetafe
22/03/14,Espanol,Levante,0,0,D,1.8,3.4,4.4,2014-03-22,2013/2014,32,SP1,0-0,0,-2.6000000000000005,2014-03-22EspanolLevante
22/03/14,Granada,Elche,1,0,H,2.1,3.2,3.4,2014-03-22,2013/2014,32,SP1,1-0,1,-1.2999999999999998,2014-03-22GranadaElche
22/03/14,Valladolid,Vallecano,1,1,D,2.3,3.3,2.9,2014-03-22,2013/2014,32,SP1,1-1,0,-0.6000000000000001,2014-03-22ValladolidVallecano
23/03/14,Betis,Ath Madrid,0,2,A,5.0,3.9,1.6,2014-03-23,2013/2014,32,SP1,0-2,-2,3.4,2014-03-23BetisAth Madrid
23/03/14,Osasuna,Sevilla,1,2,A,2.9,3.3,2.3,2014-03-23,2013/2014,32,SP1,1-2,-1,0.6000000000000001,2014-03-23OsasunaSevilla
23/03/14,Real Madrid,Barcelona,3,4,A,2.3,3.5,3.0,2014-03-23,2013/2014,32,SP1,3-4,-1,-0.7000000000000002,2014-03-23Real MadridBarcelona
23/03/14,Valencia,Villarreal,2,1,H,2.2,3.3,3.1,2014-03-23,2013/2014,33,SP1,2-1,1,-0.8999999999999999,2014-03-23ValenciaVillarreal
24/03/14,Almeria,Sociedad,4,3,H,3.3,3.3,2.1,2014-03-24,2013/2014,33,SP1,4-3,1,1.1999999999999997,2014-03-24AlmeriaSociedad
25/03/14,Elche,Ath Bilbao,0,0,D,3.6,3.3,2.0,2014-03-25,2013/2014,33,SP1,0-0,0,1.6,2014-03-25ElcheAth Bilbao
25/03/14,Malaga,Espanol,1,2,A,2.2,3.2,3.2,2014-03-25,2013/2014,33,SP1,1-2,-1,-1.0,2014-03-25MalagaEspanol
26/03/14,Ath Madrid,Granada,1,0,H,1.2,5.8,13.0,2014-03-26,2013/2014,33,SP1,1-0,1,-11.8,2014-03-26Ath MadridGranada
26/03/14,Barcelona,Celta,3,0,H,1.07,9.5,22.0,2014-03-26,2013/2014,33,SP1,3-0,3,-20.93,2014-03-26BarcelonaCelta
26/03/14,Sevilla,Real Madrid,2,1,H,5.4,4.0,1.55,2014-03-26,2013/2014,33,SP1,2-1,1,3.8500000000000005,2014-03-26SevillaReal Madrid
26/03/14,Vallecano,Osasuna,1,0,H,2.0,3.2,3.75,2014-03-26,2013/2014,33,SP1,1-0,1,-1.75,2014-03-26VallecanoOsasuna
27/03/14,Almeria,Valencia,2,2,D,3.3,3.3,2.1,2014-03-27,2013/2014,33,SP1,2-2,0,1.1999999999999997,2014-03-27AlmeriaValencia
27/03/14,Getafe,Villarreal,0,1,A,3.1,3.3,2.2,2014-03-27,2013/2014,34,SP1,0-1,-1,0.8999999999999999,2014-03-27GetafeVillarreal
27/03/14,Levante,Betis,1,3,A,2.2,3.3,3.1,2014-03-27,2013/2014,34,SP1,1-3,-2,-0.8999999999999999,2014-03-27LevanteBetis
27/03/14,Sociedad,Valladolid,1,0,H,1.5,4.0,6.1,2014-03-27,2013/2014,34,SP1,1-0,1,-4.6,2014-03-27SociedadValladolid
29/03/14,Ath Bilbao,Ath Madrid,1,2,A,2.65,3.3,2.5,2014-03-29,2013/2014,34,SP1,1-2,-1,0.1499999999999999,2014-03-29Ath BilbaoAth Madrid
29/03/14,Celta,Sevilla,1,0,H,3.3,3.3,2.1,2014-03-29,2013/2014,34,SP1,1-0,1,1.1999999999999997,2014-03-29CeltaSevilla
29/03/14,Espanol,Barcelona,0,1,A,9.0,5.0,1.3,2014-03-29,2013/2014,34,SP1,0-1,-1,7.7,2014-03-29EspanolBarcelona
29/03/14,Real Madrid,Vallecano,5,0,H,1.07,9.5,22.0,2014-03-29,2013/2014,34,SP1,5-0,5,-20.93,2014-03-29Real MadridVallecano
30/03/14,Osasuna,Sociedad,1,1,D,2.9,3.3,2.3,2014-03-30,2013/2014,34,SP1,1-1,0,0.6000000000000001,2014-03-30OsasunaSociedad
30/03/14,Valencia,Getafe,1,3,A,1.4,4.6,7.0,2014-03-30,2013/2014,34,SP1,1-3,-2,-5.6,2014-03-30ValenciaGetafe
30/03/14,Valladolid,Almeria,1,0,H,1.85,3.45,4.0,2014-03-30,2013/2014,35,SP1,1-0,1,-2.15,2014-03-30ValladolidAlmeria
30/03/14,Villarreal,Elche,1,1,D,1.5,4.0,6.1,2014-03-30,2013/2014,35,SP1,1-1,0,-4.6,2014-03-30VillarrealElche
31/03/14,Granada,Levante,0,2,A,1.9,3.45,3.8,2014-03-31,2013/2014,35,SP1,0-2,-2,-1.9,2014-03-31GranadaLevante
04/04/14,Almeria,Osasuna,1,2,A,2.2,3.2,3.2,2014-04-04,2013/2014,35,SP1,1-2,-1,-1.0,2014-04-04AlmeriaOsasuna
05/04/14,Ath Madrid,Villarreal,1,0,H,1.55,4.0,5.4,2014-04-05,2013/2014,35,SP1,1-0,1,-3.8500000000000005,2014-04-05Ath MadridVillarreal
05/04/14,Barcelona,Betis,3,1,H,1.07,9.5,22.0,2014-04-05,2013/2014,35,SP1,3-1,2,-20.93,2014-04-05BarcelonaBetis
05/04/14,Sociedad,Real Madrid,0,4,A,5.2,4.2,1.55,2014-04-05,2013/2014,35,SP1,0-4,-4,3.6500000000000004,2014-04-05SociedadReal Madrid
05/04/14,Vallecano,Celta,3,0,H,2.05,3.2,3.6,2014-04-05,2013/2014,35,SP1,3-0,3,-1.5500000000000003,2014-04-05VallecanoCelta
06/04/14,Elche,Getafe,1,0,H,2.1,3.2,3.4,2014-04-06,2013/2014,35,SP1,1-0,1,-1.2999999999999998,2014-04-06ElcheGetafe
06/04/14,Malaga,Granada,4,1,H,1.9,3.45,3.8,2014-04-06,2013/2014,36,SP1,4-1,3,-1.9,2014-04-06MalagaGranada
06/04/14,Sevilla,Espanol,4,1,H,1.6,3.9,5.0,2014-04-06,2013/2014,36,SP1,4-1,3,-3.4,2014-04-06SevillaEspanol
06/04/14,Valladolid,Valencia,0,0,D,2.85,3.3,2.35,2014-04-06,2013/2014,36,SP1,0-0,0,0.5,2014-04-06ValladolidValencia
07/04/14,Levante,Ath Bilbao,1,2,A,3.6,3.3,2.0,2014-04-07,2013/2014,36,SP1,1-2,-1,1.6,2014-04-07LevanteAth Bilbao
11/04/14,Osasuna,Valladolid,0,0,D,2.0,3.3,3.6,2014-04-11,2013/2014,36,SP1,0-0,0,-1.6,2014-04-11OsasunaValladolid
12/04/14,Celta,Sociedad,2,2,D,2.6,3.2,2.6,2014-04-12,2013/2014,36,SP1,2-2,0,0.0,2014-04-12CeltaSociedad
12/04/14,Granada,Barcelona,1,0,H,9.0,6.0,1.25,2014-04-12,2013/2014,36,SP1,1-0,1,7.75,2014-04-12GranadaBarcelona
12/04/14,Real Madrid,Almeria,4,0,H,1.05,11.0,25.0,2014-04-12,2013/2014,36,SP1,4-0,4,-23.95,2014-04-12Real MadridAlmeria
13/04/14,Betis,Sevilla,0,2,A,3.3,3.3,2.1,2014-04-13,2013/2014,36,SP1,0-2,-2,1.1999999999999997,2014-04-13BetisSevilla
13/04/14,Espanol,Vallecano,2,2,D,1.8,3.5,4.2,2014-04-13,2013/2014,37,SP1,2-2,0,-2.4000000000000004,2014-04-13EspanolVallecano
13/04/14,Getafe,Ath Madrid,0,2,A,7.0,4.0,1.45,2014-04-13,2013/2014,37,SP1,0-2,-2,5.55,2014-04-13GetafeAth Madrid
13/04/14,Valencia,Elche,2,1,H,1.65,3.6,5.1,2014-04-13,2013/2014,37,SP1,2-1,1,-3.4499999999999997,2014-04-13ValenciaElche
14/04/14,Ath Bilbao,Malaga,3,0,H,1.5,4.0,6.1,2014-04-14,2013/2014,37,SP1,3-0,3,-4.6,2014-04-14Ath BilbaoMalaga
18/04/14,Ath Madrid,Elche,2,0,H,1.2,6.0,12.5,2014-04-18,2013/2014,37,SP1,2-0,2,-11.3,2014-04-18Ath MadridElche
19/04/14,Levante,Getafe,0,0,D,2.4,3.3,2.75,2014-04-19,2013/2014,37,SP1,0-0,0,-0.3500000000000001,2014-04-19LevanteGetafe
19/04/14,Osasuna,Valencia,1,1,D,2.6,3.2,2.6,2014-04-19,2013/2014,37,SP1,1-1,0,0.0,2014-04-19OsasunaValencia
19/04/14,Sociedad,Espanol,2,1,H,1.6,3.9,5.0,2014-04-19,2013/2014,37,SP1,2-1,1,-3.4,2014-04-19SociedadEspanol
20/04/14,Almeria,Celta,2,4,A,2.3,3.3,2.9,2014-04-20,2013/2014,37,SP1,2-4,-2,-0.6000000000000001,2014-04-20AlmeriaCelta
20/04/14,Barcelona,Ath Bilbao,2,1,H,1.25,6.0,9.0,2014-04-20,2013/2014,38,SP1,2-1,1,-7.75,2014-04-20BarcelonaAth Bilbao
20/04/14,Sevilla,Granada,4,0,H,1.35,5.0,7.2,2014-04-20,2013/2014,38,SP1,4-0,4,-5.85,2014-04-20SevillaGranada
20/04/14,Vallecano,Betis,3,1,H,1.85,3.5,3.9,2014-04-20,2013/2014,38,SP1,3-1,2,-2.05,2014-04-20VallecanoBetis
21/04/14,Malaga,Villarreal,2,0,H,2.6,3.2,2.6,2014-04-21,2013/2014,38,SP1,2-0,2,0.0,2014-04-21MalagaVillarreal
25/04/14,Elche,Levante,1,1,D,1.6,3.7,5.4,2014-04-25,2013/2014,38,SP1,1-1,0,-3.8000000000000003,2014-04-25ElcheLevante
26/04/14,Betis,Sociedad,0,1,A,3.3,3.3,2.1,2014-04-26,2013/2014,38,SP1,0-1,-1,1.1999999999999997,2014-04-26BetisSociedad
26/04/14,Getafe,Malaga,1,0,H,2.0,3.3,3.6,2014-04-26,2013/2014,38,SP1,1-0,1,-1.6,2014-04-26GetafeMalaga
26/04/14,Granada,Vallecano,0,3,A,2.1,3.3,3.3,2014-04-26,2013/2014,38,SP1,0-3,-3,-1.1999999999999997,2014-04-26GranadaVallecano
26/04/14,Real Madrid,Osasuna,4,0,H,1.07,9.5,22.0,2014-04-26,2013/2014,38,SP1,4-0,4,-20.93,2014-04-26Real MadridOsasuna
27/04/14,Ath Bilbao,Sevilla,3,1,H,2.05,3.3,3.5,2014-04-27,2013/2014,39,SP1,3-1,2,-1.4500000000000002,2014-04-27Ath BilbaoSevilla
27/04/14,Espanol,Almeria,1,2,A,1.77,3.5,4.35,2014-04-27,2013/2014,39,SP1,1-2,-1,-2.5799999999999996,2014-04-27EspanolAlmeria
27/04/14,Valencia,Ath Madrid,0,1,A,4.2,3.5,1.8,2014-04-27,2013/2014,39,SP1,0-1,-1,2.4000000000000004,2014-04-27ValenciaAth Madrid
27/04/14,Villarreal,Barcelona,2,3,A,6.5,4.0,1.48,2014-04-27,2013/2014,39,SP1,2-3,-1,5.02,2014-04-27VillarrealBarcelona
28/04/14,Celta,Valladolid,4,1,H,1.85,3.45,4.0,2014-04-28,2013/2014,39,SP1,4-1,3,-2.15,2014-04-28CeltaValladolid
02/05/14,Vallecano,Ath Bilbao,0,3,A,3.6,3.3,2.0,2014-05-02,2013/2014,39,SP1,0-3,-3,1.6,2014-05-02VallecanoAth Bilbao
03/05/14,Barcelona,Getafe,2,2,D,1.05,11.0,25.0,2014-05-03,2013/2014,39,SP1,2-2,0,-23.95,2014-05-03BarcelonaGetafe
03/05/14,Malaga,Elche,0,1,A,2.1,3.3,3.3,2014-05-03,2013/2014,39,SP1,0-1,-1,-1.1999999999999997,2014-05-03MalagaElche
03/05/14,Osasuna,Celta,0,2,A,1.8,3.5,4.2,2014-05-03,2013/2014,39,SP1,0-2,-2,-2.4000000000000004,2014-05-03OsasunaCelta
03/05/14,Valladolid,Espanol,1,0,H,1.9,3.45,3.8,2014-05-03,2013/2014,40,SP1,1-0,1,-1.9,2014-05-03ValladolidEspanol
04/05/14,Almeria,Betis,3,2,H,1.6,3.9,5.0,2014-05-04,2013/2014,40,SP1,3-2,1,-3.4,2014-05-04AlmeriaBetis
04/05/14,Levante,Ath Madrid,2,0,H,9.0,6.0,1.25,2014-05-04,2013/2014,40,SP1,2-0,2,7.75,2014-05-04LevanteAth Madrid
04/05/14,Real Madrid,Valencia,2,2,D,1.15,7.0,15.0,2014-05-04,2013/2014,40,SP1,2-2,0,-13.85,2014-05-04Real MadridValencia
04/05/14,Sevilla,Villarreal,0,0,D,1.75,3.7,4.2,2014-05-04,2013/2014,40,SP1,0-0,0,-2.45,2014-05-04SevillaVillarreal
05/05/14,Sociedad,Granada,1,1,D,1.5,4.0,6.1,2014-05-05,2013/2014,40,SP1,1-1,0,-4.6,2014-05-05SociedadGranada
07/05/14,Valladolid,Real Madrid,1,1,D,12.0,6.2,1.2,2014-05-07,2013/2014,40,SP1,1-1,0,10.8,2014-05-07ValladolidReal Madrid
10/05/14,Levante,Valencia,2,0,H,3.0,3.2,2.3,2014-05-10,2013/2014,40,SP1,2-0,2,0.7000000000000002,2014-05-10LevanteValencia
10/05/14,Villarreal,Vallecano,4,0,H,1.55,3.9,5.6,2014-05-10,2013/2014,40,SP1,4-0,4,-4.05,2014-05-10VillarrealVallecano
11/05/14,Ath Bilbao,Sociedad,1,1,D,1.85,3.5,3.9,2014-05-11,2013/2014,41,SP1,1-1,0,-2.05,2014-05-11Ath BilbaoSociedad
11/05/14,Ath Madrid,Malaga,1,1,D,1.2,5.8,13.0,2014-05-11,2013/2014,41,SP1,1-1,0,-11.8,2014-05-11Ath MadridMalaga
11/05/14,Betis,Valladolid,4,3,H,3.3,3.5,2.0,2014-05-11,2013/2014,41,SP1,4-3,1,1.2999999999999998,2014-05-11BetisValladolid
11/05/14,Celta,Real Madrid,2,0,H,4.8,4.8,1.5,2014-05-11,2013/2014,41,SP1,2-0,2,3.3,2014-05-11CeltaReal Madrid
11/05/14,Elche,Barcelona,0,0,D,10.5,6.0,1.22,2014-05-11,2013/2014,41,SP1,0-0,0,9.28,2014-05-11ElcheBarcelona
11/05/14,Espanol,Osasuna,1,1,D,2.3,3.3,2.9,2014-05-11,2013/2014,41,SP1,1-1,0,-0.6000000000000001,2014-05-11EspanolOsasuna
11/05/14,Getafe,Sevilla,1,0,H,1.85,3.6,3.7,2014-05-11,2013/2014,41,SP1,1-0,1,-1.85,2014-05-11GetafeSevilla
11/05/14,Granada,Almeria,0,2,A,2.0,3.4,3.5,2014-05-11,2013/2014,41,SP1,0-2,-2,-1.5,2014-05-11GranadaAlmeria
16/05/14,Malaga,Levante,1,0,H,1.9,3.45,3.8,2014-05-16,2013/2014,41,SP1,1-0,1,-1.9,2014-05-16MalagaLevante
17/05/14,Barcelona,Ath Madrid,1,1,D,1.9,3.8,3.5,2014-05-17,2013/2014,42,SP1,1-1,0,-1.6,2014-05-17BarcelonaAth Madrid
17/05/14,Real Madrid,Espanol,3,1,H,1.3,5.0,9.0,2014-05-17,2013/2014,42,SP1,3-1,2,-7.7,2014-05-17Real MadridEspanol
17/05/14,Valencia,Celta,2,1,H,1.8,3.5,4.2,2014-05-17,2013/2014,42,SP1,2-1,1,-2.4000000000000004,2014-05-17ValenciaCelta
18/05/14,Almeria,Ath Bilbao,0,0,D,2.2,3.4,3.0,2014-05-18,2013/2014,42,SP1,0-0,0,-0.7999999999999998,2014-05-18AlmeriaAth Bilbao
18/05/14,Osasuna,Betis,2,1,H,1.4,5.0,6.0,2014-05-18,2013/2014,42,SP1,2-1,1,-4.6,2014-05-18OsasunaBetis
18/05/14,Sevilla,Elche,3,1,H,1.75,3.6,4.3,2014-05-18,2013/2014,42,SP1,3-1,2,-2.55,2014-05-18SevillaElche
18/05/14,Sociedad,Villarreal,1,2,A,1.9,3.45,3.8,2014-05-18,2013/2014,42,SP1,1-2,-1,-1.9,2014-05-18SociedadVillarreal
18/05/14,Valladolid,Granada,0,1,A,2.1,3.3,3.3,2014-05-18,2013/2014,42,SP1,0-1,-1,-1.1999999999999997,2014-05-18ValladolidGranada
18/05/14,Vallecano,Getafe,1,2,A,3.4,3.0,2.2,2014-05-18,2013/2014,42,SP1,1-2,-1,1.1999999999999997,2014-05-18VallecanoGetafe
