Date,HomeTeam,AwayTeam,FTHG,FTAG,FTR,IWH,IWD,IWA,datetime,season,game_day,league,result,goal_diff,odds_diff,game_id
26/08/06,Valencia,Betis,2,1,H,1.6,3.4,5.2,2006-08-26,2006/2007,1,SP1,2-1,1,-3.6,2006-08-26ValenciaBetis
27/08/06,Ath Bilbao,Sociedad,1,1,D,2.0,3.0,3.6,2006-08-27,2006/2007,1,SP1,1-1,0,-1.6,2006-08-27Ath BilbaoSociedad
27/08/06,Espanol,Gimnastic,0,1,A,1.75,3.3,4.2,2006-08-27,2006/2007,1,SP1,0-1,-1,-2.45,2006-08-27EspanolGimnastic
27/08/06,La Coruna,Zaragoza,3,2,H,2.0,3.2,3.0,2006-08-27,2006/2007,1,SP1,3-2,1,-1.0,2006-08-27La CorunaZaragoza
27/08/06,Osasuna,Getafe,0,2,A,1.85,3.2,3.8,2006-08-27,2006/2007,1,SP1,0-2,-2,-1.9499999999999997,2006-08-27OsasunaGetafe
27/08/06,Real Madrid,Villarreal,0,0,D,1.55,3.5,5.5,2006-08-27,2006/2007,1,SP1,0-0,0,-3.95,2006-08-27Real MadridVillarreal
27/08/06,Recreativo,Mallorca,1,1,D,2.2,3.0,3.1,2006-08-27,2006/2007,1,SP1,1-1,0,-0.8999999999999999,2006-08-27RecreativoMallorca
27/08/06,Santander,Ath Madrid,0,1,A,2.9,3.0,2.3,2006-08-27,2006/2007,1,SP1,0-1,-1,0.6000000000000001,2006-08-27SantanderAth Madrid
28/08/06,Celta,Barcelona,2,3,A,4.2,3.3,1.75,2006-08-28,2006/2007,1,SP1,2-3,-1,2.45,2006-08-28CeltaBarcelona
29/08/06,Sevilla,Levante,4,0,H,1.55,3.5,5.5,2006-08-29,2006/2007,2,SP1,4-0,4,-3.95,2006-08-29SevillaLevante
09/09/06,Ath Madrid,Valencia,0,1,A,2.4,2.8,3.0,2006-09-09,2006/2007,2,SP1,0-1,-1,-0.6000000000000001,2006-09-09Ath MadridValencia
09/09/06,Barcelona,Osasuna,3,0,H,1.33,4.2,8.0,2006-09-09,2006/2007,2,SP1,3-0,3,-6.67,2006-09-09BarcelonaOsasuna
10/09/06,Betis,Ath Bilbao,3,0,H,2.0,3.1,3.4,2006-09-10,2006/2007,2,SP1,3-0,3,-1.4,2006-09-10BetisAth Bilbao
10/09/06,Getafe,Santander,1,0,H,1.8,3.1,4.2,2006-09-10,2006/2007,2,SP1,1-0,1,-2.4000000000000004,2006-09-10GetafeSantander
10/09/06,Gimnastic,Celta,1,2,A,2.6,3.0,2.6,2006-09-10,2006/2007,2,SP1,1-2,-1,0.0,2006-09-10GimnasticCelta
10/09/06,Levante,Real Madrid,1,4,A,6.3,3.5,1.5,2006-09-10,2006/2007,2,SP1,1-4,-3,4.8,2006-09-10LevanteReal Madrid
10/09/06,Mallorca,La Coruna,0,0,D,2.5,2.9,2.8,2006-09-10,2006/2007,2,SP1,0-0,0,-0.2999999999999998,2006-09-10MallorcaLa Coruna
10/09/06,Sociedad,Sevilla,1,3,A,2.9,2.9,2.4,2006-09-10,2006/2007,2,SP1,1-3,-2,0.5,2006-09-10SociedadSevilla
10/09/06,Villarreal,Recreativo,0,1,A,1.55,3.5,5.5,2006-09-10,2006/2007,3,SP1,0-1,-1,-3.95,2006-09-10VillarrealRecreativo
10/09/06,Zaragoza,Espanol,3,0,H,1.8,3.1,4.2,2006-09-10,2006/2007,3,SP1,3-0,3,-2.4000000000000004,2006-09-10ZaragozaEspanol
16/09/06,La Coruna,Villarreal,2,0,H,2.2,3.1,3.0,2006-09-16,2006/2007,3,SP1,2-0,2,-0.7999999999999998,2006-09-16La CorunaVillarreal
17/09/06,Ath Bilbao,Ath Madrid,1,4,A,2.55,3.1,2.55,2006-09-17,2006/2007,3,SP1,1-4,-3,0.0,2006-09-17Ath BilbaoAth Madrid
17/09/06,Espanol,Celta,2,1,H,2.3,3.1,2.8,2006-09-17,2006/2007,3,SP1,2-1,1,-0.5,2006-09-17EspanolCelta
17/09/06,Osasuna,Gimnastic,2,0,H,1.7,3.3,4.5,2006-09-17,2006/2007,3,SP1,2-0,2,-2.8,2006-09-17OsasunaGimnastic
17/09/06,Real Madrid,Sociedad,2,0,H,1.25,4.6,10.5,2006-09-17,2006/2007,3,SP1,2-0,2,-9.25,2006-09-17Real MadridSociedad
17/09/06,Recreativo,Levante,0,1,A,2.0,3.0,3.6,2006-09-17,2006/2007,3,SP1,0-1,-1,-1.6,2006-09-17RecreativoLevante
17/09/06,Santander,Barcelona,0,3,A,7.0,3.6,1.45,2006-09-17,2006/2007,3,SP1,0-3,-3,5.55,2006-09-17SantanderBarcelona
17/09/06,Sevilla,Betis,3,2,H,1.75,3.2,4.3,2006-09-17,2006/2007,4,SP1,3-2,1,-2.55,2006-09-17SevillaBetis
17/09/06,Valencia,Getafe,2,0,H,1.55,3.5,5.5,2006-09-17,2006/2007,4,SP1,2-0,2,-3.95,2006-09-17ValenciaGetafe
17/09/06,Zaragoza,Mallorca,2,0,H,1.7,3.2,4.7,2006-09-17,2006/2007,4,SP1,2-0,2,-3.0,2006-09-17ZaragozaMallorca
23/09/06,Betis,Real Madrid,0,1,A,4.0,3.1,1.85,2006-09-23,2006/2007,4,SP1,0-1,-1,2.15,2006-09-23BetisReal Madrid
24/09/06,Ath Madrid,Sevilla,2,1,H,2.4,3.0,2.8,2006-09-24,2006/2007,4,SP1,2-1,1,-0.3999999999999999,2006-09-24Ath MadridSevilla
24/09/06,Barcelona,Valencia,1,1,D,1.55,3.5,5.5,2006-09-24,2006/2007,4,SP1,1-1,0,-3.95,2006-09-24BarcelonaValencia
24/09/06,Celta,Osasuna,0,2,A,1.9,3.1,3.8,2006-09-24,2006/2007,4,SP1,0-2,-2,-1.9,2006-09-24CeltaOsasuna
24/09/06,Getafe,Ath Bilbao,0,0,D,1.85,3.1,4.0,2006-09-24,2006/2007,4,SP1,0-0,0,-2.15,2006-09-24GetafeAth Bilbao
24/09/06,Gimnastic,Santander,2,2,D,2.2,3.0,3.1,2006-09-24,2006/2007,4,SP1,2-2,0,-0.8999999999999999,2006-09-24GimnasticSantander
24/09/06,Levante,La Coruna,2,0,H,3.1,3.0,2.2,2006-09-24,2006/2007,5,SP1,2-0,2,0.8999999999999999,2006-09-24LevanteLa Coruna
24/09/06,Mallorca,Espanol,1,0,H,2.1,3.0,3.3,2006-09-24,2006/2007,5,SP1,1-0,1,-1.1999999999999997,2006-09-24MallorcaEspanol
24/09/06,Sociedad,Recreativo,2,3,A,1.9,3.1,3.8,2006-09-24,2006/2007,5,SP1,2-3,-1,-1.9,2006-09-24SociedadRecreativo
24/09/06,Villarreal,Zaragoza,3,2,H,2.0,3.0,3.6,2006-09-24,2006/2007,5,SP1,3-2,1,-1.6,2006-09-24VillarrealZaragoza
30/09/06,Ath Bilbao,Barcelona,1,3,A,6.0,3.6,1.5,2006-09-30,2006/2007,5,SP1,1-3,-2,4.5,2006-09-30Ath BilbaoBarcelona
01/10/06,Espanol,Osasuna,0,0,D,2.4,3.0,2.8,2006-10-01,2006/2007,5,SP1,0-0,0,-0.3999999999999999,2006-10-01EspanolOsasuna
01/10/06,La Coruna,Sociedad,2,0,H,1.65,3.4,4.7,2006-10-01,2006/2007,5,SP1,2-0,2,-3.0500000000000003,2006-10-01La CorunaSociedad
01/10/06,Mallorca,Villarreal,1,2,A,2.6,3.0,2.6,2006-10-01,2006/2007,5,SP1,1-2,-1,0.0,2006-10-01MallorcaVillarreal
01/10/06,Real Madrid,Ath Madrid,1,1,D,1.65,3.4,4.7,2006-10-01,2006/2007,5,SP1,1-1,0,-3.0500000000000003,2006-10-01Real MadridAth Madrid
01/10/06,Recreativo,Betis,2,0,H,2.4,3.0,2.8,2006-10-01,2006/2007,6,SP1,2-0,2,-0.3999999999999999,2006-10-01RecreativoBetis
01/10/06,Santander,Celta,1,1,D,2.55,3.1,2.55,2006-10-01,2006/2007,6,SP1,1-1,0,0.0,2006-10-01SantanderCelta
01/10/06,Sevilla,Getafe,1,0,H,1.55,3.5,5.5,2006-10-01,2006/2007,6,SP1,1-0,1,-3.95,2006-10-01SevillaGetafe
01/10/06,Valencia,Gimnastic,4,0,H,1.3,4.4,8.5,2006-10-01,2006/2007,6,SP1,4-0,4,-7.2,2006-10-01ValenciaGimnastic
01/10/06,Zaragoza,Levante,2,2,D,1.65,3.4,4.7,2006-10-01,2006/2007,6,SP1,2-2,0,-3.0500000000000003,2006-10-01ZaragozaLevante
14/10/06,Ath Madrid,Recreativo,2,1,H,1.45,3.6,7.0,2006-10-14,2006/2007,6,SP1,2-1,1,-5.55,2006-10-14Ath MadridRecreativo
14/10/06,Getafe,Real Madrid,1,0,H,4.5,3.3,1.7,2006-10-14,2006/2007,6,SP1,1-0,1,2.8,2006-10-14GetafeReal Madrid
15/10/06,Barcelona,Sevilla,3,1,H,1.55,3.6,5.3,2006-10-15,2006/2007,6,SP1,3-1,2,-3.75,2006-10-15BarcelonaSevilla
15/10/06,Betis,La Coruna,1,1,D,2.3,3.1,2.8,2006-10-15,2006/2007,6,SP1,1-1,0,-0.5,2006-10-15BetisLa Coruna
15/10/06,Celta,Valencia,3,2,H,4.0,3.0,1.9,2006-10-15,2006/2007,7,SP1,3-2,1,2.1,2006-10-15CeltaValencia
15/10/06,Gimnastic,Ath Bilbao,2,3,A,2.4,3.1,2.7,2006-10-15,2006/2007,7,SP1,2-3,-1,-0.30000000000000027,2006-10-15GimnasticAth Bilbao
15/10/06,Levante,Mallorca,0,1,A,2.3,3.0,2.9,2006-10-15,2006/2007,7,SP1,0-1,-1,-0.6000000000000001,2006-10-15LevanteMallorca
15/10/06,Osasuna,Santander,0,1,A,1.85,3.0,4.2,2006-10-15,2006/2007,7,SP1,0-1,-1,-2.35,2006-10-15OsasunaSantander
15/10/06,Sociedad,Zaragoza,1,3,A,2.55,3.1,2.55,2006-10-15,2006/2007,7,SP1,1-3,-2,0.0,2006-10-15SociedadZaragoza
15/10/06,Villarreal,Espanol,0,0,D,1.6,3.5,5.0,2006-10-15,2006/2007,7,SP1,0-0,0,-3.4,2006-10-15VillarrealEspanol
21/10/06,La Coruna,Ath Madrid,1,0,H,2.4,2.9,2.9,2006-10-21,2006/2007,7,SP1,1-0,1,-0.5,2006-10-21La CorunaAth Madrid
21/10/06,Villarreal,Levante,1,1,D,1.6,3.4,5.2,2006-10-21,2006/2007,7,SP1,1-1,0,-3.6,2006-10-21VillarrealLevante
21/10/06,Zaragoza,Betis,2,1,H,1.75,3.2,4.3,2006-10-21,2006/2007,7,SP1,2-1,1,-2.55,2006-10-21ZaragozaBetis
22/10/06,Ath Bilbao,Celta,0,1,A,2.4,3.0,2.8,2006-10-22,2006/2007,8,SP1,0-1,-1,-0.3999999999999999,2006-10-22Ath BilbaoCelta
22/10/06,Espanol,Santander,2,2,D,2.0,3.0,3.6,2006-10-22,2006/2007,8,SP1,2-2,0,-1.6,2006-10-22EspanolSantander
22/10/06,Mallorca,Sociedad,0,0,D,1.9,3.1,3.8,2006-10-22,2006/2007,8,SP1,0-0,0,-1.9,2006-10-22MallorcaSociedad
22/10/06,Real Madrid,Barcelona,2,0,H,2.55,3.1,2.55,2006-10-22,2006/2007,8,SP1,2-0,2,0.0,2006-10-22Real MadridBarcelona
22/10/06,Recreativo,Getafe,1,2,A,2.3,2.9,3.0,2006-10-22,2006/2007,8,SP1,1-2,-1,-0.7000000000000002,2006-10-22RecreativoGetafe
22/10/06,Sevilla,Gimnastic,2,1,H,1.35,4.0,8.0,2006-10-22,2006/2007,8,SP1,2-1,1,-6.65,2006-10-22SevillaGimnastic
22/10/06,Valencia,Osasuna,1,0,H,1.5,3.5,6.3,2006-10-22,2006/2007,8,SP1,1-0,1,-4.8,2006-10-22ValenciaOsasuna
28/10/06,Barcelona,Recreativo,3,0,H,1.17,5.4,13.0,2006-10-28,2006/2007,8,SP1,3-0,3,-11.83,2006-10-28BarcelonaRecreativo
28/10/06,Gimnastic,Real Madrid,1,3,A,7.0,3.6,1.45,2006-10-28,2006/2007,8,SP1,1-3,-2,5.55,2006-10-28GimnasticReal Madrid
28/10/06,Santander,Valencia,1,0,H,3.8,3.1,1.9,2006-10-28,2006/2007,9,SP1,1-0,1,1.9,2006-10-28SantanderValencia
29/10/06,Ath Madrid,Zaragoza,0,1,A,1.8,3.1,4.2,2006-10-29,2006/2007,9,SP1,0-1,-1,-2.4000000000000004,2006-10-29Ath MadridZaragoza
29/10/06,Betis,Mallorca,0,1,A,2.1,3.0,3.3,2006-10-29,2006/2007,9,SP1,0-1,-1,-1.1999999999999997,2006-10-29BetisMallorca
29/10/06,Celta,Sevilla,1,2,A,2.6,3.0,2.6,2006-10-29,2006/2007,9,SP1,1-2,-1,0.0,2006-10-29CeltaSevilla
29/10/06,Getafe,La Coruna,2,0,H,2.3,3.0,2.9,2006-10-29,2006/2007,9,SP1,2-0,2,-0.6000000000000001,2006-10-29GetafeLa Coruna
29/10/06,Levante,Espanol,0,0,D,2.1,3.0,3.3,2006-10-29,2006/2007,9,SP1,0-0,0,-1.1999999999999997,2006-10-29LevanteEspanol
29/10/06,Osasuna,Ath Bilbao,1,1,D,2.0,3.1,3.4,2006-10-29,2006/2007,9,SP1,1-1,0,-1.4,2006-10-29OsasunaAth Bilbao
29/10/06,Sociedad,Villarreal,0,1,A,2.8,3.0,2.4,2006-10-29,2006/2007,9,SP1,0-1,-1,0.3999999999999999,2006-10-29SociedadVillarreal
04/11/06,La Coruna,Barcelona,1,1,D,4.0,3.0,1.9,2006-11-04,2006/2007,9,SP1,1-1,0,2.1,2006-11-04La CorunaBarcelona
04/11/06,Levante,Sociedad,2,0,H,2.0,3.0,3.6,2006-11-04,2006/2007,10,SP1,2-0,2,-1.6,2006-11-04LevanteSociedad
04/11/06,Mallorca,Ath Madrid,0,0,D,2.6,3.0,2.6,2006-11-04,2006/2007,10,SP1,0-0,0,0.0,2006-11-04MallorcaAth Madrid
05/11/06,Ath Bilbao,Santander,0,0,D,2.0,2.9,3.7,2006-11-05,2006/2007,10,SP1,0-0,0,-1.7000000000000002,2006-11-05Ath BilbaoSantander
05/11/06,Espanol,Valencia,1,1,D,3.6,3.0,2.0,2006-11-05,2006/2007,10,SP1,1-1,0,1.6,2006-11-05EspanolValencia
05/11/06,Real Madrid,Celta,1,2,A,1.3,4.4,8.5,2006-11-05,2006/2007,10,SP1,1-2,-1,-7.2,2006-11-05Real MadridCelta
05/11/06,Recreativo,Gimnastic,2,1,H,1.85,3.1,4.0,2006-11-05,2006/2007,10,SP1,2-1,1,-2.15,2006-11-05RecreativoGimnastic
05/11/06,Sevilla,Osasuna,2,0,H,1.5,3.5,6.3,2006-11-05,2006/2007,10,SP1,2-0,2,-4.8,2006-11-05SevillaOsasuna
05/11/06,Villarreal,Betis,3,2,H,1.65,3.4,4.7,2006-11-05,2006/2007,10,SP1,3-2,1,-3.0500000000000003,2006-11-05VillarrealBetis
05/11/06,Zaragoza,Getafe,3,1,H,1.85,3.0,4.2,2006-11-05,2006/2007,10,SP1,3-1,2,-2.35,2006-11-05ZaragozaGetafe
11/11/06,Ath Madrid,Villarreal,3,1,H,2.2,2.9,3.2,2006-11-11,2006/2007,11,SP1,3-1,2,-1.0,2006-11-11Ath MadridVillarreal
11/11/06,Valencia,Ath Bilbao,1,1,D,1.45,3.6,7.0,2006-11-11,2006/2007,11,SP1,1-1,0,-5.55,2006-11-11ValenciaAth Bilbao
12/11/06,Barcelona,Zaragoza,3,1,H,1.5,3.5,6.3,2006-11-12,2006/2007,11,SP1,3-1,2,-4.8,2006-11-12BarcelonaZaragoza
12/11/06,Betis,Levante,2,1,H,2.0,3.1,3.4,2006-11-12,2006/2007,11,SP1,2-1,1,-1.4,2006-11-12BetisLevante
12/11/06,Celta,Recreativo,1,2,A,1.7,3.3,4.5,2006-11-12,2006/2007,11,SP1,1-2,-1,-2.8,2006-11-12CeltaRecreativo
12/11/06,Getafe,Mallorca,1,0,H,1.9,3.0,4.0,2006-11-12,2006/2007,11,SP1,1-0,1,-2.1,2006-11-12GetafeMallorca
12/11/06,Gimnastic,La Coruna,0,0,D,3.1,3.0,2.2,2006-11-12,2006/2007,11,SP1,0-0,0,0.8999999999999999,2006-11-12GimnasticLa Coruna
12/11/06,Osasuna,Real Madrid,1,4,A,4.5,3.3,1.7,2006-11-12,2006/2007,11,SP1,1-4,-3,2.8,2006-11-12OsasunaReal Madrid
12/11/06,Santander,Sevilla,0,0,D,3.6,3.0,2.0,2006-11-12,2006/2007,11,SP1,0-0,0,1.6,2006-11-12SantanderSevilla
12/11/06,Sociedad,Espanol,1,1,D,2.4,3.0,2.8,2006-11-12,2006/2007,12,SP1,1-1,0,-0.3999999999999999,2006-11-12SociedadEspanol
18/11/06,Real Madrid,Santander,3,1,H,1.25,4.6,10.5,2006-11-18,2006/2007,12,SP1,3-1,2,-9.25,2006-11-18Real MadridSantander
18/11/06,Sevilla,Valencia,3,0,H,2.2,3.0,3.1,2006-11-18,2006/2007,12,SP1,3-0,3,-0.8999999999999999,2006-11-18SevillaValencia
19/11/06,Espanol,Ath Bilbao,3,2,H,2.2,2.9,3.2,2006-11-19,2006/2007,12,SP1,3-2,1,-1.0,2006-11-19EspanolAth Bilbao
19/11/06,La Coruna,Celta,0,1,A,1.9,3.1,3.8,2006-11-19,2006/2007,12,SP1,0-1,-1,-1.9,2006-11-19La CorunaCelta
19/11/06,Levante,Ath Madrid,0,3,A,2.7,3.0,2.5,2006-11-19,2006/2007,12,SP1,0-3,-3,0.20000000000000018,2006-11-19LevanteAth Madrid
19/11/06,Mallorca,Barcelona,1,4,A,5.5,3.5,1.55,2006-11-19,2006/2007,12,SP1,1-4,-3,3.95,2006-11-19MallorcaBarcelona
19/11/06,Recreativo,Osasuna,2,0,H,2.1,3.1,3.2,2006-11-19,2006/2007,12,SP1,2-0,2,-1.1,2006-11-19RecreativoOsasuna
19/11/06,Sociedad,Betis,0,0,D,2.3,3.0,2.9,2006-11-19,2006/2007,12,SP1,0-0,0,-0.6000000000000001,2006-11-19SociedadBetis
19/11/06,Villarreal,Getafe,1,0,H,1.9,3.0,4.0,2006-11-19,2006/2007,13,SP1,1-0,1,-2.1,2006-11-19VillarrealGetafe
19/11/06,Zaragoza,Gimnastic,3,0,H,1.4,3.7,7.5,2006-11-19,2006/2007,13,SP1,3-0,3,-6.1,2006-11-19ZaragozaGimnastic
25/11/06,Ath Madrid,Sociedad,1,1,D,1.4,3.7,7.5,2006-11-25,2006/2007,13,SP1,1-1,0,-6.1,2006-11-25Ath MadridSociedad
25/11/06,Barcelona,Villarreal,4,0,H,1.4,3.7,7.5,2006-11-25,2006/2007,13,SP1,4-0,4,-6.1,2006-11-25BarcelonaVillarreal
26/11/06,Ath Bilbao,Sevilla,1,3,A,3.3,3.0,2.1,2006-11-26,2006/2007,13,SP1,1-3,-2,1.1999999999999997,2006-11-26Ath BilbaoSevilla
26/11/06,Betis,Espanol,1,1,D,2.0,3.0,3.6,2006-11-26,2006/2007,13,SP1,1-1,0,-1.6,2006-11-26BetisEspanol
26/11/06,Celta,Zaragoza,1,1,D,2.3,3.1,2.8,2006-11-26,2006/2007,13,SP1,1-1,0,-0.5,2006-11-26CeltaZaragoza
26/11/06,Getafe,Levante,0,0,D,1.75,3.2,4.3,2006-11-26,2006/2007,13,SP1,0-0,0,-2.55,2006-11-26GetafeLevante
26/11/06,Gimnastic,Mallorca,2,3,A,2.5,3.0,2.7,2006-11-26,2006/2007,13,SP1,2-3,-1,-0.20000000000000018,2006-11-26GimnasticMallorca
26/11/06,Osasuna,La Coruna,4,1,H,2.5,3.0,2.7,2006-11-26,2006/2007,14,SP1,4-1,3,-0.20000000000000018,2006-11-26OsasunaLa Coruna
26/11/06,Santander,Recreativo,4,3,H,2.2,2.9,3.2,2006-11-26,2006/2007,14,SP1,4-3,1,-1.0,2006-11-26SantanderRecreativo
26/11/06,Valencia,Real Madrid,0,1,A,2.7,3.0,2.5,2006-11-26,2006/2007,14,SP1,0-1,-1,0.20000000000000018,2006-11-26ValenciaReal Madrid
02/12/06,Betis,Ath Madrid,0,1,A,2.7,3.0,2.5,2006-12-02,2006/2007,14,SP1,0-1,-1,0.20000000000000018,2006-12-02BetisAth Madrid
02/12/06,Levante,Barcelona,1,1,D,6.5,3.7,1.45,2006-12-02,2006/2007,14,SP1,1-1,0,5.05,2006-12-02LevanteBarcelona
02/12/06,Recreativo,Valencia,2,0,H,3.1,3.0,2.2,2006-12-02,2006/2007,14,SP1,2-0,2,0.8999999999999999,2006-12-02RecreativoValencia
03/12/06,Espanol,Sevilla,2,1,H,3.3,3.0,2.1,2006-12-03,2006/2007,14,SP1,2-1,1,1.1999999999999997,2006-12-03EspanolSevilla
03/12/06,La Coruna,Santander,0,0,D,1.8,3.1,4.2,2006-12-03,2006/2007,14,SP1,0-0,0,-2.4000000000000004,2006-12-03La CorunaSantander
03/12/06,Mallorca,Celta,2,2,D,2.4,3.0,2.8,2006-12-03,2006/2007,14,SP1,2-2,0,-0.3999999999999999,2006-12-03MallorcaCelta
03/12/06,Real Madrid,Ath Bilbao,2,1,H,1.25,4.7,10.0,2006-12-03,2006/2007,15,SP1,2-1,1,-8.75,2006-12-03Real MadridAth Bilbao
03/12/06,Sociedad,Getafe,0,0,D,2.4,3.0,2.8,2006-12-03,2006/2007,15,SP1,0-0,0,-0.3999999999999999,2006-12-03SociedadGetafe
03/12/06,Villarreal,Gimnastic,2,0,H,1.45,3.7,6.5,2006-12-03,2006/2007,15,SP1,2-0,2,-5.05,2006-12-03VillarrealGimnastic
03/12/06,Zaragoza,Osasuna,1,2,A,1.55,3.5,5.5,2006-12-03,2006/2007,15,SP1,1-2,-1,-3.95,2006-12-03ZaragozaOsasuna
09/12/06,Barcelona,Sociedad,1,0,H,1.2,5.0,12.0,2006-12-09,2006/2007,15,SP1,1-0,1,-10.8,2006-12-09BarcelonaSociedad
09/12/06,Sevilla,Real Madrid,2,1,H,2.45,3.1,2.65,2006-12-09,2006/2007,15,SP1,2-1,1,-0.19999999999999973,2006-12-09SevillaReal Madrid
10/12/06,Ath Bilbao,Recreativo,4,2,H,2.3,3.0,2.9,2006-12-10,2006/2007,15,SP1,4-2,2,-0.6000000000000001,2006-12-10Ath BilbaoRecreativo
10/12/06,Ath Madrid,Espanol,1,2,A,1.65,3.3,4.9,2006-12-10,2006/2007,15,SP1,1-2,-1,-3.2500000000000004,2006-12-10Ath MadridEspanol
10/12/06,Celta,Villarreal,1,1,D,2.3,3.0,2.9,2006-12-10,2006/2007,15,SP1,1-1,0,-0.6000000000000001,2006-12-10CeltaVillarreal
10/12/06,Getafe,Betis,1,1,D,1.9,3.1,3.8,2006-12-10,2006/2007,16,SP1,1-1,0,-1.9,2006-12-10GetafeBetis
10/12/06,Gimnastic,Levante,2,1,H,2.5,3.0,2.7,2006-12-10,2006/2007,16,SP1,2-1,1,-0.20000000000000018,2006-12-10GimnasticLevante
10/12/06,Osasuna,Mallorca,3,0,H,2.1,3.0,3.3,2006-12-10,2006/2007,16,SP1,3-0,3,-1.1999999999999997,2006-12-10OsasunaMallorca
10/12/06,Santander,Zaragoza,0,2,A,2.7,3.0,2.5,2006-12-10,2006/2007,16,SP1,0-2,-2,0.20000000000000018,2006-12-10SantanderZaragoza
10/12/06,Valencia,La Coruna,4,0,H,1.75,3.2,4.3,2006-12-10,2006/2007,16,SP1,4-0,4,-2.55,2006-12-10ValenciaLa Coruna
16/12/06,La Coruna,Ath Bilbao,0,2,A,2.0,3.1,3.4,2006-12-16,2006/2007,16,SP1,0-2,-2,-1.4,2006-12-16La CorunaAth Bilbao
16/12/06,Mallorca,Santander,1,2,A,2.0,2.9,3.7,2006-12-16,2006/2007,16,SP1,1-2,-1,-1.7000000000000002,2006-12-16MallorcaSantander
16/12/06,Zaragoza,Valencia,0,1,A,2.3,3.0,2.9,2006-12-16,2006/2007,16,SP1,0-1,-1,-0.6000000000000001,2006-12-16ZaragozaValencia
17/12/06,Ath Madrid,Getafe,1,0,H,1.8,3.0,4.4,2006-12-17,2006/2007,16,SP1,1-0,1,-2.6000000000000005,2006-12-17Ath MadridGetafe
17/12/06,Espanol,Real Madrid,0,1,A,3.8,3.1,1.9,2006-12-17,2006/2007,17,SP1,0-1,-1,1.9,2006-12-17EspanolReal Madrid
17/12/06,Levante,Celta,1,1,D,2.6,3.0,2.6,2006-12-17,2006/2007,17,SP1,1-1,0,0.0,2006-12-17LevanteCelta
17/12/06,Recreativo,Sevilla,1,3,A,3.2,3.1,2.1,2006-12-17,2006/2007,17,SP1,1-3,-2,1.1,2006-12-17RecreativoSevilla
17/12/06,Sociedad,Gimnastic,3,2,H,1.85,3.1,4.0,2006-12-17,2006/2007,17,SP1,3-2,1,-2.15,2006-12-17SociedadGimnastic
17/12/06,Villarreal,Osasuna,1,4,A,1.8,3.0,4.4,2006-12-17,2006/2007,17,SP1,1-4,-3,-2.6000000000000005,2006-12-17VillarrealOsasuna
19/12/06,Ath Bilbao,Zaragoza,0,0,D,2.65,3.1,2.45,2006-12-19,2006/2007,17,SP1,0-0,0,0.19999999999999973,2006-12-19Ath BilbaoZaragoza
19/12/06,Valencia,Mallorca,3,1,H,1.35,4.0,8.0,2006-12-19,2006/2007,17,SP1,3-1,2,-6.65,2006-12-19ValenciaMallorca
20/12/06,Celta,Sociedad,0,0,D,1.65,3.4,4.7,2006-12-20,2006/2007,17,SP1,0-0,0,-3.0500000000000003,2006-12-20CeltaSociedad
20/12/06,Getafe,Espanol,0,1,A,2.0,3.0,3.6,2006-12-20,2006/2007,17,SP1,0-1,-1,-1.6,2006-12-20GetafeEspanol
20/12/06,Gimnastic,Betis,0,1,A,2.5,3.1,2.6,2006-12-20,2006/2007,18,SP1,0-1,-1,-0.10000000000000009,2006-12-20GimnasticBetis
20/12/06,Osasuna,Levante,2,1,H,1.7,3.3,4.5,2006-12-20,2006/2007,18,SP1,2-1,1,-2.8,2006-12-20OsasunaLevante
20/12/06,Real Madrid,Recreativo,0,3,A,1.25,4.7,10.0,2006-12-20,2006/2007,18,SP1,0-3,-3,-8.75,2006-12-20Real MadridRecreativo
20/12/06,Santander,Villarreal,2,1,H,2.4,3.0,2.8,2006-12-20,2006/2007,18,SP1,2-1,1,-0.3999999999999999,2006-12-20SantanderVillarreal
20/12/06,Sevilla,La Coruna,4,0,H,1.4,3.8,7.0,2006-12-20,2006/2007,18,SP1,4-0,4,-5.6,2006-12-20SevillaLa Coruna
21/12/06,Barcelona,Ath Madrid,1,1,D,1.45,3.7,6.5,2006-12-21,2006/2007,18,SP1,1-1,0,-5.05,2006-12-21BarcelonaAth Madrid
06/01/07,Ath Madrid,Gimnastic,0,0,D,1.27,4.4,10.0,2007-01-06,2006/2007,18,SP1,0-0,0,-8.73,2007-01-06Ath MadridGimnastic
06/01/07,Sociedad,Osasuna,2,1,H,2.3,3.1,2.8,2007-01-06,2006/2007,18,SP1,2-1,1,-0.5,2007-01-06SociedadOsasuna
06/01/07,Zaragoza,Sevilla,2,1,H,2.55,3.1,2.55,2007-01-06,2006/2007,18,SP1,2-1,1,0.0,2007-01-06ZaragozaSevilla
07/01/07,Betis,Celta,1,0,H,2.3,3.1,2.8,2007-01-07,2006/2007,19,SP1,1-0,1,-0.5,2007-01-07BetisCelta
07/01/07,Espanol,Recreativo,0,1,A,2.0,3.1,3.4,2007-01-07,2006/2007,19,SP1,0-1,-1,-1.4,2007-01-07EspanolRecreativo
07/01/07,Getafe,Barcelona,1,1,D,3.8,3.2,1.85,2007-01-07,2006/2007,19,SP1,1-1,0,1.9499999999999997,2007-01-07GetafeBarcelona
07/01/07,La Coruna,Real Madrid,2,0,H,3.8,3.1,1.9,2007-01-07,2006/2007,19,SP1,2-0,2,1.9,2007-01-07La CorunaReal Madrid
07/01/07,Levante,Santander,2,0,H,2.2,3.0,3.1,2007-01-07,2006/2007,19,SP1,2-0,2,-0.8999999999999999,2007-01-07LevanteSantander
07/01/07,Mallorca,Ath Bilbao,1,3,A,2.1,3.0,3.3,2007-01-07,2006/2007,19,SP1,1-3,-2,-1.1999999999999997,2007-01-07MallorcaAth Bilbao
07/01/07,Villarreal,Valencia,0,1,A,2.6,3.0,2.6,2007-01-07,2006/2007,19,SP1,0-1,-1,0.0,2007-01-07VillarrealValencia
13/01/07,Espanol,Barcelona,3,1,H,4.9,3.3,1.65,2007-01-13,2006/2007,19,SP1,3-1,2,3.2500000000000004,2007-01-13EspanolBarcelona
13/01/07,Valencia,Levante,3,0,H,1.37,3.8,8.0,2007-01-13,2006/2007,19,SP1,3-0,3,-6.63,2007-01-13ValenciaLevante
14/01/07,Ath Bilbao,Villarreal,0,1,A,2.1,3.1,3.2,2007-01-14,2006/2007,20,SP1,0-1,-1,-1.1,2007-01-14Ath BilbaoVillarreal
14/01/07,Celta,Ath Madrid,1,3,A,2.5,3.0,2.7,2007-01-14,2006/2007,20,SP1,1-3,-2,-0.20000000000000018,2007-01-14CeltaAth Madrid
14/01/07,Gimnastic,Getafe,1,3,A,2.55,3.1,2.55,2007-01-14,2006/2007,20,SP1,1-3,-2,0.0,2007-01-14GimnasticGetafe
14/01/07,Osasuna,Betis,5,1,H,1.9,3.1,3.8,2007-01-14,2006/2007,20,SP1,5-1,4,-1.9,2007-01-14OsasunaBetis
14/01/07,Real Madrid,Zaragoza,1,0,H,1.65,3.4,4.7,2007-01-14,2006/2007,20,SP1,1-0,1,-3.0500000000000003,2007-01-14Real MadridZaragoza
14/01/07,Recreativo,La Coruna,1,1,D,2.2,3.1,3.0,2007-01-14,2006/2007,20,SP1,1-1,0,-0.7999999999999998,2007-01-14RecreativoLa Coruna
14/01/07,Santander,Sociedad,1,0,H,2.2,3.0,3.1,2007-01-14,2006/2007,20,SP1,1-0,1,-0.8999999999999999,2007-01-14SantanderSociedad
14/01/07,Sevilla,Mallorca,1,2,A,1.35,4.0,8.0,2007-01-14,2006/2007,20,SP1,1-2,-1,-6.65,2007-01-14SevillaMallorca
20/01/07,Ath Madrid,Osasuna,1,0,H,1.85,3.1,4.0,2007-01-20,2006/2007,20,SP1,1-0,1,-2.15,2007-01-20Ath MadridOsasuna
20/01/07,Villarreal,Sevilla,0,0,D,2.7,3.1,2.4,2007-01-20,2006/2007,21,SP1,0-0,0,0.30000000000000027,2007-01-20VillarrealSevilla
21/01/07,Barcelona,Gimnastic,3,0,H,1.15,5.7,14.0,2007-01-21,2006/2007,21,SP1,3-0,3,-12.85,2007-01-21BarcelonaGimnastic
21/01/07,Betis,Santander,1,1,D,2.1,3.0,3.3,2007-01-21,2006/2007,21,SP1,1-1,0,-1.1999999999999997,2007-01-21BetisSantander
21/01/07,Getafe,Celta,1,0,H,2.1,3.1,3.2,2007-01-21,2006/2007,21,SP1,1-0,1,-1.1,2007-01-21GetafeCelta
21/01/07,La Coruna,Espanol,0,0,D,2.1,3.1,3.2,2007-01-21,2006/2007,21,SP1,0-0,0,-1.1,2007-01-21La CorunaEspanol
21/01/07,Levante,Ath Bilbao,0,0,D,2.2,3.0,3.1,2007-01-21,2006/2007,21,SP1,0-0,0,-0.8999999999999999,2007-01-21LevanteAth Bilbao
21/01/07,Mallorca,Real Madrid,0,1,A,4.0,3.2,1.8,2007-01-21,2006/2007,21,SP1,0-1,-1,2.2,2007-01-21MallorcaReal Madrid
21/01/07,Sociedad,Valencia,0,1,A,3.8,3.1,1.9,2007-01-21,2006/2007,21,SP1,0-1,-1,1.9,2007-01-21SociedadValencia
21/01/07,Zaragoza,Recreativo,0,0,D,1.8,3.2,4.0,2007-01-21,2006/2007,21,SP1,0-0,0,-2.2,2007-01-21ZaragozaRecreativo
24/01/07,Betis,Barcelona,1,1,D,4.9,3.3,1.65,2007-01-24,2006/2007,22,SP1,1-1,0,3.2500000000000004,2007-01-24BetisBarcelona
27/01/07,Ath Madrid,Santander,1,1,D,1.7,3.3,4.5,2007-01-27,2006/2007,22,SP1,1-1,0,-2.8,2007-01-27Ath MadridSantander
27/01/07,Villarreal,Real Madrid,1,0,H,3.3,3.0,2.1,2007-01-27,2006/2007,22,SP1,1-0,1,1.1999999999999997,2007-01-27VillarrealReal Madrid
28/01/07,Barcelona,Celta,3,1,H,1.27,4.5,9.5,2007-01-28,2006/2007,22,SP1,3-1,2,-8.23,2007-01-28BarcelonaCelta
28/01/07,Betis,Valencia,2,1,H,3.4,3.1,2.0,2007-01-28,2006/2007,22,SP1,2-1,1,1.4,2007-01-28BetisValencia
28/01/07,Getafe,Osasuna,2,0,H,1.85,3.1,4.0,2007-01-28,2006/2007,22,SP1,2-0,2,-2.15,2007-01-28GetafeOsasuna
28/01/07,Gimnastic,Espanol,4,0,H,3.0,3.1,2.2,2007-01-28,2006/2007,22,SP1,4-0,4,0.7999999999999998,2007-01-28GimnasticEspanol
28/01/07,Levante,Sevilla,2,4,A,3.8,3.2,1.85,2007-01-28,2006/2007,22,SP1,2-4,-2,1.9499999999999997,2007-01-28LevanteSevilla
28/01/07,Mallorca,Recreativo,2,1,H,2.3,3.1,2.8,2007-01-28,2006/2007,22,SP1,2-1,1,-0.5,2007-01-28MallorcaRecreativo
28/01/07,Sociedad,Ath Bilbao,0,2,A,2.3,2.9,3.0,2007-01-28,2006/2007,23,SP1,0-2,-2,-0.7000000000000002,2007-01-28SociedadAth Bilbao
28/01/07,Zaragoza,La Coruna,1,1,D,1.85,3.1,4.0,2007-01-28,2006/2007,23,SP1,1-1,0,-2.15,2007-01-28ZaragozaLa Coruna
03/02/07,Espanol,Zaragoza,1,2,A,2.3,3.0,2.9,2007-02-03,2006/2007,23,SP1,1-2,-1,-0.6000000000000001,2007-02-03EspanolZaragoza
03/02/07,La Coruna,Mallorca,1,0,H,1.9,3.1,3.8,2007-02-03,2006/2007,23,SP1,1-0,1,-1.9,2007-02-03La CorunaMallorca
03/02/07,Valencia,Ath Madrid,3,1,H,1.85,3.1,4.0,2007-02-03,2006/2007,23,SP1,3-1,2,-2.15,2007-02-03ValenciaAth Madrid
04/02/07,Ath Bilbao,Betis,1,2,A,2.1,3.0,3.3,2007-02-04,2006/2007,23,SP1,1-2,-1,-1.1999999999999997,2007-02-04Ath BilbaoBetis
04/02/07,Celta,Gimnastic,1,1,D,1.65,3.4,4.7,2007-02-04,2006/2007,23,SP1,1-1,0,-3.0500000000000003,2007-02-04CeltaGimnastic
04/02/07,Osasuna,Barcelona,0,0,D,4.7,3.2,1.7,2007-02-04,2006/2007,23,SP1,0-0,0,3.0,2007-02-04OsasunaBarcelona
04/02/07,Real Madrid,Levante,0,1,A,1.22,4.8,11.0,2007-02-04,2006/2007,23,SP1,0-1,-1,-9.78,2007-02-04Real MadridLevante
04/02/07,Recreativo,Villarreal,2,1,H,2.3,2.9,3.0,2007-02-04,2006/2007,24,SP1,2-1,1,-0.7000000000000002,2007-02-04RecreativoVillarreal
04/02/07,Santander,Getafe,1,0,H,2.3,3.0,2.9,2007-02-04,2006/2007,24,SP1,1-0,1,-0.6000000000000001,2007-02-04SantanderGetafe
04/02/07,Sevilla,Sociedad,0,0,D,1.3,4.4,8.5,2007-02-04,2006/2007,24,SP1,0-0,0,-7.2,2007-02-04SevillaSociedad
10/02/07,Betis,Sevilla,0,0,D,2.9,2.9,2.4,2007-02-10,2006/2007,24,SP1,0-0,0,0.5,2007-02-10BetisSevilla
10/02/07,Sociedad,Real Madrid,1,2,A,4.2,3.0,1.85,2007-02-10,2006/2007,24,SP1,1-2,-1,2.35,2007-02-10SociedadReal Madrid
11/02/07,Ath Madrid,Ath Bilbao,1,0,H,1.7,3.3,4.5,2007-02-11,2006/2007,24,SP1,1-0,1,-2.8,2007-02-11Ath MadridAth Bilbao
11/02/07,Barcelona,Santander,2,0,H,1.3,4.4,8.5,2007-02-11,2006/2007,24,SP1,2-0,2,-7.2,2007-02-11BarcelonaSantander
11/02/07,Celta,Espanol,0,2,A,2.2,2.8,3.3,2007-02-11,2006/2007,24,SP1,0-2,-2,-1.0999999999999996,2007-02-11CeltaEspanol
11/02/07,Getafe,Valencia,3,0,H,2.65,3.0,2.55,2007-02-11,2006/2007,24,SP1,3-0,3,0.10000000000000009,2007-02-11GetafeValencia
11/02/07,Gimnastic,Osasuna,2,3,A,2.7,3.1,2.4,2007-02-11,2006/2007,25,SP1,2-3,-1,0.30000000000000027,2007-02-11GimnasticOsasuna
11/02/07,Levante,Recreativo,2,1,H,2.55,3.1,2.55,2007-02-11,2006/2007,25,SP1,2-1,1,0.0,2007-02-11LevanteRecreativo
11/02/07,Mallorca,Zaragoza,2,1,H,2.7,3.1,2.4,2007-02-11,2006/2007,25,SP1,2-1,1,0.30000000000000027,2007-02-11MallorcaZaragoza
11/02/07,Villarreal,La Coruna,0,2,A,1.9,3.2,3.6,2007-02-11,2006/2007,25,SP1,0-2,-2,-1.7000000000000002,2007-02-11VillarrealLa Coruna
17/02/07,Real Madrid,Betis,0,0,D,1.55,3.5,5.5,2007-02-17,2006/2007,25,SP1,0-0,0,-3.95,2007-02-17Real MadridBetis
17/02/07,Zaragoza,Villarreal,1,0,H,1.85,3.1,4.0,2007-02-17,2006/2007,25,SP1,1-0,1,-2.15,2007-02-17ZaragozaVillarreal
18/02/07,Ath Bilbao,Getafe,2,0,H,2.2,3.0,3.1,2007-02-18,2006/2007,25,SP1,2-0,2,-0.8999999999999999,2007-02-18Ath BilbaoGetafe
18/02/07,Espanol,Mallorca,3,1,H,2.0,3.1,3.4,2007-02-18,2006/2007,25,SP1,3-1,2,-1.4,2007-02-18EspanolMallorca
18/02/07,La Coruna,Levante,0,0,D,1.7,3.2,4.7,2007-02-18,2006/2007,25,SP1,0-0,0,-3.0,2007-02-18La CorunaLevante
18/02/07,Osasuna,Celta,0,1,A,1.8,3.1,4.2,2007-02-18,2006/2007,26,SP1,0-1,-1,-2.4000000000000004,2007-02-18OsasunaCelta
18/02/07,Recreativo,Sociedad,1,0,H,1.75,3.2,4.3,2007-02-18,2006/2007,26,SP1,1-0,1,-2.55,2007-02-18RecreativoSociedad
18/02/07,Santander,Gimnastic,4,1,H,1.6,3.5,5.0,2007-02-18,2006/2007,26,SP1,4-1,3,-3.4,2007-02-18SantanderGimnastic
18/02/07,Sevilla,Ath Madrid,3,1,H,1.85,3.1,4.0,2007-02-18,2006/2007,26,SP1,3-1,2,-2.15,2007-02-18SevillaAth Madrid
18/02/07,Valencia,Barcelona,2,1,H,2.7,3.0,2.5,2007-02-18,2006/2007,26,SP1,2-1,1,0.20000000000000018,2007-02-18ValenciaBarcelona
24/02/07,Ath Madrid,Real Madrid,1,1,D,2.55,3.1,2.55,2007-02-24,2006/2007,26,SP1,1-1,0,0.0,2007-02-24Ath MadridReal Madrid
24/02/07,Sociedad,La Coruna,0,1,A,2.6,3.0,2.6,2007-02-24,2006/2007,26,SP1,0-1,-1,0.0,2007-02-24SociedadLa Coruna
25/02/07,Barcelona,Ath Bilbao,3,0,H,1.27,4.4,10.0,2007-02-25,2006/2007,26,SP1,3-0,3,-8.73,2007-02-25BarcelonaAth Bilbao
25/02/07,Betis,Recreativo,0,0,D,2.0,3.1,3.4,2007-02-25,2006/2007,26,SP1,0-0,0,-1.4,2007-02-25BetisRecreativo
25/02/07,Celta,Santander,2,2,D,2.2,2.9,3.2,2007-02-25,2006/2007,27,SP1,2-2,0,-1.0,2007-02-25CeltaSantander
25/02/07,Getafe,Sevilla,0,0,D,2.6,3.0,2.6,2007-02-25,2006/2007,27,SP1,0-0,0,0.0,2007-02-25GetafeSevilla
25/02/07,Gimnastic,Valencia,1,1,D,5.2,3.4,1.6,2007-02-25,2006/2007,27,SP1,1-1,0,3.6,2007-02-25GimnasticValencia
25/02/07,Levante,Zaragoza,0,0,D,2.6,3.1,2.5,2007-02-25,2006/2007,27,SP1,0-0,0,0.10000000000000009,2007-02-25LevanteZaragoza
25/02/07,Osasuna,Espanol,0,2,A,2.1,3.1,3.2,2007-02-25,2006/2007,27,SP1,0-2,-2,-1.1,2007-02-25OsasunaEspanol
25/02/07,Villarreal,Mallorca,2,1,H,2.0,3.1,3.4,2007-02-25,2006/2007,27,SP1,2-1,1,-1.4,2007-02-25VillarrealMallorca
03/03/07,Sevilla,Barcelona,2,1,H,2.5,3.0,2.7,2007-03-03,2006/2007,27,SP1,2-1,1,-0.20000000000000018,2007-03-03SevillaBarcelona
03/03/07,Valencia,Celta,1,0,H,1.4,3.7,7.5,2007-03-03,2006/2007,27,SP1,1-0,1,-6.1,2007-03-03ValenciaCelta
04/03/07,Ath Bilbao,Gimnastic,0,2,A,1.6,3.4,5.2,2007-03-04,2006/2007,27,SP1,0-2,-2,-3.6,2007-03-04Ath BilbaoGimnastic
04/03/07,Espanol,Villarreal,1,1,D,2.0,3.0,3.6,2007-03-04,2006/2007,28,SP1,1-1,0,-1.6,2007-03-04EspanolVillarreal
04/03/07,La Coruna,Betis,0,1,A,2.0,3.0,3.6,2007-03-04,2006/2007,28,SP1,0-1,-1,-1.6,2007-03-04La CorunaBetis
04/03/07,Mallorca,Levante,3,1,H,2.1,3.0,3.3,2007-03-04,2006/2007,28,SP1,3-1,2,-1.1999999999999997,2007-03-04MallorcaLevante
04/03/07,Real Madrid,Getafe,1,1,D,1.55,3.4,5.8,2007-03-04,2006/2007,28,SP1,1-1,0,-4.25,2007-03-04Real MadridGetafe
04/03/07,Recreativo,Ath Madrid,1,0,H,2.55,3.1,2.55,2007-03-04,2006/2007,28,SP1,1-0,1,0.0,2007-03-04RecreativoAth Madrid
04/03/07,Santander,Osasuna,1,0,H,2.3,3.1,2.8,2007-03-04,2006/2007,28,SP1,1-0,1,-0.5,2007-03-04SantanderOsasuna
04/03/07,Zaragoza,Sociedad,3,2,H,1.45,3.6,7.0,2007-03-04,2006/2007,28,SP1,3-2,1,-5.55,2007-03-04ZaragozaSociedad
10/03/07,Barcelona,Real Madrid,3,3,D,1.75,3.2,4.3,2007-03-10,2006/2007,28,SP1,3-3,0,-2.55,2007-03-10BarcelonaReal Madrid
10/03/07,Levante,Villarreal,0,2,A,2.3,3.0,2.9,2007-03-10,2006/2007,28,SP1,0-2,-2,-0.6000000000000001,2007-03-10LevanteVillarreal
11/03/07,Ath Madrid,La Coruna,2,0,H,1.8,3.1,4.2,2007-03-11,2006/2007,29,SP1,2-0,2,-2.4000000000000004,2007-03-11Ath MadridLa Coruna
11/03/07,Betis,Zaragoza,1,1,D,2.4,3.1,2.7,2007-03-11,2006/2007,29,SP1,1-1,0,-0.30000000000000027,2007-03-11BetisZaragoza
11/03/07,Celta,Ath Bilbao,1,1,D,2.1,3.1,3.2,2007-03-11,2006/2007,29,SP1,1-1,0,-1.1,2007-03-11CeltaAth Bilbao
11/03/07,Getafe,Recreativo,1,1,D,2.0,3.0,3.6,2007-03-11,2006/2007,29,SP1,1-1,0,-1.6,2007-03-11GetafeRecreativo
11/03/07,Gimnastic,Sevilla,1,0,H,5.2,3.4,1.6,2007-03-11,2006/2007,29,SP1,1-0,1,3.6,2007-03-11GimnasticSevilla
11/03/07,Osasuna,Valencia,1,1,D,3.1,3.0,2.2,2007-03-11,2006/2007,29,SP1,1-1,0,0.8999999999999999,2007-03-11OsasunaValencia
11/03/07,Santander,Espanol,1,1,D,2.1,3.0,3.3,2007-03-11,2006/2007,29,SP1,1-1,0,-1.1999999999999997,2007-03-11SantanderEspanol
11/03/07,Sociedad,Mallorca,3,1,H,2.4,3.1,2.7,2007-03-11,2006/2007,29,SP1,3-1,2,-0.30000000000000027,2007-03-11SociedadMallorca
17/03/07,Ath Bilbao,Osasuna,0,3,A,2.2,2.9,3.2,2007-03-17,2006/2007,29,SP1,0-3,-3,-1.0,2007-03-17Ath BilbaoOsasuna
17/03/07,Mallorca,Betis,2,0,H,2.3,2.9,3.0,2007-03-17,2006/2007,30,SP1,2-0,2,-0.7000000000000002,2007-03-17MallorcaBetis
17/03/07,Recreativo,Barcelona,0,4,A,4.5,3.3,1.7,2007-03-17,2006/2007,30,SP1,0-4,-4,2.8,2007-03-17RecreativoBarcelona
17/03/07,Valencia,Santander,0,2,A,1.45,3.6,7.0,2007-03-17,2006/2007,30,SP1,0-2,-2,-5.55,2007-03-17ValenciaSantander
18/03/07,Espanol,Levante,1,1,D,1.8,3.2,4.0,2007-03-18,2006/2007,30,SP1,1-1,0,-2.2,2007-03-18EspanolLevante
18/03/07,La Coruna,Getafe,1,0,H,2.2,2.9,3.2,2007-03-18,2006/2007,30,SP1,1-0,1,-1.0,2007-03-18La CorunaGetafe
18/03/07,Real Madrid,Gimnastic,2,0,H,1.27,4.4,10.0,2007-03-18,2006/2007,30,SP1,2-0,2,-8.73,2007-03-18Real MadridGimnastic
18/03/07,Sevilla,Celta,2,0,H,1.45,3.6,7.0,2007-03-18,2006/2007,30,SP1,2-0,2,-5.55,2007-03-18SevillaCelta
18/03/07,Villarreal,Sociedad,1,1,D,1.7,3.3,4.5,2007-03-18,2006/2007,30,SP1,1-1,0,-2.8,2007-03-18VillarrealSociedad
18/03/07,Zaragoza,Ath Madrid,1,0,H,2.2,3.0,3.1,2007-03-18,2006/2007,30,SP1,1-0,1,-0.8999999999999999,2007-03-18ZaragozaAth Madrid
31/03/07,Barcelona,La Coruna,2,1,H,1.35,4.0,8.0,2007-03-31,2006/2007,31,SP1,2-1,1,-6.65,2007-03-31BarcelonaLa Coruna
31/03/07,Betis,Villarreal,3,3,D,2.2,2.8,3.3,2007-03-31,2006/2007,31,SP1,3-3,0,-1.0999999999999996,2007-03-31BetisVillarreal
31/03/07,Sociedad,Levante,1,0,H,2.2,3.0,3.1,2007-03-31,2006/2007,31,SP1,1-0,1,-0.8999999999999999,2007-03-31SociedadLevante
31/03/07,Valencia,Espanol,3,2,H,1.65,3.3,4.9,2007-03-31,2006/2007,31,SP1,3-2,1,-3.2500000000000004,2007-03-31ValenciaEspanol
01/04/07,Ath Madrid,Mallorca,1,1,D,1.55,3.4,5.8,2007-04-01,2006/2007,31,SP1,1-1,0,-4.25,2007-04-01Ath MadridMallorca
01/04/07,Celta,Real Madrid,1,2,A,3.8,3.1,1.9,2007-04-01,2006/2007,31,SP1,1-2,-1,1.9,2007-04-01CeltaReal Madrid
01/04/07,Getafe,Zaragoza,2,2,D,2.3,3.0,2.9,2007-04-01,2006/2007,31,SP1,2-2,0,-0.6000000000000001,2007-04-01GetafeZaragoza
01/04/07,Gimnastic,Recreativo,1,1,D,2.6,3.0,2.6,2007-04-01,2006/2007,31,SP1,1-1,0,0.0,2007-04-01GimnasticRecreativo
01/04/07,Osasuna,Sevilla,0,0,D,3.1,3.0,2.2,2007-04-01,2006/2007,31,SP1,0-0,0,0.8999999999999999,2007-04-01OsasunaSevilla
01/04/07,Santander,Ath Bilbao,5,4,H,2.1,3.1,3.2,2007-04-01,2006/2007,32,SP1,5-4,1,-1.1,2007-04-01SantanderAth Bilbao
07/04/07,Ath Bilbao,Valencia,1,0,H,3.2,3.1,2.1,2007-04-07,2006/2007,32,SP1,1-0,1,1.1,2007-04-07Ath BilbaoValencia
07/04/07,Zaragoza,Barcelona,1,0,H,3.6,3.2,1.9,2007-04-07,2006/2007,32,SP1,1-0,1,1.7000000000000002,2007-04-07ZaragozaBarcelona
08/04/07,Espanol,Sociedad,1,0,H,1.8,3.1,4.2,2007-04-08,2006/2007,32,SP1,1-0,1,-2.4000000000000004,2007-04-08EspanolSociedad
08/04/07,La Coruna,Gimnastic,1,0,H,1.65,3.4,4.7,2007-04-08,2006/2007,32,SP1,1-0,1,-3.0500000000000003,2007-04-08La CorunaGimnastic
08/04/07,Levante,Betis,1,1,D,2.3,3.0,2.9,2007-04-08,2006/2007,32,SP1,1-1,0,-0.6000000000000001,2007-04-08LevanteBetis
08/04/07,Mallorca,Getafe,2,0,H,2.2,2.9,3.2,2007-04-08,2006/2007,32,SP1,2-0,2,-1.0,2007-04-08MallorcaGetafe
08/04/07,Real Madrid,Osasuna,2,0,H,1.4,3.7,7.5,2007-04-08,2006/2007,32,SP1,2-0,2,-6.1,2007-04-08Real MadridOsasuna
08/04/07,Recreativo,Celta,4,2,H,1.9,3.1,3.8,2007-04-08,2006/2007,32,SP1,4-2,2,-1.9,2007-04-08RecreativoCelta
08/04/07,Sevilla,Santander,0,0,D,1.55,3.5,5.5,2007-04-08,2006/2007,33,SP1,0-0,0,-3.95,2007-04-08SevillaSantander
08/04/07,Villarreal,Ath Madrid,0,1,A,2.4,3.0,2.8,2007-04-08,2006/2007,33,SP1,0-1,-1,-0.3999999999999999,2007-04-08VillarrealAth Madrid
14/04/07,Betis,Sociedad,0,1,A,1.85,3.2,3.8,2007-04-14,2006/2007,33,SP1,0-1,-1,-1.9499999999999997,2007-04-14BetisSociedad
14/04/07,Santander,Real Madrid,2,1,H,3.3,3.2,2.0,2007-04-14,2006/2007,33,SP1,2-1,1,1.2999999999999998,2007-04-14SantanderReal Madrid
15/04/07,Ath Bilbao,Espanol,2,1,H,2.2,3.0,3.1,2007-04-15,2006/2007,33,SP1,2-1,1,-0.8999999999999999,2007-04-15Ath BilbaoEspanol
15/04/07,Ath Madrid,Levante,1,0,H,1.55,3.5,5.5,2007-04-15,2006/2007,33,SP1,1-0,1,-3.95,2007-04-15Ath MadridLevante
15/04/07,Barcelona,Mallorca,1,0,H,1.25,4.8,9.5,2007-04-15,2006/2007,33,SP1,1-0,1,-8.25,2007-04-15BarcelonaMallorca
15/04/07,Celta,La Coruna,1,0,H,2.2,3.0,3.1,2007-04-15,2006/2007,33,SP1,1-0,1,-0.8999999999999999,2007-04-15CeltaLa Coruna
15/04/07,Getafe,Villarreal,3,0,H,2.2,3.0,3.1,2007-04-15,2006/2007,33,SP1,3-0,3,-0.8999999999999999,2007-04-15GetafeVillarreal
15/04/07,Gimnastic,Zaragoza,1,0,H,3.6,3.2,1.9,2007-04-15,2006/2007,34,SP1,1-0,1,1.7000000000000002,2007-04-15GimnasticZaragoza
15/04/07,Osasuna,Recreativo,1,1,D,2.2,3.1,3.0,2007-04-15,2006/2007,34,SP1,1-1,0,-0.7999999999999998,2007-04-15OsasunaRecreativo
15/04/07,Valencia,Sevilla,2,0,H,2.2,3.1,3.0,2007-04-15,2006/2007,34,SP1,2-0,2,-0.7999999999999998,2007-04-15ValenciaSevilla
21/04/07,Real Madrid,Valencia,2,1,H,1.9,3.1,3.8,2007-04-21,2006/2007,34,SP1,2-1,1,-1.9,2007-04-21Real MadridValencia
21/04/07,Sociedad,Ath Madrid,2,0,H,2.6,3.1,2.5,2007-04-21,2006/2007,34,SP1,2-0,2,0.10000000000000009,2007-04-21SociedadAth Madrid
22/04/07,Espanol,Betis,2,2,D,2.1,3.0,3.3,2007-04-22,2006/2007,34,SP1,2-2,0,-1.1999999999999997,2007-04-22EspanolBetis
22/04/07,La Coruna,Osasuna,1,0,H,2.1,3.1,3.2,2007-04-22,2006/2007,34,SP1,1-0,1,-1.1,2007-04-22La CorunaOsasuna
22/04/07,Levante,Getafe,1,1,D,2.1,3.1,3.2,2007-04-22,2006/2007,34,SP1,1-1,0,-1.1,2007-04-22LevanteGetafe
22/04/07,Mallorca,Gimnastic,1,0,H,1.7,3.3,4.5,2007-04-22,2006/2007,34,SP1,1-0,1,-2.8,2007-04-22MallorcaGimnastic
22/04/07,Recreativo,Santander,4,2,H,2.3,2.9,3.0,2007-04-22,2006/2007,35,SP1,4-2,2,-0.7000000000000002,2007-04-22RecreativoSantander
22/04/07,Sevilla,Ath Bilbao,4,1,H,1.5,3.5,6.3,2007-04-22,2006/2007,35,SP1,4-1,3,-4.8,2007-04-22SevillaAth Bilbao
22/04/07,Villarreal,Barcelona,2,0,H,3.8,3.1,1.9,2007-04-22,2006/2007,35,SP1,2-0,2,1.9,2007-04-22VillarrealBarcelona
22/04/07,Zaragoza,Celta,2,0,H,1.6,3.5,5.0,2007-04-22,2006/2007,35,SP1,2-0,2,-3.4,2007-04-22ZaragozaCelta
28/04/07,Ath Madrid,Betis,0,0,D,1.7,3.3,4.5,2007-04-28,2006/2007,35,SP1,0-0,0,-2.8,2007-04-28Ath MadridBetis
28/04/07,Valencia,Recreativo,2,0,H,1.55,3.4,5.8,2007-04-28,2006/2007,35,SP1,2-0,2,-4.25,2007-04-28ValenciaRecreativo
29/04/07,Ath Bilbao,Real Madrid,1,4,A,4.0,3.1,1.85,2007-04-29,2006/2007,35,SP1,1-4,-3,2.15,2007-04-29Ath BilbaoReal Madrid
29/04/07,Barcelona,Levante,1,0,H,1.2,5.0,12.0,2007-04-29,2006/2007,35,SP1,1-0,1,-10.8,2007-04-29BarcelonaLevante
29/04/07,Celta,Mallorca,0,3,A,2.0,3.0,3.6,2007-04-29,2006/2007,35,SP1,0-3,-3,-1.6,2007-04-29CeltaMallorca
29/04/07,Getafe,Sociedad,1,0,H,1.9,3.2,3.6,2007-04-29,2006/2007,36,SP1,1-0,1,-1.7000000000000002,2007-04-29GetafeSociedad
29/04/07,Gimnastic,Villarreal,0,3,A,2.7,3.0,2.5,2007-04-29,2006/2007,36,SP1,0-3,-3,0.20000000000000018,2007-04-29GimnasticVillarreal
29/04/07,Osasuna,Zaragoza,2,2,D,2.6,3.0,2.6,2007-04-29,2006/2007,36,SP1,2-2,0,0.0,2007-04-29OsasunaZaragoza
29/04/07,Santander,La Coruna,0,0,D,1.9,3.0,4.0,2007-04-29,2006/2007,36,SP1,0-0,0,-2.1,2007-04-29SantanderLa Coruna
29/04/07,Sevilla,Espanol,3,1,H,1.5,3.5,6.3,2007-04-29,2006/2007,36,SP1,3-1,2,-4.8,2007-04-29SevillaEspanol
05/05/07,La Coruna,Valencia,1,2,A,2.8,3.1,2.3,2007-05-05,2006/2007,36,SP1,1-2,-1,0.5,2007-05-05La CorunaValencia
05/05/07,Sociedad,Barcelona,0,2,A,5.2,3.4,1.6,2007-05-05,2006/2007,36,SP1,0-2,-2,3.6,2007-05-05SociedadBarcelona
06/05/07,Betis,Getafe,0,2,A,2.0,3.0,3.6,2007-05-06,2006/2007,36,SP1,0-2,-2,-1.6,2007-05-06BetisGetafe
06/05/07,Espanol,Ath Madrid,2,1,H,2.5,3.1,2.6,2007-05-06,2006/2007,36,SP1,2-1,1,-0.10000000000000009,2007-05-06EspanolAth Madrid
06/05/07,Levante,Gimnastic,2,0,H,1.8,3.2,4.0,2007-05-06,2006/2007,37,SP1,2-0,2,-2.2,2007-05-06LevanteGimnastic
06/05/07,Mallorca,Osasuna,3,1,H,2.1,3.0,3.3,2007-05-06,2006/2007,37,SP1,3-1,2,-1.1999999999999997,2007-05-06MallorcaOsasuna
06/05/07,Real Madrid,Sevilla,3,2,H,1.85,3.1,4.0,2007-05-06,2006/2007,37,SP1,3-2,1,-2.15,2007-05-06Real MadridSevilla
06/05/07,Recreativo,Ath Bilbao,0,0,D,1.9,3.1,3.8,2007-05-06,2006/2007,37,SP1,0-0,0,-1.9,2007-05-06RecreativoAth Bilbao
06/05/07,Villarreal,Celta,1,0,H,1.9,3.1,3.5,2007-05-06,2006/2007,37,SP1,1-0,1,-1.6,2007-05-06VillarrealCelta
06/05/07,Zaragoza,Santander,0,0,D,1.7,3.2,4.7,2007-05-06,2006/2007,37,SP1,0-0,0,-3.0,2007-05-06ZaragozaSantander
12/05/07,Real Madrid,Espanol,4,3,H,1.25,4.6,10.5,2007-05-12,2006/2007,37,SP1,4-3,1,-9.25,2007-05-12Real MadridEspanol
12/05/07,Sevilla,Recreativo,2,1,H,1.5,3.5,6.3,2007-05-12,2006/2007,37,SP1,2-1,1,-4.8,2007-05-12SevillaRecreativo
13/05/07,Ath Bilbao,La Coruna,1,1,D,1.75,3.2,4.3,2007-05-13,2006/2007,37,SP1,1-1,0,-2.55,2007-05-13Ath BilbaoLa Coruna
13/05/07,Barcelona,Betis,1,1,D,1.22,4.8,11.0,2007-05-13,2006/2007,38,SP1,1-1,0,-9.78,2007-05-13BarcelonaBetis
13/05/07,Celta,Levante,1,2,A,1.9,3.1,3.8,2007-05-13,2006/2007,38,SP1,1-2,-1,-1.9,2007-05-13CeltaLevante
13/05/07,Getafe,Ath Madrid,1,4,A,2.4,3.0,2.8,2007-05-13,2006/2007,38,SP1,1-4,-3,-0.3999999999999999,2007-05-13GetafeAth Madrid
13/05/07,Gimnastic,Sociedad,1,3,A,2.4,3.2,2.6,2007-05-13,2006/2007,38,SP1,1-3,-2,-0.20000000000000018,2007-05-13GimnasticSociedad
13/05/07,Osasuna,Villarreal,1,4,A,2.2,3.0,3.1,2007-05-13,2006/2007,38,SP1,1-4,-3,-0.8999999999999999,2007-05-13OsasunaVillarreal
13/05/07,Santander,Mallorca,0,2,A,1.85,3.1,4.0,2007-05-13,2006/2007,38,SP1,0-2,-2,-2.15,2007-05-13SantanderMallorca
13/05/07,Valencia,Zaragoza,2,0,H,1.65,3.3,4.9,2007-05-13,2006/2007,38,SP1,2-0,2,-3.2500000000000004,2007-05-13ValenciaZaragoza
19/05/07,Betis,Gimnastic,1,1,D,1.45,3.7,6.5,2007-05-19,2006/2007,38,SP1,1-1,0,-5.05,2007-05-19BetisGimnastic
19/05/07,Mallorca,Valencia,0,1,A,3.0,3.1,2.2,2007-05-19,2006/2007,38,SP1,0-1,-1,0.7999999999999998,2007-05-19MallorcaValencia
19/05/07,Zaragoza,Ath Bilbao,4,3,H,1.75,3.2,4.3,2007-05-19,2006/2007,39,SP1,4-3,1,-2.55,2007-05-19ZaragozaAth Bilbao
20/05/07,Ath Madrid,Barcelona,0,6,A,3.0,3.1,2.2,2007-05-20,2006/2007,39,SP1,0-6,-6,0.7999999999999998,2007-05-20Ath MadridBarcelona
20/05/07,Espanol,Getafe,1,5,A,2.2,2.9,3.2,2007-05-20,2006/2007,39,SP1,1-5,-4,-1.0,2007-05-20EspanolGetafe
20/05/07,La Coruna,Sevilla,1,2,A,3.2,3.1,2.1,2007-05-20,2006/2007,39,SP1,1-2,-1,1.1,2007-05-20La CorunaSevilla
20/05/07,Levante,Osasuna,1,4,A,2.2,2.8,3.3,2007-05-20,2006/2007,39,SP1,1-4,-3,-1.0999999999999996,2007-05-20LevanteOsasuna
20/05/07,Recreativo,Real Madrid,2,3,A,4.9,3.3,1.65,2007-05-20,2006/2007,39,SP1,2-3,-1,3.2500000000000004,2007-05-20RecreativoReal Madrid
20/05/07,Sociedad,Celta,3,1,H,1.85,3.1,4.0,2007-05-20,2006/2007,39,SP1,3-1,2,-2.15,2007-05-20SociedadCelta
20/05/07,Villarreal,Santander,2,1,H,1.8,3.1,4.2,2007-05-20,2006/2007,39,SP1,2-1,1,-2.4000000000000004,2007-05-20VillarrealSantander
26/05/07,Barcelona,Getafe,1,0,H,1.25,4.6,10.5,2007-05-26,2006/2007,39,SP1,1-0,1,-9.25,2007-05-26BarcelonaGetafe
26/05/07,Real Madrid,La Coruna,3,1,H,1.2,5.0,12.0,2007-05-26,2006/2007,40,SP1,3-1,2,-10.8,2007-05-26Real MadridLa Coruna
26/05/07,Valencia,Villarreal,2,3,A,1.6,3.4,5.2,2007-05-26,2006/2007,40,SP1,2-3,-1,-3.6,2007-05-26ValenciaVillarreal
27/05/07,Ath Bilbao,Mallorca,1,0,H,1.6,3.4,5.2,2007-05-27,2006/2007,40,SP1,1-0,1,-3.6,2007-05-27Ath BilbaoMallorca
27/05/07,Celta,Betis,2,1,H,2.3,3.1,2.8,2007-05-27,2006/2007,40,SP1,2-1,1,-0.5,2007-05-27CeltaBetis
27/05/07,Gimnastic,Ath Madrid,0,2,A,4.0,3.2,1.8,2007-05-27,2006/2007,40,SP1,0-2,-2,2.2,2007-05-27GimnasticAth Madrid
27/05/07,Osasuna,Sociedad,2,0,H,2.9,3.2,2.1,2007-05-27,2006/2007,40,SP1,2-0,2,0.7999999999999998,2007-05-27OsasunaSociedad
27/05/07,Recreativo,Espanol,0,1,A,1.8,3.2,4.0,2007-05-27,2006/2007,40,SP1,0-1,-1,-2.2,2007-05-27RecreativoEspanol
27/05/07,Santander,Levante,2,3,A,2.0,3.2,3.3,2007-05-27,2006/2007,40,SP1,2-3,-1,-1.2999999999999998,2007-05-27SantanderLevante
27/05/07,Sevilla,Zaragoza,3,1,H,1.6,3.4,5.2,2007-05-27,2006/2007,40,SP1,3-1,2,-3.6,2007-05-27SevillaZaragoza
09/06/07,Ath Madrid,Celta,2,3,A,1.5,3.8,5.5,2007-06-09,2006/2007,41,SP1,2-3,-1,-4.0,2007-06-09Ath MadridCelta
09/06/07,Barcelona,Espanol,2,2,D,1.25,4.6,10.5,2007-06-09,2006/2007,41,SP1,2-2,0,-9.25,2007-06-09BarcelonaEspanol
09/06/07,Betis,Osasuna,0,5,A,1.65,3.5,4.5,2007-06-09,2006/2007,41,SP1,0-5,-5,-2.85,2007-06-09BetisOsasuna
09/06/07,Levante,Valencia,4,2,H,3.4,2.9,2.1,2007-06-09,2006/2007,41,SP1,4-2,2,1.2999999999999998,2007-06-09LevanteValencia
09/06/07,Mallorca,Sevilla,0,0,D,5.2,3.4,1.6,2007-06-09,2006/2007,41,SP1,0-0,0,3.6,2007-06-09MallorcaSevilla
09/06/07,Sociedad,Santander,0,0,D,1.5,3.8,5.5,2007-06-09,2006/2007,41,SP1,0-0,0,-4.0,2007-06-09SociedadSantander
09/06/07,Villarreal,Ath Bilbao,3,1,H,1.55,3.5,5.5,2007-06-09,2006/2007,41,SP1,3-1,2,-3.95,2007-06-09VillarrealAth Bilbao
09/06/07,Zaragoza,Real Madrid,2,2,D,4.5,3.3,1.7,2007-06-09,2006/2007,41,SP1,2-2,0,2.8,2007-06-09ZaragozaReal Madrid
10/06/07,Getafe,Gimnastic,0,1,A,1.45,3.7,6.5,2007-06-10,2006/2007,41,SP1,0-1,-1,-5.05,2007-06-10GetafeGimnastic
10/06/07,La Coruna,Recreativo,2,5,A,1.9,3.1,3.8,2007-06-10,2006/2007,42,SP1,2-5,-3,-1.9,2007-06-10La CorunaRecreativo
17/06/07,Ath Bilbao,Levante,2,0,H,1.25,4.8,8.0,2007-06-17,2006/2007,42,SP1,2-0,2,-6.75,2007-06-17Ath BilbaoLevante
17/06/07,Celta,Getafe,2,1,H,1.35,4.2,6.5,2007-06-17,2006/2007,42,SP1,2-1,1,-5.15,2007-06-17CeltaGetafe
17/06/07,Espanol,La Coruna,1,3,A,1.9,3.2,3.6,2007-06-17,2006/2007,42,SP1,1-3,-2,-1.7000000000000002,2007-06-17EspanolLa Coruna
17/06/07,Gimnastic,Barcelona,1,5,A,10.5,4.6,1.25,2007-06-17,2006/2007,42,SP1,1-5,-4,9.25,2007-06-17GimnasticBarcelona
17/06/07,Osasuna,Ath Madrid,1,2,A,2.9,3.4,2.1,2007-06-17,2006/2007,42,SP1,1-2,-1,0.7999999999999998,2007-06-17OsasunaAth Madrid
17/06/07,Real Madrid,Mallorca,3,1,H,1.12,6.0,16.0,2007-06-17,2006/2007,42,SP1,3-1,2,-14.879999999999999,2007-06-17Real MadridMallorca
17/06/07,Recreativo,Zaragoza,1,1,D,3.4,2.5,2.3,2007-06-17,2006/2007,42,SP1,1-1,0,1.1,2007-06-17RecreativoZaragoza
17/06/07,Santander,Betis,0,2,A,3.2,3.3,2.0,2007-06-17,2006/2007,42,SP1,0-2,-2,1.2000000000000002,2007-06-17SantanderBetis
