Date,HomeTeam,AwayTeam,FTHG,FTAG,FTR,IWH,IWD,IWA,datetime,season,game_day,league,result,goal_diff,odds_diff,game_id
30/08/08,Espanol,Valladolid,1,0,H,1.75,3.2,4.3,2008-08-30,2008/2009,1,SP1,1-0,1,-2.55,2008-08-30EspanolValladolid
30/08/08,Valencia,Mallorca,3,0,H,1.7,3.3,4.5,2008-08-30,2008/2009,1,SP1,3-0,3,-2.8,2008-08-30ValenciaMallorca
31/08/08,Ath Bilbao,Almeria,1,3,A,2.0,3.0,3.6,2008-08-31,2008/2009,1,SP1,1-3,-2,-1.6,2008-08-31Ath BilbaoAlmeria
31/08/08,Ath Madrid,Malaga,4,0,H,1.45,3.6,7.0,2008-08-31,2008/2009,1,SP1,4-0,4,-5.55,2008-08-31Ath MadridMalaga
31/08/08,Betis,Recreativo,0,1,A,1.9,3.1,3.8,2008-08-31,2008/2009,1,SP1,0-1,-1,-1.9,2008-08-31BetisRecreativo
31/08/08,La Coruna,Real Madrid,2,1,H,3.2,3.1,2.1,2008-08-31,2008/2009,1,SP1,2-1,1,1.1,2008-08-31La CorunaReal Madrid
31/08/08,Numancia,Barcelona,1,0,H,6.0,3.6,1.5,2008-08-31,2008/2009,1,SP1,1-0,1,4.5,2008-08-31NumanciaBarcelona
31/08/08,Osasuna,Villarreal,1,1,D,2.8,3.1,2.3,2008-08-31,2008/2009,1,SP1,1-1,0,0.5,2008-08-31OsasunaVillarreal
31/08/08,Santander,Sevilla,1,1,D,2.55,3.1,2.55,2008-08-31,2008/2009,1,SP1,1-1,0,0.0,2008-08-31SantanderSevilla
31/08/08,Sp Gijon,Getafe,1,2,A,2.4,3.0,2.8,2008-08-31,2008/2009,2,SP1,1-2,-1,-0.3999999999999999,2008-08-31Sp GijonGetafe
13/09/08,Barcelona,Santander,1,1,D,1.27,4.6,9.0,2008-09-13,2008/2009,2,SP1,1-1,0,-7.73,2008-09-13BarcelonaSantander
13/09/08,Valladolid,Ath Madrid,2,1,H,2.8,3.1,2.3,2008-09-13,2008/2009,2,SP1,2-1,1,0.5,2008-09-13ValladolidAth Madrid
14/09/08,Almeria,Valencia,2,2,D,2.55,3.1,2.55,2008-09-14,2008/2009,2,SP1,2-2,0,0.0,2008-09-14AlmeriaValencia
14/09/08,Getafe,Betis,0,0,D,2.0,3.1,3.4,2008-09-14,2008/2009,2,SP1,0-0,0,-1.4,2008-09-14GetafeBetis
14/09/08,Malaga,Ath Bilbao,0,0,D,2.4,3.1,2.7,2008-09-14,2008/2009,2,SP1,0-0,0,-0.30000000000000027,2008-09-14MalagaAth Bilbao
14/09/08,Mallorca,Osasuna,1,1,D,1.9,3.2,3.7,2008-09-14,2008/2009,2,SP1,1-1,0,-1.8000000000000003,2008-09-14MallorcaOsasuna
14/09/08,Real Madrid,Numancia,4,3,H,1.2,5.0,12.0,2008-09-14,2008/2009,2,SP1,4-3,1,-10.8,2008-09-14Real MadridNumancia
14/09/08,Recreativo,Espanol,0,1,A,2.2,3.1,3.0,2008-09-14,2008/2009,2,SP1,0-1,-1,-0.7999999999999998,2008-09-14RecreativoEspanol
14/09/08,Sevilla,Sp Gijon,4,3,H,1.35,4.2,7.5,2008-09-14,2008/2009,3,SP1,4-3,1,-6.15,2008-09-14SevillaSp Gijon
14/09/08,Villarreal,La Coruna,1,0,H,1.9,3.2,3.7,2008-09-14,2008/2009,3,SP1,1-0,1,-1.8000000000000003,2008-09-14VillarrealLa Coruna
20/09/08,Ath Madrid,Recreativo,4,0,H,1.5,3.6,6.0,2008-09-20,2008/2009,3,SP1,4-0,4,-4.5,2008-09-20Ath MadridRecreativo
20/09/08,Espanol,Getafe,1,1,D,2.1,3.1,3.2,2008-09-20,2008/2009,3,SP1,1-1,0,-1.1,2008-09-20EspanolGetafe
21/09/08,Almeria,Malaga,1,0,H,1.75,3.2,4.3,2008-09-21,2008/2009,3,SP1,1-0,1,-2.55,2008-09-21AlmeriaMalaga
21/09/08,Ath Bilbao,Valladolid,2,0,H,2.0,3.1,3.4,2008-09-21,2008/2009,3,SP1,2-0,2,-1.4,2008-09-21Ath BilbaoValladolid
21/09/08,Betis,Sevilla,0,0,D,3.1,3.0,2.2,2008-09-21,2008/2009,3,SP1,0-0,0,0.8999999999999999,2008-09-21BetisSevilla
21/09/08,La Coruna,Mallorca,0,0,D,1.8,3.1,4.2,2008-09-21,2008/2009,3,SP1,0-0,0,-2.4000000000000004,2008-09-21La CorunaMallorca
21/09/08,Numancia,Villarreal,1,2,A,2.8,3.1,2.3,2008-09-21,2008/2009,3,SP1,1-2,-1,0.5,2008-09-21NumanciaVillarreal
21/09/08,Santander,Real Madrid,0,2,A,3.3,3.2,2.0,2008-09-21,2008/2009,4,SP1,0-2,-2,1.2999999999999998,2008-09-21SantanderReal Madrid
21/09/08,Sp Gijon,Barcelona,1,6,A,6.5,3.7,1.45,2008-09-21,2008/2009,4,SP1,1-6,-5,5.05,2008-09-21Sp GijonBarcelona
21/09/08,Valencia,Osasuna,1,0,H,1.6,3.5,5.0,2008-09-21,2008/2009,4,SP1,1-0,1,-3.4,2008-09-21ValenciaOsasuna
24/09/08,Barcelona,Betis,3,2,H,1.27,4.4,10.0,2008-09-24,2008/2009,4,SP1,3-2,1,-8.73,2008-09-24BarcelonaBetis
24/09/08,Getafe,Ath Madrid,1,2,A,2.9,3.0,2.3,2008-09-24,2008/2009,4,SP1,1-2,-1,0.6000000000000001,2008-09-24GetafeAth Madrid
24/09/08,Osasuna,La Coruna,0,0,D,2.3,3.0,2.9,2008-09-24,2008/2009,4,SP1,0-0,0,-0.6000000000000001,2008-09-24OsasunaLa Coruna
24/09/08,Real Madrid,Sp Gijon,7,1,H,1.15,5.7,14.0,2008-09-24,2008/2009,4,SP1,7-1,6,-12.85,2008-09-24Real MadridSp Gijon
24/09/08,Sevilla,Espanol,2,0,H,1.55,3.4,5.8,2008-09-24,2008/2009,4,SP1,2-0,2,-4.25,2008-09-24SevillaEspanol
24/09/08,Villarreal,Santander,2,0,H,1.55,3.4,5.8,2008-09-24,2008/2009,4,SP1,2-0,2,-4.25,2008-09-24VillarrealSantander
25/09/08,Malaga,Valencia,0,2,A,3.3,3.0,2.1,2008-09-25,2008/2009,5,SP1,0-2,-2,1.1999999999999997,2008-09-25MalagaValencia
25/09/08,Mallorca,Numancia,2,0,H,1.8,3.2,4.0,2008-09-25,2008/2009,5,SP1,2-0,2,-2.2,2008-09-25MallorcaNumancia
25/09/08,Recreativo,Ath Bilbao,1,1,D,2.3,3.0,2.9,2008-09-25,2008/2009,5,SP1,1-1,0,-0.6000000000000001,2008-09-25RecreativoAth Bilbao
25/09/08,Valladolid,Almeria,2,0,H,2.1,3.0,3.3,2008-09-25,2008/2009,5,SP1,2-0,2,-1.1999999999999997,2008-09-25ValladolidAlmeria
27/09/08,Betis,Real Madrid,1,2,A,3.8,3.1,1.9,2008-09-27,2008/2009,5,SP1,1-2,-1,1.9,2008-09-27BetisReal Madrid
27/09/08,Espanol,Barcelona,1,2,A,3.8,3.2,1.85,2008-09-27,2008/2009,5,SP1,1-2,-1,1.9499999999999997,2008-09-27EspanolBarcelona
27/09/08,Sp Gijon,Villarreal,0,1,A,4.5,3.3,1.7,2008-09-27,2008/2009,5,SP1,0-1,-1,2.8,2008-09-27Sp GijonVillarreal
28/09/08,Almeria,Recreativo,1,0,H,1.8,3.1,4.2,2008-09-28,2008/2009,5,SP1,1-0,1,-2.4000000000000004,2008-09-28AlmeriaRecreativo
28/09/08,Ath Bilbao,Getafe,0,1,A,2.1,3.0,3.3,2008-09-28,2008/2009,5,SP1,0-1,-1,-1.1999999999999997,2008-09-28Ath BilbaoGetafe
28/09/08,Ath Madrid,Sevilla,0,1,A,2.0,3.1,3.4,2008-09-28,2008/2009,6,SP1,0-1,-1,-1.4,2008-09-28Ath MadridSevilla
28/09/08,Malaga,Valladolid,2,1,H,2.4,3.0,2.8,2008-09-28,2008/2009,6,SP1,2-1,1,-0.3999999999999999,2008-09-28MalagaValladolid
28/09/08,Numancia,Osasuna,0,0,D,2.3,3.0,2.9,2008-09-28,2008/2009,6,SP1,0-0,0,-0.6000000000000001,2008-09-28NumanciaOsasuna
28/09/08,Santander,Mallorca,1,2,A,2.0,3.0,3.6,2008-09-28,2008/2009,6,SP1,1-2,-1,-1.6,2008-09-28SantanderMallorca
28/09/08,Valencia,La Coruna,4,2,H,1.65,3.3,4.9,2008-09-28,2008/2009,6,SP1,4-2,2,-3.2500000000000004,2008-09-28ValenciaLa Coruna
04/10/08,Barcelona,Ath Madrid,6,1,H,1.6,3.4,5.2,2008-10-04,2008/2009,6,SP1,6-1,5,-3.6,2008-10-04BarcelonaAth Madrid
04/10/08,Villarreal,Betis,2,1,H,1.55,3.4,5.8,2008-10-04,2008/2009,6,SP1,2-1,1,-4.25,2008-10-04VillarrealBetis
05/10/08,Getafe,Almeria,2,2,D,2.0,3.0,3.6,2008-10-05,2008/2009,6,SP1,2-2,0,-1.6,2008-10-05GetafeAlmeria
05/10/08,La Coruna,Numancia,1,0,H,1.7,3.3,4.5,2008-10-05,2008/2009,6,SP1,1-0,1,-2.8,2008-10-05La CorunaNumancia
05/10/08,Mallorca,Sp Gijon,0,2,A,1.6,3.5,5.0,2008-10-05,2008/2009,7,SP1,0-2,-2,-3.4,2008-10-05MallorcaSp Gijon
05/10/08,Osasuna,Santander,0,1,A,2.1,3.0,3.3,2008-10-05,2008/2009,7,SP1,0-1,-1,-1.1999999999999997,2008-10-05OsasunaSantander
05/10/08,Real Madrid,Espanol,2,2,D,1.3,4.6,8.0,2008-10-05,2008/2009,7,SP1,2-2,0,-6.7,2008-10-05Real MadridEspanol
05/10/08,Recreativo,Malaga,0,4,A,2.1,3.1,3.2,2008-10-05,2008/2009,7,SP1,0-4,-4,-1.1,2008-10-05RecreativoMalaga
05/10/08,Sevilla,Ath Bilbao,4,0,H,1.45,3.6,7.0,2008-10-05,2008/2009,7,SP1,4-0,4,-5.55,2008-10-05SevillaAth Bilbao
05/10/08,Valladolid,Valencia,0,1,A,3.3,3.0,2.1,2008-10-05,2008/2009,7,SP1,0-1,-1,1.1999999999999997,2008-10-05ValladolidValencia
18/10/08,Ath Madrid,Real Madrid,1,2,A,2.7,3.1,2.4,2008-10-18,2008/2009,7,SP1,1-2,-1,0.30000000000000027,2008-10-18Ath MadridReal Madrid
18/10/08,Espanol,Villarreal,0,0,D,2.55,3.1,2.55,2008-10-18,2008/2009,7,SP1,0-0,0,0.0,2008-10-18EspanolVillarreal
19/10/08,Almeria,Sevilla,0,1,A,2.7,3.1,2.4,2008-10-19,2008/2009,7,SP1,0-1,-1,0.30000000000000027,2008-10-19AlmeriaSevilla
19/10/08,Ath Bilbao,Barcelona,0,1,A,4.5,3.5,1.65,2008-10-19,2008/2009,8,SP1,0-1,-1,2.85,2008-10-19Ath BilbaoBarcelona
19/10/08,Betis,Mallorca,3,0,H,2.1,3.1,3.2,2008-10-19,2008/2009,8,SP1,3-0,3,-1.1,2008-10-19BetisMallorca
19/10/08,Malaga,Getafe,2,1,H,2.4,3.1,2.7,2008-10-19,2008/2009,8,SP1,2-1,1,-0.30000000000000027,2008-10-19MalagaGetafe
19/10/08,Santander,La Coruna,0,0,D,2.1,3.1,3.2,2008-10-19,2008/2009,8,SP1,0-0,0,-1.1,2008-10-19SantanderLa Coruna
19/10/08,Sp Gijon,Osasuna,2,1,H,2.55,3.1,2.55,2008-10-19,2008/2009,8,SP1,2-1,1,0.0,2008-10-19Sp GijonOsasuna
19/10/08,Valencia,Numancia,4,0,H,1.3,4.6,8.0,2008-10-19,2008/2009,8,SP1,4-0,4,-6.7,2008-10-19ValenciaNumancia
19/10/08,Valladolid,Recreativo,1,1,D,1.9,3.1,3.8,2008-10-19,2008/2009,8,SP1,1-1,0,-1.9,2008-10-19ValladolidRecreativo
25/10/08,Barcelona,Almeria,5,0,H,1.25,4.8,9.5,2008-10-25,2008/2009,8,SP1,5-0,5,-8.25,2008-10-25BarcelonaAlmeria
25/10/08,Osasuna,Betis,0,2,A,2.1,3.1,3.2,2008-10-25,2008/2009,8,SP1,0-2,-2,-1.1,2008-10-25OsasunaBetis
26/10/08,Getafe,Valladolid,1,0,H,1.85,3.1,4.0,2008-10-26,2008/2009,9,SP1,1-0,1,-2.15,2008-10-26GetafeValladolid
26/10/08,La Coruna,Sp Gijon,0,3,A,1.65,3.3,4.9,2008-10-26,2008/2009,9,SP1,0-3,-3,-3.2500000000000004,2008-10-26La CorunaSp Gijon
26/10/08,Mallorca,Espanol,3,0,H,2.2,3.0,3.1,2008-10-26,2008/2009,9,SP1,3-0,3,-0.8999999999999999,2008-10-26MallorcaEspanol
26/10/08,Numancia,Santander,2,1,H,2.4,3.1,2.7,2008-10-26,2008/2009,9,SP1,2-1,1,-0.30000000000000027,2008-10-26NumanciaSantander
26/10/08,Real Madrid,Ath Bilbao,3,2,H,1.25,4.8,9.5,2008-10-26,2008/2009,9,SP1,3-2,1,-8.25,2008-10-26Real MadridAth Bilbao
26/10/08,Recreativo,Valencia,1,1,D,4.0,3.1,1.85,2008-10-26,2008/2009,9,SP1,1-1,0,2.15,2008-10-26RecreativoValencia
26/10/08,Sevilla,Malaga,0,1,A,1.35,4.2,7.5,2008-10-26,2008/2009,9,SP1,0-1,-1,-6.15,2008-10-26SevillaMalaga
26/10/08,Villarreal,Ath Madrid,4,4,D,2.1,3.1,3.2,2008-10-26,2008/2009,9,SP1,4-4,0,-1.1,2008-10-26VillarrealAth Madrid
01/11/08,Ath Bilbao,Villarreal,1,4,A,3.3,3.0,2.1,2008-11-01,2008/2009,9,SP1,1-4,-3,1.1999999999999997,2008-11-01Ath BilbaoVillarreal
01/11/08,Ath Madrid,Mallorca,2,0,H,1.55,3.4,5.8,2008-11-01,2008/2009,10,SP1,2-0,2,-4.25,2008-11-01Ath MadridMallorca
01/11/08,Malaga,Barcelona,1,4,A,7.0,3.6,1.45,2008-11-01,2008/2009,10,SP1,1-4,-3,5.55,2008-11-01MalagaBarcelona
01/11/08,Valencia,Santander,2,4,A,1.45,3.6,7.0,2008-11-01,2008/2009,10,SP1,2-4,-2,-5.55,2008-11-01ValenciaSantander
02/11/08,Almeria,Real Madrid,1,1,D,4.5,3.3,1.7,2008-11-02,2008/2009,10,SP1,1-1,0,2.8,2008-11-02AlmeriaReal Madrid
02/11/08,Betis,La Coruna,0,3,A,2.0,3.1,3.4,2008-11-02,2008/2009,10,SP1,0-3,-3,-1.4,2008-11-02BetisLa Coruna
02/11/08,Espanol,Osasuna,1,0,H,1.9,3.1,3.8,2008-11-02,2008/2009,10,SP1,1-0,1,-1.9,2008-11-02EspanolOsasuna
02/11/08,Recreativo,Getafe,1,1,D,2.3,3.0,2.9,2008-11-02,2008/2009,10,SP1,1-1,0,-0.6000000000000001,2008-11-02RecreativoGetafe
02/11/08,Sp Gijon,Numancia,3,1,H,1.9,3.1,3.8,2008-11-02,2008/2009,10,SP1,3-1,2,-1.9,2008-11-02Sp GijonNumancia
02/11/08,Valladolid,Sevilla,3,2,H,3.3,3.0,2.1,2008-11-02,2008/2009,10,SP1,3-2,1,1.1999999999999997,2008-11-02ValladolidSevilla
08/11/08,Barcelona,Valladolid,6,0,H,1.17,5.4,13.0,2008-11-08,2008/2009,11,SP1,6-0,6,-11.83,2008-11-08BarcelonaValladolid
08/11/08,Real Madrid,Malaga,4,3,H,1.22,4.8,11.0,2008-11-08,2008/2009,11,SP1,4-3,1,-9.78,2008-11-08Real MadridMalaga
09/11/08,Getafe,Valencia,0,3,A,2.9,3.0,2.3,2008-11-09,2008/2009,11,SP1,0-3,-3,0.6000000000000001,2008-11-09GetafeValencia
09/11/08,La Coruna,Espanol,1,0,H,2.0,3.1,3.4,2008-11-09,2008/2009,11,SP1,1-0,1,-1.4,2008-11-09La CorunaEspanol
09/11/08,Mallorca,Ath Bilbao,3,3,D,1.9,3.1,3.8,2008-11-09,2008/2009,11,SP1,3-3,0,-1.9,2008-11-09MallorcaAth Bilbao
09/11/08,Numancia,Betis,2,4,A,2.3,3.1,2.8,2008-11-09,2008/2009,11,SP1,2-4,-2,-0.5,2008-11-09NumanciaBetis
09/11/08,Osasuna,Ath Madrid,0,0,D,3.4,3.1,2.0,2008-11-09,2008/2009,11,SP1,0-0,0,1.4,2008-11-09OsasunaAth Madrid
09/11/08,Santander,Sp Gijon,1,0,H,1.9,3.1,3.8,2008-11-09,2008/2009,11,SP1,1-0,1,-1.9,2008-11-09SantanderSp Gijon
09/11/08,Sevilla,Recreativo,1,0,H,1.35,4.0,8.0,2008-11-09,2008/2009,11,SP1,1-0,1,-6.65,2008-11-09SevillaRecreativo
09/11/08,Villarreal,Almeria,2,1,H,1.4,3.7,7.5,2008-11-09,2008/2009,12,SP1,2-1,1,-6.1,2008-11-09VillarrealAlmeria
15/11/08,Valencia,Sp Gijon,2,3,A,1.35,4.0,8.0,2008-11-15,2008/2009,12,SP1,2-3,-1,-6.65,2008-11-15ValenciaSp Gijon
15/11/08,Valladolid,Real Madrid,1,0,H,3.8,3.2,1.85,2008-11-15,2008/2009,12,SP1,1-0,1,1.9499999999999997,2008-11-15ValladolidReal Madrid
16/11/08,Almeria,Mallorca,2,1,H,2.0,3.0,3.6,2008-11-16,2008/2009,12,SP1,2-1,1,-1.6,2008-11-16AlmeriaMallorca
16/11/08,Ath Bilbao,Osasuna,2,0,H,2.0,3.0,3.6,2008-11-16,2008/2009,12,SP1,2-0,2,-1.6,2008-11-16Ath BilbaoOsasuna
16/11/08,Ath Madrid,La Coruna,4,1,H,1.6,3.4,5.2,2008-11-16,2008/2009,12,SP1,4-1,3,-3.6,2008-11-16Ath MadridLa Coruna
16/11/08,Betis,Santander,3,1,H,2.0,3.0,3.6,2008-11-16,2008/2009,12,SP1,3-1,2,-1.6,2008-11-16BetisSantander
16/11/08,Espanol,Numancia,3,4,A,1.65,3.4,4.7,2008-11-16,2008/2009,12,SP1,3-4,-1,-3.0500000000000003,2008-11-16EspanolNumancia
16/11/08,Getafe,Sevilla,0,2,A,2.8,3.0,2.4,2008-11-16,2008/2009,12,SP1,0-2,-2,0.3999999999999999,2008-11-16GetafeSevilla
16/11/08,Malaga,Villarreal,2,2,D,3.1,3.0,2.2,2008-11-16,2008/2009,13,SP1,2-2,0,0.8999999999999999,2008-11-16MalagaVillarreal
16/11/08,Recreativo,Barcelona,0,2,A,7.5,3.7,1.4,2008-11-16,2008/2009,13,SP1,0-2,-2,6.1,2008-11-16RecreativoBarcelona
22/11/08,Real Madrid,Recreativo,1,0,H,1.27,4.4,10.0,2008-11-22,2008/2009,13,SP1,1-0,1,-8.73,2008-11-22Real MadridRecreativo
22/11/08,Sevilla,Valencia,0,0,D,2.1,3.1,3.2,2008-11-22,2008/2009,13,SP1,0-0,0,-1.1,2008-11-22SevillaValencia
22/11/08,Villarreal,Valladolid,0,3,A,1.45,3.6,7.0,2008-11-22,2008/2009,13,SP1,0-3,-3,-5.55,2008-11-22VillarrealValladolid
23/11/08,Barcelona,Getafe,1,1,D,1.2,5.0,12.0,2008-11-23,2008/2009,13,SP1,1-1,0,-10.8,2008-11-23BarcelonaGetafe
23/11/08,La Coruna,Ath Bilbao,3,1,H,1.85,3.1,4.0,2008-11-23,2008/2009,13,SP1,3-1,2,-2.15,2008-11-23La CorunaAth Bilbao
23/11/08,Mallorca,Malaga,2,2,D,2.1,3.1,3.2,2008-11-23,2008/2009,13,SP1,2-2,0,-1.1,2008-11-23MallorcaMalaga
23/11/08,Numancia,Ath Madrid,1,1,D,3.2,3.1,2.1,2008-11-23,2008/2009,13,SP1,1-1,0,1.1,2008-11-23NumanciaAth Madrid
23/11/08,Osasuna,Almeria,3,1,H,2.3,3.1,2.8,2008-11-23,2008/2009,14,SP1,3-1,2,-0.5,2008-11-23OsasunaAlmeria
23/11/08,Santander,Espanol,3,0,H,2.0,3.1,3.4,2008-11-23,2008/2009,14,SP1,3-0,3,-1.4,2008-11-23SantanderEspanol
23/11/08,Sp Gijon,Betis,1,2,A,2.3,3.1,2.8,2008-11-23,2008/2009,14,SP1,1-2,-1,-0.5,2008-11-23Sp GijonBetis
29/11/08,Getafe,Real Madrid,3,1,H,3.3,3.0,2.1,2008-11-29,2008/2009,14,SP1,3-1,2,1.1999999999999997,2008-11-29GetafeReal Madrid
29/11/08,Sevilla,Barcelona,0,3,A,3.0,3.1,2.2,2008-11-29,2008/2009,14,SP1,0-3,-3,0.7999999999999998,2008-11-29SevillaBarcelona
30/11/08,Almeria,La Coruna,0,1,A,2.0,3.1,3.4,2008-11-30,2008/2009,14,SP1,0-1,-1,-1.4,2008-11-30AlmeriaLa Coruna
30/11/08,Ath Bilbao,Numancia,2,0,H,1.85,3.2,3.8,2008-11-30,2008/2009,14,SP1,2-0,2,-1.9499999999999997,2008-11-30Ath BilbaoNumancia
30/11/08,Ath Madrid,Santander,4,1,H,1.55,3.4,5.8,2008-11-30,2008/2009,14,SP1,4-1,3,-4.25,2008-11-30Ath MadridSantander
30/11/08,Espanol,Sp Gijon,0,1,A,2.0,3.1,3.4,2008-11-30,2008/2009,14,SP1,0-1,-1,-1.4,2008-11-30EspanolSp Gijon
30/11/08,Malaga,Osasuna,4,2,H,2.0,3.1,3.4,2008-11-30,2008/2009,15,SP1,4-2,2,-1.4,2008-11-30MalagaOsasuna
30/11/08,Recreativo,Villarreal,1,2,A,3.6,3.2,1.9,2008-11-30,2008/2009,15,SP1,1-2,-1,1.7000000000000002,2008-11-30RecreativoVillarreal
30/11/08,Valencia,Betis,3,2,H,1.6,3.4,5.2,2008-11-30,2008/2009,15,SP1,3-2,1,-3.6,2008-11-30ValenciaBetis
30/11/08,Valladolid,Mallorca,3,0,H,1.9,3.1,3.8,2008-11-30,2008/2009,15,SP1,3-0,3,-1.9,2008-11-30ValladolidMallorca
06/12/08,Barcelona,Valencia,4,0,H,1.55,3.5,5.5,2008-12-06,2008/2009,15,SP1,4-0,4,-3.95,2008-12-06BarcelonaValencia
06/12/08,Sp Gijon,Ath Madrid,2,5,A,3.4,3.1,2.0,2008-12-06,2008/2009,15,SP1,2-5,-3,1.4,2008-12-06Sp GijonAth Madrid
06/12/08,Villarreal,Getafe,3,3,D,1.65,3.3,4.9,2008-12-06,2008/2009,15,SP1,3-3,0,-3.2500000000000004,2008-12-06VillarrealGetafe
07/12/08,Betis,Espanol,1,1,D,1.75,3.3,4.2,2008-12-07,2008/2009,15,SP1,1-1,0,-2.45,2008-12-07BetisEspanol
07/12/08,La Coruna,Malaga,2,0,H,1.9,3.2,3.6,2008-12-07,2008/2009,15,SP1,2-0,2,-1.7000000000000002,2008-12-07La CorunaMalaga
07/12/08,Mallorca,Recreativo,2,3,A,1.75,3.3,4.2,2008-12-07,2008/2009,16,SP1,2-3,-1,-2.45,2008-12-07MallorcaRecreativo
07/12/08,Numancia,Almeria,2,1,H,2.2,3.1,3.0,2008-12-07,2008/2009,16,SP1,2-1,1,-0.7999999999999998,2008-12-07NumanciaAlmeria
07/12/08,Osasuna,Valladolid,3,3,D,2.2,3.1,3.0,2008-12-07,2008/2009,16,SP1,3-3,0,-0.7999999999999998,2008-12-07OsasunaValladolid
07/12/08,Real Madrid,Sevilla,3,4,A,1.9,3.3,3.5,2008-12-07,2008/2009,16,SP1,3-4,-1,-1.6,2008-12-07Real MadridSevilla
07/12/08,Santander,Ath Bilbao,1,1,D,2.0,3.1,3.4,2008-12-07,2008/2009,16,SP1,1-1,0,-1.4,2008-12-07SantanderAth Bilbao
13/12/08,Barcelona,Real Madrid,2,0,H,1.6,3.5,5.0,2008-12-13,2008/2009,16,SP1,2-0,2,-3.4,2008-12-13BarcelonaReal Madrid
13/12/08,Valencia,Espanol,2,1,H,1.5,3.6,6.0,2008-12-13,2008/2009,16,SP1,2-1,1,-4.5,2008-12-13ValenciaEspanol
14/12/08,Almeria,Santander,1,1,D,2.1,3.1,3.2,2008-12-14,2008/2009,16,SP1,1-1,0,-1.1,2008-12-14AlmeriaSantander
14/12/08,Ath Bilbao,Sp Gijon,3,0,H,2.0,3.1,3.4,2008-12-14,2008/2009,16,SP1,3-0,3,-1.4,2008-12-14Ath BilbaoSp Gijon
14/12/08,Ath Madrid,Betis,2,0,H,1.65,3.5,4.5,2008-12-14,2008/2009,17,SP1,2-0,2,-2.85,2008-12-14Ath MadridBetis
14/12/08,Getafe,Mallorca,4,1,H,1.85,3.2,3.8,2008-12-14,2008/2009,17,SP1,4-1,3,-1.9499999999999997,2008-12-14GetafeMallorca
14/12/08,Malaga,Numancia,2,0,H,1.8,3.2,4.0,2008-12-14,2008/2009,17,SP1,2-0,2,-2.2,2008-12-14MalagaNumancia
14/12/08,Recreativo,Osasuna,1,0,H,2.2,3.1,3.0,2008-12-14,2008/2009,17,SP1,1-0,1,-0.7999999999999998,2008-12-14RecreativoOsasuna
14/12/08,Sevilla,Villarreal,1,0,H,2.0,3.2,3.3,2008-12-14,2008/2009,17,SP1,1-0,1,-1.2999999999999998,2008-12-14SevillaVillarreal
14/12/08,Valladolid,La Coruna,3,0,H,2.2,3.1,3.0,2008-12-14,2008/2009,17,SP1,3-0,3,-0.7999999999999998,2008-12-14ValladolidLa Coruna
20/12/08,Espanol,Ath Madrid,2,3,A,3.2,3.1,2.1,2008-12-20,2008/2009,17,SP1,2-3,-1,1.1,2008-12-20EspanolAth Madrid
20/12/08,Real Madrid,Valencia,1,0,H,1.9,3.3,3.5,2008-12-20,2008/2009,17,SP1,1-0,1,-1.6,2008-12-20Real MadridValencia
21/12/08,Betis,Ath Bilbao,0,1,A,1.9,3.2,3.6,2008-12-21,2008/2009,17,SP1,0-1,-1,-1.7000000000000002,2008-12-21BetisAth Bilbao
21/12/08,La Coruna,Recreativo,4,1,H,1.65,3.3,4.9,2008-12-21,2008/2009,18,SP1,4-1,3,-3.2500000000000004,2008-12-21La CorunaRecreativo
21/12/08,Mallorca,Sevilla,0,0,D,3.4,3.1,2.0,2008-12-21,2008/2009,18,SP1,0-0,0,1.4,2008-12-21MallorcaSevilla
21/12/08,Numancia,Valladolid,4,3,H,2.4,3.1,2.7,2008-12-21,2008/2009,18,SP1,4-3,1,-0.30000000000000027,2008-12-21NumanciaValladolid
21/12/08,Osasuna,Getafe,5,2,H,2.4,3.1,2.7,2008-12-21,2008/2009,18,SP1,5-2,3,-0.30000000000000027,2008-12-21OsasunaGetafe
21/12/08,Santander,Malaga,1,1,D,2.0,3.1,3.4,2008-12-21,2008/2009,18,SP1,1-1,0,-1.4,2008-12-21SantanderMalaga
21/12/08,Sp Gijon,Almeria,1,0,H,2.2,3.1,3.0,2008-12-21,2008/2009,18,SP1,1-0,1,-0.7999999999999998,2008-12-21Sp GijonAlmeria
21/12/08,Villarreal,Barcelona,1,2,A,3.6,3.2,1.9,2008-12-21,2008/2009,18,SP1,1-2,-1,1.7000000000000002,2008-12-21VillarrealBarcelona
03/01/09,Barcelona,Mallorca,3,1,H,1.17,5.4,13.0,2009-01-03,2008/2009,18,SP1,3-1,2,-11.83,2009-01-03BarcelonaMallorca
03/01/09,Valencia,Ath Madrid,3,1,H,2.1,3.1,3.2,2009-01-03,2008/2009,18,SP1,3-1,2,-1.1,2009-01-03ValenciaAth Madrid
04/01/09,Almeria,Betis,1,0,H,2.2,3.1,3.0,2009-01-04,2008/2009,19,SP1,1-0,1,-0.7999999999999998,2009-01-04AlmeriaBetis
04/01/09,Ath Bilbao,Espanol,1,1,D,1.8,3.2,4.0,2009-01-04,2008/2009,19,SP1,1-1,0,-2.2,2009-01-04Ath BilbaoEspanol
04/01/09,Getafe,La Coruna,1,2,A,2.0,3.1,3.4,2009-01-04,2008/2009,19,SP1,1-2,-1,-1.4,2009-01-04GetafeLa Coruna
04/01/09,Malaga,Sp Gijon,1,0,H,1.85,3.2,3.8,2009-01-04,2008/2009,19,SP1,1-0,1,-1.9499999999999997,2009-01-04MalagaSp Gijon
04/01/09,Real Madrid,Villarreal,1,0,H,1.8,3.3,3.9,2009-01-04,2008/2009,19,SP1,1-0,1,-2.0999999999999996,2009-01-04Real MadridVillarreal
04/01/09,Recreativo,Numancia,3,1,H,1.9,3.2,3.6,2009-01-04,2008/2009,19,SP1,3-1,2,-1.7000000000000002,2009-01-04RecreativoNumancia
04/01/09,Sevilla,Osasuna,1,1,D,1.35,4.2,7.5,2009-01-04,2008/2009,19,SP1,1-1,0,-6.15,2009-01-04SevillaOsasuna
04/01/09,Valladolid,Santander,0,1,A,1.9,3.2,3.6,2009-01-04,2008/2009,19,SP1,0-1,-1,-1.7000000000000002,2009-01-04ValladolidSantander
10/01/09,La Coruna,Sevilla,1,3,A,2.5,3.2,2.5,2009-01-10,2008/2009,19,SP1,1-3,-2,0.0,2009-01-10La CorunaSevilla
10/01/09,Valencia,Villarreal,3,3,D,2.0,3.1,3.4,2009-01-10,2008/2009,20,SP1,3-3,0,-1.4,2009-01-10ValenciaVillarreal
11/01/09,Ath Madrid,Ath Bilbao,2,3,A,1.55,3.5,5.5,2009-01-11,2008/2009,20,SP1,2-3,-1,-3.95,2009-01-11Ath MadridAth Bilbao
11/01/09,Betis,Malaga,1,2,A,2.0,3.2,3.3,2009-01-11,2008/2009,20,SP1,1-2,-1,-1.2999999999999998,2009-01-11BetisMalaga
11/01/09,Espanol,Almeria,2,2,D,1.9,3.3,3.4,2009-01-11,2008/2009,20,SP1,2-2,0,-1.5,2009-01-11EspanolAlmeria
11/01/09,Mallorca,Real Madrid,0,3,A,4.3,3.4,1.7,2009-01-11,2008/2009,20,SP1,0-3,-3,2.5999999999999996,2009-01-11MallorcaReal Madrid
11/01/09,Numancia,Getafe,2,0,H,2.4,3.2,2.6,2009-01-11,2008/2009,20,SP1,2-0,2,-0.20000000000000018,2009-01-11NumanciaGetafe
11/01/09,Osasuna,Barcelona,2,3,A,7.0,3.6,1.45,2009-01-11,2008/2009,20,SP1,2-3,-1,5.55,2009-01-11OsasunaBarcelona
11/01/09,Santander,Recreativo,1,1,D,1.85,3.2,3.8,2009-01-11,2008/2009,20,SP1,1-1,0,-1.9499999999999997,2009-01-11SantanderRecreativo
11/01/09,Sp Gijon,Valladolid,2,1,H,2.3,3.1,2.8,2009-01-11,2008/2009,20,SP1,2-1,1,-0.5,2009-01-11Sp GijonValladolid
17/01/09,Barcelona,La Coruna,5,0,H,1.27,4.4,10.0,2009-01-17,2008/2009,21,SP1,5-0,5,-8.73,2009-01-17BarcelonaLa Coruna
17/01/09,Sevilla,Numancia,1,0,H,1.3,4.6,8.0,2009-01-17,2008/2009,21,SP1,1-0,1,-6.7,2009-01-17SevillaNumancia
18/01/09,Almeria,Ath Madrid,1,1,D,3.1,3.2,2.1,2009-01-18,2008/2009,21,SP1,1-1,0,1.0,2009-01-18AlmeriaAth Madrid
18/01/09,Ath Bilbao,Valencia,3,2,H,2.8,3.1,2.3,2009-01-18,2008/2009,21,SP1,3-2,1,0.5,2009-01-18Ath BilbaoValencia
18/01/09,Getafe,Santander,0,1,A,2.0,3.1,3.4,2009-01-18,2008/2009,21,SP1,0-1,-1,-1.4,2009-01-18GetafeSantander
18/01/09,Malaga,Espanol,4,0,H,1.8,3.3,3.9,2009-01-18,2008/2009,21,SP1,4-0,4,-2.0999999999999996,2009-01-18MalagaEspanol
18/01/09,Real Madrid,Osasuna,3,1,H,1.22,4.8,11.0,2009-01-18,2008/2009,21,SP1,3-1,2,-9.78,2009-01-18Real MadridOsasuna
18/01/09,Recreativo,Sp Gijon,2,0,H,2.1,3.1,3.2,2009-01-18,2008/2009,21,SP1,2-0,2,-1.1,2009-01-18RecreativoSp Gijon
18/01/09,Valladolid,Betis,1,3,A,2.0,3.2,3.3,2009-01-18,2008/2009,21,SP1,1-3,-2,-1.2999999999999998,2009-01-18ValladolidBetis
18/01/09,Villarreal,Mallorca,2,0,H,1.45,3.8,6.5,2009-01-18,2008/2009,22,SP1,2-0,2,-5.05,2009-01-18VillarrealMallorca
24/01/09,Barcelona,Numancia,4,1,H,1.12,6.0,16.0,2009-01-24,2008/2009,22,SP1,4-1,3,-14.879999999999999,2009-01-24BarcelonaNumancia
24/01/09,Villarreal,Osasuna,1,1,D,1.45,3.6,7.0,2009-01-24,2008/2009,22,SP1,1-1,0,-5.55,2009-01-24VillarrealOsasuna
25/01/09,Almeria,Ath Bilbao,2,1,H,2.3,3.1,2.8,2009-01-25,2008/2009,22,SP1,2-1,1,-0.5,2009-01-25AlmeriaAth Bilbao
25/01/09,Getafe,Sp Gijon,5,1,H,1.9,3.3,3.5,2009-01-25,2008/2009,22,SP1,5-1,4,-1.6,2009-01-25GetafeSp Gijon
25/01/09,Malaga,Ath Madrid,1,1,D,2.7,3.1,2.4,2009-01-25,2008/2009,22,SP1,1-1,0,0.30000000000000027,2009-01-25MalagaAth Madrid
25/01/09,Mallorca,Valencia,3,1,H,3.1,3.2,2.1,2009-01-25,2008/2009,22,SP1,3-1,2,1.0,2009-01-25MallorcaValencia
25/01/09,Real Madrid,La Coruna,1,0,H,1.3,4.6,8.0,2009-01-25,2008/2009,22,SP1,1-0,1,-6.7,2009-01-25Real MadridLa Coruna
25/01/09,Recreativo,Betis,1,0,H,2.2,3.1,3.0,2009-01-25,2008/2009,22,SP1,1-0,1,-0.7999999999999998,2009-01-25RecreativoBetis
25/01/09,Sevilla,Santander,0,2,A,1.45,3.6,7.0,2009-01-25,2008/2009,23,SP1,0-2,-2,-5.55,2009-01-25SevillaSantander
25/01/09,Valladolid,Espanol,1,1,D,2.0,3.2,3.3,2009-01-25,2008/2009,23,SP1,1-1,0,-1.2999999999999998,2009-01-25ValladolidEspanol
31/01/09,Ath Bilbao,Malaga,3,2,H,2.0,3.1,3.4,2009-01-31,2008/2009,23,SP1,3-2,1,-1.4,2009-01-31Ath BilbaoMalaga
31/01/09,Numancia,Real Madrid,0,2,A,5.5,3.5,1.55,2009-01-31,2008/2009,23,SP1,0-2,-2,3.95,2009-01-31NumanciaReal Madrid
01/02/09,Ath Madrid,Valladolid,1,2,A,1.55,3.5,5.5,2009-02-01,2008/2009,23,SP1,1-2,-1,-3.95,2009-02-01Ath MadridValladolid
01/02/09,Betis,Getafe,2,2,D,2.1,3.1,3.2,2009-02-01,2008/2009,23,SP1,2-2,0,-1.1,2009-02-01BetisGetafe
01/02/09,Espanol,Recreativo,1,1,D,2.1,3.1,3.2,2009-02-01,2008/2009,23,SP1,1-1,0,-1.1,2009-02-01EspanolRecreativo
01/02/09,La Coruna,Villarreal,3,0,H,2.3,3.1,2.8,2009-02-01,2008/2009,23,SP1,3-0,3,-0.5,2009-02-01La CorunaVillarreal
01/02/09,Osasuna,Mallorca,1,0,H,2.0,3.1,3.4,2009-02-01,2008/2009,23,SP1,1-0,1,-1.4,2009-02-01OsasunaMallorca
01/02/09,Santander,Barcelona,1,2,A,5.2,3.4,1.6,2009-02-01,2008/2009,24,SP1,1-2,-1,3.6,2009-02-01SantanderBarcelona
01/02/09,Sp Gijon,Sevilla,1,0,H,3.4,3.1,2.0,2009-02-01,2008/2009,24,SP1,1-0,1,1.4,2009-02-01Sp GijonSevilla
01/02/09,Valencia,Almeria,3,2,H,1.5,3.5,6.3,2009-02-01,2008/2009,24,SP1,3-2,1,-4.8,2009-02-01ValenciaAlmeria
07/02/09,Real Madrid,Santander,1,0,H,1.35,4.0,8.0,2009-02-07,2008/2009,24,SP1,1-0,1,-6.65,2009-02-07Real MadridSantander
07/02/09,Sevilla,Betis,1,2,A,1.65,3.4,4.7,2009-02-07,2008/2009,24,SP1,1-2,-1,-3.0500000000000003,2009-02-07SevillaBetis
08/02/09,Barcelona,Sp Gijon,3,1,H,1.2,5.2,11.0,2009-02-08,2008/2009,24,SP1,3-1,2,-9.8,2009-02-08BarcelonaSp Gijon
08/02/09,Getafe,Espanol,1,1,D,2.0,3.1,3.4,2009-02-08,2008/2009,24,SP1,1-1,0,-1.4,2009-02-08GetafeEspanol
08/02/09,Malaga,Almeria,3,2,H,1.9,3.2,3.6,2009-02-08,2008/2009,24,SP1,3-2,1,-1.7000000000000002,2009-02-08MalagaAlmeria
08/02/09,Mallorca,La Coruna,1,1,D,2.5,3.0,2.7,2009-02-08,2008/2009,24,SP1,1-1,0,-0.20000000000000018,2009-02-08MallorcaLa Coruna
08/02/09,Osasuna,Valencia,1,0,H,2.7,3.1,2.4,2009-02-08,2008/2009,25,SP1,1-0,1,0.30000000000000027,2009-02-08OsasunaValencia
08/02/09,Recreativo,Ath Madrid,0,3,A,2.6,3.1,2.5,2009-02-08,2008/2009,25,SP1,0-3,-3,0.10000000000000009,2009-02-08RecreativoAth Madrid
08/02/09,Valladolid,Ath Bilbao,2,1,H,2.2,3.1,3.0,2009-02-08,2008/2009,25,SP1,2-1,1,-0.7999999999999998,2009-02-08ValladolidAth Bilbao
08/02/09,Villarreal,Numancia,2,1,H,1.45,3.7,6.5,2009-02-08,2008/2009,25,SP1,2-1,1,-5.05,2009-02-08VillarrealNumancia
14/02/09,Betis,Barcelona,2,2,D,5.5,3.5,1.55,2009-02-14,2008/2009,25,SP1,2-2,0,3.95,2009-02-14BetisBarcelona
14/02/09,La Coruna,Osasuna,0,0,D,1.9,3.2,3.6,2009-02-14,2008/2009,25,SP1,0-0,0,-1.7000000000000002,2009-02-14La CorunaOsasuna
14/02/09,Valencia,Malaga,1,1,D,1.7,3.2,4.7,2009-02-14,2008/2009,25,SP1,1-1,0,-3.0,2009-02-14ValenciaMalaga
15/02/09,Almeria,Valladolid,3,2,H,2.1,3.1,3.2,2009-02-15,2008/2009,25,SP1,3-2,1,-1.1,2009-02-15AlmeriaValladolid
15/02/09,Ath Bilbao,Recreativo,1,1,D,1.8,3.2,4.0,2009-02-15,2008/2009,25,SP1,1-1,0,-2.2,2009-02-15Ath BilbaoRecreativo
15/02/09,Ath Madrid,Getafe,1,1,D,1.65,3.3,4.9,2009-02-15,2008/2009,26,SP1,1-1,0,-3.2500000000000004,2009-02-15Ath MadridGetafe
15/02/09,Espanol,Sevilla,0,2,A,2.6,3.2,2.4,2009-02-15,2008/2009,26,SP1,0-2,-2,0.20000000000000018,2009-02-15EspanolSevilla
15/02/09,Numancia,Mallorca,0,1,A,2.1,3.2,3.1,2009-02-15,2008/2009,26,SP1,0-1,-1,-1.0,2009-02-15NumanciaMallorca
15/02/09,Santander,Villarreal,1,1,D,2.4,3.0,2.8,2009-02-15,2008/2009,26,SP1,1-1,0,-0.3999999999999999,2009-02-15SantanderVillarreal
15/02/09,Sp Gijon,Real Madrid,0,4,A,6.0,3.6,1.5,2009-02-15,2008/2009,26,SP1,0-4,-4,4.5,2009-02-15Sp GijonReal Madrid
21/02/09,Barcelona,Espanol,1,2,A,1.22,5.7,12.5,2009-02-21,2008/2009,26,SP1,1-2,-1,-11.28,2009-02-21BarcelonaEspanol
21/02/09,Real Madrid,Betis,6,1,H,1.45,4.0,7.0,2009-02-21,2008/2009,26,SP1,6-1,5,-5.55,2009-02-21Real MadridBetis
21/02/09,Sevilla,Ath Madrid,1,0,H,2.05,3.25,3.5,2009-02-21,2008/2009,26,SP1,1-0,1,-1.4500000000000002,2009-02-21SevillaAth Madrid
21/02/09,Villarreal,Sp Gijon,2,1,H,1.55,3.7,6.0,2009-02-21,2008/2009,26,SP1,2-1,1,-4.45,2009-02-21VillarrealSp Gijon
22/02/09,Getafe,Ath Bilbao,1,1,D,2.1,3.2,3.5,2009-02-22,2008/2009,27,SP1,1-1,0,-1.4,2009-02-22GetafeAth Bilbao
22/02/09,La Coruna,Valencia,1,1,D,2.4,3.2,2.9,2009-02-22,2008/2009,27,SP1,1-1,0,-0.5,2009-02-22La CorunaValencia
22/02/09,Mallorca,Santander,1,0,H,2.35,3.1,3.0,2009-02-22,2008/2009,27,SP1,1-0,1,-0.6499999999999999,2009-02-22MallorcaSantander
22/02/09,Osasuna,Numancia,2,0,H,1.75,3.5,4.6,2009-02-22,2008/2009,27,SP1,2-0,2,-2.8499999999999996,2009-02-22OsasunaNumancia
22/02/09,Recreativo,Almeria,1,1,D,2.1,3.25,3.4,2009-02-22,2008/2009,27,SP1,1-1,0,-1.2999999999999998,2009-02-22RecreativoAlmeria
22/02/09,Valladolid,Malaga,1,3,A,2.2,3.2,3.2,2009-02-22,2008/2009,27,SP1,1-3,-2,-1.0,2009-02-22ValladolidMalaga
28/02/09,Ath Bilbao,Sevilla,1,2,A,2.8,3.1,2.5,2009-02-28,2008/2009,27,SP1,1-2,-1,0.2999999999999998,2009-02-28Ath BilbaoSevilla
28/02/09,Espanol,Real Madrid,0,2,A,4.3,3.4,1.8,2009-02-28,2008/2009,27,SP1,0-2,-2,2.5,2009-02-28EspanolReal Madrid
01/03/09,Almeria,Getafe,2,1,H,2.25,3.0,3.25,2009-03-01,2008/2009,27,SP1,2-1,1,-1.0,2009-03-01AlmeriaGetafe
01/03/09,Ath Madrid,Barcelona,4,3,H,3.6,3.3,2.0,2009-03-01,2008/2009,28,SP1,4-3,1,1.6,2009-03-01Ath MadridBarcelona
01/03/09,Betis,Villarreal,2,2,D,2.5,3.1,2.8,2009-03-01,2008/2009,28,SP1,2-2,0,-0.2999999999999998,2009-03-01BetisVillarreal
01/03/09,Malaga,Recreativo,0,2,A,1.85,3.2,4.3,2009-03-01,2008/2009,28,SP1,0-2,-2,-2.4499999999999997,2009-03-01MalagaRecreativo
01/03/09,Numancia,La Coruna,0,1,A,2.6,3.2,2.6,2009-03-01,2008/2009,28,SP1,0-1,-1,0.0,2009-03-01NumanciaLa Coruna
01/03/09,Santander,Osasuna,1,1,D,2.25,3.1,3.15,2009-03-01,2008/2009,28,SP1,1-1,0,-0.8999999999999999,2009-03-01SantanderOsasuna
01/03/09,Sp Gijon,Mallorca,0,1,A,2.25,3.2,3.05,2009-03-01,2008/2009,28,SP1,0-1,-1,-0.7999999999999998,2009-03-01Sp GijonMallorca
01/03/09,Valencia,Valladolid,1,2,A,1.7,3.5,4.9,2009-03-01,2008/2009,28,SP1,1-2,-1,-3.2,2009-03-01ValenciaValladolid
07/03/09,Barcelona,Ath Bilbao,2,0,H,1.3,4.8,9.5,2009-03-07,2008/2009,28,SP1,2-0,2,-8.2,2009-03-07BarcelonaAth Bilbao
07/03/09,Real Madrid,Ath Madrid,1,1,D,1.7,3.5,4.9,2009-03-07,2008/2009,28,SP1,1-1,0,-3.2,2009-03-07Real MadridAth Madrid
07/03/09,Villarreal,Espanol,1,0,H,1.75,3.5,4.6,2009-03-07,2008/2009,29,SP1,1-0,1,-2.8499999999999996,2009-03-07VillarrealEspanol
08/03/09,Getafe,Malaga,1,2,A,2.2,3.2,3.2,2009-03-08,2008/2009,29,SP1,1-2,-1,-1.0,2009-03-08GetafeMalaga
08/03/09,La Coruna,Santander,5,3,H,1.9,3.3,3.9,2009-03-08,2008/2009,29,SP1,5-3,2,-2.0,2009-03-08La CorunaSantander
08/03/09,Mallorca,Betis,3,3,D,2.1,3.25,3.4,2009-03-08,2008/2009,29,SP1,3-3,0,-1.2999999999999998,2009-03-08MallorcaBetis
08/03/09,Numancia,Valencia,2,1,H,3.1,3.3,2.2,2009-03-08,2008/2009,29,SP1,2-1,1,0.8999999999999999,2009-03-08NumanciaValencia
08/03/09,Osasuna,Sp Gijon,1,2,A,1.7,3.5,4.9,2009-03-08,2008/2009,29,SP1,1-2,-1,-3.2,2009-03-08OsasunaSp Gijon
08/03/09,Recreativo,Valladolid,2,3,A,2.2,3.2,3.2,2009-03-08,2008/2009,29,SP1,2-3,-1,-1.0,2009-03-08RecreativoValladolid
08/03/09,Sevilla,Almeria,2,1,H,1.6,3.5,5.9,2009-03-08,2008/2009,29,SP1,2-1,1,-4.300000000000001,2009-03-08SevillaAlmeria
14/03/09,Ath Bilbao,Real Madrid,2,5,A,3.6,3.3,2.0,2009-03-14,2008/2009,29,SP1,2-5,-3,1.6,2009-03-14Ath BilbaoReal Madrid
14/03/09,Valencia,Recreativo,1,1,D,1.8,3.4,4.3,2009-03-14,2008/2009,30,SP1,1-1,0,-2.5,2009-03-14ValenciaRecreativo
15/03/09,Almeria,Barcelona,0,2,A,5.6,3.6,1.6,2009-03-15,2008/2009,30,SP1,0-2,-2,3.9999999999999996,2009-03-15AlmeriaBarcelona
15/03/09,Ath Madrid,Villarreal,3,2,H,2.0,3.3,3.6,2009-03-15,2008/2009,30,SP1,3-2,1,-1.6,2009-03-15Ath MadridVillarreal
15/03/09,Betis,Osasuna,0,0,D,2.1,3.25,3.4,2009-03-15,2008/2009,30,SP1,0-0,0,-1.2999999999999998,2009-03-15BetisOsasuna
15/03/09,Espanol,Mallorca,3,3,D,2.2,3.2,3.2,2009-03-15,2008/2009,30,SP1,3-3,0,-1.0,2009-03-15EspanolMallorca
15/03/09,Malaga,Sevilla,2,2,D,2.6,3.2,2.6,2009-03-15,2008/2009,30,SP1,2-2,0,0.0,2009-03-15MalagaSevilla
15/03/09,Santander,Numancia,5,0,H,1.7,3.5,4.9,2009-03-15,2008/2009,30,SP1,5-0,5,-3.2,2009-03-15SantanderNumancia
15/03/09,Sp Gijon,La Coruna,3,2,H,2.7,3.2,2.5,2009-03-15,2008/2009,30,SP1,3-2,1,0.20000000000000018,2009-03-15Sp GijonLa Coruna
15/03/09,Valladolid,Getafe,1,0,H,2.1,3.25,3.4,2009-03-15,2008/2009,30,SP1,1-0,1,-1.2999999999999998,2009-03-15ValladolidGetafe
21/03/09,Sevilla,Valladolid,4,1,H,1.6,3.6,5.6,2009-03-21,2008/2009,31,SP1,4-1,3,-3.9999999999999996,2009-03-21SevillaValladolid
21/03/09,Villarreal,Ath Bilbao,2,0,H,1.65,3.5,5.3,2009-03-21,2008/2009,31,SP1,2-0,2,-3.65,2009-03-21VillarrealAth Bilbao
22/03/09,Barcelona,Malaga,6,0,H,1.22,5.3,13.0,2009-03-22,2008/2009,31,SP1,6-0,6,-11.78,2009-03-22BarcelonaMalaga
22/03/09,Getafe,Recreativo,2,1,H,2.05,3.25,3.5,2009-03-22,2008/2009,31,SP1,2-1,1,-1.4500000000000002,2009-03-22GetafeRecreativo
22/03/09,La Coruna,Betis,1,1,D,2.0,3.3,3.6,2009-03-22,2008/2009,31,SP1,1-1,0,-1.6,2009-03-22La CorunaBetis
22/03/09,Mallorca,Ath Madrid,2,0,H,2.85,3.2,2.4,2009-03-22,2008/2009,31,SP1,2-0,2,0.4500000000000002,2009-03-22MallorcaAth Madrid
22/03/09,Numancia,Sp Gijon,2,1,H,2.3,3.3,2.9,2009-03-22,2008/2009,31,SP1,2-1,1,-0.6000000000000001,2009-03-22NumanciaSp Gijon
22/03/09,Osasuna,Espanol,1,0,H,2.0,3.3,3.6,2009-03-22,2008/2009,31,SP1,1-0,1,-1.6,2009-03-22OsasunaEspanol
22/03/09,Real Madrid,Almeria,3,0,H,1.25,5.0,12.0,2009-03-22,2008/2009,31,SP1,3-0,3,-10.75,2009-03-22Real MadridAlmeria
22/03/09,Santander,Valencia,0,1,A,2.4,3.2,2.85,2009-03-22,2008/2009,32,SP1,0-1,-1,-0.4500000000000002,2009-03-22SantanderValencia
04/04/09,Almeria,Villarreal,3,0,H,2.5,3.2,2.7,2009-04-04,2008/2009,32,SP1,3-0,3,-0.20000000000000018,2009-04-04AlmeriaVillarreal
04/04/09,Ath Bilbao,Mallorca,2,1,H,2.0,3.3,3.6,2009-04-04,2008/2009,32,SP1,2-1,1,-1.6,2009-04-04Ath BilbaoMallorca
04/04/09,Betis,Numancia,3,3,D,1.65,3.5,5.3,2009-04-04,2008/2009,32,SP1,3-3,0,-3.65,2009-04-04BetisNumancia
04/04/09,Malaga,Real Madrid,0,1,A,4.6,3.5,1.75,2009-04-04,2008/2009,32,SP1,0-1,-1,2.8499999999999996,2009-04-04MalagaReal Madrid
04/04/09,Recreativo,Sevilla,0,1,A,3.4,3.25,2.1,2009-04-04,2008/2009,32,SP1,0-1,-1,1.2999999999999998,2009-04-04RecreativoSevilla
04/04/09,Valladolid,Barcelona,0,1,A,6.7,3.8,1.5,2009-04-04,2008/2009,32,SP1,0-1,-1,5.2,2009-04-04ValladolidBarcelona
05/04/09,Ath Madrid,Osasuna,2,4,A,1.55,3.7,6.0,2009-04-05,2008/2009,32,SP1,2-4,-2,-4.45,2009-04-05Ath MadridOsasuna
05/04/09,Espanol,La Coruna,3,1,H,2.3,3.2,3.0,2009-04-05,2008/2009,32,SP1,3-1,2,-0.7000000000000002,2009-04-05EspanolLa Coruna
05/04/09,Sp Gijon,Santander,0,2,A,2.4,3.3,2.8,2009-04-05,2008/2009,33,SP1,0-2,-2,-0.3999999999999999,2009-04-05Sp GijonSantander
05/04/09,Valencia,Getafe,4,1,H,1.8,3.4,4.3,2009-04-05,2008/2009,33,SP1,4-1,3,-2.5,2009-04-05ValenciaGetafe
11/04/09,Barcelona,Recreativo,2,0,H,1.15,6.5,15.0,2009-04-11,2008/2009,33,SP1,2-0,2,-13.85,2009-04-11BarcelonaRecreativo
11/04/09,Villarreal,Malaga,0,2,A,1.95,3.3,3.8,2009-04-11,2008/2009,33,SP1,0-2,-2,-1.8499999999999999,2009-04-11VillarrealMalaga
12/04/09,La Coruna,Ath Madrid,1,2,A,2.5,3.2,2.7,2009-04-12,2008/2009,33,SP1,1-2,-1,-0.20000000000000018,2009-04-12La CorunaAth Madrid
12/04/09,Mallorca,Almeria,2,0,H,2.0,3.3,3.6,2009-04-12,2008/2009,33,SP1,2-0,2,-1.6,2009-04-12MallorcaAlmeria
12/04/09,Numancia,Espanol,0,0,D,2.3,3.3,2.9,2009-04-12,2008/2009,33,SP1,0-0,0,-0.6000000000000001,2009-04-12NumanciaEspanol
12/04/09,Osasuna,Ath Bilbao,2,1,H,2.0,3.2,3.7,2009-04-12,2008/2009,33,SP1,2-1,1,-1.7000000000000002,2009-04-12OsasunaAth Bilbao
12/04/09,Real Madrid,Valladolid,2,0,H,1.2,5.5,14.0,2009-04-12,2008/2009,33,SP1,2-0,2,-12.8,2009-04-12Real MadridValladolid
12/04/09,Santander,Betis,2,3,A,2.1,3.25,3.4,2009-04-12,2008/2009,34,SP1,2-3,-1,-1.2999999999999998,2009-04-12SantanderBetis
12/04/09,Sevilla,Getafe,0,1,A,1.5,3.8,6.7,2009-04-12,2008/2009,34,SP1,0-1,-1,-5.2,2009-04-12SevillaGetafe
12/04/09,Sp Gijon,Valencia,2,3,A,3.1,3.3,2.2,2009-04-12,2008/2009,34,SP1,2-3,-1,0.8999999999999999,2009-04-12Sp GijonValencia
18/04/09,Ath Bilbao,La Coruna,0,1,A,2.2,3.2,3.2,2009-04-18,2008/2009,34,SP1,0-1,-1,-1.0,2009-04-18Ath BilbaoLa Coruna
18/04/09,Ath Madrid,Numancia,3,0,H,1.37,4.4,8.0,2009-04-18,2008/2009,34,SP1,3-0,3,-6.63,2009-04-18Ath MadridNumancia
18/04/09,Getafe,Barcelona,0,1,A,7.0,4.0,1.45,2009-04-18,2008/2009,34,SP1,0-1,-1,5.55,2009-04-18GetafeBarcelona
18/04/09,Malaga,Mallorca,1,1,D,1.9,3.3,3.9,2009-04-18,2008/2009,34,SP1,1-1,0,-2.0,2009-04-18MalagaMallorca
18/04/09,Recreativo,Real Madrid,0,1,A,6.0,3.7,1.55,2009-04-18,2008/2009,34,SP1,0-1,-1,4.45,2009-04-18RecreativoReal Madrid
19/04/09,Almeria,Osasuna,2,1,H,2.2,3.2,3.2,2009-04-19,2008/2009,34,SP1,2-1,1,-1.0,2009-04-19AlmeriaOsasuna
19/04/09,Betis,Sp Gijon,2,0,H,1.65,3.5,5.3,2009-04-19,2008/2009,35,SP1,2-0,2,-3.65,2009-04-19BetisSp Gijon
19/04/09,Espanol,Santander,1,0,H,2.1,3.25,3.4,2009-04-19,2008/2009,35,SP1,1-0,1,-1.2999999999999998,2009-04-19EspanolSantander
19/04/09,Valencia,Sevilla,3,1,H,2.2,3.2,3.2,2009-04-19,2008/2009,35,SP1,3-1,2,-1.0,2009-04-19ValenciaSevilla
19/04/09,Valladolid,Villarreal,0,0,D,2.3,3.2,3.0,2009-04-19,2008/2009,35,SP1,0-0,0,-0.7000000000000002,2009-04-19ValladolidVillarreal
21/04/09,Numancia,Ath Bilbao,1,2,A,2.5,3.2,2.7,2009-04-21,2008/2009,35,SP1,1-2,-1,-0.20000000000000018,2009-04-21NumanciaAth Bilbao
21/04/09,Real Madrid,Getafe,3,2,H,1.22,5.3,13.0,2009-04-21,2008/2009,35,SP1,3-2,1,-11.78,2009-04-21Real MadridGetafe
22/04/09,Barcelona,Sevilla,4,0,H,1.35,4.5,8.5,2009-04-22,2008/2009,35,SP1,4-0,4,-7.15,2009-04-22BarcelonaSevilla
22/04/09,Betis,Valencia,1,2,A,3.0,3.2,2.3,2009-04-22,2008/2009,35,SP1,1-2,-1,0.7000000000000002,2009-04-22BetisValencia
22/04/09,La Coruna,Almeria,2,0,H,1.8,3.4,4.3,2009-04-22,2008/2009,35,SP1,2-0,2,-2.5,2009-04-22La CorunaAlmeria
22/04/09,Osasuna,Malaga,2,3,A,2.1,3.25,3.4,2009-04-22,2008/2009,36,SP1,2-3,-1,-1.2999999999999998,2009-04-22OsasunaMalaga
23/04/09,Mallorca,Valladolid,2,0,H,1.9,3.3,3.9,2009-04-23,2008/2009,36,SP1,2-0,2,-2.0,2009-04-23MallorcaValladolid
23/04/09,Santander,Ath Madrid,5,1,H,3.0,3.2,2.3,2009-04-23,2008/2009,36,SP1,5-1,4,0.7000000000000002,2009-04-23SantanderAth Madrid
23/04/09,Sp Gijon,Espanol,0,3,A,2.4,3.3,2.8,2009-04-23,2008/2009,36,SP1,0-3,-3,-0.3999999999999999,2009-04-23Sp GijonEspanol
23/04/09,Villarreal,Recreativo,2,1,H,1.5,3.8,6.7,2009-04-23,2008/2009,36,SP1,2-1,1,-5.2,2009-04-23VillarrealRecreativo
25/04/09,Almeria,Numancia,2,1,H,1.65,3.6,5.0,2009-04-25,2008/2009,36,SP1,2-1,1,-3.35,2009-04-25AlmeriaNumancia
25/04/09,Malaga,La Coruna,1,1,D,2.1,3.25,3.4,2009-04-25,2008/2009,36,SP1,1-1,0,-1.2999999999999998,2009-04-25MalagaLa Coruna
25/04/09,Valencia,Barcelona,2,2,D,3.9,3.3,1.9,2009-04-25,2008/2009,36,SP1,2-2,0,2.0,2009-04-25ValenciaBarcelona
26/04/09,Ath Bilbao,Santander,2,1,H,2.1,3.0,3.7,2009-04-26,2008/2009,36,SP1,2-1,1,-1.6,2009-04-26Ath BilbaoSantander
26/04/09,Ath Madrid,Sp Gijon,3,1,H,1.35,4.7,8.0,2009-04-26,2008/2009,37,SP1,3-1,2,-6.65,2009-04-26Ath MadridSp Gijon
26/04/09,Espanol,Betis,2,0,H,2.0,3.3,3.6,2009-04-26,2008/2009,37,SP1,2-0,2,-1.6,2009-04-26EspanolBetis
26/04/09,Getafe,Villarreal,1,2,A,2.3,3.2,3.0,2009-04-26,2008/2009,37,SP1,1-2,-1,-0.7000000000000002,2009-04-26GetafeVillarreal
26/04/09,Recreativo,Mallorca,2,4,A,2.2,3.2,3.2,2009-04-26,2008/2009,37,SP1,2-4,-2,-1.0,2009-04-26RecreativoMallorca
26/04/09,Sevilla,Real Madrid,2,4,A,2.65,3.3,2.5,2009-04-26,2008/2009,37,SP1,2-4,-2,0.1499999999999999,2009-04-26SevillaReal Madrid
26/04/09,Valladolid,Osasuna,0,0,D,2.2,3.2,3.2,2009-04-26,2008/2009,37,SP1,0-0,0,-1.0,2009-04-26ValladolidOsasuna
02/05/09,Numancia,Malaga,2,0,H,2.9,3.3,2.3,2009-05-02,2008/2009,37,SP1,2-0,2,0.6000000000000001,2009-05-02NumanciaMalaga
02/05/09,Real Madrid,Barcelona,2,6,A,2.5,3.3,2.65,2009-05-02,2008/2009,37,SP1,2-6,-4,-0.1499999999999999,2009-05-02Real MadridBarcelona
02/05/09,Villarreal,Sevilla,0,2,A,2.2,3.3,3.1,2009-05-02,2008/2009,37,SP1,0-2,-2,-0.8999999999999999,2009-05-02VillarrealSevilla
03/05/09,Betis,Ath Madrid,0,2,A,2.9,3.3,2.3,2009-05-03,2008/2009,38,SP1,0-2,-2,0.6000000000000001,2009-05-03BetisAth Madrid
03/05/09,Espanol,Valencia,3,0,H,2.6,3.2,2.6,2009-05-03,2008/2009,38,SP1,3-0,3,0.0,2009-05-03EspanolValencia
03/05/09,La Coruna,Valladolid,1,0,H,1.7,3.5,4.9,2009-05-03,2008/2009,38,SP1,1-0,1,-3.2,2009-05-03La CorunaValladolid
03/05/09,Mallorca,Getafe,2,1,H,2.2,3.3,3.1,2009-05-03,2008/2009,38,SP1,2-1,1,-0.8999999999999999,2009-05-03MallorcaGetafe
03/05/09,Osasuna,Recreativo,1,2,A,1.7,3.5,4.9,2009-05-03,2008/2009,38,SP1,1-2,-1,-3.2,2009-05-03OsasunaRecreativo
03/05/09,Santander,Almeria,0,2,A,2.2,3.0,3.4,2009-05-03,2008/2009,38,SP1,0-2,-2,-1.1999999999999997,2009-05-03SantanderAlmeria
03/05/09,Sp Gijon,Ath Bilbao,1,1,D,2.55,3.3,2.55,2009-05-03,2008/2009,38,SP1,1-1,0,0.0,2009-05-03Sp GijonAth Bilbao
09/05/09,Ath Bilbao,Betis,1,0,H,2.85,3.2,2.4,2009-05-09,2008/2009,38,SP1,1-0,1,0.4500000000000002,2009-05-09Ath BilbaoBetis
09/05/09,Sevilla,Mallorca,3,1,H,1.55,3.7,6.0,2009-05-09,2008/2009,38,SP1,3-1,2,-4.45,2009-05-09SevillaMallorca
09/05/09,Valencia,Real Madrid,3,0,H,2.4,3.3,2.8,2009-05-09,2008/2009,39,SP1,3-0,3,-0.3999999999999999,2009-05-09ValenciaReal Madrid
10/05/09,Almeria,Sp Gijon,3,1,H,1.8,3.5,4.0,2009-05-10,2008/2009,39,SP1,3-1,2,-2.2,2009-05-10AlmeriaSp Gijon
10/05/09,Ath Madrid,Espanol,3,2,H,1.7,3.6,4.7,2009-05-10,2008/2009,39,SP1,3-2,1,-3.0,2009-05-10Ath MadridEspanol
10/05/09,Barcelona,Villarreal,3,3,D,1.35,4.7,8.0,2009-05-10,2008/2009,39,SP1,3-3,0,-6.65,2009-05-10BarcelonaVillarreal
10/05/09,Getafe,Osasuna,3,0,H,2.1,3.25,3.4,2009-05-10,2008/2009,39,SP1,3-0,3,-1.2999999999999998,2009-05-10GetafeOsasuna
10/05/09,Malaga,Santander,1,0,H,2.0,3.3,3.6,2009-05-10,2008/2009,39,SP1,1-0,1,-1.6,2009-05-10MalagaSantander
10/05/09,Recreativo,La Coruna,1,2,A,2.55,3.3,2.55,2009-05-10,2008/2009,39,SP1,1-2,-1,0.0,2009-05-10RecreativoLa Coruna
10/05/09,Valladolid,Numancia,0,0,D,1.8,3.5,4.0,2009-05-10,2008/2009,39,SP1,0-0,0,-2.2,2009-05-10ValladolidNumancia
16/05/09,La Coruna,Getafe,1,1,D,1.85,3.4,4.0,2009-05-16,2008/2009,39,SP1,1-1,0,-2.15,2009-05-16La CorunaGetafe
16/05/09,Osasuna,Sevilla,0,0,D,2.85,3.2,2.4,2009-05-16,2008/2009,40,SP1,0-0,0,0.4500000000000002,2009-05-16OsasunaSevilla
16/05/09,Villarreal,Real Madrid,3,2,H,2.1,3.35,3.3,2009-05-16,2008/2009,40,SP1,3-2,1,-1.1999999999999997,2009-05-16VillarrealReal Madrid
17/05/09,Ath Madrid,Valencia,1,0,H,2.1,3.35,3.3,2009-05-17,2008/2009,40,SP1,1-0,1,-1.1999999999999997,2009-05-17Ath MadridValencia
17/05/09,Betis,Almeria,2,0,H,1.6,3.6,5.6,2009-05-17,2008/2009,40,SP1,2-0,2,-3.9999999999999996,2009-05-17BetisAlmeria
17/05/09,Espanol,Ath Bilbao,1,0,H,1.65,3.5,5.3,2009-05-17,2008/2009,40,SP1,1-0,1,-3.65,2009-05-17EspanolAth Bilbao
17/05/09,Mallorca,Barcelona,2,1,H,4.9,3.5,1.7,2009-05-17,2008/2009,40,SP1,2-1,1,3.2,2009-05-17MallorcaBarcelona
17/05/09,Numancia,Recreativo,1,0,H,2.2,3.4,3.0,2009-05-17,2008/2009,40,SP1,1-0,1,-0.7999999999999998,2009-05-17NumanciaRecreativo
17/05/09,Santander,Valladolid,3,2,H,1.8,3.3,4.5,2009-05-17,2008/2009,40,SP1,3-2,1,-2.7,2009-05-17SantanderValladolid
17/05/09,Sp Gijon,Malaga,2,1,H,2.4,3.4,2.7,2009-05-17,2008/2009,40,SP1,2-1,1,-0.30000000000000027,2009-05-17Sp GijonMalaga
23/05/09,Almeria,Espanol,0,3,A,2.5,3.3,2.65,2009-05-23,2008/2009,41,SP1,0-3,-3,-0.1499999999999999,2009-05-23AlmeriaEspanol
23/05/09,Ath Bilbao,Ath Madrid,1,4,A,4.1,3.5,1.8,2009-05-23,2008/2009,41,SP1,1-4,-3,2.3,2009-05-23Ath BilbaoAth Madrid
23/05/09,Barcelona,Osasuna,0,1,A,1.9,3.5,3.5,2009-05-23,2008/2009,41,SP1,0-1,-1,-1.6,2009-05-23BarcelonaOsasuna
23/05/09,Getafe,Numancia,1,0,H,1.65,3.6,5.1,2009-05-23,2008/2009,41,SP1,1-0,1,-3.4499999999999997,2009-05-23GetafeNumancia
23/05/09,Malaga,Betis,1,1,D,2.4,3.2,2.85,2009-05-23,2008/2009,41,SP1,1-1,0,-0.4500000000000002,2009-05-23MalagaBetis
23/05/09,Recreativo,Santander,0,1,A,2.2,3.4,3.0,2009-05-23,2008/2009,41,SP1,0-1,-1,-0.7999999999999998,2009-05-23RecreativoSantander
23/05/09,Sevilla,La Coruna,1,0,H,1.7,3.6,4.7,2009-05-23,2008/2009,41,SP1,1-0,1,-3.0,2009-05-23SevillaLa Coruna
23/05/09,Valladolid,Sp Gijon,1,2,A,2.2,3.4,3.0,2009-05-23,2008/2009,41,SP1,1-2,-1,-0.7999999999999998,2009-05-23ValladolidSp Gijon
23/05/09,Villarreal,Valencia,3,1,H,2.3,3.3,2.9,2009-05-23,2008/2009,41,SP1,3-1,2,-0.6000000000000001,2009-05-23VillarrealValencia
24/05/09,Real Madrid,Mallorca,1,3,A,1.45,4.0,6.0,2009-05-24,2008/2009,42,SP1,1-3,-2,-4.55,2009-05-24Real MadridMallorca
30/05/09,Ath Madrid,Almeria,3,0,H,1.3,4.4,8.5,2009-05-30,2008/2009,42,SP1,3-0,3,-7.2,2009-05-30Ath MadridAlmeria
30/05/09,La Coruna,Barcelona,1,1,D,2.2,3.3,2.85,2009-05-30,2008/2009,42,SP1,1-1,0,-0.6499999999999999,2009-05-30La CorunaBarcelona
30/05/09,Mallorca,Villarreal,2,3,A,3.0,3.5,2.0,2009-05-30,2008/2009,42,SP1,2-3,-1,1.0,2009-05-30MallorcaVillarreal
30/05/09,Valencia,Ath Bilbao,2,0,H,1.35,4.2,7.5,2009-05-30,2008/2009,42,SP1,2-0,2,-6.15,2009-05-30ValenciaAth Bilbao
31/05/09,Betis,Valladolid,1,1,D,1.75,3.4,4.0,2009-05-31,2008/2009,42,SP1,1-1,0,-2.25,2009-05-31BetisValladolid
31/05/09,Espanol,Malaga,3,0,H,1.9,3.2,3.6,2009-05-31,2008/2009,42,SP1,3-0,3,-1.7000000000000002,2009-05-31EspanolMalaga
31/05/09,Numancia,Sevilla,0,2,A,3.6,3.2,1.9,2009-05-31,2008/2009,42,SP1,0-2,-2,1.7000000000000002,2009-05-31NumanciaSevilla
31/05/09,Osasuna,Real Madrid,2,1,H,1.7,3.6,3.9,2009-05-31,2008/2009,42,SP1,2-1,1,-2.2,2009-05-31OsasunaReal Madrid
