Date,HomeTeam,AwayTeam,FTHG,FTAG,FTR,IWH,IWD,IWA,datetime,season,game_day,league,result,goal_diff,odds_diff,game_id
18/08/17,Leganes,Alaves,1,0,H,2.1,3.4,3.5,2017-08-18,2017/2018,1,SP1,1-0,1,-1.4,2017-08-18LeganesAlaves
18/08/17,Valencia,Las Palmas,1,0,H,1.75,3.6,4.8,2017-08-18,2017/2018,1,SP1,1-0,1,-3.05,2017-08-18ValenciaLas Palmas
19/08/17,Celta,Sociedad,2,3,A,2.5,3.3,2.85,2017-08-19,2017/2018,1,SP1,2-3,-1,-0.3500000000000001,2017-08-19CeltaSociedad
19/08/17,Girona,Ath Madrid,2,2,D,7.2,4.4,1.45,2017-08-19,2017/2018,1,SP1,2-2,0,5.75,2017-08-19GironaAth Madrid
19/08/17,Sevilla,Espanol,1,1,D,1.55,4.0,6.2,2017-08-19,2017/2018,1,SP1,1-1,0,-4.65,2017-08-19SevillaEspanol
20/08/17,Ath Bilbao,Getafe,0,0,D,1.5,4.2,6.5,2017-08-20,2017/2018,1,SP1,0-0,0,-5.0,2017-08-20Ath BilbaoGetafe
20/08/17,Barcelona,Betis,2,0,H,1.17,7.5,15.0,2017-08-20,2017/2018,1,SP1,2-0,2,-13.83,2017-08-20BarcelonaBetis
20/08/17,La Coruna,Real Madrid,0,3,A,7.5,5.5,1.35,2017-08-20,2017/2018,1,SP1,0-3,-3,6.15,2017-08-20La CorunaReal Madrid
21/08/17,Levante,Villarreal,1,0,H,3.3,3.35,2.2,2017-08-21,2017/2018,1,SP1,1-0,1,1.0999999999999996,2017-08-21LevanteVillarreal
21/08/17,Malaga,Eibar,0,1,A,2.1,3.4,3.5,2017-08-21,2017/2018,2,SP1,0-1,-1,-1.4,2017-08-21MalagaEibar
25/08/17,Betis,Celta,2,1,H,2.4,3.3,2.95,2017-08-25,2017/2018,2,SP1,2-1,1,-0.5500000000000003,2017-08-25BetisCelta
25/08/17,Sociedad,Villarreal,3,0,H,2.2,3.35,3.3,2017-08-25,2017/2018,2,SP1,3-0,3,-1.0999999999999996,2017-08-25SociedadVillarreal
26/08/17,Alaves,Barcelona,0,2,A,8.0,5.5,1.33,2017-08-26,2017/2018,2,SP1,0-2,-2,6.67,2017-08-26AlavesBarcelona
26/08/17,Girona,Malaga,1,0,H,2.2,3.35,3.3,2017-08-26,2017/2018,2,SP1,1-0,1,-1.0999999999999996,2017-08-26GironaMalaga
26/08/17,Las Palmas,Ath Madrid,1,5,A,4.8,3.6,1.75,2017-08-26,2017/2018,2,SP1,1-5,-4,3.05,2017-08-26Las PalmasAth Madrid
26/08/17,Levante,La Coruna,2,2,D,2.2,3.35,3.3,2017-08-26,2017/2018,2,SP1,2-2,0,-1.0999999999999996,2017-08-26LevanteLa Coruna
27/08/17,Eibar,Ath Bilbao,0,1,A,2.7,3.3,2.6,2017-08-27,2017/2018,2,SP1,0-1,-1,0.10000000000000009,2017-08-27EibarAth Bilbao
27/08/17,Espanol,Leganes,0,1,A,2.0,3.4,3.8,2017-08-27,2017/2018,2,SP1,0-1,-1,-1.7999999999999998,2017-08-27EspanolLeganes
27/08/17,Getafe,Sevilla,0,1,A,3.3,3.35,2.2,2017-08-27,2017/2018,3,SP1,0-1,-1,1.0999999999999996,2017-08-27GetafeSevilla
27/08/17,Real Madrid,Valencia,2,2,D,1.17,7.5,15.0,2017-08-27,2017/2018,3,SP1,2-2,0,-13.83,2017-08-27Real MadridValencia
08/09/17,Leganes,Getafe,1,2,A,2.0,3.4,3.8,2017-09-08,2017/2018,3,SP1,1-2,-1,-1.7999999999999998,2017-09-08LeganesGetafe
09/09/17,Barcelona,Espanol,5,0,H,1.17,7.5,15.0,2017-09-09,2017/2018,3,SP1,5-0,5,-13.83,2017-09-09BarcelonaEspanol
09/09/17,Real Madrid,Levante,1,1,D,1.1,9.0,27.0,2017-09-09,2017/2018,3,SP1,1-1,0,-25.9,2017-09-09Real MadridLevante
09/09/17,Sevilla,Eibar,3,0,H,1.6,3.9,5.7,2017-09-09,2017/2018,3,SP1,3-0,3,-4.1,2017-09-09SevillaEibar
09/09/17,Valencia,Ath Madrid,0,0,D,3.3,3.35,2.2,2017-09-09,2017/2018,3,SP1,0-0,0,1.0999999999999996,2017-09-09ValenciaAth Madrid
10/09/17,Ath Bilbao,Girona,2,0,H,1.75,3.6,4.8,2017-09-10,2017/2018,3,SP1,2-0,2,-3.05,2017-09-10Ath BilbaoGirona
10/09/17,Celta,Alaves,1,0,H,1.8,3.6,4.5,2017-09-10,2017/2018,3,SP1,1-0,1,-2.7,2017-09-10CeltaAlaves
10/09/17,La Coruna,Sociedad,2,4,A,2.7,3.3,2.6,2017-09-10,2017/2018,4,SP1,2-4,-2,0.10000000000000009,2017-09-10La CorunaSociedad
10/09/17,Villarreal,Betis,3,1,H,1.8,3.6,4.5,2017-09-10,2017/2018,4,SP1,3-1,2,-2.7,2017-09-10VillarrealBetis
11/09/17,Malaga,Las Palmas,1,3,A,1.9,3.5,4.1,2017-09-11,2017/2018,4,SP1,1-3,-2,-2.1999999999999997,2017-09-11MalagaLas Palmas
15/09/17,Eibar,Leganes,1,0,H,2.1,3.4,3.5,2017-09-15,2017/2018,4,SP1,1-0,1,-1.4,2017-09-15EibarLeganes
16/09/17,Ath Madrid,Malaga,1,0,H,1.3,5.8,9.0,2017-09-16,2017/2018,4,SP1,1-0,1,-7.7,2017-09-16Ath MadridMalaga
16/09/17,Betis,La Coruna,2,1,H,1.85,3.5,4.3,2017-09-16,2017/2018,4,SP1,2-1,1,-2.4499999999999997,2017-09-16BetisLa Coruna
16/09/17,Getafe,Barcelona,1,2,A,9.0,5.8,1.3,2017-09-16,2017/2018,4,SP1,1-2,-1,7.7,2017-09-16GetafeBarcelona
16/09/17,Levante,Valencia,1,1,D,3.15,3.3,2.3,2017-09-16,2017/2018,4,SP1,1-1,0,0.8500000000000001,2017-09-16LevanteValencia
17/09/17,Alaves,Villarreal,0,3,A,2.65,3.3,2.65,2017-09-17,2017/2018,4,SP1,0-3,-3,0.0,2017-09-17AlavesVillarreal
17/09/17,Girona,Sevilla,0,1,A,3.25,3.4,2.2,2017-09-17,2017/2018,5,SP1,0-1,-1,1.0499999999999998,2017-09-17GironaSevilla
17/09/17,Las Palmas,Ath Bilbao,1,0,H,2.95,3.3,2.4,2017-09-17,2017/2018,5,SP1,1-0,1,0.5500000000000003,2017-09-17Las PalmasAth Bilbao
17/09/17,Sociedad,Real Madrid,1,3,A,5.0,4.0,1.65,2017-09-17,2017/2018,5,SP1,1-3,-2,3.35,2017-09-17SociedadReal Madrid
18/09/17,Espanol,Celta,2,1,H,2.3,3.3,3.15,2017-09-18,2017/2018,5,SP1,2-1,1,-0.8500000000000001,2017-09-18EspanolCelta
19/09/17,Barcelona,Eibar,6,1,H,1.1,9.0,27.0,2017-09-19,2017/2018,5,SP1,6-1,5,-25.9,2017-09-19BarcelonaEibar
19/09/17,Valencia,Malaga,5,0,H,1.6,4.0,5.5,2017-09-19,2017/2018,5,SP1,5-0,5,-3.9,2017-09-19ValenciaMalaga
20/09/17,Ath Bilbao,Ath Madrid,1,2,A,3.15,3.3,2.3,2017-09-20,2017/2018,5,SP1,1-2,-1,0.8500000000000001,2017-09-20Ath BilbaoAth Madrid
20/09/17,La Coruna,Alaves,1,0,H,1.9,3.5,4.1,2017-09-20,2017/2018,5,SP1,1-0,1,-2.1999999999999997,2017-09-20La CorunaAlaves
20/09/17,Leganes,Girona,0,0,D,2.2,3.25,3.4,2017-09-20,2017/2018,5,SP1,0-0,0,-1.1999999999999997,2017-09-20LeganesGirona
20/09/17,Real Madrid,Betis,0,1,A,1.1,9.0,27.0,2017-09-20,2017/2018,6,SP1,0-1,-1,-25.9,2017-09-20Real MadridBetis
20/09/17,Sevilla,Las Palmas,1,0,H,1.45,4.4,7.2,2017-09-20,2017/2018,6,SP1,1-0,1,-5.75,2017-09-20SevillaLas Palmas
21/09/17,Celta,Getafe,1,1,D,1.75,3.6,4.8,2017-09-21,2017/2018,6,SP1,1-1,0,-3.05,2017-09-21CeltaGetafe
21/09/17,Levante,Sociedad,3,0,H,2.95,3.3,2.4,2017-09-21,2017/2018,6,SP1,3-0,3,0.5500000000000003,2017-09-21LevanteSociedad
21/09/17,Villarreal,Espanol,0,0,D,1.7,3.7,5.0,2017-09-21,2017/2018,6,SP1,0-0,0,-3.3,2017-09-21VillarrealEspanol
23/09/17,Alaves,Real Madrid,1,2,A,13.0,7.0,1.2,2017-09-23,2017/2018,6,SP1,1-2,-1,11.8,2017-09-23AlavesReal Madrid
23/09/17,Ath Madrid,Sevilla,2,0,H,1.65,4.0,5.0,2017-09-23,2017/2018,6,SP1,2-0,2,-3.35,2017-09-23Ath MadridSevilla
23/09/17,Girona,Barcelona,0,3,A,15.0,6.5,1.2,2017-09-23,2017/2018,6,SP1,0-3,-3,13.8,2017-09-23GironaBarcelona
23/09/17,Malaga,Ath Bilbao,3,3,D,3.3,3.35,2.2,2017-09-23,2017/2018,6,SP1,3-3,0,1.0999999999999996,2017-09-23MalagaAth Bilbao
24/09/17,Eibar,Celta,0,4,A,2.3,3.3,3.15,2017-09-24,2017/2018,7,SP1,0-4,-4,-0.8500000000000001,2017-09-24EibarCelta
24/09/17,Espanol,La Coruna,4,1,H,2.0,3.4,3.8,2017-09-24,2017/2018,7,SP1,4-1,3,-1.7999999999999998,2017-09-24EspanolLa Coruna
24/09/17,Getafe,Villarreal,4,0,H,2.95,3.3,2.4,2017-09-24,2017/2018,7,SP1,4-0,4,0.5500000000000003,2017-09-24GetafeVillarreal
24/09/17,Las Palmas,Leganes,0,2,A,2.0,3.4,3.8,2017-09-24,2017/2018,7,SP1,0-2,-2,-1.7999999999999998,2017-09-24Las PalmasLeganes
24/09/17,Sociedad,Valencia,2,3,A,2.2,3.4,3.25,2017-09-24,2017/2018,7,SP1,2-3,-1,-1.0499999999999998,2017-09-24SociedadValencia
25/09/17,Betis,Levante,4,0,H,1.9,3.5,4.1,2017-09-25,2017/2018,7,SP1,4-0,4,-2.1999999999999997,2017-09-25BetisLevante
29/09/17,Celta,Girona,3,3,D,1.65,3.8,5.3,2017-09-29,2017/2018,7,SP1,3-3,0,-3.65,2017-09-29CeltaGirona
30/09/17,La Coruna,Getafe,2,1,H,2.3,3.3,3.15,2017-09-30,2017/2018,7,SP1,2-1,1,-0.8500000000000001,2017-09-30La CorunaGetafe
30/09/17,Leganes,Ath Madrid,0,0,D,6.5,4.2,1.5,2017-09-30,2017/2018,7,SP1,0-0,0,5.0,2017-09-30LeganesAth Madrid
30/09/17,Levante,Alaves,0,2,A,1.75,3.6,4.8,2017-09-30,2017/2018,8,SP1,0-2,-2,-3.05,2017-09-30LevanteAlaves
30/09/17,Sevilla,Malaga,2,0,H,1.35,5.3,8.0,2017-09-30,2017/2018,8,SP1,2-0,2,-6.65,2017-09-30SevillaMalaga
01/10/17,Barcelona,Las Palmas,3,0,H,1.07,12.0,26.0,2017-10-01,2017/2018,8,SP1,3-0,3,-24.93,2017-10-01BarcelonaLas Palmas
01/10/17,Real Madrid,Espanol,2,0,H,1.1,9.0,27.0,2017-10-01,2017/2018,8,SP1,2-0,2,-25.9,2017-10-01Real MadridEspanol
01/10/17,Sociedad,Betis,4,4,D,1.9,3.5,4.1,2017-10-01,2017/2018,8,SP1,4-4,0,-2.1999999999999997,2017-10-01SociedadBetis
01/10/17,Valencia,Ath Bilbao,3,2,H,1.75,3.6,4.8,2017-10-01,2017/2018,8,SP1,3-2,1,-3.05,2017-10-01ValenciaAth Bilbao
01/10/17,Villarreal,Eibar,3,0,H,1.8,3.6,4.5,2017-10-01,2017/2018,8,SP1,3-0,3,-2.7,2017-10-01VillarrealEibar
13/10/17,Espanol,Levante,0,0,D,1.9,3.5,4.1,2017-10-13,2017/2018,8,SP1,0-0,0,-2.1999999999999997,2017-10-13EspanolLevante
14/10/17,Alaves,Sociedad,0,2,A,2.95,3.3,2.4,2017-10-14,2017/2018,8,SP1,0-2,-2,0.5500000000000003,2017-10-14AlavesSociedad
14/10/17,Ath Bilbao,Sevilla,1,0,H,2.5,3.3,2.85,2017-10-14,2017/2018,9,SP1,1-0,1,-0.3500000000000001,2017-10-14Ath BilbaoSevilla
14/10/17,Ath Madrid,Barcelona,1,1,D,2.95,3.3,2.4,2017-10-14,2017/2018,9,SP1,1-1,0,0.5500000000000003,2017-10-14Ath MadridBarcelona
14/10/17,Getafe,Real Madrid,1,2,A,11.0,6.0,1.25,2017-10-14,2017/2018,9,SP1,1-2,-1,9.75,2017-10-14GetafeReal Madrid
15/10/17,Betis,Valencia,3,6,A,2.65,3.3,2.65,2017-10-15,2017/2018,9,SP1,3-6,-3,0.0,2017-10-15BetisValencia
15/10/17,Eibar,La Coruna,0,0,D,2.1,3.4,3.5,2017-10-15,2017/2018,9,SP1,0-0,0,-1.4,2017-10-15EibarLa Coruna
15/10/17,Girona,Villarreal,1,2,A,2.65,3.3,2.65,2017-10-15,2017/2018,9,SP1,1-2,-1,0.0,2017-10-15GironaVillarreal
15/10/17,Malaga,Leganes,0,2,A,2.4,3.3,2.95,2017-10-15,2017/2018,9,SP1,0-2,-2,-0.5500000000000003,2017-10-15MalagaLeganes
16/10/17,Las Palmas,Celta,2,5,A,2.5,3.3,2.85,2017-10-16,2017/2018,9,SP1,2-5,-3,-0.3500000000000001,2017-10-16Las PalmasCelta
21/10/17,Barcelona,Malaga,2,0,H,1.07,12.0,26.0,2017-10-21,2017/2018,9,SP1,2-0,2,-24.93,2017-10-21BarcelonaMalaga
21/10/17,Betis,Alaves,2,0,H,1.65,3.8,5.3,2017-10-21,2017/2018,10,SP1,2-0,2,-3.65,2017-10-21BetisAlaves
21/10/17,Levante,Getafe,1,1,D,2.4,3.3,2.95,2017-10-21,2017/2018,10,SP1,1-1,0,-0.5500000000000003,2017-10-21LevanteGetafe
21/10/17,Valencia,Sevilla,4,0,H,1.85,3.5,4.3,2017-10-21,2017/2018,10,SP1,4-0,4,-2.4499999999999997,2017-10-21ValenciaSevilla
22/10/17,Celta,Ath Madrid,0,1,A,4.1,3.5,1.9,2017-10-22,2017/2018,10,SP1,0-1,-1,2.1999999999999997,2017-10-22CeltaAth Madrid
22/10/17,Leganes,Ath Bilbao,1,0,H,2.5,3.3,2.85,2017-10-22,2017/2018,10,SP1,1-0,1,-0.3500000000000001,2017-10-22LeganesAth Bilbao
22/10/17,Real Madrid,Eibar,3,0,H,1.1,9.0,27.0,2017-10-22,2017/2018,10,SP1,3-0,3,-25.9,2017-10-22Real MadridEibar
22/10/17,Villarreal,Las Palmas,4,0,H,1.55,4.0,6.2,2017-10-22,2017/2018,10,SP1,4-0,4,-4.65,2017-10-22VillarrealLas Palmas
23/10/17,La Coruna,Girona,1,2,A,1.9,3.5,4.1,2017-10-23,2017/2018,10,SP1,1-2,-1,-2.1999999999999997,2017-10-23La CorunaGirona
23/10/17,Sociedad,Espanol,1,1,D,1.8,3.6,4.5,2017-10-23,2017/2018,10,SP1,1-1,0,-2.7,2017-10-23SociedadEspanol
28/10/17,Alaves,Valencia,1,2,A,5.7,3.9,1.6,2017-10-28,2017/2018,11,SP1,1-2,-1,4.1,2017-10-28AlavesValencia
28/10/17,Ath Bilbao,Barcelona,0,2,A,6.5,4.2,1.5,2017-10-28,2017/2018,11,SP1,0-2,-2,5.0,2017-10-28Ath BilbaoBarcelona
28/10/17,Ath Madrid,Villarreal,1,1,D,1.5,4.2,6.5,2017-10-28,2017/2018,11,SP1,1-1,0,-5.0,2017-10-28Ath MadridVillarreal
28/10/17,Sevilla,Leganes,2,1,H,1.6,4.0,5.5,2017-10-28,2017/2018,11,SP1,2-1,1,-3.9,2017-10-28SevillaLeganes
29/10/17,Eibar,Levante,2,2,D,2.1,3.4,3.5,2017-10-29,2017/2018,11,SP1,2-2,0,-1.4,2017-10-29EibarLevante
29/10/17,Getafe,Sociedad,2,1,H,2.6,3.25,2.75,2017-10-29,2017/2018,11,SP1,2-1,1,-0.1499999999999999,2017-10-29GetafeSociedad
29/10/17,Girona,Real Madrid,2,1,H,15.0,6.5,1.2,2017-10-29,2017/2018,11,SP1,2-1,1,13.8,2017-10-29GironaReal Madrid
29/10/17,Malaga,Celta,2,1,H,2.9,3.4,2.4,2017-10-29,2017/2018,11,SP1,2-1,1,0.5,2017-10-29MalagaCelta
30/10/17,Espanol,Betis,1,0,H,2.1,3.4,3.5,2017-10-30,2017/2018,11,SP1,1-0,1,-1.4,2017-10-30EspanolBetis
30/10/17,Las Palmas,La Coruna,1,3,A,2.2,3.35,3.3,2017-10-30,2017/2018,12,SP1,1-3,-2,-1.0999999999999996,2017-10-30Las PalmasLa Coruna
03/11/17,Betis,Getafe,2,2,D,2.0,3.4,3.8,2017-11-03,2017/2018,12,SP1,2-2,0,-1.7999999999999998,2017-11-03BetisGetafe
04/11/17,Alaves,Espanol,1,0,H,2.65,3.3,2.65,2017-11-04,2017/2018,12,SP1,1-0,1,0.0,2017-11-04AlavesEspanol
04/11/17,Barcelona,Sevilla,2,1,H,1.22,7.0,11.0,2017-11-04,2017/2018,12,SP1,2-1,1,-9.78,2017-11-04BarcelonaSevilla
04/11/17,La Coruna,Ath Madrid,0,1,A,4.7,3.9,1.7,2017-11-04,2017/2018,12,SP1,0-1,-1,3.0,2017-11-04La CorunaAth Madrid
04/11/17,Valencia,Leganes,3,0,H,1.45,4.5,7.0,2017-11-04,2017/2018,12,SP1,3-0,3,-5.55,2017-11-04ValenciaLeganes
05/11/17,Celta,Ath Bilbao,3,1,H,2.2,3.35,3.3,2017-11-05,2017/2018,12,SP1,3-1,2,-1.0999999999999996,2017-11-05CeltaAth Bilbao
05/11/17,Levante,Girona,1,2,A,2.2,3.35,3.3,2017-11-05,2017/2018,12,SP1,1-2,-1,-1.0999999999999996,2017-11-05LevanteGirona
05/11/17,Real Madrid,Las Palmas,3,0,H,1.07,12.0,26.0,2017-11-05,2017/2018,12,SP1,3-0,3,-24.93,2017-11-05Real MadridLas Palmas
05/11/17,Sociedad,Eibar,3,1,H,1.6,4.0,5.5,2017-11-05,2017/2018,13,SP1,3-1,2,-3.9,2017-11-05SociedadEibar
05/11/17,Villarreal,Malaga,2,0,H,1.45,4.4,7.2,2017-11-05,2017/2018,13,SP1,2-0,2,-5.75,2017-11-05VillarrealMalaga
17/11/17,Girona,Sociedad,1,1,D,2.6,3.3,2.7,2017-11-17,2017/2018,13,SP1,1-1,0,-0.10000000000000009,2017-11-17GironaSociedad
18/11/17,Ath Madrid,Real Madrid,0,0,D,2.95,3.3,2.4,2017-11-18,2017/2018,13,SP1,0-0,0,0.5500000000000003,2017-11-18Ath MadridReal Madrid
18/11/17,Getafe,Alaves,4,1,H,1.75,3.6,4.8,2017-11-18,2017/2018,13,SP1,4-1,3,-3.05,2017-11-18GetafeAlaves
18/11/17,Leganes,Barcelona,0,3,A,9.5,5.5,1.3,2017-11-18,2017/2018,13,SP1,0-3,-3,8.2,2017-11-18LeganesBarcelona
18/11/17,Sevilla,Celta,2,1,H,1.8,3.6,4.5,2017-11-18,2017/2018,13,SP1,2-1,1,-2.7,2017-11-18SevillaCelta
19/11/17,Ath Bilbao,Villarreal,1,1,D,2.3,3.3,3.15,2017-11-19,2017/2018,13,SP1,1-1,0,-0.8500000000000001,2017-11-19Ath BilbaoVillarreal
19/11/17,Espanol,Valencia,0,2,A,3.5,3.4,2.1,2017-11-19,2017/2018,13,SP1,0-2,-2,1.4,2017-11-19EspanolValencia
19/11/17,Las Palmas,Levante,0,2,A,2.0,3.4,3.8,2017-11-19,2017/2018,14,SP1,0-2,-2,-1.7999999999999998,2017-11-19Las PalmasLevante
19/11/17,Malaga,La Coruna,3,2,H,2.2,3.35,3.3,2017-11-19,2017/2018,14,SP1,3-2,1,-1.0999999999999996,2017-11-19MalagaLa Coruna
20/11/17,Eibar,Betis,5,0,H,2.4,3.3,2.95,2017-11-20,2017/2018,14,SP1,5-0,5,-0.5500000000000003,2017-11-20EibarBetis
24/11/17,Celta,Leganes,1,0,H,1.9,3.5,4.1,2017-11-24,2017/2018,14,SP1,1-0,1,-2.1999999999999997,2017-11-24CeltaLeganes
25/11/17,Alaves,Eibar,1,2,A,2.5,3.2,2.9,2017-11-25,2017/2018,14,SP1,1-2,-1,-0.3999999999999999,2017-11-25AlavesEibar
25/11/17,Betis,Girona,2,2,D,2.0,3.4,3.8,2017-11-25,2017/2018,14,SP1,2-2,0,-1.7999999999999998,2017-11-25BetisGirona
25/11/17,Levante,Ath Madrid,0,5,A,5.7,3.9,1.6,2017-11-25,2017/2018,14,SP1,0-5,-5,4.1,2017-11-25LevanteAth Madrid
25/11/17,Real Madrid,Malaga,3,2,H,1.1,9.0,27.0,2017-11-25,2017/2018,14,SP1,3-2,1,-25.9,2017-11-25Real MadridMalaga
26/11/17,La Coruna,Ath Bilbao,2,2,D,2.6,3.25,2.75,2017-11-26,2017/2018,14,SP1,2-2,0,-0.1499999999999999,2017-11-26La CorunaAth Bilbao
26/11/17,Sociedad,Las Palmas,2,2,D,1.45,4.5,7.0,2017-11-26,2017/2018,15,SP1,2-2,0,-5.55,2017-11-26SociedadLas Palmas
26/11/17,Valencia,Barcelona,1,1,D,3.6,3.6,2.0,2017-11-26,2017/2018,15,SP1,1-1,0,1.6,2017-11-26ValenciaBarcelona
26/11/17,Villarreal,Sevilla,2,3,A,2.4,3.3,2.95,2017-11-26,2017/2018,15,SP1,2-3,-1,-0.5500000000000003,2017-11-26VillarrealSevilla
27/11/17,Espanol,Getafe,1,0,H,2.2,3.2,3.5,2017-11-27,2017/2018,15,SP1,1-0,1,-1.2999999999999998,2017-11-27EspanolGetafe
01/12/17,Malaga,Levante,0,0,D,1.85,3.5,4.3,2017-12-01,2017/2018,15,SP1,0-0,0,-2.4499999999999997,2017-12-01MalagaLevante
02/12/17,Ath Bilbao,Real Madrid,0,0,D,6.0,4.5,1.5,2017-12-02,2017/2018,15,SP1,0-0,0,4.5,2017-12-02Ath BilbaoReal Madrid
02/12/17,Ath Madrid,Sociedad,2,1,H,1.5,4.2,6.5,2017-12-02,2017/2018,15,SP1,2-1,1,-5.0,2017-12-02Ath MadridSociedad
02/12/17,Barcelona,Celta,2,2,D,1.15,8.0,16.0,2017-12-02,2017/2018,15,SP1,2-2,0,-14.85,2017-12-02BarcelonaCelta
02/12/17,Sevilla,La Coruna,2,0,H,1.4,4.8,7.5,2017-12-02,2017/2018,15,SP1,2-0,2,-6.1,2017-12-02SevillaLa Coruna
03/12/17,Eibar,Espanol,3,1,H,2.4,3.3,2.95,2017-12-03,2017/2018,16,SP1,3-1,2,-0.5500000000000003,2017-12-03EibarEspanol
03/12/17,Getafe,Valencia,1,0,H,3.15,3.3,2.3,2017-12-03,2017/2018,16,SP1,1-0,1,0.8500000000000001,2017-12-03GetafeValencia
03/12/17,Las Palmas,Betis,1,0,H,2.2,3.35,3.3,2017-12-03,2017/2018,16,SP1,1-0,1,-1.0999999999999996,2017-12-03Las PalmasBetis
03/12/17,Leganes,Villarreal,3,1,H,2.7,3.3,2.6,2017-12-03,2017/2018,16,SP1,3-1,2,0.10000000000000009,2017-12-03LeganesVillarreal
04/12/17,Girona,Alaves,2,3,A,1.7,3.7,5.0,2017-12-04,2017/2018,16,SP1,2-3,-1,-3.3,2017-12-04GironaAlaves
08/12/17,Alaves,Las Palmas,2,0,H,2.3,3.3,3.15,2017-12-08,2017/2018,16,SP1,2-0,2,-0.8500000000000001,2017-12-08AlavesLas Palmas
09/12/17,Getafe,Eibar,0,0,D,2.0,3.4,3.8,2017-12-09,2017/2018,16,SP1,0-0,0,-1.7999999999999998,2017-12-09GetafeEibar
09/12/17,La Coruna,Leganes,1,0,H,2.3,3.3,3.15,2017-12-09,2017/2018,16,SP1,1-0,1,-0.8500000000000001,2017-12-09La CorunaLeganes
09/12/17,Real Madrid,Sevilla,5,0,H,1.35,5.3,8.0,2017-12-09,2017/2018,16,SP1,5-0,5,-6.65,2017-12-09Real MadridSevilla
09/12/17,Valencia,Celta,2,1,H,1.65,4.0,5.0,2017-12-09,2017/2018,17,SP1,2-1,1,-3.35,2017-12-09ValenciaCelta
10/12/17,Betis,Ath Madrid,0,1,A,5.0,3.7,1.7,2017-12-10,2017/2018,17,SP1,0-1,-1,3.3,2017-12-10BetisAth Madrid
10/12/17,Levante,Ath Bilbao,1,2,A,2.95,3.3,2.4,2017-12-10,2017/2018,17,SP1,1-2,-1,0.5500000000000003,2017-12-10LevanteAth Bilbao
10/12/17,Sociedad,Malaga,0,2,A,1.6,4.0,5.5,2017-12-10,2017/2018,17,SP1,0-2,-2,-3.9,2017-12-10SociedadMalaga
10/12/17,Villarreal,Barcelona,0,2,A,6.0,4.5,1.5,2017-12-10,2017/2018,17,SP1,0-2,-2,4.5,2017-12-10VillarrealBarcelona
11/12/17,Espanol,Girona,0,1,A,2.05,3.3,3.8,2017-12-11,2017/2018,17,SP1,0-1,-1,-1.75,2017-12-11EspanolGirona
15/12/17,Sevilla,Levante,0,0,D,1.3,5.5,9.5,2017-12-15,2017/2018,17,SP1,0-0,0,-8.2,2017-12-15SevillaLevante
16/12/17,Ath Bilbao,Sociedad,0,0,D,2.1,3.3,3.6,2017-12-16,2017/2018,17,SP1,0-0,0,-1.5,2017-12-16Ath BilbaoSociedad
16/12/17,Ath Madrid,Alaves,1,0,H,1.25,6.0,11.0,2017-12-16,2017/2018,17,SP1,1-0,1,-9.75,2017-12-16Ath MadridAlaves
16/12/17,Eibar,Valencia,2,1,H,3.15,3.3,2.3,2017-12-16,2017/2018,18,SP1,2-1,1,0.8500000000000001,2017-12-16EibarValencia
17/12/17,Barcelona,La Coruna,4,0,H,1.1,9.0,27.0,2017-12-17,2017/2018,18,SP1,4-0,4,-25.9,2017-12-17BarcelonaLa Coruna
17/12/17,Celta,Villarreal,0,1,A,2.2,3.35,3.3,2017-12-17,2017/2018,18,SP1,0-1,-1,-1.0999999999999996,2017-12-17CeltaVillarreal
17/12/17,Girona,Getafe,1,0,H,2.2,3.2,3.5,2017-12-17,2017/2018,18,SP1,1-0,1,-1.2999999999999998,2017-12-17GironaGetafe
17/12/17,Las Palmas,Espanol,2,2,D,2.4,3.2,3.05,2017-12-17,2017/2018,18,SP1,2-2,0,-0.6499999999999999,2017-12-17Las PalmasEspanol
18/12/17,Malaga,Betis,0,2,A,2.1,3.4,3.5,2017-12-18,2017/2018,18,SP1,0-2,-2,-1.4,2017-12-18MalagaBetis
19/12/17,Levante,Leganes,0,0,D,2.6,3.25,2.75,2017-12-19,2017/2018,18,SP1,0-0,0,-0.1499999999999999,2017-12-19LevanteLeganes
20/12/17,Getafe,Las Palmas,2,0,H,1.75,3.6,4.8,2017-12-20,2017/2018,18,SP1,2-0,2,-3.05,2017-12-20GetafeLas Palmas
20/12/17,Sociedad,Sevilla,3,1,H,2.3,3.3,3.15,2017-12-20,2017/2018,18,SP1,3-1,2,-0.8500000000000001,2017-12-20SociedadSevilla
21/12/17,Alaves,Malaga,1,0,H,2.2,3.35,3.3,2017-12-21,2017/2018,19,SP1,1-0,1,-1.0999999999999996,2017-12-21AlavesMalaga
21/12/17,Eibar,Girona,4,1,H,2.1,3.4,3.5,2017-12-21,2017/2018,19,SP1,4-1,3,-1.4,2017-12-21EibarGirona
22/12/17,Betis,Ath Bilbao,0,2,A,2.75,3.25,2.6,2017-12-22,2017/2018,19,SP1,0-2,-2,0.1499999999999999,2017-12-22BetisAth Bilbao
22/12/17,Espanol,Ath Madrid,1,0,H,4.8,3.6,1.75,2017-12-22,2017/2018,19,SP1,1-0,1,3.05,2017-12-22EspanolAth Madrid
23/12/17,La Coruna,Celta,1,3,A,2.6,3.25,2.75,2017-12-23,2017/2018,19,SP1,1-3,-2,-0.1499999999999999,2017-12-23La CorunaCelta
23/12/17,Real Madrid,Barcelona,0,3,A,2.2,3.7,3.05,2017-12-23,2017/2018,19,SP1,0-3,-3,-0.8499999999999996,2017-12-23Real MadridBarcelona
23/12/17,Valencia,Villarreal,0,1,A,2.0,3.4,3.8,2017-12-23,2017/2018,19,SP1,0-1,-1,-1.7999999999999998,2017-12-23ValenciaVillarreal
06/01/18,Ath Madrid,Getafe,2,0,H,1.4,4.6,8.0,2018-01-06,2017/2018,19,SP1,2-0,2,-6.6,2018-01-06Ath MadridGetafe
06/01/18,Las Palmas,Eibar,1,2,A,2.55,3.3,2.77,2018-01-06,2017/2018,19,SP1,1-2,-1,-0.2200000000000002,2018-01-06Las PalmasEibar
06/01/18,Sevilla,Betis,3,5,A,1.55,4.0,6.2,2018-01-06,2017/2018,20,SP1,3-5,-2,-4.65,2018-01-06SevillaBetis
06/01/18,Valencia,Girona,2,1,H,1.65,3.8,5.3,2018-01-06,2017/2018,20,SP1,2-1,1,-3.65,2018-01-06ValenciaGirona
07/01/18,Ath Bilbao,Alaves,2,0,H,1.6,4.0,5.5,2018-01-07,2017/2018,20,SP1,2-0,2,-3.9,2018-01-07Ath BilbaoAlaves
07/01/18,Barcelona,Levante,3,0,H,1.07,12.0,26.0,2018-01-07,2017/2018,20,SP1,3-0,3,-24.93,2018-01-07BarcelonaLevante
07/01/18,Celta,Real Madrid,2,2,D,6.0,4.5,1.5,2018-01-07,2017/2018,20,SP1,2-2,0,4.5,2018-01-07CeltaReal Madrid
07/01/18,Leganes,Sociedad,1,0,H,2.75,3.25,2.6,2018-01-07,2017/2018,20,SP1,1-0,1,0.1499999999999999,2018-01-07LeganesSociedad
07/01/18,Villarreal,La Coruna,1,1,D,1.55,4.0,6.2,2018-01-07,2017/2018,20,SP1,1-1,0,-4.65,2018-01-07VillarrealLa Coruna
08/01/18,Malaga,Espanol,0,1,A,2.5,3.1,3.0,2018-01-08,2017/2018,20,SP1,0-1,-1,-0.5,2018-01-08MalagaEspanol
12/01/18,Getafe,Malaga,1,0,H,1.85,3.5,4.3,2018-01-12,2017/2018,20,SP1,1-0,1,-2.4499999999999997,2018-01-12GetafeMalaga
13/01/18,Eibar,Ath Madrid,0,1,A,4.1,3.5,1.9,2018-01-13,2017/2018,21,SP1,0-1,-1,2.1999999999999997,2018-01-13EibarAth Madrid
13/01/18,Girona,Las Palmas,6,0,H,1.8,3.6,4.5,2018-01-13,2017/2018,21,SP1,6-0,6,-2.7,2018-01-13GironaLas Palmas
13/01/18,La Coruna,Valencia,1,2,A,3.3,3.35,2.2,2018-01-13,2017/2018,21,SP1,1-2,-1,1.0999999999999996,2018-01-13La CorunaValencia
13/01/18,Real Madrid,Villarreal,0,1,A,1.3,5.5,9.5,2018-01-13,2017/2018,21,SP1,0-1,-1,-8.2,2018-01-13Real MadridVillarreal
14/01/18,Alaves,Sevilla,1,0,H,3.3,3.35,2.2,2018-01-14,2017/2018,21,SP1,1-0,1,1.0999999999999996,2018-01-14AlavesSevilla
14/01/18,Espanol,Ath Bilbao,1,1,D,2.6,3.2,2.8,2018-01-14,2017/2018,21,SP1,1-1,0,-0.19999999999999973,2018-01-14EspanolAth Bilbao
14/01/18,Levante,Celta,0,1,A,2.7,3.3,2.6,2018-01-14,2017/2018,21,SP1,0-1,-1,0.10000000000000009,2018-01-14LevanteCelta
14/01/18,Sociedad,Barcelona,2,4,A,7.2,5.0,1.4,2018-01-14,2017/2018,21,SP1,2-4,-2,5.800000000000001,2018-01-14SociedadBarcelona
15/01/18,Betis,Leganes,3,2,H,2.2,3.25,3.4,2018-01-15,2017/2018,21,SP1,3-2,1,-1.1999999999999997,2018-01-15BetisLeganes
19/01/18,Getafe,Ath Bilbao,2,2,D,2.6,3.2,2.8,2018-01-19,2017/2018,22,SP1,2-2,0,-0.19999999999999973,2018-01-19GetafeAth Bilbao
20/01/18,Ath Madrid,Girona,1,1,D,1.35,5.0,8.5,2018-01-20,2017/2018,22,SP1,1-1,0,-7.15,2018-01-20Ath MadridGirona
20/01/18,Espanol,Sevilla,0,3,A,2.75,3.25,2.6,2018-01-20,2017/2018,22,SP1,0-3,-3,0.1499999999999999,2018-01-20EspanolSevilla
20/01/18,Las Palmas,Valencia,2,1,H,4.8,3.6,1.75,2018-01-20,2017/2018,22,SP1,2-1,1,3.05,2018-01-20Las PalmasValencia
20/01/18,Villarreal,Levante,2,1,H,1.45,4.4,7.2,2018-01-20,2017/2018,22,SP1,2-1,1,-5.75,2018-01-20VillarrealLevante
21/01/18,Alaves,Leganes,2,2,D,2.2,3.35,3.3,2018-01-21,2017/2018,22,SP1,2-2,0,-1.0999999999999996,2018-01-21AlavesLeganes
21/01/18,Betis,Barcelona,0,5,A,9.5,5.5,1.3,2018-01-21,2017/2018,22,SP1,0-5,-5,8.2,2018-01-21BetisBarcelona
21/01/18,Real Madrid,La Coruna,7,1,H,1.12,9.0,20.0,2018-01-21,2017/2018,22,SP1,7-1,6,-18.88,2018-01-21Real MadridLa Coruna
21/01/18,Sociedad,Celta,1,2,A,2.2,3.35,3.3,2018-01-21,2017/2018,22,SP1,1-2,-1,-1.0999999999999996,2018-01-21SociedadCelta
22/01/18,Eibar,Malaga,1,1,D,1.75,3.7,4.7,2018-01-22,2017/2018,23,SP1,1-1,0,-2.95,2018-01-22EibarMalaga
26/01/18,Ath Bilbao,Eibar,1,1,D,1.9,3.5,4.1,2018-01-26,2017/2018,23,SP1,1-1,0,-2.1999999999999997,2018-01-26Ath BilbaoEibar
27/01/18,La Coruna,Levante,2,2,D,2.0,3.4,3.8,2018-01-27,2017/2018,23,SP1,2-2,0,-1.7999999999999998,2018-01-27La CorunaLevante
27/01/18,Malaga,Girona,0,0,D,2.6,3.2,2.8,2018-01-27,2017/2018,23,SP1,0-0,0,-0.19999999999999973,2018-01-27MalagaGirona
27/01/18,Valencia,Real Madrid,1,4,A,4.2,4.2,1.75,2018-01-27,2017/2018,23,SP1,1-4,-3,2.45,2018-01-27ValenciaReal Madrid
27/01/18,Villarreal,Sociedad,4,2,H,1.9,3.5,4.1,2018-01-27,2017/2018,23,SP1,4-2,2,-2.1999999999999997,2018-01-27VillarrealSociedad
28/01/18,Ath Madrid,Las Palmas,3,0,H,1.2,6.5,15.0,2018-01-28,2017/2018,23,SP1,3-0,3,-13.8,2018-01-28Ath MadridLas Palmas
28/01/18,Barcelona,Alaves,2,1,H,1.1,9.0,27.0,2018-01-28,2017/2018,23,SP1,2-1,1,-25.9,2018-01-28BarcelonaAlaves
28/01/18,Leganes,Espanol,3,2,H,2.6,3.15,2.85,2018-01-28,2017/2018,23,SP1,3-2,1,-0.25,2018-01-28LeganesEspanol
28/01/18,Sevilla,Getafe,1,1,D,1.55,4.0,6.2,2018-01-28,2017/2018,24,SP1,1-1,0,-4.65,2018-01-28SevillaGetafe
29/01/18,Celta,Betis,3,2,H,1.75,3.6,4.8,2018-01-29,2017/2018,24,SP1,3-2,1,-3.05,2018-01-29CeltaBetis
02/02/18,Sociedad,La Coruna,5,0,H,1.7,3.9,4.7,2018-02-02,2017/2018,24,SP1,5-0,5,-3.0,2018-02-02SociedadLa Coruna
03/02/18,Alaves,Celta,2,1,H,2.65,3.3,2.65,2018-02-03,2017/2018,24,SP1,2-1,1,0.0,2018-02-03AlavesCelta
03/02/18,Betis,Villarreal,2,1,H,2.85,3.3,2.5,2018-02-03,2017/2018,24,SP1,2-1,1,0.3500000000000001,2018-02-03BetisVillarreal
03/02/18,Eibar,Sevilla,5,1,H,2.7,3.3,2.6,2018-02-03,2017/2018,24,SP1,5-1,4,0.10000000000000009,2018-02-03EibarSevilla
03/02/18,Levante,Real Madrid,2,2,D,11.0,6.0,1.25,2018-02-03,2017/2018,24,SP1,2-2,0,9.75,2018-02-03LevanteReal Madrid
04/02/18,Ath Madrid,Valencia,1,0,H,1.57,3.9,6.1,2018-02-04,2017/2018,24,SP1,1-0,1,-4.529999999999999,2018-02-04Ath MadridValencia
04/02/18,Espanol,Barcelona,1,1,D,9.5,5.5,1.3,2018-02-04,2017/2018,24,SP1,1-1,0,8.2,2018-02-04EspanolBarcelona
04/02/18,Getafe,Leganes,0,0,D,2.0,3.2,4.1,2018-02-04,2017/2018,25,SP1,0-0,0,-2.0999999999999996,2018-02-04GetafeLeganes
04/02/18,Girona,Ath Bilbao,2,0,H,2.5,3.3,2.85,2018-02-04,2017/2018,25,SP1,2-0,2,-0.3500000000000001,2018-02-04GironaAth Bilbao
05/02/18,Las Palmas,Malaga,1,0,H,2.2,3.3,3.4,2018-02-05,2017/2018,25,SP1,1-0,1,-1.1999999999999997,2018-02-05Las PalmasMalaga
09/02/18,Ath Bilbao,Las Palmas,0,0,D,1.5,4.2,6.5,2018-02-09,2017/2018,25,SP1,0-0,0,-5.0,2018-02-09Ath BilbaoLas Palmas
10/02/18,Leganes,Eibar,0,1,A,2.75,3.1,2.7,2018-02-10,2017/2018,25,SP1,0-1,-1,0.04999999999999982,2018-02-10LeganesEibar
10/02/18,Malaga,Ath Madrid,0,1,A,6.5,4.2,1.5,2018-02-10,2017/2018,25,SP1,0-1,-1,5.0,2018-02-10MalagaAth Madrid
10/02/18,Real Madrid,Sociedad,5,2,H,1.25,7.0,9.0,2018-02-10,2017/2018,25,SP1,5-2,3,-7.75,2018-02-10Real MadridSociedad
10/02/18,Villarreal,Alaves,1,2,A,1.65,3.8,5.3,2018-02-10,2017/2018,25,SP1,1-2,-1,-3.65,2018-02-10VillarrealAlaves
11/02/18,Barcelona,Getafe,0,0,D,1.12,9.0,20.0,2018-02-11,2017/2018,25,SP1,0-0,0,-18.88,2018-02-11BarcelonaGetafe
11/02/18,Celta,Espanol,2,2,D,1.8,3.6,4.5,2018-02-11,2017/2018,26,SP1,2-2,0,-2.7,2018-02-11CeltaEspanol
11/02/18,Sevilla,Girona,1,0,H,1.6,4.0,5.5,2018-02-11,2017/2018,26,SP1,1-0,1,-3.9,2018-02-11SevillaGirona
11/02/18,Valencia,Levante,3,1,H,1.55,4.0,6.2,2018-02-11,2017/2018,26,SP1,3-1,2,-4.65,2018-02-11ValenciaLevante
12/02/18,La Coruna,Betis,0,1,A,2.4,3.3,2.95,2018-02-12,2017/2018,26,SP1,0-1,-1,-0.5500000000000003,2018-02-12La CorunaBetis
16/02/18,Girona,Leganes,3,0,H,2.0,3.4,3.8,2018-02-16,2017/2018,26,SP1,3-0,3,-1.7999999999999998,2018-02-16GironaLeganes
17/02/18,Alaves,La Coruna,1,0,H,1.85,3.5,4.3,2018-02-17,2017/2018,26,SP1,1-0,1,-2.4499999999999997,2018-02-17AlavesLa Coruna
17/02/18,Eibar,Barcelona,0,2,A,7.2,4.4,1.45,2018-02-17,2017/2018,26,SP1,0-2,-2,5.75,2018-02-17EibarBarcelona
17/02/18,Las Palmas,Sevilla,1,2,A,3.5,3.4,2.1,2018-02-17,2017/2018,26,SP1,1-2,-1,1.4,2018-02-17Las PalmasSevilla
17/02/18,Malaga,Valencia,1,2,A,4.1,3.5,1.9,2018-02-17,2017/2018,26,SP1,1-2,-1,2.1999999999999997,2018-02-17MalagaValencia
18/02/18,Ath Madrid,Ath Bilbao,2,0,H,1.45,4.5,7.0,2018-02-18,2017/2018,27,SP1,2-0,2,-5.55,2018-02-18Ath MadridAth Bilbao
18/02/18,Betis,Real Madrid,3,5,A,8.0,5.3,1.35,2018-02-18,2017/2018,27,SP1,3-5,-2,6.65,2018-02-18BetisReal Madrid
18/02/18,Espanol,Villarreal,1,1,D,2.5,3.3,2.85,2018-02-18,2017/2018,27,SP1,1-1,0,-0.3500000000000001,2018-02-18EspanolVillarreal
18/02/18,Sociedad,Levante,3,0,H,1.6,4.0,5.5,2018-02-18,2017/2018,27,SP1,3-0,3,-3.9,2018-02-18SociedadLevante
19/02/18,Getafe,Celta,3,0,H,2.3,3.3,3.15,2018-02-19,2017/2018,27,SP1,3-0,3,-0.8500000000000001,2018-02-19GetafeCelta
21/02/18,Leganes,Real Madrid,1,3,A,10.5,5.8,1.27,2018-02-21,2017/2018,27,SP1,1-3,-2,9.23,2018-02-21LeganesReal Madrid
23/02/18,La Coruna,Espanol,0,0,D,2.5,3.2,2.9,2018-02-23,2017/2018,27,SP1,0-0,0,-0.3999999999999999,2018-02-23La CorunaEspanol
24/02/18,Barcelona,Girona,6,1,H,1.15,7.5,18.0,2018-02-24,2017/2018,27,SP1,6-1,5,-16.85,2018-02-24BarcelonaGirona
24/02/18,Celta,Eibar,2,0,H,2.0,3.4,3.8,2018-02-24,2017/2018,27,SP1,2-0,2,-1.7999999999999998,2018-02-24CeltaEibar
24/02/18,Leganes,Las Palmas,0,0,D,1.85,3.5,4.3,2018-02-24,2017/2018,28,SP1,0-0,0,-2.4499999999999997,2018-02-24LeganesLas Palmas
24/02/18,Real Madrid,Alaves,4,0,H,1.15,8.0,16.0,2018-02-24,2017/2018,28,SP1,4-0,4,-14.85,2018-02-24Real MadridAlaves
25/02/18,Ath Bilbao,Malaga,2,1,H,1.65,3.8,5.3,2018-02-25,2017/2018,28,SP1,2-1,1,-3.65,2018-02-25Ath BilbaoMalaga
25/02/18,Sevilla,Ath Madrid,2,5,A,2.95,3.3,2.4,2018-02-25,2017/2018,28,SP1,2-5,-3,0.5500000000000003,2018-02-25SevillaAth Madrid
25/02/18,Valencia,Sociedad,2,1,H,1.65,3.8,5.3,2018-02-25,2017/2018,28,SP1,2-1,1,-3.65,2018-02-25ValenciaSociedad
25/02/18,Villarreal,Getafe,1,0,H,1.8,3.6,4.5,2018-02-25,2017/2018,28,SP1,1-0,1,-2.7,2018-02-25VillarrealGetafe
26/02/18,Levante,Betis,0,2,A,2.5,3.3,2.85,2018-02-26,2017/2018,28,SP1,0-2,-2,-0.3500000000000001,2018-02-26LevanteBetis
27/02/18,Espanol,Real Madrid,1,0,H,6.5,4.2,1.5,2018-02-27,2017/2018,28,SP1,1-0,1,5.0,2018-02-27EspanolReal Madrid
27/02/18,Girona,Celta,1,0,H,2.3,3.3,3.15,2018-02-27,2017/2018,28,SP1,1-0,1,-0.8500000000000001,2018-02-27GironaCelta
28/02/18,Ath Bilbao,Valencia,1,1,D,2.6,3.3,2.7,2018-02-28,2017/2018,29,SP1,1-1,0,-0.10000000000000009,2018-02-28Ath BilbaoValencia
28/02/18,Ath Madrid,Leganes,4,0,H,1.22,6.2,13.5,2018-02-28,2017/2018,29,SP1,4-0,4,-12.28,2018-02-28Ath MadridLeganes
28/02/18,Eibar,Villarreal,1,0,H,2.4,3.2,3.05,2018-02-28,2017/2018,29,SP1,1-0,1,-0.6499999999999999,2018-02-28EibarVillarreal
28/02/18,Getafe,La Coruna,3,0,H,1.8,3.6,4.5,2018-02-28,2017/2018,29,SP1,3-0,3,-2.7,2018-02-28GetafeLa Coruna
28/02/18,Malaga,Sevilla,0,1,A,4.1,3.5,1.9,2018-02-28,2017/2018,29,SP1,0-1,-1,2.1999999999999997,2018-02-28MalagaSevilla
01/03/18,Alaves,Levante,1,0,H,1.7,3.7,5.0,2018-03-01,2017/2018,29,SP1,1-0,1,-3.3,2018-03-01AlavesLevante
01/03/18,Betis,Sociedad,0,0,D,2.65,3.3,2.65,2018-03-01,2017/2018,29,SP1,0-0,0,0.0,2018-03-01BetisSociedad
01/03/18,Las Palmas,Barcelona,1,1,D,13.0,7.0,1.2,2018-03-01,2017/2018,29,SP1,1-1,0,11.8,2018-03-01Las PalmasBarcelona
03/03/18,La Coruna,Eibar,1,1,D,2.6,3.25,2.75,2018-03-03,2017/2018,29,SP1,1-1,0,-0.1499999999999999,2018-03-03La CorunaEibar
03/03/18,Leganes,Malaga,2,0,H,2.0,3.4,3.8,2018-03-03,2017/2018,30,SP1,2-0,2,-1.7999999999999998,2018-03-03LeganesMalaga
03/03/18,Real Madrid,Getafe,3,1,H,1.25,6.0,11.0,2018-03-03,2017/2018,30,SP1,3-1,2,-9.75,2018-03-03Real MadridGetafe
03/03/18,Sevilla,Ath Bilbao,2,0,H,1.7,3.7,5.0,2018-03-03,2017/2018,30,SP1,2-0,2,-3.3,2018-03-03SevillaAth Bilbao
03/03/18,Villarreal,Girona,0,2,A,1.8,3.6,4.5,2018-03-03,2017/2018,30,SP1,0-2,-2,-2.7,2018-03-03VillarrealGirona
04/03/18,Barcelona,Ath Madrid,1,0,H,1.8,3.6,4.5,2018-03-04,2017/2018,30,SP1,1-0,1,-2.7,2018-03-04BarcelonaAth Madrid
04/03/18,Levante,Espanol,1,1,D,2.7,3.1,2.75,2018-03-04,2017/2018,30,SP1,1-1,0,-0.04999999999999982,2018-03-04LevanteEspanol
04/03/18,Sociedad,Alaves,2,1,H,1.8,3.6,4.5,2018-03-04,2017/2018,30,SP1,2-1,1,-2.7,2018-03-04SociedadAlaves
04/03/18,Valencia,Betis,2,0,H,1.5,4.5,6.0,2018-03-04,2017/2018,30,SP1,2-0,2,-4.5,2018-03-04ValenciaBetis
05/03/18,Celta,Las Palmas,2,1,H,1.45,4.5,7.0,2018-03-05,2017/2018,30,SP1,2-1,1,-5.55,2018-03-05CeltaLas Palmas
09/03/18,Girona,La Coruna,2,0,H,1.6,4.0,5.5,2018-03-09,2017/2018,31,SP1,2-0,2,-3.9,2018-03-09GironaLa Coruna
10/03/18,Eibar,Real Madrid,1,2,A,6.2,4.0,1.55,2018-03-10,2017/2018,31,SP1,1-2,-1,4.65,2018-03-10EibarReal Madrid
10/03/18,Getafe,Levante,0,1,A,1.7,3.7,5.0,2018-03-10,2017/2018,31,SP1,0-1,-1,-3.3,2018-03-10GetafeLevante
10/03/18,Malaga,Barcelona,0,2,A,11.0,6.0,1.25,2018-03-10,2017/2018,31,SP1,0-2,-2,9.75,2018-03-10MalagaBarcelona
10/03/18,Sevilla,Valencia,0,2,A,2.2,3.5,3.15,2018-03-10,2017/2018,31,SP1,0-2,-2,-0.9499999999999997,2018-03-10SevillaValencia
11/03/18,Ath Bilbao,Leganes,2,0,H,1.9,3.5,4.1,2018-03-11,2017/2018,31,SP1,2-0,2,-2.1999999999999997,2018-03-11Ath BilbaoLeganes
11/03/18,Ath Madrid,Celta,3,0,H,1.4,4.8,7.5,2018-03-11,2017/2018,31,SP1,3-0,3,-6.1,2018-03-11Ath MadridCelta
11/03/18,Espanol,Sociedad,2,1,H,2.6,3.3,2.7,2018-03-11,2017/2018,31,SP1,2-1,1,-0.10000000000000009,2018-03-11EspanolSociedad
11/03/18,Las Palmas,Villarreal,0,2,A,3.15,3.3,2.3,2018-03-11,2017/2018,31,SP1,0-2,-2,0.8500000000000001,2018-03-11Las PalmasVillarreal
12/03/18,Alaves,Betis,1,3,A,2.2,3.35,3.3,2018-03-12,2017/2018,32,SP1,1-3,-2,-1.0999999999999996,2018-03-12AlavesBetis
16/03/18,Levante,Eibar,2,1,H,2.95,3.2,2.5,2018-03-16,2017/2018,32,SP1,2-1,1,0.4500000000000002,2018-03-16LevanteEibar
17/03/18,Betis,Espanol,3,0,H,2.1,3.4,3.5,2018-03-17,2017/2018,32,SP1,3-0,3,-1.4,2018-03-17BetisEspanol
17/03/18,La Coruna,Las Palmas,1,1,D,1.8,3.6,4.5,2018-03-17,2017/2018,32,SP1,1-1,0,-2.7,2018-03-17La CorunaLas Palmas
17/03/18,Sociedad,Getafe,1,2,A,1.75,3.6,4.8,2018-03-17,2017/2018,32,SP1,1-2,-1,-3.05,2018-03-17SociedadGetafe
17/03/18,Valencia,Alaves,3,1,H,1.4,4.8,7.5,2018-03-17,2017/2018,32,SP1,3-1,2,-6.1,2018-03-17ValenciaAlaves
18/03/18,Barcelona,Ath Bilbao,2,0,H,1.17,7.5,15.0,2018-03-18,2017/2018,32,SP1,2-0,2,-13.83,2018-03-18BarcelonaAth Bilbao
18/03/18,Celta,Malaga,0,0,D,1.4,4.8,7.5,2018-03-18,2017/2018,32,SP1,0-0,0,-6.1,2018-03-18CeltaMalaga
18/03/18,Leganes,Sevilla,2,1,H,3.15,3.3,2.3,2018-03-18,2017/2018,32,SP1,2-1,1,0.8500000000000001,2018-03-18LeganesSevilla
18/03/18,Real Madrid,Girona,6,3,H,1.2,7.0,12.5,2018-03-18,2017/2018,33,SP1,6-3,3,-11.3,2018-03-18Real MadridGirona
18/03/18,Villarreal,Ath Madrid,2,1,H,3.8,3.4,2.0,2018-03-18,2017/2018,33,SP1,2-1,1,1.7999999999999998,2018-03-18VillarrealAth Madrid
31/03/18,Ath Bilbao,Celta,1,1,D,2.1,3.4,3.5,2018-03-31,2017/2018,33,SP1,1-1,0,-1.4,2018-03-31Ath BilbaoCelta
31/03/18,Girona,Levante,1,1,D,1.65,3.8,5.3,2018-03-31,2017/2018,33,SP1,1-1,0,-3.65,2018-03-31GironaLevante
31/03/18,Las Palmas,Real Madrid,0,3,A,7.5,6.0,1.33,2018-03-31,2017/2018,33,SP1,0-3,-3,6.17,2018-03-31Las PalmasReal Madrid
31/03/18,Sevilla,Barcelona,2,2,D,5.0,4.0,1.65,2018-03-31,2017/2018,33,SP1,2-2,0,3.35,2018-03-31SevillaBarcelona
01/04/18,Ath Madrid,La Coruna,1,0,H,1.2,6.5,15.0,2018-04-01,2017/2018,33,SP1,1-0,1,-13.8,2018-04-01Ath MadridLa Coruna
01/04/18,Eibar,Sociedad,0,0,D,2.3,3.3,3.15,2018-04-01,2017/2018,33,SP1,0-0,0,-0.8500000000000001,2018-04-01EibarSociedad
01/04/18,Espanol,Alaves,0,0,D,2.2,3.2,3.5,2018-04-01,2017/2018,33,SP1,0-0,0,-1.2999999999999998,2018-04-01EspanolAlaves
01/04/18,Leganes,Valencia,0,1,A,3.8,3.4,2.0,2018-04-01,2017/2018,34,SP1,0-1,-1,1.7999999999999998,2018-04-01LeganesValencia
01/04/18,Malaga,Villarreal,1,0,H,3.3,3.35,2.2,2018-04-01,2017/2018,34,SP1,1-0,1,1.0999999999999996,2018-04-01MalagaVillarreal
02/04/18,Getafe,Betis,0,1,A,2.0,3.4,3.8,2018-04-02,2017/2018,34,SP1,0-1,-1,-1.7999999999999998,2018-04-02GetafeBetis
06/04/18,La Coruna,Malaga,3,2,H,2.0,3.4,3.8,2018-04-06,2017/2018,34,SP1,3-2,1,-1.7999999999999998,2018-04-06La CorunaMalaga
07/04/18,Alaves,Getafe,2,0,H,2.4,3.15,3.1,2018-04-07,2017/2018,34,SP1,2-0,2,-0.7000000000000002,2018-04-07AlavesGetafe
07/04/18,Barcelona,Leganes,3,1,H,1.12,9.0,20.0,2018-04-07,2017/2018,34,SP1,3-1,2,-18.88,2018-04-07BarcelonaLeganes
07/04/18,Betis,Eibar,2,0,H,2.2,3.35,3.3,2018-04-07,2017/2018,34,SP1,2-0,2,-1.0999999999999996,2018-04-07BetisEibar
07/04/18,Celta,Sevilla,4,0,H,2.2,3.35,3.3,2018-04-07,2017/2018,34,SP1,4-0,4,-1.0999999999999996,2018-04-07CeltaSevilla
08/04/18,Levante,Las Palmas,2,1,H,1.9,3.5,4.1,2018-04-08,2017/2018,34,SP1,2-1,1,-2.1999999999999997,2018-04-08LevanteLas Palmas
08/04/18,Real Madrid,Ath Madrid,1,1,D,1.8,3.6,4.5,2018-04-08,2017/2018,35,SP1,1-1,0,-2.7,2018-04-08Real MadridAth Madrid
08/04/18,Sociedad,Girona,5,0,H,1.85,3.5,4.3,2018-04-08,2017/2018,35,SP1,5-0,5,-2.4499999999999997,2018-04-08SociedadGirona
08/04/18,Valencia,Espanol,1,0,H,1.5,4.2,6.5,2018-04-08,2017/2018,35,SP1,1-0,1,-5.0,2018-04-08ValenciaEspanol
09/04/18,Villarreal,Ath Bilbao,1,3,A,1.85,3.5,4.3,2018-04-09,2017/2018,35,SP1,1-3,-2,-2.4499999999999997,2018-04-09VillarrealAth Bilbao
13/04/18,Girona,Betis,0,1,A,2.3,3.3,3.15,2018-04-13,2017/2018,35,SP1,0-1,-1,-0.8500000000000001,2018-04-13GironaBetis
14/04/18,Ath Bilbao,La Coruna,2,3,A,1.7,3.8,4.9,2018-04-14,2017/2018,35,SP1,2-3,-1,-3.2,2018-04-14Ath BilbaoLa Coruna
14/04/18,Barcelona,Valencia,2,1,H,1.33,5.3,8.7,2018-04-14,2017/2018,35,SP1,2-1,1,-7.369999999999999,2018-04-14BarcelonaValencia
14/04/18,Las Palmas,Sociedad,0,1,A,3.95,3.45,1.95,2018-04-14,2017/2018,35,SP1,0-1,-1,2.0,2018-04-14Las PalmasSociedad
14/04/18,Leganes,Celta,1,0,H,2.95,3.3,2.4,2018-04-14,2017/2018,35,SP1,1-0,1,0.5500000000000003,2018-04-14LeganesCelta
14/04/18,Sevilla,Villarreal,2,2,D,1.9,3.5,4.1,2018-04-14,2017/2018,36,SP1,2-2,0,-2.1999999999999997,2018-04-14SevillaVillarreal
15/04/18,Ath Madrid,Levante,3,0,H,1.22,6.2,13.5,2018-04-15,2017/2018,36,SP1,3-0,3,-12.28,2018-04-15Ath MadridLevante
15/04/18,Eibar,Alaves,0,1,A,1.85,3.5,4.3,2018-04-15,2017/2018,36,SP1,0-1,-1,-2.4499999999999997,2018-04-15EibarAlaves
15/04/18,Getafe,Espanol,1,0,H,2.2,3.1,3.6,2018-04-15,2017/2018,36,SP1,1-0,1,-1.4,2018-04-15GetafeEspanol
15/04/18,Malaga,Real Madrid,1,2,A,10.5,5.8,1.27,2018-04-15,2017/2018,36,SP1,1-2,-1,9.23,2018-04-15MalagaReal Madrid
17/04/18,Celta,Barcelona,2,2,D,4.5,4.1,1.7,2018-04-17,2017/2018,36,SP1,2-2,0,2.8,2018-04-17CeltaBarcelona
17/04/18,La Coruna,Sevilla,0,0,D,2.65,3.4,2.6,2018-04-17,2017/2018,36,SP1,0-0,0,0.04999999999999982,2018-04-17La CorunaSevilla
17/04/18,Villarreal,Leganes,2,1,H,1.55,4.0,6.2,2018-04-17,2017/2018,36,SP1,2-1,1,-4.65,2018-04-17VillarrealLeganes
18/04/18,Espanol,Eibar,0,1,A,2.3,3.05,3.4,2018-04-18,2017/2018,36,SP1,0-1,-1,-1.1,2018-04-18EspanolEibar
18/04/18,Real Madrid,Ath Bilbao,1,1,D,1.27,6.5,9.0,2018-04-18,2017/2018,37,SP1,1-1,0,-7.73,2018-04-18Real MadridAth Bilbao
18/04/18,Valencia,Getafe,1,2,A,1.5,4.2,6.5,2018-04-18,2017/2018,37,SP1,1-2,-1,-5.0,2018-04-18ValenciaGetafe
19/04/18,Alaves,Girona,1,2,A,2.3,3.3,3.15,2018-04-19,2017/2018,37,SP1,1-2,-1,-0.8500000000000001,2018-04-19AlavesGirona
19/04/18,Betis,Las Palmas,1,0,H,1.4,5.0,7.0,2018-04-19,2017/2018,37,SP1,1-0,1,-5.6,2018-04-19BetisLas Palmas
19/04/18,Levante,Malaga,1,0,H,1.7,3.8,4.8,2018-04-19,2017/2018,37,SP1,1-0,1,-3.0999999999999996,2018-04-19LevanteMalaga
19/04/18,Sociedad,Ath Madrid,3,0,H,3.3,3.35,2.2,2018-04-19,2017/2018,37,SP1,3-0,3,1.0999999999999996,2018-04-19SociedadAth Madrid
20/04/18,Leganes,La Coruna,0,0,D,2.5,3.1,3.0,2018-04-20,2017/2018,37,SP1,0-0,0,-0.5,2018-04-20LeganesLa Coruna
21/04/18,Celta,Valencia,1,1,D,2.65,3.3,2.65,2018-04-21,2017/2018,37,SP1,1-1,0,0.0,2018-04-21CeltaValencia
21/04/18,Eibar,Getafe,0,1,A,2.1,3.4,3.5,2018-04-21,2017/2018,37,SP1,0-1,-1,-1.4,2018-04-21EibarGetafe
22/04/18,Ath Madrid,Betis,0,0,D,1.6,4.0,5.5,2018-04-22,2017/2018,38,SP1,0-0,0,-3.9,2018-04-22Ath MadridBetis
22/04/18,Girona,Espanol,0,2,A,1.9,3.3,4.4,2018-04-22,2017/2018,38,SP1,0-2,-2,-2.5000000000000004,2018-04-22GironaEspanol
22/04/18,Las Palmas,Alaves,0,4,A,3.15,3.3,2.3,2018-04-22,2017/2018,38,SP1,0-4,-4,0.8500000000000001,2018-04-22Las PalmasAlaves
22/04/18,Malaga,Sociedad,2,0,H,4.8,3.6,1.75,2018-04-22,2017/2018,38,SP1,2-0,2,3.05,2018-04-22MalagaSociedad
23/04/18,Ath Bilbao,Levante,1,3,A,1.7,3.7,5.0,2018-04-23,2017/2018,38,SP1,1-3,-2,-3.3,2018-04-23Ath BilbaoLevante
27/04/18,Levante,Sevilla,2,1,H,3.6,3.6,2.0,2018-04-27,2017/2018,38,SP1,2-1,1,1.6,2018-04-27LevanteSevilla
28/04/18,Espanol,Las Palmas,1,1,D,1.4,4.8,7.5,2018-04-28,2017/2018,38,SP1,1-1,0,-6.1,2018-04-28EspanolLas Palmas
28/04/18,Real Madrid,Leganes,2,1,H,1.35,5.5,7.0,2018-04-28,2017/2018,38,SP1,2-1,1,-5.65,2018-04-28Real MadridLeganes
28/04/18,Sociedad,Ath Bilbao,3,1,H,2.0,3.4,3.8,2018-04-28,2017/2018,38,SP1,3-1,2,-1.7999999999999998,2018-04-28SociedadAth Bilbao
28/04/18,Villarreal,Celta,4,1,H,1.7,3.7,5.0,2018-04-28,2017/2018,39,SP1,4-1,3,-3.3,2018-04-28VillarrealCelta
29/04/18,Alaves,Ath Madrid,0,1,A,3.25,3.2,2.3,2018-04-29,2017/2018,39,SP1,0-1,-1,0.9500000000000002,2018-04-29AlavesAth Madrid
29/04/18,Getafe,Girona,1,1,D,2.0,3.4,3.8,2018-04-29,2017/2018,39,SP1,1-1,0,-1.7999999999999998,2018-04-29GetafeGirona
29/04/18,La Coruna,Barcelona,2,4,A,9.5,5.5,1.3,2018-04-29,2017/2018,39,SP1,2-4,-2,8.2,2018-04-29La CorunaBarcelona
29/04/18,Valencia,Eibar,0,0,D,1.5,4.2,6.5,2018-04-29,2017/2018,39,SP1,0-0,0,-5.0,2018-04-29ValenciaEibar
30/04/18,Betis,Malaga,2,1,H,1.4,4.8,7.5,2018-04-30,2017/2018,39,SP1,2-1,1,-6.1,2018-04-30BetisMalaga
04/05/18,Sevilla,Sociedad,1,0,H,2.0,3.6,3.6,2018-05-04,2017/2018,39,SP1,1-0,1,-1.6,2018-05-04SevillaSociedad
05/05/18,Ath Bilbao,Betis,2,0,H,2.3,3.4,3.05,2018-05-05,2017/2018,39,SP1,2-0,2,-0.75,2018-05-05Ath BilbaoBetis
05/05/18,Celta,La Coruna,1,1,D,1.55,4.0,6.2,2018-05-05,2017/2018,39,SP1,1-1,0,-4.65,2018-05-05CeltaLa Coruna
05/05/18,Girona,Eibar,1,4,A,2.0,3.4,3.8,2018-05-05,2017/2018,40,SP1,1-4,-3,-1.7999999999999998,2018-05-05GironaEibar
05/05/18,Villarreal,Valencia,1,0,H,2.1,3.4,3.5,2018-05-05,2017/2018,40,SP1,1-0,1,-1.4,2018-05-05VillarrealValencia
06/05/18,Ath Madrid,Espanol,0,2,A,1.4,4.8,7.5,2018-05-06,2017/2018,40,SP1,0-2,-2,-6.1,2018-05-06Ath MadridEspanol
06/05/18,Barcelona,Real Madrid,2,2,D,1.8,4.0,4.0,2018-05-06,2017/2018,40,SP1,2-2,0,-2.2,2018-05-06BarcelonaReal Madrid
06/05/18,Las Palmas,Getafe,0,1,A,3.5,3.4,2.1,2018-05-06,2017/2018,40,SP1,0-1,-1,1.4,2018-05-06Las PalmasGetafe
06/05/18,Malaga,Alaves,0,3,A,2.5,3.3,2.85,2018-05-06,2017/2018,40,SP1,0-3,-3,-0.3500000000000001,2018-05-06MalagaAlaves
07/05/18,Leganes,Levante,0,3,A,2.1,3.4,3.5,2018-05-07,2017/2018,40,SP1,0-3,-3,-1.4,2018-05-07LeganesLevante
09/05/18,Barcelona,Villarreal,5,1,H,1.3,5.5,9.5,2018-05-09,2017/2018,40,SP1,5-1,4,-8.2,2018-05-09BarcelonaVillarreal
09/05/18,Sevilla,Real Madrid,3,2,H,2.6,3.7,2.5,2018-05-09,2017/2018,40,SP1,3-2,1,0.10000000000000009,2018-05-09SevillaReal Madrid
12/05/18,Alaves,Ath Bilbao,3,1,H,2.5,3.2,2.9,2018-05-12,2017/2018,41,SP1,3-1,2,-0.3999999999999999,2018-05-12AlavesAth Bilbao
12/05/18,Betis,Sevilla,2,2,D,2.85,3.3,2.5,2018-05-12,2017/2018,41,SP1,2-2,0,0.3500000000000001,2018-05-12BetisSevilla
12/05/18,Eibar,Las Palmas,1,0,H,1.5,4.2,6.5,2018-05-12,2017/2018,41,SP1,1-0,1,-5.0,2018-05-12EibarLas Palmas
12/05/18,Getafe,Ath Madrid,0,1,A,2.3,3.15,3.3,2018-05-12,2017/2018,41,SP1,0-1,-1,-1.0,2018-05-12GetafeAth Madrid
12/05/18,Girona,Valencia,0,1,A,2.6,3.25,2.75,2018-05-12,2017/2018,41,SP1,0-1,-1,-0.1499999999999999,2018-05-12GironaValencia
12/05/18,La Coruna,Villarreal,2,4,A,4.1,3.5,1.9,2018-05-12,2017/2018,41,SP1,2-4,-2,2.1999999999999997,2018-05-12La CorunaVillarreal
12/05/18,Real Madrid,Celta,6,0,H,1.3,6.0,9.0,2018-05-12,2017/2018,41,SP1,6-0,6,-7.7,2018-05-12Real MadridCelta
12/05/18,Sociedad,Leganes,3,2,H,1.45,4.7,6.5,2018-05-12,2017/2018,41,SP1,3-2,1,-5.05,2018-05-12SociedadLeganes
13/05/18,Espanol,Malaga,4,1,H,1.65,3.8,5.3,2018-05-13,2017/2018,41,SP1,4-1,3,-3.65,2018-05-13EspanolMalaga
13/05/18,Levante,Barcelona,5,4,H,9.5,5.5,1.3,2018-05-13,2017/2018,42,SP1,5-4,1,8.2,2018-05-13LevanteBarcelona
19/05/18,Celta,Levante,4,2,H,2.0,3.7,3.5,2018-05-19,2017/2018,42,SP1,4-2,2,-1.5,2018-05-19CeltaLevante
19/05/18,Las Palmas,Girona,1,2,A,2.85,3.3,2.5,2018-05-19,2017/2018,42,SP1,1-2,-1,0.3500000000000001,2018-05-19Las PalmasGirona
19/05/18,Leganes,Betis,3,2,H,2.7,3.5,2.5,2018-05-19,2017/2018,42,SP1,3-2,1,0.20000000000000018,2018-05-19LeganesBetis
19/05/18,Malaga,Getafe,0,1,A,3.15,3.5,2.2,2018-05-19,2017/2018,42,SP1,0-1,-1,0.9499999999999997,2018-05-19MalagaGetafe
19/05/18,Sevilla,Alaves,1,0,H,1.5,4.5,6.0,2018-05-19,2017/2018,42,SP1,1-0,1,-4.5,2018-05-19SevillaAlaves
19/05/18,Villarreal,Real Madrid,2,2,D,2.5,3.8,2.5,2018-05-19,2017/2018,42,SP1,2-2,0,0.0,2018-05-19VillarrealReal Madrid
20/05/18,Ath Bilbao,Espanol,0,1,A,2.0,3.6,3.6,2018-05-20,2017/2018,42,SP1,0-1,-1,-1.6,2018-05-20Ath BilbaoEspanol
20/05/18,Ath Madrid,Eibar,2,2,D,1.65,3.7,5.5,2018-05-20,2017/2018,42,SP1,2-2,0,-3.85,2018-05-20Ath MadridEibar
